1;Jan 13, 2022 15:56:49.797189667 CET;192.168.1.102;192.168.1.104;50534;1883;74;50534 → 1883 [SYN] Seq=0 Win=42340 Len=0 MSS=1460 SACK_PERM=1 TSval=1797914693 TSecr=0 WS=512;
2;Jan 13, 2022 15:56:50.828578144 CET;192.168.1.102;192.168.1.104;50534;1883;74;[TCP Retransmission] 50534 → 1883 [SYN] Seq=0 Win=42340 Len=0 MSS=1460 SACK_PERM=1 TSval=1797915724 TSecr=0 WS=512;
3;Jan 13, 2022 15:56:50.864023423 CET;192.168.1.104;192.168.1.102;1883;50534;58;1883 → 50534 [SYN, ACK] Seq=0 Ack=1 Win=8192 Len=0 MSS=1460;
4;Jan 13, 2022 15:56:50.864044787 CET;192.168.1.102;192.168.1.104;50534;1883;54;50534 → 1883 [ACK] Seq=1 Ack=1 Win=42340 Len=0;
5;Jan 13, 2022 15:56:50.864120501 CET;192.168.1.102;192.168.1.104;50534;1883;108;Connect Command;
6;Jan 13, 2022 15:56:53.900568661 CET;192.168.1.102;192.168.1.104;50534;1883;108;[TCP Retransmission] 50534 → 1883 [PSH, ACK] Seq=1 Ack=1 Win=42340 Len=54;
7;Jan 13, 2022 15:56:53.914988997 CET;192.168.1.104;192.168.1.102;1883;50534;54;1883 → 50534 [ACK] Seq=1 Ack=55 Win=8192 Len=0;
8;Jan 13, 2022 15:56:53.919905576 CET;192.168.1.104;192.168.1.102;1883;50534;58;Connect Ack;
9;Jan 13, 2022 15:56:53.919918918 CET;192.168.1.102;192.168.1.104;50534;1883;54;50534 → 1883 [ACK] Seq=55 Ack=5 Win=42336 Len=0;
10;Jan 13, 2022 15:56:53.919997372 CET;192.168.1.102;192.168.1.104;50534;1883;73;Publish Message [topic];message001
11;Jan 13, 2022 15:56:53.920026648 CET;192.168.1.102;192.168.1.104;50534;1883;56;Disconnect Req;
12;Jan 13, 2022 15:56:58.928276566 CET;192.168.1.102;192.168.1.104;50536;1883;74;50536 → 1883 [SYN] Seq=0 Win=42340 Len=0 MSS=1460 SACK_PERM=1 TSval=1797923824 TSecr=0 WS=512;
13;Jan 13, 2022 15:56:58.932950793 CET;192.168.1.104;192.168.1.102;1883;50536;58;1883 → 50536 [SYN, ACK] Seq=0 Ack=1 Win=8192 Len=0 MSS=1460;
14;Jan 13, 2022 15:56:58.932980153 CET;192.168.1.102;192.168.1.104;50536;1883;54;50536 → 1883 [ACK] Seq=1 Ack=1 Win=42340 Len=0;
15;Jan 13, 2022 15:56:58.933367973 CET;192.168.1.102;192.168.1.104;50536;1883;108;Connect Command;
16;Jan 13, 2022 15:56:59.144836493 CET;192.168.1.102;192.168.1.104;50536;1883;108;[TCP Retransmission] 50536 → 1883 [PSH, ACK] Seq=1 Ack=1 Win=42340 Len=54;
17;Jan 13, 2022 15:56:59.165704532 CET;192.168.1.104;192.168.1.102;1883;50536;54;1883 → 50536 [ACK] Seq=1 Ack=55 Win=8192 Len=0;
18;Jan 13, 2022 15:56:59.174307425 CET;192.168.1.104;192.168.1.102;1883;50536;58;Connect Ack;
19;Jan 13, 2022 15:56:59.174331832 CET;192.168.1.102;192.168.1.104;50536;1883;54;50536 → 1883 [ACK] Seq=55 Ack=5 Win=42336 Len=0;
20;Jan 13, 2022 15:56:59.174428609 CET;192.168.1.102;192.168.1.104;50536;1883;73;Publish Message [topic];message002
21;Jan 13, 2022 15:56:59.174463273 CET;192.168.1.102;192.168.1.104;50536;1883;56;Disconnect Req;
22;Jan 13, 2022 15:56:59.596666485 CET;192.168.1.102;192.168.1.104;50536;1883;75;[TCP Retransmission] 50536 → 1883 [FIN, PSH, ACK] Seq=55 Ack=5 Win=42336 Len=21;
23;Jan 13, 2022 15:56:59.605770770 CET;192.168.1.104;192.168.1.102;1883;50536;54;1883 → 50536 [FIN, ACK] Seq=5 Ack=77 Win=8192 Len=0;
24;Jan 13, 2022 15:56:59.605796264 CET;192.168.1.102;192.168.1.104;50536;1883;54;50536 → 1883 [ACK] Seq=77 Ack=6 Win=42335 Len=0;
25;Jan 13, 2022 15:57:00.044532245 CET;192.168.1.102;192.168.1.104;50534;1883;75;[TCP Retransmission] 50534 → 1883 [FIN, PSH, ACK] Seq=55 Ack=5 Win=42336 Len=21;
26;Jan 13, 2022 15:57:00.047744544 CET;192.168.1.104;192.168.1.102;1883;50534;54;1883 → 50534 [FIN, ACK] Seq=5 Ack=77 Win=8192 Len=0;
27;Jan 13, 2022 15:57:00.047755450 CET;192.168.1.102;192.168.1.104;50534;1883;54;50534 → 1883 [ACK] Seq=77 Ack=6 Win=42335 Len=0;
28;Jan 13, 2022 15:57:04.187442829 CET;192.168.1.102;192.168.1.104;50538;1883;74;50538 → 1883 [SYN] Seq=0 Win=42340 Len=0 MSS=1460 SACK_PERM=1 TSval=1797929083 TSecr=0 WS=512;
29;Jan 13, 2022 15:57:04.200252243 CET;192.168.1.104;192.168.1.102;1883;50538;58;1883 → 50538 [SYN, ACK] Seq=0 Ack=1 Win=8192 Len=0 MSS=1460;
30;Jan 13, 2022 15:57:04.200297440 CET;192.168.1.102;192.168.1.104;50538;1883;54;50538 → 1883 [ACK] Seq=1 Ack=1 Win=42340 Len=0;
31;Jan 13, 2022 15:57:04.200380095 CET;192.168.1.102;192.168.1.104;50538;1883;108;Connect Command;
32;Jan 13, 2022 15:57:04.416527570 CET;192.168.1.102;192.168.1.104;50538;1883;108;[TCP Retransmission] 50538 → 1883 [PSH, ACK] Seq=1 Ack=1 Win=42340 Len=54;
33;Jan 13, 2022 15:57:04.423339319 CET;192.168.1.104;192.168.1.102;1883;50538;54;1883 → 50538 [ACK] Seq=1 Ack=55 Win=8192 Len=0;
34;Jan 13, 2022 15:57:04.426080384 CET;192.168.1.104;192.168.1.102;1883;50538;58;Connect Ack;
35;Jan 13, 2022 15:57:04.426096011 CET;192.168.1.102;192.168.1.104;50538;1883;54;50538 → 1883 [ACK] Seq=55 Ack=5 Win=42336 Len=0;
36;Jan 13, 2022 15:57:04.426173910 CET;192.168.1.102;192.168.1.104;50538;1883;73;Publish Message [topic];message003
37;Jan 13, 2022 15:57:04.426194296 CET;192.168.1.102;192.168.1.104;50538;1883;56;Disconnect Req;
38;Jan 13, 2022 15:57:04.876635865 CET;192.168.1.102;192.168.1.104;50538;1883;75;[TCP Retransmission] 50538 → 1883 [FIN, PSH, ACK] Seq=55 Ack=5 Win=42336 Len=21;
39;Jan 13, 2022 15:57:04.879675508 CET;192.168.1.104;192.168.1.102;1883;50538;54;1883 → 50538 [FIN, ACK] Seq=5 Ack=77 Win=8192 Len=0;
40;Jan 13, 2022 15:57:04.879691433 CET;192.168.1.102;192.168.1.104;50538;1883;54;50538 → 1883 [ACK] Seq=77 Ack=6 Win=42335 Len=0;
41;Jan 13, 2022 15:57:09.435004227 CET;192.168.1.102;192.168.1.104;50540;1883;74;50540 → 1883 [SYN] Seq=0 Win=42340 Len=0 MSS=1460 SACK_PERM=1 TSval=1797934331 TSecr=0 WS=512;
42;Jan 13, 2022 15:57:09.448218808 CET;192.168.1.104;192.168.1.102;1883;50540;58;1883 → 50540 [SYN, ACK] Seq=0 Ack=1 Win=8192 Len=0 MSS=1460;
43;Jan 13, 2022 15:57:09.448257595 CET;192.168.1.102;192.168.1.104;50540;1883;54;50540 → 1883 [ACK] Seq=1 Ack=1 Win=42340 Len=0;
44;Jan 13, 2022 15:57:09.448337290 CET;192.168.1.102;192.168.1.104;50540;1883;108;Connect Command;
45;Jan 13, 2022 15:57:09.664622690 CET;192.168.1.102;192.168.1.104;50540;1883;108;[TCP Retransmission] 50540 → 1883 [PSH, ACK] Seq=1 Ack=1 Win=42340 Len=54;
46;Jan 13, 2022 15:57:09.673559910 CET;192.168.1.104;192.168.1.102;1883;50540;54;1883 → 50540 [ACK] Seq=1 Ack=55 Win=8192 Len=0;
47;Jan 13, 2022 15:57:09.676837871 CET;192.168.1.104;192.168.1.102;1883;50540;58;Connect Ack;
48;Jan 13, 2022 15:57:09.676854821 CET;192.168.1.102;192.168.1.104;50540;1883;54;50540 → 1883 [ACK] Seq=55 Ack=5 Win=42336 Len=0;
49;Jan 13, 2022 15:57:09.676916398 CET;192.168.1.102;192.168.1.104;50540;1883;73;Publish Message [topic];message004
50;Jan 13, 2022 15:57:09.676938778 CET;192.168.1.102;192.168.1.104;50540;1883;56;Disconnect Req;
51;Jan 13, 2022 15:57:10.124531630 CET;192.168.1.102;192.168.1.104;50540;1883;75;[TCP Retransmission] 50540 → 1883 [FIN, PSH, ACK] Seq=55 Ack=5 Win=42336 Len=21;
52;Jan 13, 2022 15:57:10.128176858 CET;192.168.1.104;192.168.1.102;1883;50540;54;1883 → 50540 [FIN, ACK] Seq=5 Ack=77 Win=8192 Len=0;
53;Jan 13, 2022 15:57:10.128193273 CET;192.168.1.102;192.168.1.104;50540;1883;54;50540 → 1883 [ACK] Seq=77 Ack=6 Win=42335 Len=0;
54;Jan 13, 2022 15:57:14.694447728 CET;192.168.1.102;192.168.1.104;50544;1883;74;50544 → 1883 [SYN] Seq=0 Win=42340 Len=0 MSS=1460 SACK_PERM=1 TSval=1797939590 TSecr=0 WS=512;
55;Jan 13, 2022 15:57:14.706047228 CET;192.168.1.104;192.168.1.102;1883;50544;58;1883 → 50544 [SYN, ACK] Seq=0 Ack=1 Win=8192 Len=0 MSS=1460;
56;Jan 13, 2022 15:57:14.706074612 CET;192.168.1.102;192.168.1.104;50544;1883;54;50544 → 1883 [ACK] Seq=1 Ack=1 Win=42340 Len=0;
57;Jan 13, 2022 15:57:14.706137313 CET;192.168.1.102;192.168.1.104;50544;1883;108;Connect Command;
58;Jan 13, 2022 15:57:14.920651030 CET;192.168.1.102;192.168.1.104;50544;1883;108;[TCP Retransmission] 50544 → 1883 [PSH, ACK] Seq=1 Ack=1 Win=42340 Len=54;
59;Jan 13, 2022 15:57:14.943440208 CET;192.168.1.104;192.168.1.102;1883;50544;54;1883 → 50544 [ACK] Seq=1 Ack=55 Win=8192 Len=0;
60;Jan 13, 2022 15:57:14.950284701 CET;192.168.1.104;192.168.1.102;1883;50544;58;Connect Ack;
61;Jan 13, 2022 15:57:14.950306269 CET;192.168.1.102;192.168.1.104;50544;1883;54;50544 → 1883 [ACK] Seq=55 Ack=5 Win=42336 Len=0;
62;Jan 13, 2022 15:57:14.950388665 CET;192.168.1.102;192.168.1.104;50544;1883;73;Publish Message [topic];message005
63;Jan 13, 2022 15:57:14.950423466 CET;192.168.1.102;192.168.1.104;50544;1883;56;Disconnect Req;
64;Jan 13, 2022 15:57:15.404580984 CET;192.168.1.102;192.168.1.104;50544;1883;75;[TCP Retransmission] 50544 → 1883 [FIN, PSH, ACK] Seq=55 Ack=5 Win=42336 Len=21;
65;Jan 13, 2022 15:57:15.411070709 CET;192.168.1.104;192.168.1.102;1883;50544;54;1883 → 50544 [FIN, ACK] Seq=5 Ack=77 Win=8192 Len=0;
66;Jan 13, 2022 15:57:15.411094374 CET;192.168.1.102;192.168.1.104;50544;1883;54;50544 → 1883 [ACK] Seq=77 Ack=6 Win=42335 Len=0;
67;Jan 13, 2022 15:57:19.955986329 CET;192.168.1.102;192.168.1.104;50546;1883;74;50546 → 1883 [SYN] Seq=0 Win=42340 Len=0 MSS=1460 SACK_PERM=1 TSval=1797944852 TSecr=0 WS=512;
68;Jan 13, 2022 15:57:19.960203239 CET;192.168.1.104;192.168.1.102;1883;50546;58;1883 → 50546 [SYN, ACK] Seq=0 Ack=1 Win=8192 Len=0 MSS=1460;
69;Jan 13, 2022 15:57:19.960219610 CET;192.168.1.102;192.168.1.104;50546;1883;54;50546 → 1883 [ACK] Seq=1 Ack=1 Win=42340 Len=0;
70;Jan 13, 2022 15:57:19.961437212 CET;192.168.1.102;192.168.1.104;50546;1883;108;Connect Command;
71;Jan 13, 2022 15:57:20.172533759 CET;192.168.1.102;192.168.1.104;50546;1883;108;[TCP Retransmission] 50546 → 1883 [PSH, ACK] Seq=1 Ack=1 Win=42340 Len=54;
72;Jan 13, 2022 15:57:20.180220519 CET;192.168.1.104;192.168.1.102;1883;50546;54;1883 → 50546 [ACK] Seq=1 Ack=55 Win=8192 Len=0;
73;Jan 13, 2022 15:57:20.185986503 CET;192.168.1.104;192.168.1.102;1883;50546;58;Connect Ack;
74;Jan 13, 2022 15:57:20.186012638 CET;192.168.1.102;192.168.1.104;50546;1883;54;50546 → 1883 [ACK] Seq=55 Ack=5 Win=42336 Len=0;
75;Jan 13, 2022 15:57:20.186105493 CET;192.168.1.102;192.168.1.104;50546;1883;73;Publish Message [topic];message006
76;Jan 13, 2022 15:57:20.186137438 CET;192.168.1.102;192.168.1.104;50546;1883;56;Disconnect Req;
77;Jan 13, 2022 15:57:20.620660114 CET;192.168.1.102;192.168.1.104;50546;1883;75;[TCP Retransmission] 50546 → 1883 [FIN, PSH, ACK] Seq=55 Ack=5 Win=42336 Len=21;
78;Jan 13, 2022 15:57:20.637575172 CET;192.168.1.104;192.168.1.102;1883;50546;54;1883 → 50546 [FIN, ACK] Seq=5 Ack=77 Win=8192 Len=0;
79;Jan 13, 2022 15:57:20.637617224 CET;192.168.1.102;192.168.1.104;50546;1883;54;50546 → 1883 [ACK] Seq=77 Ack=6 Win=42335 Len=0;
80;Jan 13, 2022 15:57:25.199999665 CET;192.168.1.102;192.168.1.104;50548;1883;74;50548 → 1883 [SYN] Seq=0 Win=42340 Len=0 MSS=1460 SACK_PERM=1 TSval=1797950096 TSecr=0 WS=512;
81;Jan 13, 2022 15:57:25.211279213 CET;192.168.1.104;192.168.1.102;1883;50548;58;1883 → 50548 [SYN, ACK] Seq=0 Ack=1 Win=8192 Len=0 MSS=1460;
82;Jan 13, 2022 15:57:25.211323276 CET;192.168.1.102;192.168.1.104;50548;1883;54;50548 → 1883 [ACK] Seq=1 Ack=1 Win=42340 Len=0;
83;Jan 13, 2022 15:57:25.211407022 CET;192.168.1.102;192.168.1.104;50548;1883;108;Connect Command;
84;Jan 13, 2022 15:57:25.424567019 CET;192.168.1.102;192.168.1.104;50548;1883;108;[TCP Retransmission] 50548 → 1883 [PSH, ACK] Seq=1 Ack=1 Win=42340 Len=54;
85;Jan 13, 2022 15:57:25.443452460 CET;192.168.1.104;192.168.1.102;1883;50548;54;1883 → 50548 [ACK] Seq=1 Ack=55 Win=8192 Len=0;
86;Jan 13, 2022 15:57:25.449901993 CET;192.168.1.104;192.168.1.102;1883;50548;58;Connect Ack;
87;Jan 13, 2022 15:57:25.449921620 CET;192.168.1.102;192.168.1.104;50548;1883;54;50548 → 1883 [ACK] Seq=55 Ack=5 Win=42336 Len=0;
88;Jan 13, 2022 15:57:25.450004814 CET;192.168.1.102;192.168.1.104;50548;1883;73;Publish Message [topic];message007
89;Jan 13, 2022 15:57:25.450038656 CET;192.168.1.102;192.168.1.104;50548;1883;56;Disconnect Req;
90;Jan 13, 2022 15:57:25.900697118 CET;192.168.1.102;192.168.1.104;50548;1883;75;[TCP Retransmission] 50548 → 1883 [FIN, PSH, ACK] Seq=55 Ack=5 Win=42336 Len=21;
91;Jan 13, 2022 15:57:25.907251902 CET;192.168.1.104;192.168.1.102;1883;50548;54;1883 → 50548 [FIN, ACK] Seq=5 Ack=77 Win=8192 Len=0;
92;Jan 13, 2022 15:57:25.907266707 CET;192.168.1.102;192.168.1.104;50548;1883;54;50548 → 1883 [ACK] Seq=77 Ack=6 Win=42335 Len=0;
93;Jan 13, 2022 15:57:30.458111377 CET;192.168.1.102;192.168.1.104;50550;1883;74;50550 → 1883 [SYN] Seq=0 Win=42340 Len=0 MSS=1460 SACK_PERM=1 TSval=1797955354 TSecr=0 WS=512;
94;Jan 13, 2022 15:57:30.462713980 CET;192.168.1.104;192.168.1.102;1883;50550;58;1883 → 50550 [SYN, ACK] Seq=0 Ack=1 Win=8192 Len=0 MSS=1460;
95;Jan 13, 2022 15:57:30.462744372 CET;192.168.1.102;192.168.1.104;50550;1883;54;50550 → 1883 [ACK] Seq=1 Ack=1 Win=42340 Len=0;
96;Jan 13, 2022 15:57:30.463368122 CET;192.168.1.102;192.168.1.104;50550;1883;108;Connect Command;
97;Jan 13, 2022 15:57:30.673225730 CET;192.168.1.102;192.168.1.104;50550;1883;108;[TCP Retransmission] 50550 → 1883 [PSH, ACK] Seq=1 Ack=1 Win=42340 Len=54;
98;Jan 13, 2022 15:57:30.687770123 CET;192.168.1.104;192.168.1.102;1883;50550;54;1883 → 50550 [ACK] Seq=1 Ack=55 Win=8192 Len=0;
99;Jan 13, 2022 15:57:30.690671640 CET;192.168.1.104;192.168.1.102;1883;50550;58;Connect Ack;
100;Jan 13, 2022 15:57:30.690689619 CET;192.168.1.102;192.168.1.104;50550;1883;54;50550 → 1883 [ACK] Seq=55 Ack=5 Win=42336 Len=0;
101;Jan 13, 2022 15:57:30.690757566 CET;192.168.1.102;192.168.1.104;50550;1883;73;Publish Message [topic];message008
102;Jan 13, 2022 15:57:30.690780027 CET;192.168.1.102;192.168.1.104;50550;1883;56;Disconnect Req;
103;Jan 13, 2022 15:57:31.116583726 CET;192.168.1.102;192.168.1.104;50550;1883;75;[TCP Retransmission] 50550 → 1883 [FIN, PSH, ACK] Seq=55 Ack=5 Win=42336 Len=21;
104;Jan 13, 2022 15:57:31.134722522 CET;192.168.1.104;192.168.1.102;1883;50550;54;1883 → 50550 [FIN, ACK] Seq=5 Ack=77 Win=8192 Len=0;
105;Jan 13, 2022 15:57:31.134760316 CET;192.168.1.102;192.168.1.104;50550;1883;54;50550 → 1883 [ACK] Seq=77 Ack=6 Win=42335 Len=0;
106;Jan 13, 2022 15:57:35.698909051 CET;192.168.1.102;192.168.1.104;50552;1883;74;50552 → 1883 [SYN] Seq=0 Win=42340 Len=0 MSS=1460 SACK_PERM=1 TSval=1797960595 TSecr=0 WS=512;
107;Jan 13, 2022 15:57:35.703451992 CET;192.168.1.104;192.168.1.102;1883;50552;58;1883 → 50552 [SYN, ACK] Seq=0 Ack=1 Win=8192 Len=0 MSS=1460;
108;Jan 13, 2022 15:57:35.703482472 CET;192.168.1.102;192.168.1.104;50552;1883;54;50552 → 1883 [ACK] Seq=1 Ack=1 Win=42340 Len=0;
109;Jan 13, 2022 15:57:35.703996194 CET;192.168.1.102;192.168.1.104;50552;1883;108;Connect Command;
110;Jan 13, 2022 15:57:35.912632712 CET;192.168.1.102;192.168.1.104;50552;1883;108;[TCP Retransmission] 50552 → 1883 [PSH, ACK] Seq=1 Ack=1 Win=42340 Len=54;
111;Jan 13, 2022 15:57:35.924106349 CET;192.168.1.104;192.168.1.102;1883;50552;54;1883 → 50552 [ACK] Seq=1 Ack=55 Win=8192 Len=0;
112;Jan 13, 2022 15:57:35.927614099 CET;192.168.1.104;192.168.1.102;1883;50552;58;Connect Ack;
113;Jan 13, 2022 15:57:35.927632111 CET;192.168.1.102;192.168.1.104;50552;1883;54;50552 → 1883 [ACK] Seq=55 Ack=5 Win=42336 Len=0;
114;Jan 13, 2022 15:57:35.927722032 CET;192.168.1.102;192.168.1.104;50552;1883;73;Publish Message [topic];message009
115;Jan 13, 2022 15:57:35.927746760 CET;192.168.1.102;192.168.1.104;50552;1883;56;Disconnect Req;
116;Jan 13, 2022 15:57:36.364533293 CET;192.168.1.102;192.168.1.104;50552;1883;75;[TCP Retransmission] 50552 → 1883 [FIN, PSH, ACK] Seq=55 Ack=5 Win=42336 Len=21;
117;Jan 13, 2022 15:57:36.368252929 CET;192.168.1.104;192.168.1.102;1883;50552;54;1883 → 50552 [FIN, ACK] Seq=5 Ack=77 Win=8192 Len=0;
118;Jan 13, 2022 15:57:36.368266191 CET;192.168.1.102;192.168.1.104;50552;1883;54;50552 → 1883 [ACK] Seq=77 Ack=6 Win=42335 Len=0;
119;Jan 13, 2022 15:57:40.933241748 CET;192.168.1.102;192.168.1.104;50554;1883;74;50554 → 1883 [SYN] Seq=0 Win=42340 Len=0 MSS=1460 SACK_PERM=1 TSval=1797965829 TSecr=0 WS=512;
120;Jan 13, 2022 15:57:40.939363849 CET;192.168.1.104;192.168.1.102;1883;50554;58;1883 → 50554 [SYN, ACK] Seq=0 Ack=1 Win=8192 Len=0 MSS=1460;
121;Jan 13, 2022 15:57:40.939401317 CET;192.168.1.102;192.168.1.104;50554;1883;54;50554 → 1883 [ACK] Seq=1 Ack=1 Win=42340 Len=0;
122;Jan 13, 2022 15:57:40.939473731 CET;192.168.1.102;192.168.1.104;50554;1883;108;Connect Command;
123;Jan 13, 2022 15:57:41.148526680 CET;192.168.1.102;192.168.1.104;50554;1883;108;[TCP Retransmission] 50554 → 1883 [PSH, ACK] Seq=1 Ack=1 Win=42340 Len=54;
124;Jan 13, 2022 15:57:41.154118109 CET;192.168.1.104;192.168.1.102;1883;50554;54;1883 → 50554 [ACK] Seq=1 Ack=55 Win=8192 Len=0;
125;Jan 13, 2022 15:57:41.156903401 CET;192.168.1.104;192.168.1.102;1883;50554;58;Connect Ack;
126;Jan 13, 2022 15:57:41.156920827 CET;192.168.1.102;192.168.1.104;50554;1883;54;50554 → 1883 [ACK] Seq=55 Ack=5 Win=42336 Len=0;
127;Jan 13, 2022 15:57:41.157014550 CET;192.168.1.102;192.168.1.104;50554;1883;73;Publish Message [topic];message010
128;Jan 13, 2022 15:57:41.157034743 CET;192.168.1.102;192.168.1.104;50554;1883;56;Disconnect Req;
129;Jan 13, 2022 15:57:41.580531272 CET;192.168.1.102;192.168.1.104;50554;1883;75;[TCP Retransmission] 50554 → 1883 [FIN, PSH, ACK] Seq=55 Ack=5 Win=42336 Len=21;
130;Jan 13, 2022 15:57:41.584466240 CET;192.168.1.104;192.168.1.102;1883;50554;54;1883 → 50554 [FIN, ACK] Seq=5 Ack=77 Win=8192 Len=0;
131;Jan 13, 2022 15:57:41.584483020 CET;192.168.1.102;192.168.1.104;50554;1883;54;50554 → 1883 [ACK] Seq=77 Ack=6 Win=42335 Len=0;
132;Jan 13, 2022 15:57:46.164556979 CET;192.168.1.102;192.168.1.104;50556;1883;74;50556 → 1883 [SYN] Seq=0 Win=42340 Len=0 MSS=1460 SACK_PERM=1 TSval=1797971060 TSecr=0 WS=512;
133;Jan 13, 2022 15:57:46.173227289 CET;192.168.1.104;192.168.1.102;1883;50556;58;1883 → 50556 [SYN, ACK] Seq=0 Ack=1 Win=8192 Len=0 MSS=1460;
134;Jan 13, 2022 15:57:46.173261488 CET;192.168.1.102;192.168.1.104;50556;1883;54;50556 → 1883 [ACK] Seq=1 Ack=1 Win=42340 Len=0;
135;Jan 13, 2022 15:57:46.173333764 CET;192.168.1.102;192.168.1.104;50556;1883;108;Connect Command;
136;Jan 13, 2022 15:57:46.388542052 CET;192.168.1.102;192.168.1.104;50556;1883;108;[TCP Retransmission] 50556 → 1883 [PSH, ACK] Seq=1 Ack=1 Win=42340 Len=54;
137;Jan 13, 2022 15:57:46.397156454 CET;192.168.1.104;192.168.1.102;1883;50556;54;1883 → 50556 [ACK] Seq=1 Ack=55 Win=8192 Len=0;
138;Jan 13, 2022 15:57:46.402383582 CET;192.168.1.104;192.168.1.102;1883;50556;58;Connect Ack;
139;Jan 13, 2022 15:57:46.402406226 CET;192.168.1.102;192.168.1.104;50556;1883;54;50556 → 1883 [ACK] Seq=55 Ack=5 Win=42336 Len=0;
140;Jan 13, 2022 15:57:46.402496331 CET;192.168.1.102;192.168.1.104;50556;1883;73;Publish Message [topic];message011
141;Jan 13, 2022 15:57:46.402564169 CET;192.168.1.102;192.168.1.104;50556;1883;56;Disconnect Req;
142;Jan 13, 2022 15:57:46.828573348 CET;192.168.1.102;192.168.1.104;50556;1883;75;[TCP Retransmission] 50556 → 1883 [FIN, PSH, ACK] Seq=55 Ack=5 Win=42336 Len=21;
143;Jan 13, 2022 15:57:46.845646683 CET;192.168.1.104;192.168.1.102;1883;50556;54;1883 → 50556 [FIN, ACK] Seq=5 Ack=77 Win=8192 Len=0;
144;Jan 13, 2022 15:57:46.845681006 CET;192.168.1.102;192.168.1.104;50556;1883;54;50556 → 1883 [ACK] Seq=77 Ack=6 Win=42335 Len=0;
145;Jan 13, 2022 15:57:51.415295484 CET;192.168.1.102;192.168.1.104;50558;1883;74;50558 → 1883 [SYN] Seq=0 Win=42340 Len=0 MSS=1460 SACK_PERM=1 TSval=1797976311 TSecr=0 WS=512;
146;Jan 13, 2022 15:57:51.428252015 CET;192.168.1.104;192.168.1.102;1883;50558;58;1883 → 50558 [SYN, ACK] Seq=0 Ack=1 Win=8192 Len=0 MSS=1460;
147;Jan 13, 2022 15:57:51.428291442 CET;192.168.1.102;192.168.1.104;50558;1883;54;50558 → 1883 [ACK] Seq=1 Ack=1 Win=42340 Len=0;
148;Jan 13, 2022 15:57:51.428366030 CET;192.168.1.102;192.168.1.104;50558;1883;108;Connect Command;
149;Jan 13, 2022 15:57:51.644533994 CET;192.168.1.102;192.168.1.104;50558;1883;108;[TCP Retransmission] 50558 → 1883 [PSH, ACK] Seq=1 Ack=1 Win=42340 Len=54;
150;Jan 13, 2022 15:57:51.652343410 CET;192.168.1.104;192.168.1.102;1883;50558;54;1883 → 50558 [ACK] Seq=1 Ack=55 Win=8192 Len=0;
151;Jan 13, 2022 15:57:51.656183340 CET;192.168.1.104;192.168.1.102;1883;50558;58;Connect Ack;
152;Jan 13, 2022 15:57:51.656196026 CET;192.168.1.102;192.168.1.104;50558;1883;54;50558 → 1883 [ACK] Seq=55 Ack=5 Win=42336 Len=0;
153;Jan 13, 2022 15:57:51.656263140 CET;192.168.1.102;192.168.1.104;50558;1883;73;Publish Message [topic];message012
154;Jan 13, 2022 15:57:51.656290335 CET;192.168.1.102;192.168.1.104;50558;1883;56;Disconnect Req;
155;Jan 13, 2022 15:57:52.108653837 CET;192.168.1.102;192.168.1.104;50558;1883;75;[TCP Retransmission] 50558 → 1883 [FIN, PSH, ACK] Seq=55 Ack=5 Win=42336 Len=21;
156;Jan 13, 2022 15:57:52.115902888 CET;192.168.1.104;192.168.1.102;1883;50558;54;1883 → 50558 [FIN, ACK] Seq=5 Ack=77 Win=8192 Len=0;
157;Jan 13, 2022 15:57:52.115924301 CET;192.168.1.102;192.168.1.104;50558;1883;54;50558 → 1883 [ACK] Seq=77 Ack=6 Win=42335 Len=0;
158;Jan 13, 2022 15:57:56.660308384 CET;192.168.1.102;192.168.1.104;50560;1883;74;50560 → 1883 [SYN] Seq=0 Win=42340 Len=0 MSS=1460 SACK_PERM=1 TSval=1797981556 TSecr=0 WS=512;
159;Jan 13, 2022 15:57:56.662950366 CET;192.168.1.104;192.168.1.102;1883;50560;58;1883 → 50560 [SYN, ACK] Seq=0 Ack=1 Win=8192 Len=0 MSS=1460;
160;Jan 13, 2022 15:57:56.662967305 CET;192.168.1.102;192.168.1.104;50560;1883;54;50560 → 1883 [ACK] Seq=1 Ack=1 Win=42340 Len=0;
161;Jan 13, 2022 15:57:56.664278728 CET;192.168.1.102;192.168.1.104;50560;1883;108;Connect Command;
162;Jan 13, 2022 15:57:56.670590404 CET;192.168.1.104;192.168.1.102;1883;50560;54;1883 → 50560 [ACK] Seq=1 Ack=55 Win=8192 Len=0;
163;Jan 13, 2022 15:57:56.673419044 CET;192.168.1.104;192.168.1.102;1883;50560;58;Connect Ack;
164;Jan 13, 2022 15:57:56.673429612 CET;192.168.1.102;192.168.1.104;50560;1883;54;50560 → 1883 [ACK] Seq=55 Ack=5 Win=42336 Len=0;
165;Jan 13, 2022 15:57:56.673481797 CET;192.168.1.102;192.168.1.104;50560;1883;73;Publish Message [topic];message013
166;Jan 13, 2022 15:57:56.673501132 CET;192.168.1.102;192.168.1.104;50560;1883;56;Disconnect Req;
167;Jan 13, 2022 15:57:56.880551060 CET;192.168.1.102;192.168.1.104;50560;1883;75;[TCP Retransmission] 50560 → 1883 [FIN, PSH, ACK] Seq=55 Ack=5 Win=42336 Len=21;
168;Jan 13, 2022 15:57:56.884299908 CET;192.168.1.104;192.168.1.102;1883;50560;54;1883 → 50560 [FIN, ACK] Seq=5 Ack=77 Win=8192 Len=0;
169;Jan 13, 2022 15:57:56.884310629 CET;192.168.1.102;192.168.1.104;50560;1883;54;50560 → 1883 [ACK] Seq=77 Ack=6 Win=42335 Len=0;
170;Jan 13, 2022 15:58:01.684393332 CET;192.168.1.102;192.168.1.104;50562;1883;74;50562 → 1883 [SYN] Seq=0 Win=42340 Len=0 MSS=1460 SACK_PERM=1 TSval=1797986580 TSecr=0 WS=512;
171;Jan 13, 2022 15:58:01.698440746 CET;192.168.1.104;192.168.1.102;1883;50562;58;1883 → 50562 [SYN, ACK] Seq=0 Ack=1 Win=8192 Len=0 MSS=1460;
172;Jan 13, 2022 15:58:01.698474084 CET;192.168.1.102;192.168.1.104;50562;1883;54;50562 → 1883 [ACK] Seq=1 Ack=1 Win=42340 Len=0;
173;Jan 13, 2022 15:58:01.698554062 CET;192.168.1.102;192.168.1.104;50562;1883;108;Connect Command;
174;Jan 13, 2022 15:58:01.916568739 CET;192.168.1.102;192.168.1.104;50562;1883;108;[TCP Retransmission] 50562 → 1883 [PSH, ACK] Seq=1 Ack=1 Win=42340 Len=54;
175;Jan 13, 2022 15:58:01.923657550 CET;192.168.1.104;192.168.1.102;1883;50562;54;1883 → 50562 [ACK] Seq=1 Ack=55 Win=8192 Len=0;
176;Jan 13, 2022 15:58:01.926962247 CET;192.168.1.104;192.168.1.102;1883;50562;58;Connect Ack;
177;Jan 13, 2022 15:58:01.926995452 CET;192.168.1.102;192.168.1.104;50562;1883;54;50562 → 1883 [ACK] Seq=55 Ack=5 Win=42336 Len=0;
178;Jan 13, 2022 15:58:01.927151460 CET;192.168.1.102;192.168.1.104;50562;1883;73;Publish Message [topic];message014
179;Jan 13, 2022 15:58:01.927172052 CET;192.168.1.102;192.168.1.104;50562;1883;56;Disconnect Req;
180;Jan 13, 2022 15:58:02.380566929 CET;192.168.1.102;192.168.1.104;50562;1883;75;[TCP Retransmission] 50562 → 1883 [FIN, PSH, ACK] Seq=55 Ack=5 Win=42336 Len=21;
181;Jan 13, 2022 15:58:02.399657085 CET;192.168.1.104;192.168.1.102;1883;50562;54;1883 → 50562 [FIN, ACK] Seq=5 Ack=77 Win=8192 Len=0;
182;Jan 13, 2022 15:58:02.399701973 CET;192.168.1.102;192.168.1.104;50562;1883;54;50562 → 1883 [ACK] Seq=77 Ack=6 Win=42335 Len=0;
183;Jan 13, 2022 15:58:06.939249502 CET;192.168.1.102;192.168.1.104;50564;1883;74;50564 → 1883 [SYN] Seq=0 Win=42340 Len=0 MSS=1460 SACK_PERM=1 TSval=1797991835 TSecr=0 WS=512;
184;Jan 13, 2022 15:58:06.950495672 CET;192.168.1.104;192.168.1.102;1883;50564;58;1883 → 50564 [SYN, ACK] Seq=0 Ack=1 Win=8192 Len=0 MSS=1460;
185;Jan 13, 2022 15:58:06.950540470 CET;192.168.1.102;192.168.1.104;50564;1883;54;50564 → 1883 [ACK] Seq=1 Ack=1 Win=42340 Len=0;
186;Jan 13, 2022 15:58:06.950633851 CET;192.168.1.102;192.168.1.104;50564;1883;108;Connect Command;
187;Jan 13, 2022 15:58:07.164619792 CET;192.168.1.102;192.168.1.104;50564;1883;108;[TCP Retransmission] 50564 → 1883 [PSH, ACK] Seq=1 Ack=1 Win=42340 Len=54;
188;Jan 13, 2022 15:58:07.181615244 CET;192.168.1.104;192.168.1.102;1883;50564;54;1883 → 50564 [ACK] Seq=1 Ack=55 Win=8192 Len=0;
189;Jan 13, 2022 15:58:07.188939613 CET;192.168.1.104;192.168.1.102;1883;50564;58;Connect Ack;
190;Jan 13, 2022 15:58:07.188958046 CET;192.168.1.102;192.168.1.104;50564;1883;54;50564 → 1883 [ACK] Seq=55 Ack=5 Win=42336 Len=0;
191;Jan 13, 2022 15:58:07.189045731 CET;192.168.1.102;192.168.1.104;50564;1883;73;Publish Message [topic];message015
192;Jan 13, 2022 15:58:07.189082704 CET;192.168.1.102;192.168.1.104;50564;1883;56;Disconnect Req;
193;Jan 13, 2022 15:58:07.628693344 CET;192.168.1.102;192.168.1.104;50564;1883;75;[TCP Retransmission] 50564 → 1883 [FIN, PSH, ACK] Seq=55 Ack=5 Win=42336 Len=21;
194;Jan 13, 2022 15:58:07.636651383 CET;192.168.1.104;192.168.1.102;1883;50564;54;1883 → 50564 [FIN, ACK] Seq=5 Ack=77 Win=8192 Len=0;
195;Jan 13, 2022 15:58:07.636676274 CET;192.168.1.102;192.168.1.104;50564;1883;54;50564 → 1883 [ACK] Seq=77 Ack=6 Win=42335 Len=0;
196;Jan 13, 2022 15:58:12.194020785 CET;192.168.1.102;192.168.1.104;50566;1883;74;50566 → 1883 [SYN] Seq=0 Win=42340 Len=0 MSS=1460 SACK_PERM=1 TSval=1797997090 TSecr=0 WS=512;
197;Jan 13, 2022 15:58:12.196771441 CET;192.168.1.104;192.168.1.102;1883;50566;58;1883 → 50566 [SYN, ACK] Seq=0 Ack=1 Win=8192 Len=0 MSS=1460;
198;Jan 13, 2022 15:58:12.196785187 CET;192.168.1.102;192.168.1.104;50566;1883;54;50566 → 1883 [ACK] Seq=1 Ack=1 Win=42340 Len=0;
199;Jan 13, 2022 15:58:12.196911884 CET;192.168.1.102;192.168.1.104;50566;1883;108;Connect Command;
200;Jan 13, 2022 15:58:12.404538824 CET;192.168.1.102;192.168.1.104;50566;1883;108;[TCP Retransmission] 50566 → 1883 [PSH, ACK] Seq=1 Ack=1 Win=42340 Len=54;
201;Jan 13, 2022 15:58:12.408268541 CET;192.168.1.104;192.168.1.102;1883;50566;54;1883 → 50566 [ACK] Seq=1 Ack=55 Win=8192 Len=0;
202;Jan 13, 2022 15:58:12.413917331 CET;192.168.1.104;192.168.1.102;1883;50566;58;Connect Ack;
203;Jan 13, 2022 15:58:12.413931239 CET;192.168.1.102;192.168.1.104;50566;1883;54;50566 → 1883 [ACK] Seq=55 Ack=5 Win=42336 Len=0;
204;Jan 13, 2022 15:58:12.413989829 CET;192.168.1.102;192.168.1.104;50566;1883;73;Publish Message [topic];message016
205;Jan 13, 2022 15:58:12.414011529 CET;192.168.1.102;192.168.1.104;50566;1883;56;Disconnect Req;
206;Jan 13, 2022 15:58:12.845038300 CET;192.168.1.102;192.168.1.104;50566;1883;75;[TCP Retransmission] 50566 → 1883 [FIN, PSH, ACK] Seq=55 Ack=5 Win=42336 Len=21;
207;Jan 13, 2022 15:58:12.865469534 CET;192.168.1.104;192.168.1.102;1883;50566;54;1883 → 50566 [FIN, ACK] Seq=5 Ack=77 Win=8192 Len=0;
208;Jan 13, 2022 15:58:12.865512787 CET;192.168.1.102;192.168.1.104;50566;1883;54;50566 → 1883 [ACK] Seq=77 Ack=6 Win=42335 Len=0;
209;Jan 13, 2022 15:58:17.419992107 CET;192.168.1.102;192.168.1.104;50568;1883;74;50568 → 1883 [SYN] Seq=0 Win=42340 Len=0 MSS=1460 SACK_PERM=1 TSval=1798002316 TSecr=0 WS=512;
210;Jan 13, 2022 15:58:17.427836851 CET;192.168.1.104;192.168.1.102;1883;50568;58;1883 → 50568 [SYN, ACK] Seq=0 Ack=1 Win=8192 Len=0 MSS=1460;
211;Jan 13, 2022 15:58:17.427869387 CET;192.168.1.102;192.168.1.104;50568;1883;54;50568 → 1883 [ACK] Seq=1 Ack=1 Win=42340 Len=0;
212;Jan 13, 2022 15:58:17.428434797 CET;192.168.1.102;192.168.1.104;50568;1883;108;Connect Command;
213;Jan 13, 2022 15:58:17.636540449 CET;192.168.1.102;192.168.1.104;50568;1883;108;[TCP Retransmission] 50568 → 1883 [PSH, ACK] Seq=1 Ack=1 Win=42340 Len=54;
214;Jan 13, 2022 15:58:17.641817607 CET;192.168.1.104;192.168.1.102;1883;50568;54;1883 → 50568 [ACK] Seq=1 Ack=55 Win=8192 Len=0;
215;Jan 13, 2022 15:58:17.645633224 CET;192.168.1.104;192.168.1.102;1883;50568;58;Connect Ack;
216;Jan 13, 2022 15:58:17.645649960 CET;192.168.1.102;192.168.1.104;50568;1883;54;50568 → 1883 [ACK] Seq=55 Ack=5 Win=42336 Len=0;
217;Jan 13, 2022 15:58:17.645721265 CET;192.168.1.102;192.168.1.104;50568;1883;73;Publish Message [topic];message017
218;Jan 13, 2022 15:58:17.645746673 CET;192.168.1.102;192.168.1.104;50568;1883;56;Disconnect Req;
219;Jan 13, 2022 15:58:18.092524448 CET;192.168.1.102;192.168.1.104;50568;1883;75;[TCP Retransmission] 50568 → 1883 [FIN, PSH, ACK] Seq=55 Ack=5 Win=42336 Len=21;
220;Jan 13, 2022 15:58:18.095768013 CET;192.168.1.104;192.168.1.102;1883;50568;54;1883 → 50568 [FIN, ACK] Seq=5 Ack=77 Win=8192 Len=0;
221;Jan 13, 2022 15:58:18.095781309 CET;192.168.1.102;192.168.1.104;50568;1883;54;50568 → 1883 [ACK] Seq=77 Ack=6 Win=42335 Len=0;
222;Jan 13, 2022 15:58:22.653264272 CET;192.168.1.102;192.168.1.104;50570;1883;74;50570 → 1883 [SYN] Seq=0 Win=42340 Len=0 MSS=1460 SACK_PERM=1 TSval=1798007549 TSecr=0 WS=512;
223;Jan 13, 2022 15:58:22.657488640 CET;192.168.1.104;192.168.1.102;1883;50570;58;1883 → 50570 [SYN, ACK] Seq=0 Ack=1 Win=8192 Len=0 MSS=1460;
224;Jan 13, 2022 15:58:22.657514252 CET;192.168.1.102;192.168.1.104;50570;1883;54;50570 → 1883 [ACK] Seq=1 Ack=1 Win=42340 Len=0;
225;Jan 13, 2022 15:58:22.657994300 CET;192.168.1.102;192.168.1.104;50570;1883;108;Connect Command;
226;Jan 13, 2022 15:58:22.868550828 CET;192.168.1.102;192.168.1.104;50570;1883;108;[TCP Retransmission] 50570 → 1883 [PSH, ACK] Seq=1 Ack=1 Win=42340 Len=54;
227;Jan 13, 2022 15:58:22.877218893 CET;192.168.1.104;192.168.1.102;1883;50570;54;1883 → 50570 [ACK] Seq=1 Ack=55 Win=8192 Len=0;
228;Jan 13, 2022 15:58:22.882557162 CET;192.168.1.104;192.168.1.102;1883;50570;58;Connect Ack;
229;Jan 13, 2022 15:58:22.882574770 CET;192.168.1.102;192.168.1.104;50570;1883;54;50570 → 1883 [ACK] Seq=55 Ack=5 Win=42336 Len=0;
230;Jan 13, 2022 15:58:22.882661567 CET;192.168.1.102;192.168.1.104;50570;1883;73;Publish Message [topic];message018
231;Jan 13, 2022 15:58:22.882731948 CET;192.168.1.102;192.168.1.104;50570;1883;56;Disconnect Req;
232;Jan 13, 2022 15:58:23.308591217 CET;192.168.1.102;192.168.1.104;50570;1883;75;[TCP Retransmission] 50570 → 1883 [FIN, PSH, ACK] Seq=55 Ack=5 Win=42336 Len=21;
233;Jan 13, 2022 15:58:23.319881265 CET;192.168.1.104;192.168.1.102;1883;50570;54;1883 → 50570 [FIN, ACK] Seq=5 Ack=77 Win=8192 Len=0;
234;Jan 13, 2022 15:58:23.319923004 CET;192.168.1.102;192.168.1.104;50570;1883;54;50570 → 1883 [ACK] Seq=77 Ack=6 Win=42335 Len=0;
235;Jan 13, 2022 15:58:27.890582090 CET;192.168.1.102;192.168.1.104;50572;1883;74;50572 → 1883 [SYN] Seq=0 Win=42340 Len=0 MSS=1460 SACK_PERM=1 TSval=1798012786 TSecr=0 WS=512;
236;Jan 13, 2022 15:58:27.895279780 CET;192.168.1.104;192.168.1.102;1883;50572;58;1883 → 50572 [SYN, ACK] Seq=0 Ack=1 Win=8192 Len=0 MSS=1460;
237;Jan 13, 2022 15:58:27.895311927 CET;192.168.1.102;192.168.1.104;50572;1883;54;50572 → 1883 [ACK] Seq=1 Ack=1 Win=42340 Len=0;
238;Jan 13, 2022 15:58:27.895712132 CET;192.168.1.102;192.168.1.104;50572;1883;108;Connect Command;
239;Jan 13, 2022 15:58:28.104575065 CET;192.168.1.102;192.168.1.104;50572;1883;108;[TCP Retransmission] 50572 → 1883 [PSH, ACK] Seq=1 Ack=1 Win=42340 Len=54;
240;Jan 13, 2022 15:58:28.122786666 CET;192.168.1.104;192.168.1.102;1883;50572;54;1883 → 50572 [ACK] Seq=1 Ack=55 Win=8192 Len=0;
241;Jan 13, 2022 15:58:28.130710395 CET;192.168.1.104;192.168.1.102;1883;50572;58;Connect Ack;
242;Jan 13, 2022 15:58:28.130731298 CET;192.168.1.102;192.168.1.104;50572;1883;54;50572 → 1883 [ACK] Seq=55 Ack=5 Win=42336 Len=0;
243;Jan 13, 2022 15:58:28.130816002 CET;192.168.1.102;192.168.1.104;50572;1883;73;Publish Message [topic];message019
244;Jan 13, 2022 15:58:28.130853534 CET;192.168.1.102;192.168.1.104;50572;1883;56;Disconnect Req;
245;Jan 13, 2022 15:58:28.556563533 CET;192.168.1.102;192.168.1.104;50572;1883;75;[TCP Retransmission] 50572 → 1883 [FIN, PSH, ACK] Seq=55 Ack=5 Win=42336 Len=21;
246;Jan 13, 2022 15:58:28.570795677 CET;192.168.1.104;192.168.1.102;1883;50572;54;1883 → 50572 [FIN, ACK] Seq=5 Ack=77 Win=8192 Len=0;
247;Jan 13, 2022 15:58:28.570817011 CET;192.168.1.102;192.168.1.104;50572;1883;54;50572 → 1883 [ACK] Seq=77 Ack=6 Win=42335 Len=0;
248;Jan 13, 2022 15:58:33.145686317 CET;192.168.1.102;192.168.1.104;50574;1883;74;50574 → 1883 [SYN] Seq=0 Win=42340 Len=0 MSS=1460 SACK_PERM=1 TSval=1798018041 TSecr=0 WS=512;
249;Jan 13, 2022 15:58:33.150497708 CET;192.168.1.104;192.168.1.102;1883;50574;58;1883 → 50574 [SYN, ACK] Seq=0 Ack=1 Win=8192 Len=0 MSS=1460;
250;Jan 13, 2022 15:58:33.150522295 CET;192.168.1.102;192.168.1.104;50574;1883;54;50574 → 1883 [ACK] Seq=1 Ack=1 Win=42340 Len=0;
251;Jan 13, 2022 15:58:33.150580296 CET;192.168.1.102;192.168.1.104;50574;1883;108;Connect Command;
252;Jan 13, 2022 15:58:33.360525280 CET;192.168.1.102;192.168.1.104;50574;1883;108;[TCP Retransmission] 50574 → 1883 [PSH, ACK] Seq=1 Ack=1 Win=42340 Len=54;
253;Jan 13, 2022 15:58:33.367920572 CET;192.168.1.104;192.168.1.102;1883;50574;54;1883 → 50574 [ACK] Seq=1 Ack=55 Win=8192 Len=0;
254;Jan 13, 2022 15:58:33.372592656 CET;192.168.1.104;192.168.1.102;1883;50574;58;Connect Ack;
255;Jan 13, 2022 15:58:33.372613453 CET;192.168.1.102;192.168.1.104;50574;1883;54;50574 → 1883 [ACK] Seq=55 Ack=5 Win=42336 Len=0;
256;Jan 13, 2022 15:58:33.372699130 CET;192.168.1.102;192.168.1.104;50574;1883;73;Publish Message [topic];message020
257;Jan 13, 2022 15:58:33.372715214 CET;192.168.1.102;192.168.1.104;50574;1883;56;Disconnect Req;
258;Jan 13, 2022 15:58:33.804532437 CET;192.168.1.102;192.168.1.104;50574;1883;75;[TCP Retransmission] 50574 → 1883 [FIN, PSH, ACK] Seq=55 Ack=5 Win=42336 Len=21;
259;Jan 13, 2022 15:58:33.810765046 CET;192.168.1.104;192.168.1.102;1883;50574;54;1883 → 50574 [FIN, ACK] Seq=5 Ack=77 Win=8192 Len=0;
260;Jan 13, 2022 15:58:33.810784000 CET;192.168.1.102;192.168.1.104;50574;1883;54;50574 → 1883 [ACK] Seq=77 Ack=6 Win=42335 Len=0;
261;Jan 13, 2022 15:58:38.377703537 CET;192.168.1.102;192.168.1.104;50576;1883;74;50576 → 1883 [SYN] Seq=0 Win=42340 Len=0 MSS=1460 SACK_PERM=1 TSval=1798023273 TSecr=0 WS=512;
262;Jan 13, 2022 15:58:38.381635820 CET;192.168.1.104;192.168.1.102;1883;50576;58;1883 → 50576 [SYN, ACK] Seq=0 Ack=1 Win=8192 Len=0 MSS=1460;
263;Jan 13, 2022 15:58:38.381653561 CET;192.168.1.102;192.168.1.104;50576;1883;54;50576 → 1883 [ACK] Seq=1 Ack=1 Win=42340 Len=0;
264;Jan 13, 2022 15:58:38.382470407 CET;192.168.1.102;192.168.1.104;50576;1883;108;Connect Command;
265;Jan 13, 2022 15:58:38.588513899 CET;192.168.1.102;192.168.1.104;50576;1883;108;[TCP Retransmission] 50576 → 1883 [PSH, ACK] Seq=1 Ack=1 Win=42340 Len=54;
266;Jan 13, 2022 15:58:38.592057528 CET;192.168.1.104;192.168.1.102;1883;50576;54;1883 → 50576 [ACK] Seq=1 Ack=55 Win=8192 Len=0;
267;Jan 13, 2022 15:58:38.596443656 CET;192.168.1.104;192.168.1.102;1883;50576;58;Connect Ack;
268;Jan 13, 2022 15:58:38.596462250 CET;192.168.1.102;192.168.1.104;50576;1883;54;50576 → 1883 [ACK] Seq=55 Ack=5 Win=42336 Len=0;
269;Jan 13, 2022 15:58:38.596590997 CET;192.168.1.102;192.168.1.104;50576;1883;73;Publish Message [topic];message021
270;Jan 13, 2022 15:58:38.596620251 CET;192.168.1.102;192.168.1.104;50576;1883;56;Disconnect Req;
271;Jan 13, 2022 15:58:39.020991301 CET;192.168.1.102;192.168.1.104;50576;1883;75;[TCP Retransmission] 50576 → 1883 [FIN, PSH, ACK] Seq=55 Ack=5 Win=42336 Len=21;
272;Jan 13, 2022 15:58:39.024384569 CET;192.168.1.104;192.168.1.102;1883;50576;54;1883 → 50576 [FIN, ACK] Seq=5 Ack=77 Win=8192 Len=0;
273;Jan 13, 2022 15:58:39.024399245 CET;192.168.1.102;192.168.1.104;50576;1883;54;50576 → 1883 [ACK] Seq=77 Ack=6 Win=42335 Len=0;
274;Jan 13, 2022 15:58:43.601057376 CET;192.168.1.102;192.168.1.104;50578;1883;74;50578 → 1883 [SYN] Seq=0 Win=42340 Len=0 MSS=1460 SACK_PERM=1 TSval=1798028497 TSecr=0 WS=512;
275;Jan 13, 2022 15:58:43.605830735 CET;192.168.1.104;192.168.1.102;1883;50578;58;1883 → 50578 [SYN, ACK] Seq=0 Ack=1 Win=8192 Len=0 MSS=1460;
276;Jan 13, 2022 15:58:43.605853973 CET;192.168.1.102;192.168.1.104;50578;1883;54;50578 → 1883 [ACK] Seq=1 Ack=1 Win=42340 Len=0;
277;Jan 13, 2022 15:58:43.605899220 CET;192.168.1.102;192.168.1.104;50578;1883;108;Connect Command;
278;Jan 13, 2022 15:58:43.816531334 CET;192.168.1.102;192.168.1.104;50578;1883;108;[TCP Retransmission] 50578 → 1883 [PSH, ACK] Seq=1 Ack=1 Win=42340 Len=54;
279;Jan 13, 2022 15:58:43.819818603 CET;192.168.1.104;192.168.1.102;1883;50578;54;1883 → 50578 [ACK] Seq=1 Ack=55 Win=8192 Len=0;
280;Jan 13, 2022 15:58:43.823763610 CET;192.168.1.104;192.168.1.102;1883;50578;58;Connect Ack;
281;Jan 13, 2022 15:58:43.823781047 CET;192.168.1.102;192.168.1.104;50578;1883;54;50578 → 1883 [ACK] Seq=55 Ack=5 Win=42336 Len=0;
282;Jan 13, 2022 15:58:43.823839073 CET;192.168.1.102;192.168.1.104;50578;1883;73;Publish Message [topic];message022
283;Jan 13, 2022 15:58:43.823861788 CET;192.168.1.102;192.168.1.104;50578;1883;56;Disconnect Req;
284;Jan 13, 2022 15:58:44.269247596 CET;192.168.1.102;192.168.1.104;50578;1883;75;[TCP Retransmission] 50578 → 1883 [FIN, PSH, ACK] Seq=55 Ack=5 Win=42336 Len=21;
285;Jan 13, 2022 15:58:44.272331654 CET;192.168.1.104;192.168.1.102;1883;50578;54;1883 → 50578 [FIN, ACK] Seq=5 Ack=77 Win=8192 Len=0;
286;Jan 13, 2022 15:58:44.272345717 CET;192.168.1.102;192.168.1.104;50578;1883;54;50578 → 1883 [ACK] Seq=77 Ack=6 Win=42335 Len=0;
287;Jan 13, 2022 15:58:48.834387022 CET;192.168.1.102;192.168.1.104;50580;1883;74;50580 → 1883 [SYN] Seq=0 Win=42340 Len=0 MSS=1460 SACK_PERM=1 TSval=1798033730 TSecr=0 WS=512;
288;Jan 13, 2022 15:58:48.848795476 CET;192.168.1.104;192.168.1.102;1883;50580;58;1883 → 50580 [SYN, ACK] Seq=0 Ack=1 Win=8192 Len=0 MSS=1460;
289;Jan 13, 2022 15:58:48.848831226 CET;192.168.1.102;192.168.1.104;50580;1883;54;50580 → 1883 [ACK] Seq=1 Ack=1 Win=42340 Len=0;
290;Jan 13, 2022 15:58:48.848910577 CET;192.168.1.102;192.168.1.104;50580;1883;108;Connect Command;
291;Jan 13, 2022 15:58:49.068517302 CET;192.168.1.102;192.168.1.104;50580;1883;108;[TCP Retransmission] 50580 → 1883 [PSH, ACK] Seq=1 Ack=1 Win=42340 Len=54;
292;Jan 13, 2022 15:58:49.074055279 CET;192.168.1.104;192.168.1.102;1883;50580;54;1883 → 50580 [ACK] Seq=1 Ack=55 Win=8192 Len=0;
293;Jan 13, 2022 15:58:49.077169030 CET;192.168.1.104;192.168.1.102;1883;50580;58;Connect Ack;
294;Jan 13, 2022 15:58:49.077185229 CET;192.168.1.102;192.168.1.104;50580;1883;54;50580 → 1883 [ACK] Seq=55 Ack=5 Win=42336 Len=0;
295;Jan 13, 2022 15:58:49.077246464 CET;192.168.1.102;192.168.1.104;50580;1883;73;Publish Message [topic];message023
296;Jan 13, 2022 15:58:49.077273198 CET;192.168.1.102;192.168.1.104;50580;1883;56;Disconnect Req;
297;Jan 13, 2022 15:58:49.516557634 CET;192.168.1.102;192.168.1.104;50580;1883;75;[TCP Retransmission] 50580 → 1883 [FIN, PSH, ACK] Seq=55 Ack=5 Win=42336 Len=21;
298;Jan 13, 2022 15:58:49.519564007 CET;192.168.1.104;192.168.1.102;1883;50580;54;1883 → 50580 [FIN, ACK] Seq=5 Ack=77 Win=8192 Len=0;
299;Jan 13, 2022 15:58:49.519576760 CET;192.168.1.102;192.168.1.104;50580;1883;54;50580 → 1883 [ACK] Seq=77 Ack=6 Win=42335 Len=0;
300;Jan 13, 2022 15:58:54.089835096 CET;192.168.1.102;192.168.1.104;50582;1883;74;50582 → 1883 [SYN] Seq=0 Win=42340 Len=0 MSS=1460 SACK_PERM=1 TSval=1798038985 TSecr=0 WS=512;
301;Jan 13, 2022 15:58:54.119371956 CET;192.168.1.104;192.168.1.102;1883;50582;58;1883 → 50582 [SYN, ACK] Seq=0 Ack=1 Win=8192 Len=0 MSS=1460;
302;Jan 13, 2022 15:58:54.119389583 CET;192.168.1.102;192.168.1.104;50582;1883;54;50582 → 1883 [ACK] Seq=1 Ack=1 Win=42340 Len=0;
303;Jan 13, 2022 15:58:54.119445357 CET;192.168.1.102;192.168.1.104;50582;1883;108;Connect Command;
304;Jan 13, 2022 15:58:54.352546005 CET;192.168.1.102;192.168.1.104;50582;1883;108;[TCP Retransmission] 50582 → 1883 [PSH, ACK] Seq=1 Ack=1 Win=42340 Len=54;
305;Jan 13, 2022 15:58:54.369969612 CET;192.168.1.104;192.168.1.102;1883;50582;54;1883 → 50582 [ACK] Seq=1 Ack=55 Win=8192 Len=0;
306;Jan 13, 2022 15:58:54.375147931 CET;192.168.1.104;192.168.1.102;1883;50582;58;Connect Ack;
307;Jan 13, 2022 15:58:54.375161914 CET;192.168.1.102;192.168.1.104;50582;1883;54;50582 → 1883 [ACK] Seq=55 Ack=5 Win=42336 Len=0;
308;Jan 13, 2022 15:58:54.375245357 CET;192.168.1.102;192.168.1.104;50582;1883;73;Publish Message [topic];message024
309;Jan 13, 2022 15:58:54.375285594 CET;192.168.1.102;192.168.1.104;50582;1883;56;Disconnect Req;
310;Jan 13, 2022 15:58:54.861216127 CET;192.168.1.102;192.168.1.104;50582;1883;75;[TCP Retransmission] 50582 → 1883 [FIN, PSH, ACK] Seq=55 Ack=5 Win=42336 Len=21;
311;Jan 13, 2022 15:58:54.867404481 CET;192.168.1.104;192.168.1.102;1883;50582;54;1883 → 50582 [FIN, ACK] Seq=5 Ack=77 Win=8192 Len=0;
312;Jan 13, 2022 15:58:54.867427510 CET;192.168.1.102;192.168.1.104;50582;1883;54;50582 → 1883 [ACK] Seq=77 Ack=6 Win=42335 Len=0;
313;Jan 13, 2022 15:58:59.390921753 CET;192.168.1.102;192.168.1.104;50584;1883;74;50584 → 1883 [SYN] Seq=0 Win=42340 Len=0 MSS=1460 SACK_PERM=1 TSval=1798044287 TSecr=0 WS=512;
314;Jan 13, 2022 15:58:59.402551999 CET;192.168.1.104;192.168.1.102;1883;50584;58;1883 → 50584 [SYN, ACK] Seq=0 Ack=1 Win=8192 Len=0 MSS=1460;
315;Jan 13, 2022 15:58:59.402596077 CET;192.168.1.102;192.168.1.104;50584;1883;54;50584 → 1883 [ACK] Seq=1 Ack=1 Win=42340 Len=0;
316;Jan 13, 2022 15:58:59.402722382 CET;192.168.1.102;192.168.1.104;50584;1883;108;Connect Command;
317;Jan 13, 2022 15:58:59.616629413 CET;192.168.1.102;192.168.1.104;50584;1883;108;[TCP Retransmission] 50584 → 1883 [PSH, ACK] Seq=1 Ack=1 Win=42340 Len=54;
318;Jan 13, 2022 15:58:59.634384141 CET;192.168.1.104;192.168.1.102;1883;50584;54;1883 → 50584 [ACK] Seq=1 Ack=55 Win=8192 Len=0;
319;Jan 13, 2022 15:58:59.639733354 CET;192.168.1.104;192.168.1.102;1883;50584;58;Connect Ack;
320;Jan 13, 2022 15:58:59.639750610 CET;192.168.1.102;192.168.1.104;50584;1883;54;50584 → 1883 [ACK] Seq=55 Ack=5 Win=42336 Len=0;
321;Jan 13, 2022 15:58:59.639822129 CET;192.168.1.102;192.168.1.104;50584;1883;73;Publish Message [topic];message025
322;Jan 13, 2022 15:58:59.639849935 CET;192.168.1.102;192.168.1.104;50584;1883;56;Disconnect Req;
323;Jan 13, 2022 15:59:00.076526350 CET;192.168.1.102;192.168.1.104;50584;1883;75;[TCP Retransmission] 50584 → 1883 [FIN, PSH, ACK] Seq=55 Ack=5 Win=42336 Len=21;
324;Jan 13, 2022 15:59:00.083318763 CET;192.168.1.104;192.168.1.102;1883;50584;54;1883 → 50584 [FIN, ACK] Seq=5 Ack=77 Win=8192 Len=0;
325;Jan 13, 2022 15:59:00.083345233 CET;192.168.1.102;192.168.1.104;50584;1883;54;50584 → 1883 [ACK] Seq=77 Ack=6 Win=42335 Len=0;
326;Jan 13, 2022 15:59:04.654390598 CET;192.168.1.102;192.168.1.104;50586;1883;74;50586 → 1883 [SYN] Seq=0 Win=42340 Len=0 MSS=1460 SACK_PERM=1 TSval=1798049550 TSecr=0 WS=512;
327;Jan 13, 2022 15:59:04.659550082 CET;192.168.1.104;192.168.1.102;1883;50586;58;1883 → 50586 [SYN, ACK] Seq=0 Ack=1 Win=8192 Len=0 MSS=1460;
328;Jan 13, 2022 15:59:04.659572196 CET;192.168.1.102;192.168.1.104;50586;1883;54;50586 → 1883 [ACK] Seq=1 Ack=1 Win=42340 Len=0;
329;Jan 13, 2022 15:59:04.659626452 CET;192.168.1.102;192.168.1.104;50586;1883;108;Connect Command;
330;Jan 13, 2022 15:59:04.868741886 CET;192.168.1.102;192.168.1.104;50586;1883;108;[TCP Retransmission] 50586 → 1883 [PSH, ACK] Seq=1 Ack=1 Win=42340 Len=54;
331;Jan 13, 2022 15:59:04.889798122 CET;192.168.1.104;192.168.1.102;1883;50586;54;1883 → 50586 [ACK] Seq=1 Ack=55 Win=8192 Len=0;
332;Jan 13, 2022 15:59:04.896330105 CET;192.168.1.104;192.168.1.102;1883;50586;58;Connect Ack;
333;Jan 13, 2022 15:59:04.896373784 CET;192.168.1.102;192.168.1.104;50586;1883;54;50586 → 1883 [ACK] Seq=55 Ack=5 Win=42336 Len=0;
334;Jan 13, 2022 15:59:04.896456953 CET;192.168.1.102;192.168.1.104;50586;1883;73;Publish Message [topic];message026
335;Jan 13, 2022 15:59:04.896484127 CET;192.168.1.102;192.168.1.104;50586;1883;56;Disconnect Req;
336;Jan 13, 2022 15:59:05.324594956 CET;192.168.1.102;192.168.1.104;50586;1883;75;[TCP Retransmission] 50586 → 1883 [FIN, PSH, ACK] Seq=55 Ack=5 Win=42336 Len=21;
337;Jan 13, 2022 15:59:05.343358816 CET;192.168.1.104;192.168.1.102;1883;50586;54;1883 → 50586 [FIN, ACK] Seq=5 Ack=77 Win=8192 Len=0;
338;Jan 13, 2022 15:59:05.343393114 CET;192.168.1.102;192.168.1.104;50586;1883;54;50586 → 1883 [ACK] Seq=77 Ack=6 Win=42335 Len=0;
339;Jan 13, 2022 15:59:09.901035226 CET;192.168.1.102;192.168.1.104;50588;1883;74;50588 → 1883 [SYN] Seq=0 Win=42340 Len=0 MSS=1460 SACK_PERM=1 TSval=1798054797 TSecr=0 WS=512;
340;Jan 13, 2022 15:59:09.905186952 CET;192.168.1.104;192.168.1.102;1883;50588;58;1883 → 50588 [SYN, ACK] Seq=0 Ack=1 Win=8192 Len=0 MSS=1460;
341;Jan 13, 2022 15:59:09.905205922 CET;192.168.1.102;192.168.1.104;50588;1883;54;50588 → 1883 [ACK] Seq=1 Ack=1 Win=42340 Len=0;
342;Jan 13, 2022 15:59:09.905441330 CET;192.168.1.102;192.168.1.104;50588;1883;108;Connect Command;
343;Jan 13, 2022 15:59:10.116538628 CET;192.168.1.102;192.168.1.104;50588;1883;108;[TCP Retransmission] 50588 → 1883 [PSH, ACK] Seq=1 Ack=1 Win=42340 Len=54;
344;Jan 13, 2022 15:59:10.119894085 CET;192.168.1.104;192.168.1.102;1883;50588;54;1883 → 50588 [ACK] Seq=1 Ack=55 Win=8192 Len=0;
345;Jan 13, 2022 15:59:10.123458225 CET;192.168.1.104;192.168.1.102;1883;50588;58;Connect Ack;
346;Jan 13, 2022 15:59:10.123472983 CET;192.168.1.102;192.168.1.104;50588;1883;54;50588 → 1883 [ACK] Seq=55 Ack=5 Win=42336 Len=0;
347;Jan 13, 2022 15:59:10.123532243 CET;192.168.1.102;192.168.1.104;50588;1883;73;Publish Message [topic];message027
348;Jan 13, 2022 15:59:10.123555317 CET;192.168.1.102;192.168.1.104;50588;1883;56;Disconnect Req;
349;Jan 13, 2022 15:59:10.540840487 CET;192.168.1.102;192.168.1.104;50588;1883;75;[TCP Retransmission] 50588 → 1883 [FIN, PSH, ACK] Seq=55 Ack=5 Win=42336 Len=21;
350;Jan 13, 2022 15:59:10.556928751 CET;192.168.1.104;192.168.1.102;1883;50588;54;1883 → 50588 [FIN, ACK] Seq=5 Ack=77 Win=8192 Len=0;
351;Jan 13, 2022 15:59:10.556986669 CET;192.168.1.102;192.168.1.104;50588;1883;54;50588 → 1883 [ACK] Seq=77 Ack=6 Win=42335 Len=0;
352;Jan 13, 2022 15:59:15.135956618 CET;192.168.1.102;192.168.1.104;50590;1883;74;50590 → 1883 [SYN] Seq=0 Win=42340 Len=0 MSS=1460 SACK_PERM=1 TSval=1798060032 TSecr=0 WS=512;
353;Jan 13, 2022 15:59:15.148160386 CET;192.168.1.104;192.168.1.102;1883;50590;58;1883 → 50590 [SYN, ACK] Seq=0 Ack=1 Win=8192 Len=0 MSS=1460;
354;Jan 13, 2022 15:59:15.148207155 CET;192.168.1.102;192.168.1.104;50590;1883;54;50590 → 1883 [ACK] Seq=1 Ack=1 Win=42340 Len=0;
355;Jan 13, 2022 15:59:15.148310532 CET;192.168.1.102;192.168.1.104;50590;1883;108;Connect Command;
356;Jan 13, 2022 15:59:15.364598453 CET;192.168.1.102;192.168.1.104;50590;1883;108;[TCP Retransmission] 50590 → 1883 [PSH, ACK] Seq=1 Ack=1 Win=42340 Len=54;
357;Jan 13, 2022 15:59:15.381070136 CET;192.168.1.104;192.168.1.102;1883;50590;54;1883 → 50590 [ACK] Seq=1 Ack=55 Win=8192 Len=0;
358;Jan 13, 2022 15:59:15.389402720 CET;192.168.1.104;192.168.1.102;1883;50590;58;Connect Ack;
359;Jan 13, 2022 15:59:15.389427208 CET;192.168.1.102;192.168.1.104;50590;1883;54;50590 → 1883 [ACK] Seq=55 Ack=5 Win=42336 Len=0;
360;Jan 13, 2022 15:59:15.389538804 CET;192.168.1.102;192.168.1.104;50590;1883;73;Publish Message [topic];message028
361;Jan 13, 2022 15:59:15.389587193 CET;192.168.1.102;192.168.1.104;50590;1883;56;Disconnect Req;
362;Jan 13, 2022 15:59:15.852722726 CET;192.168.1.102;192.168.1.104;50590;1883;75;[TCP Retransmission] 50590 → 1883 [FIN, PSH, ACK] Seq=55 Ack=5 Win=42336 Len=21;
363;Jan 13, 2022 15:59:15.871203304 CET;192.168.1.104;192.168.1.102;1883;50590;54;1883 → 50590 [FIN, ACK] Seq=5 Ack=77 Win=8192 Len=0;
364;Jan 13, 2022 15:59:15.871257250 CET;192.168.1.102;192.168.1.104;50590;1883;54;50590 → 1883 [ACK] Seq=77 Ack=6 Win=42335 Len=0;
365;Jan 13, 2022 15:59:20.397012209 CET;192.168.1.102;192.168.1.104;50592;1883;74;50592 → 1883 [SYN] Seq=0 Win=42340 Len=0 MSS=1460 SACK_PERM=1 TSval=1798065293 TSecr=0 WS=512;
366;Jan 13, 2022 15:59:20.402233988 CET;192.168.1.104;192.168.1.102;1883;50592;58;1883 → 50592 [SYN, ACK] Seq=0 Ack=1 Win=8192 Len=0 MSS=1460;
367;Jan 13, 2022 15:59:20.402268994 CET;192.168.1.102;192.168.1.104;50592;1883;54;50592 → 1883 [ACK] Seq=1 Ack=1 Win=42340 Len=0;
368;Jan 13, 2022 15:59:20.402639385 CET;192.168.1.102;192.168.1.104;50592;1883;108;Connect Command;
369;Jan 13, 2022 15:59:20.613269007 CET;192.168.1.102;192.168.1.104;50592;1883;108;[TCP Retransmission] 50592 → 1883 [PSH, ACK] Seq=1 Ack=1 Win=42340 Len=54;
370;Jan 13, 2022 15:59:20.621091670 CET;192.168.1.104;192.168.1.102;1883;50592;54;1883 → 50592 [ACK] Seq=1 Ack=55 Win=8192 Len=0;
371;Jan 13, 2022 15:59:20.625499148 CET;192.168.1.104;192.168.1.102;1883;50592;58;Connect Ack;
372;Jan 13, 2022 15:59:20.625518323 CET;192.168.1.102;192.168.1.104;50592;1883;54;50592 → 1883 [ACK] Seq=55 Ack=5 Win=42336 Len=0;
373;Jan 13, 2022 15:59:20.625610523 CET;192.168.1.102;192.168.1.104;50592;1883;73;Publish Message [topic];message029
374;Jan 13, 2022 15:59:20.625741851 CET;192.168.1.102;192.168.1.104;50592;1883;56;Disconnect Req;
375;Jan 13, 2022 15:59:21.068582423 CET;192.168.1.102;192.168.1.104;50592;1883;75;[TCP Retransmission] 50592 → 1883 [FIN, PSH, ACK] Seq=55 Ack=5 Win=42336 Len=21;
376;Jan 13, 2022 15:59:21.077670226 CET;192.168.1.104;192.168.1.102;1883;50592;54;1883 → 50592 [FIN, ACK] Seq=5 Ack=77 Win=8192 Len=0;
377;Jan 13, 2022 15:59:21.077701562 CET;192.168.1.102;192.168.1.104;50592;1883;54;50592 → 1883 [ACK] Seq=77 Ack=6 Win=42335 Len=0;
378;Jan 13, 2022 15:59:25.631810901 CET;192.168.1.102;192.168.1.104;50594;1883;74;50594 → 1883 [SYN] Seq=0 Win=42340 Len=0 MSS=1460 SACK_PERM=1 TSval=1798070527 TSecr=0 WS=512;
379;Jan 13, 2022 15:59:25.634666091 CET;192.168.1.104;192.168.1.102;1883;50594;58;1883 → 50594 [SYN, ACK] Seq=0 Ack=1 Win=8192 Len=0 MSS=1460;
380;Jan 13, 2022 15:59:25.634678648 CET;192.168.1.102;192.168.1.104;50594;1883;54;50594 → 1883 [ACK] Seq=1 Ack=1 Win=42340 Len=0;
381;Jan 13, 2022 15:59:25.634841390 CET;192.168.1.102;192.168.1.104;50594;1883;108;Connect Command;
382;Jan 13, 2022 15:59:25.840605736 CET;192.168.1.102;192.168.1.104;50594;1883;108;[TCP Retransmission] 50594 → 1883 [PSH, ACK] Seq=1 Ack=1 Win=42340 Len=54;
383;Jan 13, 2022 15:59:25.849868087 CET;192.168.1.104;192.168.1.102;1883;50594;54;1883 → 50594 [ACK] Seq=1 Ack=55 Win=8192 Len=0;
384;Jan 13, 2022 15:59:25.853086526 CET;192.168.1.104;192.168.1.102;1883;50594;58;Connect Ack;
385;Jan 13, 2022 15:59:25.853104079 CET;192.168.1.102;192.168.1.104;50594;1883;54;50594 → 1883 [ACK] Seq=55 Ack=5 Win=42336 Len=0;
386;Jan 13, 2022 15:59:25.853169676 CET;192.168.1.102;192.168.1.104;50594;1883;73;Publish Message [topic];message030
387;Jan 13, 2022 15:59:25.853198990 CET;192.168.1.102;192.168.1.104;50594;1883;56;Disconnect Req;
388;Jan 13, 2022 15:59:26.284606691 CET;192.168.1.102;192.168.1.104;50594;1883;75;[TCP Retransmission] 50594 → 1883 [FIN, PSH, ACK] Seq=55 Ack=5 Win=42336 Len=21;
389;Jan 13, 2022 15:59:26.294667833 CET;192.168.1.104;192.168.1.102;1883;50594;54;1883 → 50594 [FIN, ACK] Seq=5 Ack=77 Win=8192 Len=0;
390;Jan 13, 2022 15:59:26.294697805 CET;192.168.1.102;192.168.1.104;50594;1883;54;50594 → 1883 [ACK] Seq=77 Ack=6 Win=42335 Len=0;
391;Jan 13, 2022 15:59:30.858336656 CET;192.168.1.102;192.168.1.104;50596;1883;74;50596 → 1883 [SYN] Seq=0 Win=42340 Len=0 MSS=1460 SACK_PERM=1 TSval=1798075754 TSecr=0 WS=512;
392;Jan 13, 2022 15:59:30.862588526 CET;192.168.1.104;192.168.1.102;1883;50596;58;1883 → 50596 [SYN, ACK] Seq=0 Ack=1 Win=8192 Len=0 MSS=1460;
393;Jan 13, 2022 15:59:30.862607129 CET;192.168.1.102;192.168.1.104;50596;1883;54;50596 → 1883 [ACK] Seq=1 Ack=1 Win=42340 Len=0;
394;Jan 13, 2022 15:59:30.862653645 CET;192.168.1.102;192.168.1.104;50596;1883;108;Connect Command;
395;Jan 13, 2022 15:59:31.072536466 CET;192.168.1.102;192.168.1.104;50596;1883;108;[TCP Retransmission] 50596 → 1883 [PSH, ACK] Seq=1 Ack=1 Win=42340 Len=54;
396;Jan 13, 2022 15:59:31.079925818 CET;192.168.1.104;192.168.1.102;1883;50596;54;1883 → 50596 [ACK] Seq=1 Ack=55 Win=8192 Len=0;
397;Jan 13, 2022 15:59:31.084038419 CET;192.168.1.104;192.168.1.102;1883;50596;58;Connect Ack;
398;Jan 13, 2022 15:59:31.084055492 CET;192.168.1.102;192.168.1.104;50596;1883;54;50596 → 1883 [ACK] Seq=55 Ack=5 Win=42336 Len=0;
399;Jan 13, 2022 15:59:31.084138792 CET;192.168.1.102;192.168.1.104;50596;1883;73;Publish Message [topic];message031
400;Jan 13, 2022 15:59:31.084178552 CET;192.168.1.102;192.168.1.104;50596;1883;56;Disconnect Req;
401;Jan 13, 2022 15:59:31.500519548 CET;192.168.1.102;192.168.1.104;50596;1883;75;[TCP Retransmission] 50596 → 1883 [FIN, PSH, ACK] Seq=55 Ack=5 Win=42336 Len=21;
402;Jan 13, 2022 15:59:31.505129759 CET;192.168.1.104;192.168.1.102;1883;50596;54;1883 → 50596 [FIN, ACK] Seq=5 Ack=77 Win=8192 Len=0;
403;Jan 13, 2022 15:59:31.505140640 CET;192.168.1.102;192.168.1.104;50596;1883;54;50596 → 1883 [ACK] Seq=77 Ack=6 Win=42335 Len=0;
404;Jan 13, 2022 15:59:36.089256916 CET;192.168.1.102;192.168.1.104;50598;1883;74;50598 → 1883 [SYN] Seq=0 Win=42340 Len=0 MSS=1460 SACK_PERM=1 TSval=1798080985 TSecr=0 WS=512;
405;Jan 13, 2022 15:59:36.094312517 CET;192.168.1.104;192.168.1.102;1883;50598;58;1883 → 50598 [SYN, ACK] Seq=0 Ack=1 Win=8192 Len=0 MSS=1460;
406;Jan 13, 2022 15:59:36.094334109 CET;192.168.1.102;192.168.1.104;50598;1883;54;50598 → 1883 [ACK] Seq=1 Ack=1 Win=42340 Len=0;
407;Jan 13, 2022 15:59:36.094556662 CET;192.168.1.102;192.168.1.104;50598;1883;108;Connect Command;
408;Jan 13, 2022 15:59:36.304529646 CET;192.168.1.102;192.168.1.104;50598;1883;108;[TCP Retransmission] 50598 → 1883 [PSH, ACK] Seq=1 Ack=1 Win=42340 Len=54;
409;Jan 13, 2022 15:59:36.312346790 CET;192.168.1.104;192.168.1.102;1883;50598;54;1883 → 50598 [ACK] Seq=1 Ack=55 Win=8192 Len=0;
410;Jan 13, 2022 15:59:36.319957492 CET;192.168.1.104;192.168.1.102;1883;50598;58;Connect Ack;
411;Jan 13, 2022 15:59:36.319979425 CET;192.168.1.102;192.168.1.104;50598;1883;54;50598 → 1883 [ACK] Seq=55 Ack=5 Win=42336 Len=0;
412;Jan 13, 2022 15:59:36.320076837 CET;192.168.1.102;192.168.1.104;50598;1883;73;Publish Message [topic];message032
413;Jan 13, 2022 15:59:36.320120049 CET;192.168.1.102;192.168.1.104;50598;1883;56;Disconnect Req;
414;Jan 13, 2022 15:59:36.748620125 CET;192.168.1.102;192.168.1.104;50598;1883;75;[TCP Retransmission] 50598 → 1883 [FIN, PSH, ACK] Seq=55 Ack=5 Win=42336 Len=21;
415;Jan 13, 2022 15:59:36.765969877 CET;192.168.1.104;192.168.1.102;1883;50598;54;1883 → 50598 [FIN, ACK] Seq=5 Ack=77 Win=8192 Len=0;
416;Jan 13, 2022 15:59:36.766013559 CET;192.168.1.102;192.168.1.104;50598;1883;54;50598 → 1883 [ACK] Seq=77 Ack=6 Win=42335 Len=0;
417;Jan 13, 2022 15:59:41.333701354 CET;192.168.1.102;192.168.1.104;50600;1883;74;50600 → 1883 [SYN] Seq=0 Win=42340 Len=0 MSS=1460 SACK_PERM=1 TSval=1798086229 TSecr=0 WS=512;
418;Jan 13, 2022 15:59:41.346212377 CET;192.168.1.104;192.168.1.102;1883;50600;58;1883 → 50600 [SYN, ACK] Seq=0 Ack=1 Win=8192 Len=0 MSS=1460;
419;Jan 13, 2022 15:59:41.346249695 CET;192.168.1.102;192.168.1.104;50600;1883;54;50600 → 1883 [ACK] Seq=1 Ack=1 Win=42340 Len=0;
420;Jan 13, 2022 15:59:41.346342415 CET;192.168.1.102;192.168.1.104;50600;1883;108;Connect Command;
421;Jan 13, 2022 15:59:41.564570119 CET;192.168.1.102;192.168.1.104;50600;1883;108;[TCP Retransmission] 50600 → 1883 [PSH, ACK] Seq=1 Ack=1 Win=42340 Len=54;
422;Jan 13, 2022 15:59:41.588336575 CET;192.168.1.104;192.168.1.102;1883;50600;54;1883 → 50600 [ACK] Seq=1 Ack=55 Win=8192 Len=0;
423;Jan 13, 2022 15:59:41.594108697 CET;192.168.1.104;192.168.1.102;1883;50600;58;Connect Ack;
424;Jan 13, 2022 15:59:41.594124097 CET;192.168.1.102;192.168.1.104;50600;1883;54;50600 → 1883 [ACK] Seq=55 Ack=5 Win=42336 Len=0;
425;Jan 13, 2022 15:59:41.594209584 CET;192.168.1.102;192.168.1.104;50600;1883;73;Publish Message [topic];message033
426;Jan 13, 2022 15:59:41.594268285 CET;192.168.1.102;192.168.1.104;50600;1883;56;Disconnect Req;
427;Jan 13, 2022 15:59:42.028619692 CET;192.168.1.102;192.168.1.104;50600;1883;75;[TCP Retransmission] 50600 → 1883 [FIN, PSH, ACK] Seq=55 Ack=5 Win=42336 Len=21;
428;Jan 13, 2022 15:59:42.036123482 CET;192.168.1.104;192.168.1.102;1883;50600;54;1883 → 50600 [FIN, ACK] Seq=5 Ack=77 Win=8192 Len=0;
429;Jan 13, 2022 15:59:42.036197611 CET;192.168.1.102;192.168.1.104;50600;1883;54;50600 → 1883 [ACK] Seq=77 Ack=6 Win=42335 Len=0;
430;Jan 13, 2022 15:59:46.608952510 CET;192.168.1.102;192.168.1.104;50602;1883;74;50602 → 1883 [SYN] Seq=0 Win=42340 Len=0 MSS=1460 SACK_PERM=1 TSval=1798091505 TSecr=0 WS=512;
431;Jan 13, 2022 15:59:46.622599880 CET;192.168.1.104;192.168.1.102;1883;50602;58;1883 → 50602 [SYN, ACK] Seq=0 Ack=1 Win=8192 Len=0 MSS=1460;
432;Jan 13, 2022 15:59:46.622632283 CET;192.168.1.102;192.168.1.104;50602;1883;54;50602 → 1883 [ACK] Seq=1 Ack=1 Win=42340 Len=0;
433;Jan 13, 2022 15:59:46.622709276 CET;192.168.1.102;192.168.1.104;50602;1883;108;Connect Command;
434;Jan 13, 2022 15:59:46.840526115 CET;192.168.1.102;192.168.1.104;50602;1883;108;[TCP Retransmission] 50602 → 1883 [PSH, ACK] Seq=1 Ack=1 Win=42340 Len=54;
435;Jan 13, 2022 15:59:46.844213593 CET;192.168.1.104;192.168.1.102;1883;50602;54;1883 → 50602 [ACK] Seq=1 Ack=55 Win=8192 Len=0;
436;Jan 13, 2022 15:59:46.848214873 CET;192.168.1.104;192.168.1.102;1883;50602;58;Connect Ack;
437;Jan 13, 2022 15:59:46.848233950 CET;192.168.1.102;192.168.1.104;50602;1883;54;50602 → 1883 [ACK] Seq=55 Ack=5 Win=42336 Len=0;
438;Jan 13, 2022 15:59:46.848308860 CET;192.168.1.102;192.168.1.104;50602;1883;73;Publish Message [topic];message034
439;Jan 13, 2022 15:59:46.848360026 CET;192.168.1.102;192.168.1.104;50602;1883;56;Disconnect Req;
440;Jan 13, 2022 15:59:47.308610680 CET;192.168.1.102;192.168.1.104;50602;1883;75;[TCP Retransmission] 50602 → 1883 [FIN, PSH, ACK] Seq=55 Ack=5 Win=42336 Len=21;
441;Jan 13, 2022 15:59:47.312550780 CET;192.168.1.104;192.168.1.102;1883;50602;54;1883 → 50602 [FIN, ACK] Seq=5 Ack=77 Win=8192 Len=0;
442;Jan 13, 2022 15:59:47.312572894 CET;192.168.1.102;192.168.1.104;50602;1883;54;50602 → 1883 [ACK] Seq=77 Ack=6 Win=42335 Len=0;
443;Jan 13, 2022 15:59:51.861489453 CET;192.168.1.102;192.168.1.104;50604;1883;74;50604 → 1883 [SYN] Seq=0 Win=42340 Len=0 MSS=1460 SACK_PERM=1 TSval=1798096757 TSecr=0 WS=512;
444;Jan 13, 2022 15:59:51.872183542 CET;192.168.1.104;192.168.1.102;1883;50604;58;1883 → 50604 [SYN, ACK] Seq=0 Ack=1 Win=8192 Len=0 MSS=1460;
445;Jan 13, 2022 15:59:51.872238429 CET;192.168.1.102;192.168.1.104;50604;1883;54;50604 → 1883 [ACK] Seq=1 Ack=1 Win=42340 Len=0;
446;Jan 13, 2022 15:59:51.872431634 CET;192.168.1.102;192.168.1.104;50604;1883;108;Connect Command;
447;Jan 13, 2022 15:59:52.084739195 CET;192.168.1.102;192.168.1.104;50604;1883;108;[TCP Retransmission] 50604 → 1883 [PSH, ACK] Seq=1 Ack=1 Win=42340 Len=54;
448;Jan 13, 2022 15:59:52.103638915 CET;192.168.1.104;192.168.1.102;1883;50604;54;1883 → 50604 [ACK] Seq=1 Ack=55 Win=8192 Len=0;
449;Jan 13, 2022 15:59:52.110483795 CET;192.168.1.104;192.168.1.102;1883;50604;58;Connect Ack;
450;Jan 13, 2022 15:59:52.110501799 CET;192.168.1.102;192.168.1.104;50604;1883;54;50604 → 1883 [ACK] Seq=55 Ack=5 Win=42336 Len=0;
451;Jan 13, 2022 15:59:52.110595443 CET;192.168.1.102;192.168.1.104;50604;1883;73;Publish Message [topic];message035
452;Jan 13, 2022 15:59:52.110643264 CET;192.168.1.102;192.168.1.104;50604;1883;56;Disconnect Req;
453;Jan 13, 2022 15:59:52.556980632 CET;192.168.1.102;192.168.1.104;50604;1883;75;[TCP Retransmission] 50604 → 1883 [FIN, PSH, ACK] Seq=55 Ack=5 Win=42336 Len=21;
454;Jan 13, 2022 15:59:52.566760487 CET;192.168.1.104;192.168.1.102;1883;50604;54;1883 → 50604 [FIN, ACK] Seq=5 Ack=77 Win=8192 Len=0;
455;Jan 13, 2022 15:59:52.566786453 CET;192.168.1.102;192.168.1.104;50604;1883;54;50604 → 1883 [ACK] Seq=77 Ack=6 Win=42335 Len=0;
456;Jan 13, 2022 15:59:57.118862202 CET;192.168.1.102;192.168.1.104;50606;1883;74;50606 → 1883 [SYN] Seq=0 Win=42340 Len=0 MSS=1460 SACK_PERM=1 TSval=1798102014 TSecr=0 WS=512;
457;Jan 13, 2022 15:59:57.124334539 CET;192.168.1.104;192.168.1.102;1883;50606;58;1883 → 50606 [SYN, ACK] Seq=0 Ack=1 Win=8192 Len=0 MSS=1460;
458;Jan 13, 2022 15:59:57.124364355 CET;192.168.1.102;192.168.1.104;50606;1883;54;50606 → 1883 [ACK] Seq=1 Ack=1 Win=42340 Len=0;
459;Jan 13, 2022 15:59:57.124605026 CET;192.168.1.102;192.168.1.104;50606;1883;108;Connect Command;
460;Jan 13, 2022 15:59:57.336793917 CET;192.168.1.102;192.168.1.104;50606;1883;108;[TCP Retransmission] 50606 → 1883 [PSH, ACK] Seq=1 Ack=1 Win=42340 Len=54;
461;Jan 13, 2022 15:59:57.342629068 CET;192.168.1.104;192.168.1.102;1883;50606;54;1883 → 50606 [ACK] Seq=1 Ack=55 Win=8192 Len=0;
462;Jan 13, 2022 15:59:57.345882057 CET;192.168.1.104;192.168.1.102;1883;50606;58;Connect Ack;
463;Jan 13, 2022 15:59:57.345899617 CET;192.168.1.102;192.168.1.104;50606;1883;54;50606 → 1883 [ACK] Seq=55 Ack=5 Win=42336 Len=0;
464;Jan 13, 2022 15:59:57.345970779 CET;192.168.1.102;192.168.1.104;50606;1883;73;Publish Message [topic];message036
465;Jan 13, 2022 15:59:57.346002543 CET;192.168.1.102;192.168.1.104;50606;1883;56;Disconnect Req;
466;Jan 13, 2022 15:59:57.772802934 CET;192.168.1.102;192.168.1.104;50606;1883;75;[TCP Retransmission] 50606 → 1883 [FIN, PSH, ACK] Seq=55 Ack=5 Win=42336 Len=21;
467;Jan 13, 2022 15:59:57.781215095 CET;192.168.1.104;192.168.1.102;1883;50606;54;1883 → 50606 [FIN, ACK] Seq=5 Ack=77 Win=8192 Len=0;
468;Jan 13, 2022 15:59:57.781247858 CET;192.168.1.102;192.168.1.104;50606;1883;54;50606 → 1883 [ACK] Seq=77 Ack=6 Win=42335 Len=0;
469;Jan 13, 2022 16:00:02.352967560 CET;192.168.1.102;192.168.1.104;50608;1883;74;50608 → 1883 [SYN] Seq=0 Win=42340 Len=0 MSS=1460 SACK_PERM=1 TSval=1798107249 TSecr=0 WS=512;
470;Jan 13, 2022 16:00:02.356082957 CET;192.168.1.104;192.168.1.102;1883;50608;58;1883 → 50608 [SYN, ACK] Seq=0 Ack=1 Win=8192 Len=0 MSS=1460;
471;Jan 13, 2022 16:00:02.356099204 CET;192.168.1.102;192.168.1.104;50608;1883;54;50608 → 1883 [ACK] Seq=1 Ack=1 Win=42340 Len=0;
472;Jan 13, 2022 16:00:02.356252569 CET;192.168.1.102;192.168.1.104;50608;1883;108;Connect Command;
473;Jan 13, 2022 16:00:02.560597373 CET;192.168.1.102;192.168.1.104;50608;1883;108;[TCP Retransmission] 50608 → 1883 [PSH, ACK] Seq=1 Ack=1 Win=42340 Len=54;
474;Jan 13, 2022 16:00:02.579440026 CET;192.168.1.104;192.168.1.102;1883;50608;54;1883 → 50608 [ACK] Seq=1 Ack=55 Win=8192 Len=0;
475;Jan 13, 2022 16:00:02.586669681 CET;192.168.1.104;192.168.1.102;1883;50608;58;Connect Ack;
476;Jan 13, 2022 16:00:02.586692859 CET;192.168.1.102;192.168.1.104;50608;1883;54;50608 → 1883 [ACK] Seq=55 Ack=5 Win=42336 Len=0;
477;Jan 13, 2022 16:00:02.586795112 CET;192.168.1.102;192.168.1.104;50608;1883;73;Publish Message [topic];message037
478;Jan 13, 2022 16:00:02.586845964 CET;192.168.1.102;192.168.1.104;50608;1883;56;Disconnect Req;
479;Jan 13, 2022 16:00:03.020533225 CET;192.168.1.102;192.168.1.104;50608;1883;75;[TCP Retransmission] 50608 → 1883 [FIN, PSH, ACK] Seq=55 Ack=5 Win=42336 Len=21;
480;Jan 13, 2022 16:00:03.024586190 CET;192.168.1.104;192.168.1.102;1883;50608;54;1883 → 50608 [FIN, ACK] Seq=5 Ack=77 Win=8192 Len=0;
481;Jan 13, 2022 16:00:03.024607203 CET;192.168.1.102;192.168.1.104;50608;1883;54;50608 → 1883 [ACK] Seq=77 Ack=6 Win=42335 Len=0;
482;Jan 13, 2022 16:00:07.592374042 CET;192.168.1.102;192.168.1.104;50610;1883;74;50610 → 1883 [SYN] Seq=0 Win=42340 Len=0 MSS=1460 SACK_PERM=1 TSval=1798112488 TSecr=0 WS=512;
483;Jan 13, 2022 16:00:07.597708669 CET;192.168.1.104;192.168.1.102;1883;50610;58;1883 → 50610 [SYN, ACK] Seq=0 Ack=1 Win=8192 Len=0 MSS=1460;
484;Jan 13, 2022 16:00:07.597727629 CET;192.168.1.102;192.168.1.104;50610;1883;54;50610 → 1883 [ACK] Seq=1 Ack=1 Win=42340 Len=0;
485;Jan 13, 2022 16:00:07.598637115 CET;192.168.1.102;192.168.1.104;50610;1883;108;Connect Command;
486;Jan 13, 2022 16:00:07.808878102 CET;192.168.1.102;192.168.1.104;50610;1883;108;[TCP Retransmission] 50610 → 1883 [PSH, ACK] Seq=1 Ack=1 Win=42340 Len=54;
487;Jan 13, 2022 16:00:07.812263911 CET;192.168.1.104;192.168.1.102;1883;50610;54;1883 → 50610 [ACK] Seq=1 Ack=55 Win=8192 Len=0;
488;Jan 13, 2022 16:00:07.815521907 CET;192.168.1.104;192.168.1.102;1883;50610;58;Connect Ack;
489;Jan 13, 2022 16:00:07.815532011 CET;192.168.1.102;192.168.1.104;50610;1883;54;50610 → 1883 [ACK] Seq=55 Ack=5 Win=42336 Len=0;
490;Jan 13, 2022 16:00:07.815587536 CET;192.168.1.102;192.168.1.104;50610;1883;73;Publish Message [topic];message038
491;Jan 13, 2022 16:00:07.815613140 CET;192.168.1.102;192.168.1.104;50610;1883;56;Disconnect Req;
492;Jan 13, 2022 16:00:08.236530684 CET;192.168.1.102;192.168.1.104;50610;1883;75;[TCP Retransmission] 50610 → 1883 [FIN, PSH, ACK] Seq=55 Ack=5 Win=42336 Len=21;
493;Jan 13, 2022 16:00:08.240563072 CET;192.168.1.104;192.168.1.102;1883;50610;54;1883 → 50610 [FIN, ACK] Seq=5 Ack=77 Win=8192 Len=0;
494;Jan 13, 2022 16:00:08.240574208 CET;192.168.1.102;192.168.1.104;50610;1883;54;50610 → 1883 [ACK] Seq=77 Ack=6 Win=42335 Len=0;
495;Jan 13, 2022 16:00:12.819759825 CET;192.168.1.102;192.168.1.104;50612;1883;74;50612 → 1883 [SYN] Seq=0 Win=42340 Len=0 MSS=1460 SACK_PERM=1 TSval=1798117715 TSecr=0 WS=512;
496;Jan 13, 2022 16:00:12.824347584 CET;192.168.1.104;192.168.1.102;1883;50612;58;1883 → 50612 [SYN, ACK] Seq=0 Ack=1 Win=8192 Len=0 MSS=1460;
497;Jan 13, 2022 16:00:12.824379417 CET;192.168.1.102;192.168.1.104;50612;1883;54;50612 → 1883 [ACK] Seq=1 Ack=1 Win=42340 Len=0;
498;Jan 13, 2022 16:00:12.825488792 CET;192.168.1.102;192.168.1.104;50612;1883;108;Connect Command;
499;Jan 13, 2022 16:00:13.036526301 CET;192.168.1.102;192.168.1.104;50612;1883;108;[TCP Retransmission] 50612 → 1883 [PSH, ACK] Seq=1 Ack=1 Win=42340 Len=54;
500;Jan 13, 2022 16:00:13.041793635 CET;192.168.1.104;192.168.1.102;1883;50612;54;1883 → 50612 [ACK] Seq=1 Ack=55 Win=8192 Len=0;
501;Jan 13, 2022 16:00:13.045973743 CET;192.168.1.104;192.168.1.102;1883;50612;58;Connect Ack;
502;Jan 13, 2022 16:00:13.045995566 CET;192.168.1.102;192.168.1.104;50612;1883;54;50612 → 1883 [ACK] Seq=55 Ack=5 Win=42336 Len=0;
503;Jan 13, 2022 16:00:13.046097164 CET;192.168.1.102;192.168.1.104;50612;1883;73;Publish Message [topic];message039
504;Jan 13, 2022 16:00:13.046239510 CET;192.168.1.102;192.168.1.104;50612;1883;56;Disconnect Req;
505;Jan 13, 2022 16:00:13.484806744 CET;192.168.1.102;192.168.1.104;50612;1883;75;[TCP Retransmission] 50612 → 1883 [FIN, PSH, ACK] Seq=55 Ack=5 Win=42336 Len=21;
506;Jan 13, 2022 16:00:13.511778292 CET;192.168.1.104;192.168.1.102;1883;50612;54;1883 → 50612 [FIN, ACK] Seq=5 Ack=77 Win=8192 Len=0;
507;Jan 13, 2022 16:00:13.511823987 CET;192.168.1.102;192.168.1.104;50612;1883;54;50612 → 1883 [ACK] Seq=77 Ack=6 Win=42335 Len=0;
508;Jan 13, 2022 16:00:18.050516350 CET;192.168.1.102;192.168.1.104;50614;1883;74;50614 → 1883 [SYN] Seq=0 Win=42340 Len=0 MSS=1460 SACK_PERM=1 TSval=1798122946 TSecr=0 WS=512;
509;Jan 13, 2022 16:00:18.053324105 CET;192.168.1.104;192.168.1.102;1883;50614;58;1883 → 50614 [SYN, ACK] Seq=0 Ack=1 Win=8192 Len=0 MSS=1460;
510;Jan 13, 2022 16:00:18.053338349 CET;192.168.1.102;192.168.1.104;50614;1883;54;50614 → 1883 [ACK] Seq=1 Ack=1 Win=42340 Len=0;
511;Jan 13, 2022 16:00:18.054490834 CET;192.168.1.102;192.168.1.104;50614;1883;108;Connect Command;
512;Jan 13, 2022 16:00:18.059914257 CET;192.168.1.104;192.168.1.102;1883;50614;54;1883 → 50614 [ACK] Seq=1 Ack=55 Win=8192 Len=0;
513;Jan 13, 2022 16:00:18.062828303 CET;192.168.1.104;192.168.1.102;1883;50614;58;Connect Ack;
514;Jan 13, 2022 16:00:18.062842780 CET;192.168.1.102;192.168.1.104;50614;1883;54;50614 → 1883 [ACK] Seq=55 Ack=5 Win=42336 Len=0;
515;Jan 13, 2022 16:00:18.062927873 CET;192.168.1.102;192.168.1.104;50614;1883;73;Publish Message [topic];message040
516;Jan 13, 2022 16:00:18.062958709 CET;192.168.1.102;192.168.1.104;50614;1883;56;Disconnect Req;
517;Jan 13, 2022 16:00:18.268687363 CET;192.168.1.102;192.168.1.104;50614;1883;75;[TCP Retransmission] 50614 → 1883 [FIN, PSH, ACK] Seq=55 Ack=5 Win=42336 Len=21;
518;Jan 13, 2022 16:00:18.286690097 CET;192.168.1.104;192.168.1.102;1883;50614;54;1883 → 50614 [FIN, ACK] Seq=5 Ack=77 Win=8192 Len=0;
519;Jan 13, 2022 16:00:18.286729667 CET;192.168.1.102;192.168.1.104;50614;1883;54;50614 → 1883 [ACK] Seq=77 Ack=6 Win=42335 Len=0;
520;Jan 13, 2022 16:00:23.066674920 CET;192.168.1.102;192.168.1.104;50616;1883;74;50616 → 1883 [SYN] Seq=0 Win=42340 Len=0 MSS=1460 SACK_PERM=1 TSval=1798127962 TSecr=0 WS=512;
521;Jan 13, 2022 16:00:23.070918821 CET;192.168.1.104;192.168.1.102;1883;50616;58;1883 → 50616 [SYN, ACK] Seq=0 Ack=1 Win=8192 Len=0 MSS=1460;
522;Jan 13, 2022 16:00:23.070933150 CET;192.168.1.102;192.168.1.104;50616;1883;54;50616 → 1883 [ACK] Seq=1 Ack=1 Win=42340 Len=0;
523;Jan 13, 2022 16:00:23.071090221 CET;192.168.1.102;192.168.1.104;50616;1883;108;Connect Command;
524;Jan 13, 2022 16:00:23.281121241 CET;192.168.1.102;192.168.1.104;50616;1883;108;[TCP Retransmission] 50616 → 1883 [PSH, ACK] Seq=1 Ack=1 Win=42340 Len=54;
525;Jan 13, 2022 16:00:23.286158370 CET;192.168.1.104;192.168.1.102;1883;50616;54;1883 → 50616 [ACK] Seq=1 Ack=55 Win=8192 Len=0;
526;Jan 13, 2022 16:00:23.289233555 CET;192.168.1.104;192.168.1.102;1883;50616;58;Connect Ack;
527;Jan 13, 2022 16:00:23.289245597 CET;192.168.1.102;192.168.1.104;50616;1883;54;50616 → 1883 [ACK] Seq=55 Ack=5 Win=42336 Len=0;
528;Jan 13, 2022 16:00:23.289310177 CET;192.168.1.102;192.168.1.104;50616;1883;73;Publish Message [topic];message041
529;Jan 13, 2022 16:00:23.289340360 CET;192.168.1.102;192.168.1.104;50616;1883;56;Disconnect Req;
530;Jan 13, 2022 16:00:23.724576493 CET;192.168.1.102;192.168.1.104;50616;1883;75;[TCP Retransmission] 50616 → 1883 [FIN, PSH, ACK] Seq=55 Ack=5 Win=42336 Len=21;
531;Jan 13, 2022 16:00:23.733127987 CET;192.168.1.104;192.168.1.102;1883;50616;54;1883 → 50616 [FIN, ACK] Seq=5 Ack=77 Win=8192 Len=0;
532;Jan 13, 2022 16:00:23.733149791 CET;192.168.1.102;192.168.1.104;50616;1883;54;50616 → 1883 [ACK] Seq=77 Ack=6 Win=42335 Len=0;
533;Jan 13, 2022 16:00:28.294057680 CET;192.168.1.102;192.168.1.104;50618;1883;74;50618 → 1883 [SYN] Seq=0 Win=42340 Len=0 MSS=1460 SACK_PERM=1 TSval=1798133190 TSecr=0 WS=512;
534;Jan 13, 2022 16:00:28.296859950 CET;192.168.1.104;192.168.1.102;1883;50618;58;1883 → 50618 [SYN, ACK] Seq=0 Ack=1 Win=8192 Len=0 MSS=1460;
535;Jan 13, 2022 16:00:28.296872588 CET;192.168.1.102;192.168.1.104;50618;1883;54;50618 → 1883 [ACK] Seq=1 Ack=1 Win=42340 Len=0;
536;Jan 13, 2022 16:00:28.298315054 CET;192.168.1.102;192.168.1.104;50618;1883;108;Connect Command;
537;Jan 13, 2022 16:00:28.303386845 CET;192.168.1.104;192.168.1.102;1883;50618;54;1883 → 50618 [ACK] Seq=1 Ack=55 Win=8192 Len=0;
538;Jan 13, 2022 16:00:28.306226903 CET;192.168.1.104;192.168.1.102;1883;50618;58;Connect Ack;
539;Jan 13, 2022 16:00:28.306237735 CET;192.168.1.102;192.168.1.104;50618;1883;54;50618 → 1883 [ACK] Seq=55 Ack=5 Win=42336 Len=0;
540;Jan 13, 2022 16:00:28.306297293 CET;192.168.1.102;192.168.1.104;50618;1883;73;Publish Message [topic];message042
541;Jan 13, 2022 16:00:28.306324675 CET;192.168.1.102;192.168.1.104;50618;1883;56;Disconnect Req;
542;Jan 13, 2022 16:00:28.512834314 CET;192.168.1.102;192.168.1.104;50618;1883;75;[TCP Retransmission] 50618 → 1883 [FIN, PSH, ACK] Seq=55 Ack=5 Win=42336 Len=21;
543;Jan 13, 2022 16:00:28.516426043 CET;192.168.1.104;192.168.1.102;1883;50618;54;1883 → 50618 [FIN, ACK] Seq=5 Ack=77 Win=8192 Len=0;
544;Jan 13, 2022 16:00:28.516440715 CET;192.168.1.102;192.168.1.104;50618;1883;54;50618 → 1883 [ACK] Seq=77 Ack=6 Win=42335 Len=0;
545;Jan 13, 2022 16:00:33.319066274 CET;192.168.1.102;192.168.1.104;50620;1883;74;50620 → 1883 [SYN] Seq=0 Win=42340 Len=0 MSS=1460 SACK_PERM=1 TSval=1798138215 TSecr=0 WS=512;
546;Jan 13, 2022 16:00:33.328906682 CET;192.168.1.104;192.168.1.102;1883;50620;58;1883 → 50620 [SYN, ACK] Seq=0 Ack=1 Win=8192 Len=0 MSS=1460;
547;Jan 13, 2022 16:00:33.328942290 CET;192.168.1.102;192.168.1.104;50620;1883;54;50620 → 1883 [ACK] Seq=1 Ack=1 Win=42340 Len=0;
548;Jan 13, 2022 16:00:33.329024801 CET;192.168.1.102;192.168.1.104;50620;1883;108;Connect Command;
549;Jan 13, 2022 16:00:33.544524854 CET;192.168.1.102;192.168.1.104;50620;1883;108;[TCP Retransmission] 50620 → 1883 [PSH, ACK] Seq=1 Ack=1 Win=42340 Len=54;
550;Jan 13, 2022 16:00:33.551512479 CET;192.168.1.104;192.168.1.102;1883;50620;54;1883 → 50620 [ACK] Seq=1 Ack=55 Win=8192 Len=0;
551;Jan 13, 2022 16:00:33.555184272 CET;192.168.1.104;192.168.1.102;1883;50620;58;Connect Ack;
552;Jan 13, 2022 16:00:33.555199043 CET;192.168.1.102;192.168.1.104;50620;1883;54;50620 → 1883 [ACK] Seq=55 Ack=5 Win=42336 Len=0;
553;Jan 13, 2022 16:00:33.555279727 CET;192.168.1.102;192.168.1.104;50620;1883;73;Publish Message [topic];message043
554;Jan 13, 2022 16:00:33.555318693 CET;192.168.1.102;192.168.1.104;50620;1883;56;Disconnect Req;
555;Jan 13, 2022 16:00:33.996572332 CET;192.168.1.102;192.168.1.104;50620;1883;75;[TCP Retransmission] 50620 → 1883 [FIN, PSH, ACK] Seq=55 Ack=5 Win=42336 Len=21;
556;Jan 13, 2022 16:00:34.024007021 CET;192.168.1.104;192.168.1.102;1883;50620;54;1883 → 50620 [FIN, ACK] Seq=5 Ack=77 Win=8192 Len=0;
557;Jan 13, 2022 16:00:34.024036694 CET;192.168.1.102;192.168.1.104;50620;1883;54;50620 → 1883 [ACK] Seq=77 Ack=6 Win=42335 Len=0;
558;Jan 13, 2022 16:00:38.568308520 CET;192.168.1.102;192.168.1.104;50622;1883;74;50622 → 1883 [SYN] Seq=0 Win=42340 Len=0 MSS=1460 SACK_PERM=1 TSval=1798143464 TSecr=0 WS=512;
559;Jan 13, 2022 16:00:38.579219126 CET;192.168.1.104;192.168.1.102;1883;50622;58;1883 → 50622 [SYN, ACK] Seq=0 Ack=1 Win=8192 Len=0 MSS=1460;
560;Jan 13, 2022 16:00:38.579269254 CET;192.168.1.102;192.168.1.104;50622;1883;54;50622 → 1883 [ACK] Seq=1 Ack=1 Win=42340 Len=0;
561;Jan 13, 2022 16:00:38.579428405 CET;192.168.1.102;192.168.1.104;50622;1883;108;Connect Command;
562;Jan 13, 2022 16:00:38.792543435 CET;192.168.1.102;192.168.1.104;50622;1883;108;[TCP Retransmission] 50622 → 1883 [PSH, ACK] Seq=1 Ack=1 Win=42340 Len=54;
563;Jan 13, 2022 16:00:38.800326652 CET;192.168.1.104;192.168.1.102;1883;50622;54;1883 → 50622 [ACK] Seq=1 Ack=55 Win=8192 Len=0;
564;Jan 13, 2022 16:00:38.804908995 CET;192.168.1.104;192.168.1.102;1883;50622;58;Connect Ack;
565;Jan 13, 2022 16:00:38.804949250 CET;192.168.1.102;192.168.1.104;50622;1883;54;50622 → 1883 [ACK] Seq=55 Ack=5 Win=42336 Len=0;
566;Jan 13, 2022 16:00:38.805046505 CET;192.168.1.102;192.168.1.104;50622;1883;73;Publish Message [topic];message044
567;Jan 13, 2022 16:00:38.805093453 CET;192.168.1.102;192.168.1.104;50622;1883;56;Disconnect Req;
568;Jan 13, 2022 16:00:39.244614232 CET;192.168.1.102;192.168.1.104;50622;1883;75;[TCP Retransmission] 50622 → 1883 [FIN, PSH, ACK] Seq=55 Ack=5 Win=42336 Len=21;
569;Jan 13, 2022 16:00:39.266816132 CET;192.168.1.104;192.168.1.102;1883;50622;54;1883 → 50622 [FIN, ACK] Seq=5 Ack=77 Win=8192 Len=0;
570;Jan 13, 2022 16:00:39.266845144 CET;192.168.1.102;192.168.1.104;50622;1883;54;50622 → 1883 [ACK] Seq=77 Ack=6 Win=42335 Len=0;
571;Jan 13, 2022 16:00:43.811207211 CET;192.168.1.102;192.168.1.104;50624;1883;74;50624 → 1883 [SYN] Seq=0 Win=42340 Len=0 MSS=1460 SACK_PERM=1 TSval=1798148707 TSecr=0 WS=512;
572;Jan 13, 2022 16:00:43.815814946 CET;192.168.1.104;192.168.1.102;1883;50624;58;1883 → 50624 [SYN, ACK] Seq=0 Ack=1 Win=8192 Len=0 MSS=1460;
573;Jan 13, 2022 16:00:43.815836945 CET;192.168.1.102;192.168.1.104;50624;1883;54;50624 → 1883 [ACK] Seq=1 Ack=1 Win=42340 Len=0;
574;Jan 13, 2022 16:00:43.816096621 CET;192.168.1.102;192.168.1.104;50624;1883;108;Connect Command;
575;Jan 13, 2022 16:00:44.033026860 CET;192.168.1.102;192.168.1.104;50624;1883;108;[TCP Retransmission] 50624 → 1883 [PSH, ACK] Seq=1 Ack=1 Win=42340 Len=54;
576;Jan 13, 2022 16:00:44.043036667 CET;192.168.1.104;192.168.1.102;1883;50624;54;1883 → 50624 [ACK] Seq=1 Ack=55 Win=8192 Len=0;
577;Jan 13, 2022 16:00:44.045877669 CET;192.168.1.104;192.168.1.102;1883;50624;58;Connect Ack;
578;Jan 13, 2022 16:00:44.045891653 CET;192.168.1.102;192.168.1.104;50624;1883;54;50624 → 1883 [ACK] Seq=55 Ack=5 Win=42336 Len=0;
579;Jan 13, 2022 16:00:44.045955062 CET;192.168.1.102;192.168.1.104;50624;1883;73;Publish Message [topic];message045
580;Jan 13, 2022 16:00:44.045984722 CET;192.168.1.102;192.168.1.104;50624;1883;56;Disconnect Req;
581;Jan 13, 2022 16:00:44.492522816 CET;192.168.1.102;192.168.1.104;50624;1883;75;[TCP Retransmission] 50624 → 1883 [FIN, PSH, ACK] Seq=55 Ack=5 Win=42336 Len=21;
582;Jan 13, 2022 16:00:44.495773082 CET;192.168.1.104;192.168.1.102;1883;50624;54;1883 → 50624 [FIN, ACK] Seq=5 Ack=77 Win=8192 Len=0;
583;Jan 13, 2022 16:00:44.495788192 CET;192.168.1.102;192.168.1.104;50624;1883;54;50624 → 1883 [ACK] Seq=77 Ack=6 Win=42335 Len=0;
584;Jan 13, 2022 16:00:49.049736692 CET;192.168.1.102;192.168.1.104;50626;1883;74;50626 → 1883 [SYN] Seq=0 Win=42340 Len=0 MSS=1460 SACK_PERM=1 TSval=1798153945 TSecr=0 WS=512;
585;Jan 13, 2022 16:00:49.052364361 CET;192.168.1.104;192.168.1.102;1883;50626;58;1883 → 50626 [SYN, ACK] Seq=0 Ack=1 Win=8192 Len=0 MSS=1460;
586;Jan 13, 2022 16:00:49.052378042 CET;192.168.1.102;192.168.1.104;50626;1883;54;50626 → 1883 [ACK] Seq=1 Ack=1 Win=42340 Len=0;
587;Jan 13, 2022 16:00:49.053533214 CET;192.168.1.102;192.168.1.104;50626;1883;108;Connect Command;
588;Jan 13, 2022 16:00:49.059420205 CET;192.168.1.104;192.168.1.102;1883;50626;54;1883 → 50626 [ACK] Seq=1 Ack=55 Win=8192 Len=0;
589;Jan 13, 2022 16:00:49.062370646 CET;192.168.1.104;192.168.1.102;1883;50626;58;Connect Ack;
590;Jan 13, 2022 16:00:49.062394559 CET;192.168.1.102;192.168.1.104;50626;1883;54;50626 → 1883 [ACK] Seq=55 Ack=5 Win=42336 Len=0;
591;Jan 13, 2022 16:00:49.062478200 CET;192.168.1.102;192.168.1.104;50626;1883;73;Publish Message [topic];message046
592;Jan 13, 2022 16:00:49.062539326 CET;192.168.1.102;192.168.1.104;50626;1883;56;Disconnect Req;
593;Jan 13, 2022 16:00:49.268551104 CET;192.168.1.102;192.168.1.104;50626;1883;75;[TCP Retransmission] 50626 → 1883 [FIN, PSH, ACK] Seq=55 Ack=5 Win=42336 Len=21;
594;Jan 13, 2022 16:00:49.274967875 CET;192.168.1.104;192.168.1.102;1883;50626;54;1883 → 50626 [FIN, ACK] Seq=5 Ack=77 Win=8192 Len=0;
595;Jan 13, 2022 16:00:49.274989122 CET;192.168.1.102;192.168.1.104;50626;1883;54;50626 → 1883 [ACK] Seq=77 Ack=6 Win=42335 Len=0;
596;Jan 13, 2022 16:00:54.067010233 CET;192.168.1.102;192.168.1.104;50628;1883;74;50628 → 1883 [SYN] Seq=0 Win=42340 Len=0 MSS=1460 SACK_PERM=1 TSval=1798158963 TSecr=0 WS=512;
597;Jan 13, 2022 16:00:54.070243167 CET;192.168.1.104;192.168.1.102;1883;50628;58;1883 → 50628 [SYN, ACK] Seq=0 Ack=1 Win=8192 Len=0 MSS=1460;
598;Jan 13, 2022 16:00:54.070259576 CET;192.168.1.102;192.168.1.104;50628;1883;54;50628 → 1883 [ACK] Seq=1 Ack=1 Win=42340 Len=0;
599;Jan 13, 2022 16:00:54.072047988 CET;192.168.1.102;192.168.1.104;50628;1883;108;Connect Command;
600;Jan 13, 2022 16:00:54.078586380 CET;192.168.1.104;192.168.1.102;1883;50628;54;1883 → 50628 [ACK] Seq=1 Ack=55 Win=8192 Len=0;
601;Jan 13, 2022 16:00:54.081218660 CET;192.168.1.104;192.168.1.102;1883;50628;58;Connect Ack;
602;Jan 13, 2022 16:00:54.081228112 CET;192.168.1.102;192.168.1.104;50628;1883;54;50628 → 1883 [ACK] Seq=55 Ack=5 Win=42336 Len=0;
603;Jan 13, 2022 16:00:54.081293587 CET;192.168.1.102;192.168.1.104;50628;1883;73;Publish Message [topic];message047
604;Jan 13, 2022 16:00:54.081325016 CET;192.168.1.102;192.168.1.104;50628;1883;56;Disconnect Req;
605;Jan 13, 2022 16:00:54.288605969 CET;192.168.1.102;192.168.1.104;50628;1883;75;[TCP Retransmission] 50628 → 1883 [FIN, PSH, ACK] Seq=55 Ack=5 Win=42336 Len=21;
606;Jan 13, 2022 16:00:54.316814676 CET;192.168.1.104;192.168.1.102;1883;50628;54;1883 → 50628 [FIN, ACK] Seq=5 Ack=77 Win=8192 Len=0;
607;Jan 13, 2022 16:00:54.316836538 CET;192.168.1.102;192.168.1.104;50628;1883;54;50628 → 1883 [ACK] Seq=77 Ack=6 Win=42335 Len=0;
608;Jan 13, 2022 16:00:59.086137228 CET;192.168.1.102;192.168.1.104;50630;1883;74;50630 → 1883 [SYN] Seq=0 Win=42340 Len=0 MSS=1460 SACK_PERM=1 TSval=1798163982 TSecr=0 WS=512;
609;Jan 13, 2022 16:00:59.089456014 CET;192.168.1.104;192.168.1.102;1883;50630;58;1883 → 50630 [SYN, ACK] Seq=0 Ack=1 Win=8192 Len=0 MSS=1460;
610;Jan 13, 2022 16:00:59.089471464 CET;192.168.1.102;192.168.1.104;50630;1883;54;50630 → 1883 [ACK] Seq=1 Ack=1 Win=42340 Len=0;
611;Jan 13, 2022 16:00:59.091292753 CET;192.168.1.102;192.168.1.104;50630;1883;108;Connect Command;
612;Jan 13, 2022 16:00:59.099306481 CET;192.168.1.104;192.168.1.102;1883;50630;54;1883 → 50630 [ACK] Seq=1 Ack=55 Win=8192 Len=0;
613;Jan 13, 2022 16:00:59.102705633 CET;192.168.1.104;192.168.1.102;1883;50630;58;Connect Ack;
614;Jan 13, 2022 16:00:59.102718605 CET;192.168.1.102;192.168.1.104;50630;1883;54;50630 → 1883 [ACK] Seq=55 Ack=5 Win=42336 Len=0;
615;Jan 13, 2022 16:00:59.102777776 CET;192.168.1.102;192.168.1.104;50630;1883;73;Publish Message [topic];message048
616;Jan 13, 2022 16:00:59.102806260 CET;192.168.1.102;192.168.1.104;50630;1883;56;Disconnect Req;
617;Jan 13, 2022 16:00:59.308640775 CET;192.168.1.102;192.168.1.104;50630;1883;75;[TCP Retransmission] 50630 → 1883 [FIN, PSH, ACK] Seq=55 Ack=5 Win=42336 Len=21;
618;Jan 13, 2022 16:00:59.326978444 CET;192.168.1.104;192.168.1.102;1883;50630;54;1883 → 50630 [FIN, ACK] Seq=5 Ack=77 Win=8192 Len=0;
619;Jan 13, 2022 16:00:59.327018125 CET;192.168.1.102;192.168.1.104;50630;1883;54;50630 → 1883 [ACK] Seq=77 Ack=6 Win=42335 Len=0;
620;Jan 13, 2022 16:01:04.111460079 CET;192.168.1.102;192.168.1.104;50632;1883;74;50632 → 1883 [SYN] Seq=0 Win=42340 Len=0 MSS=1460 SACK_PERM=1 TSval=1798169007 TSecr=0 WS=512;
621;Jan 13, 2022 16:01:04.123313221 CET;192.168.1.104;192.168.1.102;1883;50632;58;1883 → 50632 [SYN, ACK] Seq=0 Ack=1 Win=8192 Len=0 MSS=1460;
622;Jan 13, 2022 16:01:04.123359035 CET;192.168.1.102;192.168.1.104;50632;1883;54;50632 → 1883 [ACK] Seq=1 Ack=1 Win=42340 Len=0;
623;Jan 13, 2022 16:01:04.123505205 CET;192.168.1.102;192.168.1.104;50632;1883;108;Connect Command;
624;Jan 13, 2022 16:01:04.336688637 CET;192.168.1.102;192.168.1.104;50632;1883;108;[TCP Retransmission] 50632 → 1883 [PSH, ACK] Seq=1 Ack=1 Win=42340 Len=54;
625;Jan 13, 2022 16:01:04.340509635 CET;192.168.1.104;192.168.1.102;1883;50632;54;1883 → 50632 [ACK] Seq=1 Ack=55 Win=8192 Len=0;
626;Jan 13, 2022 16:01:04.344283145 CET;192.168.1.104;192.168.1.102;1883;50632;58;Connect Ack;
627;Jan 13, 2022 16:01:04.344300824 CET;192.168.1.102;192.168.1.104;50632;1883;54;50632 → 1883 [ACK] Seq=55 Ack=5 Win=42336 Len=0;
628;Jan 13, 2022 16:01:04.344379057 CET;192.168.1.102;192.168.1.104;50632;1883;73;Publish Message [topic];message049
629;Jan 13, 2022 16:01:04.344411487 CET;192.168.1.102;192.168.1.104;50632;1883;56;Disconnect Req;
630;Jan 13, 2022 16:01:04.780528692 CET;192.168.1.102;192.168.1.104;50632;1883;75;[TCP Retransmission] 50632 → 1883 [FIN, PSH, ACK] Seq=55 Ack=5 Win=42336 Len=21;
631;Jan 13, 2022 16:01:04.785290494 CET;192.168.1.104;192.168.1.102;1883;50632;54;1883 → 50632 [FIN, ACK] Seq=5 Ack=77 Win=8192 Len=0;
632;Jan 13, 2022 16:01:04.785313026 CET;192.168.1.102;192.168.1.104;50632;1883;54;50632 → 1883 [ACK] Seq=77 Ack=6 Win=42335 Len=0;
1;Jan 13, 2022 15:56:49.548530048 CET;192.168.1.103;192.168.1.104;46896;1883;66;Subscribe Request (id=1) [topic];
2;Jan 13, 2022 15:56:59.609953927 CET;192.168.1.104;192.168.1.103;1883;46918;73;Publish Message [topic];message002
3;Jan 13, 2022 15:56:59.609990732 CET;192.168.1.103;192.168.1.104;46918;1883;54;46918 → 1883 [ACK] Seq=1 Ack=20 Win=42312 Len=0;
4;Jan 13, 2022 15:57:00.051309862 CET;192.168.1.104;192.168.1.103;1883;46918;73;Publish Message [topic];message001
5;Jan 13, 2022 15:57:00.051323341 CET;192.168.1.103;192.168.1.104;46918;1883;54;46918 → 1883 [ACK] Seq=1 Ack=39 Win=42293 Len=0;
6;Jan 13, 2022 15:57:04.883067535 CET;192.168.1.104;192.168.1.103;1883;46918;73;Publish Message [topic];message003
7;Jan 13, 2022 15:57:04.883080212 CET;192.168.1.103;192.168.1.104;46918;1883;54;46918 → 1883 [ACK] Seq=1 Ack=58 Win=42274 Len=0;
8;Jan 13, 2022 15:57:10.133523656 CET;192.168.1.104;192.168.1.103;1883;46918;73;Publish Message [topic];message004
9;Jan 13, 2022 15:57:10.133545197 CET;192.168.1.103;192.168.1.104;46918;1883;54;46918 → 1883 [ACK] Seq=1 Ack=77 Win=42255 Len=0;
10;Jan 13, 2022 15:57:14.636629418 CET;192.168.1.103;192.168.1.104;46896;1883;66;[TCP Retransmission] 46896 → 1883 [FIN, PSH, ACK] Seq=1 Ack=1 Win=42336 Len=12;
11;Jan 13, 2022 15:57:15.417040843 CET;192.168.1.104;192.168.1.103;1883;46918;73;Publish Message [topic];message005
12;Jan 13, 2022 15:57:15.417060284 CET;192.168.1.103;192.168.1.104;46918;1883;54;46918 → 1883 [ACK] Seq=1 Ack=96 Win=42236 Len=0;
13;Jan 13, 2022 15:57:20.646526237 CET;192.168.1.104;192.168.1.103;1883;46918;73;Publish Message [topic];message006
14;Jan 13, 2022 15:57:20.646545641 CET;192.168.1.103;192.168.1.104;46918;1883;54;46918 → 1883 [ACK] Seq=1 Ack=115 Win=42217 Len=0;
15;Jan 13, 2022 15:57:25.912215735 CET;192.168.1.104;192.168.1.103;1883;46918;73;Publish Message [topic];message007
16;Jan 13, 2022 15:57:25.912237915 CET;192.168.1.103;192.168.1.104;46918;1883;54;46918 → 1883 [ACK] Seq=1 Ack=134 Win=42217 Len=0;
17;Jan 13, 2022 15:57:31.143049427 CET;192.168.1.104;192.168.1.103;1883;46918;73;Publish Message [topic];message008
18;Jan 13, 2022 15:57:31.143072964 CET;192.168.1.103;192.168.1.104;46918;1883;54;46918 → 1883 [ACK] Seq=1 Ack=153 Win=42217 Len=0;
19;Jan 13, 2022 15:57:36.376195434 CET;192.168.1.104;192.168.1.103;1883;46918;73;Publish Message [topic];message009
20;Jan 13, 2022 15:57:36.376225583 CET;192.168.1.103;192.168.1.104;46918;1883;54;46918 → 1883 [ACK] Seq=1 Ack=172 Win=42217 Len=0;
21;Jan 13, 2022 15:57:40.380711488 CET;192.168.1.103;192.168.1.104;46918;1883;56;Ping Request;
22;Jan 13, 2022 15:57:40.388519080 CET;192.168.1.104;192.168.1.103;1883;46918;54;1883 → 46918 [ACK] Seq=172 Ack=3 Win=8192 Len=0;
23;Jan 13, 2022 15:57:40.391028774 CET;192.168.1.104;192.168.1.103;1883;46918;56;Ping Response;
24;Jan 13, 2022 15:57:40.391037804 CET;192.168.1.103;192.168.1.104;46918;1883;54;46918 → 1883 [ACK] Seq=3 Ack=174 Win=42217 Len=0;
25;Jan 13, 2022 15:57:41.626815137 CET;192.168.1.104;192.168.1.103;1883;46918;73;Publish Message [topic];message010
26;Jan 13, 2022 15:57:41.626834751 CET;192.168.1.103;192.168.1.104;46918;1883;54;46918 → 1883 [ACK] Seq=3 Ack=193 Win=42217 Len=0;
27;Jan 13, 2022 15:57:46.853588599 CET;192.168.1.104;192.168.1.103;1883;46918;73;Publish Message [topic];message011
28;Jan 13, 2022 15:57:46.853610593 CET;192.168.1.103;192.168.1.104;46918;1883;54;46918 → 1883 [ACK] Seq=3 Ack=212 Win=42217 Len=0;
29;Jan 13, 2022 15:57:52.119428413 CET;192.168.1.104;192.168.1.103;1883;46918;73;Publish Message [topic];message012
30;Jan 13, 2022 15:57:52.119437751 CET;192.168.1.103;192.168.1.104;46918;1883;54;46918 → 1883 [ACK] Seq=3 Ack=231 Win=42217 Len=0;
31;Jan 13, 2022 15:57:56.887490778 CET;192.168.1.104;192.168.1.103;1883;46918;73;Publish Message [topic];message013
32;Jan 13, 2022 15:57:56.887500269 CET;192.168.1.103;192.168.1.104;46918;1883;54;46918 → 1883 [ACK] Seq=3 Ack=250 Win=42217 Len=0;
33;Jan 13, 2022 15:58:02.408865883 CET;192.168.1.104;192.168.1.103;1883;46918;73;Publish Message [topic];message014
34;Jan 13, 2022 15:58:02.408889563 CET;192.168.1.103;192.168.1.104;46918;1883;54;46918 → 1883 [ACK] Seq=3 Ack=269 Win=42217 Len=0;
35;Jan 13, 2022 15:58:03.788646101 CET;192.168.1.103;192.168.1.104;46896;1883;66;[TCP Retransmission] 46896 → 1883 [FIN, PSH, ACK] Seq=1 Ack=1 Win=42336 Len=12;
36;Jan 13, 2022 15:58:07.641014860 CET;192.168.1.104;192.168.1.103;1883;46918;73;Publish Message [topic];message015
37;Jan 13, 2022 15:58:07.641031263 CET;192.168.1.103;192.168.1.104;46918;1883;54;46918 → 1883 [ACK] Seq=3 Ack=288 Win=42217 Len=0;
38;Jan 13, 2022 15:58:12.874268082 CET;192.168.1.104;192.168.1.103;1883;46918;73;Publish Message [topic];message016
39;Jan 13, 2022 15:58:12.874291367 CET;192.168.1.103;192.168.1.104;46918;1883;54;46918 → 1883 [ACK] Seq=3 Ack=307 Win=42217 Len=0;
40;Jan 13, 2022 15:58:18.099436951 CET;192.168.1.104;192.168.1.103;1883;46918;73;Publish Message [topic];message017
41;Jan 13, 2022 15:58:18.099450532 CET;192.168.1.103;192.168.1.104;46918;1883;54;46918 → 1883 [ACK] Seq=3 Ack=326 Win=42217 Len=0;
42;Jan 13, 2022 15:58:23.328041032 CET;192.168.1.104;192.168.1.103;1883;46918;73;Publish Message [topic];message018
43;Jan 13, 2022 15:58:23.328060940 CET;192.168.1.103;192.168.1.104;46918;1883;54;46918 → 1883 [ACK] Seq=3 Ack=345 Win=42217 Len=0;
44;Jan 13, 2022 15:58:28.574916682 CET;192.168.1.104;192.168.1.103;1883;46918;73;Publish Message [topic];message019
45;Jan 13, 2022 15:58:28.574933729 CET;192.168.1.103;192.168.1.104;46918;1883;54;46918 → 1883 [ACK] Seq=3 Ack=364 Win=42217 Len=0;
46;Jan 13, 2022 15:58:33.816941044 CET;192.168.1.104;192.168.1.103;1883;46918;73;Publish Message [topic];message020
47;Jan 13, 2022 15:58:33.816961312 CET;192.168.1.103;192.168.1.104;46918;1883;54;46918 → 1883 [ACK] Seq=3 Ack=383 Win=42217 Len=0;
48;Jan 13, 2022 15:58:39.027782903 CET;192.168.1.104;192.168.1.103;1883;46918;73;Publish Message [topic];message021
49;Jan 13, 2022 15:58:39.027792016 CET;192.168.1.103;192.168.1.104;46918;1883;54;46918 → 1883 [ACK] Seq=3 Ack=402 Win=42217 Len=0;
50;Jan 13, 2022 15:58:41.028596822 CET;192.168.1.103;192.168.1.104;46918;1883;56;Ping Request;
51;Jan 13, 2022 15:58:41.041511032 CET;192.168.1.104;192.168.1.103;1883;46918;54;1883 → 46918 [ACK] Seq=402 Ack=5 Win=8192 Len=0;
52;Jan 13, 2022 15:58:41.044211339 CET;192.168.1.104;192.168.1.103;1883;46918;56;Ping Response;
53;Jan 13, 2022 15:58:41.044219253 CET;192.168.1.103;192.168.1.104;46918;1883;54;46918 → 1883 [ACK] Seq=5 Ack=404 Win=42217 Len=0;
54;Jan 13, 2022 15:58:44.276833495 CET;192.168.1.104;192.168.1.103;1883;46918;73;Publish Message [topic];message022
55;Jan 13, 2022 15:58:44.276859171 CET;192.168.1.103;192.168.1.104;46918;1883;54;46918 → 1883 [ACK] Seq=5 Ack=423 Win=42217 Len=0;
56;Jan 13, 2022 15:58:49.523034178 CET;192.168.1.104;192.168.1.103;1883;46918;73;Publish Message [topic];message023
57;Jan 13, 2022 15:58:49.523044259 CET;192.168.1.103;192.168.1.104;46918;1883;54;46918 → 1883 [ACK] Seq=5 Ack=442 Win=42217 Len=0;
58;Jan 13, 2022 15:58:54.875887241 CET;192.168.1.104;192.168.1.103;1883;46918;73;Publish Message [topic];message024
59;Jan 13, 2022 15:58:54.875905930 CET;192.168.1.103;192.168.1.104;46918;1883;54;46918 → 1883 [ACK] Seq=5 Ack=461 Win=42217 Len=0;
60;Jan 13, 2022 15:59:00.089974205 CET;192.168.1.104;192.168.1.103;1883;46918;73;Publish Message [topic];message025
61;Jan 13, 2022 15:59:00.089994992 CET;192.168.1.103;192.168.1.104;46918;1883;54;46918 → 1883 [ACK] Seq=5 Ack=480 Win=42217 Len=0;
62;Jan 13, 2022 15:59:05.349588503 CET;192.168.1.104;192.168.1.103;1883;46918;73;Publish Message [topic];message026
63;Jan 13, 2022 15:59:05.349602728 CET;192.168.1.103;192.168.1.104;46918;1883;54;46918 → 1883 [ACK] Seq=5 Ack=499 Win=42217 Len=0;
64;Jan 13, 2022 15:59:10.565304275 CET;192.168.1.104;192.168.1.103;1883;46918;73;Publish Message [topic];message027
65;Jan 13, 2022 15:59:10.565328419 CET;192.168.1.103;192.168.1.104;46918;1883;54;46918 → 1883 [ACK] Seq=5 Ack=518 Win=42217 Len=0;
66;Jan 13, 2022 15:59:15.882431050 CET;192.168.1.104;192.168.1.103;1883;46918;73;Publish Message [topic];message028
67;Jan 13, 2022 15:59:15.882455827 CET;192.168.1.103;192.168.1.104;46918;1883;54;46918 → 1883 [ACK] Seq=5 Ack=537 Win=42217 Len=0;
68;Jan 13, 2022 15:59:21.086625740 CET;192.168.1.104;192.168.1.103;1883;46918;73;Publish Message [topic];message029
69;Jan 13, 2022 15:59:21.086652507 CET;192.168.1.103;192.168.1.104;46918;1883;54;46918 → 1883 [ACK] Seq=5 Ack=556 Win=42217 Len=0;
70;Jan 13, 2022 15:59:26.302095382 CET;192.168.1.104;192.168.1.103;1883;46918;73;Publish Message [topic];message030
71;Jan 13, 2022 15:59:26.302106551 CET;192.168.1.103;192.168.1.104;46918;1883;54;46918 → 1883 [ACK] Seq=5 Ack=575 Win=42217 Len=0;
72;Jan 13, 2022 15:59:31.508107605 CET;192.168.1.104;192.168.1.103;1883;46918;73;Publish Message [topic];message031
73;Jan 13, 2022 15:59:31.508115675 CET;192.168.1.103;192.168.1.104;46918;1883;54;46918 → 1883 [ACK] Seq=5 Ack=594 Win=42217 Len=0;
74;Jan 13, 2022 15:59:36.774768074 CET;192.168.1.104;192.168.1.103;1883;46918;73;Publish Message [topic];message032
75;Jan 13, 2022 15:59:36.774790296 CET;192.168.1.103;192.168.1.104;46918;1883;54;46918 → 1883 [ACK] Seq=5 Ack=613 Win=42217 Len=0;
76;Jan 13, 2022 15:59:40.779236165 CET;192.168.1.103;192.168.1.104;46918;1883;56;Ping Request;
77;Jan 13, 2022 15:59:40.783962011 CET;192.168.1.104;192.168.1.103;1883;46918;54;1883 → 46918 [ACK] Seq=613 Ack=7 Win=8192 Len=0;
78;Jan 13, 2022 15:59:40.787205174 CET;192.168.1.104;192.168.1.103;1883;46918;56;Ping Response;
79;Jan 13, 2022 15:59:40.787214704 CET;192.168.1.103;192.168.1.104;46918;1883;54;46918 → 1883 [ACK] Seq=7 Ack=615 Win=42217 Len=0;
80;Jan 13, 2022 15:59:42.041209184 CET;192.168.1.104;192.168.1.103;1883;46918;73;Publish Message [topic];message033
81;Jan 13, 2022 15:59:42.041228569 CET;192.168.1.103;192.168.1.104;46918;1883;54;46918 → 1883 [ACK] Seq=7 Ack=634 Win=42217 Len=0;
82;Jan 13, 2022 15:59:47.320340078 CET;192.168.1.104;192.168.1.103;1883;46918;73;Publish Message [topic];message034
83;Jan 13, 2022 15:59:47.320358785 CET;192.168.1.103;192.168.1.104;46918;1883;54;46918 → 1883 [ACK] Seq=7 Ack=653 Win=42217 Len=0;
84;Jan 13, 2022 15:59:52.571276548 CET;192.168.1.104;192.168.1.103;1883;46918;73;Publish Message [topic];message035
85;Jan 13, 2022 15:59:52.571293586 CET;192.168.1.103;192.168.1.104;46918;1883;54;46918 → 1883 [ACK] Seq=7 Ack=672 Win=42217 Len=0;
86;Jan 13, 2022 15:59:57.790914046 CET;192.168.1.104;192.168.1.103;1883;46918;73;Publish Message [topic];message036
87;Jan 13, 2022 15:59:57.790935828 CET;192.168.1.103;192.168.1.104;46918;1883;54;46918 → 1883 [ACK] Seq=7 Ack=691 Win=42217 Len=0;
88;Jan 13, 2022 16:00:03.031290025 CET;192.168.1.104;192.168.1.103;1883;46918;73;Publish Message [topic];message037
89;Jan 13, 2022 16:00:03.031301570 CET;192.168.1.103;192.168.1.104;46918;1883;54;46918 → 1883 [ACK] Seq=7 Ack=710 Win=42217 Len=0;
90;Jan 13, 2022 16:00:08.244893371 CET;192.168.1.104;192.168.1.103;1883;46918;73;Publish Message [topic];message038
91;Jan 13, 2022 16:00:08.244913738 CET;192.168.1.103;192.168.1.104;46918;1883;54;46918 → 1883 [ACK] Seq=7 Ack=729 Win=42217 Len=0;
92;Jan 13, 2022 16:00:13.521366490 CET;192.168.1.104;192.168.1.103;1883;46918;73;Publish Message [topic];message039
93;Jan 13, 2022 16:00:13.521400443 CET;192.168.1.103;192.168.1.104;46918;1883;54;46918 → 1883 [ACK] Seq=7 Ack=748 Win=42217 Len=0;
94;Jan 13, 2022 16:00:18.295364536 CET;192.168.1.104;192.168.1.103;1883;46918;73;Publish Message [topic];message040
95;Jan 13, 2022 16:00:18.295387900 CET;192.168.1.103;192.168.1.104;46918;1883;54;46918 → 1883 [ACK] Seq=7 Ack=767 Win=42217 Len=0;
96;Jan 13, 2022 16:00:23.738222263 CET;192.168.1.104;192.168.1.103;1883;46918;73;Publish Message [topic];message041
97;Jan 13, 2022 16:00:23.738244802 CET;192.168.1.103;192.168.1.104;46918;1883;54;46918 → 1883 [ACK] Seq=7 Ack=786 Win=42217 Len=0;
98;Jan 13, 2022 16:00:28.520221759 CET;192.168.1.104;192.168.1.103;1883;46918;73;Publish Message [topic];message042
99;Jan 13, 2022 16:00:28.520234303 CET;192.168.1.103;192.168.1.104;46918;1883;54;46918 → 1883 [ACK] Seq=7 Ack=805 Win=42217 Len=0;
100;Jan 13, 2022 16:00:34.029874361 CET;192.168.1.104;192.168.1.103;1883;46918;73;Publish Message [topic];message043
101;Jan 13, 2022 16:00:34.029892585 CET;192.168.1.103;192.168.1.104;46918;1883;54;46918 → 1883 [ACK] Seq=7 Ack=824 Win=42217 Len=0;
102;Jan 13, 2022 16:00:39.272294018 CET;192.168.1.104;192.168.1.103;1883;46918;73;Publish Message [topic];message044
103;Jan 13, 2022 16:00:39.272312218 CET;192.168.1.103;192.168.1.104;46918;1883;54;46918 → 1883 [ACK] Seq=7 Ack=843 Win=42217 Len=0;
104;Jan 13, 2022 16:00:40.273591100 CET;192.168.1.103;192.168.1.104;46918;1883;56;Ping Request;
105;Jan 13, 2022 16:00:40.286106333 CET;192.168.1.104;192.168.1.103;1883;46918;54;1883 → 46918 [ACK] Seq=843 Ack=9 Win=8192 Len=0;
106;Jan 13, 2022 16:00:40.293582060 CET;192.168.1.104;192.168.1.103;1883;46918;56;Ping Response;
107;Jan 13, 2022 16:00:40.293597386 CET;192.168.1.103;192.168.1.104;46918;1883;54;46918 → 1883 [ACK] Seq=9 Ack=845 Win=42217 Len=0;
108;Jan 13, 2022 16:00:44.510185409 CET;192.168.1.104;192.168.1.103;1883;46918;73;Publish Message [topic];message045
109;Jan 13, 2022 16:00:44.510205049 CET;192.168.1.103;192.168.1.104;46918;1883;54;46918 → 1883 [ACK] Seq=9 Ack=864 Win=42217 Len=0;
110;Jan 13, 2022 16:00:49.278934485 CET;192.168.1.104;192.168.1.103;1883;46918;73;Publish Message [topic];message046
111;Jan 13, 2022 16:00:49.278952597 CET;192.168.1.103;192.168.1.104;46918;1883;54;46918 → 1883 [ACK] Seq=9 Ack=883 Win=42217 Len=0;
112;Jan 13, 2022 16:00:54.322159723 CET;192.168.1.104;192.168.1.103;1883;46918;73;Publish Message [topic];message047
113;Jan 13, 2022 16:00:54.322173545 CET;192.168.1.103;192.168.1.104;46918;1883;54;46918 → 1883 [ACK] Seq=9 Ack=902 Win=42217 Len=0;
114;Jan 13, 2022 16:00:59.335357833 CET;192.168.1.104;192.168.1.103;1883;46918;73;Publish Message [topic];message048
115;Jan 13, 2022 16:00:59.335380557 CET;192.168.1.103;192.168.1.104;46918;1883;54;46918 → 1883 [ACK] Seq=9 Ack=921 Win=42217 Len=0;
116;Jan 13, 2022 16:01:04.789176235 CET;192.168.1.104;192.168.1.103;1883;46918;73;Publish Message [topic];message049
117;Jan 13, 2022 16:01:04.789186120 CET;192.168.1.103;192.168.1.104;46918;1883;54;46918 → 1883 [ACK] Seq=9 Ack=940 Win=42217 Len=0;
