1;Jan 13, 2022 18:20:57.087132611 CET;192.168.1.102;192.168.1.104;51914;1883;74;51914 → 1883 [SYN] Seq=0 Win=42340 Len=0 MSS=1460 SACK_PERM=1 TSval=1806559969 TSecr=0 WS=512;
2;Jan 13, 2022 18:20:58.092541379 CET;192.168.1.102;192.168.1.104;51914;1883;74;[TCP Retransmission] 51914 → 1883 [SYN] Seq=0 Win=42340 Len=0 MSS=1460 SACK_PERM=1 TSval=1806562988 TSecr=0 WS=512;
3;Jan 13, 2022 18:20:59.107159859 CET;192.168.1.104;192.168.1.102;1883;51914;58;1883 → 51914 [SYN, ACK] Seq=0 Ack=1 Win=8192 Len=0 MSS=1460;
4;Jan 13, 2022 18:20:59.107192163 CET;192.168.1.102;192.168.1.104;51914;1883;54;51914 → 1883 [ACK] Seq=1 Ack=1 Win=42340 Len=0;
5;Jan 13, 2022 18:20:59.107290684 CET;192.168.1.102;192.168.1.104;51914;1883;108;Connect Command;
6;Jan 13, 2022 18:21:02.348575828 CET;192.168.1.102;192.168.1.104;51914;1883;108;[TCP Retransmission] 51914 → 1883 [PSH, ACK] Seq=1 Ack=1 Win=42340 Len=54;
7;Jan 13, 2022 18:21:03.357548437 CET;192.168.1.104;192.168.1.102;1883;51914;54;1883 → 51914 [ACK] Seq=1 Ack=55 Win=8192 Len=0;
8;Jan 13, 2022 18:21:03.360663674 CET;192.168.1.104;192.168.1.102;1883;51914;58;Connect Ack;
9;Jan 13, 2022 18:21:03.360710457 CET;192.168.1.102;192.168.1.104;51914;1883;54;51914 → 1883 [ACK] Seq=55 Ack=5 Win=42336 Len=0;
10;Jan 13, 2022 18:21:03.360881549 CET;192.168.1.102;192.168.1.104;51914;1883;73;Publish Message [topic];message001
11;Jan 13, 2022 18:21:03.360930424 CET;192.168.1.102;192.168.1.104;51914;1883;56;Disconnect Req;
12;Jan 13, 2022 18:21:08.370864884 CET;192.168.1.102;192.168.1.104;51916;1883;74;51916 → 1883 [SYN] Seq=0 Win=42340 Len=0 MSS=1460 SACK_PERM=1 TSval=1806573266 TSecr=0 WS=512;
13;Jan 13, 2022 18:21:09.376929422 CET;192.168.1.104;192.168.1.102;1883;51916;58;1883 → 51916 [SYN, ACK] Seq=0 Ack=1 Win=8192 Len=0 MSS=1460;
14;Jan 13, 2022 18:21:09.376986330 CET;192.168.1.102;192.168.1.104;51916;1883;54;51916 → 1883 [ACK] Seq=1 Ack=1 Win=42340 Len=0;
15;Jan 13, 2022 18:21:09.377085576 CET;192.168.1.102;192.168.1.104;51916;1883;108;Connect Command;
16;Jan 13, 2022 18:21:09.516888799 CET;192.168.1.102;192.168.1.104;51914;1883;75;[TCP Retransmission] 51914 → 1883 [FIN, PSH, ACK] Seq=55 Ack=5 Win=42336 Len=21;
17;Jan 13, 2022 18:21:10.527920823 CET;192.168.1.104;192.168.1.102;1883;51914;54;1883 → 51914 [FIN, ACK] Seq=5 Ack=77 Win=8192 Len=0;
18;Jan 13, 2022 18:21:10.527976997 CET;192.168.1.102;192.168.1.104;51914;1883;54;51914 → 1883 [ACK] Seq=77 Ack=6 Win=42335 Len=0;
19;Jan 13, 2022 18:21:12.588567060 CET;192.168.1.102;192.168.1.104;51916;1883;108;[TCP Retransmission] 51916 → 1883 [PSH, ACK] Seq=1 Ack=1 Win=42340 Len=54;
20;Jan 13, 2022 18:21:13.594298710 CET;192.168.1.104;192.168.1.102;1883;51916;54;1883 → 51916 [ACK] Seq=1 Ack=55 Win=8192 Len=0;
21;Jan 13, 2022 18:21:13.597402732 CET;192.168.1.104;192.168.1.102;1883;51916;58;Connect Ack;
22;Jan 13, 2022 18:21:13.597449197 CET;192.168.1.102;192.168.1.104;51916;1883;54;51916 → 1883 [ACK] Seq=55 Ack=5 Win=42336 Len=0;
23;Jan 13, 2022 18:21:13.597608151 CET;192.168.1.102;192.168.1.104;51916;1883;73;Publish Message [topic];message002
24;Jan 13, 2022 18:21:13.597657774 CET;192.168.1.102;192.168.1.104;51916;1883;56;Disconnect Req;
25;Jan 13, 2022 18:21:18.608507594 CET;192.168.1.102;192.168.1.104;51918;1883;74;51918 → 1883 [SYN] Seq=0 Win=42340 Len=0 MSS=1460 SACK_PERM=1 TSval=1806583504 TSecr=0 WS=512;
26;Jan 13, 2022 18:21:19.612023823 CET;192.168.1.104;192.168.1.102;1883;51918;58;1883 → 51918 [SYN, ACK] Seq=0 Ack=1 Win=8192 Len=0 MSS=1460;
27;Jan 13, 2022 18:21:19.612098400 CET;192.168.1.102;192.168.1.104;51918;1883;54;51918 → 1883 [ACK] Seq=1 Ack=1 Win=42340 Len=0;
28;Jan 13, 2022 18:21:19.612227130 CET;192.168.1.102;192.168.1.104;51918;1883;108;Connect Command;
29;Jan 13, 2022 18:21:19.756616304 CET;192.168.1.102;192.168.1.104;51916;1883;75;[TCP Retransmission] 51916 → 1883 [FIN, PSH, ACK] Seq=55 Ack=5 Win=42336 Len=21;
30;Jan 13, 2022 18:21:20.765849573 CET;192.168.1.104;192.168.1.102;1883;51916;54;1883 → 51916 [FIN, ACK] Seq=5 Ack=77 Win=8192 Len=0;
31;Jan 13, 2022 18:21:20.765906025 CET;192.168.1.102;192.168.1.104;51916;1883;54;51916 → 1883 [ACK] Seq=77 Ack=6 Win=42335 Len=0;
32;Jan 13, 2022 18:21:22.829646672 CET;192.168.1.102;192.168.1.104;51918;1883;108;[TCP Retransmission] 51918 → 1883 [PSH, ACK] Seq=1 Ack=1 Win=42340 Len=54;
33;Jan 13, 2022 18:21:23.838463361 CET;192.168.1.104;192.168.1.102;1883;51918;54;1883 → 51918 [ACK] Seq=1 Ack=55 Win=8192 Len=0;
34;Jan 13, 2022 18:21:23.843404840 CET;192.168.1.104;192.168.1.102;1883;51918;58;Connect Ack;
35;Jan 13, 2022 18:21:23.843452720 CET;192.168.1.102;192.168.1.104;51918;1883;54;51918 → 1883 [ACK] Seq=55 Ack=5 Win=42336 Len=0;
36;Jan 13, 2022 18:21:23.843620513 CET;192.168.1.102;192.168.1.104;51918;1883;73;Publish Message [topic];message003
37;Jan 13, 2022 18:21:23.843671502 CET;192.168.1.102;192.168.1.104;51918;1883;56;Disconnect Req;
38;Jan 13, 2022 18:21:28.853817370 CET;192.168.1.102;192.168.1.104;51920;1883;74;51920 → 1883 [SYN] Seq=0 Win=42340 Len=0 MSS=1460 SACK_PERM=1 TSval=1806593749 TSecr=0 WS=512;
39;Jan 13, 2022 18:21:29.861854253 CET;192.168.1.104;192.168.1.102;1883;51920;58;1883 → 51920 [SYN, ACK] Seq=0 Ack=1 Win=8192 Len=0 MSS=1460;
40;Jan 13, 2022 18:21:29.861893628 CET;192.168.1.102;192.168.1.104;51920;1883;54;51920 → 1883 [ACK] Seq=1 Ack=1 Win=42340 Len=0;
41;Jan 13, 2022 18:21:29.861952843 CET;192.168.1.102;192.168.1.104;51920;1883;108;Connect Command;
42;Jan 13, 2022 18:21:29.996653198 CET;192.168.1.102;192.168.1.104;51918;1883;75;[TCP Retransmission] 51918 → 1883 [FIN, PSH, ACK] Seq=55 Ack=5 Win=42336 Len=21;
43;Jan 13, 2022 18:21:31.001722186 CET;192.168.1.104;192.168.1.102;1883;51918;54;1883 → 51918 [FIN, ACK] Seq=5 Ack=77 Win=8192 Len=0;
44;Jan 13, 2022 18:21:31.001746695 CET;192.168.1.102;192.168.1.104;51918;1883;54;51918 → 1883 [ACK] Seq=77 Ack=6 Win=42335 Len=0;
45;Jan 13, 2022 18:21:33.068823849 CET;192.168.1.102;192.168.1.104;51920;1883;108;[TCP Retransmission] 51920 → 1883 [PSH, ACK] Seq=1 Ack=1 Win=42340 Len=54;
46;Jan 13, 2022 18:21:34.077958161 CET;192.168.1.104;192.168.1.102;1883;51920;54;1883 → 51920 [ACK] Seq=1 Ack=55 Win=8192 Len=0;
47;Jan 13, 2022 18:21:34.081465770 CET;192.168.1.104;192.168.1.102;1883;51920;58;Connect Ack;
48;Jan 13, 2022 18:21:34.081488605 CET;192.168.1.102;192.168.1.104;51920;1883;54;51920 → 1883 [ACK] Seq=55 Ack=5 Win=42336 Len=0;
49;Jan 13, 2022 18:21:34.081564959 CET;192.168.1.102;192.168.1.104;51920;1883;73;Publish Message [topic];message004
50;Jan 13, 2022 18:21:34.081586280 CET;192.168.1.102;192.168.1.104;51920;1883;56;Disconnect Req;
51;Jan 13, 2022 18:21:39.086193382 CET;192.168.1.102;192.168.1.104;51922;1883;74;51922 → 1883 [SYN] Seq=0 Win=42340 Len=0 MSS=1460 SACK_PERM=1 TSval=1806603982 TSecr=0 WS=512;
52;Jan 13, 2022 18:21:40.103415437 CET;192.168.1.104;192.168.1.102;1883;51922;58;1883 → 51922 [SYN, ACK] Seq=0 Ack=1 Win=8192 Len=0 MSS=1460;
53;Jan 13, 2022 18:21:40.103447812 CET;192.168.1.102;192.168.1.104;51922;1883;54;51922 → 1883 [ACK] Seq=1 Ack=1 Win=42340 Len=0;
54;Jan 13, 2022 18:21:40.103494082 CET;192.168.1.102;192.168.1.104;51922;1883;108;Connect Command;
55;Jan 13, 2022 18:21:40.236564156 CET;192.168.1.102;192.168.1.104;51920;1883;75;[TCP Retransmission] 51920 → 1883 [FIN, PSH, ACK] Seq=55 Ack=5 Win=42336 Len=21;
56;Jan 13, 2022 18:21:41.242116151 CET;192.168.1.104;192.168.1.102;1883;51920;54;1883 → 51920 [FIN, ACK] Seq=5 Ack=77 Win=8192 Len=0;
57;Jan 13, 2022 18:21:41.242176996 CET;192.168.1.102;192.168.1.104;51920;1883;54;51920 → 1883 [ACK] Seq=77 Ack=6 Win=42335 Len=0;
58;Jan 13, 2022 18:21:43.308703111 CET;192.168.1.102;192.168.1.104;51922;1883;108;[TCP Retransmission] 51922 → 1883 [PSH, ACK] Seq=1 Ack=1 Win=42340 Len=54;
59;Jan 13, 2022 18:21:44.318417275 CET;192.168.1.104;192.168.1.102;1883;51922;54;1883 → 51922 [ACK] Seq=1 Ack=55 Win=8192 Len=0;
60;Jan 13, 2022 18:21:44.321564716 CET;192.168.1.104;192.168.1.102;1883;51922;58;Connect Ack;
61;Jan 13, 2022 18:21:44.321613010 CET;192.168.1.102;192.168.1.104;51922;1883;54;51922 → 1883 [ACK] Seq=55 Ack=5 Win=42336 Len=0;
62;Jan 13, 2022 18:21:44.321772001 CET;192.168.1.102;192.168.1.104;51922;1883;73;Publish Message [topic];message005
63;Jan 13, 2022 18:21:44.321821604 CET;192.168.1.102;192.168.1.104;51922;1883;56;Disconnect Req;
64;Jan 13, 2022 18:21:49.332381730 CET;192.168.1.102;192.168.1.104;51924;1883;74;51924 → 1883 [SYN] Seq=0 Win=42340 Len=0 MSS=1460 SACK_PERM=1 TSval=1806614228 TSecr=0 WS=512;
65;Jan 13, 2022 18:21:50.340798547 CET;192.168.1.104;192.168.1.102;1883;51924;58;1883 → 51924 [SYN, ACK] Seq=0 Ack=1 Win=8192 Len=0 MSS=1460;
66;Jan 13, 2022 18:21:50.340866518 CET;192.168.1.102;192.168.1.104;51924;1883;54;51924 → 1883 [ACK] Seq=1 Ack=1 Win=42340 Len=0;
67;Jan 13, 2022 18:21:50.340970243 CET;192.168.1.102;192.168.1.104;51924;1883;108;Connect Command;
68;Jan 13, 2022 18:21:50.477083119 CET;192.168.1.102;192.168.1.104;51922;1883;75;[TCP Retransmission] 51922 → 1883 [FIN, PSH, ACK] Seq=55 Ack=5 Win=42336 Len=21;
69;Jan 13, 2022 18:21:51.485463351 CET;192.168.1.104;192.168.1.102;1883;51922;54;1883 → 51922 [FIN, ACK] Seq=5 Ack=77 Win=8192 Len=0;
70;Jan 13, 2022 18:21:51.485526531 CET;192.168.1.102;192.168.1.104;51922;1883;54;51922 → 1883 [ACK] Seq=77 Ack=6 Win=42335 Len=0;
71;Jan 13, 2022 18:21:53.548590235 CET;192.168.1.102;192.168.1.104;51924;1883;108;[TCP Retransmission] 51924 → 1883 [PSH, ACK] Seq=1 Ack=1 Win=42340 Len=54;
72;Jan 13, 2022 18:21:54.557713347 CET;192.168.1.104;192.168.1.102;1883;51924;54;1883 → 51924 [ACK] Seq=1 Ack=55 Win=8192 Len=0;
73;Jan 13, 2022 18:21:54.561112047 CET;192.168.1.104;192.168.1.102;1883;51924;58;Connect Ack;
74;Jan 13, 2022 18:21:54.561160684 CET;192.168.1.102;192.168.1.104;51924;1883;54;51924 → 1883 [ACK] Seq=55 Ack=5 Win=42336 Len=0;
75;Jan 13, 2022 18:21:54.561403507 CET;192.168.1.102;192.168.1.104;51924;1883;73;Publish Message [topic];message006
76;Jan 13, 2022 18:21:54.561454441 CET;192.168.1.102;192.168.1.104;51924;1883;56;Disconnect Req;
77;Jan 13, 2022 18:21:59.567363629 CET;192.168.1.102;192.168.1.104;51926;1883;74;51926 → 1883 [SYN] Seq=0 Win=42340 Len=0 MSS=1460 SACK_PERM=1 TSval=1806624463 TSecr=0 WS=512;
78;Jan 13, 2022 18:22:00.585304118 CET;192.168.1.104;192.168.1.102;1883;51926;58;1883 → 51926 [SYN, ACK] Seq=0 Ack=1 Win=8192 Len=0 MSS=1460;
79;Jan 13, 2022 18:22:00.585355051 CET;192.168.1.102;192.168.1.104;51926;1883;54;51926 → 1883 [ACK] Seq=1 Ack=1 Win=42340 Len=0;
80;Jan 13, 2022 18:22:00.585443041 CET;192.168.1.102;192.168.1.104;51926;1883;108;Connect Command;
81;Jan 13, 2022 18:22:00.717160208 CET;192.168.1.102;192.168.1.104;51924;1883;75;[TCP Retransmission] 51924 → 1883 [FIN, PSH, ACK] Seq=55 Ack=5 Win=42336 Len=21;
82;Jan 13, 2022 18:22:01.735820422 CET;192.168.1.104;192.168.1.102;1883;51924;54;1883 → 51924 [FIN, ACK] Seq=5 Ack=77 Win=8192 Len=0;
83;Jan 13, 2022 18:22:01.735844917 CET;192.168.1.102;192.168.1.104;51924;1883;54;51924 → 1883 [ACK] Seq=77 Ack=6 Win=42335 Len=0;
84;Jan 13, 2022 18:22:03.789162591 CET;192.168.1.102;192.168.1.104;51926;1883;108;[TCP Retransmission] 51926 → 1883 [PSH, ACK] Seq=1 Ack=1 Win=42340 Len=54;
85;Jan 13, 2022 18:22:04.799547129 CET;192.168.1.104;192.168.1.102;1883;51926;54;1883 → 51926 [ACK] Seq=1 Ack=55 Win=8192 Len=0;
86;Jan 13, 2022 18:22:04.802577861 CET;192.168.1.104;192.168.1.102;1883;51926;58;Connect Ack;
87;Jan 13, 2022 18:22:04.802624415 CET;192.168.1.102;192.168.1.104;51926;1883;54;51926 → 1883 [ACK] Seq=55 Ack=5 Win=42336 Len=0;
88;Jan 13, 2022 18:22:04.802777576 CET;192.168.1.102;192.168.1.104;51926;1883;73;Publish Message [topic];message007
89;Jan 13, 2022 18:22:04.802828592 CET;192.168.1.102;192.168.1.104;51926;1883;56;Disconnect Req;
90;Jan 13, 2022 18:22:09.812674396 CET;192.168.1.102;192.168.1.104;51928;1883;74;51928 → 1883 [SYN] Seq=0 Win=42340 Len=0 MSS=1460 SACK_PERM=1 TSval=1806634708 TSecr=0 WS=512;
91;Jan 13, 2022 18:22:10.821076838 CET;192.168.1.104;192.168.1.102;1883;51928;58;1883 → 51928 [SYN, ACK] Seq=0 Ack=1 Win=8192 Len=0 MSS=1460;
92;Jan 13, 2022 18:22:10.821159394 CET;192.168.1.102;192.168.1.104;51928;1883;54;51928 → 1883 [ACK] Seq=1 Ack=1 Win=42340 Len=0;
93;Jan 13, 2022 18:22:10.821362678 CET;192.168.1.102;192.168.1.104;51928;1883;108;Connect Command;
94;Jan 13, 2022 18:22:10.956569038 CET;192.168.1.102;192.168.1.104;51926;1883;75;[TCP Retransmission] 51926 → 1883 [FIN, PSH, ACK] Seq=55 Ack=5 Win=42336 Len=21;
95;Jan 13, 2022 18:22:11.977619819 CET;192.168.1.104;192.168.1.102;1883;51926;54;1883 → 51926 [FIN, ACK] Seq=5 Ack=77 Win=8192 Len=0;
96;Jan 13, 2022 18:22:11.977676060 CET;192.168.1.102;192.168.1.104;51926;1883;54;51926 → 1883 [ACK] Seq=77 Ack=6 Win=42335 Len=0;
97;Jan 13, 2022 18:22:14.028518457 CET;192.168.1.102;192.168.1.104;51928;1883;108;[TCP Retransmission] 51928 → 1883 [PSH, ACK] Seq=1 Ack=1 Win=42340 Len=54;
98;Jan 13, 2022 18:22:15.037426545 CET;192.168.1.104;192.168.1.102;1883;51928;54;1883 → 51928 [ACK] Seq=1 Ack=55 Win=8192 Len=0;
99;Jan 13, 2022 18:22:15.040632204 CET;192.168.1.104;192.168.1.102;1883;51928;58;Connect Ack;
100;Jan 13, 2022 18:22:15.040642184 CET;192.168.1.102;192.168.1.104;51928;1883;54;51928 → 1883 [ACK] Seq=55 Ack=5 Win=42336 Len=0;
101;Jan 13, 2022 18:22:15.040689928 CET;192.168.1.102;192.168.1.104;51928;1883;73;Publish Message [topic];message008
102;Jan 13, 2022 18:22:15.040704526 CET;192.168.1.102;192.168.1.104;51928;1883;56;Disconnect Req;
103;Jan 13, 2022 18:22:20.047179838 CET;192.168.1.102;192.168.1.104;51932;1883;74;51932 → 1883 [SYN] Seq=0 Win=42340 Len=0 MSS=1460 SACK_PERM=1 TSval=1806644943 TSecr=0 WS=512;
104;Jan 13, 2022 18:22:21.058614248 CET;192.168.1.104;192.168.1.102;1883;51932;58;1883 → 51932 [SYN, ACK] Seq=0 Ack=1 Win=8192 Len=0 MSS=1460;
105;Jan 13, 2022 18:22:21.058645999 CET;192.168.1.102;192.168.1.104;51932;1883;54;51932 → 1883 [ACK] Seq=1 Ack=1 Win=42340 Len=0;
106;Jan 13, 2022 18:22:21.058698276 CET;192.168.1.102;192.168.1.104;51932;1883;108;Connect Command;
107;Jan 13, 2022 18:22:21.196577169 CET;192.168.1.102;192.168.1.104;51928;1883;75;[TCP Retransmission] 51928 → 1883 [FIN, PSH, ACK] Seq=55 Ack=5 Win=42336 Len=21;
108;Jan 13, 2022 18:22:22.215172610 CET;192.168.1.104;192.168.1.102;1883;51928;54;1883 → 51928 [FIN, ACK] Seq=5 Ack=77 Win=8192 Len=0;
109;Jan 13, 2022 18:22:22.215203367 CET;192.168.1.102;192.168.1.104;51928;1883;54;51928 → 1883 [ACK] Seq=77 Ack=6 Win=42335 Len=0;
110;Jan 13, 2022 18:22:24.269222469 CET;192.168.1.102;192.168.1.104;51932;1883;108;[TCP Retransmission] 51932 → 1883 [PSH, ACK] Seq=1 Ack=1 Win=42340 Len=54;
111;Jan 13, 2022 18:22:25.320745248 CET;192.168.1.104;192.168.1.102;1883;51932;54;1883 → 51932 [ACK] Seq=1 Ack=55 Win=8192 Len=0;
112;Jan 13, 2022 18:22:25.322676786 CET;192.168.1.104;192.168.1.102;1883;51932;58;Connect Ack;
113;Jan 13, 2022 18:22:25.322695751 CET;192.168.1.102;192.168.1.104;51932;1883;54;51932 → 1883 [ACK] Seq=55 Ack=5 Win=42336 Len=0;
114;Jan 13, 2022 18:22:25.322762909 CET;192.168.1.102;192.168.1.104;51932;1883;73;Publish Message [topic];message009
115;Jan 13, 2022 18:22:25.322779929 CET;192.168.1.102;192.168.1.104;51932;1883;56;Disconnect Req;
116;Jan 13, 2022 18:22:30.330087836 CET;192.168.1.102;192.168.1.104;51934;1883;74;51934 → 1883 [SYN] Seq=0 Win=42340 Len=0 MSS=1460 SACK_PERM=1 TSval=1806655226 TSecr=0 WS=512;
117;Jan 13, 2022 18:22:31.340681793 CET;192.168.1.102;192.168.1.104;51934;1883;74;[TCP Retransmission] 51934 → 1883 [SYN] Seq=0 Win=42340 Len=0 MSS=1460 SACK_PERM=1 TSval=1806656236 TSecr=0 WS=512;
118;Jan 13, 2022 18:22:31.347535970 CET;192.168.1.104;192.168.1.102;1883;51934;58;1883 → 51934 [SYN, ACK] Seq=0 Ack=1 Win=8192 Len=0 MSS=1460;
119;Jan 13, 2022 18:22:31.347610149 CET;192.168.1.102;192.168.1.104;51934;1883;54;51934 → 1883 [ACK] Seq=1 Ack=1 Win=42340 Len=0;
120;Jan 13, 2022 18:22:31.347736842 CET;192.168.1.102;192.168.1.104;51934;1883;108;Connect Command;
121;Jan 13, 2022 18:22:31.436595669 CET;192.168.1.102;192.168.1.104;51932;1883;75;[TCP Retransmission] 51932 → 1883 [FIN, PSH, ACK] Seq=55 Ack=5 Win=42336 Len=21;
122;Jan 13, 2022 18:22:32.347069855 CET;192.168.1.104;192.168.1.102;1883;51934;58;[TCP Retransmission] [TCP Port numbers reused] 1883 → 51934 [SYN, ACK] Seq=3697835816 Ack=1 Win=8192 Len=0 MSS=1460;
123;Jan 13, 2022 18:22:32.347117039 CET;192.168.1.102;192.168.1.104;51934;1883;54;[TCP Dup ACK 119#1] 51934 → 1883 [ACK] Seq=55 Ack=1 Win=42340 Len=0;
124;Jan 13, 2022 18:22:32.451571563 CET;192.168.1.104;192.168.1.102;1883;51932;54;1883 → 51932 [FIN, ACK] Seq=5 Ack=77 Win=8192 Len=0;
125;Jan 13, 2022 18:22:32.451634270 CET;192.168.1.102;192.168.1.104;51932;1883;54;51932 → 1883 [ACK] Seq=77 Ack=6 Win=42335 Len=0;
126;Jan 13, 2022 18:22:34.508602918 CET;192.168.1.102;192.168.1.104;51934;1883;108;[TCP Retransmission] 51934 → 1883 [PSH, ACK] Seq=1 Ack=1 Win=42340 Len=54;
127;Jan 13, 2022 18:22:35.519778642 CET;192.168.1.104;192.168.1.102;1883;51934;54;1883 → 51934 [ACK] Seq=3697835817 Ack=55 Win=8192 Len=0;
128;Jan 13, 2022 18:22:35.519798993 CET;192.168.1.102;192.168.1.104;51934;1883;54;[TCP Dup ACK 119#2] 51934 → 1883 [ACK] Seq=55 Ack=1 Win=42340 Len=0;
129;Jan 13, 2022 18:22:35.524093009 CET;192.168.1.104;192.168.1.102;1883;51934;58;[TCP Spurious Retransmission] , Connect Ack;
130;Jan 13, 2022 18:22:35.524111151 CET;192.168.1.102;192.168.1.104;51934;1883;54;[TCP Dup ACK 119#3] 51934 → 1883 [ACK] Seq=55 Ack=1 Win=42340 Len=0;
131;Jan 13, 2022 18:22:40.652629837 CET;192.168.1.102;192.168.1.104;51934;1883;108;[TCP Spurious Retransmission] , Connect Command;
132;Jan 13, 2022 18:22:52.685086314 CET;192.168.1.102;192.168.1.104;51934;1883;108;[TCP Spurious Retransmission] , Connect Command;
133;Jan 13, 2022 18:23:18.028524843 CET;192.168.1.102;192.168.1.104;51934;1883;108;[TCP Spurious Retransmission] , Connect Command;
134;Jan 13, 2022 18:23:30.416605335 CET;192.168.1.102;192.168.1.104;51934;1883;54;51934 → 1883 [FIN, ACK] Seq=55 Ack=1 Win=42340 Len=0;
135;Jan 13, 2022 18:23:32.469015681 CET;192.168.1.104;192.168.1.102;1883;51934;54;[TCP Retransmission] 1883 → 51934 [FIN, ACK] Seq=3697835821 Ack=56 Win=8192 Len=0;
136;Jan 13, 2022 18:23:32.469059400 CET;192.168.1.102;192.168.1.104;51934;1883;54;[TCP Dup ACK 119#4] 51934 → 1883 [ACK] Seq=56 Ack=1 Win=42340 Len=0;
137;Jan 13, 2022 18:23:32.469229528 CET;192.168.1.104;192.168.1.102;1883;51934;54;[TCP ACKed unseen segment] [TCP Retransmission] 1883 → 51934 [FIN, ACK] Seq=3697835821 Ack=57 Win=8192 Len=0;
138;Jan 13, 2022 18:23:32.469249216 CET;192.168.1.102;192.168.1.104;51934;1883;54;[TCP Dup ACK 119#5] 51934 → 1883 [ACK] Seq=56 Ack=1 Win=42340 Len=0;
139;Jan 13, 2022 18:23:35.423628152 CET;192.168.1.102;192.168.1.104;51936;1883;74;51936 → 1883 [SYN] Seq=0 Win=42340 Len=0 MSS=1460 SACK_PERM=1 TSval=1806720319 TSecr=0 WS=512;
140;Jan 13, 2022 18:23:36.429406251 CET;192.168.1.102;192.168.1.104;51936;1883;74;[TCP Retransmission] 51936 → 1883 [SYN] Seq=0 Win=42340 Len=0 MSS=1460 SACK_PERM=1 TSval=1806721325 TSecr=0 WS=512;
141;Jan 13, 2022 18:23:36.441781710 CET;192.168.1.104;192.168.1.102;1883;51936;58;1883 → 51936 [SYN, ACK] Seq=0 Ack=1 Win=8192 Len=0 MSS=1460;
142;Jan 13, 2022 18:23:36.441863171 CET;192.168.1.102;192.168.1.104;51936;1883;54;51936 → 1883 [ACK] Seq=1 Ack=1 Win=42340 Len=0;
143;Jan 13, 2022 18:23:36.442084557 CET;192.168.1.102;192.168.1.104;51936;1883;108;Connect Command;
144;Jan 13, 2022 18:23:37.435062416 CET;192.168.1.104;192.168.1.102;1883;51936;58;[TCP Previous segment not captured] [TCP Port numbers reused] 1883 → 51936 [SYN, ACK] Seq=2075602631 Ack=1 Win=8192 Len=0 MSS=1460;
145;Jan 13, 2022 18:23:37.435111982 CET;192.168.1.102;192.168.1.104;51936;1883;54;[TCP Dup ACK 142#1] 51936 → 1883 [ACK] Seq=55 Ack=1 Win=42340 Len=0;
146;Jan 13, 2022 18:23:39.532606016 CET;192.168.1.102;192.168.1.104;51936;1883;108;[TCP Retransmission] 51936 → 1883 [PSH, ACK] Seq=1 Ack=1 Win=42340 Len=54;
147;Jan 13, 2022 18:23:40.538490888 CET;192.168.1.104;192.168.1.102;1883;51936;54;1883 → 51936 [ACK] Seq=2075602632 Ack=55 Win=8192 Len=0;
148;Jan 13, 2022 18:23:40.538536964 CET;192.168.1.102;192.168.1.104;51936;1883;54;[TCP Dup ACK 142#2] 51936 → 1883 [ACK] Seq=55 Ack=1 Win=42340 Len=0;
149;Jan 13, 2022 18:23:40.543563365 CET;192.168.1.104;192.168.1.102;1883;51936;58;Connect Ack;
150;Jan 13, 2022 18:23:40.543610814 CET;192.168.1.102;192.168.1.104;51936;1883;54;[TCP Dup ACK 142#3] 51936 → 1883 [ACK] Seq=55 Ack=1 Win=42340 Len=0;
151;Jan 13, 2022 18:23:45.676606240 CET;192.168.1.102;192.168.1.104;51936;1883;108;[TCP Spurious Retransmission] , Connect Command;
152;Jan 13, 2022 18:23:57.708586259 CET;192.168.1.102;192.168.1.104;51936;1883;108;[TCP Spurious Retransmission] , Connect Command;
153;Jan 13, 2022 18:24:07.180645309 CET;192.168.1.102;192.168.1.104;51934;1883;108;[TCP Spurious Retransmission] , Connect Command;
154;Jan 13, 2022 18:24:23.564528631 CET;192.168.1.102;192.168.1.104;51936;1883;108;[TCP Spurious Retransmission] , Connect Command;
155;Jan 13, 2022 18:24:35.516042378 CET;192.168.1.102;192.168.1.104;51936;1883;54;51936 → 1883 [FIN, ACK] Seq=55 Ack=1 Win=42340 Len=0;
156;Jan 13, 2022 18:24:36.526999437 CET;192.168.1.104;192.168.1.102;1883;51936;54;[TCP ACKed unseen segment] 1883 → 51936 [FIN, ACK] Seq=2075602636 Ack=57 Win=8192 Len=0;
157;Jan 13, 2022 18:24:36.527043458 CET;192.168.1.102;192.168.1.104;51936;1883;54;[TCP Dup ACK 142#4] 51936 → 1883 [ACK] Seq=56 Ack=1 Win=42340 Len=0;
158;Jan 13, 2022 18:24:36.528743392 CET;192.168.1.104;192.168.1.102;1883;51936;54;[TCP Out-Of-Order] 1883 → 51936 [FIN, ACK] Seq=2075602636 Ack=56 Win=8192 Len=0;
159;Jan 13, 2022 18:24:36.528803268 CET;192.168.1.102;192.168.1.104;51936;1883;54;[TCP Dup ACK 142#5] 51936 → 1883 [ACK] Seq=56 Ack=1 Win=42340 Len=0;
160;Jan 13, 2022 18:24:40.523834016 CET;192.168.1.102;192.168.1.104;51938;1883;74;51938 → 1883 [SYN] Seq=0 Win=42340 Len=0 MSS=1460 SACK_PERM=1 TSval=1806785419 TSecr=0 WS=512;
161;Jan 13, 2022 18:24:41.543489014 CET;192.168.1.104;192.168.1.102;1883;51938;58;1883 → 51938 [SYN, ACK] Seq=0 Ack=1 Win=8192 Len=0 MSS=1460;
162;Jan 13, 2022 18:24:41.543580216 CET;192.168.1.102;192.168.1.104;51938;1883;54;51938 → 1883 [ACK] Seq=1 Ack=1 Win=42340 Len=0;
163;Jan 13, 2022 18:24:41.543738780 CET;192.168.1.102;192.168.1.104;51938;1883;108;Connect Command;
164;Jan 13, 2022 18:24:44.812629982 CET;192.168.1.102;192.168.1.104;51938;1883;108;[TCP Retransmission] 51938 → 1883 [PSH, ACK] Seq=1 Ack=1 Win=42340 Len=54;
165;Jan 13, 2022 18:24:45.821008080 CET;192.168.1.104;192.168.1.102;1883;51938;54;1883 → 51938 [ACK] Seq=1 Ack=55 Win=8192 Len=0;
166;Jan 13, 2022 18:24:45.825297483 CET;192.168.1.104;192.168.1.102;1883;51938;58;Connect Ack;
167;Jan 13, 2022 18:24:45.825342984 CET;192.168.1.102;192.168.1.104;51938;1883;54;51938 → 1883 [ACK] Seq=55 Ack=5 Win=42336 Len=0;
168;Jan 13, 2022 18:24:45.825475746 CET;192.168.1.102;192.168.1.104;51938;1883;73;Publish Message [topic];message012
169;Jan 13, 2022 18:24:45.825523102 CET;192.168.1.102;192.168.1.104;51938;1883;56;Disconnect Req;
170;Jan 13, 2022 18:24:50.834322696 CET;192.168.1.102;192.168.1.104;51940;1883;74;51940 → 1883 [SYN] Seq=0 Win=42340 Len=0 MSS=1460 SACK_PERM=1 TSval=1806795730 TSecr=0 WS=512;
171;Jan 13, 2022 18:24:51.843566528 CET;192.168.1.104;192.168.1.102;1883;51940;58;1883 → 51940 [SYN, ACK] Seq=0 Ack=1 Win=8192 Len=0 MSS=1460;
172;Jan 13, 2022 18:24:51.843648392 CET;192.168.1.102;192.168.1.104;51940;1883;54;51940 → 1883 [ACK] Seq=1 Ack=1 Win=42340 Len=0;
173;Jan 13, 2022 18:24:51.843788260 CET;192.168.1.102;192.168.1.104;51940;1883;108;Connect Command;
174;Jan 13, 2022 18:24:51.981098352 CET;192.168.1.102;192.168.1.104;51938;1883;75;[TCP Retransmission] 51938 → 1883 [FIN, PSH, ACK] Seq=55 Ack=5 Win=42336 Len=21;
175;Jan 13, 2022 18:24:52.998856216 CET;192.168.1.104;192.168.1.102;1883;51938;54;1883 → 51938 [FIN, ACK] Seq=5 Ack=77 Win=8192 Len=0;
176;Jan 13, 2022 18:24:52.998919043 CET;192.168.1.102;192.168.1.104;51938;1883;54;51938 → 1883 [ACK] Seq=77 Ack=6 Win=42335 Len=0;
177;Jan 13, 2022 18:24:55.052542159 CET;192.168.1.102;192.168.1.104;51940;1883;108;[TCP Retransmission] 51940 → 1883 [PSH, ACK] Seq=1 Ack=1 Win=42340 Len=54;
178;Jan 13, 2022 18:24:56.062253354 CET;192.168.1.104;192.168.1.102;1883;51940;54;1883 → 51940 [ACK] Seq=1 Ack=55 Win=8192 Len=0;
179;Jan 13, 2022 18:24:56.065280556 CET;192.168.1.104;192.168.1.102;1883;51940;58;Connect Ack;
180;Jan 13, 2022 18:24:56.065326996 CET;192.168.1.102;192.168.1.104;51940;1883;54;51940 → 1883 [ACK] Seq=55 Ack=5 Win=42336 Len=0;
181;Jan 13, 2022 18:24:56.065499685 CET;192.168.1.102;192.168.1.104;51940;1883;73;Publish Message [topic];message013
182;Jan 13, 2022 18:24:56.065549590 CET;192.168.1.102;192.168.1.104;51940;1883;56;Disconnect Req;
183;Jan 13, 2022 18:25:01.072779617 CET;192.168.1.102;192.168.1.104;51942;1883;74;51942 → 1883 [SYN] Seq=0 Win=42340 Len=0 MSS=1460 SACK_PERM=1 TSval=1806805968 TSecr=0 WS=512;
184;Jan 13, 2022 18:25:02.090126666 CET;192.168.1.104;192.168.1.102;1883;51942;58;1883 → 51942 [SYN, ACK] Seq=0 Ack=1 Win=8192 Len=0 MSS=1460;
185;Jan 13, 2022 18:25:02.090164104 CET;192.168.1.102;192.168.1.104;51942;1883;54;51942 → 1883 [ACK] Seq=1 Ack=1 Win=42340 Len=0;
186;Jan 13, 2022 18:25:02.090218893 CET;192.168.1.102;192.168.1.104;51942;1883;108;Connect Command;
187;Jan 13, 2022 18:25:02.220627780 CET;192.168.1.102;192.168.1.104;51940;1883;75;[TCP Retransmission] 51940 → 1883 [FIN, PSH, ACK] Seq=55 Ack=5 Win=42336 Len=21;
188;Jan 13, 2022 18:25:03.228232800 CET;192.168.1.104;192.168.1.102;1883;51940;54;1883 → 51940 [FIN, ACK] Seq=5 Ack=77 Win=8192 Len=0;
189;Jan 13, 2022 18:25:03.228294612 CET;192.168.1.102;192.168.1.104;51940;1883;54;51940 → 1883 [ACK] Seq=77 Ack=6 Win=42335 Len=0;
190;Jan 13, 2022 18:25:05.292554560 CET;192.168.1.102;192.168.1.104;51942;1883;108;[TCP Retransmission] 51942 → 1883 [PSH, ACK] Seq=1 Ack=1 Win=42340 Len=54;
191;Jan 13, 2022 18:25:06.301649479 CET;192.168.1.104;192.168.1.102;1883;51942;54;1883 → 51942 [ACK] Seq=1 Ack=55 Win=8192 Len=0;
192;Jan 13, 2022 18:25:06.304699936 CET;192.168.1.104;192.168.1.102;1883;51942;58;Connect Ack;
193;Jan 13, 2022 18:25:06.304741896 CET;192.168.1.102;192.168.1.104;51942;1883;54;51942 → 1883 [ACK] Seq=55 Ack=5 Win=42336 Len=0;
194;Jan 13, 2022 18:25:06.304897893 CET;192.168.1.102;192.168.1.104;51942;1883;73;Publish Message [topic];message014
195;Jan 13, 2022 18:25:06.304943116 CET;192.168.1.102;192.168.1.104;51942;1883;56;Disconnect Req;
196;Jan 13, 2022 18:25:11.317143956 CET;192.168.1.102;192.168.1.104;51944;1883;74;51944 → 1883 [SYN] Seq=0 Win=42340 Len=0 MSS=1460 SACK_PERM=1 TSval=1806816213 TSecr=0 WS=512;
197;Jan 13, 2022 18:25:12.325975488 CET;192.168.1.104;192.168.1.102;1883;51944;58;1883 → 51944 [SYN, ACK] Seq=0 Ack=1 Win=8192 Len=0 MSS=1460;
198;Jan 13, 2022 18:25:12.326050288 CET;192.168.1.102;192.168.1.104;51944;1883;54;51944 → 1883 [ACK] Seq=1 Ack=1 Win=42340 Len=0;
199;Jan 13, 2022 18:25:12.326162875 CET;192.168.1.102;192.168.1.104;51944;1883;108;Connect Command;
200;Jan 13, 2022 18:25:12.460567317 CET;192.168.1.102;192.168.1.104;51942;1883;75;[TCP Retransmission] 51942 → 1883 [FIN, PSH, ACK] Seq=55 Ack=5 Win=42336 Len=21;
201;Jan 13, 2022 18:25:12.716594830 CET;192.168.1.102;192.168.1.104;51936;1883;108;[TCP Spurious Retransmission] , Connect Command;
202;Jan 13, 2022 18:25:13.480123051 CET;192.168.1.104;192.168.1.102;1883;51942;54;1883 → 51942 [FIN, ACK] Seq=5 Ack=77 Win=8192 Len=0;
203;Jan 13, 2022 18:25:13.480182766 CET;192.168.1.102;192.168.1.104;51942;1883;54;51942 → 1883 [ACK] Seq=77 Ack=6 Win=42335 Len=0;
204;Jan 13, 2022 18:25:15.533026047 CET;192.168.1.102;192.168.1.104;51944;1883;108;[TCP Retransmission] 51944 → 1883 [PSH, ACK] Seq=1 Ack=1 Win=42340 Len=54;
205;Jan 13, 2022 18:25:16.543085006 CET;192.168.1.104;192.168.1.102;1883;51944;54;1883 → 51944 [ACK] Seq=1 Ack=55 Win=8192 Len=0;
206;Jan 13, 2022 18:25:16.546087297 CET;192.168.1.104;192.168.1.102;1883;51944;58;Connect Ack;
207;Jan 13, 2022 18:25:16.546097860 CET;192.168.1.102;192.168.1.104;51944;1883;54;51944 → 1883 [ACK] Seq=55 Ack=5 Win=42336 Len=0;
208;Jan 13, 2022 18:25:16.546157452 CET;192.168.1.102;192.168.1.104;51944;1883;73;Publish Message [topic];message015
209;Jan 13, 2022 18:25:16.546173471 CET;192.168.1.102;192.168.1.104;51944;1883;56;Disconnect Req;
210;Jan 13, 2022 18:25:21.553599590 CET;192.168.1.102;192.168.1.104;51946;1883;74;51946 → 1883 [SYN] Seq=0 Win=42340 Len=0 MSS=1460 SACK_PERM=1 TSval=1806826449 TSecr=0 WS=512;
211;Jan 13, 2022 18:25:22.562618838 CET;192.168.1.104;192.168.1.102;1883;51946;58;1883 → 51946 [SYN, ACK] Seq=0 Ack=1 Win=8192 Len=0 MSS=1460;
212;Jan 13, 2022 18:25:22.562652389 CET;192.168.1.102;192.168.1.104;51946;1883;54;51946 → 1883 [ACK] Seq=1 Ack=1 Win=42340 Len=0;
213;Jan 13, 2022 18:25:22.562700978 CET;192.168.1.102;192.168.1.104;51946;1883;108;Connect Command;
214;Jan 13, 2022 18:25:22.700530398 CET;192.168.1.102;192.168.1.104;51944;1883;75;[TCP Retransmission] 51944 → 1883 [FIN, PSH, ACK] Seq=55 Ack=5 Win=42336 Len=21;
215;Jan 13, 2022 18:25:23.720932586 CET;192.168.1.104;192.168.1.102;1883;51944;54;1883 → 51944 [FIN, ACK] Seq=5 Ack=77 Win=8192 Len=0;
216;Jan 13, 2022 18:25:23.720959897 CET;192.168.1.102;192.168.1.104;51944;1883;54;51944 → 1883 [ACK] Seq=77 Ack=6 Win=42335 Len=0;
217;Jan 13, 2022 18:25:25.773264808 CET;192.168.1.102;192.168.1.104;51946;1883;108;[TCP Retransmission] 51946 → 1883 [PSH, ACK] Seq=1 Ack=1 Win=42340 Len=54;
218;Jan 13, 2022 18:25:26.782961625 CET;192.168.1.104;192.168.1.102;1883;51946;54;1883 → 51946 [ACK] Seq=1 Ack=55 Win=8192 Len=0;
219;Jan 13, 2022 18:25:26.791536117 CET;192.168.1.104;192.168.1.102;1883;51946;58;Connect Ack;
220;Jan 13, 2022 18:25:26.791546239 CET;192.168.1.102;192.168.1.104;51946;1883;54;51946 → 1883 [ACK] Seq=55 Ack=5 Win=42336 Len=0;
221;Jan 13, 2022 18:25:26.791595322 CET;192.168.1.102;192.168.1.104;51946;1883;73;Publish Message [topic];message016
222;Jan 13, 2022 18:25:26.791608630 CET;192.168.1.102;192.168.1.104;51946;1883;56;Disconnect Req;
223;Jan 13, 2022 18:25:31.798954287 CET;192.168.1.102;192.168.1.104;51948;1883;74;51948 → 1883 [SYN] Seq=0 Win=42340 Len=0 MSS=1460 SACK_PERM=1 TSval=1806836695 TSecr=0 WS=512;
224;Jan 13, 2022 18:25:32.812608046 CET;192.168.1.102;192.168.1.104;51948;1883;74;[TCP Retransmission] 51948 → 1883 [SYN] Seq=0 Win=42340 Len=0 MSS=1460 SACK_PERM=1 TSval=1806837708 TSecr=0 WS=512;
225;Jan 13, 2022 18:25:32.940568467 CET;192.168.1.102;192.168.1.104;51946;1883;75;[TCP Retransmission] 51946 → 1883 [FIN, PSH, ACK] Seq=55 Ack=5 Win=42336 Len=21;
226;Jan 13, 2022 18:25:33.827971473 CET;192.168.1.104;192.168.1.102;1883;51948;58;1883 → 51948 [SYN, ACK] Seq=0 Ack=1 Win=8192 Len=0 MSS=1460;
227;Jan 13, 2022 18:25:33.828049191 CET;192.168.1.102;192.168.1.104;51948;1883;54;51948 → 1883 [ACK] Seq=1 Ack=1 Win=42340 Len=0;
228;Jan 13, 2022 18:25:33.828179554 CET;192.168.1.102;192.168.1.104;51948;1883;108;Connect Command;
229;Jan 13, 2022 18:25:33.959731302 CET;192.168.1.104;192.168.1.102;1883;51946;54;1883 → 51946 [FIN, ACK] Seq=5 Ack=77 Win=8192 Len=0;
230;Jan 13, 2022 18:25:33.959793655 CET;192.168.1.102;192.168.1.104;51946;1883;54;51946 → 1883 [ACK] Seq=77 Ack=6 Win=42335 Len=0;
231;Jan 13, 2022 18:25:37.036569216 CET;192.168.1.102;192.168.1.104;51948;1883;108;[TCP Retransmission] 51948 → 1883 [PSH, ACK] Seq=1 Ack=1 Win=42340 Len=54;
232;Jan 13, 2022 18:25:38.050124549 CET;192.168.1.104;192.168.1.102;1883;51948;54;1883 → 51948 [ACK] Seq=1 Ack=55 Win=8192 Len=0;
233;Jan 13, 2022 18:25:38.052873674 CET;192.168.1.104;192.168.1.102;1883;51948;58;Connect Ack;
234;Jan 13, 2022 18:25:38.052919211 CET;192.168.1.102;192.168.1.104;51948;1883;54;51948 → 1883 [ACK] Seq=55 Ack=5 Win=42336 Len=0;
235;Jan 13, 2022 18:25:38.053073598 CET;192.168.1.102;192.168.1.104;51948;1883;73;Publish Message [topic];message017
236;Jan 13, 2022 18:25:38.053124758 CET;192.168.1.102;192.168.1.104;51948;1883;56;Disconnect Req;
237;Jan 13, 2022 18:25:43.063423270 CET;192.168.1.102;192.168.1.104;51950;1883;74;51950 → 1883 [SYN] Seq=0 Win=42340 Len=0 MSS=1460 SACK_PERM=1 TSval=1806847959 TSecr=0 WS=512;
238;Jan 13, 2022 18:25:44.077208304 CET;192.168.1.102;192.168.1.104;51950;1883;74;[TCP Retransmission] 51950 → 1883 [SYN] Seq=0 Win=42340 Len=0 MSS=1460 SACK_PERM=1 TSval=1806848973 TSecr=0 WS=512;
239;Jan 13, 2022 18:25:44.083562059 CET;192.168.1.104;192.168.1.102;1883;51950;58;1883 → 51950 [SYN, ACK] Seq=0 Ack=1 Win=8192 Len=0 MSS=1460;
240;Jan 13, 2022 18:25:44.083617809 CET;192.168.1.102;192.168.1.104;51950;1883;54;51950 → 1883 [ACK] Seq=1 Ack=1 Win=42340 Len=0;
241;Jan 13, 2022 18:25:44.083712411 CET;192.168.1.102;192.168.1.104;51950;1883;108;Connect Command;
242;Jan 13, 2022 18:25:44.204566997 CET;192.168.1.102;192.168.1.104;51948;1883;75;[TCP Retransmission] 51948 → 1883 [FIN, PSH, ACK] Seq=55 Ack=5 Win=42336 Len=21;
243;Jan 13, 2022 18:25:45.085197330 CET;192.168.1.104;192.168.1.102;1883;51950;58;[TCP Retransmission] [TCP Port numbers reused] 1883 → 51950 [SYN, ACK] Seq=3266381453 Ack=1 Win=8192 Len=0 MSS=1460;
244;Jan 13, 2022 18:25:45.085244562 CET;192.168.1.102;192.168.1.104;51950;1883;54;[TCP Dup ACK 240#1] 51950 → 1883 [ACK] Seq=55 Ack=1 Win=42340 Len=0;
245;Jan 13, 2022 18:25:45.225601363 CET;192.168.1.104;192.168.1.102;1883;51948;54;1883 → 51948 [FIN, ACK] Seq=5 Ack=77 Win=8192 Len=0;
246;Jan 13, 2022 18:25:45.225663234 CET;192.168.1.102;192.168.1.104;51948;1883;54;51948 → 1883 [ACK] Seq=77 Ack=6 Win=42335 Len=0;
247;Jan 13, 2022 18:25:47.276806935 CET;192.168.1.102;192.168.1.104;51950;1883;108;[TCP Retransmission] 51950 → 1883 [PSH, ACK] Seq=1 Ack=1 Win=42340 Len=54;
248;Jan 13, 2022 18:25:48.288044395 CET;192.168.1.104;192.168.1.102;1883;51950;54;1883 → 51950 [ACK] Seq=3266381454 Ack=55 Win=8192 Len=0;
249;Jan 13, 2022 18:25:48.288064703 CET;192.168.1.102;192.168.1.104;51950;1883;54;[TCP Dup ACK 240#2] 51950 → 1883 [ACK] Seq=55 Ack=1 Win=42340 Len=0;
250;Jan 13, 2022 18:25:48.292000882 CET;192.168.1.104;192.168.1.102;1883;51950;58;[TCP Spurious Retransmission] , Connect Ack;
251;Jan 13, 2022 18:25:48.292024085 CET;192.168.1.102;192.168.1.104;51950;1883;54;[TCP Dup ACK 240#3] 51950 → 1883 [ACK] Seq=55 Ack=1 Win=42340 Len=0;
252;Jan 13, 2022 18:25:53.420590488 CET;192.168.1.102;192.168.1.104;51950;1883;108;[TCP Spurious Retransmission] , Connect Command;
253;Jan 13, 2022 18:26:05.452591875 CET;192.168.1.102;192.168.1.104;51950;1883;108;[TCP Spurious Retransmission] , Connect Command;
254;Jan 13, 2022 18:26:30.540587645 CET;192.168.1.102;192.168.1.104;51950;1883;108;[TCP Spurious Retransmission] , Connect Command;
255;Jan 13, 2022 18:26:42.150263738 CET;192.168.1.102;192.168.1.104;51950;1883;54;51950 → 1883 [FIN, ACK] Seq=55 Ack=1 Win=42340 Len=0;
256;Jan 13, 2022 18:26:43.175061897 CET;192.168.1.104;192.168.1.102;1883;51950;54;[TCP Retransmission] 1883 → 51950 [FIN, ACK] Seq=3266381458 Ack=56 Win=8192 Len=0;
257;Jan 13, 2022 18:26:43.175076861 CET;192.168.1.102;192.168.1.104;51950;1883;54;[TCP Dup ACK 240#4] 51950 → 1883 [ACK] Seq=56 Ack=1 Win=42340 Len=0;
258;Jan 13, 2022 18:26:43.175330258 CET;192.168.1.104;192.168.1.102;1883;51950;54;[TCP ACKed unseen segment] [TCP Retransmission] 1883 → 51950 [FIN, ACK] Seq=3266381458 Ack=57 Win=8192 Len=0;
259;Jan 13, 2022 18:26:43.175336577 CET;192.168.1.102;192.168.1.104;51950;1883;54;[TCP Dup ACK 240#5] 51950 → 1883 [ACK] Seq=56 Ack=1 Win=42340 Len=0;
260;Jan 13, 2022 18:26:47.160671751 CET;192.168.1.102;192.168.1.104;51952;1883;74;51952 → 1883 [SYN] Seq=0 Win=42340 Len=0 MSS=1460 SACK_PERM=1 TSval=1806912056 TSecr=0 WS=512;
261;Jan 13, 2022 18:26:48.164526350 CET;192.168.1.104;192.168.1.102;1883;51952;58;1883 → 51952 [SYN, ACK] Seq=0 Ack=1 Win=8192 Len=0 MSS=1460;
262;Jan 13, 2022 18:26:48.164612900 CET;192.168.1.102;192.168.1.104;51952;1883;54;51952 → 1883 [ACK] Seq=1 Ack=1 Win=42340 Len=0;
263;Jan 13, 2022 18:26:48.164767247 CET;192.168.1.102;192.168.1.104;51952;1883;108;Connect Command;
264;Jan 13, 2022 18:26:51.276525528 CET;192.168.1.102;192.168.1.104;51952;1883;108;[TCP Retransmission] 51952 → 1883 [PSH, ACK] Seq=1 Ack=1 Win=42340 Len=54;
265;Jan 13, 2022 18:26:52.287729479 CET;192.168.1.104;192.168.1.102;1883;51952;54;1883 → 51952 [ACK] Seq=1 Ack=55 Win=8192 Len=0;
266;Jan 13, 2022 18:26:52.290653149 CET;192.168.1.104;192.168.1.102;1883;51952;58;Connect Ack;
267;Jan 13, 2022 18:26:52.290674821 CET;192.168.1.102;192.168.1.104;51952;1883;54;51952 → 1883 [ACK] Seq=55 Ack=5 Win=42336 Len=0;
268;Jan 13, 2022 18:26:52.290749210 CET;192.168.1.102;192.168.1.104;51952;1883;73;Publish Message [topic];message019
269;Jan 13, 2022 18:26:52.290769349 CET;192.168.1.102;192.168.1.104;51952;1883;56;Disconnect Req;
270;Jan 13, 2022 18:26:57.303304756 CET;192.168.1.102;192.168.1.104;51954;1883;74;51954 → 1883 [SYN] Seq=0 Win=42340 Len=0 MSS=1460 SACK_PERM=1 TSval=1806922199 TSecr=0 WS=512;
271;Jan 13, 2022 18:26:58.311698719 CET;192.168.1.104;192.168.1.102;1883;51954;58;1883 → 51954 [SYN, ACK] Seq=0 Ack=1 Win=8192 Len=0 MSS=1460;
272;Jan 13, 2022 18:26:58.311780530 CET;192.168.1.102;192.168.1.104;51954;1883;54;51954 → 1883 [ACK] Seq=1 Ack=1 Win=42340 Len=0;
273;Jan 13, 2022 18:26:58.311994085 CET;192.168.1.102;192.168.1.104;51954;1883;108;Connect Command;
274;Jan 13, 2022 18:26:58.444576319 CET;192.168.1.102;192.168.1.104;51952;1883;75;[TCP Retransmission] 51952 → 1883 [FIN, PSH, ACK] Seq=55 Ack=5 Win=42336 Len=21;
275;Jan 13, 2022 18:26:59.450512921 CET;192.168.1.104;192.168.1.102;1883;51952;54;1883 → 51952 [FIN, ACK] Seq=5 Ack=77 Win=8192 Len=0;
276;Jan 13, 2022 18:26:59.450568886 CET;192.168.1.102;192.168.1.104;51952;1883;54;51952 → 1883 [ACK] Seq=77 Ack=6 Win=42335 Len=0;
277;Jan 13, 2022 18:27:01.516713006 CET;192.168.1.102;192.168.1.104;51954;1883;108;[TCP Retransmission] 51954 → 1883 [PSH, ACK] Seq=1 Ack=1 Win=42340 Len=54;
278;Jan 13, 2022 18:27:02.536702671 CET;192.168.1.104;192.168.1.102;1883;51954;54;1883 → 51954 [ACK] Seq=1 Ack=55 Win=8192 Len=0;
279;Jan 13, 2022 18:27:02.544580800 CET;192.168.1.104;192.168.1.102;1883;51954;58;Connect Ack;
280;Jan 13, 2022 18:27:02.544623163 CET;192.168.1.102;192.168.1.104;51954;1883;54;51954 → 1883 [ACK] Seq=55 Ack=5 Win=42336 Len=0;
281;Jan 13, 2022 18:27:02.544826676 CET;192.168.1.102;192.168.1.104;51954;1883;73;Publish Message [topic];message020
282;Jan 13, 2022 18:27:02.544875513 CET;192.168.1.102;192.168.1.104;51954;1883;56;Disconnect Req;
283;Jan 13, 2022 18:27:07.555272282 CET;192.168.1.102;192.168.1.104;51956;1883;74;51956 → 1883 [SYN] Seq=0 Win=42340 Len=0 MSS=1460 SACK_PERM=1 TSval=1806932451 TSecr=0 WS=512;
284;Jan 13, 2022 18:27:08.557533087 CET;192.168.1.102;192.168.1.104;51956;1883;74;[TCP Retransmission] 51956 → 1883 [SYN] Seq=0 Win=42340 Len=0 MSS=1460 SACK_PERM=1 TSval=1806933453 TSecr=0 WS=512;
285;Jan 13, 2022 18:27:08.564901460 CET;192.168.1.104;192.168.1.102;1883;51956;58;1883 → 51956 [SYN, ACK] Seq=0 Ack=1 Win=8192 Len=0 MSS=1460;
286;Jan 13, 2022 18:27:08.564982608 CET;192.168.1.102;192.168.1.104;51956;1883;54;51956 → 1883 [ACK] Seq=1 Ack=1 Win=42340 Len=0;
287;Jan 13, 2022 18:27:08.565134092 CET;192.168.1.102;192.168.1.104;51956;1883;108;Connect Command;
288;Jan 13, 2022 18:27:08.684569068 CET;192.168.1.102;192.168.1.104;51954;1883;75;[TCP Retransmission] 51954 → 1883 [FIN, PSH, ACK] Seq=55 Ack=5 Win=42336 Len=21;
289;Jan 13, 2022 18:27:09.582221886 CET;192.168.1.104;192.168.1.102;1883;51956;58;[TCP Retransmission] [TCP Port numbers reused] 1883 → 51956 [SYN, ACK] Seq=3886555503 Ack=1 Win=8192 Len=0 MSS=1460;
290;Jan 13, 2022 18:27:09.582251001 CET;192.168.1.102;192.168.1.104;51956;1883;54;[TCP Dup ACK 286#1] 51956 → 1883 [ACK] Seq=55 Ack=1 Win=42340 Len=0;
291;Jan 13, 2022 18:27:09.697041622 CET;192.168.1.104;192.168.1.102;1883;51954;54;1883 → 51954 [FIN, ACK] Seq=5 Ack=77 Win=8192 Len=0;
292;Jan 13, 2022 18:27:09.697101876 CET;192.168.1.102;192.168.1.104;51954;1883;54;51954 → 1883 [ACK] Seq=77 Ack=6 Win=42335 Len=0;
293;Jan 13, 2022 18:27:11.756632214 CET;192.168.1.102;192.168.1.104;51956;1883;108;[TCP Retransmission] 51956 → 1883 [PSH, ACK] Seq=1 Ack=1 Win=42340 Len=54;
294;Jan 13, 2022 18:27:12.766431944 CET;192.168.1.104;192.168.1.102;1883;51956;54;1883 → 51956 [ACK] Seq=3886555504 Ack=55 Win=8192 Len=0;
