1;Jan 13, 2022 15:32:49.107780964 CET;192.168.1.102;192.168.1.104;49850;1883;74;49850 → 1883 [SYN] Seq=0 Win=42340 Len=0 MSS=1460 SACK_PERM=1 TSval=1796474003 TSecr=0 WS=512;
2;Jan 13, 2022 15:32:49.321750966 CET;192.168.1.104;192.168.1.102;1883;49850;58;1883 → 49850 [SYN, ACK] Seq=0 Ack=1 Win=8192 Len=0 MSS=1460;
3;Jan 13, 2022 15:32:49.321782838 CET;192.168.1.102;192.168.1.104;49850;1883;54;49850 → 1883 [ACK] Seq=1 Ack=1 Win=42340 Len=0;
4;Jan 13, 2022 15:32:49.321883186 CET;192.168.1.102;192.168.1.104;49850;1883;108;Connect Command;
5;Jan 13, 2022 15:32:49.996566937 CET;192.168.1.102;192.168.1.104;49850;1883;108;[TCP Retransmission] 49850 → 1883 [PSH, ACK] Seq=1 Ack=1 Win=42340 Len=54;
6;Jan 13, 2022 15:32:50.104702226 CET;192.168.1.104;192.168.1.102;1883;49850;54;1883 → 49850 [ACK] Seq=1 Ack=55 Win=8192 Len=0;
7;Jan 13, 2022 15:32:50.108864840 CET;192.168.1.104;192.168.1.102;1883;49850;58;Connect Ack;
8;Jan 13, 2022 15:32:50.108892700 CET;192.168.1.102;192.168.1.104;49850;1883;54;49850 → 1883 [ACK] Seq=55 Ack=5 Win=42336 Len=0;
9;Jan 13, 2022 15:32:50.108939605 CET;192.168.1.102;192.168.1.104;49850;1883;73;Publish Message [topic];message001
10;Jan 13, 2022 15:32:50.108952828 CET;192.168.1.102;192.168.1.104;49850;1883;56;Disconnect Req;
11;Jan 13, 2022 15:32:51.404617437 CET;192.168.1.102;192.168.1.104;49850;1883;75;[TCP Retransmission] 49850 → 1883 [FIN, PSH, ACK] Seq=55 Ack=5 Win=42336 Len=21;
12;Jan 13, 2022 15:32:51.523826241 CET;192.168.1.104;192.168.1.102;1883;49850;54;1883 → 49850 [FIN, ACK] Seq=5 Ack=77 Win=8192 Len=0;
13;Jan 13, 2022 15:32:51.523850849 CET;192.168.1.102;192.168.1.104;49850;1883;54;49850 → 1883 [ACK] Seq=77 Ack=6 Win=42335 Len=0;
14;Jan 13, 2022 15:32:55.114718552 CET;192.168.1.102;192.168.1.104;49852;1883;74;49852 → 1883 [SYN] Seq=0 Win=42340 Len=0 MSS=1460 SACK_PERM=1 TSval=1796480010 TSecr=0 WS=512;
15;Jan 13, 2022 15:32:55.239490016 CET;192.168.1.104;192.168.1.102;1883;49852;58;1883 → 49852 [SYN, ACK] Seq=0 Ack=1 Win=8192 Len=0 MSS=1460;
16;Jan 13, 2022 15:32:55.239524619 CET;192.168.1.102;192.168.1.104;49852;1883;54;49852 → 1883 [ACK] Seq=1 Ack=1 Win=42340 Len=0;
17;Jan 13, 2022 15:32:55.239577493 CET;192.168.1.102;192.168.1.104;49852;1883;108;Connect Command;
18;Jan 13, 2022 15:32:55.629255112 CET;192.168.1.102;192.168.1.104;49852;1883;108;[TCP Retransmission] 49852 → 1883 [PSH, ACK] Seq=1 Ack=1 Win=42340 Len=54;
19;Jan 13, 2022 15:32:55.747272152 CET;192.168.1.104;192.168.1.102;1883;49852;54;1883 → 49852 [ACK] Seq=1 Ack=55 Win=8192 Len=0;
20;Jan 13, 2022 15:32:55.752859323 CET;192.168.1.104;192.168.1.102;1883;49852;58;Connect Ack;
21;Jan 13, 2022 15:32:55.752877982 CET;192.168.1.102;192.168.1.104;49852;1883;54;49852 → 1883 [ACK] Seq=55 Ack=5 Win=42336 Len=0;
22;Jan 13, 2022 15:32:55.752938810 CET;192.168.1.102;192.168.1.104;49852;1883;73;Publish Message [topic];message002
23;Jan 13, 2022 15:32:55.752953863 CET;192.168.1.102;192.168.1.104;49852;1883;56;Disconnect Req;
24;Jan 13, 2022 15:32:56.524583923 CET;192.168.1.102;192.168.1.104;49852;1883;75;[TCP Retransmission] 49852 → 1883 [FIN, PSH, ACK] Seq=55 Ack=5 Win=42336 Len=21;
25;Jan 13, 2022 15:32:56.643799539 CET;192.168.1.104;192.168.1.102;1883;49852;54;1883 → 49852 [FIN, ACK] Seq=5 Ack=77 Win=8192 Len=0;
26;Jan 13, 2022 15:32:56.643823345 CET;192.168.1.102;192.168.1.104;49852;1883;54;49852 → 1883 [ACK] Seq=77 Ack=6 Win=42335 Len=0;
27;Jan 13, 2022 15:33:00.767032665 CET;192.168.1.102;192.168.1.104;49854;1883;74;49854 → 1883 [SYN] Seq=0 Win=42340 Len=0 MSS=1460 SACK_PERM=1 TSval=1796485663 TSecr=0 WS=512;
28;Jan 13, 2022 15:33:00.879825849 CET;192.168.1.104;192.168.1.102;1883;49854;58;1883 → 49854 [SYN, ACK] Seq=0 Ack=1 Win=8192 Len=0 MSS=1460;
29;Jan 13, 2022 15:33:00.879857641 CET;192.168.1.102;192.168.1.104;49854;1883;54;49854 → 1883 [ACK] Seq=1 Ack=1 Win=42340 Len=0;
30;Jan 13, 2022 15:33:00.879901839 CET;192.168.1.102;192.168.1.104;49854;1883;108;Connect Command;
31;Jan 13, 2022 15:33:01.228515264 CET;192.168.1.102;192.168.1.104;49854;1883;108;[TCP Retransmission] 49854 → 1883 [PSH, ACK] Seq=1 Ack=1 Win=42340 Len=54;
32;Jan 13, 2022 15:33:01.350668703 CET;192.168.1.104;192.168.1.102;1883;49854;54;1883 → 49854 [ACK] Seq=1 Ack=55 Win=8192 Len=0;
33;Jan 13, 2022 15:33:01.357209104 CET;192.168.1.104;192.168.1.102;1883;49854;58;Connect Ack;
34;Jan 13, 2022 15:33:01.357229230 CET;192.168.1.102;192.168.1.104;49854;1883;54;49854 → 1883 [ACK] Seq=55 Ack=5 Win=42336 Len=0;
35;Jan 13, 2022 15:33:01.357295291 CET;192.168.1.102;192.168.1.104;49854;1883;73;Publish Message [topic];message003
36;Jan 13, 2022 15:33:01.357312930 CET;192.168.1.102;192.168.1.104;49854;1883;56;Disconnect Req;
37;Jan 13, 2022 15:33:02.060524611 CET;192.168.1.102;192.168.1.104;49854;1883;75;[TCP Retransmission] 49854 → 1883 [FIN, PSH, ACK] Seq=55 Ack=5 Win=42336 Len=21;
38;Jan 13, 2022 15:33:02.163840487 CET;192.168.1.104;192.168.1.102;1883;49854;54;1883 → 49854 [FIN, ACK] Seq=5 Ack=77 Win=8192 Len=0;
39;Jan 13, 2022 15:33:02.163865143 CET;192.168.1.102;192.168.1.104;49854;1883;54;49854 → 1883 [ACK] Seq=77 Ack=6 Win=42335 Len=0;
40;Jan 13, 2022 15:33:06.370490246 CET;192.168.1.102;192.168.1.104;49856;1883;74;49856 → 1883 [SYN] Seq=0 Win=42340 Len=0 MSS=1460 SACK_PERM=1 TSval=1796491266 TSecr=0 WS=512;
41;Jan 13, 2022 15:33:06.474511626 CET;192.168.1.104;192.168.1.102;1883;49856;58;1883 → 49856 [SYN, ACK] Seq=0 Ack=1 Win=8192 Len=0 MSS=1460;
42;Jan 13, 2022 15:33:06.474543218 CET;192.168.1.102;192.168.1.104;49856;1883;54;49856 → 1883 [ACK] Seq=1 Ack=1 Win=42340 Len=0;
43;Jan 13, 2022 15:33:06.474594504 CET;192.168.1.102;192.168.1.104;49856;1883;108;Connect Command;
44;Jan 13, 2022 15:33:06.796575577 CET;192.168.1.102;192.168.1.104;49856;1883;108;[TCP Retransmission] 49856 → 1883 [PSH, ACK] Seq=1 Ack=1 Win=42340 Len=54;
45;Jan 13, 2022 15:33:06.913050157 CET;192.168.1.104;192.168.1.102;1883;49856;54;1883 → 49856 [ACK] Seq=1 Ack=55 Win=8192 Len=0;
46;Jan 13, 2022 15:33:06.918370593 CET;192.168.1.104;192.168.1.102;1883;49856;58;Connect Ack;
47;Jan 13, 2022 15:33:06.918390061 CET;192.168.1.102;192.168.1.104;49856;1883;54;49856 → 1883 [ACK] Seq=55 Ack=5 Win=42336 Len=0;
48;Jan 13, 2022 15:33:06.918455292 CET;192.168.1.102;192.168.1.104;49856;1883;73;Publish Message [topic];message004
49;Jan 13, 2022 15:33:06.918472310 CET;192.168.1.102;192.168.1.104;49856;1883;56;Disconnect Req;
50;Jan 13, 2022 15:33:07.564749504 CET;192.168.1.102;192.168.1.104;49856;1883;75;[TCP Retransmission] 49856 → 1883 [FIN, PSH, ACK] Seq=55 Ack=5 Win=42336 Len=21;
51;Jan 13, 2022 15:33:07.674625241 CET;192.168.1.104;192.168.1.102;1883;49856;54;1883 → 49856 [FIN, ACK] Seq=5 Ack=77 Win=8192 Len=0;
52;Jan 13, 2022 15:33:07.674648697 CET;192.168.1.102;192.168.1.104;49856;1883;54;49856 → 1883 [ACK] Seq=77 Ack=6 Win=42335 Len=0;
53;Jan 13, 2022 15:33:11.935185435 CET;192.168.1.102;192.168.1.104;49858;1883;74;49858 → 1883 [SYN] Seq=0 Win=42340 Len=0 MSS=1460 SACK_PERM=1 TSval=1796496831 TSecr=0 WS=512;
54;Jan 13, 2022 15:33:12.038633274 CET;192.168.1.104;192.168.1.102;1883;49858;58;1883 → 49858 [SYN, ACK] Seq=0 Ack=1 Win=8192 Len=0 MSS=1460;
55;Jan 13, 2022 15:33:12.038663184 CET;192.168.1.102;192.168.1.104;49858;1883;54;49858 → 1883 [ACK] Seq=1 Ack=1 Win=42340 Len=0;
56;Jan 13, 2022 15:33:12.038709844 CET;192.168.1.102;192.168.1.104;49858;1883;108;Connect Command;
57;Jan 13, 2022 15:33:12.364520160 CET;192.168.1.102;192.168.1.104;49858;1883;108;[TCP Retransmission] 49858 → 1883 [PSH, ACK] Seq=1 Ack=1 Win=42340 Len=54;
58;Jan 13, 2022 15:33:12.471979723 CET;192.168.1.104;192.168.1.102;1883;49858;54;1883 → 49858 [ACK] Seq=1 Ack=55 Win=8192 Len=0;
59;Jan 13, 2022 15:33:12.475009972 CET;192.168.1.104;192.168.1.102;1883;49858;58;Connect Ack;
60;Jan 13, 2022 15:33:12.475018059 CET;192.168.1.102;192.168.1.104;49858;1883;54;49858 → 1883 [ACK] Seq=55 Ack=5 Win=42336 Len=0;
61;Jan 13, 2022 15:33:12.475053908 CET;192.168.1.102;192.168.1.104;49858;1883;73;Publish Message [topic];message005
62;Jan 13, 2022 15:33:12.475065981 CET;192.168.1.102;192.168.1.104;49858;1883;56;Disconnect Req;
63;Jan 13, 2022 15:33:13.100798964 CET;192.168.1.102;192.168.1.104;49858;1883;75;[TCP Retransmission] 49858 → 1883 [FIN, PSH, ACK] Seq=55 Ack=5 Win=42336 Len=21;
64;Jan 13, 2022 15:33:13.217243606 CET;192.168.1.104;192.168.1.102;1883;49858;54;1883 → 49858 [FIN, ACK] Seq=5 Ack=77 Win=8192 Len=0;
65;Jan 13, 2022 15:33:13.217267874 CET;192.168.1.102;192.168.1.104;49858;1883;54;49858 → 1883 [ACK] Seq=77 Ack=6 Win=42335 Len=0;
66;Jan 13, 2022 15:33:17.486787302 CET;192.168.1.102;192.168.1.104;49860;1883;74;49860 → 1883 [SYN] Seq=0 Win=42340 Len=0 MSS=1460 SACK_PERM=1 TSval=1796502382 TSecr=0 WS=512;
67;Jan 13, 2022 15:33:17.603999025 CET;192.168.1.104;192.168.1.102;1883;49860;58;1883 → 49860 [SYN, ACK] Seq=0 Ack=1 Win=8192 Len=0 MSS=1460;
68;Jan 13, 2022 15:33:17.604035263 CET;192.168.1.102;192.168.1.104;49860;1883;54;49860 → 1883 [ACK] Seq=1 Ack=1 Win=42340 Len=0;
69;Jan 13, 2022 15:33:17.604085908 CET;192.168.1.102;192.168.1.104;49860;1883;108;Connect Command;
70;Jan 13, 2022 15:33:17.964723733 CET;192.168.1.102;192.168.1.104;49860;1883;108;[TCP Retransmission] 49860 → 1883 [PSH, ACK] Seq=1 Ack=1 Win=42340 Len=54;
71;Jan 13, 2022 15:33:18.068417707 CET;192.168.1.104;192.168.1.102;1883;49860;54;1883 → 49860 [ACK] Seq=1 Ack=55 Win=8192 Len=0;
72;Jan 13, 2022 15:33:18.073874125 CET;192.168.1.104;192.168.1.102;1883;49860;58;Connect Ack;
73;Jan 13, 2022 15:33:18.073892121 CET;192.168.1.102;192.168.1.104;49860;1883;54;49860 → 1883 [ACK] Seq=55 Ack=5 Win=42336 Len=0;
74;Jan 13, 2022 15:33:18.073950866 CET;192.168.1.102;192.168.1.104;49860;1883;73;Publish Message [topic];message006
75;Jan 13, 2022 15:33:18.073966788 CET;192.168.1.102;192.168.1.104;49860;1883;56;Disconnect Req;
76;Jan 13, 2022 15:33:18.796572516 CET;192.168.1.102;192.168.1.104;49860;1883;75;[TCP Retransmission] 49860 → 1883 [FIN, PSH, ACK] Seq=55 Ack=5 Win=42336 Len=21;
77;Jan 13, 2022 15:33:18.901064449 CET;192.168.1.104;192.168.1.102;1883;49860;54;1883 → 49860 [FIN, ACK] Seq=5 Ack=77 Win=8192 Len=0;
78;Jan 13, 2022 15:33:18.901088993 CET;192.168.1.102;192.168.1.104;49860;1883;54;49860 → 1883 [ACK] Seq=77 Ack=6 Win=42335 Len=0;
79;Jan 13, 2022 15:33:23.077774040 CET;192.168.1.102;192.168.1.104;49862;1883;74;49862 → 1883 [SYN] Seq=0 Win=42340 Len=0 MSS=1460 SACK_PERM=1 TSval=1796507973 TSecr=0 WS=512;
80;Jan 13, 2022 15:33:23.195211660 CET;192.168.1.104;192.168.1.102;1883;49862;58;1883 → 49862 [SYN, ACK] Seq=0 Ack=1 Win=8192 Len=0 MSS=1460;
81;Jan 13, 2022 15:33:23.195248023 CET;192.168.1.102;192.168.1.104;49862;1883;54;49862 → 1883 [ACK] Seq=1 Ack=1 Win=42340 Len=0;
82;Jan 13, 2022 15:33:23.195301493 CET;192.168.1.102;192.168.1.104;49862;1883;108;Connect Command;
83;Jan 13, 2022 15:33:23.564548281 CET;192.168.1.102;192.168.1.104;49862;1883;108;[TCP Retransmission] 49862 → 1883 [PSH, ACK] Seq=1 Ack=1 Win=42340 Len=54;
84;Jan 13, 2022 15:33:23.687792365 CET;192.168.1.104;192.168.1.102;1883;49862;54;1883 → 49862 [ACK] Seq=1 Ack=55 Win=8192 Len=0;
85;Jan 13, 2022 15:33:23.694106642 CET;192.168.1.104;192.168.1.102;1883;49862;58;Connect Ack;
86;Jan 13, 2022 15:33:23.694124815 CET;192.168.1.102;192.168.1.104;49862;1883;54;49862 → 1883 [ACK] Seq=55 Ack=5 Win=42336 Len=0;
87;Jan 13, 2022 15:33:23.694183048 CET;192.168.1.102;192.168.1.104;49862;1883;73;Publish Message [topic];message007
88;Jan 13, 2022 15:33:23.694198436 CET;192.168.1.102;192.168.1.104;49862;1883;56;Disconnect Req;
89;Jan 13, 2022 15:33:24.428552988 CET;192.168.1.102;192.168.1.104;49862;1883;75;[TCP Retransmission] 49862 → 1883 [FIN, PSH, ACK] Seq=55 Ack=5 Win=42336 Len=21;
90;Jan 13, 2022 15:33:24.546154346 CET;192.168.1.104;192.168.1.102;1883;49862;54;1883 → 49862 [FIN, ACK] Seq=5 Ack=77 Win=8192 Len=0;
91;Jan 13, 2022 15:33:24.546177777 CET;192.168.1.102;192.168.1.104;49862;1883;54;49862 → 1883 [ACK] Seq=77 Ack=6 Win=42335 Len=0;
92;Jan 13, 2022 15:33:28.707526015 CET;192.168.1.102;192.168.1.104;49864;1883;74;49864 → 1883 [SYN] Seq=0 Win=42340 Len=0 MSS=1460 SACK_PERM=1 TSval=1796513603 TSecr=0 WS=512;
93;Jan 13, 2022 15:33:28.811345833 CET;192.168.1.104;192.168.1.102;1883;49864;58;1883 → 49864 [SYN, ACK] Seq=0 Ack=1 Win=8192 Len=0 MSS=1460;
94;Jan 13, 2022 15:33:28.811377245 CET;192.168.1.102;192.168.1.104;49864;1883;54;49864 → 1883 [ACK] Seq=1 Ack=1 Win=42340 Len=0;
95;Jan 13, 2022 15:33:28.811420221 CET;192.168.1.102;192.168.1.104;49864;1883;108;Connect Command;
96;Jan 13, 2022 15:33:29.132514699 CET;192.168.1.102;192.168.1.104;49864;1883;108;[TCP Retransmission] 49864 → 1883 [PSH, ACK] Seq=1 Ack=1 Win=42340 Len=54;
97;Jan 13, 2022 15:33:29.238465260 CET;192.168.1.104;192.168.1.102;1883;49864;54;1883 → 49864 [ACK] Seq=1 Ack=55 Win=8192 Len=0;
98;Jan 13, 2022 15:33:29.244180660 CET;192.168.1.104;192.168.1.102;1883;49864;58;Connect Ack;
99;Jan 13, 2022 15:33:29.244202568 CET;192.168.1.102;192.168.1.104;49864;1883;54;49864 → 1883 [ACK] Seq=55 Ack=5 Win=42336 Len=0;
100;Jan 13, 2022 15:33:29.244275510 CET;192.168.1.102;192.168.1.104;49864;1883;73;Publish Message [topic];message008
101;Jan 13, 2022 15:33:29.244296037 CET;192.168.1.102;192.168.1.104;49864;1883;56;Disconnect Req;
102;Jan 13, 2022 15:33:29.868726958 CET;192.168.1.102;192.168.1.104;49864;1883;75;[TCP Retransmission] 49864 → 1883 [FIN, PSH, ACK] Seq=55 Ack=5 Win=42336 Len=21;
103;Jan 13, 2022 15:33:29.987352680 CET;192.168.1.104;192.168.1.102;1883;49864;54;1883 → 49864 [FIN, ACK] Seq=5 Ack=77 Win=8192 Len=0;
104;Jan 13, 2022 15:33:29.987375784 CET;192.168.1.102;192.168.1.104;49864;1883;54;49864 → 1883 [ACK] Seq=77 Ack=6 Win=42335 Len=0;
105;Jan 13, 2022 15:33:34.259059264 CET;192.168.1.102;192.168.1.104;49866;1883;74;49866 → 1883 [SYN] Seq=0 Win=42340 Len=0 MSS=1460 SACK_PERM=1 TSval=1796519155 TSecr=0 WS=512;
106;Jan 13, 2022 15:33:34.381130502 CET;192.168.1.104;192.168.1.102;1883;49866;58;1883 → 49866 [SYN, ACK] Seq=0 Ack=1 Win=8192 Len=0 MSS=1460;
107;Jan 13, 2022 15:33:34.381158413 CET;192.168.1.102;192.168.1.104;49866;1883;54;49866 → 1883 [ACK] Seq=1 Ack=1 Win=42340 Len=0;
108;Jan 13, 2022 15:33:34.381200302 CET;192.168.1.102;192.168.1.104;49866;1883;108;Connect Command;
109;Jan 13, 2022 15:33:34.764581408 CET;192.168.1.102;192.168.1.104;49866;1883;108;[TCP Retransmission] 49866 → 1883 [PSH, ACK] Seq=1 Ack=1 Win=42340 Len=54;
110;Jan 13, 2022 15:33:34.869945146 CET;192.168.1.104;192.168.1.102;1883;49866;54;1883 → 49866 [ACK] Seq=1 Ack=55 Win=8192 Len=0;
111;Jan 13, 2022 15:33:34.874049046 CET;192.168.1.104;192.168.1.102;1883;49866;58;Connect Ack;
112;Jan 13, 2022 15:33:34.874069709 CET;192.168.1.102;192.168.1.104;49866;1883;54;49866 → 1883 [ACK] Seq=55 Ack=5 Win=42336 Len=0;
113;Jan 13, 2022 15:33:34.874138764 CET;192.168.1.102;192.168.1.104;49866;1883;73;Publish Message [topic];message009
114;Jan 13, 2022 15:33:34.874158039 CET;192.168.1.102;192.168.1.104;49866;1883;56;Disconnect Req;
115;Jan 13, 2022 15:33:35.628898723 CET;192.168.1.102;192.168.1.104;49866;1883;75;[TCP Retransmission] 49866 → 1883 [FIN, PSH, ACK] Seq=55 Ack=5 Win=42336 Len=21;
116;Jan 13, 2022 15:33:35.772446713 CET;192.168.1.104;192.168.1.102;1883;49866;54;1883 → 49866 [FIN, ACK] Seq=5 Ack=77 Win=8192 Len=0;
117;Jan 13, 2022 15:33:35.772471028 CET;192.168.1.102;192.168.1.104;49866;1883;54;49866 → 1883 [ACK] Seq=77 Ack=6 Win=42335 Len=0;
118;Jan 13, 2022 15:33:39.890877952 CET;192.168.1.102;192.168.1.104;49868;1883;74;49868 → 1883 [SYN] Seq=0 Win=42340 Len=0 MSS=1460 SACK_PERM=1 TSval=1796524787 TSecr=0 WS=512;
119;Jan 13, 2022 15:33:39.994069968 CET;192.168.1.104;192.168.1.102;1883;49868;58;1883 → 49868 [SYN, ACK] Seq=0 Ack=1 Win=8192 Len=0 MSS=1460;
120;Jan 13, 2022 15:33:39.994103534 CET;192.168.1.102;192.168.1.104;49868;1883;54;49868 → 1883 [ACK] Seq=1 Ack=1 Win=42340 Len=0;
121;Jan 13, 2022 15:33:39.994155108 CET;192.168.1.102;192.168.1.104;49868;1883;108;Connect Command;
122;Jan 13, 2022 15:33:40.332617563 CET;192.168.1.102;192.168.1.104;49868;1883;108;[TCP Retransmission] 49868 → 1883 [PSH, ACK] Seq=1 Ack=1 Win=42340 Len=54;
123;Jan 13, 2022 15:33:40.442021012 CET;192.168.1.104;192.168.1.102;1883;49868;54;1883 → 49868 [ACK] Seq=1 Ack=55 Win=8192 Len=0;
124;Jan 13, 2022 15:33:40.444603332 CET;192.168.1.104;192.168.1.102;1883;49868;58;Connect Ack;
125;Jan 13, 2022 15:33:40.444618386 CET;192.168.1.102;192.168.1.104;49868;1883;54;49868 → 1883 [ACK] Seq=55 Ack=5 Win=42336 Len=0;
126;Jan 13, 2022 15:33:40.444665804 CET;192.168.1.102;192.168.1.104;49868;1883;73;Publish Message [topic];message010
127;Jan 13, 2022 15:33:40.444680282 CET;192.168.1.102;192.168.1.104;49868;1883;56;Disconnect Req;
128;Jan 13, 2022 15:33:41.100548672 CET;192.168.1.102;192.168.1.104;49868;1883;75;[TCP Retransmission] 49868 → 1883 [FIN, PSH, ACK] Seq=55 Ack=5 Win=42336 Len=21;
129;Jan 13, 2022 15:33:41.221738023 CET;192.168.1.104;192.168.1.102;1883;49868;54;1883 → 49868 [FIN, ACK] Seq=5 Ack=77 Win=8192 Len=0;
130;Jan 13, 2022 15:33:41.221761504 CET;192.168.1.102;192.168.1.104;49868;1883;54;49868 → 1883 [ACK] Seq=77 Ack=6 Win=42335 Len=0;
131;Jan 13, 2022 15:33:45.457239100 CET;192.168.1.102;192.168.1.104;49870;1883;74;49870 → 1883 [SYN] Seq=0 Win=42340 Len=0 MSS=1460 SACK_PERM=1 TSval=1796530353 TSecr=0 WS=512;
132;Jan 13, 2022 15:33:45.576693098 CET;192.168.1.104;192.168.1.102;1883;49870;58;1883 → 49870 [SYN, ACK] Seq=0 Ack=1 Win=8192 Len=0 MSS=1460;
133;Jan 13, 2022 15:33:45.576725626 CET;192.168.1.102;192.168.1.104;49870;1883;54;49870 → 1883 [ACK] Seq=1 Ack=1 Win=42340 Len=0;
134;Jan 13, 2022 15:33:45.576769867 CET;192.168.1.102;192.168.1.104;49870;1883;108;Connect Command;
135;Jan 13, 2022 15:33:45.964583988 CET;192.168.1.102;192.168.1.104;49870;1883;108;[TCP Retransmission] 49870 → 1883 [PSH, ACK] Seq=1 Ack=1 Win=42340 Len=54;
136;Jan 13, 2022 15:33:46.084444556 CET;192.168.1.104;192.168.1.102;1883;49870;54;1883 → 49870 [ACK] Seq=1 Ack=55 Win=8192 Len=0;
137;Jan 13, 2022 15:33:46.092057088 CET;192.168.1.104;192.168.1.102;1883;49870;58;Connect Ack;
138;Jan 13, 2022 15:33:46.092089064 CET;192.168.1.102;192.168.1.104;49870;1883;54;49870 → 1883 [ACK] Seq=55 Ack=5 Win=42336 Len=0;
139;Jan 13, 2022 15:33:46.092148223 CET;192.168.1.102;192.168.1.104;49870;1883;73;Publish Message [topic];message011
140;Jan 13, 2022 15:33:46.092164955 CET;192.168.1.102;192.168.1.104;49870;1883;56;Disconnect Req;
141;Jan 13, 2022 15:33:46.828542250 CET;192.168.1.102;192.168.1.104;49870;1883;75;[TCP Retransmission] 49870 → 1883 [FIN, PSH, ACK] Seq=55 Ack=5 Win=42336 Len=21;
142;Jan 13, 2022 15:33:46.933060895 CET;192.168.1.104;192.168.1.102;1883;49870;54;1883 → 49870 [FIN, ACK] Seq=5 Ack=77 Win=8192 Len=0;
143;Jan 13, 2022 15:33:46.933084890 CET;192.168.1.102;192.168.1.104;49870;1883;54;49870 → 1883 [ACK] Seq=77 Ack=6 Win=42335 Len=0;
144;Jan 13, 2022 15:33:51.097195834 CET;192.168.1.102;192.168.1.104;49872;1883;74;49872 → 1883 [SYN] Seq=0 Win=42340 Len=0 MSS=1460 SACK_PERM=1 TSval=1796535993 TSecr=0 WS=512;
145;Jan 13, 2022 15:33:51.217135417 CET;192.168.1.104;192.168.1.102;1883;49872;58;1883 → 49872 [SYN, ACK] Seq=0 Ack=1 Win=8192 Len=0 MSS=1460;
146;Jan 13, 2022 15:33:51.217159866 CET;192.168.1.102;192.168.1.104;49872;1883;54;49872 → 1883 [ACK] Seq=1 Ack=1 Win=42340 Len=0;
147;Jan 13, 2022 15:33:51.217197858 CET;192.168.1.102;192.168.1.104;49872;1883;108;Connect Command;
148;Jan 13, 2022 15:33:51.596545079 CET;192.168.1.102;192.168.1.104;49872;1883;108;[TCP Retransmission] 49872 → 1883 [PSH, ACK] Seq=1 Ack=1 Win=42340 Len=54;
149;Jan 13, 2022 15:33:51.700580669 CET;192.168.1.104;192.168.1.102;1883;49872;54;1883 → 49872 [ACK] Seq=1 Ack=55 Win=8192 Len=0;
150;Jan 13, 2022 15:33:51.703513535 CET;192.168.1.104;192.168.1.102;1883;49872;58;Connect Ack;
151;Jan 13, 2022 15:33:51.703532923 CET;192.168.1.102;192.168.1.104;49872;1883;54;49872 → 1883 [ACK] Seq=55 Ack=5 Win=42336 Len=0;
152;Jan 13, 2022 15:33:51.703596866 CET;192.168.1.102;192.168.1.104;49872;1883;73;Publish Message [topic];message012
153;Jan 13, 2022 15:33:51.703614404 CET;192.168.1.102;192.168.1.104;49872;1883;56;Disconnect Req;
154;Jan 13, 2022 15:33:52.428611738 CET;192.168.1.102;192.168.1.104;49872;1883;75;[TCP Retransmission] 49872 → 1883 [FIN, PSH, ACK] Seq=55 Ack=5 Win=42336 Len=21;
155;Jan 13, 2022 15:33:52.533374103 CET;192.168.1.104;192.168.1.102;1883;49872;54;1883 → 49872 [FIN, ACK] Seq=5 Ack=77 Win=8192 Len=0;
156;Jan 13, 2022 15:33:52.533398842 CET;192.168.1.102;192.168.1.104;49872;1883;54;49872 → 1883 [ACK] Seq=77 Ack=6 Win=42335 Len=0;
157;Jan 13, 2022 15:33:56.709569399 CET;192.168.1.102;192.168.1.104;49874;1883;74;49874 → 1883 [SYN] Seq=0 Win=42340 Len=0 MSS=1460 SACK_PERM=1 TSval=1796541605 TSecr=0 WS=512;
158;Jan 13, 2022 15:33:56.813594888 CET;192.168.1.104;192.168.1.102;1883;49874;58;1883 → 49874 [SYN, ACK] Seq=0 Ack=1 Win=8192 Len=0 MSS=1460;
159;Jan 13, 2022 15:33:56.813629504 CET;192.168.1.102;192.168.1.104;49874;1883;54;49874 → 1883 [ACK] Seq=1 Ack=1 Win=42340 Len=0;
160;Jan 13, 2022 15:33:56.813686515 CET;192.168.1.102;192.168.1.104;49874;1883;108;Connect Command;
161;Jan 13, 2022 15:33:57.132524569 CET;192.168.1.102;192.168.1.104;49874;1883;108;[TCP Retransmission] 49874 → 1883 [PSH, ACK] Seq=1 Ack=1 Win=42340 Len=54;
162;Jan 13, 2022 15:33:57.252391404 CET;192.168.1.104;192.168.1.102;1883;49874;54;1883 → 49874 [ACK] Seq=1 Ack=55 Win=8192 Len=0;
163;Jan 13, 2022 15:33:57.258910611 CET;192.168.1.104;192.168.1.102;1883;49874;58;Connect Ack;
164;Jan 13, 2022 15:33:57.258931145 CET;192.168.1.102;192.168.1.104;49874;1883;54;49874 → 1883 [ACK] Seq=55 Ack=5 Win=42336 Len=0;
165;Jan 13, 2022 15:33:57.258994565 CET;192.168.1.102;192.168.1.104;49874;1883;73;Publish Message [topic];message013
166;Jan 13, 2022 15:33:57.259013133 CET;192.168.1.102;192.168.1.104;49874;1883;56;Disconnect Req;
167;Jan 13, 2022 15:33:57.900585769 CET;192.168.1.102;192.168.1.104;49874;1883;75;[TCP Retransmission] 49874 → 1883 [FIN, PSH, ACK] Seq=55 Ack=5 Win=42336 Len=21;
168;Jan 13, 2022 15:33:58.004115284 CET;192.168.1.104;192.168.1.102;1883;49874;54;1883 → 49874 [FIN, ACK] Seq=5 Ack=77 Win=8192 Len=0;
169;Jan 13, 2022 15:33:58.004138136 CET;192.168.1.102;192.168.1.104;49874;1883;54;49874 → 1883 [ACK] Seq=77 Ack=6 Win=42335 Len=0;
170;Jan 13, 2022 15:34:02.274590574 CET;192.168.1.102;192.168.1.104;49876;1883;74;49876 → 1883 [SYN] Seq=0 Win=42340 Len=0 MSS=1460 SACK_PERM=1 TSval=1796547170 TSecr=0 WS=512;
171;Jan 13, 2022 15:34:02.385880018 CET;192.168.1.104;192.168.1.102;1883;49876;58;1883 → 49876 [SYN, ACK] Seq=0 Ack=1 Win=8192 Len=0 MSS=1460;
172;Jan 13, 2022 15:34:02.385921802 CET;192.168.1.102;192.168.1.104;49876;1883;54;49876 → 1883 [ACK] Seq=1 Ack=1 Win=42340 Len=0;
173;Jan 13, 2022 15:34:02.385989413 CET;192.168.1.102;192.168.1.104;49876;1883;108;Connect Command;
174;Jan 13, 2022 15:34:02.732552878 CET;192.168.1.102;192.168.1.104;49876;1883;108;[TCP Retransmission] 49876 → 1883 [PSH, ACK] Seq=1 Ack=1 Win=42340 Len=54;
175;Jan 13, 2022 15:34:02.852316185 CET;192.168.1.104;192.168.1.102;1883;49876;54;1883 → 49876 [ACK] Seq=1 Ack=55 Win=8192 Len=0;
176;Jan 13, 2022 15:34:02.859537641 CET;192.168.1.104;192.168.1.102;1883;49876;58;Connect Ack;
177;Jan 13, 2022 15:34:02.859558250 CET;192.168.1.102;192.168.1.104;49876;1883;54;49876 → 1883 [ACK] Seq=55 Ack=5 Win=42336 Len=0;
178;Jan 13, 2022 15:34:02.859631767 CET;192.168.1.102;192.168.1.104;49876;1883;73;Publish Message [topic];message014
179;Jan 13, 2022 15:34:02.859651539 CET;192.168.1.102;192.168.1.104;49876;1883;56;Disconnect Req;
180;Jan 13, 2022 15:34:03.532697221 CET;192.168.1.102;192.168.1.104;49876;1883;75;[TCP Retransmission] 49876 → 1883 [FIN, PSH, ACK] Seq=55 Ack=5 Win=42336 Len=21;
181;Jan 13, 2022 15:34:03.652832691 CET;192.168.1.104;192.168.1.102;1883;49876;54;1883 → 49876 [FIN, ACK] Seq=5 Ack=77 Win=8192 Len=0;
182;Jan 13, 2022 15:34:03.652855855 CET;192.168.1.102;192.168.1.104;49876;1883;54;49876 → 1883 [ACK] Seq=77 Ack=6 Win=42335 Len=0;
183;Jan 13, 2022 15:34:07.863916133 CET;192.168.1.102;192.168.1.104;49878;1883;74;49878 → 1883 [SYN] Seq=0 Win=42340 Len=0 MSS=1460 SACK_PERM=1 TSval=1796552760 TSecr=0 WS=512;
184;Jan 13, 2022 15:34:07.968626670 CET;192.168.1.104;192.168.1.102;1883;49878;58;1883 → 49878 [SYN, ACK] Seq=0 Ack=1 Win=8192 Len=0 MSS=1460;
185;Jan 13, 2022 15:34:07.968668330 CET;192.168.1.102;192.168.1.104;49878;1883;54;49878 → 1883 [ACK] Seq=1 Ack=1 Win=42340 Len=0;
186;Jan 13, 2022 15:34:07.968734175 CET;192.168.1.102;192.168.1.104;49878;1883;108;Connect Command;
187;Jan 13, 2022 15:34:08.300751367 CET;192.168.1.102;192.168.1.104;49878;1883;108;[TCP Retransmission] 49878 → 1883 [PSH, ACK] Seq=1 Ack=1 Win=42340 Len=54;
188;Jan 13, 2022 15:34:08.406353170 CET;192.168.1.104;192.168.1.102;1883;49878;54;1883 → 49878 [ACK] Seq=1 Ack=55 Win=8192 Len=0;
189;Jan 13, 2022 15:34:08.411228273 CET;192.168.1.104;192.168.1.102;1883;49878;58;Connect Ack;
190;Jan 13, 2022 15:34:08.411247158 CET;192.168.1.102;192.168.1.104;49878;1883;54;49878 → 1883 [ACK] Seq=55 Ack=5 Win=42336 Len=0;
191;Jan 13, 2022 15:34:08.411308869 CET;192.168.1.102;192.168.1.104;49878;1883;73;Publish Message [topic];message015
192;Jan 13, 2022 15:34:08.411325161 CET;192.168.1.102;192.168.1.104;49878;1883;56;Disconnect Req;
193;Jan 13, 2022 15:34:09.068533193 CET;192.168.1.102;192.168.1.104;49878;1883;75;[TCP Retransmission] 49878 → 1883 [FIN, PSH, ACK] Seq=55 Ack=5 Win=42336 Len=21;
194;Jan 13, 2022 15:34:09.173356796 CET;192.168.1.104;192.168.1.102;1883;49878;54;1883 → 49878 [FIN, ACK] Seq=5 Ack=77 Win=8192 Len=0;
195;Jan 13, 2022 15:34:09.173381553 CET;192.168.1.102;192.168.1.104;49878;1883;54;49878 → 1883 [ACK] Seq=77 Ack=6 Win=42335 Len=0;
196;Jan 13, 2022 15:34:13.415208711 CET;192.168.1.102;192.168.1.104;49880;1883;74;49880 → 1883 [SYN] Seq=0 Win=42340 Len=0 MSS=1460 SACK_PERM=1 TSval=1796558311 TSecr=0 WS=512;
197;Jan 13, 2022 15:34:13.521797604 CET;192.168.1.104;192.168.1.102;1883;49880;58;1883 → 49880 [SYN, ACK] Seq=0 Ack=1 Win=8192 Len=0 MSS=1460;
198;Jan 13, 2022 15:34:13.521844427 CET;192.168.1.102;192.168.1.104;49880;1883;54;49880 → 1883 [ACK] Seq=1 Ack=1 Win=42340 Len=0;
199;Jan 13, 2022 15:34:13.521924595 CET;192.168.1.102;192.168.1.104;49880;1883;108;Connect Command;
200;Jan 13, 2022 15:34:13.868523837 CET;192.168.1.102;192.168.1.104;49880;1883;108;[TCP Retransmission] 49880 → 1883 [PSH, ACK] Seq=1 Ack=1 Win=42340 Len=54;
201;Jan 13, 2022 15:34:13.974447867 CET;192.168.1.104;192.168.1.102;1883;49880;54;1883 → 49880 [ACK] Seq=1 Ack=55 Win=8192 Len=0;
202;Jan 13, 2022 15:34:13.980579375 CET;192.168.1.104;192.168.1.102;1883;49880;58;Connect Ack;
203;Jan 13, 2022 15:34:13.980600842 CET;192.168.1.102;192.168.1.104;49880;1883;54;49880 → 1883 [ACK] Seq=55 Ack=5 Win=42336 Len=0;
204;Jan 13, 2022 15:34:13.980657317 CET;192.168.1.102;192.168.1.104;49880;1883;73;Publish Message [topic];message016
205;Jan 13, 2022 15:34:13.980678174 CET;192.168.1.102;192.168.1.104;49880;1883;56;Disconnect Req;
206;Jan 13, 2022 15:34:14.636613416 CET;192.168.1.102;192.168.1.104;49880;1883;75;[TCP Retransmission] 49880 → 1883 [FIN, PSH, ACK] Seq=55 Ack=5 Win=42336 Len=21;
207;Jan 13, 2022 15:34:14.755761832 CET;192.168.1.104;192.168.1.102;1883;49880;54;1883 → 49880 [FIN, ACK] Seq=5 Ack=77 Win=8192 Len=0;
208;Jan 13, 2022 15:34:14.755786058 CET;192.168.1.102;192.168.1.104;49880;1883;54;49880 → 1883 [ACK] Seq=77 Ack=6 Win=42335 Len=0;
209;Jan 13, 2022 15:34:18.987531565 CET;192.168.1.102;192.168.1.104;49882;1883;74;49882 → 1883 [SYN] Seq=0 Win=42340 Len=0 MSS=1460 SACK_PERM=1 TSval=1796563883 TSecr=0 WS=512;
210;Jan 13, 2022 15:34:19.098420915 CET;192.168.1.104;192.168.1.102;1883;49882;58;1883 → 49882 [SYN, ACK] Seq=0 Ack=1 Win=8192 Len=0 MSS=1460;
211;Jan 13, 2022 15:34:19.098454146 CET;192.168.1.102;192.168.1.104;49882;1883;54;49882 → 1883 [ACK] Seq=1 Ack=1 Win=42340 Len=0;
212;Jan 13, 2022 15:34:19.098508871 CET;192.168.1.102;192.168.1.104;49882;1883;108;Connect Command;
213;Jan 13, 2022 15:34:19.436633857 CET;192.168.1.102;192.168.1.104;49882;1883;108;[TCP Retransmission] 49882 → 1883 [PSH, ACK] Seq=1 Ack=1 Win=42340 Len=54;
214;Jan 13, 2022 15:34:19.558403986 CET;192.168.1.104;192.168.1.102;1883;49882;54;1883 → 49882 [ACK] Seq=1 Ack=55 Win=8192 Len=0;
215;Jan 13, 2022 15:34:19.564796954 CET;192.168.1.104;192.168.1.102;1883;49882;58;Connect Ack;
216;Jan 13, 2022 15:34:19.564816515 CET;192.168.1.102;192.168.1.104;49882;1883;54;49882 → 1883 [ACK] Seq=55 Ack=5 Win=42336 Len=0;
217;Jan 13, 2022 15:34:19.564877176 CET;192.168.1.102;192.168.1.104;49882;1883;73;Publish Message [topic];message017
218;Jan 13, 2022 15:34:19.564896921 CET;192.168.1.102;192.168.1.104;49882;1883;56;Disconnect Req;
219;Jan 13, 2022 15:34:20.268575980 CET;192.168.1.102;192.168.1.104;49882;1883;75;[TCP Retransmission] 49882 → 1883 [FIN, PSH, ACK] Seq=55 Ack=5 Win=42336 Len=21;
220;Jan 13, 2022 15:34:20.372481449 CET;192.168.1.104;192.168.1.102;1883;49882;54;1883 → 49882 [FIN, ACK] Seq=5 Ack=77 Win=8192 Len=0;
221;Jan 13, 2022 15:34:20.372496574 CET;192.168.1.102;192.168.1.104;49882;1883;54;49882 → 1883 [ACK] Seq=77 Ack=6 Win=42335 Len=0;
222;Jan 13, 2022 15:34:24.569461517 CET;192.168.1.102;192.168.1.104;49886;1883;74;49886 → 1883 [SYN] Seq=0 Win=42340 Len=0 MSS=1460 SACK_PERM=1 TSval=1796569465 TSecr=0 WS=512;
223;Jan 13, 2022 15:34:24.673104717 CET;192.168.1.104;192.168.1.102;1883;49886;58;1883 → 49886 [SYN, ACK] Seq=0 Ack=1 Win=8192 Len=0 MSS=1460;
224;Jan 13, 2022 15:34:24.673133110 CET;192.168.1.102;192.168.1.104;49886;1883;54;49886 → 1883 [ACK] Seq=1 Ack=1 Win=42340 Len=0;
225;Jan 13, 2022 15:34:24.673176031 CET;192.168.1.102;192.168.1.104;49886;1883;108;Connect Command;
226;Jan 13, 2022 15:34:25.004523490 CET;192.168.1.102;192.168.1.104;49886;1883;108;[TCP Retransmission] 49886 → 1883 [PSH, ACK] Seq=1 Ack=1 Win=42340 Len=54;
227;Jan 13, 2022 15:34:25.111311705 CET;192.168.1.104;192.168.1.102;1883;49886;54;1883 → 49886 [ACK] Seq=1 Ack=55 Win=8192 Len=0;
228;Jan 13, 2022 15:34:25.113682621 CET;192.168.1.104;192.168.1.102;1883;49886;58;Connect Ack;
229;Jan 13, 2022 15:34:25.113701585 CET;192.168.1.102;192.168.1.104;49886;1883;54;49886 → 1883 [ACK] Seq=55 Ack=5 Win=42336 Len=0;
230;Jan 13, 2022 15:34:25.113763214 CET;192.168.1.102;192.168.1.104;49886;1883;73;Publish Message [topic];message018
231;Jan 13, 2022 15:34:25.113778171 CET;192.168.1.102;192.168.1.104;49886;1883;56;Disconnect Req;
232;Jan 13, 2022 15:34:25.740508137 CET;192.168.1.102;192.168.1.104;49886;1883;75;[TCP Retransmission] 49886 → 1883 [FIN, PSH, ACK] Seq=55 Ack=5 Win=42336 Len=21;
233;Jan 13, 2022 15:34:25.843572091 CET;192.168.1.104;192.168.1.102;1883;49886;54;1883 → 49886 [FIN, ACK] Seq=5 Ack=77 Win=8192 Len=0;
234;Jan 13, 2022 15:34:25.843594808 CET;192.168.1.102;192.168.1.104;49886;1883;54;49886 → 1883 [ACK] Seq=77 Ack=6 Win=42335 Len=0;
235;Jan 13, 2022 15:34:30.117736886 CET;192.168.1.102;192.168.1.104;49888;1883;74;49888 → 1883 [SYN] Seq=0 Win=42340 Len=0 MSS=1460 SACK_PERM=1 TSval=1796575013 TSecr=0 WS=512;
236;Jan 13, 2022 15:34:30.220768279 CET;192.168.1.104;192.168.1.102;1883;49888;58;1883 → 49888 [SYN, ACK] Seq=0 Ack=1 Win=8192 Len=0 MSS=1460;
237;Jan 13, 2022 15:34:30.220803022 CET;192.168.1.102;192.168.1.104;49888;1883;54;49888 → 1883 [ACK] Seq=1 Ack=1 Win=42340 Len=0;
238;Jan 13, 2022 15:34:30.220853163 CET;192.168.1.102;192.168.1.104;49888;1883;108;Connect Command;
239;Jan 13, 2022 15:34:30.540522119 CET;192.168.1.102;192.168.1.104;49888;1883;108;[TCP Retransmission] 49888 → 1883 [PSH, ACK] Seq=1 Ack=1 Win=42340 Len=54;
240;Jan 13, 2022 15:34:30.645550728 CET;192.168.1.104;192.168.1.102;1883;49888;54;1883 → 49888 [ACK] Seq=1 Ack=55 Win=8192 Len=0;
241;Jan 13, 2022 15:34:30.651839205 CET;192.168.1.104;192.168.1.102;1883;49888;58;Connect Ack;
242;Jan 13, 2022 15:34:30.651855814 CET;192.168.1.102;192.168.1.104;49888;1883;54;49888 → 1883 [ACK] Seq=55 Ack=5 Win=42336 Len=0;
243;Jan 13, 2022 15:34:30.651901587 CET;192.168.1.102;192.168.1.104;49888;1883;73;Publish Message [topic];message019
244;Jan 13, 2022 15:34:30.651917992 CET;192.168.1.102;192.168.1.104;49888;1883;56;Disconnect Req;
245;Jan 13, 2022 15:34:31.276656507 CET;192.168.1.102;192.168.1.104;49888;1883;75;[TCP Retransmission] 49888 → 1883 [FIN, PSH, ACK] Seq=55 Ack=5 Win=42336 Len=21;
246;Jan 13, 2022 15:34:31.380656631 CET;192.168.1.104;192.168.1.102;1883;49888;54;1883 → 49888 [FIN, ACK] Seq=5 Ack=77 Win=8192 Len=0;
247;Jan 13, 2022 15:34:31.380681718 CET;192.168.1.102;192.168.1.104;49888;1883;54;49888 → 1883 [ACK] Seq=77 Ack=6 Win=42335 Len=0;
248;Jan 13, 2022 15:34:35.664162514 CET;192.168.1.102;192.168.1.104;49890;1883;74;49890 → 1883 [SYN] Seq=0 Win=42340 Len=0 MSS=1460 SACK_PERM=1 TSval=1796580560 TSecr=0 WS=512;
249;Jan 13, 2022 15:34:35.789143059 CET;192.168.1.104;192.168.1.102;1883;49890;58;1883 → 49890 [SYN, ACK] Seq=0 Ack=1 Win=8192 Len=0 MSS=1460;
250;Jan 13, 2022 15:34:35.789173115 CET;192.168.1.102;192.168.1.104;49890;1883;54;49890 → 1883 [ACK] Seq=1 Ack=1 Win=42340 Len=0;
251;Jan 13, 2022 15:34:35.789215649 CET;192.168.1.102;192.168.1.104;49890;1883;108;Connect Command;
252;Jan 13, 2022 15:34:36.172727515 CET;192.168.1.102;192.168.1.104;49890;1883;108;[TCP Retransmission] 49890 → 1883 [PSH, ACK] Seq=1 Ack=1 Win=42340 Len=54;
253;Jan 13, 2022 15:34:36.282806506 CET;192.168.1.104;192.168.1.102;1883;49890;54;1883 → 49890 [ACK] Seq=1 Ack=55 Win=8192 Len=0;
254;Jan 13, 2022 15:34:36.285749736 CET;192.168.1.104;192.168.1.102;1883;49890;58;Connect Ack;
255;Jan 13, 2022 15:34:36.285768254 CET;192.168.1.102;192.168.1.104;49890;1883;54;49890 → 1883 [ACK] Seq=55 Ack=5 Win=42336 Len=0;
256;Jan 13, 2022 15:34:36.285822310 CET;192.168.1.102;192.168.1.104;49890;1883;73;Publish Message [topic];message020
257;Jan 13, 2022 15:34:36.285838256 CET;192.168.1.102;192.168.1.104;49890;1883;56;Disconnect Req;
258;Jan 13, 2022 15:34:37.069300584 CET;192.168.1.102;192.168.1.104;49890;1883;75;[TCP Retransmission] 49890 → 1883 [FIN, PSH, ACK] Seq=55 Ack=5 Win=42336 Len=21;
259;Jan 13, 2022 15:34:37.172927349 CET;192.168.1.104;192.168.1.102;1883;49890;54;1883 → 49890 [FIN, ACK] Seq=5 Ack=77 Win=8192 Len=0;
260;Jan 13, 2022 15:34:37.172951829 CET;192.168.1.102;192.168.1.104;49890;1883;54;49890 → 1883 [ACK] Seq=77 Ack=6 Win=42335 Len=0;
261;Jan 13, 2022 15:34:41.298315721 CET;192.168.1.102;192.168.1.104;49892;1883;74;49892 → 1883 [SYN] Seq=0 Win=42340 Len=0 MSS=1460 SACK_PERM=1 TSval=1796586194 TSecr=0 WS=512;
262;Jan 13, 2022 15:34:41.416254235 CET;192.168.1.104;192.168.1.102;1883;49892;58;1883 → 49892 [SYN, ACK] Seq=0 Ack=1 Win=8192 Len=0 MSS=1460;
263;Jan 13, 2022 15:34:41.416286035 CET;192.168.1.102;192.168.1.104;49892;1883;54;49892 → 1883 [ACK] Seq=1 Ack=1 Win=42340 Len=0;
264;Jan 13, 2022 15:34:41.416333471 CET;192.168.1.102;192.168.1.104;49892;1883;108;Connect Command;
265;Jan 13, 2022 15:34:41.772522690 CET;192.168.1.102;192.168.1.104;49892;1883;108;[TCP Retransmission] 49892 → 1883 [PSH, ACK] Seq=1 Ack=1 Win=42340 Len=54;
266;Jan 13, 2022 15:34:41.884607500 CET;192.168.1.104;192.168.1.102;1883;49892;54;1883 → 49892 [ACK] Seq=1 Ack=55 Win=8192 Len=0;
267;Jan 13, 2022 15:34:41.890382711 CET;192.168.1.104;192.168.1.102;1883;49892;58;Connect Ack;
268;Jan 13, 2022 15:34:41.890402400 CET;192.168.1.102;192.168.1.104;49892;1883;54;49892 → 1883 [ACK] Seq=55 Ack=5 Win=42336 Len=0;
269;Jan 13, 2022 15:34:41.890460056 CET;192.168.1.102;192.168.1.104;49892;1883;73;Publish Message [topic];message021
270;Jan 13, 2022 15:34:41.890476520 CET;192.168.1.102;192.168.1.104;49892;1883;56;Disconnect Req;
271;Jan 13, 2022 15:34:42.604524783 CET;192.168.1.102;192.168.1.104;49892;1883;75;[TCP Retransmission] 49892 → 1883 [FIN, PSH, ACK] Seq=55 Ack=5 Win=42336 Len=21;
272;Jan 13, 2022 15:34:42.709157820 CET;192.168.1.104;192.168.1.102;1883;49892;54;1883 → 49892 [FIN, ACK] Seq=5 Ack=77 Win=8192 Len=0;
273;Jan 13, 2022 15:34:42.709181568 CET;192.168.1.102;192.168.1.104;49892;1883;54;49892 → 1883 [ACK] Seq=77 Ack=6 Win=42335 Len=0;
274;Jan 13, 2022 15:34:46.902952643 CET;192.168.1.102;192.168.1.104;49894;1883;74;49894 → 1883 [SYN] Seq=0 Win=42340 Len=0 MSS=1460 SACK_PERM=1 TSval=1796591799 TSecr=0 WS=512;
275;Jan 13, 2022 15:34:47.021894698 CET;192.168.1.104;192.168.1.102;1883;49894;58;1883 → 49894 [SYN, ACK] Seq=0 Ack=1 Win=8192 Len=0 MSS=1460;
276;Jan 13, 2022 15:34:47.021928836 CET;192.168.1.102;192.168.1.104;49894;1883;54;49894 → 1883 [ACK] Seq=1 Ack=1 Win=42340 Len=0;
277;Jan 13, 2022 15:34:47.021978381 CET;192.168.1.102;192.168.1.104;49894;1883;108;Connect Command;
278;Jan 13, 2022 15:34:47.404512775 CET;192.168.1.102;192.168.1.104;49894;1883;108;[TCP Retransmission] 49894 → 1883 [PSH, ACK] Seq=1 Ack=1 Win=42340 Len=54;
279;Jan 13, 2022 15:34:47.520708991 CET;192.168.1.104;192.168.1.102;1883;49894;54;1883 → 49894 [ACK] Seq=1 Ack=55 Win=8192 Len=0;
280;Jan 13, 2022 15:34:47.530869008 CET;192.168.1.104;192.168.1.102;1883;49894;58;Connect Ack;
281;Jan 13, 2022 15:34:47.530885877 CET;192.168.1.102;192.168.1.104;49894;1883;54;49894 → 1883 [ACK] Seq=55 Ack=5 Win=42336 Len=0;
282;Jan 13, 2022 15:34:47.530928238 CET;192.168.1.102;192.168.1.104;49894;1883;73;Publish Message [topic];message022
283;Jan 13, 2022 15:34:47.530942645 CET;192.168.1.102;192.168.1.104;49894;1883;56;Disconnect Req;
284;Jan 13, 2022 15:34:48.268573015 CET;192.168.1.102;192.168.1.104;49894;1883;75;[TCP Retransmission] 49894 → 1883 [FIN, PSH, ACK] Seq=55 Ack=5 Win=42336 Len=21;
285;Jan 13, 2022 15:34:48.389850837 CET;192.168.1.104;192.168.1.102;1883;49894;54;1883 → 49894 [FIN, ACK] Seq=5 Ack=77 Win=8192 Len=0;
286;Jan 13, 2022 15:34:48.389874423 CET;192.168.1.102;192.168.1.104;49894;1883;54;49894 → 1883 [ACK] Seq=77 Ack=6 Win=42335 Len=0;
287;Jan 13, 2022 15:34:52.535137333 CET;192.168.1.102;192.168.1.104;49896;1883;74;49896 → 1883 [SYN] Seq=0 Win=42340 Len=0 MSS=1460 SACK_PERM=1 TSval=1796597431 TSecr=0 WS=512;
288;Jan 13, 2022 15:34:52.749335935 CET;192.168.1.104;192.168.1.102;1883;49896;58;1883 → 49896 [SYN, ACK] Seq=0 Ack=1 Win=8192 Len=0 MSS=1460;
289;Jan 13, 2022 15:34:52.749375138 CET;192.168.1.102;192.168.1.104;49896;1883;54;49896 → 1883 [ACK] Seq=1 Ack=1 Win=42340 Len=0;
290;Jan 13, 2022 15:34:52.749439976 CET;192.168.1.102;192.168.1.104;49896;1883;108;Connect Command;
291;Jan 13, 2022 15:34:53.420669416 CET;192.168.1.102;192.168.1.104;49896;1883;108;[TCP Retransmission] 49896 → 1883 [PSH, ACK] Seq=1 Ack=1 Win=42340 Len=54;
292;Jan 13, 2022 15:34:53.525479422 CET;192.168.1.104;192.168.1.102;1883;49896;54;1883 → 49896 [ACK] Seq=1 Ack=55 Win=8192 Len=0;
293;Jan 13, 2022 15:34:53.533556870 CET;192.168.1.104;192.168.1.102;1883;49896;58;Connect Ack;
294;Jan 13, 2022 15:34:53.533574097 CET;192.168.1.102;192.168.1.104;49896;1883;54;49896 → 1883 [ACK] Seq=55 Ack=5 Win=42336 Len=0;
295;Jan 13, 2022 15:34:53.533628013 CET;192.168.1.102;192.168.1.104;49896;1883;73;Publish Message [topic];message023
296;Jan 13, 2022 15:34:53.533642466 CET;192.168.1.102;192.168.1.104;49896;1883;56;Disconnect Req;
297;Jan 13, 2022 15:34:54.828778807 CET;192.168.1.102;192.168.1.104;49896;1883;75;[TCP Retransmission] 49896 → 1883 [FIN, PSH, ACK] Seq=55 Ack=5 Win=42336 Len=21;
298;Jan 13, 2022 15:34:54.946982261 CET;192.168.1.104;192.168.1.102;1883;49896;54;1883 → 49896 [FIN, ACK] Seq=5 Ack=77 Win=8192 Len=0;
299;Jan 13, 2022 15:34:54.947005496 CET;192.168.1.102;192.168.1.104;49896;1883;54;49896 → 1883 [ACK] Seq=77 Ack=6 Win=42335 Len=0;
300;Jan 13, 2022 15:34:58.537752481 CET;192.168.1.102;192.168.1.104;49898;1883;74;49898 → 1883 [SYN] Seq=0 Win=42340 Len=0 MSS=1460 SACK_PERM=1 TSval=1796603433 TSecr=0 WS=512;
301;Jan 13, 2022 15:34:58.644740849 CET;192.168.1.104;192.168.1.102;1883;49898;58;1883 → 49898 [SYN, ACK] Seq=0 Ack=1 Win=8192 Len=0 MSS=1460;
302;Jan 13, 2022 15:34:58.644774849 CET;192.168.1.102;192.168.1.104;49898;1883;54;49898 → 1883 [ACK] Seq=1 Ack=1 Win=42340 Len=0;
303;Jan 13, 2022 15:34:58.644830307 CET;192.168.1.102;192.168.1.104;49898;1883;108;Connect Command;
304;Jan 13, 2022 15:34:58.988612464 CET;192.168.1.102;192.168.1.104;49898;1883;108;[TCP Retransmission] 49898 → 1883 [PSH, ACK] Seq=1 Ack=1 Win=42340 Len=54;
305;Jan 13, 2022 15:34:59.111236740 CET;192.168.1.104;192.168.1.102;1883;49898;54;1883 → 49898 [ACK] Seq=1 Ack=55 Win=8192 Len=0;
306;Jan 13, 2022 15:34:59.114168015 CET;192.168.1.104;192.168.1.102;1883;49898;58;Connect Ack;
307;Jan 13, 2022 15:34:59.114185459 CET;192.168.1.102;192.168.1.104;49898;1883;54;49898 → 1883 [ACK] Seq=55 Ack=5 Win=42336 Len=0;
308;Jan 13, 2022 15:34:59.114244824 CET;192.168.1.102;192.168.1.104;49898;1883;73;Publish Message [topic];message024
309;Jan 13, 2022 15:34:59.114259890 CET;192.168.1.102;192.168.1.104;49898;1883;56;Disconnect Req;
310;Jan 13, 2022 15:34:59.788567231 CET;192.168.1.102;192.168.1.104;49898;1883;75;[TCP Retransmission] 49898 → 1883 [FIN, PSH, ACK] Seq=55 Ack=5 Win=42336 Len=21;
311;Jan 13, 2022 15:34:59.892866479 CET;192.168.1.104;192.168.1.102;1883;49898;54;1883 → 49898 [FIN, ACK] Seq=5 Ack=77 Win=8192 Len=0;
312;Jan 13, 2022 15:34:59.892889637 CET;192.168.1.102;192.168.1.104;49898;1883;54;49898 → 1883 [ACK] Seq=77 Ack=6 Win=42335 Len=0;
313;Jan 13, 2022 15:35:04.120085345 CET;192.168.1.102;192.168.1.104;49900;1883;74;49900 → 1883 [SYN] Seq=0 Win=42340 Len=0 MSS=1460 SACK_PERM=1 TSval=1796609016 TSecr=0 WS=512;
314;Jan 13, 2022 15:35:04.237620065 CET;192.168.1.104;192.168.1.102;1883;49900;58;1883 → 49900 [SYN, ACK] Seq=0 Ack=1 Win=8192 Len=0 MSS=1460;
315;Jan 13, 2022 15:35:04.237648519 CET;192.168.1.102;192.168.1.104;49900;1883;54;49900 → 1883 [ACK] Seq=1 Ack=1 Win=42340 Len=0;
316;Jan 13, 2022 15:35:04.237692513 CET;192.168.1.102;192.168.1.104;49900;1883;108;Connect Command;
317;Jan 13, 2022 15:35:04.620606367 CET;192.168.1.102;192.168.1.104;49900;1883;108;[TCP Retransmission] 49900 → 1883 [PSH, ACK] Seq=1 Ack=1 Win=42340 Len=54;
318;Jan 13, 2022 15:35:04.725058245 CET;192.168.1.104;192.168.1.102;1883;49900;54;1883 → 49900 [ACK] Seq=1 Ack=55 Win=8192 Len=0;
319;Jan 13, 2022 15:35:04.729895749 CET;192.168.1.104;192.168.1.102;1883;49900;58;Connect Ack;
320;Jan 13, 2022 15:35:04.729914252 CET;192.168.1.102;192.168.1.104;49900;1883;54;49900 → 1883 [ACK] Seq=55 Ack=5 Win=42336 Len=0;
321;Jan 13, 2022 15:35:04.729969444 CET;192.168.1.102;192.168.1.104;49900;1883;73;Publish Message [topic];message025
322;Jan 13, 2022 15:35:04.729984899 CET;192.168.1.102;192.168.1.104;49900;1883;56;Disconnect Req;
323;Jan 13, 2022 15:35:05.452540843 CET;192.168.1.102;192.168.1.104;49900;1883;75;[TCP Retransmission] 49900 → 1883 [FIN, PSH, ACK] Seq=55 Ack=5 Win=42336 Len=21;
324;Jan 13, 2022 15:35:05.557280440 CET;192.168.1.104;192.168.1.102;1883;49900;54;1883 → 49900 [FIN, ACK] Seq=5 Ack=77 Win=8192 Len=0;
325;Jan 13, 2022 15:35:05.557303115 CET;192.168.1.102;192.168.1.104;49900;1883;54;49900 → 1883 [ACK] Seq=77 Ack=6 Win=42335 Len=0;
326;Jan 13, 2022 15:35:09.734263664 CET;192.168.1.102;192.168.1.104;49902;1883;74;49902 → 1883 [SYN] Seq=0 Win=42340 Len=0 MSS=1460 SACK_PERM=1 TSval=1796614630 TSecr=0 WS=512;
327;Jan 13, 2022 15:35:09.841870418 CET;192.168.1.104;192.168.1.102;1883;49902;58;1883 → 49902 [SYN, ACK] Seq=0 Ack=1 Win=8192 Len=0 MSS=1460;
328;Jan 13, 2022 15:35:09.841903296 CET;192.168.1.102;192.168.1.104;49902;1883;54;49902 → 1883 [ACK] Seq=1 Ack=1 Win=42340 Len=0;
329;Jan 13, 2022 15:35:09.841955504 CET;192.168.1.102;192.168.1.104;49902;1883;108;Connect Command;
330;Jan 13, 2022 15:35:10.188679850 CET;192.168.1.102;192.168.1.104;49902;1883;108;[TCP Retransmission] 49902 → 1883 [PSH, ACK] Seq=1 Ack=1 Win=42340 Len=54;
331;Jan 13, 2022 15:35:10.311253658 CET;192.168.1.104;192.168.1.102;1883;49902;54;1883 → 49902 [ACK] Seq=1 Ack=55 Win=8192 Len=0;
332;Jan 13, 2022 15:35:10.319623250 CET;192.168.1.104;192.168.1.102;1883;49902;58;Connect Ack;
333;Jan 13, 2022 15:35:10.319642108 CET;192.168.1.102;192.168.1.104;49902;1883;54;49902 → 1883 [ACK] Seq=55 Ack=5 Win=42336 Len=0;
334;Jan 13, 2022 15:35:10.319698364 CET;192.168.1.102;192.168.1.104;49902;1883;73;Publish Message [topic];message026
335;Jan 13, 2022 15:35:10.319714302 CET;192.168.1.102;192.168.1.104;49902;1883;56;Disconnect Req;
336;Jan 13, 2022 15:35:10.988545613 CET;192.168.1.102;192.168.1.104;49902;1883;75;[TCP Retransmission] 49902 → 1883 [FIN, PSH, ACK] Seq=55 Ack=5 Win=42336 Len=21;
337;Jan 13, 2022 15:35:11.114006985 CET;192.168.1.104;192.168.1.102;1883;49902;54;1883 → 49902 [FIN, ACK] Seq=5 Ack=77 Win=8192 Len=0;
338;Jan 13, 2022 15:35:11.114032018 CET;192.168.1.102;192.168.1.104;49902;1883;54;49902 → 1883 [ACK] Seq=77 Ack=6 Win=42335 Len=0;
339;Jan 13, 2022 15:35:15.327923702 CET;192.168.1.102;192.168.1.104;49904;1883;74;49904 → 1883 [SYN] Seq=0 Win=42340 Len=0 MSS=1460 SACK_PERM=1 TSval=1796620224 TSecr=0 WS=512;
340;Jan 13, 2022 15:35:15.446170731 CET;192.168.1.104;192.168.1.102;1883;49904;58;1883 → 49904 [SYN, ACK] Seq=0 Ack=1 Win=8192 Len=0 MSS=1460;
341;Jan 13, 2022 15:35:15.446202184 CET;192.168.1.102;192.168.1.104;49904;1883;54;49904 → 1883 [ACK] Seq=1 Ack=1 Win=42340 Len=0;
342;Jan 13, 2022 15:35:15.446244982 CET;192.168.1.102;192.168.1.104;49904;1883;108;Connect Command;
343;Jan 13, 2022 15:35:15.820735114 CET;192.168.1.102;192.168.1.104;49904;1883;108;[TCP Retransmission] 49904 → 1883 [PSH, ACK] Seq=1 Ack=1 Win=42340 Len=54;
344;Jan 13, 2022 15:35:15.930403010 CET;192.168.1.104;192.168.1.102;1883;49904;54;1883 → 49904 [ACK] Seq=1 Ack=55 Win=8192 Len=0;
345;Jan 13, 2022 15:35:15.933810224 CET;192.168.1.104;192.168.1.102;1883;49904;58;Connect Ack;
346;Jan 13, 2022 15:35:15.933840251 CET;192.168.1.102;192.168.1.104;49904;1883;54;49904 → 1883 [ACK] Seq=55 Ack=5 Win=42336 Len=0;
347;Jan 13, 2022 15:35:15.933945959 CET;192.168.1.102;192.168.1.104;49904;1883;73;Publish Message [topic];message027
348;Jan 13, 2022 15:35:15.933976618 CET;192.168.1.102;192.168.1.104;49904;1883;56;Disconnect Req;
349;Jan 13, 2022 15:35:16.652857638 CET;192.168.1.102;192.168.1.104;49904;1883;75;[TCP Retransmission] 49904 → 1883 [FIN, PSH, ACK] Seq=55 Ack=5 Win=42336 Len=21;
350;Jan 13, 2022 15:35:16.760893475 CET;192.168.1.104;192.168.1.102;1883;49904;54;1883 → 49904 [FIN, ACK] Seq=5 Ack=77 Win=8192 Len=0;
351;Jan 13, 2022 15:35:16.760920180 CET;192.168.1.102;192.168.1.104;49904;1883;54;49904 → 1883 [ACK] Seq=77 Ack=6 Win=42335 Len=0;
352;Jan 13, 2022 15:35:20.945319433 CET;192.168.1.102;192.168.1.104;49906;1883;74;49906 → 1883 [SYN] Seq=0 Win=42340 Len=0 MSS=1460 SACK_PERM=1 TSval=1796625841 TSecr=0 WS=512;
353;Jan 13, 2022 15:35:21.063671648 CET;192.168.1.104;192.168.1.102;1883;49906;58;1883 → 49906 [SYN, ACK] Seq=0 Ack=1 Win=8192 Len=0 MSS=1460;
354;Jan 13, 2022 15:35:21.063702291 CET;192.168.1.102;192.168.1.104;49906;1883;54;49906 → 1883 [ACK] Seq=1 Ack=1 Win=42340 Len=0;
355;Jan 13, 2022 15:35:21.063749971 CET;192.168.1.102;192.168.1.104;49906;1883;108;Connect Command;
356;Jan 13, 2022 15:35:21.420526272 CET;192.168.1.102;192.168.1.104;49906;1883;108;[TCP Retransmission] 49906 → 1883 [PSH, ACK] Seq=1 Ack=1 Win=42340 Len=54;
357;Jan 13, 2022 15:35:21.540883984 CET;192.168.1.104;192.168.1.102;1883;49906;54;1883 → 49906 [ACK] Seq=1 Ack=55 Win=8192 Len=0;
358;Jan 13, 2022 15:35:21.545170672 CET;192.168.1.104;192.168.1.102;1883;49906;58;Connect Ack;
359;Jan 13, 2022 15:35:21.545189910 CET;192.168.1.102;192.168.1.104;49906;1883;54;49906 → 1883 [ACK] Seq=55 Ack=5 Win=42336 Len=0;
360;Jan 13, 2022 15:35:21.545249874 CET;192.168.1.102;192.168.1.104;49906;1883;73;Publish Message [topic];message028
361;Jan 13, 2022 15:35:21.545266242 CET;192.168.1.102;192.168.1.104;49906;1883;56;Disconnect Req;
362;Jan 13, 2022 15:35:22.284594193 CET;192.168.1.102;192.168.1.104;49906;1883;75;[TCP Retransmission] 49906 → 1883 [FIN, PSH, ACK] Seq=55 Ack=5 Win=42336 Len=21;
363;Jan 13, 2022 15:35:22.388598837 CET;192.168.1.104;192.168.1.102;1883;49906;54;1883 → 49906 [FIN, ACK] Seq=5 Ack=77 Win=8192 Len=0;
364;Jan 13, 2022 15:35:22.388622727 CET;192.168.1.102;192.168.1.104;49906;1883;54;49906 → 1883 [ACK] Seq=77 Ack=6 Win=42335 Len=0;
365;Jan 13, 2022 15:35:26.550149284 CET;192.168.1.102;192.168.1.104;49908;1883;74;49908 → 1883 [SYN] Seq=0 Win=42340 Len=0 MSS=1460 SACK_PERM=1 TSval=1796631446 TSecr=0 WS=512;
366;Jan 13, 2022 15:35:26.654632416 CET;192.168.1.104;192.168.1.102;1883;49908;58;1883 → 49908 [SYN, ACK] Seq=0 Ack=1 Win=8192 Len=0 MSS=1460;
367;Jan 13, 2022 15:35:26.654664824 CET;192.168.1.102;192.168.1.104;49908;1883;54;49908 → 1883 [ACK] Seq=1 Ack=1 Win=42340 Len=0;
368;Jan 13, 2022 15:35:26.654716145 CET;192.168.1.102;192.168.1.104;49908;1883;108;Connect Command;
369;Jan 13, 2022 15:35:26.988665170 CET;192.168.1.102;192.168.1.104;49908;1883;108;[TCP Retransmission] 49908 → 1883 [PSH, ACK] Seq=1 Ack=1 Win=42340 Len=54;
370;Jan 13, 2022 15:35:27.113648624 CET;192.168.1.104;192.168.1.102;1883;49908;54;1883 → 49908 [ACK] Seq=1 Ack=55 Win=8192 Len=0;
371;Jan 13, 2022 15:35:27.116693904 CET;192.168.1.104;192.168.1.102;1883;49908;58;Connect Ack;
372;Jan 13, 2022 15:35:27.116709728 CET;192.168.1.102;192.168.1.104;49908;1883;54;49908 → 1883 [ACK] Seq=55 Ack=5 Win=42336 Len=0;
373;Jan 13, 2022 15:35:27.116765603 CET;192.168.1.102;192.168.1.104;49908;1883;73;Publish Message [topic];message029
374;Jan 13, 2022 15:35:27.116782223 CET;192.168.1.102;192.168.1.104;49908;1883;56;Disconnect Req;
375;Jan 13, 2022 15:35:27.756523013 CET;192.168.1.102;192.168.1.104;49908;1883;75;[TCP Retransmission] 49908 → 1883 [FIN, PSH, ACK] Seq=55 Ack=5 Win=42336 Len=21;
376;Jan 13, 2022 15:35:27.868350434 CET;192.168.1.104;192.168.1.102;1883;49908;54;1883 → 49908 [FIN, ACK] Seq=5 Ack=77 Win=8192 Len=0;
377;Jan 13, 2022 15:35:27.868374723 CET;192.168.1.102;192.168.1.104;49908;1883;54;49908 → 1883 [ACK] Seq=77 Ack=6 Win=42335 Len=0;
378;Jan 13, 2022 15:35:32.125301925 CET;192.168.1.102;192.168.1.104;49910;1883;74;49910 → 1883 [SYN] Seq=0 Win=42340 Len=0 MSS=1460 SACK_PERM=1 TSval=1796637021 TSecr=0 WS=512;
379;Jan 13, 2022 15:35:32.239041577 CET;192.168.1.104;192.168.1.102;1883;49910;58;1883 → 49910 [SYN, ACK] Seq=0 Ack=1 Win=8192 Len=0 MSS=1460;
380;Jan 13, 2022 15:35:32.239072500 CET;192.168.1.102;192.168.1.104;49910;1883;54;49910 → 1883 [ACK] Seq=1 Ack=1 Win=42340 Len=0;
381;Jan 13, 2022 15:35:32.239117033 CET;192.168.1.102;192.168.1.104;49910;1883;108;Connect Command;
382;Jan 13, 2022 15:35:32.588521614 CET;192.168.1.102;192.168.1.104;49910;1883;108;[TCP Retransmission] 49910 → 1883 [PSH, ACK] Seq=1 Ack=1 Win=42340 Len=54;
383;Jan 13, 2022 15:35:32.696641733 CET;192.168.1.104;192.168.1.102;1883;49910;54;1883 → 49910 [ACK] Seq=1 Ack=55 Win=8192 Len=0;
384;Jan 13, 2022 15:35:32.702097336 CET;192.168.1.104;192.168.1.102;1883;49910;58;Connect Ack;
385;Jan 13, 2022 15:35:32.702120150 CET;192.168.1.102;192.168.1.104;49910;1883;54;49910 → 1883 [ACK] Seq=55 Ack=5 Win=42336 Len=0;
386;Jan 13, 2022 15:35:32.702195052 CET;192.168.1.102;192.168.1.104;49910;1883;73;Publish Message [topic];message030
387;Jan 13, 2022 15:35:32.702215925 CET;192.168.1.102;192.168.1.104;49910;1883;56;Disconnect Req;
388;Jan 13, 2022 15:35:33.420554950 CET;192.168.1.102;192.168.1.104;49910;1883;75;[TCP Retransmission] 49910 → 1883 [FIN, PSH, ACK] Seq=55 Ack=5 Win=42336 Len=21;
389;Jan 13, 2022 15:35:33.526326057 CET;192.168.1.104;192.168.1.102;1883;49910;54;1883 → 49910 [FIN, ACK] Seq=5 Ack=77 Win=8192 Len=0;
390;Jan 13, 2022 15:35:33.526351064 CET;192.168.1.102;192.168.1.104;49910;1883;54;49910 → 1883 [ACK] Seq=77 Ack=6 Win=42335 Len=0;
391;Jan 13, 2022 15:35:37.711189580 CET;192.168.1.102;192.168.1.104;49912;1883;74;49912 → 1883 [SYN] Seq=0 Win=42340 Len=0 MSS=1460 SACK_PERM=1 TSval=1796642607 TSecr=0 WS=512;
392;Jan 13, 2022 15:35:37.831570745 CET;192.168.1.104;192.168.1.102;1883;49912;58;1883 → 49912 [SYN, ACK] Seq=0 Ack=1 Win=8192 Len=0 MSS=1460;
393;Jan 13, 2022 15:35:37.831602343 CET;192.168.1.102;192.168.1.104;49912;1883;54;49912 → 1883 [ACK] Seq=1 Ack=1 Win=42340 Len=0;
394;Jan 13, 2022 15:35:37.831663749 CET;192.168.1.102;192.168.1.104;49912;1883;108;Connect Command;
395;Jan 13, 2022 15:35:38.220617704 CET;192.168.1.102;192.168.1.104;49912;1883;108;[TCP Retransmission] 49912 → 1883 [PSH, ACK] Seq=1 Ack=1 Win=42340 Len=54;
396;Jan 13, 2022 15:35:38.329951810 CET;192.168.1.104;192.168.1.102;1883;49912;54;1883 → 49912 [ACK] Seq=1 Ack=55 Win=8192 Len=0;
397;Jan 13, 2022 15:35:38.333478051 CET;192.168.1.104;192.168.1.102;1883;49912;58;Connect Ack;
398;Jan 13, 2022 15:35:38.333497986 CET;192.168.1.102;192.168.1.104;49912;1883;54;49912 → 1883 [ACK] Seq=55 Ack=5 Win=42336 Len=0;
399;Jan 13, 2022 15:35:38.333558462 CET;192.168.1.102;192.168.1.104;49912;1883;73;Publish Message [topic];message031
400;Jan 13, 2022 15:35:38.333574899 CET;192.168.1.102;192.168.1.104;49912;1883;56;Disconnect Req;
401;Jan 13, 2022 15:35:39.084540133 CET;192.168.1.102;192.168.1.104;49912;1883;75;[TCP Retransmission] 49912 → 1883 [FIN, PSH, ACK] Seq=55 Ack=5 Win=42336 Len=21;
402;Jan 13, 2022 15:35:39.197625591 CET;192.168.1.104;192.168.1.102;1883;49912;54;1883 → 49912 [FIN, ACK] Seq=5 Ack=77 Win=8192 Len=0;
403;Jan 13, 2022 15:35:39.197649175 CET;192.168.1.102;192.168.1.104;49912;1883;54;49912 → 1883 [ACK] Seq=77 Ack=6 Win=42335 Len=0;
404;Jan 13, 2022 15:35:43.343404486 CET;192.168.1.102;192.168.1.104;49914;1883;74;49914 → 1883 [SYN] Seq=0 Win=42340 Len=0 MSS=1460 SACK_PERM=1 TSval=1796648239 TSecr=0 WS=512;
405;Jan 13, 2022 15:35:43.447574986 CET;192.168.1.104;192.168.1.102;1883;49914;58;1883 → 49914 [SYN, ACK] Seq=0 Ack=1 Win=8192 Len=0 MSS=1460;
406;Jan 13, 2022 15:35:43.447608598 CET;192.168.1.102;192.168.1.104;49914;1883;54;49914 → 1883 [ACK] Seq=1 Ack=1 Win=42340 Len=0;
407;Jan 13, 2022 15:35:43.447662635 CET;192.168.1.102;192.168.1.104;49914;1883;108;Connect Command;
408;Jan 13, 2022 15:35:43.788614219 CET;192.168.1.102;192.168.1.104;49914;1883;108;[TCP Retransmission] 49914 → 1883 [PSH, ACK] Seq=1 Ack=1 Win=42340 Len=54;
409;Jan 13, 2022 15:35:43.897636682 CET;192.168.1.104;192.168.1.102;1883;49914;54;1883 → 49914 [ACK] Seq=1 Ack=55 Win=8192 Len=0;
410;Jan 13, 2022 15:35:43.901406641 CET;192.168.1.104;192.168.1.102;1883;49914;58;Connect Ack;
411;Jan 13, 2022 15:35:43.901424410 CET;192.168.1.102;192.168.1.104;49914;1883;54;49914 → 1883 [ACK] Seq=55 Ack=5 Win=42336 Len=0;
412;Jan 13, 2022 15:35:43.901481963 CET;192.168.1.102;192.168.1.104;49914;1883;73;Publish Message [topic];message032
413;Jan 13, 2022 15:35:43.901497517 CET;192.168.1.102;192.168.1.104;49914;1883;56;Disconnect Req;
414;Jan 13, 2022 15:35:44.556640619 CET;192.168.1.102;192.168.1.104;49914;1883;75;[TCP Retransmission] 49914 → 1883 [FIN, PSH, ACK] Seq=55 Ack=5 Win=42336 Len=21;
415;Jan 13, 2022 15:35:44.665152924 CET;192.168.1.104;192.168.1.102;1883;49914;54;1883 → 49914 [FIN, ACK] Seq=5 Ack=77 Win=8192 Len=0;
416;Jan 13, 2022 15:35:44.665177405 CET;192.168.1.102;192.168.1.104;49914;1883;54;49914 → 1883 [ACK] Seq=77 Ack=6 Win=42335 Len=0;
417;Jan 13, 2022 15:35:48.914990046 CET;192.168.1.102;192.168.1.104;49916;1883;74;49916 → 1883 [SYN] Seq=0 Win=42340 Len=0 MSS=1460 SACK_PERM=1 TSval=1796653811 TSecr=0 WS=512;
418;Jan 13, 2022 15:35:49.034902751 CET;192.168.1.104;192.168.1.102;1883;49916;58;1883 → 49916 [SYN, ACK] Seq=0 Ack=1 Win=8192 Len=0 MSS=1460;
419;Jan 13, 2022 15:35:49.034948194 CET;192.168.1.102;192.168.1.104;49916;1883;54;49916 → 1883 [ACK] Seq=1 Ack=1 Win=42340 Len=0;
420;Jan 13, 2022 15:35:49.035021540 CET;192.168.1.102;192.168.1.104;49916;1883;108;Connect Command;
421;Jan 13, 2022 15:35:49.420532927 CET;192.168.1.102;192.168.1.104;49916;1883;108;[TCP Retransmission] 49916 → 1883 [PSH, ACK] Seq=1 Ack=1 Win=42340 Len=54;
422;Jan 13, 2022 15:35:49.541698113 CET;192.168.1.104;192.168.1.102;1883;49916;54;1883 → 49916 [ACK] Seq=1 Ack=55 Win=8192 Len=0;
423;Jan 13, 2022 15:35:49.548576776 CET;192.168.1.104;192.168.1.102;1883;49916;58;Connect Ack;
424;Jan 13, 2022 15:35:49.548594795 CET;192.168.1.102;192.168.1.104;49916;1883;54;49916 → 1883 [ACK] Seq=55 Ack=5 Win=42336 Len=0;
425;Jan 13, 2022 15:35:49.548650383 CET;192.168.1.102;192.168.1.104;49916;1883;73;Publish Message [topic];message033
426;Jan 13, 2022 15:35:49.548667337 CET;192.168.1.102;192.168.1.104;49916;1883;56;Disconnect Req;
427;Jan 13, 2022 15:35:50.284873977 CET;192.168.1.102;192.168.1.104;49916;1883;75;[TCP Retransmission] 49916 → 1883 [FIN, PSH, ACK] Seq=55 Ack=5 Win=42336 Len=21;
428;Jan 13, 2022 15:35:50.390148429 CET;192.168.1.104;192.168.1.102;1883;49916;54;1883 → 49916 [FIN, ACK] Seq=5 Ack=77 Win=8192 Len=0;
429;Jan 13, 2022 15:35:50.390173496 CET;192.168.1.102;192.168.1.104;49916;1883;54;49916 → 1883 [ACK] Seq=77 Ack=6 Win=42335 Len=0;
430;Jan 13, 2022 15:35:54.555761900 CET;192.168.1.102;192.168.1.104;49918;1883;74;49918 → 1883 [SYN] Seq=0 Win=42340 Len=0 MSS=1460 SACK_PERM=1 TSval=1796659451 TSecr=0 WS=512;
431;Jan 13, 2022 15:35:54.666616280 CET;192.168.1.104;192.168.1.102;1883;49918;58;1883 → 49918 [SYN, ACK] Seq=0 Ack=1 Win=8192 Len=0 MSS=1460;
432;Jan 13, 2022 15:35:54.666665350 CET;192.168.1.102;192.168.1.104;49918;1883;54;49918 → 1883 [ACK] Seq=1 Ack=1 Win=42340 Len=0;
433;Jan 13, 2022 15:35:54.666734990 CET;192.168.1.102;192.168.1.104;49918;1883;108;Connect Command;
434;Jan 13, 2022 15:35:55.020558874 CET;192.168.1.102;192.168.1.104;49918;1883;108;[TCP Retransmission] 49918 → 1883 [PSH, ACK] Seq=1 Ack=1 Win=42340 Len=54;
435;Jan 13, 2022 15:35:55.136501966 CET;192.168.1.104;192.168.1.102;1883;49918;54;1883 → 49918 [ACK] Seq=1 Ack=55 Win=8192 Len=0;
436;Jan 13, 2022 15:35:55.138525397 CET;192.168.1.104;192.168.1.102;1883;49918;58;Connect Ack;
437;Jan 13, 2022 15:35:55.138543092 CET;192.168.1.102;192.168.1.104;49918;1883;54;49918 → 1883 [ACK] Seq=55 Ack=5 Win=42336 Len=0;
438;Jan 13, 2022 15:35:55.138596456 CET;192.168.1.102;192.168.1.104;49918;1883;73;Publish Message [topic];message034
439;Jan 13, 2022 15:35:55.138611877 CET;192.168.1.102;192.168.1.104;49918;1883;56;Disconnect Req;
440;Jan 13, 2022 15:35:55.820573073 CET;192.168.1.102;192.168.1.104;49918;1883;75;[TCP Retransmission] 49918 → 1883 [FIN, PSH, ACK] Seq=55 Ack=5 Win=42336 Len=21;
441;Jan 13, 2022 15:35:55.938342178 CET;192.168.1.104;192.168.1.102;1883;49918;54;1883 → 49918 [FIN, ACK] Seq=5 Ack=77 Win=8192 Len=0;
442;Jan 13, 2022 15:35:55.938364789 CET;192.168.1.102;192.168.1.104;49918;1883;54;49918 → 1883 [ACK] Seq=77 Ack=6 Win=42335 Len=0;
443;Jan 13, 2022 15:36:00.144645735 CET;192.168.1.102;192.168.1.104;49920;1883;74;49920 → 1883 [SYN] Seq=0 Win=42340 Len=0 MSS=1460 SACK_PERM=1 TSval=1796665040 TSecr=0 WS=512;
444;Jan 13, 2022 15:36:00.249322855 CET;192.168.1.104;192.168.1.102;1883;49920;58;1883 → 49920 [SYN, ACK] Seq=0 Ack=1 Win=8192 Len=0 MSS=1460;
445;Jan 13, 2022 15:36:00.249359324 CET;192.168.1.102;192.168.1.104;49920;1883;54;49920 → 1883 [ACK] Seq=1 Ack=1 Win=42340 Len=0;
446;Jan 13, 2022 15:36:00.249418585 CET;192.168.1.102;192.168.1.104;49920;1883;108;Connect Command;
447;Jan 13, 2022 15:36:00.588952148 CET;192.168.1.102;192.168.1.104;49920;1883;108;[TCP Retransmission] 49920 → 1883 [PSH, ACK] Seq=1 Ack=1 Win=42340 Len=54;
448;Jan 13, 2022 15:36:00.696520612 CET;192.168.1.104;192.168.1.102;1883;49920;54;1883 → 49920 [ACK] Seq=1 Ack=55 Win=8192 Len=0;
449;Jan 13, 2022 15:36:00.700634379 CET;192.168.1.104;192.168.1.102;1883;49920;58;Connect Ack;
450;Jan 13, 2022 15:36:00.700660906 CET;192.168.1.102;192.168.1.104;49920;1883;54;49920 → 1883 [ACK] Seq=55 Ack=5 Win=42336 Len=0;
451;Jan 13, 2022 15:36:00.700753699 CET;192.168.1.102;192.168.1.104;49920;1883;73;Publish Message [topic];message035
452;Jan 13, 2022 15:36:00.700779369 CET;192.168.1.102;192.168.1.104;49920;1883;56;Disconnect Req;
453;Jan 13, 2022 15:36:01.356809490 CET;192.168.1.102;192.168.1.104;49920;1883;75;[TCP Retransmission] 49920 → 1883 [FIN, PSH, ACK] Seq=55 Ack=5 Win=42336 Len=21;
454;Jan 13, 2022 15:36:01.461530540 CET;192.168.1.104;192.168.1.102;1883;49920;54;1883 → 49920 [FIN, ACK] Seq=5 Ack=77 Win=8192 Len=0;
455;Jan 13, 2022 15:36:01.461553297 CET;192.168.1.102;192.168.1.104;49920;1883;54;49920 → 1883 [ACK] Seq=77 Ack=6 Win=42335 Len=0;
456;Jan 13, 2022 15:36:05.716973657 CET;192.168.1.102;192.168.1.104;49922;1883;74;49922 → 1883 [SYN] Seq=0 Win=42340 Len=0 MSS=1460 SACK_PERM=1 TSval=1796670613 TSecr=0 WS=512;
457;Jan 13, 2022 15:36:05.821407993 CET;192.168.1.104;192.168.1.102;1883;49922;58;1883 → 49922 [SYN, ACK] Seq=0 Ack=1 Win=8192 Len=0 MSS=1460;
458;Jan 13, 2022 15:36:05.821431911 CET;192.168.1.102;192.168.1.104;49922;1883;54;49922 → 1883 [ACK] Seq=1 Ack=1 Win=42340 Len=0;
459;Jan 13, 2022 15:36:05.821469791 CET;192.168.1.102;192.168.1.104;49922;1883;108;Connect Command;
460;Jan 13, 2022 15:36:06.672678033 CET;192.168.1.102;192.168.1.104;49922;1883;108;[TCP Retransmission] 49922 → 1883 [PSH, ACK] Seq=1 Ack=1 Win=42340 Len=54;
461;Jan 13, 2022 15:36:06.777020759 CET;192.168.1.104;192.168.1.102;1883;49922;54;1883 → 49922 [ACK] Seq=1 Ack=55 Win=8192 Len=0;
462;Jan 13, 2022 15:36:06.779827335 CET;192.168.1.104;192.168.1.102;1883;49922;58;Connect Ack;
463;Jan 13, 2022 15:36:06.779842757 CET;192.168.1.102;192.168.1.104;49922;1883;54;49922 → 1883 [ACK] Seq=55 Ack=5 Win=42336 Len=0;
464;Jan 13, 2022 15:36:06.779883802 CET;192.168.1.102;192.168.1.104;49922;1883;73;Publish Message [topic];message036
465;Jan 13, 2022 15:36:06.779898031 CET;192.168.1.102;192.168.1.104;49922;1883;56;Disconnect Req;
466;Jan 13, 2022 15:36:07.436517128 CET;192.168.1.102;192.168.1.104;49922;1883;75;[TCP Retransmission] 49922 → 1883 [FIN, PSH, ACK] Seq=55 Ack=5 Win=42336 Len=21;
467;Jan 13, 2022 15:36:07.545979624 CET;192.168.1.104;192.168.1.102;1883;49922;54;1883 → 49922 [FIN, ACK] Seq=5 Ack=77 Win=8192 Len=0;
468;Jan 13, 2022 15:36:07.546003570 CET;192.168.1.102;192.168.1.104;49922;1883;54;49922 → 1883 [ACK] Seq=77 Ack=6 Win=42335 Len=0;
469;Jan 13, 2022 15:36:11.795420567 CET;192.168.1.102;192.168.1.104;49924;1883;74;49924 → 1883 [SYN] Seq=0 Win=42340 Len=0 MSS=1460 SACK_PERM=1 TSval=1796676691 TSecr=0 WS=512;
470;Jan 13, 2022 15:36:11.909398972 CET;192.168.1.104;192.168.1.102;1883;49924;58;1883 → 49924 [SYN, ACK] Seq=0 Ack=1 Win=8192 Len=0 MSS=1460;
471;Jan 13, 2022 15:36:11.909431601 CET;192.168.1.102;192.168.1.104;49924;1883;54;49924 → 1883 [ACK] Seq=1 Ack=1 Win=42340 Len=0;
472;Jan 13, 2022 15:36:11.909483822 CET;192.168.1.102;192.168.1.104;49924;1883;108;Connect Command;
473;Jan 13, 2022 15:36:12.269093030 CET;192.168.1.102;192.168.1.104;49924;1883;108;[TCP Retransmission] 49924 → 1883 [PSH, ACK] Seq=1 Ack=1 Win=42340 Len=54;
474;Jan 13, 2022 15:36:12.391440872 CET;192.168.1.104;192.168.1.102;1883;49924;54;1883 → 49924 [ACK] Seq=1 Ack=55 Win=8192 Len=0;
475;Jan 13, 2022 15:36:12.397711652 CET;192.168.1.104;192.168.1.102;1883;49924;58;Connect Ack;
476;Jan 13, 2022 15:36:12.397729075 CET;192.168.1.102;192.168.1.104;49924;1883;54;49924 → 1883 [ACK] Seq=55 Ack=5 Win=42336 Len=0;
477;Jan 13, 2022 15:36:12.397776814 CET;192.168.1.102;192.168.1.104;49924;1883;73;Publish Message [topic];message037
478;Jan 13, 2022 15:36:12.397790552 CET;192.168.1.102;192.168.1.104;49924;1883;56;Disconnect Req;
479;Jan 13, 2022 15:36:13.100527317 CET;192.168.1.102;192.168.1.104;49924;1883;75;[TCP Retransmission] 49924 → 1883 [FIN, PSH, ACK] Seq=55 Ack=5 Win=42336 Len=21;
480;Jan 13, 2022 15:36:13.207255583 CET;192.168.1.104;192.168.1.102;1883;49924;54;1883 → 49924 [FIN, ACK] Seq=5 Ack=77 Win=8192 Len=0;
481;Jan 13, 2022 15:36:13.207278507 CET;192.168.1.102;192.168.1.104;49924;1883;54;49924 → 1883 [ACK] Seq=77 Ack=6 Win=42335 Len=0;
482;Jan 13, 2022 15:36:17.402141597 CET;192.168.1.102;192.168.1.104;49926;1883;74;49926 → 1883 [SYN] Seq=0 Win=42340 Len=0 MSS=1460 SACK_PERM=1 TSval=1796682298 TSecr=0 WS=512;
483;Jan 13, 2022 15:36:17.510768804 CET;192.168.1.104;192.168.1.102;1883;49926;58;1883 → 49926 [SYN, ACK] Seq=0 Ack=1 Win=8192 Len=0 MSS=1460;
484;Jan 13, 2022 15:36:17.510844304 CET;192.168.1.102;192.168.1.104;49926;1883;54;49926 → 1883 [ACK] Seq=1 Ack=1 Win=42340 Len=0;
485;Jan 13, 2022 15:36:17.510986202 CET;192.168.1.102;192.168.1.104;49926;1883;108;Connect Command;
486;Jan 13, 2022 15:36:17.868547587 CET;192.168.1.102;192.168.1.104;49926;1883;108;[TCP Retransmission] 49926 → 1883 [PSH, ACK] Seq=1 Ack=1 Win=42340 Len=54;
487;Jan 13, 2022 15:36:17.978173605 CET;192.168.1.104;192.168.1.102;1883;49926;54;1883 → 49926 [ACK] Seq=1 Ack=55 Win=8192 Len=0;
488;Jan 13, 2022 15:36:17.983456543 CET;192.168.1.104;192.168.1.102;1883;49926;58;Connect Ack;
489;Jan 13, 2022 15:36:17.983476326 CET;192.168.1.102;192.168.1.104;49926;1883;54;49926 → 1883 [ACK] Seq=55 Ack=5 Win=42336 Len=0;
490;Jan 13, 2022 15:36:17.983546823 CET;192.168.1.102;192.168.1.104;49926;1883;73;Publish Message [topic];message038
491;Jan 13, 2022 15:36:17.983566048 CET;192.168.1.102;192.168.1.104;49926;1883;56;Disconnect Req;
492;Jan 13, 2022 15:36:18.668637469 CET;192.168.1.102;192.168.1.104;49926;1883;75;[TCP Retransmission] 49926 → 1883 [FIN, PSH, ACK] Seq=55 Ack=5 Win=42336 Len=21;
493;Jan 13, 2022 15:36:18.792359169 CET;192.168.1.104;192.168.1.102;1883;49926;54;1883 → 49926 [FIN, ACK] Seq=5 Ack=77 Win=8192 Len=0;
494;Jan 13, 2022 15:36:18.792403272 CET;192.168.1.102;192.168.1.104;49926;1883;54;49926 → 1883 [ACK] Seq=77 Ack=6 Win=42335 Len=0;
495;Jan 13, 2022 15:36:22.987684651 CET;192.168.1.102;192.168.1.104;49928;1883;74;49928 → 1883 [SYN] Seq=0 Win=42340 Len=0 MSS=1460 SACK_PERM=1 TSval=1796687883 TSecr=0 WS=512;
496;Jan 13, 2022 15:36:23.092451561 CET;192.168.1.104;192.168.1.102;1883;49928;58;1883 → 49928 [SYN, ACK] Seq=0 Ack=1 Win=8192 Len=0 MSS=1460;
497;Jan 13, 2022 15:36:23.092482693 CET;192.168.1.102;192.168.1.104;49928;1883;54;49928 → 1883 [ACK] Seq=1 Ack=1 Win=42340 Len=0;
498;Jan 13, 2022 15:36:23.092532469 CET;192.168.1.102;192.168.1.104;49928;1883;108;Connect Command;
499;Jan 13, 2022 15:36:23.436728675 CET;192.168.1.102;192.168.1.104;49928;1883;108;[TCP Retransmission] 49928 → 1883 [PSH, ACK] Seq=1 Ack=1 Win=42340 Len=54;
500;Jan 13, 2022 15:36:23.546550201 CET;192.168.1.104;192.168.1.102;1883;49928;54;1883 → 49928 [ACK] Seq=1 Ack=55 Win=8192 Len=0;
501;Jan 13, 2022 15:36:23.549929518 CET;192.168.1.104;192.168.1.102;1883;49928;58;Connect Ack;
502;Jan 13, 2022 15:36:23.549949902 CET;192.168.1.102;192.168.1.104;49928;1883;54;49928 → 1883 [ACK] Seq=55 Ack=5 Win=42336 Len=0;
503;Jan 13, 2022 15:36:23.550022131 CET;192.168.1.102;192.168.1.104;49928;1883;73;Publish Message [topic];message039
504;Jan 13, 2022 15:36:23.550042238 CET;192.168.1.102;192.168.1.104;49928;1883;56;Disconnect Req;
505;Jan 13, 2022 15:36:24.204528940 CET;192.168.1.102;192.168.1.104;49928;1883;75;[TCP Retransmission] 49928 → 1883 [FIN, PSH, ACK] Seq=55 Ack=5 Win=42336 Len=21;
506;Jan 13, 2022 15:36:24.317158836 CET;192.168.1.104;192.168.1.102;1883;49928;54;1883 → 49928 [FIN, ACK] Seq=5 Ack=77 Win=8192 Len=0;
507;Jan 13, 2022 15:36:24.317180674 CET;192.168.1.102;192.168.1.104;49928;1883;54;49928 → 1883 [ACK] Seq=77 Ack=6 Win=42335 Len=0;
508;Jan 13, 2022 15:36:28.565134774 CET;192.168.1.102;192.168.1.104;49930;1883;74;49930 → 1883 [SYN] Seq=0 Win=42340 Len=0 MSS=1460 SACK_PERM=1 TSval=1796693461 TSecr=0 WS=512;
509;Jan 13, 2022 15:36:28.676316875 CET;192.168.1.104;192.168.1.102;1883;49930;58;1883 → 49930 [SYN, ACK] Seq=0 Ack=1 Win=8192 Len=0 MSS=1460;
510;Jan 13, 2022 15:36:28.676347662 CET;192.168.1.102;192.168.1.104;49930;1883;54;49930 → 1883 [ACK] Seq=1 Ack=1 Win=42340 Len=0;
511;Jan 13, 2022 15:36:28.676393791 CET;192.168.1.102;192.168.1.104;49930;1883;108;Connect Command;
512;Jan 13, 2022 15:36:29.036554557 CET;192.168.1.102;192.168.1.104;49930;1883;108;[TCP Retransmission] 49930 → 1883 [PSH, ACK] Seq=1 Ack=1 Win=42340 Len=54;
513;Jan 13, 2022 15:36:29.142136508 CET;192.168.1.104;192.168.1.102;1883;49930;54;1883 → 49930 [ACK] Seq=1 Ack=55 Win=8192 Len=0;
514;Jan 13, 2022 15:36:29.147602269 CET;192.168.1.104;192.168.1.102;1883;49930;58;Connect Ack;
515;Jan 13, 2022 15:36:29.147633359 CET;192.168.1.102;192.168.1.104;49930;1883;54;49930 → 1883 [ACK] Seq=55 Ack=5 Win=42336 Len=0;
516;Jan 13, 2022 15:36:29.147749638 CET;192.168.1.102;192.168.1.104;49930;1883;73;Publish Message [topic];message040
517;Jan 13, 2022 15:36:29.147783086 CET;192.168.1.102;192.168.1.104;49930;1883;56;Disconnect Req;
518;Jan 13, 2022 15:36:29.836776926 CET;192.168.1.102;192.168.1.104;49930;1883;75;[TCP Retransmission] 49930 → 1883 [FIN, PSH, ACK] Seq=55 Ack=5 Win=42336 Len=21;
519;Jan 13, 2022 15:36:29.946087476 CET;192.168.1.104;192.168.1.102;1883;49930;54;1883 → 49930 [FIN, ACK] Seq=5 Ack=77 Win=8192 Len=0;
520;Jan 13, 2022 15:36:29.946115811 CET;192.168.1.102;192.168.1.104;49930;1883;54;49930 → 1883 [ACK] Seq=77 Ack=6 Win=42335 Len=0;
521;Jan 13, 2022 15:36:34.154345977 CET;192.168.1.102;192.168.1.104;49932;1883;74;49932 → 1883 [SYN] Seq=0 Win=42340 Len=0 MSS=1460 SACK_PERM=1 TSval=1796699050 TSecr=0 WS=512;
522;Jan 13, 2022 15:36:34.272708700 CET;192.168.1.104;192.168.1.102;1883;49932;58;1883 → 49932 [SYN, ACK] Seq=0 Ack=1 Win=8192 Len=0 MSS=1460;
523;Jan 13, 2022 15:36:34.272746106 CET;192.168.1.102;192.168.1.104;49932;1883;54;49932 → 1883 [ACK] Seq=1 Ack=1 Win=42340 Len=0;
524;Jan 13, 2022 15:36:34.272803553 CET;192.168.1.102;192.168.1.104;49932;1883;108;Connect Command;
525;Jan 13, 2022 15:36:34.636530702 CET;192.168.1.102;192.168.1.104;49932;1883;108;[TCP Retransmission] 49932 → 1883 [PSH, ACK] Seq=1 Ack=1 Win=42340 Len=54;
526;Jan 13, 2022 15:36:34.741938341 CET;192.168.1.104;192.168.1.102;1883;49932;54;1883 → 49932 [ACK] Seq=1 Ack=55 Win=8192 Len=0;
527;Jan 13, 2022 15:36:34.745985039 CET;192.168.1.104;192.168.1.102;1883;49932;58;Connect Ack;
528;Jan 13, 2022 15:36:34.746002772 CET;192.168.1.102;192.168.1.104;49932;1883;54;49932 → 1883 [ACK] Seq=55 Ack=5 Win=42336 Len=0;
529;Jan 13, 2022 15:36:34.746051259 CET;192.168.1.102;192.168.1.104;49932;1883;73;Publish Message [topic];message041
530;Jan 13, 2022 15:36:34.746066389 CET;192.168.1.102;192.168.1.104;49932;1883;56;Disconnect Req;
531;Jan 13, 2022 15:36:35.468634398 CET;192.168.1.102;192.168.1.104;49932;1883;75;[TCP Retransmission] 49932 → 1883 [FIN, PSH, ACK] Seq=55 Ack=5 Win=42336 Len=21;
532;Jan 13, 2022 15:36:35.589869660 CET;192.168.1.104;192.168.1.102;1883;49932;54;1883 → 49932 [FIN, ACK] Seq=5 Ack=77 Win=8192 Len=0;
533;Jan 13, 2022 15:36:35.589890245 CET;192.168.1.102;192.168.1.104;49932;1883;54;49932 → 1883 [ACK] Seq=77 Ack=6 Win=42335 Len=0;
534;Jan 13, 2022 15:36:39.758407623 CET;192.168.1.102;192.168.1.104;49934;1883;74;49934 → 1883 [SYN] Seq=0 Win=42340 Len=0 MSS=1460 SACK_PERM=1 TSval=1796704654 TSecr=0 WS=512;
535;Jan 13, 2022 15:36:39.878009838 CET;192.168.1.104;192.168.1.102;1883;49934;58;1883 → 49934 [SYN, ACK] Seq=0 Ack=1 Win=8192 Len=0 MSS=1460;
536;Jan 13, 2022 15:36:39.878042668 CET;192.168.1.102;192.168.1.104;49934;1883;54;49934 → 1883 [ACK] Seq=1 Ack=1 Win=42340 Len=0;
537;Jan 13, 2022 15:36:39.878121245 CET;192.168.1.102;192.168.1.104;49934;1883;108;Connect Command;
538;Jan 13, 2022 15:36:40.268526804 CET;192.168.1.102;192.168.1.104;49934;1883;108;[TCP Retransmission] 49934 → 1883 [PSH, ACK] Seq=1 Ack=1 Win=42340 Len=54;
539;Jan 13, 2022 15:36:40.391316912 CET;192.168.1.104;192.168.1.102;1883;49934;54;1883 → 49934 [ACK] Seq=1 Ack=55 Win=8192 Len=0;
540;Jan 13, 2022 15:36:40.397769672 CET;192.168.1.104;192.168.1.102;1883;49934;58;Connect Ack;
541;Jan 13, 2022 15:36:40.397809391 CET;192.168.1.102;192.168.1.104;49934;1883;54;49934 → 1883 [ACK] Seq=55 Ack=5 Win=42336 Len=0;
542;Jan 13, 2022 15:36:40.397916369 CET;192.168.1.102;192.168.1.104;49934;1883;73;Publish Message [topic];message042
543;Jan 13, 2022 15:36:40.397995733 CET;192.168.1.102;192.168.1.104;49934;1883;56;Disconnect Req;
544;Jan 13, 2022 15:36:41.132627800 CET;192.168.1.102;192.168.1.104;49934;1883;75;[TCP Retransmission] 49934 → 1883 [FIN, PSH, ACK] Seq=55 Ack=5 Win=42336 Len=21;
545;Jan 13, 2022 15:36:41.250548821 CET;192.168.1.104;192.168.1.102;1883;49934;54;1883 → 49934 [FIN, ACK] Seq=5 Ack=77 Win=8192 Len=0;
546;Jan 13, 2022 15:36:41.250572581 CET;192.168.1.102;192.168.1.104;49934;1883;54;49934 → 1883 [ACK] Seq=77 Ack=6 Win=42335 Len=0;
547;Jan 13, 2022 15:36:45.406271088 CET;192.168.1.102;192.168.1.104;49936;1883;74;49936 → 1883 [SYN] Seq=0 Win=42340 Len=0 MSS=1460 SACK_PERM=1 TSval=1796710302 TSecr=0 WS=512;
548;Jan 13, 2022 15:36:45.510235477 CET;192.168.1.104;192.168.1.102;1883;49936;58;1883 → 49936 [SYN, ACK] Seq=0 Ack=1 Win=8192 Len=0 MSS=1460;
549;Jan 13, 2022 15:36:45.510262740 CET;192.168.1.102;192.168.1.104;49936;1883;54;49936 → 1883 [ACK] Seq=1 Ack=1 Win=42340 Len=0;
550;Jan 13, 2022 15:36:45.510300163 CET;192.168.1.102;192.168.1.104;49936;1883;108;Connect Command;
551;Jan 13, 2022 15:36:45.836585792 CET;192.168.1.102;192.168.1.104;49936;1883;108;[TCP Retransmission] 49936 → 1883 [PSH, ACK] Seq=1 Ack=1 Win=42340 Len=54;
552;Jan 13, 2022 15:36:45.948536886 CET;192.168.1.104;192.168.1.102;1883;49936;54;1883 → 49936 [ACK] Seq=1 Ack=55 Win=8192 Len=0;
553;Jan 13, 2022 15:36:45.953544324 CET;192.168.1.104;192.168.1.102;1883;49936;58;Connect Ack;
554;Jan 13, 2022 15:36:45.953566169 CET;192.168.1.102;192.168.1.104;49936;1883;54;49936 → 1883 [ACK] Seq=55 Ack=5 Win=42336 Len=0;
555;Jan 13, 2022 15:36:45.953640904 CET;192.168.1.102;192.168.1.104;49936;1883;73;Publish Message [topic];message043
556;Jan 13, 2022 15:36:45.953661822 CET;192.168.1.102;192.168.1.104;49936;1883;56;Disconnect Req;
557;Jan 13, 2022 15:36:46.604530231 CET;192.168.1.102;192.168.1.104;49936;1883;75;[TCP Retransmission] 49936 → 1883 [FIN, PSH, ACK] Seq=55 Ack=5 Win=42336 Len=21;
558;Jan 13, 2022 15:36:46.724213718 CET;192.168.1.104;192.168.1.102;1883;49936;54;1883 → 49936 [FIN, ACK] Seq=5 Ack=77 Win=8192 Len=0;
559;Jan 13, 2022 15:36:46.724235121 CET;192.168.1.102;192.168.1.104;49936;1883;54;49936 → 1883 [ACK] Seq=77 Ack=6 Win=42335 Len=0;
560;Jan 13, 2022 15:36:50.958658937 CET;192.168.1.102;192.168.1.104;49938;1883;74;49938 → 1883 [SYN] Seq=0 Win=42340 Len=0 MSS=1460 SACK_PERM=1 TSval=1796715854 TSecr=0 WS=512;
561;Jan 13, 2022 15:36:51.065184995 CET;192.168.1.104;192.168.1.102;1883;49938;58;1883 → 49938 [SYN, ACK] Seq=0 Ack=1 Win=8192 Len=0 MSS=1460;
562;Jan 13, 2022 15:36:51.065214358 CET;192.168.1.102;192.168.1.104;49938;1883;54;49938 → 1883 [ACK] Seq=1 Ack=1 Win=42340 Len=0;
563;Jan 13, 2022 15:36:51.065260302 CET;192.168.1.102;192.168.1.104;49938;1883;108;Connect Command;
564;Jan 13, 2022 15:36:51.404575940 CET;192.168.1.102;192.168.1.104;49938;1883;108;[TCP Retransmission] 49938 → 1883 [PSH, ACK] Seq=1 Ack=1 Win=42340 Len=54;
565;Jan 13, 2022 15:36:51.525622832 CET;192.168.1.104;192.168.1.102;1883;49938;54;1883 → 49938 [ACK] Seq=1 Ack=55 Win=8192 Len=0;
566;Jan 13, 2022 15:36:51.532603216 CET;192.168.1.104;192.168.1.102;1883;49938;58;Connect Ack;
567;Jan 13, 2022 15:36:51.532620016 CET;192.168.1.102;192.168.1.104;49938;1883;54;49938 → 1883 [ACK] Seq=55 Ack=5 Win=42336 Len=0;
568;Jan 13, 2022 15:36:51.532670420 CET;192.168.1.102;192.168.1.104;49938;1883;73;Publish Message [topic];message044
569;Jan 13, 2022 15:36:51.532685543 CET;192.168.1.102;192.168.1.104;49938;1883;56;Disconnect Req;
570;Jan 13, 2022 15:36:52.204553452 CET;192.168.1.102;192.168.1.104;49938;1883;75;[TCP Retransmission] 49938 → 1883 [FIN, PSH, ACK] Seq=55 Ack=5 Win=42336 Len=21;
571;Jan 13, 2022 15:36:52.325070348 CET;192.168.1.104;192.168.1.102;1883;49938;54;1883 → 49938 [FIN, ACK] Seq=5 Ack=77 Win=8192 Len=0;
572;Jan 13, 2022 15:36:52.325093886 CET;192.168.1.102;192.168.1.104;49938;1883;54;49938 → 1883 [ACK] Seq=77 Ack=6 Win=42335 Len=0;
573;Jan 13, 2022 15:36:56.547138178 CET;192.168.1.102;192.168.1.104;49940;1883;74;49940 → 1883 [SYN] Seq=0 Win=42340 Len=0 MSS=1460 SACK_PERM=1 TSval=1796721443 TSecr=0 WS=512;
574;Jan 13, 2022 15:36:56.770531126 CET;192.168.1.104;192.168.1.102;1883;49940;58;1883 → 49940 [SYN, ACK] Seq=0 Ack=1 Win=8192 Len=0 MSS=1460;
575;Jan 13, 2022 15:36:56.770564986 CET;192.168.1.102;192.168.1.104;49940;1883;54;49940 → 1883 [ACK] Seq=1 Ack=1 Win=42340 Len=0;
576;Jan 13, 2022 15:36:56.770619972 CET;192.168.1.102;192.168.1.104;49940;1883;108;Connect Command;
577;Jan 13, 2022 15:36:57.452565564 CET;192.168.1.102;192.168.1.104;49940;1883;108;[TCP Retransmission] 49940 → 1883 [PSH, ACK] Seq=1 Ack=1 Win=42340 Len=54;
578;Jan 13, 2022 15:36:57.556843328 CET;192.168.1.104;192.168.1.102;1883;49940;54;1883 → 49940 [ACK] Seq=1 Ack=55 Win=8192 Len=0;
579;Jan 13, 2022 15:36:57.562516342 CET;192.168.1.104;192.168.1.102;1883;49940;58;Connect Ack;
580;Jan 13, 2022 15:36:57.562533932 CET;192.168.1.102;192.168.1.104;49940;1883;54;49940 → 1883 [ACK] Seq=55 Ack=5 Win=42336 Len=0;
581;Jan 13, 2022 15:36:57.562595955 CET;192.168.1.102;192.168.1.104;49940;1883;73;Publish Message [topic];message045
582;Jan 13, 2022 15:36:57.562611160 CET;192.168.1.102;192.168.1.104;49940;1883;56;Disconnect Req;
583;Jan 13, 2022 15:36:58.924805644 CET;192.168.1.102;192.168.1.104;49940;1883;75;[TCP Retransmission] 49940 → 1883 [FIN, PSH, ACK] Seq=55 Ack=5 Win=42336 Len=21;
584;Jan 13, 2022 15:36:59.029179610 CET;192.168.1.104;192.168.1.102;1883;49940;54;1883 → 49940 [FIN, ACK] Seq=5 Ack=77 Win=8192 Len=0;
585;Jan 13, 2022 15:36:59.029203255 CET;192.168.1.102;192.168.1.104;49940;1883;54;49940 → 1883 [ACK] Seq=77 Ack=6 Win=42335 Len=0;
586;Jan 13, 2022 15:37:02.566890576 CET;192.168.1.102;192.168.1.104;49942;1883;74;49942 → 1883 [SYN] Seq=0 Win=42340 Len=0 MSS=1460 SACK_PERM=1 TSval=1796727463 TSecr=0 WS=512;
587;Jan 13, 2022 15:37:02.669800999 CET;192.168.1.104;192.168.1.102;1883;49942;58;1883 → 49942 [SYN, ACK] Seq=0 Ack=1 Win=8192 Len=0 MSS=1460;
588;Jan 13, 2022 15:37:02.669833374 CET;192.168.1.102;192.168.1.104;49942;1883;54;49942 → 1883 [ACK] Seq=1 Ack=1 Win=42340 Len=0;
589;Jan 13, 2022 15:37:02.669877323 CET;192.168.1.102;192.168.1.104;49942;1883;108;Connect Command;
590;Jan 13, 2022 15:37:02.988522062 CET;192.168.1.102;192.168.1.104;49942;1883;108;[TCP Retransmission] 49942 → 1883 [PSH, ACK] Seq=1 Ack=1 Win=42340 Len=54;
591;Jan 13, 2022 15:37:03.112410280 CET;192.168.1.104;192.168.1.102;1883;49942;54;1883 → 49942 [ACK] Seq=1 Ack=55 Win=8192 Len=0;
592;Jan 13, 2022 15:37:03.114753569 CET;192.168.1.104;192.168.1.102;1883;49942;58;Connect Ack;
593;Jan 13, 2022 15:37:03.114774350 CET;192.168.1.102;192.168.1.104;49942;1883;54;49942 → 1883 [ACK] Seq=55 Ack=5 Win=42336 Len=0;
594;Jan 13, 2022 15:37:03.114831969 CET;192.168.1.102;192.168.1.104;49942;1883;73;Publish Message [topic];message046
595;Jan 13, 2022 15:37:03.114847075 CET;192.168.1.102;192.168.1.104;49942;1883;56;Disconnect Req;
596;Jan 13, 2022 15:37:03.756637413 CET;192.168.1.102;192.168.1.104;49942;1883;75;[TCP Retransmission] 49942 → 1883 [FIN, PSH, ACK] Seq=55 Ack=5 Win=42336 Len=21;
597;Jan 13, 2022 15:37:03.869110114 CET;192.168.1.104;192.168.1.102;1883;49942;54;1883 → 49942 [FIN, ACK] Seq=5 Ack=77 Win=8192 Len=0;
598;Jan 13, 2022 15:37:03.869134772 CET;192.168.1.102;192.168.1.104;49942;1883;54;49942 → 1883 [ACK] Seq=77 Ack=6 Win=42335 Len=0;
599;Jan 13, 2022 15:37:08.121687287 CET;192.168.1.102;192.168.1.104;49944;1883;74;49944 → 1883 [SYN] Seq=0 Win=42340 Len=0 MSS=1460 SACK_PERM=1 TSval=1796733017 TSecr=0 WS=512;
600;Jan 13, 2022 15:37:08.232520281 CET;192.168.1.104;192.168.1.102;1883;49944;58;1883 → 49944 [SYN, ACK] Seq=0 Ack=1 Win=8192 Len=0 MSS=1460;
601;Jan 13, 2022 15:37:08.232561546 CET;192.168.1.102;192.168.1.104;49944;1883;54;49944 → 1883 [ACK] Seq=1 Ack=1 Win=42340 Len=0;
602;Jan 13, 2022 15:37:08.232655219 CET;192.168.1.102;192.168.1.104;49944;1883;108;Connect Command;
603;Jan 13, 2022 15:37:08.588594376 CET;192.168.1.102;192.168.1.104;49944;1883;108;[TCP Retransmission] 49944 → 1883 [PSH, ACK] Seq=1 Ack=1 Win=42340 Len=54;
604;Jan 13, 2022 15:37:08.697686322 CET;192.168.1.104;192.168.1.102;1883;49944;54;1883 → 49944 [ACK] Seq=1 Ack=55 Win=8192 Len=0;
605;Jan 13, 2022 15:37:08.700851738 CET;192.168.1.104;192.168.1.102;1883;49944;58;Connect Ack;
606;Jan 13, 2022 15:37:08.700860908 CET;192.168.1.102;192.168.1.104;49944;1883;54;49944 → 1883 [ACK] Seq=55 Ack=5 Win=42336 Len=0;
607;Jan 13, 2022 15:37:08.700910328 CET;192.168.1.102;192.168.1.104;49944;1883;73;Publish Message [topic];message047
608;Jan 13, 2022 15:37:08.700925288 CET;192.168.1.102;192.168.1.104;49944;1883;56;Disconnect Req;
609;Jan 13, 2022 15:37:09.388919349 CET;192.168.1.102;192.168.1.104;49944;1883;75;[TCP Retransmission] 49944 → 1883 [FIN, PSH, ACK] Seq=55 Ack=5 Win=42336 Len=21;
610;Jan 13, 2022 15:37:09.494944251 CET;192.168.1.104;192.168.1.102;1883;49944;54;1883 → 49944 [FIN, ACK] Seq=5 Ack=77 Win=8192 Len=0;
611;Jan 13, 2022 15:37:09.494967656 CET;192.168.1.102;192.168.1.104;49944;1883;54;49944 → 1883 [ACK] Seq=77 Ack=6 Win=42335 Len=0;
612;Jan 13, 2022 15:37:13.717405614 CET;192.168.1.102;192.168.1.104;49946;1883;74;49946 → 1883 [SYN] Seq=0 Win=42340 Len=0 MSS=1460 SACK_PERM=1 TSval=1796738613 TSecr=0 WS=512;
613;Jan 13, 2022 15:37:13.820835293 CET;192.168.1.104;192.168.1.102;1883;49946;58;1883 → 49946 [SYN, ACK] Seq=0 Ack=1 Win=8192 Len=0 MSS=1460;
614;Jan 13, 2022 15:37:13.820867033 CET;192.168.1.102;192.168.1.104;49946;1883;54;49946 → 1883 [ACK] Seq=1 Ack=1 Win=42340 Len=0;
615;Jan 13, 2022 15:37:13.820912568 CET;192.168.1.102;192.168.1.104;49946;1883;108;Connect Command;
616;Jan 13, 2022 15:37:14.156555267 CET;192.168.1.102;192.168.1.104;49946;1883;108;[TCP Retransmission] 49946 → 1883 [PSH, ACK] Seq=1 Ack=1 Win=42340 Len=54;
617;Jan 13, 2022 15:37:14.276625762 CET;192.168.1.104;192.168.1.102;1883;49946;54;1883 → 49946 [ACK] Seq=1 Ack=55 Win=8192 Len=0;
618;Jan 13, 2022 15:37:14.284390366 CET;192.168.1.104;192.168.1.102;1883;49946;58;Connect Ack;
619;Jan 13, 2022 15:37:14.284408893 CET;192.168.1.102;192.168.1.104;49946;1883;54;49946 → 1883 [ACK] Seq=55 Ack=5 Win=42336 Len=0;
620;Jan 13, 2022 15:37:14.284460585 CET;192.168.1.102;192.168.1.104;49946;1883;73;Publish Message [topic];message048
621;Jan 13, 2022 15:37:14.284475877 CET;192.168.1.102;192.168.1.104;49946;1883;56;Disconnect Req;
622;Jan 13, 2022 15:37:14.924958024 CET;192.168.1.102;192.168.1.104;49946;1883;75;[TCP Retransmission] 49946 → 1883 [FIN, PSH, ACK] Seq=55 Ack=5 Win=42336 Len=21;
623;Jan 13, 2022 15:37:15.032811300 CET;192.168.1.104;192.168.1.102;1883;49946;54;1883 → 49946 [FIN, ACK] Seq=5 Ack=77 Win=8192 Len=0;
624;Jan 13, 2022 15:37:15.032862436 CET;192.168.1.102;192.168.1.104;49946;1883;54;49946 → 1883 [ACK] Seq=77 Ack=6 Win=42335 Len=0;
625;Jan 13, 2022 15:37:19.296859174 CET;192.168.1.102;192.168.1.104;49950;1883;74;49950 → 1883 [SYN] Seq=0 Win=42340 Len=0 MSS=1460 SACK_PERM=1 TSval=1796744192 TSecr=0 WS=512;
626;Jan 13, 2022 15:37:19.415498433 CET;192.168.1.104;192.168.1.102;1883;49950;58;1883 → 49950 [SYN, ACK] Seq=0 Ack=1 Win=8192 Len=0 MSS=1460;
627;Jan 13, 2022 15:37:19.415531913 CET;192.168.1.102;192.168.1.104;49950;1883;54;49950 → 1883 [ACK] Seq=1 Ack=1 Win=42340 Len=0;
628;Jan 13, 2022 15:37:19.415587050 CET;192.168.1.102;192.168.1.104;49950;1883;108;Connect Command;
629;Jan 13, 2022 15:37:19.788517412 CET;192.168.1.102;192.168.1.104;49950;1883;108;[TCP Retransmission] 49950 → 1883 [PSH, ACK] Seq=1 Ack=1 Win=42340 Len=54;
630;Jan 13, 2022 15:37:19.903193167 CET;192.168.1.104;192.168.1.102;1883;49950;54;1883 → 49950 [ACK] Seq=1 Ack=55 Win=8192 Len=0;
631;Jan 13, 2022 15:37:19.909681572 CET;192.168.1.104;192.168.1.102;1883;49950;58;Connect Ack;
632;Jan 13, 2022 15:37:19.909700700 CET;192.168.1.102;192.168.1.104;49950;1883;54;49950 → 1883 [ACK] Seq=55 Ack=5 Win=42336 Len=0;
633;Jan 13, 2022 15:37:19.909764543 CET;192.168.1.102;192.168.1.104;49950;1883;73;Publish Message [topic];message049
634;Jan 13, 2022 15:37:19.909782310 CET;192.168.1.102;192.168.1.104;49950;1883;56;Disconnect Req;
635;Jan 13, 2022 15:37:20.652853428 CET;192.168.1.102;192.168.1.104;49950;1883;75;[TCP Retransmission] 49950 → 1883 [FIN, PSH, ACK] Seq=55 Ack=5 Win=42336 Len=21;
636;Jan 13, 2022 15:37:20.762544659 CET;192.168.1.104;192.168.1.102;1883;49950;54;1883 → 49950 [FIN, ACK] Seq=5 Ack=77 Win=8192 Len=0;
637;Jan 13, 2022 15:37:20.762568796 CET;192.168.1.102;192.168.1.104;49950;1883;54;49950 → 1883 [ACK] Seq=77 Ack=6 Win=42335 Len=0;
638;Jan 13, 2022 15:37:24.917930746 CET;192.168.1.102;192.168.1.104;49952;1883;74;49952 → 1883 [SYN] Seq=0 Win=42340 Len=0 MSS=1460 SACK_PERM=1 TSval=1796749814 TSecr=0 WS=512;
639;Jan 13, 2022 15:37:25.037784261 CET;192.168.1.104;192.168.1.102;1883;49952;58;1883 → 49952 [SYN, ACK] Seq=0 Ack=1 Win=8192 Len=0 MSS=1460;
640;Jan 13, 2022 15:37:25.037812958 CET;192.168.1.102;192.168.1.104;49952;1883;54;49952 → 1883 [ACK] Seq=1 Ack=1 Win=42340 Len=0;
641;Jan 13, 2022 15:37:25.037864155 CET;192.168.1.102;192.168.1.104;49952;1883;108;Connect Command;
1;Jan 13, 2022 15:32:28.300594908 CET;192.168.1.103;192.168.1.104;46234;1883;108;Connect Command;
2;Jan 13, 2022 15:32:28.309786968 CET;192.168.1.104;192.168.1.103;1883;46234;54;1883 → 46234 [ACK] Seq=1 Ack=55 Win=8192 Len=0;
3;Jan 13, 2022 15:32:28.313045265 CET;192.168.1.104;192.168.1.103;1883;46234;58;Connect Ack;
4;Jan 13, 2022 15:32:28.313062554 CET;192.168.1.103;192.168.1.104;46234;1883;54;46234 → 1883 [ACK] Seq=55 Ack=5 Win=42336 Len=0;
5;Jan 13, 2022 15:32:28.313130355 CET;192.168.1.103;192.168.1.104;46234;1883;66;Subscribe Request (id=1) [topic];
6;Jan 13, 2022 15:32:33.676773549 CET;192.168.1.103;192.168.1.104;46234;1883;66;[TCP Retransmission] 46234 → 1883 [PSH, ACK] Seq=55 Ack=5 Win=42336 Len=12;
7;Jan 13, 2022 15:32:33.694695794 CET;192.168.1.104;192.168.1.103;1883;46234;54;1883 → 46234 [ACK] Seq=5 Ack=67 Win=8192 Len=0;
8;Jan 13, 2022 15:32:33.699544573 CET;192.168.1.104;192.168.1.103;1883;46234;59;Subscribe Ack (id=1);
9;Jan 13, 2022 15:32:33.699558473 CET;192.168.1.103;192.168.1.104;46234;1883;54;46234 → 1883 [ACK] Seq=67 Ack=10 Win=42331 Len=0;
10;Jan 13, 2022 15:32:51.483475027 CET;192.168.1.104;192.168.1.103;1883;46234;73;Publish Message [topic];message001
11;Jan 13, 2022 15:32:51.483505615 CET;192.168.1.103;192.168.1.104;46234;1883;54;46234 → 1883 [ACK] Seq=67 Ack=29 Win=42312 Len=0;
12;Jan 13, 2022 15:32:56.601802595 CET;192.168.1.104;192.168.1.103;1883;46234;73;Publish Message [topic];message002
13;Jan 13, 2022 15:32:56.601827548 CET;192.168.1.103;192.168.1.104;46234;1883;54;46234 → 1883 [ACK] Seq=67 Ack=48 Win=42293 Len=0;
14;Jan 13, 2022 15:33:02.118336236 CET;192.168.1.104;192.168.1.103;1883;46234;73;Publish Message [topic];message003
15;Jan 13, 2022 15:33:02.118356858 CET;192.168.1.103;192.168.1.104;46234;1883;54;46234 → 1883 [ACK] Seq=67 Ack=67 Win=42274 Len=0;
16;Jan 13, 2022 15:33:07.628946855 CET;192.168.1.104;192.168.1.103;1883;46234;73;Publish Message [topic];message004
17;Jan 13, 2022 15:33:07.628965331 CET;192.168.1.103;192.168.1.104;46234;1883;54;46234 → 1883 [ACK] Seq=67 Ack=86 Win=42255 Len=0;
18;Jan 13, 2022 15:33:13.177070790 CET;192.168.1.104;192.168.1.103;1883;46234;73;Publish Message [topic];message005
19;Jan 13, 2022 15:33:13.177094597 CET;192.168.1.103;192.168.1.104;46234;1883;54;46234 → 1883 [ACK] Seq=67 Ack=105 Win=42236 Len=0;
20;Jan 13, 2022 15:33:18.859103732 CET;192.168.1.104;192.168.1.103;1883;46234;73;Publish Message [topic];message006
21;Jan 13, 2022 15:33:18.859124046 CET;192.168.1.103;192.168.1.104;46234;1883;54;46234 → 1883 [ACK] Seq=67 Ack=124 Win=42217 Len=0;
22;Jan 13, 2022 15:33:24.504896788 CET;192.168.1.104;192.168.1.103;1883;46234;73;Publish Message [topic];message007
23;Jan 13, 2022 15:33:24.504920069 CET;192.168.1.103;192.168.1.104;46234;1883;54;46234 → 1883 [ACK] Seq=67 Ack=143 Win=42217 Len=0;
24;Jan 13, 2022 15:33:28.510133272 CET;192.168.1.103;192.168.1.104;46234;1883;56;Ping Request;
25;Jan 13, 2022 15:33:28.517481657 CET;192.168.1.104;192.168.1.103;1883;46234;54;1883 → 46234 [ACK] Seq=143 Ack=69 Win=8192 Len=0;
26;Jan 13, 2022 15:33:28.520128321 CET;192.168.1.104;192.168.1.103;1883;46234;56;Ping Response;
27;Jan 13, 2022 15:33:28.520135279 CET;192.168.1.103;192.168.1.104;46234;1883;54;46234 → 1883 [ACK] Seq=69 Ack=145 Win=42217 Len=0;
28;Jan 13, 2022 15:33:29.947478002 CET;192.168.1.104;192.168.1.103;1883;46234;73;Publish Message [topic];message008
29;Jan 13, 2022 15:33:29.947501935 CET;192.168.1.103;192.168.1.104;46234;1883;54;46234 → 1883 [ACK] Seq=69 Ack=164 Win=42217 Len=0;
30;Jan 13, 2022 15:33:35.728038089 CET;192.168.1.104;192.168.1.103;1883;46234;73;Publish Message [topic];message009
31;Jan 13, 2022 15:33:35.728061552 CET;192.168.1.103;192.168.1.104;46234;1883;54;46234 → 1883 [ACK] Seq=69 Ack=183 Win=42217 Len=0;
32;Jan 13, 2022 15:33:41.182211341 CET;192.168.1.104;192.168.1.103;1883;46234;73;Publish Message [topic];message010
33;Jan 13, 2022 15:33:41.182242612 CET;192.168.1.103;192.168.1.104;46234;1883;54;46234 → 1883 [ACK] Seq=69 Ack=202 Win=42217 Len=0;
34;Jan 13, 2022 15:33:46.886660957 CET;192.168.1.104;192.168.1.103;1883;46234;73;Publish Message [topic];message011
35;Jan 13, 2022 15:33:46.886714418 CET;192.168.1.103;192.168.1.104;46234;1883;54;46234 → 1883 [ACK] Seq=69 Ack=221 Win=42217 Len=0;
36;Jan 13, 2022 15:33:52.491220571 CET;192.168.1.104;192.168.1.103;1883;46234;73;Publish Message [topic];message012
37;Jan 13, 2022 15:33:52.491238517 CET;192.168.1.103;192.168.1.104;46234;1883;54;46234 → 1883 [ACK] Seq=69 Ack=240 Win=42217 Len=0;
38;Jan 13, 2022 15:33:57.958696740 CET;192.168.1.104;192.168.1.103;1883;46234;73;Publish Message [topic];message013
39;Jan 13, 2022 15:33:57.958721025 CET;192.168.1.103;192.168.1.104;46234;1883;54;46234 → 1883 [ACK] Seq=69 Ack=259 Win=42217 Len=0;
40;Jan 13, 2022 15:34:03.611294852 CET;192.168.1.104;192.168.1.103;1883;46234;73;Publish Message [topic];message014
41;Jan 13, 2022 15:34:03.611323892 CET;192.168.1.103;192.168.1.104;46234;1883;54;46234 → 1883 [ACK] Seq=69 Ack=278 Win=42217 Len=0;
42;Jan 13, 2022 15:34:09.127771366 CET;192.168.1.104;192.168.1.103;1883;46234;73;Publish Message [topic];message015
43;Jan 13, 2022 15:34:09.127791821 CET;192.168.1.103;192.168.1.104;46234;1883;54;46234 → 1883 [ACK] Seq=69 Ack=297 Win=42217 Len=0;
44;Jan 13, 2022 15:34:14.711515629 CET;192.168.1.104;192.168.1.103;1883;46234;73;Publish Message [topic];message016
45;Jan 13, 2022 15:34:14.711535480 CET;192.168.1.103;192.168.1.104;46234;1883;54;46234 → 1883 [ACK] Seq=69 Ack=316 Win=42217 Len=0;
46;Jan 13, 2022 15:34:20.327455905 CET;192.168.1.104;192.168.1.103;1883;46234;73;Publish Message [topic];message017
47;Jan 13, 2022 15:34:20.327474665 CET;192.168.1.103;192.168.1.104;46234;1883;54;46234 → 1883 [ACK] Seq=69 Ack=335 Win=42217 Len=0;
48;Jan 13, 2022 15:34:25.803044403 CET;192.168.1.104;192.168.1.103;1883;46234;73;Publish Message [topic];message018
49;Jan 13, 2022 15:34:25.803062218 CET;192.168.1.103;192.168.1.104;46234;1883;54;46234 → 1883 [ACK] Seq=69 Ack=354 Win=42217 Len=0;
50;Jan 13, 2022 15:34:28.805792149 CET;192.168.1.103;192.168.1.104;46234;1883;56;Ping Request;
51;Jan 13, 2022 15:34:28.812396028 CET;192.168.1.104;192.168.1.103;1883;46234;54;1883 → 46234 [ACK] Seq=354 Ack=71 Win=8192 Len=0;
52;Jan 13, 2022 15:34:28.814793094 CET;192.168.1.104;192.168.1.103;1883;46234;56;Ping Response;
53;Jan 13, 2022 15:34:28.814799913 CET;192.168.1.103;192.168.1.104;46234;1883;54;46234 → 1883 [ACK] Seq=71 Ack=356 Win=42217 Len=0;
54;Jan 13, 2022 15:34:31.336087872 CET;192.168.1.104;192.168.1.103;1883;46234;73;Publish Message [topic];message019
55;Jan 13, 2022 15:34:31.336115618 CET;192.168.1.103;192.168.1.104;46234;1883;54;46234 → 1883 [ACK] Seq=71 Ack=375 Win=42217 Len=0;
56;Jan 13, 2022 15:34:37.127125095 CET;192.168.1.104;192.168.1.103;1883;46234;73;Publish Message [topic];message020
57;Jan 13, 2022 15:34:37.127139285 CET;192.168.1.103;192.168.1.104;46234;1883;54;46234 → 1883 [ACK] Seq=71 Ack=394 Win=42217 Len=0;
58;Jan 13, 2022 15:34:42.663526163 CET;192.168.1.104;192.168.1.103;1883;46234;73;Publish Message [topic];message021
59;Jan 13, 2022 15:34:42.663541278 CET;192.168.1.103;192.168.1.104;46234;1883;54;46234 → 1883 [ACK] Seq=71 Ack=413 Win=42217 Len=0;
60;Jan 13, 2022 15:34:48.347168464 CET;192.168.1.104;192.168.1.103;1883;46234;73;Publish Message [topic];message022
61;Jan 13, 2022 15:34:48.347192455 CET;192.168.1.103;192.168.1.104;46234;1883;54;46234 → 1883 [ACK] Seq=71 Ack=432 Win=42217 Len=0;
62;Jan 13, 2022 15:34:54.906667150 CET;192.168.1.104;192.168.1.103;1883;46234;73;Publish Message [topic];message023
63;Jan 13, 2022 15:34:54.906690694 CET;192.168.1.103;192.168.1.104;46234;1883;54;46234 → 1883 [ACK] Seq=71 Ack=451 Win=42217 Len=0;
64;Jan 13, 2022 15:34:59.847455534 CET;192.168.1.104;192.168.1.103;1883;46234;73;Publish Message [topic];message024
65;Jan 13, 2022 15:34:59.847471943 CET;192.168.1.103;192.168.1.104;46234;1883;54;46234 → 1883 [ACK] Seq=71 Ack=470 Win=42217 Len=0;
66;Jan 13, 2022 15:35:05.512347013 CET;192.168.1.104;192.168.1.103;1883;46234;73;Publish Message [topic];message025
67;Jan 13, 2022 15:35:05.512367359 CET;192.168.1.103;192.168.1.104;46234;1883;54;46234 → 1883 [ACK] Seq=71 Ack=489 Win=42217 Len=0;
68;Jan 13, 2022 15:35:11.068354138 CET;192.168.1.104;192.168.1.103;1883;46234;73;Publish Message [topic];message026
69;Jan 13, 2022 15:35:11.068378223 CET;192.168.1.103;192.168.1.104;46234;1883;54;46234 → 1883 [ACK] Seq=71 Ack=508 Win=42217 Len=0;
70;Jan 13, 2022 15:35:16.715305710 CET;192.168.1.104;192.168.1.103;1883;46234;73;Publish Message [topic];message027
71;Jan 13, 2022 15:35:16.715324783 CET;192.168.1.103;192.168.1.104;46234;1883;54;46234 → 1883 [ACK] Seq=71 Ack=527 Win=42217 Len=0;
72;Jan 13, 2022 15:35:22.343911210 CET;192.168.1.104;192.168.1.103;1883;46234;73;Publish Message [topic];message028
73;Jan 13, 2022 15:35:22.343929984 CET;192.168.1.103;192.168.1.104;46234;1883;54;46234 → 1883 [ACK] Seq=71 Ack=546 Win=42217 Len=0;
74;Jan 13, 2022 15:35:27.827063064 CET;192.168.1.104;192.168.1.103;1883;46234;73;Publish Message [topic];message029
75;Jan 13, 2022 15:35:27.827087488 CET;192.168.1.103;192.168.1.104;46234;1883;54;46234 → 1883 [ACK] Seq=71 Ack=565 Win=42217 Len=0;
76;Jan 13, 2022 15:35:28.828385753 CET;192.168.1.103;192.168.1.104;46234;1883;56;Ping Request;
77;Jan 13, 2022 15:35:28.833024818 CET;192.168.1.104;192.168.1.103;1883;46234;54;1883 → 46234 [ACK] Seq=565 Ack=73 Win=8192 Len=0;
78;Jan 13, 2022 15:35:28.835324888 CET;192.168.1.104;192.168.1.103;1883;46234;56;Ping Response;
79;Jan 13, 2022 15:35:28.835333115 CET;192.168.1.103;192.168.1.104;46234;1883;54;46234 → 1883 [ACK] Seq=73 Ack=567 Win=42217 Len=0;
80;Jan 13, 2022 15:35:33.486177357 CET;192.168.1.104;192.168.1.103;1883;46234;73;Publish Message [topic];message030
81;Jan 13, 2022 15:35:33.486208425 CET;192.168.1.103;192.168.1.104;46234;1883;54;46234 → 1883 [ACK] Seq=73 Ack=586 Win=42217 Len=0;
82;Jan 13, 2022 15:35:39.156729954 CET;192.168.1.104;192.168.1.103;1883;46234;73;Publish Message [topic];message031
83;Jan 13, 2022 15:35:39.156755473 CET;192.168.1.103;192.168.1.104;46234;1883;54;46234 → 1883 [ACK] Seq=73 Ack=605 Win=42217 Len=0;
84;Jan 13, 2022 15:35:44.619393725 CET;192.168.1.104;192.168.1.103;1883;46234;73;Publish Message [topic];message032
85;Jan 13, 2022 15:35:44.619414366 CET;192.168.1.103;192.168.1.104;46234;1883;54;46234 → 1883 [ACK] Seq=73 Ack=624 Win=42217 Len=0;
86;Jan 13, 2022 15:35:50.346454895 CET;192.168.1.104;192.168.1.103;1883;46234;73;Publish Message [topic];message033
87;Jan 13, 2022 15:35:50.346479963 CET;192.168.1.103;192.168.1.104;46234;1883;54;46234 → 1883 [ACK] Seq=73 Ack=643 Win=42217 Len=0;
88;Jan 13, 2022 15:35:55.898391618 CET;192.168.1.104;192.168.1.103;1883;46234;73;Publish Message [topic];message034
89;Jan 13, 2022 15:35:55.898416865 CET;192.168.1.103;192.168.1.104;46234;1883;54;46234 → 1883 [ACK] Seq=73 Ack=662 Win=42217 Len=0;
90;Jan 13, 2022 15:36:01.416237661 CET;192.168.1.104;192.168.1.103;1883;46234;73;Publish Message [topic];message035
91;Jan 13, 2022 15:36:01.416253862 CET;192.168.1.103;192.168.1.104;46234;1883;54;46234 → 1883 [ACK] Seq=73 Ack=681 Win=42217 Len=0;
92;Jan 13, 2022 15:36:07.502533193 CET;192.168.1.104;192.168.1.103;1883;46234;73;Publish Message [topic];message036
93;Jan 13, 2022 15:36:07.502552702 CET;192.168.1.103;192.168.1.104;46234;1883;54;46234 → 1883 [ACK] Seq=73 Ack=700 Win=42217 Len=0;
94;Jan 13, 2022 15:36:13.162623580 CET;192.168.1.104;192.168.1.103;1883;46234;73;Publish Message [topic];message037
95;Jan 13, 2022 15:36:13.162648307 CET;192.168.1.103;192.168.1.104;46234;1883;54;46234 → 1883 [ACK] Seq=73 Ack=719 Win=42217 Len=0;
96;Jan 13, 2022 15:36:18.750854492 CET;192.168.1.104;192.168.1.103;1883;46234;73;Publish Message [topic];message038
97;Jan 13, 2022 15:36:18.750876658 CET;192.168.1.103;192.168.1.104;46234;1883;54;46234 → 1883 [ACK] Seq=73 Ack=738 Win=42217 Len=0;
98;Jan 13, 2022 15:36:24.277020530 CET;192.168.1.104;192.168.1.103;1883;46234;73;Publish Message [topic];message039
99;Jan 13, 2022 15:36:24.277045613 CET;192.168.1.103;192.168.1.104;46234;1883;54;46234 → 1883 [ACK] Seq=73 Ack=757 Win=42217 Len=0;
100;Jan 13, 2022 15:36:28.281593754 CET;192.168.1.103;192.168.1.104;46234;1883;56;Ping Request;
101;Jan 13, 2022 15:36:28.308933576 CET;192.168.1.104;192.168.1.103;1883;46234;54;1883 → 46234 [ACK] Seq=757 Ack=75 Win=8192 Len=0;
102;Jan 13, 2022 15:36:28.312586556 CET;192.168.1.104;192.168.1.103;1883;46234;56;Ping Response;
103;Jan 13, 2022 15:36:28.312596243 CET;192.168.1.103;192.168.1.104;46234;1883;54;46234 → 1883 [ACK] Seq=75 Ack=759 Win=42217 Len=0;
104;Jan 13, 2022 15:36:29.900170374 CET;192.168.1.104;192.168.1.103;1883;46234;73;Publish Message [topic];message040
105;Jan 13, 2022 15:36:29.900191840 CET;192.168.1.103;192.168.1.104;46234;1883;54;46234 → 1883 [ACK] Seq=75 Ack=778 Win=42217 Len=0;
106;Jan 13, 2022 15:36:35.549710325 CET;192.168.1.104;192.168.1.103;1883;46234;73;Publish Message [topic];message041
107;Jan 13, 2022 15:36:35.549759086 CET;192.168.1.103;192.168.1.104;46234;1883;54;46234 → 1883 [ACK] Seq=75 Ack=797 Win=42217 Len=0;
108;Jan 13, 2022 15:36:41.208023519 CET;192.168.1.104;192.168.1.103;1883;46234;73;Publish Message [topic];message042
109;Jan 13, 2022 15:36:41.208045129 CET;192.168.1.103;192.168.1.104;46234;1883;54;46234 → 1883 [ACK] Seq=75 Ack=816 Win=42217 Len=0;
110;Jan 13, 2022 15:36:46.683341156 CET;192.168.1.104;192.168.1.103;1883;46234;73;Publish Message [topic];message043
111;Jan 13, 2022 15:36:46.683369123 CET;192.168.1.103;192.168.1.104;46234;1883;54;46234 → 1883 [ACK] Seq=75 Ack=835 Win=42217 Len=0;
112;Jan 13, 2022 15:36:52.283598743 CET;192.168.1.104;192.168.1.103;1883;46234;73;Publish Message [topic];message044
113;Jan 13, 2022 15:36:52.283623755 CET;192.168.1.103;192.168.1.104;46234;1883;54;46234 → 1883 [ACK] Seq=75 Ack=854 Win=42217 Len=0;
114;Jan 13, 2022 15:36:58.986861224 CET;192.168.1.104;192.168.1.103;1883;46234;73;Publish Message [topic];message045
115;Jan 13, 2022 15:36:58.986871271 CET;192.168.1.103;192.168.1.104;46234;1883;54;46234 → 1883 [ACK] Seq=75 Ack=873 Win=42217 Len=0;
116;Jan 13, 2022 15:37:03.824398069 CET;192.168.1.104;192.168.1.103;1883;46234;73;Publish Message [topic];message046
117;Jan 13, 2022 15:37:03.824415235 CET;192.168.1.103;192.168.1.104;46234;1883;54;46234 → 1883 [ACK] Seq=75 Ack=892 Win=42217 Len=0;
118;Jan 13, 2022 15:37:09.449039955 CET;192.168.1.104;192.168.1.103;1883;46234;73;Publish Message [topic];message047
119;Jan 13, 2022 15:37:09.449057422 CET;192.168.1.103;192.168.1.104;46234;1883;54;46234 → 1883 [ACK] Seq=75 Ack=911 Win=42217 Len=0;
120;Jan 13, 2022 15:37:14.986493547 CET;192.168.1.104;192.168.1.103;1883;46234;73;Publish Message [topic];message048
121;Jan 13, 2022 15:37:14.986510946 CET;192.168.1.103;192.168.1.104;46234;1883;54;46234 → 1883 [ACK] Seq=75 Ack=930 Win=42217 Len=0;
122;Jan 13, 2022 15:37:20.721964819 CET;192.168.1.104;192.168.1.103;1883;46234;73;Publish Message [topic];message049
123;Jan 13, 2022 15:37:20.721981460 CET;192.168.1.103;192.168.1.104;46234;1883;54;46234 → 1883 [ACK] Seq=75 Ack=949 Win=42217 Len=0;
