1;Jan 13, 2022 15:49:35.767008767 CET;192.168.1.102;192.168.1.104;50308;1883;74;50308 → 1883 [SYN] Seq=0 Win=42340 Len=0 MSS=1460 SACK_PERM=1 TSval=1797480663 TSecr=0 WS=512;
2;Jan 13, 2022 15:49:36.780526652 CET;192.168.1.102;192.168.1.104;50308;1883;74;[TCP Retransmission] 50308 → 1883 [SYN] Seq=0 Win=42340 Len=0 MSS=1460 SACK_PERM=1 TSval=1797481676 TSecr=0 WS=512;
3;Jan 13, 2022 15:49:36.815810250 CET;192.168.1.104;192.168.1.102;1883;50308;58;1883 → 50308 [SYN, ACK] Seq=0 Ack=1 Win=8192 Len=0 MSS=1460;
4;Jan 13, 2022 15:49:36.815842426 CET;192.168.1.102;192.168.1.104;50308;1883;54;50308 → 1883 [ACK] Seq=1 Ack=1 Win=42340 Len=0;
5;Jan 13, 2022 15:49:36.815915956 CET;192.168.1.102;192.168.1.104;50308;1883;108;Connect Command;
6;Jan 13, 2022 15:49:39.980646398 CET;192.168.1.102;192.168.1.104;50308;1883;108;[TCP Retransmission] 50308 → 1883 [PSH, ACK] Seq=1 Ack=1 Win=42340 Len=54;
7;Jan 13, 2022 15:49:40.010730752 CET;192.168.1.104;192.168.1.102;1883;50308;54;1883 → 50308 [ACK] Seq=1 Ack=55 Win=8192 Len=0;
8;Jan 13, 2022 15:49:40.016455370 CET;192.168.1.104;192.168.1.102;1883;50308;58;Connect Ack;
9;Jan 13, 2022 15:49:40.016482451 CET;192.168.1.102;192.168.1.104;50308;1883;54;50308 → 1883 [ACK] Seq=55 Ack=5 Win=42336 Len=0;
10;Jan 13, 2022 15:49:40.016560351 CET;192.168.1.102;192.168.1.104;50308;1883;73;Publish Message [topic];message001
11;Jan 13, 2022 15:49:40.016581168 CET;192.168.1.102;192.168.1.104;50308;1883;56;Disconnect Req;
12;Jan 13, 2022 15:49:45.024854270 CET;192.168.1.102;192.168.1.104;50310;1883;74;50310 → 1883 [SYN] Seq=0 Win=42340 Len=0 MSS=1460 SACK_PERM=1 TSval=1797489920 TSecr=0 WS=512;
13;Jan 13, 2022 15:49:45.039812288 CET;192.168.1.104;192.168.1.102;1883;50310;58;1883 → 50310 [SYN, ACK] Seq=0 Ack=1 Win=8192 Len=0 MSS=1460;
14;Jan 13, 2022 15:49:45.039844456 CET;192.168.1.102;192.168.1.104;50310;1883;54;50310 → 1883 [ACK] Seq=1 Ack=1 Win=42340 Len=0;
15;Jan 13, 2022 15:49:45.039891787 CET;192.168.1.102;192.168.1.104;50310;1883;108;Connect Command;
16;Jan 13, 2022 15:49:45.256543675 CET;192.168.1.102;192.168.1.104;50310;1883;108;[TCP Retransmission] 50310 → 1883 [PSH, ACK] Seq=1 Ack=1 Win=42340 Len=54;
17;Jan 13, 2022 15:49:45.276294822 CET;192.168.1.104;192.168.1.102;1883;50310;54;1883 → 50310 [ACK] Seq=1 Ack=55 Win=8192 Len=0;
18;Jan 13, 2022 15:49:45.280856381 CET;192.168.1.104;192.168.1.102;1883;50310;58;Connect Ack;
19;Jan 13, 2022 15:49:45.280876275 CET;192.168.1.102;192.168.1.104;50310;1883;54;50310 → 1883 [ACK] Seq=55 Ack=5 Win=42336 Len=0;
20;Jan 13, 2022 15:49:45.280934281 CET;192.168.1.102;192.168.1.104;50310;1883;73;Publish Message [topic];message002
21;Jan 13, 2022 15:49:45.280951827 CET;192.168.1.102;192.168.1.104;50310;1883;56;Disconnect Req;
22;Jan 13, 2022 15:49:45.741274190 CET;192.168.1.102;192.168.1.104;50310;1883;75;[TCP Retransmission] 50310 → 1883 [FIN, PSH, ACK] Seq=55 Ack=5 Win=42336 Len=21;
23;Jan 13, 2022 15:49:45.761459763 CET;192.168.1.104;192.168.1.102;1883;50310;54;1883 → 50310 [FIN, ACK] Seq=5 Ack=77 Win=8192 Len=0;
24;Jan 13, 2022 15:49:45.761474210 CET;192.168.1.102;192.168.1.104;50310;1883;54;50310 → 1883 [ACK] Seq=77 Ack=6 Win=42335 Len=0;
25;Jan 13, 2022 15:49:46.124914428 CET;192.168.1.102;192.168.1.104;50308;1883;75;[TCP Retransmission] 50308 → 1883 [FIN, PSH, ACK] Seq=55 Ack=5 Win=42336 Len=21;
26;Jan 13, 2022 15:49:46.142202435 CET;192.168.1.104;192.168.1.102;1883;50308;54;1883 → 50308 [FIN, ACK] Seq=5 Ack=77 Win=8192 Len=0;
27;Jan 13, 2022 15:49:46.142223493 CET;192.168.1.102;192.168.1.104;50308;1883;54;50308 → 1883 [ACK] Seq=77 Ack=6 Win=42335 Len=0;
28;Jan 13, 2022 15:49:50.293348795 CET;192.168.1.102;192.168.1.104;50312;1883;74;50312 → 1883 [SYN] Seq=0 Win=42340 Len=0 MSS=1460 SACK_PERM=1 TSval=1797495189 TSecr=0 WS=512;
29;Jan 13, 2022 15:49:50.316348750 CET;192.168.1.104;192.168.1.102;1883;50312;58;1883 → 50312 [SYN, ACK] Seq=0 Ack=1 Win=8192 Len=0 MSS=1460;
30;Jan 13, 2022 15:49:50.316386567 CET;192.168.1.102;192.168.1.104;50312;1883;54;50312 → 1883 [ACK] Seq=1 Ack=1 Win=42340 Len=0;
31;Jan 13, 2022 15:49:50.316440795 CET;192.168.1.102;192.168.1.104;50312;1883;108;Connect Command;
32;Jan 13, 2022 15:49:50.541355964 CET;192.168.1.102;192.168.1.104;50312;1883;108;[TCP Retransmission] 50312 → 1883 [PSH, ACK] Seq=1 Ack=1 Win=42340 Len=54;
33;Jan 13, 2022 15:49:50.570487043 CET;192.168.1.104;192.168.1.102;1883;50312;54;1883 → 50312 [ACK] Seq=1 Ack=55 Win=8192 Len=0;
34;Jan 13, 2022 15:49:50.576333351 CET;192.168.1.104;192.168.1.102;1883;50312;58;Connect Ack;
35;Jan 13, 2022 15:49:50.576346117 CET;192.168.1.102;192.168.1.104;50312;1883;54;50312 → 1883 [ACK] Seq=55 Ack=5 Win=42336 Len=0;
36;Jan 13, 2022 15:49:50.576391646 CET;192.168.1.102;192.168.1.104;50312;1883;73;Publish Message [topic];message003
37;Jan 13, 2022 15:49:50.576407746 CET;192.168.1.102;192.168.1.104;50312;1883;56;Disconnect Req;
38;Jan 13, 2022 15:49:51.052607566 CET;192.168.1.102;192.168.1.104;50312;1883;75;[TCP Retransmission] 50312 → 1883 [FIN, PSH, ACK] Seq=55 Ack=5 Win=42336 Len=21;
39;Jan 13, 2022 15:49:51.085907833 CET;192.168.1.104;192.168.1.102;1883;50312;54;1883 → 50312 [FIN, ACK] Seq=5 Ack=77 Win=8192 Len=0;
40;Jan 13, 2022 15:49:51.085937151 CET;192.168.1.102;192.168.1.104;50312;1883;54;50312 → 1883 [ACK] Seq=77 Ack=6 Win=42335 Len=0;
41;Jan 13, 2022 15:49:55.588155588 CET;192.168.1.102;192.168.1.104;50314;1883;74;50314 → 1883 [SYN] Seq=0 Win=42340 Len=0 MSS=1460 SACK_PERM=1 TSval=1797500484 TSecr=0 WS=512;
42;Jan 13, 2022 15:49:55.612736289 CET;192.168.1.104;192.168.1.102;1883;50314;58;1883 → 50314 [SYN, ACK] Seq=0 Ack=1 Win=8192 Len=0 MSS=1460;
43;Jan 13, 2022 15:49:55.612773225 CET;192.168.1.102;192.168.1.104;50314;1883;54;50314 → 1883 [ACK] Seq=1 Ack=1 Win=42340 Len=0;
44;Jan 13, 2022 15:49:55.612825868 CET;192.168.1.102;192.168.1.104;50314;1883;108;Connect Command;
45;Jan 13, 2022 15:49:55.844575602 CET;192.168.1.102;192.168.1.104;50314;1883;108;[TCP Retransmission] 50314 → 1883 [PSH, ACK] Seq=1 Ack=1 Win=42340 Len=54;
46;Jan 13, 2022 15:49:55.874013411 CET;192.168.1.104;192.168.1.102;1883;50314;54;1883 → 50314 [ACK] Seq=1 Ack=55 Win=8192 Len=0;
47;Jan 13, 2022 15:49:55.880181371 CET;192.168.1.104;192.168.1.102;1883;50314;58;Connect Ack;
48;Jan 13, 2022 15:49:55.880203193 CET;192.168.1.102;192.168.1.104;50314;1883;54;50314 → 1883 [ACK] Seq=55 Ack=5 Win=42336 Len=0;
49;Jan 13, 2022 15:49:55.880268120 CET;192.168.1.102;192.168.1.104;50314;1883;73;Publish Message [topic];message004
50;Jan 13, 2022 15:49:55.880287100 CET;192.168.1.102;192.168.1.104;50314;1883;56;Disconnect Req;
51;Jan 13, 2022 15:49:56.364557189 CET;192.168.1.102;192.168.1.104;50314;1883;75;[TCP Retransmission] 50314 → 1883 [FIN, PSH, ACK] Seq=55 Ack=5 Win=42336 Len=21;
52;Jan 13, 2022 15:49:56.388584303 CET;192.168.1.104;192.168.1.102;1883;50314;54;1883 → 50314 [FIN, ACK] Seq=5 Ack=77 Win=8192 Len=0;
53;Jan 13, 2022 15:49:56.388617961 CET;192.168.1.102;192.168.1.104;50314;1883;54;50314 → 1883 [ACK] Seq=77 Ack=6 Win=42335 Len=0;
54;Jan 13, 2022 15:50:00.894008217 CET;192.168.1.102;192.168.1.104;50316;1883;74;50316 → 1883 [SYN] Seq=0 Win=42340 Len=0 MSS=1460 SACK_PERM=1 TSval=1797505790 TSecr=0 WS=512;
55;Jan 13, 2022 15:50:00.915943399 CET;192.168.1.104;192.168.1.102;1883;50316;58;1883 → 50316 [SYN, ACK] Seq=0 Ack=1 Win=8192 Len=0 MSS=1460;
56;Jan 13, 2022 15:50:00.915970507 CET;192.168.1.102;192.168.1.104;50316;1883;54;50316 → 1883 [ACK] Seq=1 Ack=1 Win=42340 Len=0;
57;Jan 13, 2022 15:50:00.916010036 CET;192.168.1.102;192.168.1.104;50316;1883;108;Connect Command;
58;Jan 13, 2022 15:50:01.140536627 CET;192.168.1.102;192.168.1.104;50316;1883;108;[TCP Retransmission] 50316 → 1883 [PSH, ACK] Seq=1 Ack=1 Win=42340 Len=54;
59;Jan 13, 2022 15:50:01.161645649 CET;192.168.1.104;192.168.1.102;1883;50316;54;1883 → 50316 [ACK] Seq=1 Ack=55 Win=8192 Len=0;
60;Jan 13, 2022 15:50:01.167755324 CET;192.168.1.104;192.168.1.102;1883;50316;58;Connect Ack;
61;Jan 13, 2022 15:50:01.167775043 CET;192.168.1.102;192.168.1.104;50316;1883;54;50316 → 1883 [ACK] Seq=55 Ack=5 Win=42336 Len=0;
62;Jan 13, 2022 15:50:01.167830627 CET;192.168.1.102;192.168.1.104;50316;1883;73;Publish Message [topic];message005
63;Jan 13, 2022 15:50:01.167850298 CET;192.168.1.102;192.168.1.104;50316;1883;56;Disconnect Req;
64;Jan 13, 2022 15:50:01.644712823 CET;192.168.1.102;192.168.1.104;50316;1883;75;[TCP Retransmission] 50316 → 1883 [FIN, PSH, ACK] Seq=55 Ack=5 Win=42336 Len=21;
65;Jan 13, 2022 15:50:01.680169390 CET;192.168.1.104;192.168.1.102;1883;50316;54;1883 → 50316 [FIN, ACK] Seq=5 Ack=77 Win=8192 Len=0;
66;Jan 13, 2022 15:50:01.680195675 CET;192.168.1.102;192.168.1.104;50316;1883;54;50316 → 1883 [ACK] Seq=77 Ack=6 Win=42335 Len=0;
67;Jan 13, 2022 15:50:06.181683274 CET;192.168.1.102;192.168.1.104;50318;1883;74;50318 → 1883 [SYN] Seq=0 Win=42340 Len=0 MSS=1460 SACK_PERM=1 TSval=1797511077 TSecr=0 WS=512;
68;Jan 13, 2022 15:50:06.201984872 CET;192.168.1.104;192.168.1.102;1883;50318;58;1883 → 50318 [SYN, ACK] Seq=0 Ack=1 Win=8192 Len=0 MSS=1460;
69;Jan 13, 2022 15:50:06.202021162 CET;192.168.1.102;192.168.1.104;50318;1883;54;50318 → 1883 [ACK] Seq=1 Ack=1 Win=42340 Len=0;
70;Jan 13, 2022 15:50:06.202072328 CET;192.168.1.102;192.168.1.104;50318;1883;108;Connect Command;
71;Jan 13, 2022 15:50:06.428585849 CET;192.168.1.102;192.168.1.104;50318;1883;108;[TCP Retransmission] 50318 → 1883 [PSH, ACK] Seq=1 Ack=1 Win=42340 Len=54;
72;Jan 13, 2022 15:50:06.445015829 CET;192.168.1.104;192.168.1.102;1883;50318;54;1883 → 50318 [ACK] Seq=1 Ack=55 Win=8192 Len=0;
73;Jan 13, 2022 15:50:06.448731199 CET;192.168.1.104;192.168.1.102;1883;50318;58;Connect Ack;
74;Jan 13, 2022 15:50:06.448748676 CET;192.168.1.102;192.168.1.104;50318;1883;54;50318 → 1883 [ACK] Seq=55 Ack=5 Win=42336 Len=0;
75;Jan 13, 2022 15:50:06.448803393 CET;192.168.1.102;192.168.1.104;50318;1883;73;Publish Message [topic];message006
76;Jan 13, 2022 15:50:06.448819378 CET;192.168.1.102;192.168.1.104;50318;1883;56;Disconnect Req;
77;Jan 13, 2022 15:50:06.924661751 CET;192.168.1.102;192.168.1.104;50318;1883;75;[TCP Retransmission] 50318 → 1883 [FIN, PSH, ACK] Seq=55 Ack=5 Win=42336 Len=21;
78;Jan 13, 2022 15:50:06.938198621 CET;192.168.1.104;192.168.1.102;1883;50318;54;1883 → 50318 [FIN, ACK] Seq=5 Ack=77 Win=8192 Len=0;
79;Jan 13, 2022 15:50:06.938220627 CET;192.168.1.102;192.168.1.104;50318;1883;54;50318 → 1883 [ACK] Seq=77 Ack=6 Win=42335 Len=0;
80;Jan 13, 2022 15:50:11.452923080 CET;192.168.1.102;192.168.1.104;50320;1883;74;50320 → 1883 [SYN] Seq=0 Win=42340 Len=0 MSS=1460 SACK_PERM=1 TSval=1797516349 TSecr=0 WS=512;
81;Jan 13, 2022 15:50:11.466121274 CET;192.168.1.104;192.168.1.102;1883;50320;58;1883 → 50320 [SYN, ACK] Seq=0 Ack=1 Win=8192 Len=0 MSS=1460;
82;Jan 13, 2022 15:50:11.466170308 CET;192.168.1.102;192.168.1.104;50320;1883;54;50320 → 1883 [ACK] Seq=1 Ack=1 Win=42340 Len=0;
83;Jan 13, 2022 15:50:11.466214379 CET;192.168.1.102;192.168.1.104;50320;1883;108;Connect Command;
84;Jan 13, 2022 15:50:11.684784597 CET;192.168.1.102;192.168.1.104;50320;1883;108;[TCP Retransmission] 50320 → 1883 [PSH, ACK] Seq=1 Ack=1 Win=42340 Len=54;
85;Jan 13, 2022 15:50:11.715344343 CET;192.168.1.104;192.168.1.102;1883;50320;54;1883 → 50320 [ACK] Seq=1 Ack=55 Win=8192 Len=0;
86;Jan 13, 2022 15:50:11.722766934 CET;192.168.1.104;192.168.1.102;1883;50320;58;Connect Ack;
87;Jan 13, 2022 15:50:11.722788280 CET;192.168.1.102;192.168.1.104;50320;1883;54;50320 → 1883 [ACK] Seq=55 Ack=5 Win=42336 Len=0;
88;Jan 13, 2022 15:50:11.722856149 CET;192.168.1.102;192.168.1.104;50320;1883;73;Publish Message [topic];message007
89;Jan 13, 2022 15:50:11.722874799 CET;192.168.1.102;192.168.1.104;50320;1883;56;Disconnect Req;
90;Jan 13, 2022 15:50:12.172551052 CET;192.168.1.102;192.168.1.104;50320;1883;75;[TCP Retransmission] 50320 → 1883 [FIN, PSH, ACK] Seq=55 Ack=5 Win=42336 Len=21;
91;Jan 13, 2022 15:50:12.201152243 CET;192.168.1.104;192.168.1.102;1883;50320;54;1883 → 50320 [FIN, ACK] Seq=5 Ack=77 Win=8192 Len=0;
92;Jan 13, 2022 15:50:12.201167112 CET;192.168.1.102;192.168.1.104;50320;1883;54;50320 → 1883 [ACK] Seq=77 Ack=6 Win=42335 Len=0;
93;Jan 13, 2022 15:50:16.739702976 CET;192.168.1.102;192.168.1.104;50322;1883;74;50322 → 1883 [SYN] Seq=0 Win=42340 Len=0 MSS=1460 SACK_PERM=1 TSval=1797521635 TSecr=0 WS=512;
94;Jan 13, 2022 15:50:16.755476078 CET;192.168.1.104;192.168.1.102;1883;50322;58;1883 → 50322 [SYN, ACK] Seq=0 Ack=1 Win=8192 Len=0 MSS=1460;
95;Jan 13, 2022 15:50:16.755511162 CET;192.168.1.102;192.168.1.104;50322;1883;54;50322 → 1883 [ACK] Seq=1 Ack=1 Win=42340 Len=0;
96;Jan 13, 2022 15:50:16.755555932 CET;192.168.1.102;192.168.1.104;50322;1883;108;Connect Command;
97;Jan 13, 2022 15:50:16.972662871 CET;192.168.1.102;192.168.1.104;50322;1883;108;[TCP Retransmission] 50322 → 1883 [PSH, ACK] Seq=1 Ack=1 Win=42340 Len=54;
98;Jan 13, 2022 15:50:16.988284873 CET;192.168.1.104;192.168.1.102;1883;50322;54;1883 → 50322 [ACK] Seq=1 Ack=55 Win=8192 Len=0;
99;Jan 13, 2022 15:50:16.992960389 CET;192.168.1.104;192.168.1.102;1883;50322;58;Connect Ack;
100;Jan 13, 2022 15:50:16.992976304 CET;192.168.1.102;192.168.1.104;50322;1883;54;50322 → 1883 [ACK] Seq=55 Ack=5 Win=42336 Len=0;
101;Jan 13, 2022 15:50:16.993032978 CET;192.168.1.102;192.168.1.104;50322;1883;73;Publish Message [topic];message008
102;Jan 13, 2022 15:50:16.993046537 CET;192.168.1.102;192.168.1.104;50322;1883;56;Disconnect Req;
103;Jan 13, 2022 15:50:17.452986957 CET;192.168.1.102;192.168.1.104;50322;1883;75;[TCP Retransmission] 50322 → 1883 [FIN, PSH, ACK] Seq=55 Ack=5 Win=42336 Len=21;
104;Jan 13, 2022 15:50:17.472454562 CET;192.168.1.104;192.168.1.102;1883;50322;54;1883 → 50322 [FIN, ACK] Seq=5 Ack=77 Win=8192 Len=0;
105;Jan 13, 2022 15:50:17.472469625 CET;192.168.1.102;192.168.1.104;50322;1883;54;50322 → 1883 [ACK] Seq=77 Ack=6 Win=42335 Len=0;
106;Jan 13, 2022 15:50:22.000577543 CET;192.168.1.102;192.168.1.104;50324;1883;74;50324 → 1883 [SYN] Seq=0 Win=42340 Len=0 MSS=1460 SACK_PERM=1 TSval=1797526896 TSecr=0 WS=512;
107;Jan 13, 2022 15:50:22.015635701 CET;192.168.1.104;192.168.1.102;1883;50324;58;1883 → 50324 [SYN, ACK] Seq=0 Ack=1 Win=8192 Len=0 MSS=1460;
108;Jan 13, 2022 15:50:22.015668400 CET;192.168.1.102;192.168.1.104;50324;1883;54;50324 → 1883 [ACK] Seq=1 Ack=1 Win=42340 Len=0;
109;Jan 13, 2022 15:50:22.015714677 CET;192.168.1.102;192.168.1.104;50324;1883;108;Connect Command;
110;Jan 13, 2022 15:50:22.232555504 CET;192.168.1.102;192.168.1.104;50324;1883;108;[TCP Retransmission] 50324 → 1883 [PSH, ACK] Seq=1 Ack=1 Win=42340 Len=54;
111;Jan 13, 2022 15:50:22.247611156 CET;192.168.1.104;192.168.1.102;1883;50324;54;1883 → 50324 [ACK] Seq=1 Ack=55 Win=8192 Len=0;
112;Jan 13, 2022 15:50:22.251730833 CET;192.168.1.104;192.168.1.102;1883;50324;58;Connect Ack;
113;Jan 13, 2022 15:50:22.251748736 CET;192.168.1.102;192.168.1.104;50324;1883;54;50324 → 1883 [ACK] Seq=55 Ack=5 Win=42336 Len=0;
114;Jan 13, 2022 15:50:22.251812004 CET;192.168.1.102;192.168.1.104;50324;1883;73;Publish Message [topic];message009
115;Jan 13, 2022 15:50:22.251829743 CET;192.168.1.102;192.168.1.104;50324;1883;56;Disconnect Req;
116;Jan 13, 2022 15:50:22.700603169 CET;192.168.1.102;192.168.1.104;50324;1883;75;[TCP Retransmission] 50324 → 1883 [FIN, PSH, ACK] Seq=55 Ack=5 Win=42336 Len=21;
117;Jan 13, 2022 15:50:22.720705651 CET;192.168.1.104;192.168.1.102;1883;50324;54;1883 → 50324 [FIN, ACK] Seq=5 Ack=77 Win=8192 Len=0;
118;Jan 13, 2022 15:50:22.720727252 CET;192.168.1.102;192.168.1.104;50324;1883;54;50324 → 1883 [ACK] Seq=77 Ack=6 Win=42335 Len=0;
119;Jan 13, 2022 15:50:27.259421281 CET;192.168.1.102;192.168.1.104;50326;1883;74;50326 → 1883 [SYN] Seq=0 Win=42340 Len=0 MSS=1460 SACK_PERM=1 TSval=1797532155 TSecr=0 WS=512;
120;Jan 13, 2022 15:50:27.274870691 CET;192.168.1.104;192.168.1.102;1883;50326;58;1883 → 50326 [SYN, ACK] Seq=0 Ack=1 Win=8192 Len=0 MSS=1460;
121;Jan 13, 2022 15:50:27.274903894 CET;192.168.1.102;192.168.1.104;50326;1883;54;50326 → 1883 [ACK] Seq=1 Ack=1 Win=42340 Len=0;
122;Jan 13, 2022 15:50:27.274951904 CET;192.168.1.102;192.168.1.104;50326;1883;108;Connect Command;
123;Jan 13, 2022 15:50:27.492610522 CET;192.168.1.102;192.168.1.104;50326;1883;108;[TCP Retransmission] 50326 → 1883 [PSH, ACK] Seq=1 Ack=1 Win=42340 Len=54;
124;Jan 13, 2022 15:50:27.522671585 CET;192.168.1.104;192.168.1.102;1883;50326;54;1883 → 50326 [ACK] Seq=1 Ack=55 Win=8192 Len=0;
125;Jan 13, 2022 15:50:27.533208034 CET;192.168.1.104;192.168.1.102;1883;50326;58;Connect Ack;
126;Jan 13, 2022 15:50:27.533229688 CET;192.168.1.102;192.168.1.104;50326;1883;54;50326 → 1883 [ACK] Seq=55 Ack=5 Win=42336 Len=0;
127;Jan 13, 2022 15:50:27.533290208 CET;192.168.1.102;192.168.1.104;50326;1883;73;Publish Message [topic];message010
128;Jan 13, 2022 15:50:27.533308364 CET;192.168.1.102;192.168.1.104;50326;1883;56;Disconnect Req;
129;Jan 13, 2022 15:50:27.980801770 CET;192.168.1.102;192.168.1.104;50326;1883;75;[TCP Retransmission] 50326 → 1883 [FIN, PSH, ACK] Seq=55 Ack=5 Win=42336 Len=21;
130;Jan 13, 2022 15:50:28.013269573 CET;192.168.1.104;192.168.1.102;1883;50326;54;1883 → 50326 [FIN, ACK] Seq=5 Ack=77 Win=8192 Len=0;
131;Jan 13, 2022 15:50:28.013310100 CET;192.168.1.102;192.168.1.104;50326;1883;54;50326 → 1883 [ACK] Seq=77 Ack=6 Win=42335 Len=0;
132;Jan 13, 2022 15:50:32.541224260 CET;192.168.1.102;192.168.1.104;50328;1883;74;50328 → 1883 [SYN] Seq=0 Win=42340 Len=0 MSS=1460 SACK_PERM=1 TSval=1797537437 TSecr=0 WS=512;
133;Jan 13, 2022 15:50:32.555796438 CET;192.168.1.104;192.168.1.102;1883;50328;58;1883 → 50328 [SYN, ACK] Seq=0 Ack=1 Win=8192 Len=0 MSS=1460;
134;Jan 13, 2022 15:50:32.555826844 CET;192.168.1.102;192.168.1.104;50328;1883;54;50328 → 1883 [ACK] Seq=1 Ack=1 Win=42340 Len=0;
135;Jan 13, 2022 15:50:32.555870074 CET;192.168.1.102;192.168.1.104;50328;1883;108;Connect Command;
136;Jan 13, 2022 15:50:32.772955082 CET;192.168.1.102;192.168.1.104;50328;1883;108;[TCP Retransmission] 50328 → 1883 [PSH, ACK] Seq=1 Ack=1 Win=42340 Len=54;
137;Jan 13, 2022 15:50:32.787927914 CET;192.168.1.104;192.168.1.102;1883;50328;54;1883 → 50328 [ACK] Seq=1 Ack=55 Win=8192 Len=0;
138;Jan 13, 2022 15:50:32.790773793 CET;192.168.1.104;192.168.1.102;1883;50328;58;Connect Ack;
139;Jan 13, 2022 15:50:32.790791943 CET;192.168.1.102;192.168.1.104;50328;1883;54;50328 → 1883 [ACK] Seq=55 Ack=5 Win=42336 Len=0;
140;Jan 13, 2022 15:50:32.790836132 CET;192.168.1.102;192.168.1.104;50328;1883;73;Publish Message [topic];message011
141;Jan 13, 2022 15:50:32.790849875 CET;192.168.1.102;192.168.1.104;50328;1883;56;Disconnect Req;
142;Jan 13, 2022 15:50:33.228677690 CET;192.168.1.102;192.168.1.104;50328;1883;75;[TCP Retransmission] 50328 → 1883 [FIN, PSH, ACK] Seq=55 Ack=5 Win=42336 Len=21;
143;Jan 13, 2022 15:50:33.246387214 CET;192.168.1.104;192.168.1.102;1883;50328;54;1883 → 50328 [FIN, ACK] Seq=5 Ack=77 Win=8192 Len=0;
144;Jan 13, 2022 15:50:33.246418836 CET;192.168.1.102;192.168.1.104;50328;1883;54;50328 → 1883 [ACK] Seq=77 Ack=6 Win=42335 Len=0;
145;Jan 13, 2022 15:50:37.804860587 CET;192.168.1.102;192.168.1.104;50330;1883;74;50330 → 1883 [SYN] Seq=0 Win=42340 Len=0 MSS=1460 SACK_PERM=1 TSval=1797542700 TSecr=0 WS=512;
146;Jan 13, 2022 15:50:37.828110070 CET;192.168.1.104;192.168.1.102;1883;50330;58;1883 → 50330 [SYN, ACK] Seq=0 Ack=1 Win=8192 Len=0 MSS=1460;
147;Jan 13, 2022 15:50:37.828152972 CET;192.168.1.102;192.168.1.104;50330;1883;54;50330 → 1883 [ACK] Seq=1 Ack=1 Win=42340 Len=0;
148;Jan 13, 2022 15:50:37.828217815 CET;192.168.1.102;192.168.1.104;50330;1883;108;Connect Command;
149;Jan 13, 2022 15:50:38.052630270 CET;192.168.1.102;192.168.1.104;50330;1883;108;[TCP Retransmission] 50330 → 1883 [PSH, ACK] Seq=1 Ack=1 Win=42340 Len=54;
150;Jan 13, 2022 15:50:38.089616877 CET;192.168.1.104;192.168.1.102;1883;50330;54;1883 → 50330 [ACK] Seq=1 Ack=55 Win=8192 Len=0;
151;Jan 13, 2022 15:50:38.096152799 CET;192.168.1.104;192.168.1.102;1883;50330;58;Connect Ack;
152;Jan 13, 2022 15:50:38.096170982 CET;192.168.1.102;192.168.1.104;50330;1883;54;50330 → 1883 [ACK] Seq=55 Ack=5 Win=42336 Len=0;
153;Jan 13, 2022 15:50:38.096227040 CET;192.168.1.102;192.168.1.104;50330;1883;73;Publish Message [topic];message012
154;Jan 13, 2022 15:50:38.096241821 CET;192.168.1.102;192.168.1.104;50330;1883;56;Disconnect Req;
155;Jan 13, 2022 15:50:38.572535993 CET;192.168.1.102;192.168.1.104;50330;1883;75;[TCP Retransmission] 50330 → 1883 [FIN, PSH, ACK] Seq=55 Ack=5 Win=42336 Len=21;
156;Jan 13, 2022 15:50:38.585919510 CET;192.168.1.104;192.168.1.102;1883;50330;54;1883 → 50330 [FIN, ACK] Seq=5 Ack=77 Win=8192 Len=0;
157;Jan 13, 2022 15:50:38.585934906 CET;192.168.1.102;192.168.1.104;50330;1883;54;50330 → 1883 [ACK] Seq=77 Ack=6 Win=42335 Len=0;
158;Jan 13, 2022 15:50:43.099853336 CET;192.168.1.102;192.168.1.104;50332;1883;74;50332 → 1883 [SYN] Seq=0 Win=42340 Len=0 MSS=1460 SACK_PERM=1 TSval=1797547995 TSecr=0 WS=512;
159;Jan 13, 2022 15:50:43.114239186 CET;192.168.1.104;192.168.1.102;1883;50332;58;1883 → 50332 [SYN, ACK] Seq=0 Ack=1 Win=8192 Len=0 MSS=1460;
160;Jan 13, 2022 15:50:43.114269580 CET;192.168.1.102;192.168.1.104;50332;1883;54;50332 → 1883 [ACK] Seq=1 Ack=1 Win=42340 Len=0;
161;Jan 13, 2022 15:50:43.114311621 CET;192.168.1.102;192.168.1.104;50332;1883;108;Connect Command;
162;Jan 13, 2022 15:50:43.332558994 CET;192.168.1.102;192.168.1.104;50332;1883;108;[TCP Retransmission] 50332 → 1883 [PSH, ACK] Seq=1 Ack=1 Win=42340 Len=54;
163;Jan 13, 2022 15:50:43.348975546 CET;192.168.1.104;192.168.1.102;1883;50332;54;1883 → 50332 [ACK] Seq=1 Ack=55 Win=8192 Len=0;
164;Jan 13, 2022 15:50:43.352324626 CET;192.168.1.104;192.168.1.102;1883;50332;58;Connect Ack;
165;Jan 13, 2022 15:50:43.352342727 CET;192.168.1.102;192.168.1.104;50332;1883;54;50332 → 1883 [ACK] Seq=55 Ack=5 Win=42336 Len=0;
166;Jan 13, 2022 15:50:43.352395419 CET;192.168.1.102;192.168.1.104;50332;1883;73;Publish Message [topic];message013
167;Jan 13, 2022 15:50:43.352409822 CET;192.168.1.102;192.168.1.104;50332;1883;56;Disconnect Req;
168;Jan 13, 2022 15:50:43.788556061 CET;192.168.1.102;192.168.1.104;50332;1883;75;[TCP Retransmission] 50332 → 1883 [FIN, PSH, ACK] Seq=55 Ack=5 Win=42336 Len=21;
169;Jan 13, 2022 15:50:43.808177173 CET;192.168.1.104;192.168.1.102;1883;50332;54;1883 → 50332 [FIN, ACK] Seq=5 Ack=77 Win=8192 Len=0;
170;Jan 13, 2022 15:50:43.808204506 CET;192.168.1.102;192.168.1.104;50332;1883;54;50332 → 1883 [ACK] Seq=77 Ack=6 Win=42335 Len=0;
171;Jan 13, 2022 15:50:48.357359291 CET;192.168.1.102;192.168.1.104;50334;1883;74;50334 → 1883 [SYN] Seq=0 Win=42340 Len=0 MSS=1460 SACK_PERM=1 TSval=1797553253 TSecr=0 WS=512;
172;Jan 13, 2022 15:50:48.371597124 CET;192.168.1.104;192.168.1.102;1883;50334;58;1883 → 50334 [SYN, ACK] Seq=0 Ack=1 Win=8192 Len=0 MSS=1460;
173;Jan 13, 2022 15:50:48.371643544 CET;192.168.1.102;192.168.1.104;50334;1883;54;50334 → 1883 [ACK] Seq=1 Ack=1 Win=42340 Len=0;
174;Jan 13, 2022 15:50:48.371705514 CET;192.168.1.102;192.168.1.104;50334;1883;108;Connect Command;
175;Jan 13, 2022 15:50:48.588518050 CET;192.168.1.102;192.168.1.104;50334;1883;108;[TCP Retransmission] 50334 → 1883 [PSH, ACK] Seq=1 Ack=1 Win=42340 Len=54;
176;Jan 13, 2022 15:50:48.603155412 CET;192.168.1.104;192.168.1.102;1883;50334;54;1883 → 50334 [ACK] Seq=1 Ack=55 Win=8192 Len=0;
177;Jan 13, 2022 15:50:48.607137828 CET;192.168.1.104;192.168.1.102;1883;50334;58;Connect Ack;
178;Jan 13, 2022 15:50:48.607157923 CET;192.168.1.102;192.168.1.104;50334;1883;54;50334 → 1883 [ACK] Seq=55 Ack=5 Win=42336 Len=0;
179;Jan 13, 2022 15:50:48.607217339 CET;192.168.1.102;192.168.1.104;50334;1883;73;Publish Message [topic];message014
180;Jan 13, 2022 15:50:48.607233459 CET;192.168.1.102;192.168.1.104;50334;1883;56;Disconnect Req;
181;Jan 13, 2022 15:50:49.069057318 CET;192.168.1.102;192.168.1.104;50334;1883;75;[TCP Retransmission] 50334 → 1883 [FIN, PSH, ACK] Seq=55 Ack=5 Win=42336 Len=21;
182;Jan 13, 2022 15:50:49.102110310 CET;192.168.1.104;192.168.1.102;1883;50334;54;1883 → 50334 [FIN, ACK] Seq=5 Ack=77 Win=8192 Len=0;
183;Jan 13, 2022 15:50:49.102125796 CET;192.168.1.102;192.168.1.104;50334;1883;54;50334 → 1883 [ACK] Seq=77 Ack=6 Win=42335 Len=0;
184;Jan 13, 2022 15:50:53.619178233 CET;192.168.1.102;192.168.1.104;50336;1883;74;50336 → 1883 [SYN] Seq=0 Win=42340 Len=0 MSS=1460 SACK_PERM=1 TSval=1797558515 TSecr=0 WS=512;
185;Jan 13, 2022 15:50:53.639538653 CET;192.168.1.104;192.168.1.102;1883;50336;58;1883 → 50336 [SYN, ACK] Seq=0 Ack=1 Win=8192 Len=0 MSS=1460;
186;Jan 13, 2022 15:50:53.639574484 CET;192.168.1.102;192.168.1.104;50336;1883;54;50336 → 1883 [ACK] Seq=1 Ack=1 Win=42340 Len=0;
187;Jan 13, 2022 15:50:53.639628151 CET;192.168.1.102;192.168.1.104;50336;1883;108;Connect Command;
188;Jan 13, 2022 15:50:53.864621366 CET;192.168.1.102;192.168.1.104;50336;1883;108;[TCP Retransmission] 50336 → 1883 [PSH, ACK] Seq=1 Ack=1 Win=42340 Len=54;
189;Jan 13, 2022 15:50:53.889300036 CET;192.168.1.104;192.168.1.102;1883;50336;54;1883 → 50336 [ACK] Seq=1 Ack=55 Win=8192 Len=0;
190;Jan 13, 2022 15:50:53.893865457 CET;192.168.1.104;192.168.1.102;1883;50336;58;Connect Ack;
191;Jan 13, 2022 15:50:53.893890077 CET;192.168.1.102;192.168.1.104;50336;1883;54;50336 → 1883 [ACK] Seq=55 Ack=5 Win=42336 Len=0;
192;Jan 13, 2022 15:50:53.893951572 CET;192.168.1.102;192.168.1.104;50336;1883;73;Publish Message [topic];message015
193;Jan 13, 2022 15:50:53.893972186 CET;192.168.1.102;192.168.1.104;50336;1883;56;Disconnect Req;
194;Jan 13, 2022 15:50:54.348778162 CET;192.168.1.102;192.168.1.104;50336;1883;75;[TCP Retransmission] 50336 → 1883 [FIN, PSH, ACK] Seq=55 Ack=5 Win=42336 Len=21;
195;Jan 13, 2022 15:50:54.368147622 CET;192.168.1.104;192.168.1.102;1883;50336;54;1883 → 50336 [FIN, ACK] Seq=5 Ack=77 Win=8192 Len=0;
196;Jan 13, 2022 15:50:54.368164991 CET;192.168.1.102;192.168.1.104;50336;1883;54;50336 → 1883 [ACK] Seq=77 Ack=6 Win=42335 Len=0;
197;Jan 13, 2022 15:50:58.901565698 CET;192.168.1.102;192.168.1.104;50338;1883;74;50338 → 1883 [SYN] Seq=0 Win=42340 Len=0 MSS=1460 SACK_PERM=1 TSval=1797563797 TSecr=0 WS=512;
198;Jan 13, 2022 15:50:58.915652389 CET;192.168.1.104;192.168.1.102;1883;50338;58;1883 → 50338 [SYN, ACK] Seq=0 Ack=1 Win=8192 Len=0 MSS=1460;
199;Jan 13, 2022 15:50:58.915684857 CET;192.168.1.102;192.168.1.104;50338;1883;54;50338 → 1883 [ACK] Seq=1 Ack=1 Win=42340 Len=0;
200;Jan 13, 2022 15:50:58.915730539 CET;192.168.1.102;192.168.1.104;50338;1883;108;Connect Command;
201;Jan 13, 2022 15:50:59.132522126 CET;192.168.1.102;192.168.1.104;50338;1883;108;[TCP Retransmission] 50338 → 1883 [PSH, ACK] Seq=1 Ack=1 Win=42340 Len=54;
202;Jan 13, 2022 15:50:59.156106402 CET;192.168.1.104;192.168.1.102;1883;50338;54;1883 → 50338 [ACK] Seq=1 Ack=55 Win=8192 Len=0;
203;Jan 13, 2022 15:50:59.160636940 CET;192.168.1.104;192.168.1.102;1883;50338;58;Connect Ack;
204;Jan 13, 2022 15:50:59.160649894 CET;192.168.1.102;192.168.1.104;50338;1883;54;50338 → 1883 [ACK] Seq=55 Ack=5 Win=42336 Len=0;
205;Jan 13, 2022 15:50:59.160693545 CET;192.168.1.102;192.168.1.104;50338;1883;73;Publish Message [topic];message016
206;Jan 13, 2022 15:50:59.160708244 CET;192.168.1.102;192.168.1.104;50338;1883;56;Disconnect Req;
207;Jan 13, 2022 15:50:59.597492051 CET;192.168.1.102;192.168.1.104;50338;1883;75;[TCP Retransmission] 50338 → 1883 [FIN, PSH, ACK] Seq=55 Ack=5 Win=42336 Len=21;
208;Jan 13, 2022 15:50:59.626391228 CET;192.168.1.104;192.168.1.102;1883;50338;54;1883 → 50338 [FIN, ACK] Seq=5 Ack=77 Win=8192 Len=0;
209;Jan 13, 2022 15:50:59.626407244 CET;192.168.1.102;192.168.1.104;50338;1883;54;50338 → 1883 [ACK] Seq=77 Ack=6 Win=42335 Len=0;
210;Jan 13, 2022 15:51:04.173866050 CET;192.168.1.102;192.168.1.104;50340;1883;74;50340 → 1883 [SYN] Seq=0 Win=42340 Len=0 MSS=1460 SACK_PERM=1 TSval=1797569069 TSecr=0 WS=512;
211;Jan 13, 2022 15:51:04.200498068 CET;192.168.1.104;192.168.1.102;1883;50340;58;1883 → 50340 [SYN, ACK] Seq=0 Ack=1 Win=8192 Len=0 MSS=1460;
212;Jan 13, 2022 15:51:04.200535553 CET;192.168.1.102;192.168.1.104;50340;1883;54;50340 → 1883 [ACK] Seq=1 Ack=1 Win=42340 Len=0;
213;Jan 13, 2022 15:51:04.200660843 CET;192.168.1.102;192.168.1.104;50340;1883;108;Connect Command;
214;Jan 13, 2022 15:51:04.428702619 CET;192.168.1.102;192.168.1.104;50340;1883;108;[TCP Retransmission] 50340 → 1883 [PSH, ACK] Seq=1 Ack=1 Win=42340 Len=54;
215;Jan 13, 2022 15:51:04.457580474 CET;192.168.1.104;192.168.1.102;1883;50340;54;1883 → 50340 [ACK] Seq=1 Ack=55 Win=8192 Len=0;
216;Jan 13, 2022 15:51:04.462732222 CET;192.168.1.104;192.168.1.102;1883;50340;58;Connect Ack;
217;Jan 13, 2022 15:51:04.462755500 CET;192.168.1.102;192.168.1.104;50340;1883;54;50340 → 1883 [ACK] Seq=55 Ack=5 Win=42336 Len=0;
218;Jan 13, 2022 15:51:04.462821029 CET;192.168.1.102;192.168.1.104;50340;1883;73;Publish Message [topic];message017
219;Jan 13, 2022 15:51:04.462841804 CET;192.168.1.102;192.168.1.104;50340;1883;56;Disconnect Req;
220;Jan 13, 2022 15:51:04.940515060 CET;192.168.1.102;192.168.1.104;50340;1883;75;[TCP Retransmission] 50340 → 1883 [FIN, PSH, ACK] Seq=55 Ack=5 Win=42336 Len=21;
221;Jan 13, 2022 15:51:04.953906313 CET;192.168.1.104;192.168.1.102;1883;50340;54;1883 → 50340 [FIN, ACK] Seq=5 Ack=77 Win=8192 Len=0;
222;Jan 13, 2022 15:51:04.953931532 CET;192.168.1.102;192.168.1.104;50340;1883;54;50340 → 1883 [ACK] Seq=77 Ack=6 Win=42335 Len=0;
223;Jan 13, 2022 15:51:09.472040263 CET;192.168.1.102;192.168.1.104;50342;1883;74;50342 → 1883 [SYN] Seq=0 Win=42340 Len=0 MSS=1460 SACK_PERM=1 TSval=1797574368 TSecr=0 WS=512;
224;Jan 13, 2022 15:51:09.487582852 CET;192.168.1.104;192.168.1.102;1883;50342;58;1883 → 50342 [SYN, ACK] Seq=0 Ack=1 Win=8192 Len=0 MSS=1460;
225;Jan 13, 2022 15:51:09.487615378 CET;192.168.1.102;192.168.1.104;50342;1883;54;50342 → 1883 [ACK] Seq=1 Ack=1 Win=42340 Len=0;
226;Jan 13, 2022 15:51:09.487661463 CET;192.168.1.102;192.168.1.104;50342;1883;108;Connect Command;
227;Jan 13, 2022 15:51:09.704652285 CET;192.168.1.102;192.168.1.104;50342;1883;108;[TCP Retransmission] 50342 → 1883 [PSH, ACK] Seq=1 Ack=1 Win=42340 Len=54;
228;Jan 13, 2022 15:51:09.734867198 CET;192.168.1.104;192.168.1.102;1883;50342;54;1883 → 50342 [ACK] Seq=1 Ack=55 Win=8192 Len=0;
229;Jan 13, 2022 15:51:09.741329831 CET;192.168.1.104;192.168.1.102;1883;50342;58;Connect Ack;
230;Jan 13, 2022 15:51:09.741350271 CET;192.168.1.102;192.168.1.104;50342;1883;54;50342 → 1883 [ACK] Seq=55 Ack=5 Win=42336 Len=0;
231;Jan 13, 2022 15:51:09.741412870 CET;192.168.1.102;192.168.1.104;50342;1883;73;Publish Message [topic];message018
232;Jan 13, 2022 15:51:09.741433832 CET;192.168.1.102;192.168.1.104;50342;1883;56;Disconnect Req;
233;Jan 13, 2022 15:51:10.188686299 CET;192.168.1.102;192.168.1.104;50342;1883;75;[TCP Retransmission] 50342 → 1883 [FIN, PSH, ACK] Seq=55 Ack=5 Win=42336 Len=21;
234;Jan 13, 2022 15:51:10.203929590 CET;192.168.1.104;192.168.1.102;1883;50342;54;1883 → 50342 [FIN, ACK] Seq=5 Ack=77 Win=8192 Len=0;
235;Jan 13, 2022 15:51:10.203961740 CET;192.168.1.102;192.168.1.104;50342;1883;54;50342 → 1883 [ACK] Seq=77 Ack=6 Win=42335 Len=0;
236;Jan 13, 2022 15:51:14.745908619 CET;192.168.1.102;192.168.1.104;50344;1883;74;50344 → 1883 [SYN] Seq=0 Win=42340 Len=0 MSS=1460 SACK_PERM=1 TSval=1797579642 TSecr=0 WS=512;
237;Jan 13, 2022 15:51:14.759465358 CET;192.168.1.104;192.168.1.102;1883;50344;58;1883 → 50344 [SYN, ACK] Seq=0 Ack=1 Win=8192 Len=0 MSS=1460;
238;Jan 13, 2022 15:51:14.759501254 CET;192.168.1.102;192.168.1.104;50344;1883;54;50344 → 1883 [ACK] Seq=1 Ack=1 Win=42340 Len=0;
239;Jan 13, 2022 15:51:14.759549759 CET;192.168.1.102;192.168.1.104;50344;1883;108;Connect Command;
240;Jan 13, 2022 15:51:14.976708650 CET;192.168.1.102;192.168.1.104;50344;1883;108;[TCP Retransmission] 50344 → 1883 [PSH, ACK] Seq=1 Ack=1 Win=42340 Len=54;
241;Jan 13, 2022 15:51:15.005986112 CET;192.168.1.104;192.168.1.102;1883;50344;54;1883 → 50344 [ACK] Seq=1 Ack=55 Win=8192 Len=0;
242;Jan 13, 2022 15:51:15.011158517 CET;192.168.1.104;192.168.1.102;1883;50344;58;Connect Ack;
243;Jan 13, 2022 15:51:15.011180328 CET;192.168.1.102;192.168.1.104;50344;1883;54;50344 → 1883 [ACK] Seq=55 Ack=5 Win=42336 Len=0;
244;Jan 13, 2022 15:51:15.011240530 CET;192.168.1.102;192.168.1.104;50344;1883;73;Publish Message [topic];message019
245;Jan 13, 2022 15:51:15.011260016 CET;192.168.1.102;192.168.1.104;50344;1883;56;Disconnect Req;
246;Jan 13, 2022 15:51:15.468809322 CET;192.168.1.102;192.168.1.104;50344;1883;75;[TCP Retransmission] 50344 → 1883 [FIN, PSH, ACK] Seq=55 Ack=5 Win=42336 Len=21;
247;Jan 13, 2022 15:51:15.487015198 CET;192.168.1.104;192.168.1.102;1883;50344;54;1883 → 50344 [FIN, ACK] Seq=5 Ack=77 Win=8192 Len=0;
248;Jan 13, 2022 15:51:15.487045004 CET;192.168.1.102;192.168.1.104;50344;1883;54;50344 → 1883 [ACK] Seq=77 Ack=6 Win=42335 Len=0;
249;Jan 13, 2022 15:51:20.024180982 CET;192.168.1.102;192.168.1.104;50346;1883;74;50346 → 1883 [SYN] Seq=0 Win=42340 Len=0 MSS=1460 SACK_PERM=1 TSval=1797584920 TSecr=0 WS=512;
250;Jan 13, 2022 15:51:20.053529776 CET;192.168.1.104;192.168.1.102;1883;50346;58;1883 → 50346 [SYN, ACK] Seq=0 Ack=1 Win=8192 Len=0 MSS=1460;
251;Jan 13, 2022 15:51:20.053564441 CET;192.168.1.102;192.168.1.104;50346;1883;54;50346 → 1883 [ACK] Seq=1 Ack=1 Win=42340 Len=0;
252;Jan 13, 2022 15:51:20.053943474 CET;192.168.1.102;192.168.1.104;50346;1883;108;Connect Command;
253;Jan 13, 2022 15:51:20.288689990 CET;192.168.1.102;192.168.1.104;50346;1883;108;[TCP Retransmission] 50346 → 1883 [PSH, ACK] Seq=1 Ack=1 Win=42340 Len=54;
254;Jan 13, 2022 15:51:20.318220609 CET;192.168.1.104;192.168.1.102;1883;50346;54;1883 → 50346 [ACK] Seq=1 Ack=55 Win=8192 Len=0;
255;Jan 13, 2022 15:51:20.323803324 CET;192.168.1.104;192.168.1.102;1883;50346;58;Connect Ack;
256;Jan 13, 2022 15:51:20.323828244 CET;192.168.1.102;192.168.1.104;50346;1883;54;50346 → 1883 [ACK] Seq=55 Ack=5 Win=42336 Len=0;
257;Jan 13, 2022 15:51:20.323925286 CET;192.168.1.102;192.168.1.104;50346;1883;73;Publish Message [topic];message020
258;Jan 13, 2022 15:51:20.323947117 CET;192.168.1.102;192.168.1.104;50346;1883;56;Disconnect Req;
259;Jan 13, 2022 15:51:20.812527270 CET;192.168.1.102;192.168.1.104;50346;1883;75;[TCP Retransmission] 50346 → 1883 [FIN, PSH, ACK] Seq=55 Ack=5 Win=42336 Len=21;
260;Jan 13, 2022 15:51:20.827700626 CET;192.168.1.104;192.168.1.102;1883;50346;54;1883 → 50346 [FIN, ACK] Seq=5 Ack=77 Win=8192 Len=0;
261;Jan 13, 2022 15:51:20.827727637 CET;192.168.1.102;192.168.1.104;50346;1883;54;50346 → 1883 [ACK] Seq=77 Ack=6 Win=42335 Len=0;
262;Jan 13, 2022 15:51:25.328753841 CET;192.168.1.102;192.168.1.104;50348;1883;74;50348 → 1883 [SYN] Seq=0 Win=42340 Len=0 MSS=1460 SACK_PERM=1 TSval=1797590224 TSecr=0 WS=512;
263;Jan 13, 2022 15:51:25.342462106 CET;192.168.1.104;192.168.1.102;1883;50348;58;1883 → 50348 [SYN, ACK] Seq=0 Ack=1 Win=8192 Len=0 MSS=1460;
264;Jan 13, 2022 15:51:25.342479613 CET;192.168.1.102;192.168.1.104;50348;1883;54;50348 → 1883 [ACK] Seq=1 Ack=1 Win=42340 Len=0;
265;Jan 13, 2022 15:51:25.342510579 CET;192.168.1.102;192.168.1.104;50348;1883;108;Connect Command;
266;Jan 13, 2022 15:51:25.560585677 CET;192.168.1.102;192.168.1.104;50348;1883;108;[TCP Retransmission] 50348 → 1883 [PSH, ACK] Seq=1 Ack=1 Win=42340 Len=54;
267;Jan 13, 2022 15:51:25.588778398 CET;192.168.1.104;192.168.1.102;1883;50348;54;1883 → 50348 [ACK] Seq=1 Ack=55 Win=8192 Len=0;
268;Jan 13, 2022 15:51:25.595906885 CET;192.168.1.104;192.168.1.102;1883;50348;58;Connect Ack;
269;Jan 13, 2022 15:51:25.595933895 CET;192.168.1.102;192.168.1.104;50348;1883;54;50348 → 1883 [ACK] Seq=55 Ack=5 Win=42336 Len=0;
270;Jan 13, 2022 15:51:25.596006138 CET;192.168.1.102;192.168.1.104;50348;1883;73;Publish Message [topic];message021
271;Jan 13, 2022 15:51:25.596025898 CET;192.168.1.102;192.168.1.104;50348;1883;56;Disconnect Req;
272;Jan 13, 2022 15:51:26.028560341 CET;192.168.1.102;192.168.1.104;50348;1883;75;[TCP Retransmission] 50348 → 1883 [FIN, PSH, ACK] Seq=55 Ack=5 Win=42336 Len=21;
273;Jan 13, 2022 15:51:26.054933060 CET;192.168.1.104;192.168.1.102;1883;50348;54;1883 → 50348 [FIN, ACK] Seq=5 Ack=77 Win=8192 Len=0;
274;Jan 13, 2022 15:51:26.054967831 CET;192.168.1.102;192.168.1.104;50348;1883;54;50348 → 1883 [ACK] Seq=77 Ack=6 Win=42335 Len=0;
275;Jan 13, 2022 15:51:30.599905684 CET;192.168.1.102;192.168.1.104;50350;1883;74;50350 → 1883 [SYN] Seq=0 Win=42340 Len=0 MSS=1460 SACK_PERM=1 TSval=1797595496 TSecr=0 WS=512;
276;Jan 13, 2022 15:51:30.612697172 CET;192.168.1.104;192.168.1.102;1883;50350;58;1883 → 50350 [SYN, ACK] Seq=0 Ack=1 Win=8192 Len=0 MSS=1460;
277;Jan 13, 2022 15:51:30.612731828 CET;192.168.1.102;192.168.1.104;50350;1883;54;50350 → 1883 [ACK] Seq=1 Ack=1 Win=42340 Len=0;
278;Jan 13, 2022 15:51:30.612809008 CET;192.168.1.102;192.168.1.104;50350;1883;108;Connect Command;
279;Jan 13, 2022 15:51:30.832587788 CET;192.168.1.102;192.168.1.104;50350;1883;108;[TCP Retransmission] 50350 → 1883 [PSH, ACK] Seq=1 Ack=1 Win=42340 Len=54;
280;Jan 13, 2022 15:51:30.856546069 CET;192.168.1.104;192.168.1.102;1883;50350;54;1883 → 50350 [ACK] Seq=1 Ack=55 Win=8192 Len=0;
281;Jan 13, 2022 15:51:30.862626725 CET;192.168.1.104;192.168.1.102;1883;50350;58;Connect Ack;
282;Jan 13, 2022 15:51:30.862645769 CET;192.168.1.102;192.168.1.104;50350;1883;54;50350 → 1883 [ACK] Seq=55 Ack=5 Win=42336 Len=0;
283;Jan 13, 2022 15:51:30.862736782 CET;192.168.1.102;192.168.1.104;50350;1883;73;Publish Message [topic];message022
284;Jan 13, 2022 15:51:30.862755997 CET;192.168.1.102;192.168.1.104;50350;1883;56;Disconnect Req;
285;Jan 13, 2022 15:51:31.308535496 CET;192.168.1.102;192.168.1.104;50350;1883;75;[TCP Retransmission] 50350 → 1883 [FIN, PSH, ACK] Seq=55 Ack=5 Win=42336 Len=21;
286;Jan 13, 2022 15:51:31.326250650 CET;192.168.1.104;192.168.1.102;1883;50350;54;1883 → 50350 [FIN, ACK] Seq=5 Ack=77 Win=8192 Len=0;
287;Jan 13, 2022 15:51:31.326284288 CET;192.168.1.102;192.168.1.104;50350;1883;54;50350 → 1883 [ACK] Seq=77 Ack=6 Win=42335 Len=0;
288;Jan 13, 2022 15:51:35.868299897 CET;192.168.1.102;192.168.1.104;50352;1883;74;50352 → 1883 [SYN] Seq=0 Win=42340 Len=0 MSS=1460 SACK_PERM=1 TSval=1797600764 TSecr=0 WS=512;
289;Jan 13, 2022 15:51:35.881777324 CET;192.168.1.104;192.168.1.102;1883;50352;58;1883 → 50352 [SYN, ACK] Seq=0 Ack=1 Win=8192 Len=0 MSS=1460;
290;Jan 13, 2022 15:51:35.881804908 CET;192.168.1.102;192.168.1.104;50352;1883;54;50352 → 1883 [ACK] Seq=1 Ack=1 Win=42340 Len=0;
291;Jan 13, 2022 15:51:35.881846685 CET;192.168.1.102;192.168.1.104;50352;1883;108;Connect Command;
292;Jan 13, 2022 15:51:36.100520118 CET;192.168.1.102;192.168.1.104;50352;1883;108;[TCP Retransmission] 50352 → 1883 [PSH, ACK] Seq=1 Ack=1 Win=42340 Len=54;
293;Jan 13, 2022 15:51:36.115740480 CET;192.168.1.104;192.168.1.102;1883;50352;54;1883 → 50352 [ACK] Seq=1 Ack=55 Win=8192 Len=0;
294;Jan 13, 2022 15:51:36.119549249 CET;192.168.1.104;192.168.1.102;1883;50352;58;Connect Ack;
295;Jan 13, 2022 15:51:36.119564982 CET;192.168.1.102;192.168.1.104;50352;1883;54;50352 → 1883 [ACK] Seq=55 Ack=5 Win=42336 Len=0;
296;Jan 13, 2022 15:51:36.119601120 CET;192.168.1.102;192.168.1.104;50352;1883;73;Publish Message [topic];message023
297;Jan 13, 2022 15:51:36.119614457 CET;192.168.1.102;192.168.1.104;50352;1883;56;Disconnect Req;
298;Jan 13, 2022 15:51:36.556567033 CET;192.168.1.102;192.168.1.104;50352;1883;75;[TCP Retransmission] 50352 → 1883 [FIN, PSH, ACK] Seq=55 Ack=5 Win=42336 Len=21;
299;Jan 13, 2022 15:51:36.586446679 CET;192.168.1.104;192.168.1.102;1883;50352;54;1883 → 50352 [FIN, ACK] Seq=5 Ack=77 Win=8192 Len=0;
300;Jan 13, 2022 15:51:36.586480963 CET;192.168.1.102;192.168.1.104;50352;1883;54;50352 → 1883 [ACK] Seq=77 Ack=6 Win=42335 Len=0;
301;Jan 13, 2022 15:51:41.124485644 CET;192.168.1.102;192.168.1.104;50354;1883;74;50354 → 1883 [SYN] Seq=0 Win=42340 Len=0 MSS=1460 SACK_PERM=1 TSval=1797606020 TSecr=0 WS=512;
302;Jan 13, 2022 15:51:41.160707683 CET;192.168.1.104;192.168.1.102;1883;50354;58;1883 → 50354 [SYN, ACK] Seq=0 Ack=1 Win=8192 Len=0 MSS=1460;
303;Jan 13, 2022 15:51:41.160738065 CET;192.168.1.102;192.168.1.104;50354;1883;54;50354 → 1883 [ACK] Seq=1 Ack=1 Win=42340 Len=0;
304;Jan 13, 2022 15:51:41.160790342 CET;192.168.1.102;192.168.1.104;50354;1883;108;Connect Command;
305;Jan 13, 2022 15:51:41.404555604 CET;192.168.1.102;192.168.1.104;50354;1883;108;[TCP Retransmission] 50354 → 1883 [PSH, ACK] Seq=1 Ack=1 Win=42340 Len=54;
306;Jan 13, 2022 15:51:41.433389667 CET;192.168.1.104;192.168.1.102;1883;50354;54;1883 → 50354 [ACK] Seq=1 Ack=55 Win=8192 Len=0;
307;Jan 13, 2022 15:51:41.438637483 CET;192.168.1.104;192.168.1.102;1883;50354;58;Connect Ack;
308;Jan 13, 2022 15:51:41.438658181 CET;192.168.1.102;192.168.1.104;50354;1883;54;50354 → 1883 [ACK] Seq=55 Ack=5 Win=42336 Len=0;
309;Jan 13, 2022 15:51:41.438720012 CET;192.168.1.102;192.168.1.104;50354;1883;73;Publish Message [topic];message024
310;Jan 13, 2022 15:51:41.438738339 CET;192.168.1.102;192.168.1.104;50354;1883;56;Disconnect Req;
311;Jan 13, 2022 15:51:42.293750727 CET;192.168.1.102;192.168.1.104;50354;1883;75;[TCP Retransmission] 50354 → 1883 [FIN, PSH, ACK] Seq=55 Ack=5 Win=42336 Len=21;
312;Jan 13, 2022 15:51:42.312796805 CET;192.168.1.104;192.168.1.102;1883;50354;54;1883 → 50354 [FIN, ACK] Seq=5 Ack=77 Win=8192 Len=0;
313;Jan 13, 2022 15:51:42.312817865 CET;192.168.1.102;192.168.1.104;50354;1883;54;50354 → 1883 [ACK] Seq=77 Ack=6 Win=42335 Len=0;
314;Jan 13, 2022 15:51:46.451523112 CET;192.168.1.102;192.168.1.104;50356;1883;74;50356 → 1883 [SYN] Seq=0 Win=42340 Len=0 MSS=1460 SACK_PERM=1 TSval=1797611347 TSecr=0 WS=512;
315;Jan 13, 2022 15:51:46.469428460 CET;192.168.1.104;192.168.1.102;1883;50356;58;1883 → 50356 [SYN, ACK] Seq=0 Ack=1 Win=8192 Len=0 MSS=1460;
316;Jan 13, 2022 15:51:46.469459754 CET;192.168.1.102;192.168.1.104;50356;1883;54;50356 → 1883 [ACK] Seq=1 Ack=1 Win=42340 Len=0;
317;Jan 13, 2022 15:51:46.469509911 CET;192.168.1.102;192.168.1.104;50356;1883;108;Connect Command;
318;Jan 13, 2022 15:51:46.692797619 CET;192.168.1.102;192.168.1.104;50356;1883;108;[TCP Retransmission] 50356 → 1883 [PSH, ACK] Seq=1 Ack=1 Win=42340 Len=54;
319;Jan 13, 2022 15:51:46.725151513 CET;192.168.1.104;192.168.1.102;1883;50356;54;1883 → 50356 [ACK] Seq=1 Ack=55 Win=8192 Len=0;
320;Jan 13, 2022 15:51:46.732740230 CET;192.168.1.104;192.168.1.102;1883;50356;58;Connect Ack;
321;Jan 13, 2022 15:51:46.732762299 CET;192.168.1.102;192.168.1.104;50356;1883;54;50356 → 1883 [ACK] Seq=55 Ack=5 Win=42336 Len=0;
322;Jan 13, 2022 15:51:46.732831419 CET;192.168.1.102;192.168.1.104;50356;1883;73;Publish Message [topic];message025
323;Jan 13, 2022 15:51:46.732852184 CET;192.168.1.102;192.168.1.104;50356;1883;56;Disconnect Req;
324;Jan 13, 2022 15:51:47.181331812 CET;192.168.1.102;192.168.1.104;50356;1883;75;[TCP Retransmission] 50356 → 1883 [FIN, PSH, ACK] Seq=55 Ack=5 Win=42336 Len=21;
325;Jan 13, 2022 15:51:47.195172695 CET;192.168.1.104;192.168.1.102;1883;50356;54;1883 → 50356 [FIN, ACK] Seq=5 Ack=77 Win=8192 Len=0;
326;Jan 13, 2022 15:51:47.195186822 CET;192.168.1.102;192.168.1.104;50356;1883;54;50356 → 1883 [ACK] Seq=77 Ack=6 Win=42335 Len=0;
327;Jan 13, 2022 15:51:51.740013789 CET;192.168.1.102;192.168.1.104;50358;1883;74;50358 → 1883 [SYN] Seq=0 Win=42340 Len=0 MSS=1460 SACK_PERM=1 TSval=1797616636 TSecr=0 WS=512;
328;Jan 13, 2022 15:51:51.758250824 CET;192.168.1.104;192.168.1.102;1883;50358;58;1883 → 50358 [SYN, ACK] Seq=0 Ack=1 Win=8192 Len=0 MSS=1460;
329;Jan 13, 2022 15:51:51.758292276 CET;192.168.1.102;192.168.1.104;50358;1883;54;50358 → 1883 [ACK] Seq=1 Ack=1 Win=42340 Len=0;
330;Jan 13, 2022 15:51:51.758351052 CET;192.168.1.102;192.168.1.104;50358;1883;108;Connect Command;
331;Jan 13, 2022 15:51:51.980566793 CET;192.168.1.102;192.168.1.104;50358;1883;108;[TCP Retransmission] 50358 → 1883 [PSH, ACK] Seq=1 Ack=1 Win=42340 Len=54;
332;Jan 13, 2022 15:51:52.000619040 CET;192.168.1.104;192.168.1.102;1883;50358;54;1883 → 50358 [ACK] Seq=1 Ack=55 Win=8192 Len=0;
333;Jan 13, 2022 15:51:52.003751590 CET;192.168.1.104;192.168.1.102;1883;50358;58;Connect Ack;
334;Jan 13, 2022 15:51:52.003770096 CET;192.168.1.102;192.168.1.104;50358;1883;54;50358 → 1883 [ACK] Seq=55 Ack=5 Win=42336 Len=0;
335;Jan 13, 2022 15:51:52.003819447 CET;192.168.1.102;192.168.1.104;50358;1883;73;Publish Message [topic];message026
336;Jan 13, 2022 15:51:52.003835872 CET;192.168.1.102;192.168.1.104;50358;1883;56;Disconnect Req;
337;Jan 13, 2022 15:51:52.460744638 CET;192.168.1.102;192.168.1.104;50358;1883;75;[TCP Retransmission] 50358 → 1883 [FIN, PSH, ACK] Seq=55 Ack=5 Win=42336 Len=21;
338;Jan 13, 2022 15:51:52.477059036 CET;192.168.1.104;192.168.1.102;1883;50358;54;1883 → 50358 [FIN, ACK] Seq=5 Ack=77 Win=8192 Len=0;
339;Jan 13, 2022 15:51:52.477083250 CET;192.168.1.102;192.168.1.104;50358;1883;54;50358 → 1883 [ACK] Seq=77 Ack=6 Win=42335 Len=0;
340;Jan 13, 2022 15:51:57.009977195 CET;192.168.1.102;192.168.1.104;50360;1883;74;50360 → 1883 [SYN] Seq=0 Win=42340 Len=0 MSS=1460 SACK_PERM=1 TSval=1797621906 TSecr=0 WS=512;
341;Jan 13, 2022 15:51:57.026117345 CET;192.168.1.104;192.168.1.102;1883;50360;58;1883 → 50360 [SYN, ACK] Seq=0 Ack=1 Win=8192 Len=0 MSS=1460;
342;Jan 13, 2022 15:51:57.026152420 CET;192.168.1.102;192.168.1.104;50360;1883;54;50360 → 1883 [ACK] Seq=1 Ack=1 Win=42340 Len=0;
343;Jan 13, 2022 15:51:57.026200483 CET;192.168.1.102;192.168.1.104;50360;1883;108;Connect Command;
344;Jan 13, 2022 15:51:57.248637071 CET;192.168.1.102;192.168.1.104;50360;1883;108;[TCP Retransmission] 50360 → 1883 [PSH, ACK] Seq=1 Ack=1 Win=42340 Len=54;
345;Jan 13, 2022 15:51:57.278234254 CET;192.168.1.104;192.168.1.102;1883;50360;54;1883 → 50360 [ACK] Seq=1 Ack=55 Win=8192 Len=0;
346;Jan 13, 2022 15:51:57.285444676 CET;192.168.1.104;192.168.1.102;1883;50360;58;Connect Ack;
347;Jan 13, 2022 15:51:57.285466895 CET;192.168.1.102;192.168.1.104;50360;1883;54;50360 → 1883 [ACK] Seq=55 Ack=5 Win=42336 Len=0;
348;Jan 13, 2022 15:51:57.285532804 CET;192.168.1.102;192.168.1.104;50360;1883;73;Publish Message [topic];message027
349;Jan 13, 2022 15:51:57.285552159 CET;192.168.1.102;192.168.1.104;50360;1883;56;Disconnect Req;
350;Jan 13, 2022 15:51:57.740526694 CET;192.168.1.102;192.168.1.104;50360;1883;75;[TCP Retransmission] 50360 → 1883 [FIN, PSH, ACK] Seq=55 Ack=5 Win=42336 Len=21;
351;Jan 13, 2022 15:51:57.754920088 CET;192.168.1.104;192.168.1.102;1883;50360;54;1883 → 50360 [FIN, ACK] Seq=5 Ack=77 Win=8192 Len=0;
352;Jan 13, 2022 15:51:57.754942084 CET;192.168.1.102;192.168.1.104;50360;1883;54;50360 → 1883 [ACK] Seq=77 Ack=6 Win=42335 Len=0;
353;Jan 13, 2022 15:52:02.290010608 CET;192.168.1.102;192.168.1.104;50362;1883;74;50362 → 1883 [SYN] Seq=0 Win=42340 Len=0 MSS=1460 SACK_PERM=1 TSval=1797627186 TSecr=0 WS=512;
354;Jan 13, 2022 15:52:02.303738588 CET;192.168.1.104;192.168.1.102;1883;50362;58;1883 → 50362 [SYN, ACK] Seq=0 Ack=1 Win=8192 Len=0 MSS=1460;
355;Jan 13, 2022 15:52:02.303763540 CET;192.168.1.102;192.168.1.104;50362;1883;54;50362 → 1883 [ACK] Seq=1 Ack=1 Win=42340 Len=0;
356;Jan 13, 2022 15:52:02.303797854 CET;192.168.1.102;192.168.1.104;50362;1883;108;Connect Command;
357;Jan 13, 2022 15:52:02.521017878 CET;192.168.1.102;192.168.1.104;50362;1883;108;[TCP Retransmission] 50362 → 1883 [PSH, ACK] Seq=1 Ack=1 Win=42340 Len=54;
358;Jan 13, 2022 15:52:02.537034636 CET;192.168.1.104;192.168.1.102;1883;50362;54;1883 → 50362 [ACK] Seq=1 Ack=55 Win=8192 Len=0;
359;Jan 13, 2022 15:52:02.540877450 CET;192.168.1.104;192.168.1.102;1883;50362;58;Connect Ack;
360;Jan 13, 2022 15:52:02.540894066 CET;192.168.1.102;192.168.1.104;50362;1883;54;50362 → 1883 [ACK] Seq=55 Ack=5 Win=42336 Len=0;
361;Jan 13, 2022 15:52:02.540946140 CET;192.168.1.102;192.168.1.104;50362;1883;73;Publish Message [topic];message028
362;Jan 13, 2022 15:52:02.540960889 CET;192.168.1.102;192.168.1.104;50362;1883;56;Disconnect Req;
363;Jan 13, 2022 15:52:02.988634791 CET;192.168.1.102;192.168.1.104;50362;1883;75;[TCP Retransmission] 50362 → 1883 [FIN, PSH, ACK] Seq=55 Ack=5 Win=42336 Len=21;
364;Jan 13, 2022 15:52:03.017869065 CET;192.168.1.104;192.168.1.102;1883;50362;54;1883 → 50362 [FIN, ACK] Seq=5 Ack=77 Win=8192 Len=0;
365;Jan 13, 2022 15:52:03.017903839 CET;192.168.1.102;192.168.1.104;50362;1883;54;50362 → 1883 [ACK] Seq=77 Ack=6 Win=42335 Len=0;
366;Jan 13, 2022 15:52:07.548249823 CET;192.168.1.102;192.168.1.104;50364;1883;74;50364 → 1883 [SYN] Seq=0 Win=42340 Len=0 MSS=1460 SACK_PERM=1 TSval=1797632444 TSecr=0 WS=512;
367;Jan 13, 2022 15:52:07.563543741 CET;192.168.1.104;192.168.1.102;1883;50364;58;1883 → 50364 [SYN, ACK] Seq=0 Ack=1 Win=8192 Len=0 MSS=1460;
368;Jan 13, 2022 15:52:07.563575998 CET;192.168.1.102;192.168.1.104;50364;1883;54;50364 → 1883 [ACK] Seq=1 Ack=1 Win=42340 Len=0;
369;Jan 13, 2022 15:52:07.563619095 CET;192.168.1.102;192.168.1.104;50364;1883;108;Connect Command;
370;Jan 13, 2022 15:52:07.780614034 CET;192.168.1.102;192.168.1.104;50364;1883;108;[TCP Retransmission] 50364 → 1883 [PSH, ACK] Seq=1 Ack=1 Win=42340 Len=54;
371;Jan 13, 2022 15:52:07.805302295 CET;192.168.1.104;192.168.1.102;1883;50364;54;1883 → 50364 [ACK] Seq=1 Ack=55 Win=8192 Len=0;
372;Jan 13, 2022 15:52:07.809448292 CET;192.168.1.104;192.168.1.102;1883;50364;58;Connect Ack;
373;Jan 13, 2022 15:52:07.809472864 CET;192.168.1.102;192.168.1.104;50364;1883;54;50364 → 1883 [ACK] Seq=55 Ack=5 Win=42336 Len=0;
374;Jan 13, 2022 15:52:07.809533254 CET;192.168.1.102;192.168.1.104;50364;1883;73;Publish Message [topic];message029
375;Jan 13, 2022 15:52:07.809552453 CET;192.168.1.102;192.168.1.104;50364;1883;56;Disconnect Req;
376;Jan 13, 2022 15:52:08.268569204 CET;192.168.1.102;192.168.1.104;50364;1883;75;[TCP Retransmission] 50364 → 1883 [FIN, PSH, ACK] Seq=55 Ack=5 Win=42336 Len=21;
377;Jan 13, 2022 15:52:08.297778444 CET;192.168.1.104;192.168.1.102;1883;50364;54;1883 → 50364 [FIN, ACK] Seq=5 Ack=77 Win=8192 Len=0;
378;Jan 13, 2022 15:52:08.297812384 CET;192.168.1.102;192.168.1.104;50364;1883;54;50364 → 1883 [ACK] Seq=77 Ack=6 Win=42335 Len=0;
379;Jan 13, 2022 15:52:12.817093639 CET;192.168.1.102;192.168.1.104;50366;1883;74;50366 → 1883 [SYN] Seq=0 Win=42340 Len=0 MSS=1460 SACK_PERM=1 TSval=1797637713 TSecr=0 WS=512;
380;Jan 13, 2022 15:52:12.831363269 CET;192.168.1.104;192.168.1.102;1883;50366;58;1883 → 50366 [SYN, ACK] Seq=0 Ack=1 Win=8192 Len=0 MSS=1460;
381;Jan 13, 2022 15:52:12.831412947 CET;192.168.1.102;192.168.1.104;50366;1883;54;50366 → 1883 [ACK] Seq=1 Ack=1 Win=42340 Len=0;
382;Jan 13, 2022 15:52:12.831457729 CET;192.168.1.102;192.168.1.104;50366;1883;108;Connect Command;
383;Jan 13, 2022 15:52:13.048648636 CET;192.168.1.102;192.168.1.104;50366;1883;108;[TCP Retransmission] 50366 → 1883 [PSH, ACK] Seq=1 Ack=1 Win=42340 Len=54;
384;Jan 13, 2022 15:52:13.080374832 CET;192.168.1.104;192.168.1.102;1883;50366;54;1883 → 50366 [ACK] Seq=1 Ack=55 Win=8192 Len=0;
385;Jan 13, 2022 15:52:13.084811122 CET;192.168.1.104;192.168.1.102;1883;50366;58;Connect Ack;
386;Jan 13, 2022 15:52:13.084831619 CET;192.168.1.102;192.168.1.104;50366;1883;54;50366 → 1883 [ACK] Seq=55 Ack=5 Win=42336 Len=0;
387;Jan 13, 2022 15:52:13.084879405 CET;192.168.1.102;192.168.1.104;50366;1883;73;Publish Message [topic];message030
388;Jan 13, 2022 15:52:13.084893704 CET;192.168.1.102;192.168.1.104;50366;1883;56;Disconnect Req;
389;Jan 13, 2022 15:52:13.548599550 CET;192.168.1.102;192.168.1.104;50366;1883;75;[TCP Retransmission] 50366 → 1883 [FIN, PSH, ACK] Seq=55 Ack=5 Win=42336 Len=21;
390;Jan 13, 2022 15:52:13.571713773 CET;192.168.1.104;192.168.1.102;1883;50366;54;1883 → 50366 [FIN, ACK] Seq=5 Ack=77 Win=8192 Len=0;
391;Jan 13, 2022 15:52:13.571727511 CET;192.168.1.102;192.168.1.104;50366;1883;54;50366 → 1883 [ACK] Seq=77 Ack=6 Win=42335 Len=0;
392;Jan 13, 2022 15:52:18.089815149 CET;192.168.1.102;192.168.1.104;50370;1883;74;50370 → 1883 [SYN] Seq=0 Win=42340 Len=0 MSS=1460 SACK_PERM=1 TSval=1797642985 TSecr=0 WS=512;
393;Jan 13, 2022 15:52:18.103810804 CET;192.168.1.104;192.168.1.102;1883;50370;58;1883 → 50370 [SYN, ACK] Seq=0 Ack=1 Win=8192 Len=0 MSS=1460;
394;Jan 13, 2022 15:52:18.103872863 CET;192.168.1.102;192.168.1.104;50370;1883;54;50370 → 1883 [ACK] Seq=1 Ack=1 Win=42340 Len=0;
395;Jan 13, 2022 15:52:18.103928882 CET;192.168.1.102;192.168.1.104;50370;1883;108;Connect Command;
396;Jan 13, 2022 15:52:18.320521040 CET;192.168.1.102;192.168.1.104;50370;1883;108;[TCP Retransmission] 50370 → 1883 [PSH, ACK] Seq=1 Ack=1 Win=42340 Len=54;
397;Jan 13, 2022 15:52:18.334858923 CET;192.168.1.104;192.168.1.102;1883;50370;54;1883 → 50370 [ACK] Seq=1 Ack=55 Win=8192 Len=0;
398;Jan 13, 2022 15:52:18.338038953 CET;192.168.1.104;192.168.1.102;1883;50370;58;Connect Ack;
399;Jan 13, 2022 15:52:18.338085289 CET;192.168.1.102;192.168.1.104;50370;1883;54;50370 → 1883 [ACK] Seq=55 Ack=5 Win=42336 Len=0;
400;Jan 13, 2022 15:52:18.338150606 CET;192.168.1.102;192.168.1.104;50370;1883;73;Publish Message [topic];message031
401;Jan 13, 2022 15:52:18.338229895 CET;192.168.1.102;192.168.1.104;50370;1883;56;Disconnect Req;
402;Jan 13, 2022 15:52:18.796787091 CET;192.168.1.102;192.168.1.104;50370;1883;75;[TCP Retransmission] 50370 → 1883 [FIN, PSH, ACK] Seq=55 Ack=5 Win=42336 Len=21;
403;Jan 13, 2022 15:52:18.823082746 CET;192.168.1.104;192.168.1.102;1883;50370;54;1883 → 50370 [FIN, ACK] Seq=5 Ack=77 Win=8192 Len=0;
404;Jan 13, 2022 15:52:18.823109090 CET;192.168.1.102;192.168.1.104;50370;1883;54;50370 → 1883 [ACK] Seq=77 Ack=6 Win=42335 Len=0;
405;Jan 13, 2022 15:52:23.342335607 CET;192.168.1.102;192.168.1.104;50372;1883;74;50372 → 1883 [SYN] Seq=0 Win=42340 Len=0 MSS=1460 SACK_PERM=1 TSval=1797648238 TSecr=0 WS=512;
406;Jan 13, 2022 15:52:23.358417924 CET;192.168.1.104;192.168.1.102;1883;50372;58;1883 → 50372 [SYN, ACK] Seq=0 Ack=1 Win=8192 Len=0 MSS=1460;
407;Jan 13, 2022 15:52:23.358447125 CET;192.168.1.102;192.168.1.104;50372;1883;54;50372 → 1883 [ACK] Seq=1 Ack=1 Win=42340 Len=0;
408;Jan 13, 2022 15:52:23.358486193 CET;192.168.1.102;192.168.1.104;50372;1883;108;Connect Command;
409;Jan 13, 2022 15:52:23.580589302 CET;192.168.1.102;192.168.1.104;50372;1883;108;[TCP Retransmission] 50372 → 1883 [PSH, ACK] Seq=1 Ack=1 Win=42340 Len=54;
410;Jan 13, 2022 15:52:23.604340803 CET;192.168.1.104;192.168.1.102;1883;50372;54;1883 → 50372 [ACK] Seq=1 Ack=55 Win=8192 Len=0;
411;Jan 13, 2022 15:52:23.608785194 CET;192.168.1.104;192.168.1.102;1883;50372;58;Connect Ack;
412;Jan 13, 2022 15:52:23.608811090 CET;192.168.1.102;192.168.1.104;50372;1883;54;50372 → 1883 [ACK] Seq=55 Ack=5 Win=42336 Len=0;
413;Jan 13, 2022 15:52:23.608879084 CET;192.168.1.102;192.168.1.104;50372;1883;73;Publish Message [topic];message032
414;Jan 13, 2022 15:52:23.608897340 CET;192.168.1.102;192.168.1.104;50372;1883;56;Disconnect Req;
415;Jan 13, 2022 15:52:24.076955745 CET;192.168.1.102;192.168.1.104;50372;1883;75;[TCP Retransmission] 50372 → 1883 [FIN, PSH, ACK] Seq=55 Ack=5 Win=42336 Len=21;
416;Jan 13, 2022 15:52:24.097103405 CET;192.168.1.104;192.168.1.102;1883;50372;54;1883 → 50372 [FIN, ACK] Seq=5 Ack=77 Win=8192 Len=0;
417;Jan 13, 2022 15:52:24.097134701 CET;192.168.1.102;192.168.1.104;50372;1883;54;50372 → 1883 [ACK] Seq=77 Ack=6 Win=42335 Len=0;
418;Jan 13, 2022 15:52:28.621182158 CET;192.168.1.102;192.168.1.104;50374;1883;74;50374 → 1883 [SYN] Seq=0 Win=42340 Len=0 MSS=1460 SACK_PERM=1 TSval=1797653517 TSecr=0 WS=512;
419;Jan 13, 2022 15:52:28.643486291 CET;192.168.1.104;192.168.1.102;1883;50374;58;1883 → 50374 [SYN, ACK] Seq=0 Ack=1 Win=8192 Len=0 MSS=1460;
420;Jan 13, 2022 15:52:28.643522357 CET;192.168.1.102;192.168.1.104;50374;1883;54;50374 → 1883 [ACK] Seq=1 Ack=1 Win=42340 Len=0;
421;Jan 13, 2022 15:52:28.643575947 CET;192.168.1.102;192.168.1.104;50374;1883;108;Connect Command;
422;Jan 13, 2022 15:52:28.868610238 CET;192.168.1.102;192.168.1.104;50374;1883;108;[TCP Retransmission] 50374 → 1883 [PSH, ACK] Seq=1 Ack=1 Win=42340 Len=54;
423;Jan 13, 2022 15:52:28.885448512 CET;192.168.1.104;192.168.1.102;1883;50374;54;1883 → 50374 [ACK] Seq=1 Ack=55 Win=8192 Len=0;
424;Jan 13, 2022 15:52:28.891767288 CET;192.168.1.104;192.168.1.102;1883;50374;58;Connect Ack;
425;Jan 13, 2022 15:52:28.891787545 CET;192.168.1.102;192.168.1.104;50374;1883;54;50374 → 1883 [ACK] Seq=55 Ack=5 Win=42336 Len=0;
426;Jan 13, 2022 15:52:28.891847000 CET;192.168.1.102;192.168.1.104;50374;1883;73;Publish Message [topic];message033
427;Jan 13, 2022 15:52:28.891863757 CET;192.168.1.102;192.168.1.104;50374;1883;56;Disconnect Req;
428;Jan 13, 2022 15:52:29.356634950 CET;192.168.1.102;192.168.1.104;50374;1883;75;[TCP Retransmission] 50374 → 1883 [FIN, PSH, ACK] Seq=55 Ack=5 Win=42336 Len=21;
429;Jan 13, 2022 15:52:29.385601654 CET;192.168.1.104;192.168.1.102;1883;50374;54;1883 → 50374 [FIN, ACK] Seq=5 Ack=77 Win=8192 Len=0;
430;Jan 13, 2022 15:52:29.385636369 CET;192.168.1.102;192.168.1.104;50374;1883;54;50374 → 1883 [ACK] Seq=77 Ack=6 Win=42335 Len=0;
431;Jan 13, 2022 15:52:33.898796094 CET;192.168.1.102;192.168.1.104;50376;1883;74;50376 → 1883 [SYN] Seq=0 Win=42340 Len=0 MSS=1460 SACK_PERM=1 TSval=1797658794 TSecr=0 WS=512;
432;Jan 13, 2022 15:52:33.913666719 CET;192.168.1.104;192.168.1.102;1883;50376;58;1883 → 50376 [SYN, ACK] Seq=0 Ack=1 Win=8192 Len=0 MSS=1460;
433;Jan 13, 2022 15:52:33.913699919 CET;192.168.1.102;192.168.1.104;50376;1883;54;50376 → 1883 [ACK] Seq=1 Ack=1 Win=42340 Len=0;
434;Jan 13, 2022 15:52:33.913751775 CET;192.168.1.102;192.168.1.104;50376;1883;108;Connect Command;
435;Jan 13, 2022 15:52:34.132525453 CET;192.168.1.102;192.168.1.104;50376;1883;108;[TCP Retransmission] 50376 → 1883 [PSH, ACK] Seq=1 Ack=1 Win=42340 Len=54;
436;Jan 13, 2022 15:52:34.150535209 CET;192.168.1.104;192.168.1.102;1883;50376;54;1883 → 50376 [ACK] Seq=1 Ack=55 Win=8192 Len=0;
437;Jan 13, 2022 15:52:34.154443590 CET;192.168.1.104;192.168.1.102;1883;50376;58;Connect Ack;
438;Jan 13, 2022 15:52:34.154461788 CET;192.168.1.102;192.168.1.104;50376;1883;54;50376 → 1883 [ACK] Seq=55 Ack=5 Win=42336 Len=0;
439;Jan 13, 2022 15:52:34.154510917 CET;192.168.1.102;192.168.1.104;50376;1883;73;Publish Message [topic];message034
440;Jan 13, 2022 15:52:34.154524618 CET;192.168.1.102;192.168.1.104;50376;1883;56;Disconnect Req;
441;Jan 13, 2022 15:52:34.604578801 CET;192.168.1.102;192.168.1.104;50376;1883;75;[TCP Retransmission] 50376 → 1883 [FIN, PSH, ACK] Seq=55 Ack=5 Win=42336 Len=21;
442;Jan 13, 2022 15:52:34.619519559 CET;192.168.1.104;192.168.1.102;1883;50376;54;1883 → 50376 [FIN, ACK] Seq=5 Ack=77 Win=8192 Len=0;
443;Jan 13, 2022 15:52:34.619549160 CET;192.168.1.102;192.168.1.104;50376;1883;54;50376 → 1883 [ACK] Seq=77 Ack=6 Win=42335 Len=0;
444;Jan 13, 2022 15:52:39.159755947 CET;192.168.1.102;192.168.1.104;50378;1883;74;50378 → 1883 [SYN] Seq=0 Win=42340 Len=0 MSS=1460 SACK_PERM=1 TSval=1797664055 TSecr=0 WS=512;
445;Jan 13, 2022 15:52:39.176107945 CET;192.168.1.104;192.168.1.102;1883;50378;58;1883 → 50378 [SYN, ACK] Seq=0 Ack=1 Win=8192 Len=0 MSS=1460;
446;Jan 13, 2022 15:52:39.176155112 CET;192.168.1.102;192.168.1.104;50378;1883;54;50378 → 1883 [ACK] Seq=1 Ack=1 Win=42340 Len=0;
447;Jan 13, 2022 15:52:39.176222157 CET;192.168.1.102;192.168.1.104;50378;1883;108;Connect Command;
448;Jan 13, 2022 15:52:39.396605625 CET;192.168.1.102;192.168.1.104;50378;1883;108;[TCP Retransmission] 50378 → 1883 [PSH, ACK] Seq=1 Ack=1 Win=42340 Len=54;
449;Jan 13, 2022 15:52:39.417296127 CET;192.168.1.104;192.168.1.102;1883;50378;54;1883 → 50378 [ACK] Seq=1 Ack=55 Win=8192 Len=0;
450;Jan 13, 2022 15:52:39.420337141 CET;192.168.1.104;192.168.1.102;1883;50378;58;Connect Ack;
451;Jan 13, 2022 15:52:39.420355758 CET;192.168.1.102;192.168.1.104;50378;1883;54;50378 → 1883 [ACK] Seq=55 Ack=5 Win=42336 Len=0;
452;Jan 13, 2022 15:52:39.420412120 CET;192.168.1.102;192.168.1.104;50378;1883;73;Publish Message [topic];message035
453;Jan 13, 2022 15:52:39.420428505 CET;192.168.1.102;192.168.1.104;50378;1883;56;Disconnect Req;
454;Jan 13, 2022 15:52:39.884547361 CET;192.168.1.102;192.168.1.104;50378;1883;75;[TCP Retransmission] 50378 → 1883 [FIN, PSH, ACK] Seq=55 Ack=5 Win=42336 Len=21;
455;Jan 13, 2022 15:52:39.906907722 CET;192.168.1.104;192.168.1.102;1883;50378;54;1883 → 50378 [FIN, ACK] Seq=5 Ack=77 Win=8192 Len=0;
456;Jan 13, 2022 15:52:39.906940394 CET;192.168.1.102;192.168.1.104;50378;1883;54;50378 → 1883 [ACK] Seq=77 Ack=6 Win=42335 Len=0;
457;Jan 13, 2022 15:52:44.433037546 CET;192.168.1.102;192.168.1.104;50380;1883;74;50380 → 1883 [SYN] Seq=0 Win=42340 Len=0 MSS=1460 SACK_PERM=1 TSval=1797669329 TSecr=0 WS=512;
458;Jan 13, 2022 15:52:44.456603866 CET;192.168.1.104;192.168.1.102;1883;50380;58;1883 → 50380 [SYN, ACK] Seq=0 Ack=1 Win=8192 Len=0 MSS=1460;
459;Jan 13, 2022 15:52:44.456641673 CET;192.168.1.102;192.168.1.104;50380;1883;54;50380 → 1883 [ACK] Seq=1 Ack=1 Win=42340 Len=0;
460;Jan 13, 2022 15:52:44.456704139 CET;192.168.1.102;192.168.1.104;50380;1883;108;Connect Command;
461;Jan 13, 2022 15:52:44.684750724 CET;192.168.1.102;192.168.1.104;50380;1883;108;[TCP Retransmission] 50380 → 1883 [PSH, ACK] Seq=1 Ack=1 Win=42340 Len=54;
462;Jan 13, 2022 15:52:44.703966475 CET;192.168.1.104;192.168.1.102;1883;50380;54;1883 → 50380 [ACK] Seq=1 Ack=55 Win=8192 Len=0;
463;Jan 13, 2022 15:52:44.707139756 CET;192.168.1.104;192.168.1.102;1883;50380;58;Connect Ack;
464;Jan 13, 2022 15:52:44.707159131 CET;192.168.1.102;192.168.1.104;50380;1883;54;50380 → 1883 [ACK] Seq=55 Ack=5 Win=42336 Len=0;
465;Jan 13, 2022 15:52:44.707214151 CET;192.168.1.102;192.168.1.104;50380;1883;73;Publish Message [topic];message036
466;Jan 13, 2022 15:52:44.707230462 CET;192.168.1.102;192.168.1.104;50380;1883;56;Disconnect Req;
467;Jan 13, 2022 15:52:45.164576282 CET;192.168.1.102;192.168.1.104;50380;1883;75;[TCP Retransmission] 50380 → 1883 [FIN, PSH, ACK] Seq=55 Ack=5 Win=42336 Len=21;
468;Jan 13, 2022 15:52:45.186477080 CET;192.168.1.104;192.168.1.102;1883;50380;54;1883 → 50380 [FIN, ACK] Seq=5 Ack=77 Win=8192 Len=0;
469;Jan 13, 2022 15:52:45.186509145 CET;192.168.1.102;192.168.1.104;50380;1883;54;50380 → 1883 [ACK] Seq=77 Ack=6 Win=42335 Len=0;
470;Jan 13, 2022 15:52:49.711420295 CET;192.168.1.102;192.168.1.104;50382;1883;74;50382 → 1883 [SYN] Seq=0 Win=42340 Len=0 MSS=1460 SACK_PERM=1 TSval=1797674607 TSecr=0 WS=512;
471;Jan 13, 2022 15:52:49.725514537 CET;192.168.1.104;192.168.1.102;1883;50382;58;1883 → 50382 [SYN, ACK] Seq=0 Ack=1 Win=8192 Len=0 MSS=1460;
472;Jan 13, 2022 15:52:49.725547373 CET;192.168.1.102;192.168.1.104;50382;1883;54;50382 → 1883 [ACK] Seq=1 Ack=1 Win=42340 Len=0;
473;Jan 13, 2022 15:52:49.725591510 CET;192.168.1.102;192.168.1.104;50382;1883;108;Connect Command;
474;Jan 13, 2022 15:52:49.944681935 CET;192.168.1.102;192.168.1.104;50382;1883;108;[TCP Retransmission] 50382 → 1883 [PSH, ACK] Seq=1 Ack=1 Win=42340 Len=54;
475;Jan 13, 2022 15:52:49.963232697 CET;192.168.1.104;192.168.1.102;1883;50382;54;1883 → 50382 [ACK] Seq=1 Ack=55 Win=8192 Len=0;
476;Jan 13, 2022 15:52:49.966322920 CET;192.168.1.104;192.168.1.102;1883;50382;58;Connect Ack;
477;Jan 13, 2022 15:52:49.966342095 CET;192.168.1.102;192.168.1.104;50382;1883;54;50382 → 1883 [ACK] Seq=55 Ack=5 Win=42336 Len=0;
478;Jan 13, 2022 15:52:49.966395816 CET;192.168.1.102;192.168.1.104;50382;1883;73;Publish Message [topic];message037
479;Jan 13, 2022 15:52:49.966411341 CET;192.168.1.102;192.168.1.104;50382;1883;56;Disconnect Req;
480;Jan 13, 2022 15:52:50.412530253 CET;192.168.1.102;192.168.1.104;50382;1883;75;[TCP Retransmission] 50382 → 1883 [FIN, PSH, ACK] Seq=55 Ack=5 Win=42336 Len=21;
481;Jan 13, 2022 15:52:50.426376424 CET;192.168.1.104;192.168.1.102;1883;50382;54;1883 → 50382 [FIN, ACK] Seq=5 Ack=77 Win=8192 Len=0;
482;Jan 13, 2022 15:52:50.426399147 CET;192.168.1.102;192.168.1.104;50382;1883;54;50382 → 1883 [ACK] Seq=77 Ack=6 Win=42335 Len=0;
483;Jan 13, 2022 15:52:54.971945199 CET;192.168.1.102;192.168.1.104;50384;1883;74;50384 → 1883 [SYN] Seq=0 Win=42340 Len=0 MSS=1460 SACK_PERM=1 TSval=1797679868 TSecr=0 WS=512;
484;Jan 13, 2022 15:52:54.988152157 CET;192.168.1.104;192.168.1.102;1883;50384;58;1883 → 50384 [SYN, ACK] Seq=0 Ack=1 Win=8192 Len=0 MSS=1460;
485;Jan 13, 2022 15:52:54.988184712 CET;192.168.1.102;192.168.1.104;50384;1883;54;50384 → 1883 [ACK] Seq=1 Ack=1 Win=42340 Len=0;
486;Jan 13, 2022 15:52:54.988233272 CET;192.168.1.102;192.168.1.104;50384;1883;108;Connect Command;
487;Jan 13, 2022 15:52:55.208607986 CET;192.168.1.102;192.168.1.104;50384;1883;108;[TCP Retransmission] 50384 → 1883 [PSH, ACK] Seq=1 Ack=1 Win=42340 Len=54;
488;Jan 13, 2022 15:52:55.235185100 CET;192.168.1.104;192.168.1.102;1883;50384;54;1883 → 50384 [ACK] Seq=1 Ack=55 Win=8192 Len=0;
489;Jan 13, 2022 15:52:55.240688876 CET;192.168.1.104;192.168.1.102;1883;50384;58;Connect Ack;
490;Jan 13, 2022 15:52:55.240709713 CET;192.168.1.102;192.168.1.104;50384;1883;54;50384 → 1883 [ACK] Seq=55 Ack=5 Win=42336 Len=0;
491;Jan 13, 2022 15:52:55.240768305 CET;192.168.1.102;192.168.1.104;50384;1883;73;Publish Message [topic];message038
492;Jan 13, 2022 15:52:55.240787665 CET;192.168.1.102;192.168.1.104;50384;1883;56;Disconnect Req;
493;Jan 13, 2022 15:52:55.692553059 CET;192.168.1.102;192.168.1.104;50384;1883;75;[TCP Retransmission] 50384 → 1883 [FIN, PSH, ACK] Seq=55 Ack=5 Win=42336 Len=21;
494;Jan 13, 2022 15:52:55.708497734 CET;192.168.1.104;192.168.1.102;1883;50384;54;1883 → 50384 [FIN, ACK] Seq=5 Ack=77 Win=8192 Len=0;
495;Jan 13, 2022 15:52:55.708530764 CET;192.168.1.102;192.168.1.104;50384;1883;54;50384 → 1883 [ACK] Seq=77 Ack=6 Win=42335 Len=0;
496;Jan 13, 2022 15:53:00.259023768 CET;192.168.1.102;192.168.1.104;50386;1883;74;50386 → 1883 [SYN] Seq=0 Win=42340 Len=0 MSS=1460 SACK_PERM=1 TSval=1797685155 TSecr=0 WS=512;
497;Jan 13, 2022 15:53:00.276102435 CET;192.168.1.104;192.168.1.102;1883;50386;58;1883 → 50386 [SYN, ACK] Seq=0 Ack=1 Win=8192 Len=0 MSS=1460;
498;Jan 13, 2022 15:53:00.276135172 CET;192.168.1.102;192.168.1.104;50386;1883;54;50386 → 1883 [ACK] Seq=1 Ack=1 Win=42340 Len=0;
499;Jan 13, 2022 15:53:00.276183639 CET;192.168.1.102;192.168.1.104;50386;1883;108;Connect Command;
500;Jan 13, 2022 15:53:00.496799975 CET;192.168.1.102;192.168.1.104;50386;1883;108;[TCP Retransmission] 50386 → 1883 [PSH, ACK] Seq=1 Ack=1 Win=42340 Len=54;
501;Jan 13, 2022 15:53:00.529438498 CET;192.168.1.104;192.168.1.102;1883;50386;54;1883 → 50386 [ACK] Seq=1 Ack=55 Win=8192 Len=0;
502;Jan 13, 2022 15:53:00.534326979 CET;192.168.1.104;192.168.1.102;1883;50386;58;Connect Ack;
503;Jan 13, 2022 15:53:00.534346863 CET;192.168.1.102;192.168.1.104;50386;1883;54;50386 → 1883 [ACK] Seq=55 Ack=5 Win=42336 Len=0;
504;Jan 13, 2022 15:53:00.534397933 CET;192.168.1.102;192.168.1.104;50386;1883;73;Publish Message [topic];message039
505;Jan 13, 2022 15:53:00.534415068 CET;192.168.1.102;192.168.1.104;50386;1883;56;Disconnect Req;
506;Jan 13, 2022 15:53:01.004578045 CET;192.168.1.102;192.168.1.104;50386;1883;75;[TCP Retransmission] 50386 → 1883 [FIN, PSH, ACK] Seq=55 Ack=5 Win=42336 Len=21;
507;Jan 13, 2022 15:53:01.022567894 CET;192.168.1.104;192.168.1.102;1883;50386;54;1883 → 50386 [FIN, ACK] Seq=5 Ack=77 Win=8192 Len=0;
508;Jan 13, 2022 15:53:01.022582303 CET;192.168.1.102;192.168.1.104;50386;1883;54;50386 → 1883 [ACK] Seq=77 Ack=6 Win=42335 Len=0;
509;Jan 13, 2022 15:53:05.543118799 CET;192.168.1.102;192.168.1.104;50388;1883;74;50388 → 1883 [SYN] Seq=0 Win=42340 Len=0 MSS=1460 SACK_PERM=1 TSval=1797690439 TSecr=0 WS=512;
510;Jan 13, 2022 15:53:05.558364937 CET;192.168.1.104;192.168.1.102;1883;50388;58;1883 → 50388 [SYN, ACK] Seq=0 Ack=1 Win=8192 Len=0 MSS=1460;
511;Jan 13, 2022 15:53:05.558395914 CET;192.168.1.102;192.168.1.104;50388;1883;54;50388 → 1883 [ACK] Seq=1 Ack=1 Win=42340 Len=0;
512;Jan 13, 2022 15:53:05.558433486 CET;192.168.1.102;192.168.1.104;50388;1883;108;Connect Command;
513;Jan 13, 2022 15:53:05.776633558 CET;192.168.1.102;192.168.1.104;50388;1883;108;[TCP Retransmission] 50388 → 1883 [PSH, ACK] Seq=1 Ack=1 Win=42340 Len=54;
514;Jan 13, 2022 15:53:05.792177033 CET;192.168.1.104;192.168.1.102;1883;50388;54;1883 → 50388 [ACK] Seq=1 Ack=55 Win=8192 Len=0;
515;Jan 13, 2022 15:53:05.799582263 CET;192.168.1.104;192.168.1.102;1883;50388;58;Connect Ack;
516;Jan 13, 2022 15:53:05.799604386 CET;192.168.1.102;192.168.1.104;50388;1883;54;50388 → 1883 [ACK] Seq=55 Ack=5 Win=42336 Len=0;
517;Jan 13, 2022 15:53:05.799676666 CET;192.168.1.102;192.168.1.104;50388;1883;73;Publish Message [topic];message040
518;Jan 13, 2022 15:53:05.799694366 CET;192.168.1.102;192.168.1.104;50388;1883;56;Disconnect Req;
519;Jan 13, 2022 15:53:06.252527266 CET;192.168.1.102;192.168.1.104;50388;1883;75;[TCP Retransmission] 50388 → 1883 [FIN, PSH, ACK] Seq=55 Ack=5 Win=42336 Len=21;
520;Jan 13, 2022 15:53:06.266561285 CET;192.168.1.104;192.168.1.102;1883;50388;54;1883 → 50388 [FIN, ACK] Seq=5 Ack=77 Win=8192 Len=0;
521;Jan 13, 2022 15:53:06.266594398 CET;192.168.1.102;192.168.1.104;50388;1883;54;50388 → 1883 [ACK] Seq=77 Ack=6 Win=42335 Len=0;
522;Jan 13, 2022 15:53:10.804041773 CET;192.168.1.102;192.168.1.104;50390;1883;74;50390 → 1883 [SYN] Seq=0 Win=42340 Len=0 MSS=1460 SACK_PERM=1 TSval=1797695700 TSecr=0 WS=512;
523;Jan 13, 2022 15:53:10.816856023 CET;192.168.1.104;192.168.1.102;1883;50390;58;1883 → 50390 [SYN, ACK] Seq=0 Ack=1 Win=8192 Len=0 MSS=1460;
524;Jan 13, 2022 15:53:10.816887345 CET;192.168.1.102;192.168.1.104;50390;1883;54;50390 → 1883 [ACK] Seq=1 Ack=1 Win=42340 Len=0;
525;Jan 13, 2022 15:53:10.816928860 CET;192.168.1.102;192.168.1.104;50390;1883;108;Connect Command;
526;Jan 13, 2022 15:53:11.036560188 CET;192.168.1.102;192.168.1.104;50390;1883;108;[TCP Retransmission] 50390 → 1883 [PSH, ACK] Seq=1 Ack=1 Win=42340 Len=54;
527;Jan 13, 2022 15:53:11.053496778 CET;192.168.1.104;192.168.1.102;1883;50390;54;1883 → 50390 [ACK] Seq=1 Ack=55 Win=8192 Len=0;
528;Jan 13, 2022 15:53:11.056229602 CET;192.168.1.104;192.168.1.102;1883;50390;58;Connect Ack;
529;Jan 13, 2022 15:53:11.056249420 CET;192.168.1.102;192.168.1.104;50390;1883;54;50390 → 1883 [ACK] Seq=55 Ack=5 Win=42336 Len=0;
530;Jan 13, 2022 15:53:11.056296075 CET;192.168.1.102;192.168.1.104;50390;1883;73;Publish Message [topic];message041
531;Jan 13, 2022 15:53:11.056309624 CET;192.168.1.102;192.168.1.104;50390;1883;56;Disconnect Req;
532;Jan 13, 2022 15:53:11.500538450 CET;192.168.1.102;192.168.1.104;50390;1883;75;[TCP Retransmission] 50390 → 1883 [FIN, PSH, ACK] Seq=55 Ack=5 Win=42336 Len=21;
533;Jan 13, 2022 15:53:11.516197073 CET;192.168.1.104;192.168.1.102;1883;50390;54;1883 → 50390 [FIN, ACK] Seq=5 Ack=77 Win=8192 Len=0;
534;Jan 13, 2022 15:53:11.516227984 CET;192.168.1.102;192.168.1.104;50390;1883;54;50390 → 1883 [ACK] Seq=77 Ack=6 Win=42335 Len=0;
535;Jan 13, 2022 15:53:16.062676615 CET;192.168.1.102;192.168.1.104;50392;1883;74;50392 → 1883 [SYN] Seq=0 Win=42340 Len=0 MSS=1460 SACK_PERM=1 TSval=1797700958 TSecr=0 WS=512;
536;Jan 13, 2022 15:53:16.082071729 CET;192.168.1.104;192.168.1.102;1883;50392;58;1883 → 50392 [SYN, ACK] Seq=0 Ack=1 Win=8192 Len=0 MSS=1460;
537;Jan 13, 2022 15:53:16.082103989 CET;192.168.1.102;192.168.1.104;50392;1883;54;50392 → 1883 [ACK] Seq=1 Ack=1 Win=42340 Len=0;
538;Jan 13, 2022 15:53:16.082160335 CET;192.168.1.102;192.168.1.104;50392;1883;108;Connect Command;
539;Jan 13, 2022 15:53:16.304511069 CET;192.168.1.102;192.168.1.104;50392;1883;108;[TCP Retransmission] 50392 → 1883 [PSH, ACK] Seq=1 Ack=1 Win=42340 Len=54;
540;Jan 13, 2022 15:53:16.321819563 CET;192.168.1.104;192.168.1.102;1883;50392;54;1883 → 50392 [ACK] Seq=1 Ack=55 Win=8192 Len=0;
541;Jan 13, 2022 15:53:16.325414526 CET;192.168.1.104;192.168.1.102;1883;50392;58;Connect Ack;
542;Jan 13, 2022 15:53:16.325440297 CET;192.168.1.102;192.168.1.104;50392;1883;54;50392 → 1883 [ACK] Seq=55 Ack=5 Win=42336 Len=0;
543;Jan 13, 2022 15:53:16.325503566 CET;192.168.1.102;192.168.1.104;50392;1883;73;Publish Message [topic];message042
544;Jan 13, 2022 15:53:16.325516151 CET;192.168.1.102;192.168.1.104;50392;1883;56;Disconnect Req;
545;Jan 13, 2022 15:53:16.780530576 CET;192.168.1.102;192.168.1.104;50392;1883;75;[TCP Retransmission] 50392 → 1883 [FIN, PSH, ACK] Seq=55 Ack=5 Win=42336 Len=21;
546;Jan 13, 2022 15:53:16.795637885 CET;192.168.1.104;192.168.1.102;1883;50392;54;1883 → 50392 [FIN, ACK] Seq=5 Ack=77 Win=8192 Len=0;
547;Jan 13, 2022 15:53:16.795670580 CET;192.168.1.102;192.168.1.104;50392;1883;54;50392 → 1883 [ACK] Seq=77 Ack=6 Win=42335 Len=0;
548;Jan 13, 2022 15:53:21.331898687 CET;192.168.1.102;192.168.1.104;50394;1883;74;50394 → 1883 [SYN] Seq=0 Win=42340 Len=0 MSS=1460 SACK_PERM=1 TSval=1797706228 TSecr=0 WS=512;
549;Jan 13, 2022 15:53:21.349024567 CET;192.168.1.104;192.168.1.102;1883;50394;58;1883 → 50394 [SYN, ACK] Seq=0 Ack=1 Win=8192 Len=0 MSS=1460;
550;Jan 13, 2022 15:53:21.349089420 CET;192.168.1.102;192.168.1.104;50394;1883;54;50394 → 1883 [ACK] Seq=1 Ack=1 Win=42340 Len=0;
551;Jan 13, 2022 15:53:21.349154493 CET;192.168.1.102;192.168.1.104;50394;1883;108;Connect Command;
552;Jan 13, 2022 15:53:21.573236469 CET;192.168.1.102;192.168.1.104;50394;1883;108;[TCP Retransmission] 50394 → 1883 [PSH, ACK] Seq=1 Ack=1 Win=42340 Len=54;
553;Jan 13, 2022 15:53:21.605539098 CET;192.168.1.104;192.168.1.102;1883;50394;54;1883 → 50394 [ACK] Seq=1 Ack=55 Win=8192 Len=0;
554;Jan 13, 2022 15:53:21.613308999 CET;192.168.1.104;192.168.1.102;1883;50394;58;Connect Ack;
555;Jan 13, 2022 15:53:21.613331682 CET;192.168.1.102;192.168.1.104;50394;1883;54;50394 → 1883 [ACK] Seq=55 Ack=5 Win=42336 Len=0;
556;Jan 13, 2022 15:53:21.613388052 CET;192.168.1.102;192.168.1.104;50394;1883;73;Publish Message [topic];message043
557;Jan 13, 2022 15:53:21.613407376 CET;192.168.1.102;192.168.1.104;50394;1883;56;Disconnect Req;
558;Jan 13, 2022 15:53:22.060779786 CET;192.168.1.102;192.168.1.104;50394;1883;75;[TCP Retransmission] 50394 → 1883 [FIN, PSH, ACK] Seq=55 Ack=5 Win=42336 Len=21;
559;Jan 13, 2022 15:53:22.077817367 CET;192.168.1.104;192.168.1.102;1883;50394;54;1883 → 50394 [FIN, ACK] Seq=5 Ack=77 Win=8192 Len=0;
560;Jan 13, 2022 15:53:22.077879862 CET;192.168.1.102;192.168.1.104;50394;1883;54;50394 → 1883 [ACK] Seq=77 Ack=6 Win=42335 Len=0;
561;Jan 13, 2022 15:53:26.618180319 CET;192.168.1.102;192.168.1.104;50396;1883;74;50396 → 1883 [SYN] Seq=0 Win=42340 Len=0 MSS=1460 SACK_PERM=1 TSval=1797711514 TSecr=0 WS=512;
562;Jan 13, 2022 15:53:26.633153070 CET;192.168.1.104;192.168.1.102;1883;50396;58;1883 → 50396 [SYN, ACK] Seq=0 Ack=1 Win=8192 Len=0 MSS=1460;
563;Jan 13, 2022 15:53:26.633172637 CET;192.168.1.102;192.168.1.104;50396;1883;54;50396 → 1883 [ACK] Seq=1 Ack=1 Win=42340 Len=0;
564;Jan 13, 2022 15:53:26.633217943 CET;192.168.1.102;192.168.1.104;50396;1883;108;Connect Command;
565;Jan 13, 2022 15:53:26.852640379 CET;192.168.1.102;192.168.1.104;50396;1883;108;[TCP Retransmission] 50396 → 1883 [PSH, ACK] Seq=1 Ack=1 Win=42340 Len=54;
566;Jan 13, 2022 15:53:26.868210446 CET;192.168.1.104;192.168.1.102;1883;50396;54;1883 → 50396 [ACK] Seq=1 Ack=55 Win=8192 Len=0;
567;Jan 13, 2022 15:53:26.873011130 CET;192.168.1.104;192.168.1.102;1883;50396;58;Connect Ack;
568;Jan 13, 2022 15:53:26.873032888 CET;192.168.1.102;192.168.1.104;50396;1883;54;50396 → 1883 [ACK] Seq=55 Ack=5 Win=42336 Len=0;
569;Jan 13, 2022 15:53:26.873095176 CET;192.168.1.102;192.168.1.104;50396;1883;73;Publish Message [topic];message044
570;Jan 13, 2022 15:53:26.873112615 CET;192.168.1.102;192.168.1.104;50396;1883;56;Disconnect Req;
571;Jan 13, 2022 15:53:27.308604571 CET;192.168.1.102;192.168.1.104;50396;1883;75;[TCP Retransmission] 50396 → 1883 [FIN, PSH, ACK] Seq=55 Ack=5 Win=42336 Len=21;
572;Jan 13, 2022 15:53:27.325002476 CET;192.168.1.104;192.168.1.102;1883;50396;54;1883 → 50396 [FIN, ACK] Seq=5 Ack=77 Win=8192 Len=0;
573;Jan 13, 2022 15:53:27.325045213 CET;192.168.1.102;192.168.1.104;50396;1883;54;50396 → 1883 [ACK] Seq=77 Ack=6 Win=42335 Len=0;
574;Jan 13, 2022 15:53:31.878518534 CET;192.168.1.102;192.168.1.104;50398;1883;74;50398 → 1883 [SYN] Seq=0 Win=42340 Len=0 MSS=1460 SACK_PERM=1 TSval=1797716774 TSecr=0 WS=512;
575;Jan 13, 2022 15:53:31.893318934 CET;192.168.1.104;192.168.1.102;1883;50398;58;1883 → 50398 [SYN, ACK] Seq=0 Ack=1 Win=8192 Len=0 MSS=1460;
576;Jan 13, 2022 15:53:31.893345827 CET;192.168.1.102;192.168.1.104;50398;1883;54;50398 → 1883 [ACK] Seq=1 Ack=1 Win=42340 Len=0;
577;Jan 13, 2022 15:53:31.894421235 CET;192.168.1.102;192.168.1.104;50398;1883;108;Connect Command;
578;Jan 13, 2022 15:53:32.112699041 CET;192.168.1.102;192.168.1.104;50398;1883;108;[TCP Retransmission] 50398 → 1883 [PSH, ACK] Seq=1 Ack=1 Win=42340 Len=54;
579;Jan 13, 2022 15:53:32.127483392 CET;192.168.1.104;192.168.1.102;1883;50398;54;1883 → 50398 [ACK] Seq=1 Ack=55 Win=8192 Len=0;
580;Jan 13, 2022 15:53:32.132029602 CET;192.168.1.104;192.168.1.102;1883;50398;58;Connect Ack;
581;Jan 13, 2022 15:53:32.132049757 CET;192.168.1.102;192.168.1.104;50398;1883;54;50398 → 1883 [ACK] Seq=55 Ack=5 Win=42336 Len=0;
582;Jan 13, 2022 15:53:32.132108807 CET;192.168.1.102;192.168.1.104;50398;1883;73;Publish Message [topic];message045
583;Jan 13, 2022 15:53:32.132125082 CET;192.168.1.102;192.168.1.104;50398;1883;56;Disconnect Req;
584;Jan 13, 2022 15:53:32.588525613 CET;192.168.1.102;192.168.1.104;50398;1883;75;[TCP Retransmission] 50398 → 1883 [FIN, PSH, ACK] Seq=55 Ack=5 Win=42336 Len=21;
585;Jan 13, 2022 15:53:32.602890345 CET;192.168.1.104;192.168.1.102;1883;50398;54;1883 → 50398 [FIN, ACK] Seq=5 Ack=77 Win=8192 Len=0;
586;Jan 13, 2022 15:53:32.602917548 CET;192.168.1.102;192.168.1.104;50398;1883;54;50398 → 1883 [ACK] Seq=77 Ack=6 Win=42335 Len=0;
587;Jan 13, 2022 15:53:37.137429556 CET;192.168.1.102;192.168.1.104;50400;1883;74;50400 → 1883 [SYN] Seq=0 Win=42340 Len=0 MSS=1460 SACK_PERM=1 TSval=1797722033 TSecr=0 WS=512;
588;Jan 13, 2022 15:53:37.152724659 CET;192.168.1.104;192.168.1.102;1883;50400;58;1883 → 50400 [SYN, ACK] Seq=0 Ack=1 Win=8192 Len=0 MSS=1460;
589;Jan 13, 2022 15:53:37.152760623 CET;192.168.1.102;192.168.1.104;50400;1883;54;50400 → 1883 [ACK] Seq=1 Ack=1 Win=42340 Len=0;
590;Jan 13, 2022 15:53:37.152815035 CET;192.168.1.102;192.168.1.104;50400;1883;108;Connect Command;
591;Jan 13, 2022 15:53:37.372570084 CET;192.168.1.102;192.168.1.104;50400;1883;108;[TCP Retransmission] 50400 → 1883 [PSH, ACK] Seq=1 Ack=1 Win=42340 Len=54;
592;Jan 13, 2022 15:53:37.391895493 CET;192.168.1.104;192.168.1.102;1883;50400;54;1883 → 50400 [ACK] Seq=1 Ack=55 Win=8192 Len=0;
593;Jan 13, 2022 15:53:37.397944715 CET;192.168.1.104;192.168.1.102;1883;50400;58;Connect Ack;
594;Jan 13, 2022 15:53:37.397968731 CET;192.168.1.102;192.168.1.104;50400;1883;54;50400 → 1883 [ACK] Seq=55 Ack=5 Win=42336 Len=0;
595;Jan 13, 2022 15:53:37.398447765 CET;192.168.1.102;192.168.1.104;50400;1883;73;Publish Message [topic];message046
596;Jan 13, 2022 15:53:37.398471237 CET;192.168.1.102;192.168.1.104;50400;1883;56;Disconnect Req;
597;Jan 13, 2022 15:53:37.836618828 CET;192.168.1.102;192.168.1.104;50400;1883;75;[TCP Retransmission] 50400 → 1883 [FIN, PSH, ACK] Seq=55 Ack=5 Win=42336 Len=21;
598;Jan 13, 2022 15:53:37.864416389 CET;192.168.1.104;192.168.1.102;1883;50400;54;1883 → 50400 [FIN, ACK] Seq=5 Ack=77 Win=8192 Len=0;
599;Jan 13, 2022 15:53:37.864446226 CET;192.168.1.102;192.168.1.104;50400;1883;54;50400 → 1883 [ACK] Seq=77 Ack=6 Win=42335 Len=0;
600;Jan 13, 2022 15:53:42.408024227 CET;192.168.1.102;192.168.1.104;50402;1883;74;50402 → 1883 [SYN] Seq=0 Win=42340 Len=0 MSS=1460 SACK_PERM=1 TSval=1797727304 TSecr=0 WS=512;
601;Jan 13, 2022 15:53:42.454936265 CET;192.168.1.104;192.168.1.102;1883;50402;58;1883 → 50402 [SYN, ACK] Seq=0 Ack=1 Win=8192 Len=0 MSS=1460;
602;Jan 13, 2022 15:53:42.454988747 CET;192.168.1.102;192.168.1.104;50402;1883;54;50402 → 1883 [ACK] Seq=1 Ack=1 Win=42340 Len=0;
603;Jan 13, 2022 15:53:42.455090737 CET;192.168.1.102;192.168.1.104;50402;1883;108;Connect Command;
604;Jan 13, 2022 15:53:42.704535795 CET;192.168.1.102;192.168.1.104;50402;1883;108;[TCP Retransmission] 50402 → 1883 [PSH, ACK] Seq=1 Ack=1 Win=42340 Len=54;
605;Jan 13, 2022 15:53:42.719540118 CET;192.168.1.104;192.168.1.102;1883;50402;54;1883 → 50402 [ACK] Seq=1 Ack=55 Win=8192 Len=0;
606;Jan 13, 2022 15:53:42.724785301 CET;192.168.1.104;192.168.1.102;1883;50402;58;Connect Ack;
607;Jan 13, 2022 15:53:42.724803216 CET;192.168.1.102;192.168.1.104;50402;1883;54;50402 → 1883 [ACK] Seq=55 Ack=5 Win=42336 Len=0;
608;Jan 13, 2022 15:53:42.724863121 CET;192.168.1.102;192.168.1.104;50402;1883;73;Publish Message [topic];message047
609;Jan 13, 2022 15:53:42.724877888 CET;192.168.1.102;192.168.1.104;50402;1883;56;Disconnect Req;
610;Jan 13, 2022 15:53:43.244712233 CET;192.168.1.102;192.168.1.104;50402;1883;75;[TCP Retransmission] 50402 → 1883 [FIN, PSH, ACK] Seq=55 Ack=5 Win=42336 Len=21;
611;Jan 13, 2022 15:53:43.276093146 CET;192.168.1.104;192.168.1.102;1883;50402;54;1883 → 50402 [FIN, ACK] Seq=5 Ack=77 Win=8192 Len=0;
612;Jan 13, 2022 15:53:43.276123102 CET;192.168.1.102;192.168.1.104;50402;1883;54;50402 → 1883 [ACK] Seq=77 Ack=6 Win=42335 Len=0;
613;Jan 13, 2022 15:53:47.738074545 CET;192.168.1.102;192.168.1.104;50404;1883;74;50404 → 1883 [SYN] Seq=0 Win=42340 Len=0 MSS=1460 SACK_PERM=1 TSval=1797732634 TSecr=0 WS=512;
614;Jan 13, 2022 15:53:47.757306646 CET;192.168.1.104;192.168.1.102;1883;50404;58;1883 → 50404 [SYN, ACK] Seq=0 Ack=1 Win=8192 Len=0 MSS=1460;
615;Jan 13, 2022 15:53:47.757337086 CET;192.168.1.102;192.168.1.104;50404;1883;54;50404 → 1883 [ACK] Seq=1 Ack=1 Win=42340 Len=0;
616;Jan 13, 2022 15:53:47.757388025 CET;192.168.1.102;192.168.1.104;50404;1883;108;Connect Command;
617;Jan 13, 2022 15:53:47.980538481 CET;192.168.1.102;192.168.1.104;50404;1883;108;[TCP Retransmission] 50404 → 1883 [PSH, ACK] Seq=1 Ack=1 Win=42340 Len=54;
618;Jan 13, 2022 15:53:48.000033274 CET;192.168.1.104;192.168.1.102;1883;50404;54;1883 → 50404 [ACK] Seq=1 Ack=55 Win=8192 Len=0;
619;Jan 13, 2022 15:53:48.004379736 CET;192.168.1.104;192.168.1.102;1883;50404;58;Connect Ack;
620;Jan 13, 2022 15:53:48.004400206 CET;192.168.1.102;192.168.1.104;50404;1883;54;50404 → 1883 [ACK] Seq=55 Ack=5 Win=42336 Len=0;
621;Jan 13, 2022 15:53:48.004457930 CET;192.168.1.102;192.168.1.104;50404;1883;73;Publish Message [topic];message048
622;Jan 13, 2022 15:53:48.004473316 CET;192.168.1.102;192.168.1.104;50404;1883;56;Disconnect Req;
623;Jan 13, 2022 15:53:48.460517687 CET;192.168.1.102;192.168.1.104;50404;1883;75;[TCP Retransmission] 50404 → 1883 [FIN, PSH, ACK] Seq=55 Ack=5 Win=42336 Len=21;
624;Jan 13, 2022 15:53:48.475682533 CET;192.168.1.104;192.168.1.102;1883;50404;54;1883 → 50404 [FIN, ACK] Seq=5 Ack=77 Win=8192 Len=0;
625;Jan 13, 2022 15:53:48.475711230 CET;192.168.1.102;192.168.1.104;50404;1883;54;50404 → 1883 [ACK] Seq=77 Ack=6 Win=42335 Len=0;
626;Jan 13, 2022 15:53:53.012442481 CET;192.168.1.102;192.168.1.104;50406;1883;74;50406 → 1883 [SYN] Seq=0 Win=42340 Len=0 MSS=1460 SACK_PERM=1 TSval=1797737908 TSecr=0 WS=512;
627;Jan 13, 2022 15:53:53.028489858 CET;192.168.1.104;192.168.1.102;1883;50406;58;1883 → 50406 [SYN, ACK] Seq=0 Ack=1 Win=8192 Len=0 MSS=1460;
628;Jan 13, 2022 15:53:53.028518187 CET;192.168.1.102;192.168.1.104;50406;1883;54;50406 → 1883 [ACK] Seq=1 Ack=1 Win=42340 Len=0;
629;Jan 13, 2022 15:53:53.028557736 CET;192.168.1.102;192.168.1.104;50406;1883;108;Connect Command;
630;Jan 13, 2022 15:53:53.248625918 CET;192.168.1.102;192.168.1.104;50406;1883;108;[TCP Retransmission] 50406 → 1883 [PSH, ACK] Seq=1 Ack=1 Win=42340 Len=54;
631;Jan 13, 2022 15:53:53.280584625 CET;192.168.1.104;192.168.1.102;1883;50406;54;1883 → 50406 [ACK] Seq=1 Ack=55 Win=8192 Len=0;
632;Jan 13, 2022 15:53:53.287771205 CET;192.168.1.104;192.168.1.102;1883;50406;58;Connect Ack;
633;Jan 13, 2022 15:53:53.287793944 CET;192.168.1.102;192.168.1.104;50406;1883;54;50406 → 1883 [ACK] Seq=55 Ack=5 Win=42336 Len=0;
634;Jan 13, 2022 15:53:53.287860862 CET;192.168.1.102;192.168.1.104;50406;1883;73;Publish Message [topic];message049
635;Jan 13, 2022 15:53:53.287881228 CET;192.168.1.102;192.168.1.104;50406;1883;56;Disconnect Req;
636;Jan 13, 2022 15:53:53.740520725 CET;192.168.1.102;192.168.1.104;50406;1883;75;[TCP Retransmission] 50406 → 1883 [FIN, PSH, ACK] Seq=55 Ack=5 Win=42336 Len=21;
637;Jan 13, 2022 15:53:53.754594721 CET;192.168.1.104;192.168.1.102;1883;50406;54;1883 → 50406 [FIN, ACK] Seq=5 Ack=77 Win=8192 Len=0;
638;Jan 13, 2022 15:53:53.754617692 CET;192.168.1.102;192.168.1.104;50406;1883;54;50406 → 1883 [ACK] Seq=77 Ack=6 Win=42335 Len=0;
1;Jan 13, 2022 15:49:30.252831353 CET;192.168.1.103;192.168.1.104;46670;1883;66;Subscribe Request (id=1) [topic];
2;Jan 13, 2022 15:49:45.760042094 CET;192.168.1.104;192.168.1.103;1883;46692;73;Publish Message [topic];message002
3;Jan 13, 2022 15:49:45.760062241 CET;192.168.1.103;192.168.1.104;46692;1883;54;46692 → 1883 [ACK] Seq=1 Ack=20 Win=42312 Len=0;
4;Jan 13, 2022 15:49:46.144049753 CET;192.168.1.104;192.168.1.103;1883;46692;73;Publish Message [topic];message001
5;Jan 13, 2022 15:49:46.144064162 CET;192.168.1.103;192.168.1.104;46692;1883;54;46692 → 1883 [ACK] Seq=1 Ack=39 Win=42293 Len=0;
6;Jan 13, 2022 15:49:51.088813806 CET;192.168.1.104;192.168.1.103;1883;46692;73;Publish Message [topic];message003
7;Jan 13, 2022 15:49:51.088833880 CET;192.168.1.103;192.168.1.104;46692;1883;54;46692 → 1883 [ACK] Seq=1 Ack=58 Win=42274 Len=0;
8;Jan 13, 2022 15:49:54.316580399 CET;192.168.1.103;192.168.1.104;46670;1883;66;[TCP Retransmission] 46670 → 1883 [FIN, PSH, ACK] Seq=1 Ack=1 Win=42336 Len=12;
9;Jan 13, 2022 15:49:56.393367260 CET;192.168.1.104;192.168.1.103;1883;46692;73;Publish Message [topic];message004
10;Jan 13, 2022 15:49:56.393388277 CET;192.168.1.103;192.168.1.104;46692;1883;54;46692 → 1883 [ACK] Seq=1 Ack=77 Win=42255 Len=0;
11;Jan 13, 2022 15:50:01.680840199 CET;192.168.1.104;192.168.1.103;1883;46692;73;Publish Message [topic];message005
12;Jan 13, 2022 15:50:01.680851853 CET;192.168.1.103;192.168.1.104;46692;1883;54;46692 → 1883 [ACK] Seq=1 Ack=96 Win=42236 Len=0;
13;Jan 13, 2022 15:50:06.935885438 CET;192.168.1.104;192.168.1.103;1883;46692;73;Publish Message [topic];message006
14;Jan 13, 2022 15:50:06.935901047 CET;192.168.1.103;192.168.1.104;46692;1883;54;46692 → 1883 [ACK] Seq=1 Ack=115 Win=42217 Len=0;
15;Jan 13, 2022 15:50:12.200872785 CET;192.168.1.104;192.168.1.103;1883;46692;73;Publish Message [topic];message007
16;Jan 13, 2022 15:50:12.200888678 CET;192.168.1.103;192.168.1.104;46692;1883;54;46692 → 1883 [ACK] Seq=1 Ack=134 Win=42217 Len=0;
17;Jan 13, 2022 15:50:17.471690873 CET;192.168.1.104;192.168.1.103;1883;46692;73;Publish Message [topic];message008
18;Jan 13, 2022 15:50:17.471708058 CET;192.168.1.103;192.168.1.104;46692;1883;54;46692 → 1883 [ACK] Seq=1 Ack=153 Win=42217 Len=0;
19;Jan 13, 2022 15:50:22.719781216 CET;192.168.1.104;192.168.1.103;1883;46692;73;Publish Message [topic];message009
20;Jan 13, 2022 15:50:22.719803458 CET;192.168.1.103;192.168.1.104;46692;1883;54;46692 → 1883 [ACK] Seq=1 Ack=172 Win=42217 Len=0;
21;Jan 13, 2022 15:50:24.722117429 CET;192.168.1.103;192.168.1.104;46692;1883;56;Ping Request;
22;Jan 13, 2022 15:50:24.768057594 CET;192.168.1.104;192.168.1.103;1883;46692;54;1883 → 46692 [ACK] Seq=172 Ack=3 Win=8192 Len=0;
23;Jan 13, 2022 15:50:24.770748981 CET;192.168.1.104;192.168.1.103;1883;46692;56;Ping Response;
24;Jan 13, 2022 15:50:24.770756098 CET;192.168.1.103;192.168.1.104;46692;1883;54;46692 → 1883 [ACK] Seq=3 Ack=174 Win=42217 Len=0;
25;Jan 13, 2022 15:50:28.016688241 CET;192.168.1.104;192.168.1.103;1883;46692;73;Publish Message [topic];message010
26;Jan 13, 2022 15:50:28.016715165 CET;192.168.1.103;192.168.1.104;46692;1883;54;46692 → 1883 [ACK] Seq=3 Ack=193 Win=42217 Len=0;
27;Jan 13, 2022 15:50:33.248830258 CET;192.168.1.104;192.168.1.103;1883;46692;73;Publish Message [topic];message011
28;Jan 13, 2022 15:50:33.248848981 CET;192.168.1.103;192.168.1.104;46692;1883;54;46692 → 1883 [ACK] Seq=3 Ack=212 Win=42217 Len=0;
29;Jan 13, 2022 15:50:38.585299094 CET;192.168.1.104;192.168.1.103;1883;46692;73;Publish Message [topic];message012
30;Jan 13, 2022 15:50:38.585314419 CET;192.168.1.103;192.168.1.104;46692;1883;54;46692 → 1883 [ACK] Seq=3 Ack=231 Win=42217 Len=0;
31;Jan 13, 2022 15:50:43.468873626 CET;192.168.1.103;192.168.1.104;46670;1883;66;[TCP Retransmission] 46670 → 1883 [FIN, PSH, ACK] Seq=1 Ack=1 Win=42336 Len=12;
32;Jan 13, 2022 15:50:43.811441418 CET;192.168.1.104;192.168.1.103;1883;46692;73;Publish Message [topic];message013
33;Jan 13, 2022 15:50:43.811456095 CET;192.168.1.103;192.168.1.104;46692;1883;54;46692 → 1883 [ACK] Seq=3 Ack=250 Win=42217 Len=0;
34;Jan 13, 2022 15:50:49.101744793 CET;192.168.1.104;192.168.1.103;1883;46692;73;Publish Message [topic];message014
35;Jan 13, 2022 15:50:49.101761247 CET;192.168.1.103;192.168.1.104;46692;1883;54;46692 → 1883 [ACK] Seq=3 Ack=269 Win=42217 Len=0;
36;Jan 13, 2022 15:50:54.367538548 CET;192.168.1.104;192.168.1.103;1883;46692;73;Publish Message [topic];message015
37;Jan 13, 2022 15:50:54.367556425 CET;192.168.1.103;192.168.1.104;46692;1883;54;46692 → 1883 [ACK] Seq=3 Ack=288 Win=42217 Len=0;
38;Jan 13, 2022 15:50:59.625720384 CET;192.168.1.104;192.168.1.103;1883;46692;73;Publish Message [topic];message016
39;Jan 13, 2022 15:50:59.625736654 CET;192.168.1.103;192.168.1.104;46692;1883;54;46692 → 1883 [ACK] Seq=3 Ack=307 Win=42217 Len=0;
40;Jan 13, 2022 15:51:04.952002542 CET;192.168.1.104;192.168.1.103;1883;46692;73;Publish Message [topic];message017
41;Jan 13, 2022 15:51:04.952015902 CET;192.168.1.103;192.168.1.104;46692;1883;54;46692 → 1883 [ACK] Seq=3 Ack=326 Win=42217 Len=0;
42;Jan 13, 2022 15:51:10.205613883 CET;192.168.1.104;192.168.1.103;1883;46692;73;Publish Message [topic];message018
43;Jan 13, 2022 15:51:10.205631405 CET;192.168.1.103;192.168.1.104;46692;1883;54;46692 → 1883 [ACK] Seq=3 Ack=345 Win=42217 Len=0;
44;Jan 13, 2022 15:51:15.488234882 CET;192.168.1.104;192.168.1.103;1883;46692;73;Publish Message [topic];message019
45;Jan 13, 2022 15:51:15.488246600 CET;192.168.1.103;192.168.1.104;46692;1883;54;46692 → 1883 [ACK] Seq=3 Ack=364 Win=42217 Len=0;
46;Jan 13, 2022 15:51:20.832261859 CET;192.168.1.104;192.168.1.103;1883;46692;73;Publish Message [topic];message020
47;Jan 13, 2022 15:51:20.832281204 CET;192.168.1.103;192.168.1.104;46692;1883;54;46692 → 1883 [ACK] Seq=3 Ack=383 Win=42217 Len=0;
48;Jan 13, 2022 15:51:24.836699077 CET;192.168.1.103;192.168.1.104;46692;1883;56;Ping Request;
49;Jan 13, 2022 15:51:24.843393111 CET;192.168.1.104;192.168.1.103;1883;46692;54;1883 → 46692 [ACK] Seq=383 Ack=5 Win=8192 Len=0;
50;Jan 13, 2022 15:51:24.845739064 CET;192.168.1.104;192.168.1.103;1883;46692;56;Ping Response;
51;Jan 13, 2022 15:51:24.845745392 CET;192.168.1.103;192.168.1.104;46692;1883;54;46692 → 1883 [ACK] Seq=5 Ack=385 Win=42217 Len=0;
52;Jan 13, 2022 15:51:26.065287512 CET;192.168.1.104;192.168.1.103;1883;46692;73;Publish Message [topic];message021
53;Jan 13, 2022 15:51:26.065300774 CET;192.168.1.103;192.168.1.104;46692;1883;54;46692 → 1883 [ACK] Seq=5 Ack=404 Win=42217 Len=0;
54;Jan 13, 2022 15:51:31.327753495 CET;192.168.1.104;192.168.1.103;1883;46692;73;Publish Message [topic];message022
55;Jan 13, 2022 15:51:31.327769161 CET;192.168.1.103;192.168.1.104;46692;1883;54;46692 → 1883 [ACK] Seq=5 Ack=423 Win=42217 Len=0;
56;Jan 13, 2022 15:51:36.590006095 CET;192.168.1.104;192.168.1.103;1883;46692;73;Publish Message [topic];message023
57;Jan 13, 2022 15:51:36.590028330 CET;192.168.1.103;192.168.1.104;46692;1883;54;46692 → 1883 [ACK] Seq=5 Ack=442 Win=42217 Len=0;
58;Jan 13, 2022 15:51:42.316857406 CET;192.168.1.104;192.168.1.103;1883;46692;73;Publish Message [topic];message024
59;Jan 13, 2022 15:51:42.316867608 CET;192.168.1.103;192.168.1.104;46692;1883;54;46692 → 1883 [ACK] Seq=5 Ack=461 Win=42217 Len=0;
60;Jan 13, 2022 15:51:47.194673442 CET;192.168.1.104;192.168.1.103;1883;46692;73;Publish Message [topic];message025
61;Jan 13, 2022 15:51:47.194688303 CET;192.168.1.103;192.168.1.104;46692;1883;54;46692 → 1883 [ACK] Seq=5 Ack=480 Win=42217 Len=0;
62;Jan 13, 2022 15:51:52.475916958 CET;192.168.1.104;192.168.1.103;1883;46692;73;Publish Message [topic];message026
63;Jan 13, 2022 15:51:52.475934992 CET;192.168.1.103;192.168.1.104;46692;1883;54;46692 → 1883 [ACK] Seq=5 Ack=499 Win=42217 Len=0;
64;Jan 13, 2022 15:51:57.757753007 CET;192.168.1.104;192.168.1.103;1883;46692;73;Publish Message [topic];message027
65;Jan 13, 2022 15:51:57.757767749 CET;192.168.1.103;192.168.1.104;46692;1883;54;46692 → 1883 [ACK] Seq=5 Ack=518 Win=42217 Len=0;
66;Jan 13, 2022 15:52:03.020739557 CET;192.168.1.104;192.168.1.103;1883;46692;73;Publish Message [topic];message028
67;Jan 13, 2022 15:52:03.020756354 CET;192.168.1.103;192.168.1.104;46692;1883;54;46692 → 1883 [ACK] Seq=5 Ack=537 Win=42217 Len=0;
68;Jan 13, 2022 15:52:08.302127331 CET;192.168.1.104;192.168.1.103;1883;46692;73;Publish Message [topic];message029
69;Jan 13, 2022 15:52:08.302151376 CET;192.168.1.103;192.168.1.104;46692;1883;54;46692 → 1883 [ACK] Seq=5 Ack=556 Win=42217 Len=0;
70;Jan 13, 2022 15:52:13.571596381 CET;192.168.1.104;192.168.1.103;1883;46692;73;Publish Message [topic];message030
71;Jan 13, 2022 15:52:13.571613006 CET;192.168.1.103;192.168.1.104;46692;1883;54;46692 → 1883 [ACK] Seq=5 Ack=575 Win=42217 Len=0;
72;Jan 13, 2022 15:52:18.829368460 CET;192.168.1.104;192.168.1.103;1883;46692;73;Publish Message [topic];message031
73;Jan 13, 2022 15:52:18.829381264 CET;192.168.1.103;192.168.1.104;46692;1883;54;46692 → 1883 [ACK] Seq=5 Ack=594 Win=42217 Len=0;
74;Jan 13, 2022 15:52:24.098369284 CET;192.168.1.104;192.168.1.103;1883;46692;73;Publish Message [topic];message032
75;Jan 13, 2022 15:52:24.098387032 CET;192.168.1.103;192.168.1.104;46692;1883;54;46692 → 1883 [ACK] Seq=5 Ack=613 Win=42217 Len=0;
76;Jan 13, 2022 15:52:24.098454650 CET;192.168.1.103;192.168.1.104;46692;1883;56;Ping Request;
77;Jan 13, 2022 15:52:24.320518145 CET;192.168.1.103;192.168.1.104;46692;1883;56;[TCP Retransmission] 46692 → 1883 [PSH, ACK] Seq=5 Ack=613 Win=42217 Len=2;
78;Jan 13, 2022 15:52:24.323388198 CET;192.168.1.104;192.168.1.103;1883;46692;54;1883 → 46692 [ACK] Seq=613 Ack=7 Win=8192 Len=0;
79;Jan 13, 2022 15:52:24.325343752 CET;192.168.1.104;192.168.1.103;1883;46692;56;Ping Response;
80;Jan 13, 2022 15:52:24.325349171 CET;192.168.1.103;192.168.1.104;46692;1883;54;46692 → 1883 [ACK] Seq=7 Ack=615 Win=42217 Len=0;
81;Jan 13, 2022 15:52:29.389144823 CET;192.168.1.104;192.168.1.103;1883;46692;73;Publish Message [topic];message033
82;Jan 13, 2022 15:52:29.389172559 CET;192.168.1.103;192.168.1.104;46692;1883;54;46692 → 1883 [ACK] Seq=7 Ack=634 Win=42217 Len=0;
83;Jan 13, 2022 15:52:34.620051674 CET;192.168.1.104;192.168.1.103;1883;46692;73;Publish Message [topic];message034
84;Jan 13, 2022 15:52:34.620064717 CET;192.168.1.103;192.168.1.104;46692;1883;54;46692 → 1883 [ACK] Seq=7 Ack=653 Win=42217 Len=0;
85;Jan 13, 2022 15:52:39.910676302 CET;192.168.1.104;192.168.1.103;1883;46692;73;Publish Message [topic];message035
86;Jan 13, 2022 15:52:39.910691378 CET;192.168.1.103;192.168.1.104;46692;1883;54;46692 → 1883 [ACK] Seq=7 Ack=672 Win=42217 Len=0;
87;Jan 13, 2022 15:52:45.191108878 CET;192.168.1.104;192.168.1.103;1883;46692;73;Publish Message [topic];message036
88;Jan 13, 2022 15:52:45.191120081 CET;192.168.1.103;192.168.1.104;46692;1883;54;46692 → 1883 [ACK] Seq=7 Ack=691 Win=42217 Len=0;
89;Jan 13, 2022 15:52:50.426520277 CET;192.168.1.104;192.168.1.103;1883;46692;73;Publish Message [topic];message037
90;Jan 13, 2022 15:52:50.426528006 CET;192.168.1.103;192.168.1.104;46692;1883;54;46692 → 1883 [ACK] Seq=7 Ack=710 Win=42217 Len=0;
91;Jan 13, 2022 15:52:55.711961016 CET;192.168.1.104;192.168.1.103;1883;46692;73;Publish Message [topic];message038
92;Jan 13, 2022 15:52:55.711980198 CET;192.168.1.103;192.168.1.104;46692;1883;54;46692 → 1883 [ACK] Seq=7 Ack=729 Win=42217 Len=0;
93;Jan 13, 2022 15:53:01.022260446 CET;192.168.1.104;192.168.1.103;1883;46692;73;Publish Message [topic];message039
94;Jan 13, 2022 15:53:01.022278287 CET;192.168.1.103;192.168.1.104;46692;1883;54;46692 → 1883 [ACK] Seq=7 Ack=748 Win=42217 Len=0;
95;Jan 13, 2022 15:53:06.267615247 CET;192.168.1.104;192.168.1.103;1883;46692;73;Publish Message [topic];message040
96;Jan 13, 2022 15:53:06.267632489 CET;192.168.1.103;192.168.1.104;46692;1883;54;46692 → 1883 [ACK] Seq=7 Ack=767 Win=42217 Len=0;
97;Jan 13, 2022 15:53:11.520296731 CET;192.168.1.104;192.168.1.103;1883;46692;73;Publish Message [topic];message041
98;Jan 13, 2022 15:53:11.520313903 CET;192.168.1.103;192.168.1.104;46692;1883;54;46692 → 1883 [ACK] Seq=7 Ack=786 Win=42217 Len=0;
99;Jan 13, 2022 15:53:16.797040723 CET;192.168.1.104;192.168.1.103;1883;46692;73;Publish Message [topic];message042
100;Jan 13, 2022 15:53:16.797055220 CET;192.168.1.103;192.168.1.104;46692;1883;54;46692 → 1883 [ACK] Seq=7 Ack=805 Win=42217 Len=0;
101;Jan 13, 2022 15:53:22.081290168 CET;192.168.1.104;192.168.1.103;1883;46692;73;Publish Message [topic];message043
102;Jan 13, 2022 15:53:22.081311948 CET;192.168.1.103;192.168.1.104;46692;1883;54;46692 → 1883 [ACK] Seq=7 Ack=824 Win=42217 Len=0;
103;Jan 13, 2022 15:53:24.083586700 CET;192.168.1.103;192.168.1.104;46692;1883;56;Ping Request;
104;Jan 13, 2022 15:53:24.087674557 CET;192.168.1.104;192.168.1.103;1883;46692;54;1883 → 46692 [ACK] Seq=824 Ack=9 Win=8192 Len=0;
105;Jan 13, 2022 15:53:24.089951892 CET;192.168.1.104;192.168.1.103;1883;46692;56;Ping Response;
106;Jan 13, 2022 15:53:24.089963218 CET;192.168.1.103;192.168.1.104;46692;1883;54;46692 → 1883 [ACK] Seq=9 Ack=826 Win=42217 Len=0;
107;Jan 13, 2022 15:53:27.338003289 CET;192.168.1.104;192.168.1.103;1883;46692;73;Publish Message [topic];message044
108;Jan 13, 2022 15:53:27.338018167 CET;192.168.1.103;192.168.1.104;46692;1883;54;46692 → 1883 [ACK] Seq=9 Ack=845 Win=42217 Len=0;
109;Jan 13, 2022 15:53:32.603344336 CET;192.168.1.104;192.168.1.103;1883;46692;73;Publish Message [topic];message045
110;Jan 13, 2022 15:53:32.603353215 CET;192.168.1.103;192.168.1.104;46692;1883;54;46692 → 1883 [ACK] Seq=9 Ack=864 Win=42217 Len=0;
111;Jan 13, 2022 15:53:37.866715191 CET;192.168.1.104;192.168.1.103;1883;46692;73;Publish Message [topic];message046
112;Jan 13, 2022 15:53:37.866732056 CET;192.168.1.103;192.168.1.104;46692;1883;54;46692 → 1883 [ACK] Seq=9 Ack=883 Win=42217 Len=0;
113;Jan 13, 2022 15:53:43.280285221 CET;192.168.1.104;192.168.1.103;1883;46692;73;Publish Message [topic];message047
114;Jan 13, 2022 15:53:43.280353658 CET;192.168.1.103;192.168.1.104;46692;1883;54;46692 → 1883 [ACK] Seq=9 Ack=902 Win=42217 Len=0;
115;Jan 13, 2022 15:53:48.477163612 CET;192.168.1.104;192.168.1.103;1883;46692;73;Publish Message [topic];message048
116;Jan 13, 2022 15:53:48.477188412 CET;192.168.1.103;192.168.1.104;46692;1883;54;46692 → 1883 [ACK] Seq=9 Ack=921 Win=42217 Len=0;
117;Jan 13, 2022 15:53:53.755064688 CET;192.168.1.104;192.168.1.103;1883;46692;73;Publish Message [topic];message049
118;Jan 13, 2022 15:53:53.755074099 CET;192.168.1.103;192.168.1.104;46692;1883;54;46692 → 1883 [ACK] Seq=9 Ack=940 Win=42217 Len=0;
