1;Jan 13, 2022 12:27:28.641627482 CET;192.168.1.102;192.168.1.104;49268;1883;74;49268 → 1883 [SYN] Seq=0 Win=42340 Len=0 MSS=1460 SACK_PERM=1 TSval=1794773872 TSecr=0 WS=512;
2;Jan 13, 2022 12:27:29.661338806 CET;192.168.1.102;192.168.1.104;49268;1883;74;[TCP Retransmission] 49268 → 1883 [SYN] Seq=0 Win=42340 Len=0 MSS=1460 SACK_PERM=1 TSval=1794774892 TSecr=0 WS=512;
3;Jan 13, 2022 12:27:30.204921934 CET;192.168.1.104;192.168.1.102;1883;49268;58;1883 → 49268 [SYN, ACK] Seq=0 Ack=1 Win=8192 Len=0 MSS=1460;
4;Jan 13, 2022 12:27:30.205005631 CET;192.168.1.102;192.168.1.104;49268;1883;54;49268 → 1883 [ACK] Seq=1 Ack=1 Win=42340 Len=0;
5;Jan 13, 2022 12:27:30.205137085 CET;192.168.1.102;192.168.1.104;49268;1883;108;Connect Command;
6;Jan 13, 2022 12:27:33.213867950 CET;192.168.1.102;192.168.1.104;49268;1883;108;[TCP Retransmission] 49268 → 1883 [PSH, ACK] Seq=1 Ack=1 Win=42340 Len=54;
7;Jan 13, 2022 12:27:33.468899597 CET;192.168.1.104;192.168.1.102;1883;49268;54;1883 → 49268 [ACK] Seq=1 Ack=55 Win=8192 Len=0;
8;Jan 13, 2022 12:27:33.472178627 CET;192.168.1.104;192.168.1.102;1883;49268;58;Connect Ack;
9;Jan 13, 2022 12:27:33.472196953 CET;192.168.1.102;192.168.1.104;49268;1883;54;49268 → 1883 [ACK] Seq=55 Ack=5 Win=42336 Len=0;
10;Jan 13, 2022 12:27:33.472244736 CET;192.168.1.102;192.168.1.104;49268;1883;73;Publish Message [topic];message001
11;Jan 13, 2022 12:27:33.472259454 CET;192.168.1.102;192.168.1.104;49268;1883;56;Disconnect Req;
12;Jan 13, 2022 12:27:38.480635519 CET;192.168.1.102;192.168.1.104;49270;1883;74;49270 → 1883 [SYN] Seq=0 Win=42340 Len=0 MSS=1460 SACK_PERM=1 TSval=1794783711 TSecr=0 WS=512;
13;Jan 13, 2022 12:27:38.751148270 CET;192.168.1.104;192.168.1.102;1883;49270;58;1883 → 49270 [SYN, ACK] Seq=0 Ack=1 Win=8192 Len=0 MSS=1460;
14;Jan 13, 2022 12:27:38.751180535 CET;192.168.1.102;192.168.1.104;49270;1883;54;49270 → 1883 [ACK] Seq=1 Ack=1 Win=42340 Len=0;
15;Jan 13, 2022 12:27:38.751232047 CET;192.168.1.102;192.168.1.104;49270;1883;108;Connect Command;
16;Jan 13, 2022 12:27:39.582012335 CET;192.168.1.102;192.168.1.104;49270;1883;108;[TCP Retransmission] 49270 → 1883 [PSH, ACK] Seq=1 Ack=1 Win=42340 Len=54;
17;Jan 13, 2022 12:27:39.613352011 CET;192.168.1.102;192.168.1.104;49268;1883;75;[TCP Retransmission] 49268 → 1883 [FIN, PSH, ACK] Seq=55 Ack=5 Win=42336 Len=21;
18;Jan 13, 2022 12:27:39.848519641 CET;192.168.1.104;192.168.1.102;1883;49270;54;1883 → 49270 [ACK] Seq=1 Ack=55 Win=8192 Len=0;
19;Jan 13, 2022 12:27:39.853615559 CET;192.168.1.104;192.168.1.102;1883;49270;58;Connect Ack;
20;Jan 13, 2022 12:27:39.853632901 CET;192.168.1.102;192.168.1.104;49270;1883;54;49270 → 1883 [ACK] Seq=55 Ack=5 Win=42336 Len=0;
21;Jan 13, 2022 12:27:39.853681654 CET;192.168.1.102;192.168.1.104;49270;1883;73;Publish Message [topic];message002
22;Jan 13, 2022 12:27:39.853696419 CET;192.168.1.102;192.168.1.104;49270;1883;56;Disconnect Req;
23;Jan 13, 2022 12:27:39.868037842 CET;192.168.1.104;192.168.1.102;1883;49268;54;1883 → 49268 [FIN, ACK] Seq=5 Ack=77 Win=8192 Len=0;
24;Jan 13, 2022 12:27:39.868061633 CET;192.168.1.102;192.168.1.104;49268;1883;54;49268 → 1883 [ACK] Seq=77 Ack=6 Win=42335 Len=0;
25;Jan 13, 2022 12:27:41.501414439 CET;192.168.1.102;192.168.1.104;49270;1883;75;[TCP Retransmission] 49270 → 1883 [FIN, PSH, ACK] Seq=55 Ack=5 Win=42336 Len=21;
26;Jan 13, 2022 12:27:41.755708760 CET;192.168.1.104;192.168.1.102;1883;49270;54;1883 → 49270 [FIN, ACK] Seq=5 Ack=77 Win=8192 Len=0;
27;Jan 13, 2022 12:27:41.755779238 CET;192.168.1.102;192.168.1.104;49270;1883;54;49270 → 1883 [ACK] Seq=77 Ack=6 Win=42335 Len=0;
28;Jan 13, 2022 12:27:44.862258613 CET;192.168.1.102;192.168.1.104;49272;1883;74;49272 → 1883 [SYN] Seq=0 Win=42340 Len=0 MSS=1460 SACK_PERM=1 TSval=1794790093 TSecr=0 WS=512;
29;Jan 13, 2022 12:27:45.116150878 CET;192.168.1.104;192.168.1.102;1883;49272;58;1883 → 49272 [SYN, ACK] Seq=0 Ack=1 Win=8192 Len=0 MSS=1460;
30;Jan 13, 2022 12:27:45.116241211 CET;192.168.1.102;192.168.1.104;49272;1883;54;49272 → 1883 [ACK] Seq=1 Ack=1 Win=42340 Len=0;
31;Jan 13, 2022 12:27:45.116390479 CET;192.168.1.102;192.168.1.104;49272;1883;108;Connect Command;
32;Jan 13, 2022 12:27:45.885714445 CET;192.168.1.102;192.168.1.104;49272;1883;108;[TCP Retransmission] 49272 → 1883 [PSH, ACK] Seq=1 Ack=1 Win=42340 Len=54;
33;Jan 13, 2022 12:27:46.161209034 CET;192.168.1.104;192.168.1.102;1883;49272;54;1883 → 49272 [ACK] Seq=1 Ack=55 Win=8192 Len=0;
34;Jan 13, 2022 12:27:46.165658375 CET;192.168.1.104;192.168.1.102;1883;49272;58;Connect Ack;
35;Jan 13, 2022 12:27:46.165674663 CET;192.168.1.102;192.168.1.104;49272;1883;54;49272 → 1883 [ACK] Seq=55 Ack=5 Win=42336 Len=0;
36;Jan 13, 2022 12:27:46.165725137 CET;192.168.1.102;192.168.1.104;49272;1883;73;Publish Message [topic];message003
37;Jan 13, 2022 12:27:46.165739875 CET;192.168.1.102;192.168.1.104;49272;1883;56;Disconnect Req;
38;Jan 13, 2022 12:27:47.709417745 CET;192.168.1.102;192.168.1.104;49272;1883;75;[TCP Retransmission] 49272 → 1883 [FIN, PSH, ACK] Seq=55 Ack=5 Win=42336 Len=21;
39;Jan 13, 2022 12:27:47.974761503 CET;192.168.1.104;192.168.1.102;1883;49272;54;1883 → 49272 [FIN, ACK] Seq=5 Ack=77 Win=8192 Len=0;
40;Jan 13, 2022 12:27:47.974784776 CET;192.168.1.102;192.168.1.104;49272;1883;54;49272 → 1883 [ACK] Seq=77 Ack=6 Win=42335 Len=0;
41;Jan 13, 2022 12:27:51.174536695 CET;192.168.1.102;192.168.1.104;49274;1883;74;49274 → 1883 [SYN] Seq=0 Win=42340 Len=0 MSS=1460 SACK_PERM=1 TSval=1794796405 TSecr=0 WS=512;
42;Jan 13, 2022 12:27:51.428592835 CET;192.168.1.104;192.168.1.102;1883;49274;58;1883 → 49274 [SYN, ACK] Seq=0 Ack=1 Win=8192 Len=0 MSS=1460;
43;Jan 13, 2022 12:27:51.428682784 CET;192.168.1.102;192.168.1.104;49274;1883;54;49274 → 1883 [ACK] Seq=1 Ack=1 Win=42340 Len=0;
44;Jan 13, 2022 12:27:51.428908259 CET;192.168.1.102;192.168.1.104;49274;1883;108;Connect Command;
45;Jan 13, 2022 12:27:52.221347303 CET;192.168.1.102;192.168.1.104;49274;1883;108;[TCP Retransmission] 49274 → 1883 [PSH, ACK] Seq=1 Ack=1 Win=42340 Len=54;
46;Jan 13, 2022 12:27:52.481881462 CET;192.168.1.104;192.168.1.102;1883;49274;54;1883 → 49274 [ACK] Seq=1 Ack=55 Win=8192 Len=0;
47;Jan 13, 2022 12:27:52.490010967 CET;192.168.1.104;192.168.1.102;1883;49274;58;Connect Ack;
48;Jan 13, 2022 12:27:52.490029288 CET;192.168.1.102;192.168.1.104;49274;1883;54;49274 → 1883 [ACK] Seq=55 Ack=5 Win=42336 Len=0;
49;Jan 13, 2022 12:27:52.490084450 CET;192.168.1.102;192.168.1.104;49274;1883;73;Publish Message [topic];message004
50;Jan 13, 2022 12:27:52.490099161 CET;192.168.1.102;192.168.1.104;49274;1883;56;Disconnect Req;
51;Jan 13, 2022 12:27:54.045372255 CET;192.168.1.102;192.168.1.104;49274;1883;75;[TCP Retransmission] 49274 → 1883 [FIN, PSH, ACK] Seq=55 Ack=5 Win=42336 Len=21;
52;Jan 13, 2022 12:27:54.304973242 CET;192.168.1.104;192.168.1.102;1883;49274;54;1883 → 49274 [FIN, ACK] Seq=5 Ack=77 Win=8192 Len=0;
53;Jan 13, 2022 12:27:54.304998320 CET;192.168.1.102;192.168.1.104;49274;1883;54;49274 → 1883 [ACK] Seq=77 Ack=6 Win=42335 Len=0;
54;Jan 13, 2022 12:27:57.496927806 CET;192.168.1.102;192.168.1.104;49276;1883;74;49276 → 1883 [SYN] Seq=0 Win=42340 Len=0 MSS=1460 SACK_PERM=1 TSval=1794802728 TSecr=0 WS=512;
55;Jan 13, 2022 12:27:57.754093525 CET;192.168.1.104;192.168.1.102;1883;49276;58;1883 → 49276 [SYN, ACK] Seq=0 Ack=1 Win=8192 Len=0 MSS=1460;
56;Jan 13, 2022 12:27:57.754121435 CET;192.168.1.102;192.168.1.104;49276;1883;54;49276 → 1883 [ACK] Seq=1 Ack=1 Win=42340 Len=0;
57;Jan 13, 2022 12:27:57.754160738 CET;192.168.1.102;192.168.1.104;49276;1883;108;Connect Command;
58;Jan 13, 2022 12:27:58.557371892 CET;192.168.1.102;192.168.1.104;49276;1883;108;[TCP Retransmission] 49276 → 1883 [PSH, ACK] Seq=1 Ack=1 Win=42340 Len=54;
59;Jan 13, 2022 12:27:58.816169745 CET;192.168.1.104;192.168.1.102;1883;49276;54;1883 → 49276 [ACK] Seq=1 Ack=55 Win=8192 Len=0;
60;Jan 13, 2022 12:27:58.821933038 CET;192.168.1.104;192.168.1.102;1883;49276;58;Connect Ack;
61;Jan 13, 2022 12:27:58.821955810 CET;192.168.1.102;192.168.1.104;49276;1883;54;49276 → 1883 [ACK] Seq=55 Ack=5 Win=42336 Len=0;
62;Jan 13, 2022 12:27:58.822046342 CET;192.168.1.102;192.168.1.104;49276;1883;73;Publish Message [topic];message005
63;Jan 13, 2022 12:27:58.822068841 CET;192.168.1.102;192.168.1.104;49276;1883;56;Disconnect Req;
64;Jan 13, 2022 12:28:00.381397056 CET;192.168.1.102;192.168.1.104;49276;1883;75;[TCP Retransmission] 49276 → 1883 [FIN, PSH, ACK] Seq=55 Ack=5 Win=42336 Len=21;
65;Jan 13, 2022 12:28:00.635522728 CET;192.168.1.104;192.168.1.102;1883;49276;54;1883 → 49276 [FIN, ACK] Seq=5 Ack=77 Win=8192 Len=0;
66;Jan 13, 2022 12:28:00.635554642 CET;192.168.1.102;192.168.1.104;49276;1883;54;49276 → 1883 [ACK] Seq=77 Ack=6 Win=42335 Len=0;
67;Jan 13, 2022 12:28:03.830654844 CET;192.168.1.102;192.168.1.104;49278;1883;74;49278 → 1883 [SYN] Seq=0 Win=42340 Len=0 MSS=1460 SACK_PERM=1 TSval=1794809061 TSecr=0 WS=512;
68;Jan 13, 2022 12:28:04.084586485 CET;192.168.1.104;192.168.1.102;1883;49278;58;1883 → 49278 [SYN, ACK] Seq=0 Ack=1 Win=8192 Len=0 MSS=1460;
69;Jan 13, 2022 12:28:04.084633351 CET;192.168.1.102;192.168.1.104;49278;1883;54;49278 → 1883 [ACK] Seq=1 Ack=1 Win=42340 Len=0;
70;Jan 13, 2022 12:28:04.084702270 CET;192.168.1.102;192.168.1.104;49278;1883;108;Connect Command;
71;Jan 13, 2022 12:28:04.861694861 CET;192.168.1.102;192.168.1.104;49278;1883;108;[TCP Retransmission] 49278 → 1883 [PSH, ACK] Seq=1 Ack=1 Win=42340 Len=54;
72;Jan 13, 2022 12:28:05.115616169 CET;192.168.1.104;192.168.1.102;1883;49278;54;1883 → 49278 [ACK] Seq=1 Ack=55 Win=8192 Len=0;
73;Jan 13, 2022 12:28:05.123749432 CET;192.168.1.104;192.168.1.102;1883;49278;58;Connect Ack;
74;Jan 13, 2022 12:28:05.123768585 CET;192.168.1.102;192.168.1.104;49278;1883;54;49278 → 1883 [ACK] Seq=55 Ack=5 Win=42336 Len=0;
75;Jan 13, 2022 12:28:05.123827353 CET;192.168.1.102;192.168.1.104;49278;1883;73;Publish Message [topic];message006
76;Jan 13, 2022 12:28:05.123846143 CET;192.168.1.102;192.168.1.104;49278;1883;56;Disconnect Req;
77;Jan 13, 2022 12:28:06.653374358 CET;192.168.1.102;192.168.1.104;49278;1883;75;[TCP Retransmission] 49278 → 1883 [FIN, PSH, ACK] Seq=55 Ack=5 Win=42336 Len=21;
78;Jan 13, 2022 12:28:06.910466025 CET;192.168.1.104;192.168.1.102;1883;49278;54;1883 → 49278 [FIN, ACK] Seq=5 Ack=77 Win=8192 Len=0;
79;Jan 13, 2022 12:28:06.910489344 CET;192.168.1.102;192.168.1.104;49278;1883;54;49278 → 1883 [ACK] Seq=77 Ack=6 Win=42335 Len=0;
80;Jan 13, 2022 12:28:10.128620868 CET;192.168.1.102;192.168.1.104;49280;1883;74;49280 → 1883 [SYN] Seq=0 Win=42340 Len=0 MSS=1460 SACK_PERM=1 TSval=1794815359 TSecr=0 WS=512;
81;Jan 13, 2022 12:28:10.383970110 CET;192.168.1.104;192.168.1.102;1883;49280;58;1883 → 49280 [SYN, ACK] Seq=0 Ack=1 Win=8192 Len=0 MSS=1460;
82;Jan 13, 2022 12:28:10.384006303 CET;192.168.1.102;192.168.1.104;49280;1883;54;49280 → 1883 [ACK] Seq=1 Ack=1 Win=42340 Len=0;
83;Jan 13, 2022 12:28:10.384059981 CET;192.168.1.102;192.168.1.104;49280;1883;108;Connect Command;
84;Jan 13, 2022 12:28:11.165732542 CET;192.168.1.102;192.168.1.104;49280;1883;108;[TCP Retransmission] 49280 → 1883 [PSH, ACK] Seq=1 Ack=1 Win=42340 Len=54;
85;Jan 13, 2022 12:28:11.420656967 CET;192.168.1.104;192.168.1.102;1883;49280;54;1883 → 49280 [ACK] Seq=1 Ack=55 Win=8192 Len=0;
86;Jan 13, 2022 12:28:11.429499257 CET;192.168.1.104;192.168.1.102;1883;49280;58;Connect Ack;
87;Jan 13, 2022 12:28:11.429520224 CET;192.168.1.102;192.168.1.104;49280;1883;54;49280 → 1883 [ACK] Seq=55 Ack=5 Win=42336 Len=0;
88;Jan 13, 2022 12:28:11.429590756 CET;192.168.1.102;192.168.1.104;49280;1883;73;Publish Message [topic];message007
89;Jan 13, 2022 12:28:11.429609776 CET;192.168.1.102;192.168.1.104;49280;1883;56;Disconnect Req;
90;Jan 13, 2022 12:28:12.989589812 CET;192.168.1.102;192.168.1.104;49280;1883;75;[TCP Retransmission] 49280 → 1883 [FIN, PSH, ACK] Seq=55 Ack=5 Win=42336 Len=21;
91;Jan 13, 2022 12:28:13.243450981 CET;192.168.1.104;192.168.1.102;1883;49280;54;1883 → 49280 [FIN, ACK] Seq=5 Ack=77 Win=8192 Len=0;
92;Jan 13, 2022 12:28:13.243476354 CET;192.168.1.102;192.168.1.104;49280;1883;54;49280 → 1883 [ACK] Seq=77 Ack=6 Win=42335 Len=0;
93;Jan 13, 2022 12:28:16.434693056 CET;192.168.1.102;192.168.1.104;49282;1883;74;49282 → 1883 [SYN] Seq=0 Win=42340 Len=0 MSS=1460 SACK_PERM=1 TSval=1794821666 TSecr=0 WS=512;
94;Jan 13, 2022 12:28:16.695525392 CET;192.168.1.104;192.168.1.102;1883;49282;58;1883 → 49282 [SYN, ACK] Seq=0 Ack=1 Win=8192 Len=0 MSS=1460;
95;Jan 13, 2022 12:28:16.695566151 CET;192.168.1.102;192.168.1.104;49282;1883;54;49282 → 1883 [ACK] Seq=1 Ack=1 Win=42340 Len=0;
96;Jan 13, 2022 12:28:16.695625091 CET;192.168.1.102;192.168.1.104;49282;1883;108;Connect Command;
97;Jan 13, 2022 12:28:16.950839834 CET;192.168.1.104;192.168.1.102;1883;49282;54;1883 → 49282 [ACK] Seq=1 Ack=55 Win=8192 Len=0;
98;Jan 13, 2022 12:28:16.953733736 CET;192.168.1.104;192.168.1.102;1883;49282;58;Connect Ack;
99;Jan 13, 2022 12:28:16.953784641 CET;192.168.1.102;192.168.1.104;49282;1883;54;49282 → 1883 [ACK] Seq=55 Ack=5 Win=42336 Len=0;
100;Jan 13, 2022 12:28:16.953983837 CET;192.168.1.102;192.168.1.104;49282;1883;73;Publish Message [topic];message008
101;Jan 13, 2022 12:28:16.954040404 CET;192.168.1.102;192.168.1.104;49282;1883;56;Disconnect Req;
102;Jan 13, 2022 12:28:17.758294949 CET;192.168.1.102;192.168.1.104;49282;1883;75;[TCP Retransmission] 49282 → 1883 [FIN, PSH, ACK] Seq=55 Ack=5 Win=42336 Len=21;
103;Jan 13, 2022 12:28:18.018288713 CET;192.168.1.104;192.168.1.102;1883;49282;54;1883 → 49282 [FIN, ACK] Seq=5 Ack=77 Win=8192 Len=0;
104;Jan 13, 2022 12:28:18.018357361 CET;192.168.1.102;192.168.1.104;49282;1883;54;49282 → 1883 [ACK] Seq=77 Ack=6 Win=42335 Len=0;
105;Jan 13, 2022 12:28:21.963338291 CET;192.168.1.102;192.168.1.104;49284;1883;74;49284 → 1883 [SYN] Seq=0 Win=42340 Len=0 MSS=1460 SACK_PERM=1 TSval=1794827194 TSecr=0 WS=512;
106;Jan 13, 2022 12:28:22.230734078 CET;192.168.1.104;192.168.1.102;1883;49284;58;1883 → 49284 [SYN, ACK] Seq=0 Ack=1 Win=8192 Len=0 MSS=1460;
107;Jan 13, 2022 12:28:22.230766770 CET;192.168.1.102;192.168.1.104;49284;1883;54;49284 → 1883 [ACK] Seq=1 Ack=1 Win=42340 Len=0;
108;Jan 13, 2022 12:28:22.230813343 CET;192.168.1.102;192.168.1.104;49284;1883;108;Connect Command;
109;Jan 13, 2022 12:28:23.037361898 CET;192.168.1.102;192.168.1.104;49284;1883;108;[TCP Retransmission] 49284 → 1883 [PSH, ACK] Seq=1 Ack=1 Win=42340 Len=54;
110;Jan 13, 2022 12:28:23.308627620 CET;192.168.1.104;192.168.1.102;1883;49284;54;1883 → 49284 [ACK] Seq=1 Ack=55 Win=8192 Len=0;
111;Jan 13, 2022 12:28:23.358821387 CET;192.168.1.104;192.168.1.102;1883;49284;58;Connect Ack;
112;Jan 13, 2022 12:28:23.358873868 CET;192.168.1.102;192.168.1.104;49284;1883;54;49284 → 1883 [ACK] Seq=55 Ack=5 Win=42336 Len=0;
113;Jan 13, 2022 12:28:23.359064849 CET;192.168.1.102;192.168.1.104;49284;1883;73;Publish Message [topic];message009
114;Jan 13, 2022 12:28:23.359195289 CET;192.168.1.102;192.168.1.104;49284;1883;56;Disconnect Req;
115;Jan 13, 2022 12:28:24.989426760 CET;192.168.1.102;192.168.1.104;49284;1883;75;[TCP Retransmission] 49284 → 1883 [FIN, PSH, ACK] Seq=55 Ack=5 Win=42336 Len=21;
116;Jan 13, 2022 12:28:25.248160694 CET;192.168.1.104;192.168.1.102;1883;49284;54;1883 → 49284 [FIN, ACK] Seq=5 Ack=77 Win=8192 Len=0;
117;Jan 13, 2022 12:28:25.248227440 CET;192.168.1.102;192.168.1.104;49284;1883;54;49284 → 1883 [ACK] Seq=77 Ack=6 Win=42335 Len=0;
118;Jan 13, 2022 12:28:28.369406117 CET;192.168.1.102;192.168.1.104;49286;1883;74;49286 → 1883 [SYN] Seq=0 Win=42340 Len=0 MSS=1460 SACK_PERM=1 TSval=1794833600 TSecr=0 WS=512;
119;Jan 13, 2022 12:28:28.623521846 CET;192.168.1.104;192.168.1.102;1883;49286;58;1883 → 49286 [SYN, ACK] Seq=0 Ack=1 Win=8192 Len=0 MSS=1460;
120;Jan 13, 2022 12:28:28.623559549 CET;192.168.1.102;192.168.1.104;49286;1883;54;49286 → 1883 [ACK] Seq=1 Ack=1 Win=42340 Len=0;
121;Jan 13, 2022 12:28:28.623621630 CET;192.168.1.102;192.168.1.104;49286;1883;108;Connect Command;
122;Jan 13, 2022 12:28:29.405348326 CET;192.168.1.102;192.168.1.104;49286;1883;108;[TCP Retransmission] 49286 → 1883 [PSH, ACK] Seq=1 Ack=1 Win=42340 Len=54;
123;Jan 13, 2022 12:28:29.660361101 CET;192.168.1.104;192.168.1.102;1883;49286;54;1883 → 49286 [ACK] Seq=1 Ack=55 Win=8192 Len=0;
124;Jan 13, 2022 12:28:29.664792988 CET;192.168.1.104;192.168.1.102;1883;49286;58;Connect Ack;
125;Jan 13, 2022 12:28:29.664896841 CET;192.168.1.102;192.168.1.104;49286;1883;54;49286 → 1883 [ACK] Seq=55 Ack=5 Win=42336 Len=0;
126;Jan 13, 2022 12:28:29.665093358 CET;192.168.1.102;192.168.1.104;49286;1883;73;Publish Message [topic];message010
127;Jan 13, 2022 12:28:29.665150525 CET;192.168.1.102;192.168.1.104;49286;1883;56;Disconnect Req;
128;Jan 13, 2022 12:28:31.197363435 CET;192.168.1.102;192.168.1.104;49286;1883;75;[TCP Retransmission] 49286 → 1883 [FIN, PSH, ACK] Seq=55 Ack=5 Win=42336 Len=21;
129;Jan 13, 2022 12:28:31.468717803 CET;192.168.1.104;192.168.1.102;1883;49286;54;1883 → 49286 [FIN, ACK] Seq=5 Ack=77 Win=8192 Len=0;
130;Jan 13, 2022 12:28:31.468785191 CET;192.168.1.102;192.168.1.104;49286;1883;54;49286 → 1883 [ACK] Seq=77 Ack=6 Win=42335 Len=0;
131;Jan 13, 2022 12:28:34.685317626 CET;192.168.1.102;192.168.1.104;49288;1883;74;49288 → 1883 [SYN] Seq=0 Win=42340 Len=0 MSS=1460 SACK_PERM=1 TSval=1794839916 TSecr=0 WS=512;
132;Jan 13, 2022 12:28:34.938987883 CET;192.168.1.104;192.168.1.102;1883;49288;58;1883 → 49288 [SYN, ACK] Seq=0 Ack=1 Win=8192 Len=0 MSS=1460;
133;Jan 13, 2022 12:28:34.939014790 CET;192.168.1.102;192.168.1.104;49288;1883;54;49288 → 1883 [ACK] Seq=1 Ack=1 Win=42340 Len=0;
134;Jan 13, 2022 12:28:34.939057266 CET;192.168.1.102;192.168.1.104;49288;1883;108;Connect Command;
135;Jan 13, 2022 12:28:35.709347678 CET;192.168.1.102;192.168.1.104;49288;1883;108;[TCP Retransmission] 49288 → 1883 [PSH, ACK] Seq=1 Ack=1 Win=42340 Len=54;
136;Jan 13, 2022 12:28:35.963149146 CET;192.168.1.104;192.168.1.102;1883;49288;54;1883 → 49288 [ACK] Seq=1 Ack=55 Win=8192 Len=0;
137;Jan 13, 2022 12:28:35.965285031 CET;192.168.1.104;192.168.1.102;1883;49288;58;Connect Ack;
138;Jan 13, 2022 12:28:35.965308057 CET;192.168.1.102;192.168.1.104;49288;1883;54;49288 → 1883 [ACK] Seq=55 Ack=5 Win=42336 Len=0;
139;Jan 13, 2022 12:28:35.965382012 CET;192.168.1.102;192.168.1.104;49288;1883;73;Publish Message [topic];message011
140;Jan 13, 2022 12:28:35.965402885 CET;192.168.1.102;192.168.1.104;49288;1883;56;Disconnect Req;
141;Jan 13, 2022 12:28:37.501342799 CET;192.168.1.102;192.168.1.104;49288;1883;75;[TCP Retransmission] 49288 → 1883 [FIN, PSH, ACK] Seq=55 Ack=5 Win=42336 Len=21;
142;Jan 13, 2022 12:28:37.772058049 CET;192.168.1.104;192.168.1.102;1883;49288;54;1883 → 49288 [FIN, ACK] Seq=5 Ack=77 Win=8192 Len=0;
143;Jan 13, 2022 12:28:37.772125714 CET;192.168.1.102;192.168.1.104;49288;1883;54;49288 → 1883 [ACK] Seq=77 Ack=6 Win=42335 Len=0;
144;Jan 13, 2022 12:28:40.970070277 CET;192.168.1.102;192.168.1.104;49290;1883;74;49290 → 1883 [SYN] Seq=0 Win=42340 Len=0 MSS=1460 SACK_PERM=1 TSval=1794846201 TSecr=0 WS=512;
145;Jan 13, 2022 12:28:41.224477615 CET;192.168.1.104;192.168.1.102;1883;49290;58;1883 → 49290 [SYN, ACK] Seq=0 Ack=1 Win=8192 Len=0 MSS=1460;
146;Jan 13, 2022 12:28:41.224567663 CET;192.168.1.102;192.168.1.104;49290;1883;54;49290 → 1883 [ACK] Seq=1 Ack=1 Win=42340 Len=0;
147;Jan 13, 2022 12:28:41.224722496 CET;192.168.1.102;192.168.1.104;49290;1883;108;Connect Command;
148;Jan 13, 2022 12:28:42.013782443 CET;192.168.1.102;192.168.1.104;49290;1883;108;[TCP Retransmission] 49290 → 1883 [PSH, ACK] Seq=1 Ack=1 Win=42340 Len=54;
149;Jan 13, 2022 12:28:42.283280239 CET;192.168.1.104;192.168.1.102;1883;49290;54;1883 → 49290 [ACK] Seq=1 Ack=55 Win=8192 Len=0;
150;Jan 13, 2022 12:28:42.289125665 CET;192.168.1.104;192.168.1.102;1883;49290;58;Connect Ack;
151;Jan 13, 2022 12:28:42.289176457 CET;192.168.1.102;192.168.1.104;49290;1883;54;49290 → 1883 [ACK] Seq=55 Ack=5 Win=42336 Len=0;
152;Jan 13, 2022 12:28:42.289362525 CET;192.168.1.102;192.168.1.104;49290;1883;73;Publish Message [topic];message012
153;Jan 13, 2022 12:28:42.289421519 CET;192.168.1.102;192.168.1.104;49290;1883;56;Disconnect Req;
154;Jan 13, 2022 12:28:43.837701883 CET;192.168.1.102;192.168.1.104;49290;1883;75;[TCP Retransmission] 49290 → 1883 [FIN, PSH, ACK] Seq=55 Ack=5 Win=42336 Len=21;
155;Jan 13, 2022 12:28:44.110539993 CET;192.168.1.104;192.168.1.102;1883;49290;54;1883 → 49290 [FIN, ACK] Seq=5 Ack=77 Win=8192 Len=0;
156;Jan 13, 2022 12:28:44.110608203 CET;192.168.1.102;192.168.1.104;49290;1883;54;49290 → 1883 [ACK] Seq=77 Ack=6 Win=42335 Len=0;
157;Jan 13, 2022 12:28:47.299453171 CET;192.168.1.102;192.168.1.104;49292;1883;74;49292 → 1883 [SYN] Seq=0 Win=42340 Len=0 MSS=1460 SACK_PERM=1 TSval=1794852530 TSecr=0 WS=512;
158;Jan 13, 2022 12:28:47.554142397 CET;192.168.1.104;192.168.1.102;1883;49292;58;1883 → 49292 [SYN, ACK] Seq=0 Ack=1 Win=8192 Len=0 MSS=1460;
159;Jan 13, 2022 12:28:47.554169896 CET;192.168.1.102;192.168.1.104;49292;1883;54;49292 → 1883 [ACK] Seq=1 Ack=1 Win=42340 Len=0;
160;Jan 13, 2022 12:28:47.554211045 CET;192.168.1.102;192.168.1.104;49292;1883;108;Connect Command;
161;Jan 13, 2022 12:28:48.349350362 CET;192.168.1.102;192.168.1.104;49292;1883;108;[TCP Retransmission] 49292 → 1883 [PSH, ACK] Seq=1 Ack=1 Win=42340 Len=54;
162;Jan 13, 2022 12:28:48.619145189 CET;192.168.1.104;192.168.1.102;1883;49292;54;1883 → 49292 [ACK] Seq=1 Ack=55 Win=8192 Len=0;
163;Jan 13, 2022 12:28:48.625757071 CET;192.168.1.104;192.168.1.102;1883;49292;58;Connect Ack;
164;Jan 13, 2022 12:28:48.625776241 CET;192.168.1.102;192.168.1.104;49292;1883;54;49292 → 1883 [ACK] Seq=55 Ack=5 Win=42336 Len=0;
165;Jan 13, 2022 12:28:48.625840435 CET;192.168.1.102;192.168.1.104;49292;1883;73;Publish Message [topic];message013
166;Jan 13, 2022 12:28:48.625856403 CET;192.168.1.102;192.168.1.104;49292;1883;56;Disconnect Req;
167;Jan 13, 2022 12:28:50.173660263 CET;192.168.1.102;192.168.1.104;49292;1883;75;[TCP Retransmission] 49292 → 1883 [FIN, PSH, ACK] Seq=55 Ack=5 Win=42336 Len=21;
168;Jan 13, 2022 12:28:50.427769816 CET;192.168.1.104;192.168.1.102;1883;49292;54;1883 → 49292 [FIN, ACK] Seq=5 Ack=77 Win=8192 Len=0;
169;Jan 13, 2022 12:28:50.427807032 CET;192.168.1.102;192.168.1.104;49292;1883;54;49292 → 1883 [ACK] Seq=77 Ack=6 Win=42335 Len=0;
170;Jan 13, 2022 12:28:53.631615066 CET;192.168.1.102;192.168.1.104;49294;1883;74;49294 → 1883 [SYN] Seq=0 Win=42340 Len=0 MSS=1460 SACK_PERM=1 TSval=1794858862 TSecr=0 WS=512;
171;Jan 13, 2022 12:28:53.884954146 CET;192.168.1.104;192.168.1.102;1883;49294;58;1883 → 49294 [SYN, ACK] Seq=0 Ack=1 Win=8192 Len=0 MSS=1460;
172;Jan 13, 2022 12:28:53.885001456 CET;192.168.1.102;192.168.1.104;49294;1883;54;49294 → 1883 [ACK] Seq=1 Ack=1 Win=42340 Len=0;
173;Jan 13, 2022 12:28:53.885101524 CET;192.168.1.102;192.168.1.104;49294;1883;108;Connect Command;
174;Jan 13, 2022 12:28:54.653338582 CET;192.168.1.102;192.168.1.104;49294;1883;108;[TCP Retransmission] 49294 → 1883 [PSH, ACK] Seq=1 Ack=1 Win=42340 Len=54;
175;Jan 13, 2022 12:28:54.912959548 CET;192.168.1.104;192.168.1.102;1883;49294;54;1883 → 49294 [ACK] Seq=1 Ack=55 Win=8192 Len=0;
176;Jan 13, 2022 12:28:54.916798624 CET;192.168.1.104;192.168.1.102;1883;49294;58;Connect Ack;
177;Jan 13, 2022 12:28:54.916848715 CET;192.168.1.102;192.168.1.104;49294;1883;54;49294 → 1883 [ACK] Seq=55 Ack=5 Win=42336 Len=0;
178;Jan 13, 2022 12:28:54.917037476 CET;192.168.1.102;192.168.1.104;49294;1883;73;Publish Message [topic];message014
179;Jan 13, 2022 12:28:54.917096249 CET;192.168.1.102;192.168.1.104;49294;1883;56;Disconnect Req;
180;Jan 13, 2022 12:28:56.445490638 CET;192.168.1.102;192.168.1.104;49294;1883;75;[TCP Retransmission] 49294 → 1883 [FIN, PSH, ACK] Seq=55 Ack=5 Win=42336 Len=21;
181;Jan 13, 2022 12:28:56.699625700 CET;192.168.1.104;192.168.1.102;1883;49294;54;1883 → 49294 [FIN, ACK] Seq=5 Ack=77 Win=8192 Len=0;
182;Jan 13, 2022 12:28:56.699692336 CET;192.168.1.102;192.168.1.104;49294;1883;54;49294 → 1883 [ACK] Seq=77 Ack=6 Win=42335 Len=0;
183;Jan 13, 2022 12:28:59.930823132 CET;192.168.1.102;192.168.1.104;49296;1883;74;49296 → 1883 [SYN] Seq=0 Win=42340 Len=0 MSS=1460 SACK_PERM=1 TSval=1794865162 TSecr=0 WS=512;
184;Jan 13, 2022 12:29:00.183964305 CET;192.168.1.104;192.168.1.102;1883;49296;58;1883 → 49296 [SYN, ACK] Seq=0 Ack=1 Win=8192 Len=0 MSS=1460;
185;Jan 13, 2022 12:29:00.184052581 CET;192.168.1.102;192.168.1.104;49296;1883;54;49296 → 1883 [ACK] Seq=1 Ack=1 Win=42340 Len=0;
186;Jan 13, 2022 12:29:00.184208419 CET;192.168.1.102;192.168.1.104;49296;1883;108;Connect Command;
187;Jan 13, 2022 12:29:00.957582204 CET;192.168.1.102;192.168.1.104;49296;1883;108;[TCP Retransmission] 49296 → 1883 [PSH, ACK] Seq=1 Ack=1 Win=42340 Len=54;
188;Jan 13, 2022 12:29:01.211567284 CET;192.168.1.104;192.168.1.102;1883;49296;54;1883 → 49296 [ACK] Seq=1 Ack=55 Win=8192 Len=0;
189;Jan 13, 2022 12:29:01.213671017 CET;192.168.1.104;192.168.1.102;1883;49296;58;Connect Ack;
190;Jan 13, 2022 12:29:01.213722459 CET;192.168.1.102;192.168.1.104;49296;1883;54;49296 → 1883 [ACK] Seq=55 Ack=5 Win=42336 Len=0;
191;Jan 13, 2022 12:29:01.213920384 CET;192.168.1.102;192.168.1.104;49296;1883;73;Publish Message [topic];message015
192;Jan 13, 2022 12:29:01.213978360 CET;192.168.1.102;192.168.1.104;49296;1883;56;Disconnect Req;
193;Jan 13, 2022 12:29:02.749602896 CET;192.168.1.102;192.168.1.104;49296;1883;75;[TCP Retransmission] 49296 → 1883 [FIN, PSH, ACK] Seq=55 Ack=5 Win=42336 Len=21;
194;Jan 13, 2022 12:29:03.019885696 CET;192.168.1.104;192.168.1.102;1883;49296;54;1883 → 49296 [FIN, ACK] Seq=5 Ack=77 Win=8192 Len=0;
195;Jan 13, 2022 12:29:03.019953230 CET;192.168.1.102;192.168.1.104;49296;1883;54;49296 → 1883 [ACK] Seq=77 Ack=6 Win=42335 Len=0;
196;Jan 13, 2022 12:29:06.232365982 CET;192.168.1.102;192.168.1.104;49298;1883;74;49298 → 1883 [SYN] Seq=0 Win=42340 Len=0 MSS=1460 SACK_PERM=1 TSval=1794871463 TSecr=0 WS=512;
197;Jan 13, 2022 12:29:06.485519565 CET;192.168.1.104;192.168.1.102;1883;49298;58;1883 → 49298 [SYN, ACK] Seq=0 Ack=1 Win=8192 Len=0 MSS=1460;
198;Jan 13, 2022 12:29:06.485577062 CET;192.168.1.102;192.168.1.104;49298;1883;54;49298 → 1883 [ACK] Seq=1 Ack=1 Win=42340 Len=0;
199;Jan 13, 2022 12:29:06.485683546 CET;192.168.1.102;192.168.1.104;49298;1883;108;Connect Command;
200;Jan 13, 2022 12:29:07.261352547 CET;192.168.1.102;192.168.1.104;49298;1883;108;[TCP Retransmission] 49298 → 1883 [PSH, ACK] Seq=1 Ack=1 Win=42340 Len=54;
201;Jan 13, 2022 12:29:07.535664299 CET;192.168.1.104;192.168.1.102;1883;49298;54;1883 → 49298 [ACK] Seq=1 Ack=55 Win=8192 Len=0;
202;Jan 13, 2022 12:29:07.542272056 CET;192.168.1.104;192.168.1.102;1883;49298;58;Connect Ack;
203;Jan 13, 2022 12:29:07.542318733 CET;192.168.1.102;192.168.1.104;49298;1883;54;49298 → 1883 [ACK] Seq=55 Ack=5 Win=42336 Len=0;
204;Jan 13, 2022 12:29:07.542413814 CET;192.168.1.102;192.168.1.104;49298;1883;73;Publish Message [topic];message016
205;Jan 13, 2022 12:29:07.542438770 CET;192.168.1.102;192.168.1.104;49298;1883;56;Disconnect Req;
206;Jan 13, 2022 12:29:09.085376269 CET;192.168.1.102;192.168.1.104;49298;1883;75;[TCP Retransmission] 49298 → 1883 [FIN, PSH, ACK] Seq=55 Ack=5 Win=42336 Len=21;
207;Jan 13, 2022 12:29:09.344889495 CET;192.168.1.104;192.168.1.102;1883;49298;54;1883 → 49298 [FIN, ACK] Seq=5 Ack=77 Win=8192 Len=0;
208;Jan 13, 2022 12:29:09.344957089 CET;192.168.1.102;192.168.1.104;49298;1883;54;49298 → 1883 [ACK] Seq=77 Ack=6 Win=42335 Len=0;
209;Jan 13, 2022 12:29:12.547285608 CET;192.168.1.102;192.168.1.104;49300;1883;74;49300 → 1883 [SYN] Seq=0 Win=42340 Len=0 MSS=1460 SACK_PERM=1 TSval=1794877778 TSecr=0 WS=512;
210;Jan 13, 2022 12:29:12.801805426 CET;192.168.1.104;192.168.1.102;1883;49300;58;1883 → 49300 [SYN, ACK] Seq=0 Ack=1 Win=8192 Len=0 MSS=1460;
211;Jan 13, 2022 12:29:12.801896365 CET;192.168.1.102;192.168.1.104;49300;1883;54;49300 → 1883 [ACK] Seq=1 Ack=1 Win=42340 Len=0;
212;Jan 13, 2022 12:29:12.802049492 CET;192.168.1.102;192.168.1.104;49300;1883;108;Connect Command;
213;Jan 13, 2022 12:29:13.597356641 CET;192.168.1.102;192.168.1.104;49300;1883;108;[TCP Retransmission] 49300 → 1883 [PSH, ACK] Seq=1 Ack=1 Win=42340 Len=54;
214;Jan 13, 2022 12:29:13.868093694 CET;192.168.1.104;192.168.1.102;1883;49300;54;1883 → 49300 [ACK] Seq=1 Ack=55 Win=8192 Len=0;
215;Jan 13, 2022 12:29:13.875740946 CET;192.168.1.104;192.168.1.102;1883;49300;58;Connect Ack;
216;Jan 13, 2022 12:29:13.875791582 CET;192.168.1.102;192.168.1.104;49300;1883;54;49300 → 1883 [ACK] Seq=55 Ack=5 Win=42336 Len=0;
217;Jan 13, 2022 12:29:13.875979635 CET;192.168.1.102;192.168.1.104;49300;1883;73;Publish Message [topic];message017
218;Jan 13, 2022 12:29:13.876037900 CET;192.168.1.102;192.168.1.104;49300;1883;56;Disconnect Req;
219;Jan 13, 2022 12:29:15.421500981 CET;192.168.1.102;192.168.1.104;49300;1883;75;[TCP Retransmission] 49300 → 1883 [FIN, PSH, ACK] Seq=55 Ack=5 Win=42336 Len=21;
220;Jan 13, 2022 12:29:15.677540310 CET;192.168.1.104;192.168.1.102;1883;49300;54;1883 → 49300 [FIN, ACK] Seq=5 Ack=77 Win=8192 Len=0;
221;Jan 13, 2022 12:29:15.677567603 CET;192.168.1.102;192.168.1.104;49300;1883;54;49300 → 1883 [ACK] Seq=77 Ack=6 Win=42335 Len=0;
222;Jan 13, 2022 12:29:18.883566550 CET;192.168.1.102;192.168.1.104;49302;1883;74;49302 → 1883 [SYN] Seq=0 Win=42340 Len=0 MSS=1460 SACK_PERM=1 TSval=1794884114 TSecr=0 WS=512;
223;Jan 13, 2022 12:29:19.141595282 CET;192.168.1.104;192.168.1.102;1883;49302;58;1883 → 49302 [SYN, ACK] Seq=0 Ack=1 Win=8192 Len=0 MSS=1460;
224;Jan 13, 2022 12:29:19.141681912 CET;192.168.1.102;192.168.1.104;49302;1883;54;49302 → 1883 [ACK] Seq=1 Ack=1 Win=42340 Len=0;
225;Jan 13, 2022 12:29:19.141835969 CET;192.168.1.102;192.168.1.104;49302;1883;108;Connect Command;
226;Jan 13, 2022 12:29:19.933844791 CET;192.168.1.102;192.168.1.104;49302;1883;108;[TCP Retransmission] 49302 → 1883 [PSH, ACK] Seq=1 Ack=1 Win=42340 Len=54;
227;Jan 13, 2022 12:29:20.188727833 CET;192.168.1.104;192.168.1.102;1883;49302;54;1883 → 49302 [ACK] Seq=1 Ack=55 Win=8192 Len=0;
228;Jan 13, 2022 12:29:20.192472191 CET;192.168.1.104;192.168.1.102;1883;49302;58;Connect Ack;
229;Jan 13, 2022 12:29:20.192523108 CET;192.168.1.102;192.168.1.104;49302;1883;54;49302 → 1883 [ACK] Seq=55 Ack=5 Win=42336 Len=0;
230;Jan 13, 2022 12:29:20.192782286 CET;192.168.1.102;192.168.1.104;49302;1883;73;Publish Message [topic];message018
231;Jan 13, 2022 12:29:20.192847717 CET;192.168.1.102;192.168.1.104;49302;1883;56;Disconnect Req;
232;Jan 13, 2022 12:29:21.757529471 CET;192.168.1.102;192.168.1.104;49302;1883;75;[TCP Retransmission] 49302 → 1883 [FIN, PSH, ACK] Seq=55 Ack=5 Win=42336 Len=21;
233;Jan 13, 2022 12:29:22.011389169 CET;192.168.1.104;192.168.1.102;1883;49302;54;1883 → 49302 [FIN, ACK] Seq=5 Ack=77 Win=8192 Len=0;
234;Jan 13, 2022 12:29:22.011456921 CET;192.168.1.102;192.168.1.104;49302;1883;54;49302 → 1883 [ACK] Seq=77 Ack=6 Win=42335 Len=0;
235;Jan 13, 2022 12:29:25.200555219 CET;192.168.1.102;192.168.1.104;49304;1883;74;49304 → 1883 [SYN] Seq=0 Win=42340 Len=0 MSS=1460 SACK_PERM=1 TSval=1794890431 TSecr=0 WS=512;
236;Jan 13, 2022 12:29:25.463110373 CET;192.168.1.104;192.168.1.102;1883;49304;58;1883 → 49304 [SYN, ACK] Seq=0 Ack=1 Win=8192 Len=0 MSS=1460;
237;Jan 13, 2022 12:29:25.463153032 CET;192.168.1.102;192.168.1.104;49304;1883;54;49304 → 1883 [ACK] Seq=1 Ack=1 Win=42340 Len=0;
238;Jan 13, 2022 12:29:25.463217089 CET;192.168.1.102;192.168.1.104;49304;1883;108;Connect Command;
239;Jan 13, 2022 12:29:26.269426523 CET;192.168.1.102;192.168.1.104;49304;1883;108;[TCP Retransmission] 49304 → 1883 [PSH, ACK] Seq=1 Ack=1 Win=42340 Len=54;
240;Jan 13, 2022 12:29:26.530482267 CET;192.168.1.104;192.168.1.102;1883;49304;54;1883 → 49304 [ACK] Seq=1 Ack=55 Win=8192 Len=0;
241;Jan 13, 2022 12:29:26.532790777 CET;192.168.1.104;192.168.1.102;1883;49304;58;Connect Ack;
242;Jan 13, 2022 12:29:26.532841403 CET;192.168.1.102;192.168.1.104;49304;1883;54;49304 → 1883 [ACK] Seq=55 Ack=5 Win=42336 Len=0;
243;Jan 13, 2022 12:29:26.533034123 CET;192.168.1.102;192.168.1.104;49304;1883;73;Publish Message [topic];message019
244;Jan 13, 2022 12:29:26.533186672 CET;192.168.1.102;192.168.1.104;49304;1883;56;Disconnect Req;
245;Jan 13, 2022 12:29:28.125759304 CET;192.168.1.102;192.168.1.104;49304;1883;75;[TCP Retransmission] 49304 → 1883 [FIN, PSH, ACK] Seq=55 Ack=5 Win=42336 Len=21;
246;Jan 13, 2022 12:29:28.385519605 CET;192.168.1.104;192.168.1.102;1883;49304;54;1883 → 49304 [FIN, ACK] Seq=5 Ack=77 Win=8192 Len=0;
247;Jan 13, 2022 12:29:28.385586950 CET;192.168.1.102;192.168.1.104;49304;1883;54;49304 → 1883 [ACK] Seq=77 Ack=6 Win=42335 Len=0;
248;Jan 13, 2022 12:29:31.541750486 CET;192.168.1.102;192.168.1.104;49306;1883;74;49306 → 1883 [SYN] Seq=0 Win=42340 Len=0 MSS=1460 SACK_PERM=1 TSval=1794896773 TSecr=0 WS=512;
249;Jan 13, 2022 12:29:32.084235270 CET;192.168.1.104;192.168.1.102;1883;49306;58;1883 → 49306 [SYN, ACK] Seq=0 Ack=1 Win=8192 Len=0 MSS=1460;
250;Jan 13, 2022 12:29:32.084317885 CET;192.168.1.102;192.168.1.104;49306;1883;54;49306 → 1883 [ACK] Seq=1 Ack=1 Win=42340 Len=0;
251;Jan 13, 2022 12:29:32.084630561 CET;192.168.1.102;192.168.1.104;49306;1883;108;Connect Command;
252;Jan 13, 2022 12:29:33.725341935 CET;192.168.1.102;192.168.1.104;49306;1883;108;[TCP Retransmission] 49306 → 1883 [PSH, ACK] Seq=1 Ack=1 Win=42340 Len=54;
253;Jan 13, 2022 12:29:33.983076886 CET;192.168.1.104;192.168.1.102;1883;49306;54;1883 → 49306 [ACK] Seq=1 Ack=55 Win=8192 Len=0;
254;Jan 13, 2022 12:29:33.986637906 CET;192.168.1.104;192.168.1.102;1883;49306;58;Connect Ack;
255;Jan 13, 2022 12:29:33.986654432 CET;192.168.1.102;192.168.1.104;49306;1883;54;49306 → 1883 [ACK] Seq=55 Ack=5 Win=42336 Len=0;
256;Jan 13, 2022 12:29:33.986692681 CET;192.168.1.102;192.168.1.104;49306;1883;73;Publish Message [topic];message020
257;Jan 13, 2022 12:29:33.986707204 CET;192.168.1.102;192.168.1.104;49306;1883;56;Disconnect Req;
258;Jan 13, 2022 12:29:37.373424825 CET;192.168.1.102;192.168.1.104;49306;1883;75;[TCP Retransmission] 49306 → 1883 [FIN, PSH, ACK] Seq=55 Ack=5 Win=42336 Len=21;
259;Jan 13, 2022 12:29:37.632603605 CET;192.168.1.104;192.168.1.102;1883;49306;54;1883 → 49306 [FIN, ACK] Seq=5 Ack=77 Win=8192 Len=0;
260;Jan 13, 2022 12:29:37.632634187 CET;192.168.1.102;192.168.1.104;49306;1883;54;49306 → 1883 [ACK] Seq=77 Ack=6 Win=42335 Len=0;
261;Jan 13, 2022 12:29:38.994468677 CET;192.168.1.102;192.168.1.104;49308;1883;74;49308 → 1883 [SYN] Seq=0 Win=42340 Len=0 MSS=1460 SACK_PERM=1 TSval=1794904225 TSecr=0 WS=512;
262;Jan 13, 2022 12:29:39.269586879 CET;192.168.1.104;192.168.1.102;1883;49308;58;1883 → 49308 [SYN, ACK] Seq=0 Ack=1 Win=8192 Len=0 MSS=1460;
263;Jan 13, 2022 12:29:39.269669379 CET;192.168.1.102;192.168.1.104;49308;1883;54;49308 → 1883 [ACK] Seq=1 Ack=1 Win=42340 Len=0;
264;Jan 13, 2022 12:29:39.269800937 CET;192.168.1.102;192.168.1.104;49308;1883;108;Connect Command;
265;Jan 13, 2022 12:29:40.126034394 CET;192.168.1.102;192.168.1.104;49308;1883;108;[TCP Retransmission] 49308 → 1883 [PSH, ACK] Seq=1 Ack=1 Win=42340 Len=54;
266;Jan 13, 2022 12:29:40.386675783 CET;192.168.1.104;192.168.1.102;1883;49308;54;1883 → 49308 [ACK] Seq=1 Ack=55 Win=8192 Len=0;
267;Jan 13, 2022 12:29:40.389919683 CET;192.168.1.104;192.168.1.102;1883;49308;58;Connect Ack;
268;Jan 13, 2022 12:29:40.389955283 CET;192.168.1.102;192.168.1.104;49308;1883;54;49308 → 1883 [ACK] Seq=55 Ack=5 Win=42336 Len=0;
269;Jan 13, 2022 12:29:40.390104540 CET;192.168.1.102;192.168.1.104;49308;1883;73;Publish Message [topic];message021
270;Jan 13, 2022 12:29:40.390157032 CET;192.168.1.102;192.168.1.104;49308;1883;56;Disconnect Req;
271;Jan 13, 2022 12:29:42.077597580 CET;192.168.1.102;192.168.1.104;49308;1883;75;[TCP Retransmission] 49308 → 1883 [FIN, PSH, ACK] Seq=55 Ack=5 Win=42336 Len=21;
272;Jan 13, 2022 12:29:42.345918107 CET;192.168.1.104;192.168.1.102;1883;49308;54;1883 → 49308 [FIN, ACK] Seq=5 Ack=77 Win=8192 Len=0;
273;Jan 13, 2022 12:29:42.345942795 CET;192.168.1.102;192.168.1.104;49308;1883;54;49308 → 1883 [ACK] Seq=77 Ack=6 Win=42335 Len=0;
274;Jan 13, 2022 12:29:45.408176131 CET;192.168.1.102;192.168.1.104;49310;1883;74;49310 → 1883 [SYN] Seq=0 Win=42340 Len=0 MSS=1460 SACK_PERM=1 TSval=1794910639 TSecr=0 WS=512;
275;Jan 13, 2022 12:29:45.678549630 CET;192.168.1.104;192.168.1.102;1883;49310;58;1883 → 49310 [SYN, ACK] Seq=0 Ack=1 Win=8192 Len=0 MSS=1460;
276;Jan 13, 2022 12:29:45.678636030 CET;192.168.1.102;192.168.1.104;49310;1883;54;49310 → 1883 [ACK] Seq=1 Ack=1 Win=42340 Len=0;
277;Jan 13, 2022 12:29:45.678781559 CET;192.168.1.102;192.168.1.104;49310;1883;108;Connect Command;
278;Jan 13, 2022 12:29:46.493494426 CET;192.168.1.102;192.168.1.104;49310;1883;108;[TCP Retransmission] 49310 → 1883 [PSH, ACK] Seq=1 Ack=1 Win=42340 Len=54;
279;Jan 13, 2022 12:29:46.751052634 CET;192.168.1.104;192.168.1.102;1883;49310;54;1883 → 49310 [ACK] Seq=1 Ack=55 Win=8192 Len=0;
280;Jan 13, 2022 12:29:46.753973245 CET;192.168.1.104;192.168.1.102;1883;49310;58;Connect Ack;
281;Jan 13, 2022 12:29:46.753982385 CET;192.168.1.102;192.168.1.104;49310;1883;54;49310 → 1883 [ACK] Seq=55 Ack=5 Win=42336 Len=0;
282;Jan 13, 2022 12:29:46.754028931 CET;192.168.1.102;192.168.1.104;49310;1883;73;Publish Message [topic];message022
283;Jan 13, 2022 12:29:46.754043545 CET;192.168.1.102;192.168.1.104;49310;1883;56;Disconnect Req;
284;Jan 13, 2022 12:29:48.381402281 CET;192.168.1.102;192.168.1.104;49310;1883;75;[TCP Retransmission] 49310 → 1883 [FIN, PSH, ACK] Seq=55 Ack=5 Win=42336 Len=21;
285;Jan 13, 2022 12:29:48.650900096 CET;192.168.1.104;192.168.1.102;1883;49310;54;1883 → 49310 [FIN, ACK] Seq=5 Ack=77 Win=8192 Len=0;
286;Jan 13, 2022 12:29:48.650923611 CET;192.168.1.102;192.168.1.104;49310;1883;54;49310 → 1883 [ACK] Seq=77 Ack=6 Win=42335 Len=0;
287;Jan 13, 2022 12:29:51.762762185 CET;192.168.1.102;192.168.1.104;49312;1883;74;49312 → 1883 [SYN] Seq=0 Win=42340 Len=0 MSS=1460 SACK_PERM=1 TSval=1794916994 TSecr=0 WS=512;
288;Jan 13, 2022 12:29:52.032387958 CET;192.168.1.104;192.168.1.102;1883;49312;58;1883 → 49312 [SYN, ACK] Seq=0 Ack=1 Win=8192 Len=0 MSS=1460;
289;Jan 13, 2022 12:29:52.032418875 CET;192.168.1.102;192.168.1.104;49312;1883;54;49312 → 1883 [ACK] Seq=1 Ack=1 Win=42340 Len=0;
290;Jan 13, 2022 12:29:52.032465517 CET;192.168.1.102;192.168.1.104;49312;1883;108;Connect Command;
291;Jan 13, 2022 12:29:52.862030326 CET;192.168.1.102;192.168.1.104;49312;1883;108;[TCP Retransmission] 49312 → 1883 [PSH, ACK] Seq=1 Ack=1 Win=42340 Len=54;
292;Jan 13, 2022 12:29:53.117167534 CET;192.168.1.104;192.168.1.102;1883;49312;54;1883 → 49312 [ACK] Seq=1 Ack=55 Win=8192 Len=0;
293;Jan 13, 2022 12:29:53.120502595 CET;192.168.1.104;192.168.1.102;1883;49312;58;Connect Ack;
294;Jan 13, 2022 12:29:53.120529354 CET;192.168.1.102;192.168.1.104;49312;1883;54;49312 → 1883 [ACK] Seq=55 Ack=5 Win=42336 Len=0;
295;Jan 13, 2022 12:29:53.120616258 CET;192.168.1.102;192.168.1.104;49312;1883;73;Publish Message [topic];message023
296;Jan 13, 2022 12:29:53.120642549 CET;192.168.1.102;192.168.1.104;49312;1883;56;Disconnect Req;
297;Jan 13, 2022 12:29:54.749502720 CET;192.168.1.102;192.168.1.104;49312;1883;75;[TCP Retransmission] 49312 → 1883 [FIN, PSH, ACK] Seq=55 Ack=5 Win=42336 Len=21;
298;Jan 13, 2022 12:29:55.022770119 CET;192.168.1.104;192.168.1.102;1883;49312;54;1883 → 49312 [FIN, ACK] Seq=5 Ack=77 Win=8192 Len=0;
299;Jan 13, 2022 12:29:55.022786653 CET;192.168.1.102;192.168.1.104;49312;1883;54;49312 → 1883 [ACK] Seq=77 Ack=6 Win=42335 Len=0;
300;Jan 13, 2022 12:29:58.130615531 CET;192.168.1.102;192.168.1.104;49314;1883;74;49314 → 1883 [SYN] Seq=0 Win=42340 Len=0 MSS=1460 SACK_PERM=1 TSval=1794923361 TSecr=0 WS=512;
301;Jan 13, 2022 12:29:58.387951945 CET;192.168.1.104;192.168.1.102;1883;49314;58;1883 → 49314 [SYN, ACK] Seq=0 Ack=1 Win=8192 Len=0 MSS=1460;
302;Jan 13, 2022 12:29:58.387996213 CET;192.168.1.102;192.168.1.104;49314;1883;54;49314 → 1883 [ACK] Seq=1 Ack=1 Win=42340 Len=0;
303;Jan 13, 2022 12:29:58.388103958 CET;192.168.1.102;192.168.1.104;49314;1883;108;Connect Command;
304;Jan 13, 2022 12:29:59.165623337 CET;192.168.1.102;192.168.1.104;49314;1883;108;[TCP Retransmission] 49314 → 1883 [PSH, ACK] Seq=1 Ack=1 Win=42340 Len=54;
305;Jan 13, 2022 12:29:59.422067569 CET;192.168.1.104;192.168.1.102;1883;49314;54;1883 → 49314 [ACK] Seq=1 Ack=55 Win=8192 Len=0;
306;Jan 13, 2022 12:29:59.429788534 CET;192.168.1.104;192.168.1.102;1883;49314;58;Connect Ack;
307;Jan 13, 2022 12:29:59.429806794 CET;192.168.1.102;192.168.1.104;49314;1883;54;49314 → 1883 [ACK] Seq=55 Ack=5 Win=42336 Len=0;
308;Jan 13, 2022 12:29:59.429859641 CET;192.168.1.102;192.168.1.104;49314;1883;73;Publish Message [topic];message024
309;Jan 13, 2022 12:29:59.429876416 CET;192.168.1.102;192.168.1.104;49314;1883;56;Disconnect Req;
310;Jan 13, 2022 12:30:00.989355155 CET;192.168.1.102;192.168.1.104;49314;1883;75;[TCP Retransmission] 49314 → 1883 [FIN, PSH, ACK] Seq=55 Ack=5 Win=42336 Len=21;
311;Jan 13, 2022 12:30:01.253216614 CET;192.168.1.104;192.168.1.102;1883;49314;54;1883 → 49314 [FIN, ACK] Seq=5 Ack=77 Win=8192 Len=0;
312;Jan 13, 2022 12:30:01.253238019 CET;192.168.1.102;192.168.1.104;49314;1883;54;49314 → 1883 [ACK] Seq=77 Ack=6 Win=42335 Len=0;
313;Jan 13, 2022 12:30:04.434314187 CET;192.168.1.102;192.168.1.104;49316;1883;74;49316 → 1883 [SYN] Seq=0 Win=42340 Len=0 MSS=1460 SACK_PERM=1 TSval=1794929665 TSecr=0 WS=512;
314;Jan 13, 2022 12:30:04.690070979 CET;192.168.1.104;192.168.1.102;1883;49316;58;1883 → 49316 [SYN, ACK] Seq=0 Ack=1 Win=8192 Len=0 MSS=1460;
315;Jan 13, 2022 12:30:04.690111208 CET;192.168.1.102;192.168.1.104;49316;1883;54;49316 → 1883 [ACK] Seq=1 Ack=1 Win=42340 Len=0;
316;Jan 13, 2022 12:30:04.690174539 CET;192.168.1.102;192.168.1.104;49316;1883;108;Connect Command;
317;Jan 13, 2022 12:30:05.469330885 CET;192.168.1.102;192.168.1.104;49316;1883;108;[TCP Retransmission] 49316 → 1883 [PSH, ACK] Seq=1 Ack=1 Win=42340 Len=54;
318;Jan 13, 2022 12:30:05.731040396 CET;192.168.1.104;192.168.1.102;1883;49316;54;1883 → 49316 [ACK] Seq=1 Ack=55 Win=8192 Len=0;
319;Jan 13, 2022 12:30:05.736538582 CET;192.168.1.104;192.168.1.102;1883;49316;58;Connect Ack;
320;Jan 13, 2022 12:30:05.736557214 CET;192.168.1.102;192.168.1.104;49316;1883;54;49316 → 1883 [ACK] Seq=55 Ack=5 Win=42336 Len=0;
321;Jan 13, 2022 12:30:05.736612291 CET;192.168.1.102;192.168.1.104;49316;1883;73;Publish Message [topic];message025
322;Jan 13, 2022 12:30:05.736627779 CET;192.168.1.102;192.168.1.104;49316;1883;56;Disconnect Req;
323;Jan 13, 2022 12:30:07.294118853 CET;192.168.1.102;192.168.1.104;49316;1883;75;[TCP Retransmission] 49316 → 1883 [FIN, PSH, ACK] Seq=55 Ack=5 Win=42336 Len=21;
324;Jan 13, 2022 12:30:07.551593188 CET;192.168.1.104;192.168.1.102;1883;49316;54;1883 → 49316 [FIN, ACK] Seq=5 Ack=77 Win=8192 Len=0;
325;Jan 13, 2022 12:30:07.551615875 CET;192.168.1.102;192.168.1.104;49316;1883;54;49316 → 1883 [ACK] Seq=77 Ack=6 Win=42335 Len=0;
326;Jan 13, 2022 12:30:10.744743632 CET;192.168.1.102;192.168.1.104;49318;1883;74;49318 → 1883 [SYN] Seq=0 Win=42340 Len=0 MSS=1460 SACK_PERM=1 TSval=1794935976 TSecr=0 WS=512;
327;Jan 13, 2022 12:30:11.013914099 CET;192.168.1.104;192.168.1.102;1883;49318;58;1883 → 49318 [SYN, ACK] Seq=0 Ack=1 Win=8192 Len=0 MSS=1460;
328;Jan 13, 2022 12:30:11.013947587 CET;192.168.1.102;192.168.1.104;49318;1883;54;49318 → 1883 [ACK] Seq=1 Ack=1 Win=42340 Len=0;
329;Jan 13, 2022 12:30:11.014000965 CET;192.168.1.102;192.168.1.104;49318;1883;108;Connect Command;
330;Jan 13, 2022 12:30:11.837498106 CET;192.168.1.102;192.168.1.104;49318;1883;108;[TCP Retransmission] 49318 → 1883 [PSH, ACK] Seq=1 Ack=1 Win=42340 Len=54;
331;Jan 13, 2022 12:30:12.109125304 CET;192.168.1.104;192.168.1.102;1883;49318;54;1883 → 49318 [ACK] Seq=1 Ack=55 Win=8192 Len=0;
332;Jan 13, 2022 12:30:12.119149954 CET;192.168.1.104;192.168.1.102;1883;49318;58;Connect Ack;
333;Jan 13, 2022 12:30:12.119176558 CET;192.168.1.102;192.168.1.104;49318;1883;54;49318 → 1883 [ACK] Seq=55 Ack=5 Win=42336 Len=0;
334;Jan 13, 2022 12:30:12.119245958 CET;192.168.1.102;192.168.1.104;49318;1883;73;Publish Message [topic];message026
335;Jan 13, 2022 12:30:12.119263288 CET;192.168.1.102;192.168.1.104;49318;1883;56;Disconnect Req;
336;Jan 13, 2022 12:30:13.757408213 CET;192.168.1.102;192.168.1.104;49318;1883;75;[TCP Retransmission] 49318 → 1883 [FIN, PSH, ACK] Seq=55 Ack=5 Win=42336 Len=21;
337;Jan 13, 2022 12:30:14.011018320 CET;192.168.1.104;192.168.1.102;1883;49318;54;1883 → 49318 [FIN, ACK] Seq=5 Ack=77 Win=8192 Len=0;
338;Jan 13, 2022 12:30:14.011061906 CET;192.168.1.102;192.168.1.104;49318;1883;54;49318 → 1883 [ACK] Seq=77 Ack=6 Win=42335 Len=0;
339;Jan 13, 2022 12:30:17.134049426 CET;192.168.1.102;192.168.1.104;49322;1883;74;49322 → 1883 [SYN] Seq=0 Win=42340 Len=0 MSS=1460 SACK_PERM=1 TSval=1794942365 TSecr=0 WS=512;
340;Jan 13, 2022 12:30:17.392127621 CET;192.168.1.104;192.168.1.102;1883;49322;58;1883 → 49322 [SYN, ACK] Seq=0 Ack=1 Win=8192 Len=0 MSS=1460;
341;Jan 13, 2022 12:30:17.392205738 CET;192.168.1.102;192.168.1.104;49322;1883;54;49322 → 1883 [ACK] Seq=1 Ack=1 Win=42340 Len=0;
342;Jan 13, 2022 12:30:17.392330944 CET;192.168.1.102;192.168.1.104;49322;1883;108;Connect Command;
343;Jan 13, 2022 12:30:18.173992494 CET;192.168.1.102;192.168.1.104;49322;1883;108;[TCP Retransmission] 49322 → 1883 [PSH, ACK] Seq=1 Ack=1 Win=42340 Len=54;
344;Jan 13, 2022 12:30:18.444712996 CET;192.168.1.104;192.168.1.102;1883;49322;54;1883 → 49322 [ACK] Seq=1 Ack=55 Win=8192 Len=0;
345;Jan 13, 2022 12:30:18.446946097 CET;192.168.1.104;192.168.1.102;1883;49322;58;Connect Ack;
346;Jan 13, 2022 12:30:18.446966571 CET;192.168.1.102;192.168.1.104;49322;1883;54;49322 → 1883 [ACK] Seq=55 Ack=5 Win=42336 Len=0;
347;Jan 13, 2022 12:30:18.447012992 CET;192.168.1.102;192.168.1.104;49322;1883;73;Publish Message [topic];message027
348;Jan 13, 2022 12:30:18.447028138 CET;192.168.1.102;192.168.1.104;49322;1883;56;Disconnect Req;
349;Jan 13, 2022 12:30:20.029737761 CET;192.168.1.102;192.168.1.104;49322;1883;75;[TCP Retransmission] 49322 → 1883 [FIN, PSH, ACK] Seq=55 Ack=5 Win=42336 Len=21;
350;Jan 13, 2022 12:30:20.289772086 CET;192.168.1.104;192.168.1.102;1883;49322;54;1883 → 49322 [FIN, ACK] Seq=5 Ack=77 Win=8192 Len=0;
351;Jan 13, 2022 12:30:20.289799068 CET;192.168.1.102;192.168.1.104;49322;1883;54;49322 → 1883 [ACK] Seq=77 Ack=6 Win=42335 Len=0;
352;Jan 13, 2022 12:30:23.451525351 CET;192.168.1.102;192.168.1.104;49324;1883;74;49324 → 1883 [SYN] Seq=0 Win=42340 Len=0 MSS=1460 SACK_PERM=1 TSval=1794948682 TSecr=0 WS=512;
353;Jan 13, 2022 12:30:23.705221608 CET;192.168.1.104;192.168.1.102;1883;49324;58;1883 → 49324 [SYN, ACK] Seq=0 Ack=1 Win=8192 Len=0 MSS=1460;
354;Jan 13, 2022 12:30:23.705252837 CET;192.168.1.102;192.168.1.104;49324;1883;54;49324 → 1883 [ACK] Seq=1 Ack=1 Win=42340 Len=0;
355;Jan 13, 2022 12:30:23.705295725 CET;192.168.1.102;192.168.1.104;49324;1883;108;Connect Command;
356;Jan 13, 2022 12:30:24.477383871 CET;192.168.1.102;192.168.1.104;49324;1883;108;[TCP Retransmission] 49324 → 1883 [PSH, ACK] Seq=1 Ack=1 Win=42340 Len=54;
357;Jan 13, 2022 12:30:24.750872364 CET;192.168.1.104;192.168.1.102;1883;49324;54;1883 → 49324 [ACK] Seq=1 Ack=55 Win=8192 Len=0;
358;Jan 13, 2022 12:30:24.754973388 CET;192.168.1.104;192.168.1.102;1883;49324;58;Connect Ack;
359;Jan 13, 2022 12:30:24.755015963 CET;192.168.1.102;192.168.1.104;49324;1883;54;49324 → 1883 [ACK] Seq=55 Ack=5 Win=42336 Len=0;
360;Jan 13, 2022 12:30:24.755090854 CET;192.168.1.102;192.168.1.104;49324;1883;73;Publish Message [topic];message028
361;Jan 13, 2022 12:30:24.755113797 CET;192.168.1.102;192.168.1.104;49324;1883;56;Disconnect Req;
362;Jan 13, 2022 12:30:26.301562988 CET;192.168.1.102;192.168.1.104;49324;1883;75;[TCP Retransmission] 49324 → 1883 [FIN, PSH, ACK] Seq=55 Ack=5 Win=42336 Len=21;
363;Jan 13, 2022 12:30:26.572813752 CET;192.168.1.104;192.168.1.102;1883;49324;54;1883 → 49324 [FIN, ACK] Seq=5 Ack=77 Win=8192 Len=0;
364;Jan 13, 2022 12:30:26.572836615 CET;192.168.1.102;192.168.1.104;49324;1883;54;49324 → 1883 [ACK] Seq=77 Ack=6 Win=42335 Len=0;
365;Jan 13, 2022 12:30:29.762980563 CET;192.168.1.102;192.168.1.104;49326;1883;74;49326 → 1883 [SYN] Seq=0 Win=42340 Len=0 MSS=1460 SACK_PERM=1 TSval=1794954994 TSecr=0 WS=512;
366;Jan 13, 2022 12:30:30.016116219 CET;192.168.1.104;192.168.1.102;1883;49326;58;1883 → 49326 [SYN, ACK] Seq=0 Ack=1 Win=8192 Len=0 MSS=1460;
367;Jan 13, 2022 12:30:30.016172730 CET;192.168.1.102;192.168.1.104;49326;1883;54;49326 → 1883 [ACK] Seq=1 Ack=1 Win=42340 Len=0;
368;Jan 13, 2022 12:30:30.016273566 CET;192.168.1.102;192.168.1.104;49326;1883;108;Connect Command;
369;Jan 13, 2022 12:30:30.273602404 CET;192.168.1.104;192.168.1.102;1883;49326;54;1883 → 49326 [ACK] Seq=1 Ack=55 Win=8192 Len=0;
370;Jan 13, 2022 12:30:30.280133822 CET;192.168.1.104;192.168.1.102;1883;49326;58;Connect Ack;
371;Jan 13, 2022 12:30:30.280185567 CET;192.168.1.102;192.168.1.104;49326;1883;54;49326 → 1883 [ACK] Seq=55 Ack=5 Win=42336 Len=0;
372;Jan 13, 2022 12:30:30.280377635 CET;192.168.1.102;192.168.1.104;49326;1883;73;Publish Message [topic];message029
373;Jan 13, 2022 12:30:30.280437453 CET;192.168.1.102;192.168.1.104;49326;1883;56;Disconnect Req;
374;Jan 13, 2022 12:30:31.069519574 CET;192.168.1.102;192.168.1.104;49326;1883;75;[TCP Retransmission] 49326 → 1883 [FIN, PSH, ACK] Seq=55 Ack=5 Win=42336 Len=21;
375;Jan 13, 2022 12:30:31.323787297 CET;192.168.1.104;192.168.1.102;1883;49326;54;1883 → 49326 [FIN, ACK] Seq=5 Ack=77 Win=8192 Len=0;
376;Jan 13, 2022 12:30:31.323830137 CET;192.168.1.102;192.168.1.104;49326;1883;54;49326 → 1883 [ACK] Seq=77 Ack=6 Win=42335 Len=0;
377;Jan 13, 2022 12:30:35.287879016 CET;192.168.1.102;192.168.1.104;49328;1883;74;49328 → 1883 [SYN] Seq=0 Win=42340 Len=0 MSS=1460 SACK_PERM=1 TSval=1794960519 TSecr=0 WS=512;
378;Jan 13, 2022 12:30:35.566996341 CET;192.168.1.104;192.168.1.102;1883;49328;58;1883 → 49328 [SYN, ACK] Seq=0 Ack=1 Win=8192 Len=0 MSS=1460;
379;Jan 13, 2022 12:30:35.567031389 CET;192.168.1.102;192.168.1.104;49328;1883;54;49328 → 1883 [ACK] Seq=1 Ack=1 Win=42340 Len=0;
380;Jan 13, 2022 12:30:35.567079812 CET;192.168.1.102;192.168.1.104;49328;1883;108;Connect Command;
381;Jan 13, 2022 12:30:36.413387430 CET;192.168.1.102;192.168.1.104;49328;1883;108;[TCP Retransmission] 49328 → 1883 [PSH, ACK] Seq=1 Ack=1 Win=42340 Len=54;
382;Jan 13, 2022 12:30:36.685236857 CET;192.168.1.104;192.168.1.102;1883;49328;54;1883 → 49328 [ACK] Seq=1 Ack=55 Win=8192 Len=0;
383;Jan 13, 2022 12:30:36.691820424 CET;192.168.1.104;192.168.1.102;1883;49328;58;Connect Ack;
384;Jan 13, 2022 12:30:36.691830467 CET;192.168.1.102;192.168.1.104;49328;1883;54;49328 → 1883 [ACK] Seq=55 Ack=5 Win=42336 Len=0;
385;Jan 13, 2022 12:30:36.691873657 CET;192.168.1.102;192.168.1.104;49328;1883;73;Publish Message [topic];message030
386;Jan 13, 2022 12:30:36.691887181 CET;192.168.1.102;192.168.1.104;49328;1883;56;Disconnect Req;
387;Jan 13, 2022 12:30:38.397363742 CET;192.168.1.102;192.168.1.104;49328;1883;75;[TCP Retransmission] 49328 → 1883 [FIN, PSH, ACK] Seq=55 Ack=5 Win=42336 Len=21;
388;Jan 13, 2022 12:30:38.650918040 CET;192.168.1.104;192.168.1.102;1883;49328;54;1883 → 49328 [FIN, ACK] Seq=5 Ack=77 Win=8192 Len=0;
389;Jan 13, 2022 12:30:38.650942807 CET;192.168.1.102;192.168.1.104;49328;1883;54;49328 → 1883 [ACK] Seq=77 Ack=6 Win=42335 Len=0;
390;Jan 13, 2022 12:30:41.696275982 CET;192.168.1.102;192.168.1.104;49330;1883;74;49330 → 1883 [SYN] Seq=0 Win=42340 Len=0 MSS=1460 SACK_PERM=1 TSval=1794966927 TSecr=0 WS=512;
391;Jan 13, 2022 12:30:41.950421341 CET;192.168.1.104;192.168.1.102;1883;49330;58;1883 → 49330 [SYN, ACK] Seq=0 Ack=1 Win=8192 Len=0 MSS=1460;
392;Jan 13, 2022 12:30:41.950452097 CET;192.168.1.102;192.168.1.104;49330;1883;54;49330 → 1883 [ACK] Seq=1 Ack=1 Win=42340 Len=0;
393;Jan 13, 2022 12:30:41.950496447 CET;192.168.1.102;192.168.1.104;49330;1883;108;Connect Command;
394;Jan 13, 2022 12:30:42.717387933 CET;192.168.1.102;192.168.1.104;49330;1883;108;[TCP Retransmission] 49330 → 1883 [PSH, ACK] Seq=1 Ack=1 Win=42340 Len=54;
395;Jan 13, 2022 12:30:42.972204824 CET;192.168.1.104;192.168.1.102;1883;49330;54;1883 → 49330 [ACK] Seq=1 Ack=55 Win=8192 Len=0;
396;Jan 13, 2022 12:30:42.974255829 CET;192.168.1.104;192.168.1.102;1883;49330;58;Connect Ack;
397;Jan 13, 2022 12:30:42.974273121 CET;192.168.1.102;192.168.1.104;49330;1883;54;49330 → 1883 [ACK] Seq=55 Ack=5 Win=42336 Len=0;
398;Jan 13, 2022 12:30:42.974321169 CET;192.168.1.102;192.168.1.104;49330;1883;73;Publish Message [topic];message031
399;Jan 13, 2022 12:30:42.974336573 CET;192.168.1.102;192.168.1.104;49330;1883;56;Disconnect Req;
400;Jan 13, 2022 12:30:44.509553473 CET;192.168.1.102;192.168.1.104;49330;1883;75;[TCP Retransmission] 49330 → 1883 [FIN, PSH, ACK] Seq=55 Ack=5 Win=42336 Len=21;
401;Jan 13, 2022 12:30:44.763784610 CET;192.168.1.104;192.168.1.102;1883;49330;54;1883 → 49330 [FIN, ACK] Seq=5 Ack=77 Win=8192 Len=0;
402;Jan 13, 2022 12:30:44.763808683 CET;192.168.1.102;192.168.1.104;49330;1883;54;49330 → 1883 [ACK] Seq=77 Ack=6 Win=42335 Len=0;
403;Jan 13, 2022 12:30:47.983812628 CET;192.168.1.102;192.168.1.104;49332;1883;74;49332 → 1883 [SYN] Seq=0 Win=42340 Len=0 MSS=1460 SACK_PERM=1 TSval=1794973215 TSecr=0 WS=512;
404;Jan 13, 2022 12:30:48.238224290 CET;192.168.1.104;192.168.1.102;1883;49332;58;1883 → 49332 [SYN, ACK] Seq=0 Ack=1 Win=8192 Len=0 MSS=1460;
405;Jan 13, 2022 12:30:48.238253141 CET;192.168.1.102;192.168.1.104;49332;1883;54;49332 → 1883 [ACK] Seq=1 Ack=1 Win=42340 Len=0;
406;Jan 13, 2022 12:30:48.238297412 CET;192.168.1.102;192.168.1.104;49332;1883;108;Connect Command;
407;Jan 13, 2022 12:30:49.021376237 CET;192.168.1.102;192.168.1.104;49332;1883;108;[TCP Retransmission] 49332 → 1883 [PSH, ACK] Seq=1 Ack=1 Win=42340 Len=54;
408;Jan 13, 2022 12:30:49.276289665 CET;192.168.1.104;192.168.1.102;1883;49332;54;1883 → 49332 [ACK] Seq=1 Ack=55 Win=8192 Len=0;
409;Jan 13, 2022 12:30:49.278098718 CET;192.168.1.104;192.168.1.102;1883;49332;58;Connect Ack;
410;Jan 13, 2022 12:30:49.278151705 CET;192.168.1.102;192.168.1.104;49332;1883;54;49332 → 1883 [ACK] Seq=55 Ack=5 Win=42336 Len=0;
411;Jan 13, 2022 12:30:49.278343152 CET;192.168.1.102;192.168.1.104;49332;1883;73;Publish Message [topic];message032
412;Jan 13, 2022 12:30:49.278400052 CET;192.168.1.102;192.168.1.104;49332;1883;56;Disconnect Req;
413;Jan 13, 2022 12:30:50.813348726 CET;192.168.1.102;192.168.1.104;49332;1883;75;[TCP Retransmission] 49332 → 1883 [FIN, PSH, ACK] Seq=55 Ack=5 Win=42336 Len=21;
414;Jan 13, 2022 12:30:51.086290264 CET;192.168.1.104;192.168.1.102;1883;49332;54;1883 → 49332 [FIN, ACK] Seq=5 Ack=77 Win=8192 Len=0;
415;Jan 13, 2022 12:30:51.086361165 CET;192.168.1.102;192.168.1.104;49332;1883;54;49332 → 1883 [ACK] Seq=77 Ack=6 Win=42335 Len=0;
416;Jan 13, 2022 12:30:54.286924454 CET;192.168.1.102;192.168.1.104;49334;1883;74;49334 → 1883 [SYN] Seq=0 Win=42340 Len=0 MSS=1460 SACK_PERM=1 TSval=1794979518 TSecr=0 WS=512;
417;Jan 13, 2022 12:30:54.544560575 CET;192.168.1.104;192.168.1.102;1883;49334;58;1883 → 49334 [SYN, ACK] Seq=0 Ack=1 Win=8192 Len=0 MSS=1460;
418;Jan 13, 2022 12:30:54.544643171 CET;192.168.1.102;192.168.1.104;49334;1883;54;49334 → 1883 [ACK] Seq=1 Ack=1 Win=42340 Len=0;
419;Jan 13, 2022 12:30:54.544789518 CET;192.168.1.102;192.168.1.104;49334;1883;108;Connect Command;
420;Jan 13, 2022 12:30:55.325359454 CET;192.168.1.102;192.168.1.104;49334;1883;108;[TCP Retransmission] 49334 → 1883 [PSH, ACK] Seq=1 Ack=1 Win=42340 Len=54;
421;Jan 13, 2022 12:30:55.585245328 CET;192.168.1.104;192.168.1.102;1883;49334;54;1883 → 49334 [ACK] Seq=1 Ack=55 Win=8192 Len=0;
422;Jan 13, 2022 12:30:55.592885557 CET;192.168.1.104;192.168.1.102;1883;49334;58;Connect Ack;
423;Jan 13, 2022 12:30:55.592919853 CET;192.168.1.102;192.168.1.104;49334;1883;54;49334 → 1883 [ACK] Seq=55 Ack=5 Win=42336 Len=0;
424;Jan 13, 2022 12:30:55.593046765 CET;192.168.1.102;192.168.1.104;49334;1883;73;Publish Message [topic];message033
425;Jan 13, 2022 12:30:55.593084848 CET;192.168.1.102;192.168.1.104;49334;1883;56;Disconnect Req;
426;Jan 13, 2022 12:30:57.149345235 CET;192.168.1.102;192.168.1.104;49334;1883;75;[TCP Retransmission] 49334 → 1883 [FIN, PSH, ACK] Seq=55 Ack=5 Win=42336 Len=21;
427;Jan 13, 2022 12:30:57.403260958 CET;192.168.1.104;192.168.1.102;1883;49334;54;1883 → 49334 [FIN, ACK] Seq=5 Ack=77 Win=8192 Len=0;
428;Jan 13, 2022 12:30:57.403328330 CET;192.168.1.102;192.168.1.104;49334;1883;54;49334 → 1883 [ACK] Seq=77 Ack=6 Win=42335 Len=0;
429;Jan 13, 2022 12:31:00.599526303 CET;192.168.1.102;192.168.1.104;49336;1883;74;49336 → 1883 [SYN] Seq=0 Win=42340 Len=0 MSS=1460 SACK_PERM=1 TSval=1794985830 TSecr=0 WS=512;
430;Jan 13, 2022 12:31:00.854349926 CET;192.168.1.104;192.168.1.102;1883;49336;58;1883 → 49336 [SYN, ACK] Seq=0 Ack=1 Win=8192 Len=0 MSS=1460;
431;Jan 13, 2022 12:31:00.854400156 CET;192.168.1.102;192.168.1.104;49336;1883;54;49336 → 1883 [ACK] Seq=1 Ack=1 Win=42340 Len=0;
432;Jan 13, 2022 12:31:00.854487195 CET;192.168.1.102;192.168.1.104;49336;1883;108;Connect Command;
433;Jan 13, 2022 12:31:01.629334408 CET;192.168.1.102;192.168.1.104;49336;1883;108;[TCP Retransmission] 49336 → 1883 [PSH, ACK] Seq=1 Ack=1 Win=42340 Len=54;
434;Jan 13, 2022 12:31:01.885874278 CET;192.168.1.104;192.168.1.102;1883;49336;54;1883 → 49336 [ACK] Seq=1 Ack=55 Win=8192 Len=0;
435;Jan 13, 2022 12:31:01.891786403 CET;192.168.1.104;192.168.1.102;1883;49336;58;Connect Ack;
436;Jan 13, 2022 12:31:01.891837504 CET;192.168.1.102;192.168.1.104;49336;1883;54;49336 → 1883 [ACK] Seq=55 Ack=5 Win=42336 Len=0;
437;Jan 13, 2022 12:31:01.892026249 CET;192.168.1.102;192.168.1.104;49336;1883;73;Publish Message [topic];message034
438;Jan 13, 2022 12:31:01.892085366 CET;192.168.1.102;192.168.1.104;49336;1883;56;Disconnect Req;
439;Jan 13, 2022 12:31:03.453400262 CET;192.168.1.102;192.168.1.104;49336;1883;75;[TCP Retransmission] 49336 → 1883 [FIN, PSH, ACK] Seq=55 Ack=5 Win=42336 Len=21;
440;Jan 13, 2022 12:31:03.723589832 CET;192.168.1.104;192.168.1.102;1883;49336;54;1883 → 49336 [FIN, ACK] Seq=5 Ack=77 Win=8192 Len=0;
441;Jan 13, 2022 12:31:03.723652288 CET;192.168.1.102;192.168.1.104;49336;1883;54;49336 → 1883 [ACK] Seq=77 Ack=6 Win=42335 Len=0;
442;Jan 13, 2022 12:31:06.901009737 CET;192.168.1.102;192.168.1.104;49338;1883;74;49338 → 1883 [SYN] Seq=0 Win=42340 Len=0 MSS=1460 SACK_PERM=1 TSval=1794992132 TSecr=0 WS=512;
443;Jan 13, 2022 12:31:07.156037664 CET;192.168.1.104;192.168.1.102;1883;49338;58;1883 → 49338 [SYN, ACK] Seq=0 Ack=1 Win=8192 Len=0 MSS=1460;
444;Jan 13, 2022 12:31:07.156091102 CET;192.168.1.102;192.168.1.104;49338;1883;54;49338 → 1883 [ACK] Seq=1 Ack=1 Win=42340 Len=0;
445;Jan 13, 2022 12:31:07.156182532 CET;192.168.1.102;192.168.1.104;49338;1883;108;Connect Command;
446;Jan 13, 2022 12:31:07.933351156 CET;192.168.1.102;192.168.1.104;49338;1883;108;[TCP Retransmission] 49338 → 1883 [PSH, ACK] Seq=1 Ack=1 Win=42340 Len=54;
447;Jan 13, 2022 12:31:08.205239913 CET;192.168.1.104;192.168.1.102;1883;49338;54;1883 → 49338 [ACK] Seq=1 Ack=55 Win=8192 Len=0;
448;Jan 13, 2022 12:31:08.213060475 CET;192.168.1.104;192.168.1.102;1883;49338;58;Connect Ack;
449;Jan 13, 2022 12:31:08.213111487 CET;192.168.1.102;192.168.1.104;49338;1883;54;49338 → 1883 [ACK] Seq=55 Ack=5 Win=42336 Len=0;
450;Jan 13, 2022 12:31:08.213312971 CET;192.168.1.102;192.168.1.104;49338;1883;73;Publish Message [topic];message035
451;Jan 13, 2022 12:31:08.213370445 CET;192.168.1.102;192.168.1.104;49338;1883;56;Disconnect Req;
452;Jan 13, 2022 12:31:09.757449568 CET;192.168.1.102;192.168.1.104;49338;1883;75;[TCP Retransmission] 49338 → 1883 [FIN, PSH, ACK] Seq=55 Ack=5 Win=42336 Len=21;
453;Jan 13, 2022 12:31:10.014223661 CET;192.168.1.104;192.168.1.102;1883;49338;54;1883 → 49338 [FIN, ACK] Seq=5 Ack=77 Win=8192 Len=0;
454;Jan 13, 2022 12:31:10.014246917 CET;192.168.1.102;192.168.1.104;49338;1883;54;49338 → 1883 [ACK] Seq=77 Ack=6 Win=42335 Len=0;
455;Jan 13, 2022 12:31:13.230178938 CET;192.168.1.102;192.168.1.104;49340;1883;74;49340 → 1883 [SYN] Seq=0 Win=42340 Len=0 MSS=1460 SACK_PERM=1 TSval=1794998461 TSecr=0 WS=512;
456;Jan 13, 2022 12:31:13.483799014 CET;192.168.1.104;192.168.1.102;1883;49340;58;1883 → 49340 [SYN, ACK] Seq=0 Ack=1 Win=8192 Len=0 MSS=1460;
457;Jan 13, 2022 12:31:13.483828701 CET;192.168.1.102;192.168.1.104;49340;1883;54;49340 → 1883 [ACK] Seq=1 Ack=1 Win=42340 Len=0;
458;Jan 13, 2022 12:31:13.483869454 CET;192.168.1.102;192.168.1.104;49340;1883;108;Connect Command;
459;Jan 13, 2022 12:31:14.269342315 CET;192.168.1.102;192.168.1.104;49340;1883;108;[TCP Retransmission] 49340 → 1883 [PSH, ACK] Seq=1 Ack=1 Win=42340 Len=54;
460;Jan 13, 2022 12:31:14.538811411 CET;192.168.1.104;192.168.1.102;1883;49340;54;1883 → 49340 [ACK] Seq=1 Ack=55 Win=8192 Len=0;
461;Jan 13, 2022 12:31:14.541922230 CET;192.168.1.104;192.168.1.102;1883;49340;58;Connect Ack;
462;Jan 13, 2022 12:31:14.541940647 CET;192.168.1.102;192.168.1.104;49340;1883;54;49340 → 1883 [ACK] Seq=55 Ack=5 Win=42336 Len=0;
463;Jan 13, 2022 12:31:14.542003160 CET;192.168.1.102;192.168.1.104;49340;1883;73;Publish Message [topic];message036
464;Jan 13, 2022 12:31:14.542019351 CET;192.168.1.102;192.168.1.104;49340;1883;56;Disconnect Req;
465;Jan 13, 2022 12:31:16.094011788 CET;192.168.1.102;192.168.1.104;49340;1883;75;[TCP Retransmission] 49340 → 1883 [FIN, PSH, ACK] Seq=55 Ack=5 Win=42336 Len=21;
466;Jan 13, 2022 12:31:16.349130807 CET;192.168.1.104;192.168.1.102;1883;49340;54;1883 → 49340 [FIN, ACK] Seq=5 Ack=77 Win=8192 Len=0;
467;Jan 13, 2022 12:31:16.349193646 CET;192.168.1.102;192.168.1.104;49340;1883;54;49340 → 1883 [ACK] Seq=77 Ack=6 Win=42335 Len=0;
468;Jan 13, 2022 12:31:19.550585088 CET;192.168.1.102;192.168.1.104;49342;1883;74;49342 → 1883 [SYN] Seq=0 Win=42340 Len=0 MSS=1460 SACK_PERM=1 TSval=1795004781 TSecr=0 WS=512;
469;Jan 13, 2022 12:31:19.806335233 CET;192.168.1.104;192.168.1.102;1883;49342;58;1883 → 49342 [SYN, ACK] Seq=0 Ack=1 Win=8192 Len=0 MSS=1460;
470;Jan 13, 2022 12:31:19.806362908 CET;192.168.1.102;192.168.1.104;49342;1883;54;49342 → 1883 [ACK] Seq=1 Ack=1 Win=42340 Len=0;
471;Jan 13, 2022 12:31:19.806404524 CET;192.168.1.102;192.168.1.104;49342;1883;108;Connect Command;
472;Jan 13, 2022 12:31:20.605357424 CET;192.168.1.102;192.168.1.104;49342;1883;108;[TCP Retransmission] 49342 → 1883 [PSH, ACK] Seq=1 Ack=1 Win=42340 Len=54;
473;Jan 13, 2022 12:31:20.875316892 CET;192.168.1.104;192.168.1.102;1883;49342;54;1883 → 49342 [ACK] Seq=1 Ack=55 Win=8192 Len=0;
474;Jan 13, 2022 12:31:20.881210137 CET;192.168.1.104;192.168.1.102;1883;49342;58;Connect Ack;
475;Jan 13, 2022 12:31:20.881260745 CET;192.168.1.102;192.168.1.104;49342;1883;54;49342 → 1883 [ACK] Seq=55 Ack=5 Win=42336 Len=0;
476;Jan 13, 2022 12:31:20.881593167 CET;192.168.1.102;192.168.1.104;49342;1883;73;Publish Message [topic];message037
477;Jan 13, 2022 12:31:20.881655541 CET;192.168.1.102;192.168.1.104;49342;1883;56;Disconnect Req;
478;Jan 13, 2022 12:31:22.429356431 CET;192.168.1.102;192.168.1.104;49342;1883;75;[TCP Retransmission] 49342 → 1883 [FIN, PSH, ACK] Seq=55 Ack=5 Win=42336 Len=21;
479;Jan 13, 2022 12:31:22.699183313 CET;192.168.1.104;192.168.1.102;1883;49342;54;1883 → 49342 [FIN, ACK] Seq=5 Ack=77 Win=8192 Len=0;
480;Jan 13, 2022 12:31:22.699231524 CET;192.168.1.102;192.168.1.104;49342;1883;54;49342 → 1883 [ACK] Seq=77 Ack=6 Win=42335 Len=0;
481;Jan 13, 2022 12:31:25.902719508 CET;192.168.1.102;192.168.1.104;49344;1883;74;49344 → 1883 [SYN] Seq=0 Win=42340 Len=0 MSS=1460 SACK_PERM=1 TSval=1795011134 TSecr=0 WS=512;
482;Jan 13, 2022 12:31:26.157932949 CET;192.168.1.104;192.168.1.102;1883;49344;58;1883 → 49344 [SYN, ACK] Seq=0 Ack=1 Win=8192 Len=0 MSS=1460;
483;Jan 13, 2022 12:31:26.158022021 CET;192.168.1.102;192.168.1.104;49344;1883;54;49344 → 1883 [ACK] Seq=1 Ack=1 Win=42340 Len=0;
484;Jan 13, 2022 12:31:26.158188157 CET;192.168.1.102;192.168.1.104;49344;1883;108;Connect Command;
485;Jan 13, 2022 12:31:26.941606808 CET;192.168.1.102;192.168.1.104;49344;1883;108;[TCP Retransmission] 49344 → 1883 [PSH, ACK] Seq=1 Ack=1 Win=42340 Len=54;
486;Jan 13, 2022 12:31:27.196728005 CET;192.168.1.104;192.168.1.102;1883;49344;54;1883 → 49344 [ACK] Seq=1 Ack=55 Win=8192 Len=0;
487;Jan 13, 2022 12:31:27.200540216 CET;192.168.1.104;192.168.1.102;1883;49344;58;Connect Ack;
488;Jan 13, 2022 12:31:27.200585843 CET;192.168.1.102;192.168.1.104;49344;1883;54;49344 → 1883 [ACK] Seq=55 Ack=5 Win=42336 Len=0;
489;Jan 13, 2022 12:31:27.200752795 CET;192.168.1.102;192.168.1.104;49344;1883;73;Publish Message [topic];message038
490;Jan 13, 2022 12:31:27.200802155 CET;192.168.1.102;192.168.1.104;49344;1883;56;Disconnect Req;
491;Jan 13, 2022 12:31:28.765438403 CET;192.168.1.102;192.168.1.104;49344;1883;75;[TCP Retransmission] 49344 → 1883 [FIN, PSH, ACK] Seq=55 Ack=5 Win=42336 Len=21;
492;Jan 13, 2022 12:31:29.034665430 CET;192.168.1.104;192.168.1.102;1883;49344;54;1883 → 49344 [FIN, ACK] Seq=5 Ack=77 Win=8192 Len=0;
493;Jan 13, 2022 12:31:29.034731131 CET;192.168.1.102;192.168.1.104;49344;1883;54;49344 → 1883 [ACK] Seq=77 Ack=6 Win=42335 Len=0;
494;Jan 13, 2022 12:31:32.211181937 CET;192.168.1.102;192.168.1.104;49346;1883;74;49346 → 1883 [SYN] Seq=0 Win=42340 Len=0 MSS=1460 SACK_PERM=1 TSval=1795017442 TSecr=0 WS=512;
495;Jan 13, 2022 12:31:32.732098614 CET;192.168.1.104;192.168.1.102;1883;49346;58;1883 → 49346 [SYN, ACK] Seq=0 Ack=1 Win=8192 Len=0 MSS=1460;
496;Jan 13, 2022 12:31:32.732122934 CET;192.168.1.102;192.168.1.104;49346;1883;54;49346 → 1883 [ACK] Seq=1 Ack=1 Win=42340 Len=0;
497;Jan 13, 2022 12:31:32.732159336 CET;192.168.1.102;192.168.1.104;49346;1883;108;Connect Command;
498;Jan 13, 2022 12:31:34.301352314 CET;192.168.1.102;192.168.1.104;49346;1883;108;[TCP Retransmission] 49346 → 1883 [PSH, ACK] Seq=1 Ack=1 Win=42340 Len=54;
499;Jan 13, 2022 12:31:34.572220297 CET;192.168.1.104;192.168.1.102;1883;49346;54;1883 → 49346 [ACK] Seq=1 Ack=55 Win=8192 Len=0;
500;Jan 13, 2022 12:31:34.579144390 CET;192.168.1.104;192.168.1.102;1883;49346;58;Connect Ack;
501;Jan 13, 2022 12:31:34.579197027 CET;192.168.1.102;192.168.1.104;49346;1883;54;49346 → 1883 [ACK] Seq=55 Ack=5 Win=42336 Len=0;
502;Jan 13, 2022 12:31:34.579468552 CET;192.168.1.102;192.168.1.104;49346;1883;73;Publish Message [topic];message039
503;Jan 13, 2022 12:31:34.579528017 CET;192.168.1.102;192.168.1.104;49346;1883;56;Disconnect Req;
504;Jan 13, 2022 12:31:37.950090175 CET;192.168.1.102;192.168.1.104;49346;1883;75;[TCP Retransmission] 49346 → 1883 [FIN, PSH, ACK] Seq=55 Ack=5 Win=42336 Len=21;
505;Jan 13, 2022 12:31:38.208594793 CET;192.168.1.104;192.168.1.102;1883;49346;54;1883 → 49346 [FIN, ACK] Seq=5 Ack=77 Win=8192 Len=0;
506;Jan 13, 2022 12:31:38.208661347 CET;192.168.1.102;192.168.1.104;49346;1883;54;49346 → 1883 [ACK] Seq=77 Ack=6 Win=42335 Len=0;
507;Jan 13, 2022 12:31:39.586524421 CET;192.168.1.102;192.168.1.104;49348;1883;74;49348 → 1883 [SYN] Seq=0 Win=42340 Len=0 MSS=1460 SACK_PERM=1 TSval=1795024817 TSecr=0 WS=512;
508;Jan 13, 2022 12:31:39.839478496 CET;192.168.1.104;192.168.1.102;1883;49348;58;1883 → 49348 [SYN, ACK] Seq=0 Ack=1 Win=8192 Len=0 MSS=1460;
509;Jan 13, 2022 12:31:39.839506630 CET;192.168.1.102;192.168.1.104;49348;1883;54;49348 → 1883 [ACK] Seq=1 Ack=1 Win=42340 Len=0;
510;Jan 13, 2022 12:31:39.839549768 CET;192.168.1.102;192.168.1.104;49348;1883;108;Connect Command;
511;Jan 13, 2022 12:31:40.605470187 CET;192.168.1.102;192.168.1.104;49348;1883;108;[TCP Retransmission] 49348 → 1883 [PSH, ACK] Seq=1 Ack=1 Win=42340 Len=54;
512;Jan 13, 2022 12:31:40.860201782 CET;192.168.1.104;192.168.1.102;1883;49348;54;1883 → 49348 [ACK] Seq=1 Ack=55 Win=8192 Len=0;
513;Jan 13, 2022 12:31:40.862168974 CET;192.168.1.104;192.168.1.102;1883;49348;58;Connect Ack;
514;Jan 13, 2022 12:31:40.862197209 CET;192.168.1.102;192.168.1.104;49348;1883;54;49348 → 1883 [ACK] Seq=55 Ack=5 Win=42336 Len=0;
515;Jan 13, 2022 12:31:40.862290767 CET;192.168.1.102;192.168.1.104;49348;1883;73;Publish Message [topic];message040
516;Jan 13, 2022 12:31:40.862320294 CET;192.168.1.102;192.168.1.104;49348;1883;56;Disconnect Req;
517;Jan 13, 2022 12:31:42.397406168 CET;192.168.1.102;192.168.1.104;49348;1883;75;[TCP Retransmission] 49348 → 1883 [FIN, PSH, ACK] Seq=55 Ack=5 Win=42336 Len=21;
518;Jan 13, 2022 12:31:42.652546727 CET;192.168.1.104;192.168.1.102;1883;49348;54;1883 → 49348 [FIN, ACK] Seq=5 Ack=77 Win=8192 Len=0;
519;Jan 13, 2022 12:31:42.652615863 CET;192.168.1.102;192.168.1.104;49348;1883;54;49348 → 1883 [ACK] Seq=77 Ack=6 Win=42335 Len=0;
520;Jan 13, 2022 12:31:45.868462082 CET;192.168.1.102;192.168.1.104;49350;1883;74;49350 → 1883 [SYN] Seq=0 Win=42340 Len=0 MSS=1460 SACK_PERM=1 TSval=1795031099 TSecr=0 WS=512;
521;Jan 13, 2022 12:31:46.140584334 CET;192.168.1.104;192.168.1.102;1883;49350;58;1883 → 49350 [SYN, ACK] Seq=0 Ack=1 Win=8192 Len=0 MSS=1460;
522;Jan 13, 2022 12:31:46.140624152 CET;192.168.1.102;192.168.1.104;49350;1883;54;49350 → 1883 [ACK] Seq=1 Ack=1 Win=42340 Len=0;
523;Jan 13, 2022 12:31:46.140707107 CET;192.168.1.102;192.168.1.104;49350;1883;108;Connect Command;
524;Jan 13, 2022 12:31:46.973371821 CET;192.168.1.102;192.168.1.104;49350;1883;108;[TCP Retransmission] 49350 → 1883 [PSH, ACK] Seq=1 Ack=1 Win=42340 Len=54;
525;Jan 13, 2022 12:31:47.247526468 CET;192.168.1.104;192.168.1.102;1883;49350;54;1883 → 49350 [ACK] Seq=1 Ack=55 Win=8192 Len=0;
526;Jan 13, 2022 12:31:47.255929858 CET;192.168.1.104;192.168.1.102;1883;49350;58;Connect Ack;
527;Jan 13, 2022 12:31:47.255944924 CET;192.168.1.102;192.168.1.104;49350;1883;54;49350 → 1883 [ACK] Seq=55 Ack=5 Win=42336 Len=0;
528;Jan 13, 2022 12:31:47.256007059 CET;192.168.1.102;192.168.1.104;49350;1883;73;Publish Message [topic];message041
529;Jan 13, 2022 12:31:47.256024405 CET;192.168.1.102;192.168.1.104;49350;1883;56;Disconnect Req;
530;Jan 13, 2022 12:31:48.925347572 CET;192.168.1.102;192.168.1.104;49350;1883;75;[TCP Retransmission] 49350 → 1883 [FIN, PSH, ACK] Seq=55 Ack=5 Win=42336 Len=21;
531;Jan 13, 2022 12:31:49.205122589 CET;192.168.1.104;192.168.1.102;1883;49350;54;1883 → 49350 [FIN, ACK] Seq=5 Ack=77 Win=8192 Len=0;
532;Jan 13, 2022 12:31:49.205147815 CET;192.168.1.102;192.168.1.104;49350;1883;54;49350 → 1883 [ACK] Seq=77 Ack=6 Win=42335 Len=0;
533;Jan 13, 2022 12:31:52.260137776 CET;192.168.1.102;192.168.1.104;49352;1883;74;49352 → 1883 [SYN] Seq=0 Win=42340 Len=0 MSS=1460 SACK_PERM=1 TSval=1795037491 TSecr=0 WS=512;
534;Jan 13, 2022 12:31:52.537561964 CET;192.168.1.104;192.168.1.102;1883;49352;58;1883 → 49352 [SYN, ACK] Seq=0 Ack=1 Win=8192 Len=0 MSS=1460;
535;Jan 13, 2022 12:31:52.537609891 CET;192.168.1.102;192.168.1.104;49352;1883;54;49352 → 1883 [ACK] Seq=1 Ack=1 Win=42340 Len=0;
536;Jan 13, 2022 12:31:52.537677795 CET;192.168.1.102;192.168.1.104;49352;1883;108;Connect Command;
537;Jan 13, 2022 12:31:53.406213281 CET;192.168.1.102;192.168.1.104;49352;1883;108;[TCP Retransmission] 49352 → 1883 [PSH, ACK] Seq=1 Ack=1 Win=42340 Len=54;
538;Jan 13, 2022 12:31:53.662012792 CET;192.168.1.104;192.168.1.102;1883;49352;54;1883 → 49352 [ACK] Seq=1 Ack=55 Win=8192 Len=0;
539;Jan 13, 2022 12:31:53.665921287 CET;192.168.1.104;192.168.1.102;1883;49352;58;Connect Ack;
540;Jan 13, 2022 12:31:53.665951336 CET;192.168.1.102;192.168.1.104;49352;1883;54;49352 → 1883 [ACK] Seq=55 Ack=5 Win=42336 Len=0;
541;Jan 13, 2022 12:31:53.666030562 CET;192.168.1.102;192.168.1.104;49352;1883;73;Publish Message [topic];message042
542;Jan 13, 2022 12:31:53.666053543 CET;192.168.1.102;192.168.1.104;49352;1883;56;Disconnect Req;
543;Jan 13, 2022 12:31:55.357353955 CET;192.168.1.102;192.168.1.104;49352;1883;75;[TCP Retransmission] 49352 → 1883 [FIN, PSH, ACK] Seq=55 Ack=5 Win=42336 Len=21;
544;Jan 13, 2022 12:31:55.611359161 CET;192.168.1.104;192.168.1.102;1883;49352;54;1883 → 49352 [FIN, ACK] Seq=5 Ack=77 Win=8192 Len=0;
545;Jan 13, 2022 12:31:55.611382177 CET;192.168.1.102;192.168.1.104;49352;1883;54;49352 → 1883 [ACK] Seq=77 Ack=6 Win=42335 Len=0;
546;Jan 13, 2022 12:31:58.671217789 CET;192.168.1.102;192.168.1.104;49354;1883;74;49354 → 1883 [SYN] Seq=0 Win=42340 Len=0 MSS=1460 SACK_PERM=1 TSval=1795043902 TSecr=0 WS=512;
547;Jan 13, 2022 12:31:58.925747418 CET;192.168.1.104;192.168.1.102;1883;49354;58;1883 → 49354 [SYN, ACK] Seq=0 Ack=1 Win=8192 Len=0 MSS=1460;
548;Jan 13, 2022 12:31:58.925837513 CET;192.168.1.102;192.168.1.104;49354;1883;54;49354 → 1883 [ACK] Seq=1 Ack=1 Win=42340 Len=0;
549;Jan 13, 2022 12:31:58.925992586 CET;192.168.1.102;192.168.1.104;49354;1883;108;Connect Command;
550;Jan 13, 2022 12:31:59.709354561 CET;192.168.1.102;192.168.1.104;49354;1883;108;[TCP Retransmission] 49354 → 1883 [PSH, ACK] Seq=1 Ack=1 Win=42340 Len=54;
551;Jan 13, 2022 12:31:59.979021751 CET;192.168.1.104;192.168.1.102;1883;49354;54;1883 → 49354 [ACK] Seq=1 Ack=55 Win=8192 Len=0;
552;Jan 13, 2022 12:31:59.985777404 CET;192.168.1.104;192.168.1.102;1883;49354;58;Connect Ack;
553;Jan 13, 2022 12:31:59.985797920 CET;192.168.1.102;192.168.1.104;49354;1883;54;49354 → 1883 [ACK] Seq=55 Ack=5 Win=42336 Len=0;
554;Jan 13, 2022 12:31:59.985851981 CET;192.168.1.102;192.168.1.104;49354;1883;73;Publish Message [topic];message043
555;Jan 13, 2022 12:31:59.985872387 CET;192.168.1.102;192.168.1.104;49354;1883;56;Disconnect Req;
556;Jan 13, 2022 12:32:01.534149852 CET;192.168.1.102;192.168.1.104;49354;1883;75;[TCP Retransmission] 49354 → 1883 [FIN, PSH, ACK] Seq=55 Ack=5 Win=42336 Len=21;
557;Jan 13, 2022 12:32:01.792889500 CET;192.168.1.104;192.168.1.102;1883;49354;54;1883 → 49354 [FIN, ACK] Seq=5 Ack=77 Win=8192 Len=0;
558;Jan 13, 2022 12:32:01.792916501 CET;192.168.1.102;192.168.1.104;49354;1883;54;49354 → 1883 [ACK] Seq=77 Ack=6 Win=42335 Len=0;
559;Jan 13, 2022 12:32:04.991431069 CET;192.168.1.102;192.168.1.104;49356;1883;74;49356 → 1883 [SYN] Seq=0 Win=42340 Len=0 MSS=1460 SACK_PERM=1 TSval=1795050222 TSecr=0 WS=512;
560;Jan 13, 2022 12:32:05.247928673 CET;192.168.1.104;192.168.1.102;1883;49356;58;1883 → 49356 [SYN, ACK] Seq=0 Ack=1 Win=8192 Len=0 MSS=1460;
561;Jan 13, 2022 12:32:05.247964640 CET;192.168.1.102;192.168.1.104;49356;1883;54;49356 → 1883 [ACK] Seq=1 Ack=1 Win=42340 Len=0;
562;Jan 13, 2022 12:32:05.248023376 CET;192.168.1.102;192.168.1.104;49356;1883;108;Connect Command;
563;Jan 13, 2022 12:32:06.045610147 CET;192.168.1.102;192.168.1.104;49356;1883;108;[TCP Retransmission] 49356 → 1883 [PSH, ACK] Seq=1 Ack=1 Win=42340 Len=54;
564;Jan 13, 2022 12:32:06.299511732 CET;192.168.1.104;192.168.1.102;1883;49356;54;1883 → 49356 [ACK] Seq=1 Ack=55 Win=8192 Len=0;
565;Jan 13, 2022 12:32:06.301516626 CET;192.168.1.104;192.168.1.102;1883;49356;58;Connect Ack;
566;Jan 13, 2022 12:32:06.301536643 CET;192.168.1.102;192.168.1.104;49356;1883;54;49356 → 1883 [ACK] Seq=55 Ack=5 Win=42336 Len=0;
567;Jan 13, 2022 12:32:06.301613279 CET;192.168.1.102;192.168.1.104;49356;1883;73;Publish Message [topic];message044
568;Jan 13, 2022 12:32:06.301631046 CET;192.168.1.102;192.168.1.104;49356;1883;56;Disconnect Req;
569;Jan 13, 2022 12:32:07.869549181 CET;192.168.1.102;192.168.1.104;49356;1883;75;[TCP Retransmission] 49356 → 1883 [FIN, PSH, ACK] Seq=55 Ack=5 Win=42336 Len=21;
570;Jan 13, 2022 12:32:08.123511680 CET;192.168.1.104;192.168.1.102;1883;49356;54;1883 → 49356 [FIN, ACK] Seq=5 Ack=77 Win=8192 Len=0;
571;Jan 13, 2022 12:32:08.123534232 CET;192.168.1.102;192.168.1.104;49356;1883;54;49356 → 1883 [ACK] Seq=77 Ack=6 Win=42335 Len=0;
572;Jan 13, 2022 12:32:11.305780472 CET;192.168.1.102;192.168.1.104;49358;1883;74;49358 → 1883 [SYN] Seq=0 Win=42340 Len=0 MSS=1460 SACK_PERM=1 TSval=1795056537 TSecr=0 WS=512;
573;Jan 13, 2022 12:32:11.560919067 CET;192.168.1.104;192.168.1.102;1883;49358;58;1883 → 49358 [SYN, ACK] Seq=0 Ack=1 Win=8192 Len=0 MSS=1460;
574;Jan 13, 2022 12:32:11.560967420 CET;192.168.1.102;192.168.1.104;49358;1883;54;49358 → 1883 [ACK] Seq=1 Ack=1 Win=42340 Len=0;
575;Jan 13, 2022 12:32:11.561035982 CET;192.168.1.102;192.168.1.104;49358;1883;108;Connect Command;
576;Jan 13, 2022 12:32:12.349473764 CET;192.168.1.102;192.168.1.104;49358;1883;108;[TCP Retransmission] 49358 → 1883 [PSH, ACK] Seq=1 Ack=1 Win=42340 Len=54;
577;Jan 13, 2022 12:32:12.604215005 CET;192.168.1.104;192.168.1.102;1883;49358;54;1883 → 49358 [ACK] Seq=1 Ack=55 Win=8192 Len=0;
578;Jan 13, 2022 12:32:12.608112051 CET;192.168.1.104;192.168.1.102;1883;49358;58;Connect Ack;
579;Jan 13, 2022 12:32:12.608138926 CET;192.168.1.102;192.168.1.104;49358;1883;54;49358 → 1883 [ACK] Seq=55 Ack=5 Win=42336 Len=0;
580;Jan 13, 2022 12:32:12.608222597 CET;192.168.1.102;192.168.1.104;49358;1883;73;Publish Message [topic];message045
581;Jan 13, 2022 12:32:12.608243436 CET;192.168.1.102;192.168.1.104;49358;1883;56;Disconnect Req;
582;Jan 13, 2022 12:32:14.173654335 CET;192.168.1.102;192.168.1.104;49358;1883;75;[TCP Retransmission] 49358 → 1883 [FIN, PSH, ACK] Seq=55 Ack=5 Win=42336 Len=21;
583;Jan 13, 2022 12:32:14.427898730 CET;192.168.1.104;192.168.1.102;1883;49358;54;1883 → 49358 [FIN, ACK] Seq=5 Ack=77 Win=8192 Len=0;
584;Jan 13, 2022 12:32:14.427923819 CET;192.168.1.102;192.168.1.104;49358;1883;54;49358 → 1883 [ACK] Seq=77 Ack=6 Win=42335 Len=0;
585;Jan 13, 2022 12:32:17.613009755 CET;192.168.1.102;192.168.1.104;49360;1883;74;49360 → 1883 [SYN] Seq=0 Win=42340 Len=0 MSS=1460 SACK_PERM=1 TSval=1795062844 TSecr=0 WS=512;
586;Jan 13, 2022 12:32:17.867448539 CET;192.168.1.104;192.168.1.102;1883;49360;58;1883 → 49360 [SYN, ACK] Seq=0 Ack=1 Win=8192 Len=0 MSS=1460;
587;Jan 13, 2022 12:32:17.867539276 CET;192.168.1.102;192.168.1.104;49360;1883;54;49360 → 1883 [ACK] Seq=1 Ack=1 Win=42340 Len=0;
588;Jan 13, 2022 12:32:17.867704893 CET;192.168.1.102;192.168.1.104;49360;1883;108;Connect Command;
589;Jan 13, 2022 12:32:18.653850631 CET;192.168.1.102;192.168.1.104;49360;1883;108;[TCP Retransmission] 49360 → 1883 [PSH, ACK] Seq=1 Ack=1 Win=42340 Len=54;
590;Jan 13, 2022 12:32:18.909853260 CET;192.168.1.104;192.168.1.102;1883;49360;54;1883 → 49360 [ACK] Seq=1 Ack=55 Win=8192 Len=0;
591;Jan 13, 2022 12:32:18.916289123 CET;192.168.1.104;192.168.1.102;1883;49360;58;Connect Ack;
592;Jan 13, 2022 12:32:18.916306670 CET;192.168.1.102;192.168.1.104;49360;1883;54;49360 → 1883 [ACK] Seq=55 Ack=5 Win=42336 Len=0;
593;Jan 13, 2022 12:32:18.916363521 CET;192.168.1.102;192.168.1.104;49360;1883;73;Publish Message [topic];message046
594;Jan 13, 2022 12:32:18.916378308 CET;192.168.1.102;192.168.1.104;49360;1883;56;Disconnect Req;
595;Jan 13, 2022 12:32:20.445339963 CET;192.168.1.102;192.168.1.104;49360;1883;75;[TCP Retransmission] 49360 → 1883 [FIN, PSH, ACK] Seq=55 Ack=5 Win=42336 Len=21;
596;Jan 13, 2022 12:32:20.699787404 CET;192.168.1.104;192.168.1.102;1883;49360;54;1883 → 49360 [FIN, ACK] Seq=5 Ack=77 Win=8192 Len=0;
597;Jan 13, 2022 12:32:20.699810004 CET;192.168.1.102;192.168.1.104;49360;1883;54;49360 → 1883 [ACK] Seq=77 Ack=6 Win=42335 Len=0;
598;Jan 13, 2022 12:32:23.924812265 CET;192.168.1.102;192.168.1.104;49362;1883;74;49362 → 1883 [SYN] Seq=0 Win=42340 Len=0 MSS=1460 SACK_PERM=1 TSval=1795069156 TSecr=0 WS=512;
599;Jan 13, 2022 12:32:24.193020065 CET;192.168.1.104;192.168.1.102;1883;49362;58;1883 → 49362 [SYN, ACK] Seq=0 Ack=1 Win=8192 Len=0 MSS=1460;
600;Jan 13, 2022 12:32:24.193109162 CET;192.168.1.102;192.168.1.104;49362;1883;54;49362 → 1883 [ACK] Seq=1 Ack=1 Win=42340 Len=0;
601;Jan 13, 2022 12:32:24.193263239 CET;192.168.1.102;192.168.1.104;49362;1883;108;Connect Command;
602;Jan 13, 2022 12:32:25.021422081 CET;192.168.1.102;192.168.1.104;49362;1883;108;[TCP Retransmission] 49362 → 1883 [PSH, ACK] Seq=1 Ack=1 Win=42340 Len=54;
603;Jan 13, 2022 12:32:25.293517516 CET;192.168.1.104;192.168.1.102;1883;49362;54;1883 → 49362 [ACK] Seq=1 Ack=55 Win=8192 Len=0;
604;Jan 13, 2022 12:32:25.298589199 CET;192.168.1.104;192.168.1.102;1883;49362;58;Connect Ack;
605;Jan 13, 2022 12:32:25.298613285 CET;192.168.1.102;192.168.1.104;49362;1883;54;49362 → 1883 [ACK] Seq=55 Ack=5 Win=42336 Len=0;
606;Jan 13, 2022 12:32:25.298705991 CET;192.168.1.102;192.168.1.104;49362;1883;73;Publish Message [topic];message047
607;Jan 13, 2022 12:32:25.298731241 CET;192.168.1.102;192.168.1.104;49362;1883;56;Disconnect Req;
608;Jan 13, 2022 12:32:26.941358591 CET;192.168.1.102;192.168.1.104;49362;1883;75;[TCP Retransmission] 49362 → 1883 [FIN, PSH, ACK] Seq=55 Ack=5 Win=42336 Len=21;
609;Jan 13, 2022 12:32:27.195841345 CET;192.168.1.104;192.168.1.102;1883;49362;54;1883 → 49362 [FIN, ACK] Seq=5 Ack=77 Win=8192 Len=0;
610;Jan 13, 2022 12:32:27.195866486 CET;192.168.1.102;192.168.1.104;49362;1883;54;49362 → 1883 [ACK] Seq=77 Ack=6 Win=42335 Len=0;
611;Jan 13, 2022 12:32:30.303901094 CET;192.168.1.102;192.168.1.104;49364;1883;74;49364 → 1883 [SYN] Seq=0 Win=42340 Len=0 MSS=1460 SACK_PERM=1 TSval=1795075535 TSecr=0 WS=512;
612;Jan 13, 2022 12:32:30.574051237 CET;192.168.1.104;192.168.1.102;1883;49364;58;1883 → 49364 [SYN, ACK] Seq=0 Ack=1 Win=8192 Len=0 MSS=1460;
613;Jan 13, 2022 12:32:30.574195138 CET;192.168.1.102;192.168.1.104;49364;1883;54;49364 → 1883 [ACK] Seq=1 Ack=1 Win=42340 Len=0;
614;Jan 13, 2022 12:32:30.574366208 CET;192.168.1.102;192.168.1.104;49364;1883;108;Connect Command;
615;Jan 13, 2022 12:32:31.389377423 CET;192.168.1.102;192.168.1.104;49364;1883;108;[TCP Retransmission] 49364 → 1883 [PSH, ACK] Seq=1 Ack=1 Win=42340 Len=54;
616;Jan 13, 2022 12:32:31.645165522 CET;192.168.1.104;192.168.1.102;1883;49364;54;1883 → 49364 [ACK] Seq=1 Ack=55 Win=8192 Len=0;
617;Jan 13, 2022 12:32:31.650285753 CET;192.168.1.104;192.168.1.102;1883;49364;58;Connect Ack;
618;Jan 13, 2022 12:32:31.650321371 CET;192.168.1.102;192.168.1.104;49364;1883;54;49364 → 1883 [ACK] Seq=55 Ack=5 Win=42336 Len=0;
619;Jan 13, 2022 12:32:31.650461480 CET;192.168.1.102;192.168.1.104;49364;1883;73;Publish Message [topic];message048
620;Jan 13, 2022 12:32:31.650508658 CET;192.168.1.102;192.168.1.104;49364;1883;56;Disconnect Req;
621;Jan 13, 2022 12:32:33.277383405 CET;192.168.1.102;192.168.1.104;49364;1883;75;[TCP Retransmission] 49364 → 1883 [FIN, PSH, ACK] Seq=55 Ack=5 Win=42336 Len=21;
622;Jan 13, 2022 12:32:33.531024136 CET;192.168.1.104;192.168.1.102;1883;49364;54;1883 → 49364 [FIN, ACK] Seq=5 Ack=77 Win=8192 Len=0;
623;Jan 13, 2022 12:32:33.531067584 CET;192.168.1.102;192.168.1.104;49364;1883;54;49364 → 1883 [ACK] Seq=77 Ack=6 Win=42335 Len=0;
624;Jan 13, 2022 12:32:36.661191106 CET;192.168.1.102;192.168.1.104;49366;1883;74;49366 → 1883 [SYN] Seq=0 Win=42340 Len=0 MSS=1460 SACK_PERM=1 TSval=1795081892 TSecr=0 WS=512;
625;Jan 13, 2022 12:32:36.932386266 CET;192.168.1.104;192.168.1.102;1883;49366;58;1883 → 49366 [SYN, ACK] Seq=0 Ack=1 Win=8192 Len=0 MSS=1460;
626;Jan 13, 2022 12:32:36.932437429 CET;192.168.1.102;192.168.1.104;49366;1883;54;49366 → 1883 [ACK] Seq=1 Ack=1 Win=42340 Len=0;
627;Jan 13, 2022 12:32:36.932510774 CET;192.168.1.102;192.168.1.104;49366;1883;108;Connect Command;
628;Jan 13, 2022 12:32:37.757790668 CET;192.168.1.102;192.168.1.104;49366;1883;108;[TCP Retransmission] 49366 → 1883 [PSH, ACK] Seq=1 Ack=1 Win=42340 Len=54;
629;Jan 13, 2022 12:32:38.014905733 CET;192.168.1.104;192.168.1.102;1883;49366;54;1883 → 49366 [ACK] Seq=1 Ack=55 Win=8192 Len=0;
630;Jan 13, 2022 12:32:38.021584436 CET;192.168.1.104;192.168.1.102;1883;49366;58;Connect Ack;
631;Jan 13, 2022 12:32:38.021604675 CET;192.168.1.102;192.168.1.104;49366;1883;54;49366 → 1883 [ACK] Seq=55 Ack=5 Win=42336 Len=0;
632;Jan 13, 2022 12:32:38.021706730 CET;192.168.1.102;192.168.1.104;49366;1883;73;Publish Message [topic];message049
633;Jan 13, 2022 12:32:38.021731823 CET;192.168.1.102;192.168.1.104;49366;1883;56;Disconnect Req;
634;Jan 13, 2022 12:32:39.677554289 CET;192.168.1.102;192.168.1.104;49366;1883;75;[TCP Retransmission] 49366 → 1883 [FIN, PSH, ACK] Seq=55 Ack=5 Win=42336 Len=21;
635;Jan 13, 2022 12:32:39.931933127 CET;192.168.1.104;192.168.1.102;1883;49366;54;1883 → 49366 [FIN, ACK] Seq=5 Ack=77 Win=8192 Len=0;
636;Jan 13, 2022 12:32:39.931968514 CET;192.168.1.102;192.168.1.104;49366;1883;54;49366 → 1883 [ACK] Seq=77 Ack=6 Win=42335 Len=0;
637;Jan 13, 2022 12:32:43.027857505 CET;192.168.1.102;192.168.1.104;49368;1883;74;49368 → 1883 [SYN] Seq=0 Win=42340 Len=0 MSS=1460 SACK_PERM=1 TSval=1795088259 TSecr=0 WS=512;
638;Jan 13, 2022 12:32:43.302208083 CET;192.168.1.104;192.168.1.102;1883;49368;58;1883 → 49368 [SYN, ACK] Seq=0 Ack=1 Win=8192 Len=0 MSS=1460;
639;Jan 13, 2022 12:32:43.302264889 CET;192.168.1.102;192.168.1.104;49368;1883;54;49368 → 1883 [ACK] Seq=1 Ack=1 Win=42340 Len=0;
640;Jan 13, 2022 12:32:43.302356001 CET;192.168.1.102;192.168.1.104;49368;1883;108;Connect Command;
1;Jan 13, 2022 12:27:16.893412540 CET;192.168.1.103;192.168.1.104;45652;1883;66;Subscribe Request (id=1) [topic];
2;Jan 13, 2022 12:27:16.912585362 CET;192.168.1.104;192.168.1.103;1883;45652;54;1883 → 45652 [ACK] Seq=1 Ack=13 Win=8192 Len=0;
3;Jan 13, 2022 12:27:16.917974337 CET;192.168.1.104;192.168.1.103;1883;45652;59;Subscribe Ack (id=1);
4;Jan 13, 2022 12:27:16.917997550 CET;192.168.1.103;192.168.1.104;45652;1883;54;45652 → 1883 [ACK] Seq=13 Ack=6 Win=42331 Len=0;
5;Jan 13, 2022 12:27:39.747475334 CET;192.168.1.104;192.168.1.103;1883;45652;73;Publish Message [topic];message001
6;Jan 13, 2022 12:27:39.747491486 CET;192.168.1.103;192.168.1.104;45652;1883;54;45652 → 1883 [ACK] Seq=13 Ack=25 Win=42312 Len=0;
7;Jan 13, 2022 12:27:40.381372022 CET;192.168.1.103;192.168.1.104;45630;1883;54;45630 → 1883 [FIN, ACK] Seq=1 Ack=1 Win=42331 Len=0;
8;Jan 13, 2022 12:27:41.634422832 CET;192.168.1.104;192.168.1.103;1883;45652;73;Publish Message [topic];message002
9;Jan 13, 2022 12:27:41.634438158 CET;192.168.1.103;192.168.1.104;45652;1883;54;45652 → 1883 [ACK] Seq=13 Ack=44 Win=42293 Len=0;
10;Jan 13, 2022 12:27:47.857058894 CET;192.168.1.104;192.168.1.103;1883;45652;73;Publish Message [topic];message003
11;Jan 13, 2022 12:27:47.857069775 CET;192.168.1.103;192.168.1.104;45652;1883;54;45652 → 1883 [ACK] Seq=13 Ack=63 Win=42274 Len=0;
12;Jan 13, 2022 12:27:54.188869723 CET;192.168.1.104;192.168.1.103;1883;45652;73;Publish Message [topic];message004
13;Jan 13, 2022 12:27:54.188886097 CET;192.168.1.103;192.168.1.104;45652;1883;54;45652 → 1883 [ACK] Seq=13 Ack=82 Win=42255 Len=0;
14;Jan 13, 2022 12:28:00.514104561 CET;192.168.1.104;192.168.1.103;1883;45652;73;Publish Message [topic];message005
15;Jan 13, 2022 12:28:00.514122503 CET;192.168.1.103;192.168.1.104;45652;1883;54;45652 → 1883 [ACK] Seq=13 Ack=101 Win=42236 Len=0;
16;Jan 13, 2022 12:28:06.788826781 CET;192.168.1.104;192.168.1.103;1883;45652;73;Publish Message [topic];message006
17;Jan 13, 2022 12:28:06.788843035 CET;192.168.1.103;192.168.1.104;45652;1883;54;45652 → 1883 [ACK] Seq=13 Ack=120 Win=42217 Len=0;
18;Jan 13, 2022 12:28:13.122137880 CET;192.168.1.104;192.168.1.103;1883;45652;73;Publish Message [topic];message007
19;Jan 13, 2022 12:28:13.122152923 CET;192.168.1.103;192.168.1.104;45652;1883;54;45652 → 1883 [ACK] Seq=13 Ack=139 Win=42217 Len=0;
20;Jan 13, 2022 12:28:16.125957641 CET;192.168.1.103;192.168.1.104;45652;1883;56;Ping Request;
21;Jan 13, 2022 12:28:16.133160461 CET;192.168.1.104;192.168.1.103;1883;45652;54;1883 → 45652 [ACK] Seq=139 Ack=15 Win=8192 Len=0;
22;Jan 13, 2022 12:28:16.135592879 CET;192.168.1.104;192.168.1.103;1883;45652;56;Ping Response;
23;Jan 13, 2022 12:28:16.135599589 CET;192.168.1.103;192.168.1.104;45652;1883;54;45652 → 1883 [ACK] Seq=15 Ack=141 Win=42217 Len=0;
24;Jan 13, 2022 12:28:17.896906157 CET;192.168.1.104;192.168.1.103;1883;45652;73;Publish Message [topic];message008
25;Jan 13, 2022 12:28:17.896925614 CET;192.168.1.103;192.168.1.104;45652;1883;54;45652 → 1883 [ACK] Seq=15 Ack=160 Win=42217 Len=0;
26;Jan 13, 2022 12:28:25.127347500 CET;192.168.1.104;192.168.1.103;1883;45652;73;Publish Message [topic];message009
27;Jan 13, 2022 12:28:25.127365106 CET;192.168.1.103;192.168.1.104;45652;1883;54;45652 → 1883 [ACK] Seq=15 Ack=179 Win=42217 Len=0;
28;Jan 13, 2022 12:28:29.533379781 CET;192.168.1.103;192.168.1.104;45630;1883;54;[TCP Retransmission] 45630 → 1883 [FIN, ACK] Seq=1 Ack=1 Win=42331 Len=0;
29;Jan 13, 2022 12:28:31.352209826 CET;192.168.1.104;192.168.1.103;1883;45652;73;Publish Message [topic];message010
30;Jan 13, 2022 12:28:31.352231203 CET;192.168.1.103;192.168.1.104;45652;1883;54;45652 → 1883 [ACK] Seq=15 Ack=198 Win=42217 Len=0;
31;Jan 13, 2022 12:28:37.656136530 CET;192.168.1.104;192.168.1.103;1883;45652;73;Publish Message [topic];message011
32;Jan 13, 2022 12:28:37.656159268 CET;192.168.1.103;192.168.1.104;45652;1883;54;45652 → 1883 [ACK] Seq=15 Ack=217 Win=42217 Len=0;
33;Jan 13, 2022 12:28:43.992564325 CET;192.168.1.104;192.168.1.103;1883;45652;73;Publish Message [topic];message012
34;Jan 13, 2022 12:28:43.992586877 CET;192.168.1.103;192.168.1.104;45652;1883;54;45652 → 1883 [ACK] Seq=15 Ack=236 Win=42217 Len=0;
35;Jan 13, 2022 12:28:50.308660864 CET;192.168.1.104;192.168.1.103;1883;45652;73;Publish Message [topic];message013
36;Jan 13, 2022 12:28:50.308676015 CET;192.168.1.103;192.168.1.104;45652;1883;54;45652 → 1883 [ACK] Seq=15 Ack=255 Win=42217 Len=0;
37;Jan 13, 2022 12:28:56.578256963 CET;192.168.1.104;192.168.1.103;1883;45652;73;Publish Message [topic];message014
38;Jan 13, 2022 12:28:56.578272018 CET;192.168.1.103;192.168.1.104;45652;1883;54;45652 → 1883 [ACK] Seq=15 Ack=274 Win=42217 Len=0;
39;Jan 13, 2022 12:29:02.904890861 CET;192.168.1.104;192.168.1.103;1883;45652;73;Publish Message [topic];message015
40;Jan 13, 2022 12:29:02.904917999 CET;192.168.1.103;192.168.1.104;45652;1883;54;45652 → 1883 [ACK] Seq=15 Ack=293 Win=42217 Len=0;
41;Jan 13, 2022 12:29:09.224059835 CET;192.168.1.104;192.168.1.103;1883;45652;73;Publish Message [topic];message016
42;Jan 13, 2022 12:29:09.224076867 CET;192.168.1.103;192.168.1.104;45652;1883;54;45652 → 1883 [ACK] Seq=15 Ack=312 Win=42217 Len=0;
43;Jan 13, 2022 12:29:15.556918301 CET;192.168.1.104;192.168.1.103;1883;45652;73;Publish Message [topic];message017
44;Jan 13, 2022 12:29:15.556935717 CET;192.168.1.103;192.168.1.104;45652;1883;54;45652 → 1883 [ACK] Seq=15 Ack=331 Win=42217 Len=0;
45;Jan 13, 2022 12:29:16.558256424 CET;192.168.1.103;192.168.1.104;45652;1883;56;Ping Request;
46;Jan 13, 2022 12:29:16.569483559 CET;192.168.1.104;192.168.1.103;1883;45652;54;1883 → 45652 [ACK] Seq=331 Ack=17 Win=8192 Len=0;
47;Jan 13, 2022 12:29:16.571876271 CET;192.168.1.104;192.168.1.103;1883;45652;56;Ping Response;
48;Jan 13, 2022 12:29:16.571882417 CET;192.168.1.103;192.168.1.104;45652;1883;54;45652 → 1883 [ACK] Seq=17 Ack=333 Win=42217 Len=0;
49;Jan 13, 2022 12:29:21.890939328 CET;192.168.1.104;192.168.1.103;1883;45652;73;Publish Message [topic];message018
50;Jan 13, 2022 12:29:21.890972800 CET;192.168.1.103;192.168.1.104;45652;1883;54;45652 → 1883 [ACK] Seq=17 Ack=352 Win=42217 Len=0;
51;Jan 13, 2022 12:29:28.264692197 CET;192.168.1.104;192.168.1.103;1883;45652;73;Publish Message [topic];message019
52;Jan 13, 2022 12:29:28.264709792 CET;192.168.1.103;192.168.1.104;45652;1883;54;45652 → 1883 [ACK] Seq=17 Ack=371 Win=42217 Len=0;
53;Jan 13, 2022 12:29:37.511686112 CET;192.168.1.104;192.168.1.103;1883;45652;73;Publish Message [topic];message020
54;Jan 13, 2022 12:29:37.511705252 CET;192.168.1.103;192.168.1.104;45652;1883;54;45652 → 1883 [ACK] Seq=17 Ack=390 Win=42217 Len=0;
55;Jan 13, 2022 12:29:42.229713873 CET;192.168.1.104;192.168.1.103;1883;45652;73;Publish Message [topic];message021
56;Jan 13, 2022 12:29:42.229760063 CET;192.168.1.103;192.168.1.104;45652;1883;54;45652 → 1883 [ACK] Seq=17 Ack=409 Win=42217 Len=0;
57;Jan 13, 2022 12:29:48.535449222 CET;192.168.1.104;192.168.1.103;1883;45652;73;Publish Message [topic];message022
58;Jan 13, 2022 12:29:48.535472400 CET;192.168.1.103;192.168.1.104;45652;1883;54;45652 → 1883 [ACK] Seq=17 Ack=428 Win=42217 Len=0;
59;Jan 13, 2022 12:29:54.908373115 CET;192.168.1.104;192.168.1.103;1883;45652;73;Publish Message [topic];message023
60;Jan 13, 2022 12:29:54.908390200 CET;192.168.1.103;192.168.1.104;45652;1883;54;45652 → 1883 [ACK] Seq=17 Ack=447 Win=42217 Len=0;
61;Jan 13, 2022 12:30:01.139021176 CET;192.168.1.104;192.168.1.103;1883;45652;73;Publish Message [topic];message024
62;Jan 13, 2022 12:30:01.139045954 CET;192.168.1.103;192.168.1.104;45652;1883;54;45652 → 1883 [ACK] Seq=17 Ack=466 Win=42217 Len=0;
63;Jan 13, 2022 12:30:07.431681411 CET;192.168.1.104;192.168.1.103;1883;45652;73;Publish Message [topic];message025
64;Jan 13, 2022 12:30:07.431702142 CET;192.168.1.103;192.168.1.104;45652;1883;54;45652 → 1883 [ACK] Seq=17 Ack=485 Win=42217 Len=0;
65;Jan 13, 2022 12:30:13.888969065 CET;192.168.1.104;192.168.1.103;1883;45652;73;Publish Message [topic];message026
66;Jan 13, 2022 12:30:13.888982372 CET;192.168.1.103;192.168.1.104;45652;1883;54;45652 → 1883 [ACK] Seq=17 Ack=504 Win=42217 Len=0;
67;Jan 13, 2022 12:30:15.891372502 CET;192.168.1.103;192.168.1.104;45652;1883;56;Ping Request;
68;Jan 13, 2022 12:30:15.894409279 CET;192.168.1.104;192.168.1.103;1883;45652;54;1883 → 45652 [ACK] Seq=504 Ack=19 Win=8192 Len=0;
69;Jan 13, 2022 12:30:15.896363550 CET;192.168.1.104;192.168.1.103;1883;45652;56;Ping Response;
70;Jan 13, 2022 12:30:15.896369185 CET;192.168.1.103;192.168.1.104;45652;1883;54;45652 → 1883 [ACK] Seq=19 Ack=506 Win=42217 Len=0;
71;Jan 13, 2022 12:30:20.168165256 CET;192.168.1.104;192.168.1.103;1883;45652;73;Publish Message [topic];message027
72;Jan 13, 2022 12:30:20.168182583 CET;192.168.1.103;192.168.1.104;45652;1883;54;45652 → 1883 [ACK] Seq=19 Ack=525 Win=42217 Len=0;
73;Jan 13, 2022 12:30:26.456766889 CET;192.168.1.104;192.168.1.103;1883;45652;73;Publish Message [topic];message028
74;Jan 13, 2022 12:30:26.456780068 CET;192.168.1.103;192.168.1.104;45652;1883;54;45652 → 1883 [ACK] Seq=19 Ack=544 Win=42217 Len=0;
75;Jan 13, 2022 12:30:31.201253495 CET;192.168.1.104;192.168.1.103;1883;45652;73;Publish Message [topic];message029
76;Jan 13, 2022 12:30:31.201267247 CET;192.168.1.103;192.168.1.104;45652;1883;54;45652 → 1883 [ACK] Seq=19 Ack=563 Win=42217 Len=0;
77;Jan 13, 2022 12:30:38.528917625 CET;192.168.1.104;192.168.1.103;1883;45652;73;Publish Message [topic];message030
78;Jan 13, 2022 12:30:38.528932764 CET;192.168.1.103;192.168.1.104;45652;1883;54;45652 → 1883 [ACK] Seq=19 Ack=582 Win=42217 Len=0;
79;Jan 13, 2022 12:30:44.646488905 CET;192.168.1.104;192.168.1.103;1883;45652;73;Publish Message [topic];message031
80;Jan 13, 2022 12:30:44.646523701 CET;192.168.1.103;192.168.1.104;45652;1883;54;45652 → 1883 [ACK] Seq=19 Ack=601 Win=42217 Len=0;
81;Jan 13, 2022 12:30:50.970412659 CET;192.168.1.104;192.168.1.103;1883;45652;73;Publish Message [topic];message032
82;Jan 13, 2022 12:30:50.970434996 CET;192.168.1.103;192.168.1.104;45652;1883;54;45652 → 1883 [ACK] Seq=19 Ack=620 Win=42217 Len=0;
83;Jan 13, 2022 12:30:57.283073505 CET;192.168.1.104;192.168.1.103;1883;45652;73;Publish Message [topic];message033
84;Jan 13, 2022 12:30:57.283091553 CET;192.168.1.103;192.168.1.104;45652;1883;54;45652 → 1883 [ACK] Seq=19 Ack=639 Win=42217 Len=0;
85;Jan 13, 2022 12:31:03.609143860 CET;192.168.1.104;192.168.1.103;1883;45652;73;Publish Message [topic];message034
86;Jan 13, 2022 12:31:03.609170352 CET;192.168.1.103;192.168.1.104;45652;1883;54;45652 → 1883 [ACK] Seq=19 Ack=658 Win=42217 Len=0;
87;Jan 13, 2022 12:31:09.897154945 CET;192.168.1.104;192.168.1.103;1883;45652;73;Publish Message [topic];message035
88;Jan 13, 2022 12:31:09.897175519 CET;192.168.1.103;192.168.1.104;45652;1883;54;45652 → 1883 [ACK] Seq=19 Ack=677 Win=42217 Len=0;
89;Jan 13, 2022 12:31:15.903392494 CET;192.168.1.103;192.168.1.104;45652;1883;56;Ping Request;
90;Jan 13, 2022 12:31:15.917078388 CET;192.168.1.104;192.168.1.103;1883;45652;54;1883 → 45652 [ACK] Seq=677 Ack=21 Win=8192 Len=0;
91;Jan 13, 2022 12:31:15.923203717 CET;192.168.1.104;192.168.1.103;1883;45652;56;Ping Response;
92;Jan 13, 2022 12:31:15.923216182 CET;192.168.1.103;192.168.1.104;45652;1883;54;45652 → 1883 [ACK] Seq=21 Ack=679 Win=42217 Len=0;
93;Jan 13, 2022 12:31:16.231393536 CET;192.168.1.104;192.168.1.103;1883;45652;73;Publish Message [topic];message036
94;Jan 13, 2022 12:31:16.231423264 CET;192.168.1.103;192.168.1.104;45652;1883;54;45652 → 1883 [ACK] Seq=21 Ack=698 Win=42217 Len=0;
95;Jan 13, 2022 12:31:22.590623931 CET;192.168.1.104;192.168.1.103;1883;45652;73;Publish Message [topic];message037
96;Jan 13, 2022 12:31:22.590633127 CET;192.168.1.103;192.168.1.104;45652;1883;54;45652 → 1883 [ACK] Seq=21 Ack=717 Win=42217 Len=0;
97;Jan 13, 2022 12:31:28.918669013 CET;192.168.1.104;192.168.1.103;1883;45652;73;Publish Message [topic];message038
98;Jan 13, 2022 12:31:28.918687842 CET;192.168.1.103;192.168.1.104;45652;1883;54;45652 → 1883 [ACK] Seq=21 Ack=736 Win=42217 Len=0;
99;Jan 13, 2022 12:31:38.087669334 CET;192.168.1.104;192.168.1.103;1883;45652;73;Publish Message [topic];message039
100;Jan 13, 2022 12:31:38.087692925 CET;192.168.1.103;192.168.1.104;45652;1883;54;45652 → 1883 [ACK] Seq=21 Ack=755 Win=42217 Len=0;
101;Jan 13, 2022 12:31:42.534666348 CET;192.168.1.104;192.168.1.103;1883;45652;73;Publish Message [topic];message040
102;Jan 13, 2022 12:31:42.534687193 CET;192.168.1.103;192.168.1.104;45652;1883;54;45652 → 1883 [ACK] Seq=21 Ack=774 Win=42217 Len=0;
103;Jan 13, 2022 12:31:49.085696339 CET;192.168.1.104;192.168.1.103;1883;45652;73;Publish Message [topic];message041
104;Jan 13, 2022 12:31:49.085712943 CET;192.168.1.103;192.168.1.104;45652;1883;54;45652 → 1883 [ACK] Seq=21 Ack=793 Win=42217 Len=0;
105;Jan 13, 2022 12:31:55.489163603 CET;192.168.1.104;192.168.1.103;1883;45652;73;Publish Message [topic];message042
106;Jan 13, 2022 12:31:55.489178374 CET;192.168.1.103;192.168.1.104;45652;1883;54;45652 → 1883 [ACK] Seq=21 Ack=812 Win=42217 Len=0;
107;Jan 13, 2022 12:32:01.677175328 CET;192.168.1.104;192.168.1.103;1883;45652;73;Publish Message [topic];message043
108;Jan 13, 2022 12:32:01.677196845 CET;192.168.1.103;192.168.1.104;45652;1883;54;45652 → 1883 [ACK] Seq=21 Ack=831 Win=42217 Len=0;
109;Jan 13, 2022 12:32:08.002740762 CET;192.168.1.104;192.168.1.103;1883;45652;73;Publish Message [topic];message044
110;Jan 13, 2022 12:32:08.002757303 CET;192.168.1.103;192.168.1.104;45652;1883;54;45652 → 1883 [ACK] Seq=21 Ack=850 Win=42217 Len=0;
111;Jan 13, 2022 12:32:14.311143262 CET;192.168.1.104;192.168.1.103;1883;45652;73;Publish Message [topic];message045
112;Jan 13, 2022 12:32:14.311165349 CET;192.168.1.103;192.168.1.104;45652;1883;54;45652 → 1883 [ACK] Seq=21 Ack=869 Win=42217 Len=0;
113;Jan 13, 2022 12:32:16.313271113 CET;192.168.1.103;192.168.1.104;45652;1883;56;Ping Request;
114;Jan 13, 2022 12:32:16.316210692 CET;192.168.1.104;192.168.1.103;1883;45652;54;1883 → 45652 [ACK] Seq=869 Ack=23 Win=8192 Len=0;
115;Jan 13, 2022 12:32:16.318442127 CET;192.168.1.104;192.168.1.103;1883;45652;56;Ping Response;
116;Jan 13, 2022 12:32:16.318455063 CET;192.168.1.103;192.168.1.104;45652;1883;54;45652 → 1883 [ACK] Seq=23 Ack=871 Win=42217 Len=0;
117;Jan 13, 2022 12:32:20.578717987 CET;192.168.1.104;192.168.1.103;1883;45652;73;Publish Message [topic];message046
118;Jan 13, 2022 12:32:20.578770067 CET;192.168.1.103;192.168.1.104;45652;1883;54;45652 → 1883 [ACK] Seq=23 Ack=890 Win=42217 Len=0;
119;Jan 13, 2022 12:32:27.072780648 CET;192.168.1.104;192.168.1.103;1883;45652;73;Publish Message [topic];message047
120;Jan 13, 2022 12:32:27.072795470 CET;192.168.1.103;192.168.1.104;45652;1883;54;45652 → 1883 [ACK] Seq=23 Ack=909 Win=42217 Len=0;
121;Jan 13, 2022 12:32:33.409035666 CET;192.168.1.104;192.168.1.103;1883;45652;73;Publish Message [topic];message048
122;Jan 13, 2022 12:32:33.409051061 CET;192.168.1.103;192.168.1.104;45652;1883;54;45652 → 1883 [ACK] Seq=23 Ack=928 Win=42217 Len=0;
123;Jan 13, 2022 12:32:39.812195197 CET;192.168.1.104;192.168.1.103;1883;45652;73;Publish Message [topic];message049
124;Jan 13, 2022 12:32:39.812217303 CET;192.168.1.103;192.168.1.104;45652;1883;54;45652 → 1883 [ACK] Seq=23 Ack=947 Win=42217 Len=0;
