1;Jan 13, 2022 15:23:21.168507737 CET;192.168.1.102;192.168.1.104;49614;1883;74;49614 → 1883 [SYN] Seq=0 Win=42340 Len=0 MSS=1460 SACK_PERM=1 TSval=1795904531 TSecr=0 WS=512;
2;Jan 13, 2022 15:23:22.198406300 CET;192.168.1.104;192.168.1.102;1883;49614;58;1883 → 49614 [SYN, ACK] Seq=0 Ack=1 Win=8192 Len=0 MSS=1460;
3;Jan 13, 2022 15:23:22.198439846 CET;192.168.1.102;192.168.1.104;49614;1883;54;49614 → 1883 [ACK] Seq=1 Ack=1 Win=42340 Len=0;
4;Jan 13, 2022 15:23:22.198567756 CET;192.168.1.102;192.168.1.104;49614;1883;108;Connect Command;
5;Jan 13, 2022 15:23:29.932624799 CET;192.168.1.102;192.168.1.104;49614;1883;108;[TCP Retransmission] 49614 → 1883 [PSH, ACK] Seq=1 Ack=1 Win=42340 Len=54;
6;Jan 13, 2022 15:23:30.438400647 CET;192.168.1.104;192.168.1.102;1883;49614;54;1883 → 49614 [ACK] Seq=1 Ack=55 Win=8192 Len=0;
7;Jan 13, 2022 15:23:30.441324082 CET;192.168.1.104;192.168.1.102;1883;49614;58;Connect Ack;
8;Jan 13, 2022 15:23:30.441335298 CET;192.168.1.102;192.168.1.104;49614;1883;54;49614 → 1883 [ACK] Seq=55 Ack=5 Win=42336 Len=0;
9;Jan 13, 2022 15:23:30.441381394 CET;192.168.1.102;192.168.1.104;49614;1883;73;Publish Message [topic];message001
10;Jan 13, 2022 15:23:30.441396161 CET;192.168.1.102;192.168.1.104;49614;1883;56;Disconnect Req;
11;Jan 13, 2022 15:23:35.448758646 CET;192.168.1.102;192.168.1.104;49616;1883;74;49616 → 1883 [SYN] Seq=0 Win=42340 Len=0 MSS=1460 SACK_PERM=1 TSval=1795920344 TSecr=0 WS=512;
12;Jan 13, 2022 15:23:35.968568899 CET;192.168.1.104;192.168.1.102;1883;49616;58;1883 → 49616 [SYN, ACK] Seq=0 Ack=1 Win=8192 Len=0 MSS=1460;
13;Jan 13, 2022 15:23:35.968648491 CET;192.168.1.102;192.168.1.104;49616;1883;54;49616 → 1883 [ACK] Seq=1 Ack=1 Win=42340 Len=0;
14;Jan 13, 2022 15:23:35.968795680 CET;192.168.1.102;192.168.1.104;49616;1883;108;Connect Command;
15;Jan 13, 2022 15:23:37.549274398 CET;192.168.1.102;192.168.1.104;49616;1883;108;[TCP Retransmission] 49616 → 1883 [PSH, ACK] Seq=1 Ack=1 Win=42340 Len=54;
16;Jan 13, 2022 15:23:38.058241868 CET;192.168.1.104;192.168.1.102;1883;49616;54;1883 → 49616 [ACK] Seq=1 Ack=55 Win=8192 Len=0;
17;Jan 13, 2022 15:23:38.062695158 CET;192.168.1.104;192.168.1.102;1883;49616;58;Connect Ack;
18;Jan 13, 2022 15:23:38.062713049 CET;192.168.1.102;192.168.1.104;49616;1883;54;49616 → 1883 [ACK] Seq=55 Ack=5 Win=42336 Len=0;
19;Jan 13, 2022 15:23:38.062768813 CET;192.168.1.102;192.168.1.104;49616;1883;73;Publish Message [topic];message002
20;Jan 13, 2022 15:23:38.062783691 CET;192.168.1.102;192.168.1.104;49616;1883;56;Disconnect Req;
21;Jan 13, 2022 15:23:41.196612003 CET;192.168.1.102;192.168.1.104;49616;1883;75;[TCP Retransmission] 49616 → 1883 [FIN, PSH, ACK] Seq=55 Ack=5 Win=42336 Len=21;
22;Jan 13, 2022 15:23:41.703113288 CET;192.168.1.104;192.168.1.102;1883;49616;54;1883 → 49616 [FIN, ACK] Seq=5 Ack=77 Win=8192 Len=0;
23;Jan 13, 2022 15:23:41.703175465 CET;192.168.1.102;192.168.1.104;49616;1883;54;49616 → 1883 [ACK] Seq=77 Ack=6 Win=42335 Len=0;
24;Jan 13, 2022 15:23:43.066330462 CET;192.168.1.102;192.168.1.104;49618;1883;74;49618 → 1883 [SYN] Seq=0 Win=42340 Len=0 MSS=1460 SACK_PERM=1 TSval=1795927962 TSecr=0 WS=512;
25;Jan 13, 2022 15:23:43.573007548 CET;192.168.1.104;192.168.1.102;1883;49618;58;1883 → 49618 [SYN, ACK] Seq=0 Ack=1 Win=8192 Len=0 MSS=1460;
26;Jan 13, 2022 15:23:43.573093224 CET;192.168.1.102;192.168.1.104;49618;1883;54;49618 → 1883 [ACK] Seq=1 Ack=1 Win=42340 Len=0;
27;Jan 13, 2022 15:23:43.573242014 CET;192.168.1.102;192.168.1.104;49618;1883;108;Connect Command;
28;Jan 13, 2022 15:23:45.100613575 CET;192.168.1.102;192.168.1.104;49618;1883;108;[TCP Retransmission] 49618 → 1883 [PSH, ACK] Seq=1 Ack=1 Win=42340 Len=54;
29;Jan 13, 2022 15:23:45.609095474 CET;192.168.1.104;192.168.1.102;1883;49618;54;1883 → 49618 [ACK] Seq=1 Ack=55 Win=8192 Len=0;
30;Jan 13, 2022 15:23:45.612126833 CET;192.168.1.104;192.168.1.102;1883;49618;58;Connect Ack;
31;Jan 13, 2022 15:23:45.612167514 CET;192.168.1.102;192.168.1.104;49618;1883;54;49618 → 1883 [ACK] Seq=55 Ack=5 Win=42336 Len=0;
32;Jan 13, 2022 15:23:45.612329023 CET;192.168.1.102;192.168.1.104;49618;1883;73;Publish Message [topic];message003
33;Jan 13, 2022 15:23:45.612375791 CET;192.168.1.102;192.168.1.104;49618;1883;56;Disconnect Req;
34;Jan 13, 2022 15:23:46.061281671 CET;192.168.1.102;192.168.1.104;49614;1883;75;[TCP Retransmission] 49614 → 1883 [FIN, PSH, ACK] Seq=55 Ack=5 Win=42336 Len=21;
35;Jan 13, 2022 15:23:46.581027255 CET;192.168.1.104;192.168.1.102;1883;49614;54;1883 → 49614 [FIN, ACK] Seq=5 Ack=77 Win=8192 Len=0;
36;Jan 13, 2022 15:23:46.581089064 CET;192.168.1.102;192.168.1.104;49614;1883;54;49614 → 1883 [ACK] Seq=77 Ack=6 Win=42335 Len=0;
37;Jan 13, 2022 15:23:48.876606316 CET;192.168.1.102;192.168.1.104;49618;1883;75;[TCP Retransmission] 49618 → 1883 [FIN, PSH, ACK] Seq=55 Ack=5 Win=42336 Len=21;
38;Jan 13, 2022 15:23:49.384203967 CET;192.168.1.104;192.168.1.102;1883;49618;54;1883 → 49618 [FIN, ACK] Seq=5 Ack=77 Win=8192 Len=0;
39;Jan 13, 2022 15:23:49.384259887 CET;192.168.1.102;192.168.1.104;49618;1883;54;49618 → 1883 [ACK] Seq=77 Ack=6 Win=42335 Len=0;
40;Jan 13, 2022 15:23:50.625925536 CET;192.168.1.102;192.168.1.104;49620;1883;74;49620 → 1883 [SYN] Seq=0 Win=42340 Len=0 MSS=1460 SACK_PERM=1 TSval=1795935521 TSecr=0 WS=512;
41;Jan 13, 2022 15:23:51.133605311 CET;192.168.1.104;192.168.1.102;1883;49620;58;1883 → 49620 [SYN, ACK] Seq=0 Ack=1 Win=8192 Len=0 MSS=1460;
42;Jan 13, 2022 15:23:51.133673222 CET;192.168.1.102;192.168.1.104;49620;1883;54;49620 → 1883 [ACK] Seq=1 Ack=1 Win=42340 Len=0;
43;Jan 13, 2022 15:23:51.133787311 CET;192.168.1.102;192.168.1.104;49620;1883;108;Connect Command;
44;Jan 13, 2022 15:23:52.684612643 CET;192.168.1.102;192.168.1.104;49620;1883;108;[TCP Retransmission] 49620 → 1883 [PSH, ACK] Seq=1 Ack=1 Win=42340 Len=54;
45;Jan 13, 2022 15:23:53.191155162 CET;192.168.1.104;192.168.1.102;1883;49620;54;1883 → 49620 [ACK] Seq=1 Ack=55 Win=8192 Len=0;
46;Jan 13, 2022 15:23:53.193753843 CET;192.168.1.104;192.168.1.102;1883;49620;58;Connect Ack;
47;Jan 13, 2022 15:23:53.193796330 CET;192.168.1.102;192.168.1.104;49620;1883;54;49620 → 1883 [ACK] Seq=55 Ack=5 Win=42336 Len=0;
48;Jan 13, 2022 15:23:53.193935236 CET;192.168.1.102;192.168.1.104;49620;1883;73;Publish Message [topic];message004
49;Jan 13, 2022 15:23:53.193980222 CET;192.168.1.102;192.168.1.104;49620;1883;56;Disconnect Req;
50;Jan 13, 2022 15:23:56.300568011 CET;192.168.1.102;192.168.1.104;49620;1883;75;[TCP Retransmission] 49620 → 1883 [FIN, PSH, ACK] Seq=55 Ack=5 Win=42336 Len=21;
51;Jan 13, 2022 15:23:56.804810354 CET;192.168.1.104;192.168.1.102;1883;49620;54;1883 → 49620 [FIN, ACK] Seq=5 Ack=77 Win=8192 Len=0;
52;Jan 13, 2022 15:23:56.804835804 CET;192.168.1.102;192.168.1.104;49620;1883;54;49620 → 1883 [ACK] Seq=77 Ack=6 Win=42335 Len=0;
53;Jan 13, 2022 15:23:58.208454901 CET;192.168.1.102;192.168.1.104;49622;1883;74;49622 → 1883 [SYN] Seq=0 Win=42340 Len=0 MSS=1460 SACK_PERM=1 TSval=1795943104 TSecr=0 WS=512;
54;Jan 13, 2022 15:23:58.713504277 CET;192.168.1.104;192.168.1.102;1883;49622;58;1883 → 49622 [SYN, ACK] Seq=0 Ack=1 Win=8192 Len=0 MSS=1460;
55;Jan 13, 2022 15:23:58.713584889 CET;192.168.1.102;192.168.1.104;49622;1883;54;49622 → 1883 [ACK] Seq=1 Ack=1 Win=42340 Len=0;
56;Jan 13, 2022 15:23:58.713725251 CET;192.168.1.102;192.168.1.104;49622;1883;108;Connect Command;
57;Jan 13, 2022 15:24:00.236687551 CET;192.168.1.102;192.168.1.104;49622;1883;108;[TCP Retransmission] 49622 → 1883 [PSH, ACK] Seq=1 Ack=1 Win=42340 Len=54;
58;Jan 13, 2022 15:24:00.746200869 CET;192.168.1.104;192.168.1.102;1883;49622;54;1883 → 49622 [ACK] Seq=1 Ack=55 Win=8192 Len=0;
59;Jan 13, 2022 15:24:00.749021828 CET;192.168.1.104;192.168.1.102;1883;49622;58;Connect Ack;
60;Jan 13, 2022 15:24:00.749069308 CET;192.168.1.102;192.168.1.104;49622;1883;54;49622 → 1883 [ACK] Seq=55 Ack=5 Win=42336 Len=0;
61;Jan 13, 2022 15:24:00.749306685 CET;192.168.1.102;192.168.1.104;49622;1883;73;Publish Message [topic];message005
62;Jan 13, 2022 15:24:00.749363699 CET;192.168.1.102;192.168.1.104;49622;1883;56;Disconnect Req;
63;Jan 13, 2022 15:24:03.980625389 CET;192.168.1.102;192.168.1.104;49622;1883;75;[TCP Retransmission] 49622 → 1883 [FIN, PSH, ACK] Seq=55 Ack=5 Win=42336 Len=21;
64;Jan 13, 2022 15:24:04.487078184 CET;192.168.1.104;192.168.1.102;1883;49622;54;1883 → 49622 [FIN, ACK] Seq=5 Ack=77 Win=8192 Len=0;
65;Jan 13, 2022 15:24:04.487135607 CET;192.168.1.102;192.168.1.104;49622;1883;54;49622 → 1883 [ACK] Seq=77 Ack=6 Win=42335 Len=0;
66;Jan 13, 2022 15:24:05.758894226 CET;192.168.1.102;192.168.1.104;49624;1883;74;49624 → 1883 [SYN] Seq=0 Win=42340 Len=0 MSS=1460 SACK_PERM=1 TSval=1795950655 TSecr=0 WS=512;
67;Jan 13, 2022 15:24:06.276529755 CET;192.168.1.104;192.168.1.102;1883;49624;58;1883 → 49624 [SYN, ACK] Seq=0 Ack=1 Win=8192 Len=0 MSS=1460;
68;Jan 13, 2022 15:24:06.276612261 CET;192.168.1.102;192.168.1.104;49624;1883;54;49624 → 1883 [ACK] Seq=1 Ack=1 Win=42340 Len=0;
69;Jan 13, 2022 15:24:06.276755860 CET;192.168.1.102;192.168.1.104;49624;1883;108;Connect Command;
70;Jan 13, 2022 15:24:07.852599584 CET;192.168.1.102;192.168.1.104;49624;1883;108;[TCP Retransmission] 49624 → 1883 [PSH, ACK] Seq=1 Ack=1 Win=42340 Len=54;
71;Jan 13, 2022 15:24:08.362710398 CET;192.168.1.104;192.168.1.102;1883;49624;54;1883 → 49624 [ACK] Seq=1 Ack=55 Win=8192 Len=0;
72;Jan 13, 2022 15:24:08.367485672 CET;192.168.1.104;192.168.1.102;1883;49624;58;Connect Ack;
73;Jan 13, 2022 15:24:08.367494753 CET;192.168.1.102;192.168.1.104;49624;1883;54;49624 → 1883 [ACK] Seq=55 Ack=5 Win=42336 Len=0;
74;Jan 13, 2022 15:24:08.367561113 CET;192.168.1.102;192.168.1.104;49624;1883;73;Publish Message [topic];message006
75;Jan 13, 2022 15:24:08.367575078 CET;192.168.1.102;192.168.1.104;49624;1883;56;Disconnect Req;
76;Jan 13, 2022 15:24:11.660633511 CET;192.168.1.102;192.168.1.104;49624;1883;75;[TCP Retransmission] 49624 → 1883 [FIN, PSH, ACK] Seq=55 Ack=5 Win=42336 Len=21;
77;Jan 13, 2022 15:24:12.169316256 CET;192.168.1.104;192.168.1.102;1883;49624;54;1883 → 49624 [FIN, ACK] Seq=5 Ack=77 Win=8192 Len=0;
78;Jan 13, 2022 15:24:12.169367881 CET;192.168.1.102;192.168.1.104;49624;1883;54;49624 → 1883 [ACK] Seq=77 Ack=6 Win=42335 Len=0;
79;Jan 13, 2022 15:24:13.375088660 CET;192.168.1.102;192.168.1.104;49626;1883;74;49626 → 1883 [SYN] Seq=0 Win=42340 Len=0 MSS=1460 SACK_PERM=1 TSval=1795958271 TSecr=0 WS=512;
80;Jan 13, 2022 15:24:13.890564523 CET;192.168.1.104;192.168.1.102;1883;49626;58;1883 → 49626 [SYN, ACK] Seq=0 Ack=1 Win=8192 Len=0 MSS=1460;
81;Jan 13, 2022 15:24:13.890638519 CET;192.168.1.102;192.168.1.104;49626;1883;54;49626 → 1883 [ACK] Seq=1 Ack=1 Win=42340 Len=0;
82;Jan 13, 2022 15:24:13.890766071 CET;192.168.1.102;192.168.1.104;49626;1883;108;Connect Command;
83;Jan 13, 2022 15:24:15.468809456 CET;192.168.1.102;192.168.1.104;49626;1883;108;[TCP Retransmission] 49626 → 1883 [PSH, ACK] Seq=1 Ack=1 Win=42340 Len=54;
84;Jan 13, 2022 15:24:15.977801265 CET;192.168.1.104;192.168.1.102;1883;49626;54;1883 → 49626 [ACK] Seq=1 Ack=55 Win=8192 Len=0;
85;Jan 13, 2022 15:24:15.980764742 CET;192.168.1.104;192.168.1.102;1883;49626;58;Connect Ack;
86;Jan 13, 2022 15:24:15.980812262 CET;192.168.1.102;192.168.1.104;49626;1883;54;49626 → 1883 [ACK] Seq=55 Ack=5 Win=42336 Len=0;
87;Jan 13, 2022 15:24:15.980971372 CET;192.168.1.102;192.168.1.104;49626;1883;73;Publish Message [topic];message007
88;Jan 13, 2022 15:24:15.981021823 CET;192.168.1.102;192.168.1.104;49626;1883;56;Disconnect Req;
89;Jan 13, 2022 15:24:19.084528984 CET;192.168.1.102;192.168.1.104;49626;1883;75;[TCP Retransmission] 49626 → 1883 [FIN, PSH, ACK] Seq=55 Ack=5 Win=42336 Len=21;
90;Jan 13, 2022 15:24:19.594360495 CET;192.168.1.104;192.168.1.102;1883;49626;54;1883 → 49626 [FIN, ACK] Seq=5 Ack=77 Win=8192 Len=0;
91;Jan 13, 2022 15:24:19.594420514 CET;192.168.1.102;192.168.1.104;49626;1883;54;49626 → 1883 [ACK] Seq=77 Ack=6 Win=42335 Len=0;
92;Jan 13, 2022 15:24:20.990617945 CET;192.168.1.102;192.168.1.104;49628;1883;74;49628 → 1883 [SYN] Seq=0 Win=42340 Len=0 MSS=1460 SACK_PERM=1 TSval=1795965886 TSecr=0 WS=512;
93;Jan 13, 2022 15:24:21.506653838 CET;192.168.1.104;192.168.1.102;1883;49628;58;1883 → 49628 [SYN, ACK] Seq=0 Ack=1 Win=8192 Len=0 MSS=1460;
94;Jan 13, 2022 15:24:21.506688360 CET;192.168.1.102;192.168.1.104;49628;1883;54;49628 → 1883 [ACK] Seq=1 Ack=1 Win=42340 Len=0;
95;Jan 13, 2022 15:24:21.506738053 CET;192.168.1.102;192.168.1.104;49628;1883;108;Connect Command;
96;Jan 13, 2022 15:24:23.084519174 CET;192.168.1.102;192.168.1.104;49628;1883;108;[TCP Retransmission] 49628 → 1883 [PSH, ACK] Seq=1 Ack=1 Win=42340 Len=54;
97;Jan 13, 2022 15:24:23.592720602 CET;192.168.1.104;192.168.1.102;1883;49628;54;1883 → 49628 [ACK] Seq=1 Ack=55 Win=8192 Len=0;
98;Jan 13, 2022 15:24:23.595748383 CET;192.168.1.104;192.168.1.102;1883;49628;58;Connect Ack;
99;Jan 13, 2022 15:24:23.595790525 CET;192.168.1.102;192.168.1.104;49628;1883;54;49628 → 1883 [ACK] Seq=55 Ack=5 Win=42336 Len=0;
100;Jan 13, 2022 15:24:23.595948769 CET;192.168.1.102;192.168.1.104;49628;1883;73;Publish Message [topic];message008
101;Jan 13, 2022 15:24:23.595997297 CET;192.168.1.102;192.168.1.104;49628;1883;56;Disconnect Req;
102;Jan 13, 2022 15:24:26.764778672 CET;192.168.1.102;192.168.1.104;49628;1883;75;[TCP Retransmission] 49628 → 1883 [FIN, PSH, ACK] Seq=55 Ack=5 Win=42336 Len=21;
103;Jan 13, 2022 15:24:27.272462593 CET;192.168.1.104;192.168.1.102;1883;49628;54;1883 → 49628 [FIN, ACK] Seq=5 Ack=77 Win=8192 Len=0;
104;Jan 13, 2022 15:24:27.272521513 CET;192.168.1.102;192.168.1.104;49628;1883;54;49628 → 1883 [ACK] Seq=77 Ack=6 Win=42335 Len=0;
105;Jan 13, 2022 15:24:28.602247719 CET;192.168.1.102;192.168.1.104;49630;1883;74;49630 → 1883 [SYN] Seq=0 Win=42340 Len=0 MSS=1460 SACK_PERM=1 TSval=1795973498 TSecr=0 WS=512;
106;Jan 13, 2022 15:24:29.111053088 CET;192.168.1.104;192.168.1.102;1883;49630;58;1883 → 49630 [SYN, ACK] Seq=0 Ack=1 Win=8192 Len=0 MSS=1460;
107;Jan 13, 2022 15:24:29.111187808 CET;192.168.1.102;192.168.1.104;49630;1883;54;49630 → 1883 [ACK] Seq=1 Ack=1 Win=42340 Len=0;
108;Jan 13, 2022 15:24:29.111309708 CET;192.168.1.102;192.168.1.104;49630;1883;108;Connect Command;
109;Jan 13, 2022 15:24:30.668570025 CET;192.168.1.102;192.168.1.104;49630;1883;108;[TCP Retransmission] 49630 → 1883 [PSH, ACK] Seq=1 Ack=1 Win=42340 Len=54;
110;Jan 13, 2022 15:24:31.173984732 CET;192.168.1.104;192.168.1.102;1883;49630;54;1883 → 49630 [ACK] Seq=1 Ack=55 Win=8192 Len=0;
111;Jan 13, 2022 15:24:31.176875053 CET;192.168.1.104;192.168.1.102;1883;49630;58;Connect Ack;
112;Jan 13, 2022 15:24:31.176917147 CET;192.168.1.102;192.168.1.104;49630;1883;54;49630 → 1883 [ACK] Seq=55 Ack=5 Win=42336 Len=0;
113;Jan 13, 2022 15:24:31.177076487 CET;192.168.1.102;192.168.1.104;49630;1883;73;Publish Message [topic];message009
114;Jan 13, 2022 15:24:31.177119664 CET;192.168.1.102;192.168.1.104;49630;1883;56;Disconnect Req;
115;Jan 13, 2022 15:24:34.444884648 CET;192.168.1.102;192.168.1.104;49630;1883;75;[TCP Retransmission] 49630 → 1883 [FIN, PSH, ACK] Seq=55 Ack=5 Win=42336 Len=21;
116;Jan 13, 2022 15:24:34.963559432 CET;192.168.1.104;192.168.1.102;1883;49630;54;1883 → 49630 [FIN, ACK] Seq=5 Ack=77 Win=8192 Len=0;
117;Jan 13, 2022 15:24:34.963619158 CET;192.168.1.102;192.168.1.104;49630;1883;54;49630 → 1883 [ACK] Seq=77 Ack=6 Win=42335 Len=0;
118;Jan 13, 2022 15:24:36.190576292 CET;192.168.1.102;192.168.1.104;49632;1883;74;49632 → 1883 [SYN] Seq=0 Win=42340 Len=0 MSS=1460 SACK_PERM=1 TSval=1795981086 TSecr=0 WS=512;
119;Jan 13, 2022 15:24:36.698095867 CET;192.168.1.104;192.168.1.102;1883;49632;58;1883 → 49632 [SYN, ACK] Seq=0 Ack=1 Win=8192 Len=0 MSS=1460;
120;Jan 13, 2022 15:24:36.698178137 CET;192.168.1.102;192.168.1.104;49632;1883;54;49632 → 1883 [ACK] Seq=1 Ack=1 Win=42340 Len=0;
121;Jan 13, 2022 15:24:36.698325433 CET;192.168.1.102;192.168.1.104;49632;1883;108;Connect Command;
122;Jan 13, 2022 15:24:38.252621581 CET;192.168.1.102;192.168.1.104;49632;1883;108;[TCP Retransmission] 49632 → 1883 [PSH, ACK] Seq=1 Ack=1 Win=42340 Len=54;
123;Jan 13, 2022 15:24:38.761831197 CET;192.168.1.104;192.168.1.102;1883;49632;54;1883 → 49632 [ACK] Seq=1 Ack=55 Win=8192 Len=0;
124;Jan 13, 2022 15:24:38.764901726 CET;192.168.1.104;192.168.1.102;1883;49632;58;Connect Ack;
125;Jan 13, 2022 15:24:38.764921958 CET;192.168.1.102;192.168.1.104;49632;1883;54;49632 → 1883 [ACK] Seq=55 Ack=5 Win=42336 Len=0;
126;Jan 13, 2022 15:24:38.764981212 CET;192.168.1.102;192.168.1.104;49632;1883;73;Publish Message [topic];message010
127;Jan 13, 2022 15:24:38.765000106 CET;192.168.1.102;192.168.1.104;49632;1883;56;Disconnect Req;
128;Jan 13, 2022 15:24:41.868582839 CET;192.168.1.102;192.168.1.104;49632;1883;75;[TCP Retransmission] 49632 → 1883 [FIN, PSH, ACK] Seq=55 Ack=5 Win=42336 Len=21;
129;Jan 13, 2022 15:24:42.389811069 CET;192.168.1.104;192.168.1.102;1883;49632;54;1883 → 49632 [FIN, ACK] Seq=5 Ack=77 Win=8192 Len=0;
130;Jan 13, 2022 15:24:42.389834701 CET;192.168.1.102;192.168.1.104;49632;1883;54;49632 → 1883 [ACK] Seq=77 Ack=6 Win=42335 Len=0;
131;Jan 13, 2022 15:24:43.769628678 CET;192.168.1.102;192.168.1.104;49634;1883;74;49634 → 1883 [SYN] Seq=0 Win=42340 Len=0 MSS=1460 SACK_PERM=1 TSval=1795988665 TSecr=0 WS=512;
132;Jan 13, 2022 15:24:44.277935645 CET;192.168.1.104;192.168.1.102;1883;49634;58;1883 → 49634 [SYN, ACK] Seq=0 Ack=1 Win=8192 Len=0 MSS=1460;
133;Jan 13, 2022 15:24:44.278017413 CET;192.168.1.102;192.168.1.104;49634;1883;54;49634 → 1883 [ACK] Seq=1 Ack=1 Win=42340 Len=0;
134;Jan 13, 2022 15:24:44.278156180 CET;192.168.1.102;192.168.1.104;49634;1883;108;Connect Command;
135;Jan 13, 2022 15:24:45.836565307 CET;192.168.1.102;192.168.1.104;49634;1883;108;[TCP Retransmission] 49634 → 1883 [PSH, ACK] Seq=1 Ack=1 Win=42340 Len=54;
136;Jan 13, 2022 15:24:46.345372966 CET;192.168.1.104;192.168.1.102;1883;49634;54;1883 → 49634 [ACK] Seq=1 Ack=55 Win=8192 Len=0;
137;Jan 13, 2022 15:24:46.349501126 CET;192.168.1.104;192.168.1.102;1883;49634;58;Connect Ack;
138;Jan 13, 2022 15:24:46.349521269 CET;192.168.1.102;192.168.1.104;49634;1883;54;49634 → 1883 [ACK] Seq=55 Ack=5 Win=42336 Len=0;
139;Jan 13, 2022 15:24:46.349589504 CET;192.168.1.102;192.168.1.104;49634;1883;73;Publish Message [topic];message011
140;Jan 13, 2022 15:24:46.349608442 CET;192.168.1.102;192.168.1.104;49634;1883;56;Disconnect Req;
141;Jan 13, 2022 15:24:49.548628230 CET;192.168.1.102;192.168.1.104;49634;1883;75;[TCP Retransmission] 49634 → 1883 [FIN, PSH, ACK] Seq=55 Ack=5 Win=42336 Len=21;
142;Jan 13, 2022 15:24:50.054175521 CET;192.168.1.104;192.168.1.102;1883;49634;54;1883 → 49634 [FIN, ACK] Seq=5 Ack=77 Win=8192 Len=0;
143;Jan 13, 2022 15:24:50.054199793 CET;192.168.1.102;192.168.1.104;49634;1883;54;49634 → 1883 [ACK] Seq=77 Ack=6 Win=42335 Len=0;
144;Jan 13, 2022 15:24:51.359935128 CET;192.168.1.102;192.168.1.104;49636;1883;74;49636 → 1883 [SYN] Seq=0 Win=42340 Len=0 MSS=1460 SACK_PERM=1 TSval=1795996256 TSecr=0 WS=512;
145;Jan 13, 2022 15:24:51.866008127 CET;192.168.1.104;192.168.1.102;1883;49636;58;1883 → 49636 [SYN, ACK] Seq=0 Ack=1 Win=8192 Len=0 MSS=1460;
146;Jan 13, 2022 15:24:51.866083342 CET;192.168.1.102;192.168.1.104;49636;1883;54;49636 → 1883 [ACK] Seq=1 Ack=1 Win=42340 Len=0;
147;Jan 13, 2022 15:24:51.866207889 CET;192.168.1.102;192.168.1.104;49636;1883;108;Connect Command;
148;Jan 13, 2022 15:24:53.388953018 CET;192.168.1.102;192.168.1.104;49636;1883;108;[TCP Retransmission] 49636 → 1883 [PSH, ACK] Seq=1 Ack=1 Win=42340 Len=54;
149;Jan 13, 2022 15:24:53.896805275 CET;192.168.1.104;192.168.1.102;1883;49636;54;1883 → 49636 [ACK] Seq=1 Ack=55 Win=8192 Len=0;
150;Jan 13, 2022 15:24:53.899892086 CET;192.168.1.104;192.168.1.102;1883;49636;58;Connect Ack;
151;Jan 13, 2022 15:24:53.899933966 CET;192.168.1.102;192.168.1.104;49636;1883;54;49636 → 1883 [ACK] Seq=55 Ack=5 Win=42336 Len=0;
152;Jan 13, 2022 15:24:53.900094061 CET;192.168.1.102;192.168.1.104;49636;1883;73;Publish Message [topic];message012
153;Jan 13, 2022 15:24:53.900139181 CET;192.168.1.102;192.168.1.104;49636;1883;56;Disconnect Req;
154;Jan 13, 2022 15:24:56.972578065 CET;192.168.1.102;192.168.1.104;49636;1883;75;[TCP Retransmission] 49636 → 1883 [FIN, PSH, ACK] Seq=55 Ack=5 Win=42336 Len=21;
155;Jan 13, 2022 15:24:57.489302473 CET;192.168.1.104;192.168.1.102;1883;49636;54;1883 → 49636 [FIN, ACK] Seq=5 Ack=77 Win=8192 Len=0;
156;Jan 13, 2022 15:24:57.489365456 CET;192.168.1.102;192.168.1.104;49636;1883;54;49636 → 1883 [ACK] Seq=77 Ack=6 Win=42335 Len=0;
157;Jan 13, 2022 15:24:58.906612105 CET;192.168.1.102;192.168.1.104;49638;1883;74;49638 → 1883 [SYN] Seq=0 Win=42340 Len=0 MSS=1460 SACK_PERM=1 TSval=1796003802 TSecr=0 WS=512;
158;Jan 13, 2022 15:24:59.425618453 CET;192.168.1.104;192.168.1.102;1883;49638;58;1883 → 49638 [SYN, ACK] Seq=0 Ack=1 Win=8192 Len=0 MSS=1460;
159;Jan 13, 2022 15:24:59.425692084 CET;192.168.1.102;192.168.1.104;49638;1883;54;49638 → 1883 [ACK] Seq=1 Ack=1 Win=42340 Len=0;
160;Jan 13, 2022 15:24:59.425806740 CET;192.168.1.102;192.168.1.104;49638;1883;108;Connect Command;
161;Jan 13, 2022 15:25:01.004871340 CET;192.168.1.102;192.168.1.104;49638;1883;108;[TCP Retransmission] 49638 → 1883 [PSH, ACK] Seq=1 Ack=1 Win=42340 Len=54;
162;Jan 13, 2022 15:25:01.525296407 CET;192.168.1.104;192.168.1.102;1883;49638;54;1883 → 49638 [ACK] Seq=1 Ack=55 Win=8192 Len=0;
163;Jan 13, 2022 15:25:01.531098362 CET;192.168.1.104;192.168.1.102;1883;49638;58;Connect Ack;
164;Jan 13, 2022 15:25:01.531144635 CET;192.168.1.102;192.168.1.104;49638;1883;54;49638 → 1883 [ACK] Seq=55 Ack=5 Win=42336 Len=0;
165;Jan 13, 2022 15:25:01.531314165 CET;192.168.1.102;192.168.1.104;49638;1883;73;Publish Message [topic];message013
166;Jan 13, 2022 15:25:01.531365727 CET;192.168.1.102;192.168.1.104;49638;1883;56;Disconnect Req;
167;Jan 13, 2022 15:25:04.652618588 CET;192.168.1.102;192.168.1.104;49638;1883;75;[TCP Retransmission] 49638 → 1883 [FIN, PSH, ACK] Seq=55 Ack=5 Win=42336 Len=21;
168;Jan 13, 2022 15:25:05.161309323 CET;192.168.1.104;192.168.1.102;1883;49638;54;1883 → 49638 [FIN, ACK] Seq=5 Ack=77 Win=8192 Len=0;
169;Jan 13, 2022 15:25:05.161359256 CET;192.168.1.102;192.168.1.104;49638;1883;54;49638 → 1883 [ACK] Seq=77 Ack=6 Win=42335 Len=0;
170;Jan 13, 2022 15:25:06.539307886 CET;192.168.1.102;192.168.1.104;49640;1883;74;49640 → 1883 [SYN] Seq=0 Win=42340 Len=0 MSS=1460 SACK_PERM=1 TSval=1796011435 TSecr=0 WS=512;
171;Jan 13, 2022 15:25:07.044544536 CET;192.168.1.104;192.168.1.102;1883;49640;58;1883 → 49640 [SYN, ACK] Seq=0 Ack=1 Win=8192 Len=0 MSS=1460;
172;Jan 13, 2022 15:25:07.044572804 CET;192.168.1.102;192.168.1.104;49640;1883;54;49640 → 1883 [ACK] Seq=1 Ack=1 Win=42340 Len=0;
173;Jan 13, 2022 15:25:07.044615952 CET;192.168.1.102;192.168.1.104;49640;1883;108;Connect Command;
174;Jan 13, 2022 15:25:08.588628802 CET;192.168.1.102;192.168.1.104;49640;1883;108;[TCP Retransmission] 49640 → 1883 [PSH, ACK] Seq=1 Ack=1 Win=42340 Len=54;
175;Jan 13, 2022 15:25:09.102552019 CET;192.168.1.104;192.168.1.102;1883;49640;54;1883 → 49640 [ACK] Seq=1 Ack=55 Win=8192 Len=0;
176;Jan 13, 2022 15:25:09.110271548 CET;192.168.1.104;192.168.1.102;1883;49640;58;Connect Ack;
177;Jan 13, 2022 15:25:09.110295322 CET;192.168.1.102;192.168.1.104;49640;1883;54;49640 → 1883 [ACK] Seq=55 Ack=5 Win=42336 Len=0;
178;Jan 13, 2022 15:25:09.110375302 CET;192.168.1.102;192.168.1.104;49640;1883;73;Publish Message [topic];message014
179;Jan 13, 2022 15:25:09.110398439 CET;192.168.1.102;192.168.1.104;49640;1883;56;Disconnect Req;
180;Jan 13, 2022 15:25:12.332618966 CET;192.168.1.102;192.168.1.104;49640;1883;75;[TCP Retransmission] 49640 → 1883 [FIN, PSH, ACK] Seq=55 Ack=5 Win=42336 Len=21;
181;Jan 13, 2022 15:25:12.841236080 CET;192.168.1.104;192.168.1.102;1883;49640;54;1883 → 49640 [FIN, ACK] Seq=5 Ack=77 Win=8192 Len=0;
182;Jan 13, 2022 15:25:12.841291876 CET;192.168.1.102;192.168.1.104;49640;1883;54;49640 → 1883 [ACK] Seq=77 Ack=6 Win=42335 Len=0;
183;Jan 13, 2022 15:25:14.118601109 CET;192.168.1.102;192.168.1.104;49642;1883;74;49642 → 1883 [SYN] Seq=0 Win=42340 Len=0 MSS=1460 SACK_PERM=1 TSval=1796019014 TSecr=0 WS=512;
184;Jan 13, 2022 15:25:14.635860130 CET;192.168.1.104;192.168.1.102;1883;49642;58;1883 → 49642 [SYN, ACK] Seq=0 Ack=1 Win=8192 Len=0 MSS=1460;
185;Jan 13, 2022 15:25:14.635933562 CET;192.168.1.102;192.168.1.104;49642;1883;54;49642 → 1883 [ACK] Seq=1 Ack=1 Win=42340 Len=0;
186;Jan 13, 2022 15:25:14.636064494 CET;192.168.1.102;192.168.1.104;49642;1883;108;Connect Command;
187;Jan 13, 2022 15:25:16.204549050 CET;192.168.1.102;192.168.1.104;49642;1883;108;[TCP Retransmission] 49642 → 1883 [PSH, ACK] Seq=1 Ack=1 Win=42340 Len=54;
188;Jan 13, 2022 15:25:16.712795546 CET;192.168.1.104;192.168.1.102;1883;49642;54;1883 → 49642 [ACK] Seq=1 Ack=55 Win=8192 Len=0;
189;Jan 13, 2022 15:25:16.715710277 CET;192.168.1.104;192.168.1.102;1883;49642;58;Connect Ack;
190;Jan 13, 2022 15:25:16.715731734 CET;192.168.1.102;192.168.1.104;49642;1883;54;49642 → 1883 [ACK] Seq=55 Ack=5 Win=42336 Len=0;
191;Jan 13, 2022 15:25:16.715799380 CET;192.168.1.102;192.168.1.104;49642;1883;73;Publish Message [topic];message015
192;Jan 13, 2022 15:25:16.715816114 CET;192.168.1.102;192.168.1.104;49642;1883;56;Disconnect Req;
193;Jan 13, 2022 15:25:20.012560453 CET;192.168.1.102;192.168.1.104;49642;1883;75;[TCP Retransmission] 49642 → 1883 [FIN, PSH, ACK] Seq=55 Ack=5 Win=42336 Len=21;
194;Jan 13, 2022 15:25:20.530859823 CET;192.168.1.104;192.168.1.102;1883;49642;54;1883 → 49642 [FIN, ACK] Seq=5 Ack=77 Win=8192 Len=0;
195;Jan 13, 2022 15:25:20.530885749 CET;192.168.1.102;192.168.1.104;49642;1883;54;49642 → 1883 [ACK] Seq=77 Ack=6 Win=42335 Len=0;
196;Jan 13, 2022 15:25:21.723526015 CET;192.168.1.102;192.168.1.104;49644;1883;74;49644 → 1883 [SYN] Seq=0 Win=42340 Len=0 MSS=1460 SACK_PERM=1 TSval=1796026619 TSecr=0 WS=512;
197;Jan 13, 2022 15:25:22.732603385 CET;192.168.1.102;192.168.1.104;49644;1883;74;[TCP Retransmission] 49644 → 1883 [SYN] Seq=0 Win=42340 Len=0 MSS=1460 SACK_PERM=1 TSval=1796027628 TSecr=0 WS=512;
198;Jan 13, 2022 15:25:22.752131704 CET;192.168.1.104;192.168.1.102;1883;49644;58;1883 → 49644 [SYN, ACK] Seq=0 Ack=1 Win=8192 Len=0 MSS=1460;
199;Jan 13, 2022 15:25:22.752206009 CET;192.168.1.102;192.168.1.104;49644;1883;54;49644 → 1883 [ACK] Seq=1 Ack=1 Win=42340 Len=0;
200;Jan 13, 2022 15:25:22.752332668 CET;192.168.1.102;192.168.1.104;49644;1883;108;Connect Command;
201;Jan 13, 2022 15:25:23.254111275 CET;192.168.1.104;192.168.1.102;1883;49644;58;[TCP Previous segment not captured] [TCP Port numbers reused] 1883 → 49644 [SYN, ACK] Seq=1217319800 Ack=1 Win=8192 Len=0 MSS=1460;
202;Jan 13, 2022 15:25:23.254158972 CET;192.168.1.102;192.168.1.104;49644;1883;54;[TCP Dup ACK 199#1] 49644 → 1883 [ACK] Seq=55 Ack=1 Win=42340 Len=0;
203;Jan 13, 2022 15:25:25.900750591 CET;192.168.1.102;192.168.1.104;49644;1883;108;[TCP Retransmission] 49644 → 1883 [PSH, ACK] Seq=1 Ack=1 Win=42340 Len=54;
204;Jan 13, 2022 15:25:26.421088288 CET;192.168.1.104;192.168.1.102;1883;49644;54;1883 → 49644 [ACK] Seq=1217319801 Ack=55 Win=8192 Len=0;
205;Jan 13, 2022 15:25:26.421134503 CET;192.168.1.102;192.168.1.104;49644;1883;54;[TCP Dup ACK 199#2] 49644 → 1883 [ACK] Seq=55 Ack=1 Win=42340 Len=0;
206;Jan 13, 2022 15:25:26.428136539 CET;192.168.1.104;192.168.1.102;1883;49644;58;Connect Ack;
207;Jan 13, 2022 15:25:26.428182499 CET;192.168.1.102;192.168.1.104;49644;1883;54;[TCP Dup ACK 199#3] 49644 → 1883 [ACK] Seq=55 Ack=1 Win=42340 Len=0;
208;Jan 13, 2022 15:25:32.044513839 CET;192.168.1.102;192.168.1.104;49644;1883;108;[TCP Spurious Retransmission] , Connect Command;
209;Jan 13, 2022 15:25:44.077032546 CET;192.168.1.102;192.168.1.104;49644;1883;108;[TCP Spurious Retransmission] , Connect Command;
210;Jan 13, 2022 15:26:08.908637227 CET;192.168.1.102;192.168.1.104;49644;1883;108;[TCP Spurious Retransmission] , Connect Command;
211;Jan 13, 2022 15:26:21.821379118 CET;192.168.1.102;192.168.1.104;49644;1883;54;49644 → 1883 [FIN, ACK] Seq=55 Ack=1 Win=42340 Len=0;
212;Jan 13, 2022 15:26:22.326980567 CET;192.168.1.104;192.168.1.102;1883;49644;54;1883 → 49644 [FIN, ACK] Seq=1217319805 Ack=56 Win=8192 Len=0;
213;Jan 13, 2022 15:26:22.327022704 CET;192.168.1.102;192.168.1.104;49644;1883;54;[TCP Dup ACK 199#4] 49644 → 1883 [ACK] Seq=56 Ack=1 Win=42340 Len=0;
214;Jan 13, 2022 15:26:22.329015868 CET;192.168.1.104;192.168.1.102;1883;49644;54;[TCP ACKed unseen segment] [TCP Out-Of-Order] 1883 → 49644 [FIN, ACK] Seq=1217319805 Ack=57 Win=8192 Len=0;
215;Jan 13, 2022 15:26:22.329063870 CET;192.168.1.102;192.168.1.104;49644;1883;54;[TCP Dup ACK 199#5] 49644 → 1883 [ACK] Seq=56 Ack=1 Win=42340 Len=0;
216;Jan 13, 2022 15:26:26.832139180 CET;192.168.1.102;192.168.1.104;49646;1883;74;49646 → 1883 [SYN] Seq=0 Win=42340 Len=0 MSS=1460 SACK_PERM=1 TSval=1796091728 TSecr=0 WS=512;
217;Jan 13, 2022 15:26:27.337057921 CET;192.168.1.104;192.168.1.102;1883;49646;58;1883 → 49646 [SYN, ACK] Seq=0 Ack=1 Win=8192 Len=0 MSS=1460;
218;Jan 13, 2022 15:26:27.337132101 CET;192.168.1.102;192.168.1.104;49646;1883;54;49646 → 1883 [ACK] Seq=1 Ack=1 Win=42340 Len=0;
219;Jan 13, 2022 15:26:27.337263648 CET;192.168.1.102;192.168.1.104;49646;1883;108;Connect Command;
220;Jan 13, 2022 15:26:28.876620966 CET;192.168.1.102;192.168.1.104;49646;1883;108;[TCP Retransmission] 49646 → 1883 [PSH, ACK] Seq=1 Ack=1 Win=42340 Len=54;
221;Jan 13, 2022 15:26:29.383012697 CET;192.168.1.104;192.168.1.102;1883;49646;54;1883 → 49646 [ACK] Seq=1 Ack=55 Win=8192 Len=0;
222;Jan 13, 2022 15:26:29.386213692 CET;192.168.1.104;192.168.1.102;1883;49646;58;Connect Ack;
223;Jan 13, 2022 15:26:29.386256535 CET;192.168.1.102;192.168.1.104;49646;1883;54;49646 → 1883 [ACK] Seq=55 Ack=5 Win=42336 Len=0;
224;Jan 13, 2022 15:26:29.386418251 CET;192.168.1.102;192.168.1.104;49646;1883;73;Publish Message [topic];message017
225;Jan 13, 2022 15:26:29.386464313 CET;192.168.1.102;192.168.1.104;49646;1883;56;Disconnect Req;
226;Jan 13, 2022 15:26:32.460699136 CET;192.168.1.102;192.168.1.104;49646;1883;75;[TCP Retransmission] 49646 → 1883 [FIN, PSH, ACK] Seq=55 Ack=5 Win=42336 Len=21;
227;Jan 13, 2022 15:26:32.969323110 CET;192.168.1.104;192.168.1.102;1883;49646;54;1883 → 49646 [FIN, ACK] Seq=5 Ack=77 Win=8192 Len=0;
228;Jan 13, 2022 15:26:32.969379406 CET;192.168.1.102;192.168.1.104;49646;1883;54;49646 → 1883 [ACK] Seq=77 Ack=6 Win=42335 Len=0;
229;Jan 13, 2022 15:26:34.395169521 CET;192.168.1.102;192.168.1.104;49648;1883;74;49648 → 1883 [SYN] Seq=0 Win=42340 Len=0 MSS=1460 SACK_PERM=1 TSval=1796099291 TSecr=0 WS=512;
230;Jan 13, 2022 15:26:34.912776332 CET;192.168.1.104;192.168.1.102;1883;49648;58;1883 → 49648 [SYN, ACK] Seq=0 Ack=1 Win=8192 Len=0 MSS=1460;
231;Jan 13, 2022 15:26:34.912848982 CET;192.168.1.102;192.168.1.104;49648;1883;54;49648 → 1883 [ACK] Seq=1 Ack=1 Win=42340 Len=0;
232;Jan 13, 2022 15:26:34.912973158 CET;192.168.1.102;192.168.1.104;49648;1883;108;Connect Command;
233;Jan 13, 2022 15:26:36.492558620 CET;192.168.1.102;192.168.1.104;49648;1883;108;[TCP Retransmission] 49648 → 1883 [PSH, ACK] Seq=1 Ack=1 Win=42340 Len=54;
234;Jan 13, 2022 15:26:37.002378598 CET;192.168.1.104;192.168.1.102;1883;49648;54;1883 → 49648 [ACK] Seq=1 Ack=55 Win=8192 Len=0;
235;Jan 13, 2022 15:26:37.004518898 CET;192.168.1.104;192.168.1.102;1883;49648;58;Connect Ack;
236;Jan 13, 2022 15:26:37.004558011 CET;192.168.1.102;192.168.1.104;49648;1883;54;49648 → 1883 [ACK] Seq=55 Ack=5 Win=42336 Len=0;
237;Jan 13, 2022 15:26:37.004687289 CET;192.168.1.102;192.168.1.104;49648;1883;73;Publish Message [topic];message018
238;Jan 13, 2022 15:26:37.004728328 CET;192.168.1.102;192.168.1.104;49648;1883;56;Disconnect Req;
239;Jan 13, 2022 15:26:40.140758956 CET;192.168.1.102;192.168.1.104;49648;1883;75;[TCP Retransmission] 49648 → 1883 [FIN, PSH, ACK] Seq=55 Ack=5 Win=42336 Len=21;
240;Jan 13, 2022 15:26:40.646867738 CET;192.168.1.104;192.168.1.102;1883;49648;54;1883 → 49648 [FIN, ACK] Seq=5 Ack=77 Win=8192 Len=0;
241;Jan 13, 2022 15:26:40.646893779 CET;192.168.1.102;192.168.1.104;49648;1883;54;49648 → 1883 [ACK] Seq=77 Ack=6 Win=42335 Len=0;
242;Jan 13, 2022 15:26:42.010957311 CET;192.168.1.102;192.168.1.104;49650;1883;74;49650 → 1883 [SYN] Seq=0 Win=42340 Len=0 MSS=1460 SACK_PERM=1 TSval=1796106907 TSecr=0 WS=512;
243;Jan 13, 2022 15:26:42.528837592 CET;192.168.1.104;192.168.1.102;1883;49650;58;1883 → 49650 [SYN, ACK] Seq=0 Ack=1 Win=8192 Len=0 MSS=1460;
244;Jan 13, 2022 15:26:42.528914244 CET;192.168.1.102;192.168.1.104;49650;1883;54;49650 → 1883 [ACK] Seq=1 Ack=1 Win=42340 Len=0;
245;Jan 13, 2022 15:26:42.529029187 CET;192.168.1.102;192.168.1.104;49650;1883;108;Connect Command;
246;Jan 13, 2022 15:26:44.108716401 CET;192.168.1.102;192.168.1.104;49650;1883;108;[TCP Retransmission] 49650 → 1883 [PSH, ACK] Seq=1 Ack=1 Win=42340 Len=54;
247;Jan 13, 2022 15:26:44.619092655 CET;192.168.1.104;192.168.1.102;1883;49650;54;1883 → 49650 [ACK] Seq=1 Ack=55 Win=8192 Len=0;
248;Jan 13, 2022 15:26:44.621133240 CET;192.168.1.104;192.168.1.102;1883;49650;58;Connect Ack;
249;Jan 13, 2022 15:26:44.621180042 CET;192.168.1.102;192.168.1.104;49650;1883;54;49650 → 1883 [ACK] Seq=55 Ack=5 Win=42336 Len=0;
250;Jan 13, 2022 15:26:44.621382851 CET;192.168.1.102;192.168.1.104;49650;1883;73;Publish Message [topic];message019
251;Jan 13, 2022 15:26:44.621432981 CET;192.168.1.102;192.168.1.104;49650;1883;56;Disconnect Req;
252;Jan 13, 2022 15:26:47.820719802 CET;192.168.1.102;192.168.1.104;49650;1883;75;[TCP Retransmission] 49650 → 1883 [FIN, PSH, ACK] Seq=55 Ack=5 Win=42336 Len=21;
253;Jan 13, 2022 15:26:48.327430387 CET;192.168.1.104;192.168.1.102;1883;49650;54;1883 → 49650 [FIN, ACK] Seq=5 Ack=77 Win=8192 Len=0;
254;Jan 13, 2022 15:26:48.327487498 CET;192.168.1.102;192.168.1.104;49650;1883;54;49650 → 1883 [ACK] Seq=77 Ack=6 Win=42335 Len=0;
255;Jan 13, 2022 15:26:49.636394829 CET;192.168.1.102;192.168.1.104;49652;1883;74;49652 → 1883 [SYN] Seq=0 Win=42340 Len=0 MSS=1460 SACK_PERM=1 TSval=1796114532 TSecr=0 WS=512;
256;Jan 13, 2022 15:26:50.148849792 CET;192.168.1.104;192.168.1.102;1883;49652;58;1883 → 49652 [SYN, ACK] Seq=0 Ack=1 Win=8192 Len=0 MSS=1460;
257;Jan 13, 2022 15:26:50.148881336 CET;192.168.1.102;192.168.1.104;49652;1883;54;49652 → 1883 [ACK] Seq=1 Ack=1 Win=42340 Len=0;
258;Jan 13, 2022 15:26:50.148929366 CET;192.168.1.102;192.168.1.104;49652;1883;108;Connect Command;
259;Jan 13, 2022 15:26:51.692638497 CET;192.168.1.102;192.168.1.104;49652;1883;108;[TCP Retransmission] 49652 → 1883 [PSH, ACK] Seq=1 Ack=1 Win=42340 Len=54;
260;Jan 13, 2022 15:26:52.202007918 CET;192.168.1.104;192.168.1.102;1883;49652;54;1883 → 49652 [ACK] Seq=1 Ack=55 Win=8192 Len=0;
261;Jan 13, 2022 15:26:52.205595518 CET;192.168.1.104;192.168.1.102;1883;49652;58;Connect Ack;
262;Jan 13, 2022 15:26:52.205637034 CET;192.168.1.102;192.168.1.104;49652;1883;54;49652 → 1883 [ACK] Seq=55 Ack=5 Win=42336 Len=0;
263;Jan 13, 2022 15:26:52.205763590 CET;192.168.1.102;192.168.1.104;49652;1883;73;Publish Message [topic];message020
264;Jan 13, 2022 15:26:52.205807540 CET;192.168.1.102;192.168.1.104;49652;1883;56;Disconnect Req;
265;Jan 13, 2022 15:26:55.500595014 CET;192.168.1.102;192.168.1.104;49652;1883;75;[TCP Retransmission] 49652 → 1883 [FIN, PSH, ACK] Seq=55 Ack=5 Win=42336 Len=21;
266;Jan 13, 2022 15:26:56.009694323 CET;192.168.1.104;192.168.1.102;1883;49652;54;1883 → 49652 [FIN, ACK] Seq=5 Ack=77 Win=8192 Len=0;
267;Jan 13, 2022 15:26:56.009755036 CET;192.168.1.102;192.168.1.104;49652;1883;54;49652 → 1883 [ACK] Seq=77 Ack=6 Win=42335 Len=0;
268;Jan 13, 2022 15:26:57.214539601 CET;192.168.1.102;192.168.1.104;49654;1883;74;49654 → 1883 [SYN] Seq=0 Win=42340 Len=0 MSS=1460 SACK_PERM=1 TSval=1796122110 TSecr=0 WS=512;
269;Jan 13, 2022 15:26:57.719341411 CET;192.168.1.104;192.168.1.102;1883;49654;58;1883 → 49654 [SYN, ACK] Seq=0 Ack=1 Win=8192 Len=0 MSS=1460;
270;Jan 13, 2022 15:26:57.719419714 CET;192.168.1.102;192.168.1.104;49654;1883;54;49654 → 1883 [ACK] Seq=1 Ack=1 Win=42340 Len=0;
271;Jan 13, 2022 15:26:57.719558716 CET;192.168.1.102;192.168.1.104;49654;1883;108;Connect Command;
272;Jan 13, 2022 15:26:58.060672999 CET;192.168.1.102;192.168.1.104;49644;1883;108;[TCP Spurious Retransmission] , Connect Command;
273;Jan 13, 2022 15:26:59.244749829 CET;192.168.1.102;192.168.1.104;49654;1883;108;[TCP Retransmission] 49654 → 1883 [PSH, ACK] Seq=1 Ack=1 Win=42340 Len=54;
274;Jan 13, 2022 15:26:59.750179591 CET;192.168.1.104;192.168.1.102;1883;49654;54;1883 → 49654 [ACK] Seq=1 Ack=55 Win=8192 Len=0;
275;Jan 13, 2022 15:26:59.754159668 CET;192.168.1.104;192.168.1.102;1883;49654;58;Connect Ack;
276;Jan 13, 2022 15:26:59.754196469 CET;192.168.1.102;192.168.1.104;49654;1883;54;49654 → 1883 [ACK] Seq=55 Ack=5 Win=42336 Len=0;
277;Jan 13, 2022 15:26:59.754331332 CET;192.168.1.102;192.168.1.104;49654;1883;73;Publish Message [topic];message021
278;Jan 13, 2022 15:26:59.754370950 CET;192.168.1.102;192.168.1.104;49654;1883;56;Disconnect Req;
279;Jan 13, 2022 15:27:02.924640215 CET;192.168.1.102;192.168.1.104;49654;1883;75;[TCP Retransmission] 49654 → 1883 [FIN, PSH, ACK] Seq=55 Ack=5 Win=42336 Len=21;
280;Jan 13, 2022 15:27:03.442031313 CET;192.168.1.104;192.168.1.102;1883;49654;54;1883 → 49654 [FIN, ACK] Seq=5 Ack=77 Win=8192 Len=0;
281;Jan 13, 2022 15:27:03.442091326 CET;192.168.1.102;192.168.1.104;49654;1883;54;49654 → 1883 [ACK] Seq=77 Ack=6 Win=42335 Len=0;
282;Jan 13, 2022 15:27:04.767594572 CET;192.168.1.102;192.168.1.104;49656;1883;74;49656 → 1883 [SYN] Seq=0 Win=42340 Len=0 MSS=1460 SACK_PERM=1 TSval=1796129663 TSecr=0 WS=512;
283;Jan 13, 2022 15:27:05.277326700 CET;192.168.1.104;192.168.1.102;1883;49656;58;1883 → 49656 [SYN, ACK] Seq=0 Ack=1 Win=8192 Len=0 MSS=1460;
284;Jan 13, 2022 15:27:05.277405984 CET;192.168.1.102;192.168.1.104;49656;1883;54;49656 → 1883 [ACK] Seq=1 Ack=1 Win=42340 Len=0;
285;Jan 13, 2022 15:27:05.277529819 CET;192.168.1.102;192.168.1.104;49656;1883;108;Connect Command;
286;Jan 13, 2022 15:27:06.828589137 CET;192.168.1.102;192.168.1.104;49656;1883;108;[TCP Retransmission] 49656 → 1883 [PSH, ACK] Seq=1 Ack=1 Win=42340 Len=54;
287;Jan 13, 2022 15:27:07.339688079 CET;192.168.1.104;192.168.1.102;1883;49656;54;1883 → 49656 [ACK] Seq=1 Ack=55 Win=8192 Len=0;
288;Jan 13, 2022 15:27:07.343554375 CET;192.168.1.104;192.168.1.102;1883;49656;58;Connect Ack;
289;Jan 13, 2022 15:27:07.343591278 CET;192.168.1.102;192.168.1.104;49656;1883;54;49656 → 1883 [ACK] Seq=55 Ack=5 Win=42336 Len=0;
290;Jan 13, 2022 15:27:07.343731371 CET;192.168.1.102;192.168.1.104;49656;1883;73;Publish Message [topic];message022
291;Jan 13, 2022 15:27:07.343774104 CET;192.168.1.102;192.168.1.104;49656;1883;56;Disconnect Req;
292;Jan 13, 2022 15:27:10.604709826 CET;192.168.1.102;192.168.1.104;49656;1883;75;[TCP Retransmission] 49656 → 1883 [FIN, PSH, ACK] Seq=55 Ack=5 Win=42336 Len=21;
293;Jan 13, 2022 15:27:11.109519231 CET;192.168.1.104;192.168.1.102;1883;49656;54;1883 → 49656 [FIN, ACK] Seq=5 Ack=77 Win=8192 Len=0;
294;Jan 13, 2022 15:27:11.109551871 CET;192.168.1.102;192.168.1.104;49656;1883;54;49656 → 1883 [ACK] Seq=77 Ack=6 Win=42335 Len=0;
295;Jan 13, 2022 15:27:12.352589012 CET;192.168.1.102;192.168.1.104;49658;1883;74;49658 → 1883 [SYN] Seq=0 Win=42340 Len=0 MSS=1460 SACK_PERM=1 TSval=1796137248 TSecr=0 WS=512;
296;Jan 13, 2022 15:27:12.871911126 CET;192.168.1.104;192.168.1.102;1883;49658;58;1883 → 49658 [SYN, ACK] Seq=0 Ack=1 Win=8192 Len=0 MSS=1460;
297;Jan 13, 2022 15:27:12.871937595 CET;192.168.1.102;192.168.1.104;49658;1883;54;49658 → 1883 [ACK] Seq=1 Ack=1 Win=42340 Len=0;
298;Jan 13, 2022 15:27:12.871982151 CET;192.168.1.102;192.168.1.104;49658;1883;108;Connect Command;
299;Jan 13, 2022 15:27:14.444581489 CET;192.168.1.102;192.168.1.104;49658;1883;108;[TCP Retransmission] 49658 → 1883 [PSH, ACK] Seq=1 Ack=1 Win=42340 Len=54;
300;Jan 13, 2022 15:27:14.964066599 CET;192.168.1.104;192.168.1.102;1883;49658;54;1883 → 49658 [ACK] Seq=1 Ack=55 Win=8192 Len=0;
301;Jan 13, 2022 15:27:14.969638322 CET;192.168.1.104;192.168.1.102;1883;49658;58;Connect Ack;
302;Jan 13, 2022 15:27:14.969656876 CET;192.168.1.102;192.168.1.104;49658;1883;54;49658 → 1883 [ACK] Seq=55 Ack=5 Win=42336 Len=0;
