1;Jan 13, 2022 19:29:36.749476721 CET;192.168.1.102;192.168.1.101;54516;1883;74;54516 → 1883 [SYN] Seq=0 Win=42340 Len=0 MSS=1460 SACK_PERM=1 TSval=3425690640 TSecr=0 WS=512;
2;Jan 13, 2022 19:29:36.762811665 CET;192.168.1.101;192.168.1.102;1883;54516;58;1883 → 54516 [SYN, ACK] Seq=0 Ack=1 Win=8192 Len=0 MSS=1460;
3;Jan 13, 2022 19:29:36.762828557 CET;192.168.1.102;192.168.1.101;54516;1883;54;54516 → 1883 [ACK] Seq=1 Ack=1 Win=42340 Len=0;
4;Jan 13, 2022 19:29:36.762908014 CET;192.168.1.102;192.168.1.101;54516;1883;108;Connect Command;
5;Jan 13, 2022 19:29:36.980536256 CET;192.168.1.102;192.168.1.101;54516;1883;108;[TCP Retransmission] 54516 → 1883 [PSH, ACK] Seq=1 Ack=1 Win=42340 Len=54;
6;Jan 13, 2022 19:29:36.985089619 CET;192.168.1.101;192.168.1.102;1883;54516;54;1883 → 54516 [ACK] Seq=1 Ack=55 Win=8192 Len=0;
7;Jan 13, 2022 19:29:36.992349580 CET;192.168.1.101;192.168.1.102;1883;54516;58;Connect Ack;
8;Jan 13, 2022 19:29:36.992363501 CET;192.168.1.102;192.168.1.101;54516;1883;54;54516 → 1883 [ACK] Seq=55 Ack=5 Win=42336 Len=0;
9;Jan 13, 2022 19:29:36.992414575 CET;192.168.1.102;192.168.1.101;54516;1883;73;Publish Message [topic];message001
10;Jan 13, 2022 19:29:36.992434240 CET;192.168.1.102;192.168.1.101;54516;1883;56;Disconnect Req;
11;Jan 13, 2022 19:29:37.452617796 CET;192.168.1.102;192.168.1.101;54516;1883;75;[TCP Retransmission] 54516 → 1883 [FIN, PSH, ACK] Seq=55 Ack=5 Win=42336 Len=21;
12;Jan 13, 2022 19:29:37.470629272 CET;192.168.1.101;192.168.1.102;1883;54516;54;1883 → 54516 [FIN, ACK] Seq=5 Ack=77 Win=8192 Len=0;
13;Jan 13, 2022 19:29:37.470659702 CET;192.168.1.102;192.168.1.101;54516;1883;54;54516 → 1883 [ACK] Seq=77 Ack=6 Win=42335 Len=0;
14;Jan 13, 2022 19:29:47.004182065 CET;192.168.1.102;192.168.1.101;54518;1883;74;54518 → 1883 [SYN] Seq=0 Win=42340 Len=0 MSS=1460 SACK_PERM=1 TSval=3425700895 TSecr=0 WS=512;
15;Jan 13, 2022 19:29:47.014397362 CET;192.168.1.101;192.168.1.102;1883;54518;58;1883 → 54518 [SYN, ACK] Seq=0 Ack=1 Win=8192 Len=0 MSS=1460;
16;Jan 13, 2022 19:29:47.014432051 CET;192.168.1.102;192.168.1.101;54518;1883;54;54518 → 1883 [ACK] Seq=1 Ack=1 Win=42340 Len=0;
17;Jan 13, 2022 19:29:47.014609121 CET;192.168.1.102;192.168.1.101;54518;1883;108;Connect Command;
18;Jan 13, 2022 19:29:47.228627495 CET;192.168.1.102;192.168.1.101;54518;1883;108;[TCP Retransmission] 54518 → 1883 [PSH, ACK] Seq=1 Ack=1 Win=42340 Len=54;
19;Jan 13, 2022 19:29:47.247784943 CET;192.168.1.101;192.168.1.102;1883;54518;54;1883 → 54518 [ACK] Seq=1 Ack=55 Win=8192 Len=0;
20;Jan 13, 2022 19:29:47.250168509 CET;192.168.1.101;192.168.1.102;1883;54518;58;Connect Ack;
21;Jan 13, 2022 19:29:47.250177227 CET;192.168.1.102;192.168.1.101;54518;1883;54;54518 → 1883 [ACK] Seq=55 Ack=5 Win=42336 Len=0;
22;Jan 13, 2022 19:29:47.250225212 CET;192.168.1.102;192.168.1.101;54518;1883;73;Publish Message [topic];message002
23;Jan 13, 2022 19:29:47.250242205 CET;192.168.1.102;192.168.1.101;54518;1883;56;Disconnect Req;
24;Jan 13, 2022 19:29:47.692677372 CET;192.168.1.102;192.168.1.101;54518;1883;75;[TCP Retransmission] 54518 → 1883 [FIN, PSH, ACK] Seq=55 Ack=5 Win=42336 Len=21;
25;Jan 13, 2022 19:29:47.709499778 CET;192.168.1.101;192.168.1.102;1883;54518;54;1883 → 54518 [FIN, ACK] Seq=5 Ack=77 Win=8192 Len=0;
26;Jan 13, 2022 19:29:47.709527160 CET;192.168.1.102;192.168.1.101;54518;1883;54;54518 → 1883 [ACK] Seq=77 Ack=6 Win=42335 Len=0;
27;Jan 13, 2022 19:29:57.256466379 CET;192.168.1.102;192.168.1.101;54520;1883;74;54520 → 1883 [SYN] Seq=0 Win=42340 Len=0 MSS=1460 SACK_PERM=1 TSval=3425711147 TSecr=0 WS=512;
28;Jan 13, 2022 19:29:57.262380888 CET;192.168.1.101;192.168.1.102;1883;54520;58;1883 → 54520 [SYN, ACK] Seq=0 Ack=1 Win=8192 Len=0 MSS=1460;
29;Jan 13, 2022 19:29:57.262407626 CET;192.168.1.102;192.168.1.101;54520;1883;54;54520 → 1883 [ACK] Seq=1 Ack=1 Win=42340 Len=0;
30;Jan 13, 2022 19:29:57.262464594 CET;192.168.1.102;192.168.1.101;54520;1883;108;Connect Command;
31;Jan 13, 2022 19:29:57.472518575 CET;192.168.1.102;192.168.1.101;54520;1883;108;[TCP Retransmission] 54520 → 1883 [PSH, ACK] Seq=1 Ack=1 Win=42340 Len=54;
32;Jan 13, 2022 19:29:57.477997439 CET;192.168.1.101;192.168.1.102;1883;54520;54;1883 → 54520 [ACK] Seq=1 Ack=55 Win=8192 Len=0;
33;Jan 13, 2022 19:29:57.480213958 CET;192.168.1.101;192.168.1.102;1883;54520;58;Connect Ack;
34;Jan 13, 2022 19:29:57.480220734 CET;192.168.1.102;192.168.1.101;54520;1883;54;54520 → 1883 [ACK] Seq=55 Ack=5 Win=42336 Len=0;
35;Jan 13, 2022 19:29:57.480277170 CET;192.168.1.102;192.168.1.101;54520;1883;73;Publish Message [topic];message003
36;Jan 13, 2022 19:29:57.480293183 CET;192.168.1.102;192.168.1.101;54520;1883;56;Disconnect Req;
37;Jan 13, 2022 19:29:57.900628360 CET;192.168.1.102;192.168.1.101;54520;1883;75;[TCP Retransmission] 54520 → 1883 [FIN, PSH, ACK] Seq=55 Ack=5 Win=42336 Len=21;
38;Jan 13, 2022 19:29:57.909744693 CET;192.168.1.101;192.168.1.102;1883;54520;54;1883 → 54520 [FIN, ACK] Seq=5 Ack=77 Win=8192 Len=0;
39;Jan 13, 2022 19:29:57.909771880 CET;192.168.1.102;192.168.1.101;54520;1883;54;54520 → 1883 [ACK] Seq=77 Ack=6 Win=42335 Len=0;
40;Jan 13, 2022 19:30:07.484058257 CET;192.168.1.102;192.168.1.101;54522;1883;74;54522 → 1883 [SYN] Seq=0 Win=42340 Len=0 MSS=1460 SACK_PERM=1 TSval=3425721375 TSecr=0 WS=512;
41;Jan 13, 2022 19:30:07.487152186 CET;192.168.1.101;192.168.1.102;1883;54522;58;1883 → 54522 [SYN, ACK] Seq=0 Ack=1 Win=8192 Len=0 MSS=1460;
42;Jan 13, 2022 19:30:07.487167187 CET;192.168.1.102;192.168.1.101;54522;1883;54;54522 → 1883 [ACK] Seq=1 Ack=1 Win=42340 Len=0;
43;Jan 13, 2022 19:30:07.487289598 CET;192.168.1.102;192.168.1.101;54522;1883;108;Connect Command;
44;Jan 13, 2022 19:30:07.692702695 CET;192.168.1.102;192.168.1.101;54522;1883;108;[TCP Retransmission] 54522 → 1883 [PSH, ACK] Seq=1 Ack=1 Win=42340 Len=54;
45;Jan 13, 2022 19:30:07.699916657 CET;192.168.1.101;192.168.1.102;1883;54522;54;1883 → 54522 [ACK] Seq=1 Ack=55 Win=8192 Len=0;
46;Jan 13, 2022 19:30:07.704424769 CET;192.168.1.101;192.168.1.102;1883;54522;58;Connect Ack;
47;Jan 13, 2022 19:30:07.704438311 CET;192.168.1.102;192.168.1.101;54522;1883;54;54522 → 1883 [ACK] Seq=55 Ack=5 Win=42336 Len=0;
48;Jan 13, 2022 19:30:07.704521150 CET;192.168.1.102;192.168.1.101;54522;1883;73;Publish Message [topic];message004
49;Jan 13, 2022 19:30:07.704602223 CET;192.168.1.102;192.168.1.101;54522;1883;56;Disconnect Req;
50;Jan 13, 2022 19:30:08.140965371 CET;192.168.1.102;192.168.1.101;54522;1883;75;[TCP Retransmission] 54522 → 1883 [FIN, PSH, ACK] Seq=55 Ack=5 Win=42336 Len=21;
51;Jan 13, 2022 19:30:08.156866261 CET;192.168.1.101;192.168.1.102;1883;54522;54;1883 → 54522 [FIN, ACK] Seq=5 Ack=77 Win=8192 Len=0;
52;Jan 13, 2022 19:30:08.156902797 CET;192.168.1.102;192.168.1.101;54522;1883;54;54522 → 1883 [ACK] Seq=77 Ack=6 Win=42335 Len=0;
53;Jan 13, 2022 19:30:17.709998203 CET;192.168.1.102;192.168.1.101;54524;1883;74;54524 → 1883 [SYN] Seq=0 Win=42340 Len=0 MSS=1460 SACK_PERM=1 TSval=3425731601 TSecr=0 WS=512;
54;Jan 13, 2022 19:30:17.713641702 CET;192.168.1.101;192.168.1.102;1883;54524;58;1883 → 54524 [SYN, ACK] Seq=0 Ack=1 Win=8192 Len=0 MSS=1460;
55;Jan 13, 2022 19:30:17.713658875 CET;192.168.1.102;192.168.1.101;54524;1883;54;54524 → 1883 [ACK] Seq=1 Ack=1 Win=42340 Len=0;
56;Jan 13, 2022 19:30:17.714066718 CET;192.168.1.102;192.168.1.101;54524;1883;108;Connect Command;
57;Jan 13, 2022 19:30:17.920540565 CET;192.168.1.102;192.168.1.101;54524;1883;108;[TCP Retransmission] 54524 → 1883 [PSH, ACK] Seq=1 Ack=1 Win=42340 Len=54;
58;Jan 13, 2022 19:30:17.934878637 CET;192.168.1.101;192.168.1.102;1883;54524;54;1883 → 54524 [ACK] Seq=1 Ack=55 Win=8192 Len=0;
59;Jan 13, 2022 19:30:17.941670588 CET;192.168.1.101;192.168.1.102;1883;54524;58;Connect Ack;
60;Jan 13, 2022 19:30:17.941687423 CET;192.168.1.102;192.168.1.101;54524;1883;54;54524 → 1883 [ACK] Seq=55 Ack=5 Win=42336 Len=0;
61;Jan 13, 2022 19:30:17.941767887 CET;192.168.1.102;192.168.1.101;54524;1883;73;Publish Message [topic];message005
62;Jan 13, 2022 19:30:17.941802033 CET;192.168.1.102;192.168.1.101;54524;1883;56;Disconnect Req;
63;Jan 13, 2022 19:30:18.380544088 CET;192.168.1.102;192.168.1.101;54524;1883;75;[TCP Retransmission] 54524 → 1883 [FIN, PSH, ACK] Seq=55 Ack=5 Win=42336 Len=21;
64;Jan 13, 2022 19:30:18.386813015 CET;192.168.1.101;192.168.1.102;1883;54524;54;1883 → 54524 [FIN, ACK] Seq=5 Ack=77 Win=8192 Len=0;
65;Jan 13, 2022 19:30:18.386837437 CET;192.168.1.102;192.168.1.101;54524;1883;54;54524 → 1883 [ACK] Seq=77 Ack=6 Win=42335 Len=0;
66;Jan 13, 2022 19:30:27.955398677 CET;192.168.1.102;192.168.1.101;54526;1883;74;54526 → 1883 [SYN] Seq=0 Win=42340 Len=0 MSS=1460 SACK_PERM=1 TSval=3425741846 TSecr=0 WS=512;
67;Jan 13, 2022 19:30:27.965641990 CET;192.168.1.101;192.168.1.102;1883;54526;58;1883 → 54526 [SYN, ACK] Seq=0 Ack=1 Win=8192 Len=0 MSS=1460;
68;Jan 13, 2022 19:30:27.965675660 CET;192.168.1.102;192.168.1.101;54526;1883;54;54526 → 1883 [ACK] Seq=1 Ack=1 Win=42340 Len=0;
69;Jan 13, 2022 19:30:27.965745401 CET;192.168.1.102;192.168.1.101;54526;1883;108;Connect Command;
70;Jan 13, 2022 19:30:28.180809693 CET;192.168.1.102;192.168.1.101;54526;1883;108;[TCP Retransmission] 54526 → 1883 [PSH, ACK] Seq=1 Ack=1 Win=42340 Len=54;
71;Jan 13, 2022 19:30:28.198523492 CET;192.168.1.101;192.168.1.102;1883;54526;54;1883 → 54526 [ACK] Seq=1 Ack=55 Win=8192 Len=0;
72;Jan 13, 2022 19:30:28.203858171 CET;192.168.1.101;192.168.1.102;1883;54526;58;Connect Ack;
73;Jan 13, 2022 19:30:28.203871525 CET;192.168.1.102;192.168.1.101;54526;1883;54;54526 → 1883 [ACK] Seq=55 Ack=5 Win=42336 Len=0;
74;Jan 13, 2022 19:30:28.203944644 CET;192.168.1.102;192.168.1.101;54526;1883;73;Publish Message [topic];message006
75;Jan 13, 2022 19:30:28.203977116 CET;192.168.1.102;192.168.1.101;54526;1883;56;Disconnect Req;
76;Jan 13, 2022 19:30:28.652589746 CET;192.168.1.102;192.168.1.101;54526;1883;75;[TCP Retransmission] 54526 → 1883 [FIN, PSH, ACK] Seq=55 Ack=5 Win=42336 Len=21;
77;Jan 13, 2022 19:30:28.659944272 CET;192.168.1.101;192.168.1.102;1883;54526;54;1883 → 54526 [FIN, ACK] Seq=5 Ack=77 Win=8192 Len=0;
78;Jan 13, 2022 19:30:28.659959499 CET;192.168.1.102;192.168.1.101;54526;1883;54;54526 → 1883 [ACK] Seq=77 Ack=6 Win=42335 Len=0;
79;Jan 13, 2022 19:30:38.211836227 CET;192.168.1.102;192.168.1.101;54528;1883;74;54528 → 1883 [SYN] Seq=0 Win=42340 Len=0 MSS=1460 SACK_PERM=1 TSval=3425752102 TSecr=0 WS=512;
80;Jan 13, 2022 19:30:38.215299935 CET;192.168.1.101;192.168.1.102;1883;54528;58;1883 → 54528 [SYN, ACK] Seq=0 Ack=1 Win=8192 Len=0 MSS=1460;
81;Jan 13, 2022 19:30:38.215315779 CET;192.168.1.102;192.168.1.101;54528;1883;54;54528 → 1883 [ACK] Seq=1 Ack=1 Win=42340 Len=0;
82;Jan 13, 2022 19:30:38.215519460 CET;192.168.1.102;192.168.1.101;54528;1883;108;Connect Command;
83;Jan 13, 2022 19:30:38.420847086 CET;192.168.1.102;192.168.1.101;54528;1883;108;[TCP Retransmission] 54528 → 1883 [PSH, ACK] Seq=1 Ack=1 Win=42340 Len=54;
84;Jan 13, 2022 19:30:38.435835413 CET;192.168.1.101;192.168.1.102;1883;54528;54;1883 → 54528 [ACK] Seq=1 Ack=55 Win=8192 Len=0;
85;Jan 13, 2022 19:30:38.443880494 CET;192.168.1.101;192.168.1.102;1883;54528;58;Connect Ack;
86;Jan 13, 2022 19:30:38.443893330 CET;192.168.1.102;192.168.1.101;54528;1883;54;54528 → 1883 [ACK] Seq=55 Ack=5 Win=42336 Len=0;
87;Jan 13, 2022 19:30:38.444006148 CET;192.168.1.102;192.168.1.101;54528;1883;73;Publish Message [topic];message007
88;Jan 13, 2022 19:30:38.444043388 CET;192.168.1.102;192.168.1.101;54528;1883;56;Disconnect Req;
89;Jan 13, 2022 19:30:38.860598084 CET;192.168.1.102;192.168.1.101;54528;1883;75;[TCP Retransmission] 54528 → 1883 [FIN, PSH, ACK] Seq=55 Ack=5 Win=42336 Len=21;
90;Jan 13, 2022 19:30:38.865969685 CET;192.168.1.101;192.168.1.102;1883;54528;54;1883 → 54528 [FIN, ACK] Seq=5 Ack=77 Win=8192 Len=0;
91;Jan 13, 2022 19:30:38.865984121 CET;192.168.1.102;192.168.1.101;54528;1883;54;54528 → 1883 [ACK] Seq=77 Ack=6 Win=42335 Len=0;
92;Jan 13, 2022 19:30:48.452689345 CET;192.168.1.102;192.168.1.101;54530;1883;74;54530 → 1883 [SYN] Seq=0 Win=42340 Len=0 MSS=1460 SACK_PERM=1 TSval=3425762343 TSecr=0 WS=512;
93;Jan 13, 2022 19:30:48.456116576 CET;192.168.1.101;192.168.1.102;1883;54530;58;1883 → 54530 [SYN, ACK] Seq=0 Ack=1 Win=8192 Len=0 MSS=1460;
94;Jan 13, 2022 19:30:48.456131872 CET;192.168.1.102;192.168.1.101;54530;1883;54;54530 → 1883 [ACK] Seq=1 Ack=1 Win=42340 Len=0;
95;Jan 13, 2022 19:30:48.456593491 CET;192.168.1.102;192.168.1.101;54530;1883;108;Connect Command;
96;Jan 13, 2022 19:30:48.664571768 CET;192.168.1.102;192.168.1.101;54530;1883;108;[TCP Retransmission] 54530 → 1883 [PSH, ACK] Seq=1 Ack=1 Win=42340 Len=54;
97;Jan 13, 2022 19:30:48.671044376 CET;192.168.1.101;192.168.1.102;1883;54530;54;1883 → 54530 [ACK] Seq=1 Ack=55 Win=8192 Len=0;
98;Jan 13, 2022 19:30:48.673641381 CET;192.168.1.101;192.168.1.102;1883;54530;58;Connect Ack;
99;Jan 13, 2022 19:30:48.673648039 CET;192.168.1.102;192.168.1.101;54530;1883;54;54530 → 1883 [ACK] Seq=55 Ack=5 Win=42336 Len=0;
100;Jan 13, 2022 19:30:48.673692168 CET;192.168.1.102;192.168.1.101;54530;1883;73;Publish Message [topic];message008
101;Jan 13, 2022 19:30:48.673710614 CET;192.168.1.102;192.168.1.101;54530;1883;56;Disconnect Req;
102;Jan 13, 2022 19:30:49.100584811 CET;192.168.1.102;192.168.1.101;54530;1883;75;[TCP Retransmission] 54530 → 1883 [FIN, PSH, ACK] Seq=55 Ack=5 Win=42336 Len=21;
103;Jan 13, 2022 19:30:49.108330204 CET;192.168.1.101;192.168.1.102;1883;54530;54;1883 → 54530 [FIN, ACK] Seq=5 Ack=77 Win=8192 Len=0;
104;Jan 13, 2022 19:30:49.108345493 CET;192.168.1.102;192.168.1.101;54530;1883;54;54530 → 1883 [ACK] Seq=77 Ack=6 Win=42335 Len=0;
105;Jan 13, 2022 19:30:58.678072738 CET;192.168.1.102;192.168.1.101;54532;1883;74;54532 → 1883 [SYN] Seq=0 Win=42340 Len=0 MSS=1460 SACK_PERM=1 TSval=3425772569 TSecr=0 WS=512;
106;Jan 13, 2022 19:30:58.681087214 CET;192.168.1.101;192.168.1.102;1883;54532;58;1883 → 54532 [SYN, ACK] Seq=0 Ack=1 Win=8192 Len=0 MSS=1460;
107;Jan 13, 2022 19:30:58.681101142 CET;192.168.1.102;192.168.1.101;54532;1883;54;54532 → 1883 [ACK] Seq=1 Ack=1 Win=42340 Len=0;
108;Jan 13, 2022 19:30:58.682439247 CET;192.168.1.102;192.168.1.101;54532;1883;108;Connect Command;
109;Jan 13, 2022 19:30:58.685736058 CET;192.168.1.101;192.168.1.102;1883;54532;54;1883 → 54532 [ACK] Seq=1 Ack=55 Win=8192 Len=0;
110;Jan 13, 2022 19:30:58.688178238 CET;192.168.1.101;192.168.1.102;1883;54532;58;Connect Ack;
111;Jan 13, 2022 19:30:58.688184888 CET;192.168.1.102;192.168.1.101;54532;1883;54;54532 → 1883 [ACK] Seq=55 Ack=5 Win=42336 Len=0;
112;Jan 13, 2022 19:30:58.688225083 CET;192.168.1.102;192.168.1.101;54532;1883;73;Publish Message [topic];message009
113;Jan 13, 2022 19:30:58.688242333 CET;192.168.1.102;192.168.1.101;54532;1883;56;Disconnect Req;
114;Jan 13, 2022 19:30:58.892856812 CET;192.168.1.102;192.168.1.101;54532;1883;75;[TCP Retransmission] 54532 → 1883 [FIN, PSH, ACK] Seq=55 Ack=5 Win=42336 Len=21;
115;Jan 13, 2022 19:30:58.908067496 CET;192.168.1.101;192.168.1.102;1883;54532;54;1883 → 54532 [FIN, ACK] Seq=5 Ack=77 Win=8192 Len=0;
116;Jan 13, 2022 19:30:58.908222002 CET;192.168.1.102;192.168.1.101;54532;1883;54;54532 → 1883 [ACK] Seq=77 Ack=6 Win=42335 Len=0;
117;Jan 13, 2022 19:31:08.700336806 CET;192.168.1.102;192.168.1.101;54534;1883;74;54534 → 1883 [SYN] Seq=0 Win=42340 Len=0 MSS=1460 SACK_PERM=1 TSval=3425782591 TSecr=0 WS=512;
118;Jan 13, 2022 19:31:08.704035774 CET;192.168.1.101;192.168.1.102;1883;54534;58;1883 → 54534 [SYN, ACK] Seq=0 Ack=1 Win=8192 Len=0 MSS=1460;
119;Jan 13, 2022 19:31:08.704055885 CET;192.168.1.102;192.168.1.101;54534;1883;54;54534 → 1883 [ACK] Seq=1 Ack=1 Win=42340 Len=0;
120;Jan 13, 2022 19:31:08.704270071 CET;192.168.1.102;192.168.1.101;54534;1883;108;Connect Command;
121;Jan 13, 2022 19:31:08.908599577 CET;192.168.1.102;192.168.1.101;54534;1883;108;[TCP Retransmission] 54534 → 1883 [PSH, ACK] Seq=1 Ack=1 Win=42340 Len=54;
122;Jan 13, 2022 19:31:08.925118793 CET;192.168.1.101;192.168.1.102;1883;54534;54;1883 → 54534 [ACK] Seq=1 Ack=55 Win=8192 Len=0;
123;Jan 13, 2022 19:31:08.931800456 CET;192.168.1.101;192.168.1.102;1883;54534;58;Connect Ack;
124;Jan 13, 2022 19:31:08.931813334 CET;192.168.1.102;192.168.1.101;54534;1883;54;54534 → 1883 [ACK] Seq=55 Ack=5 Win=42336 Len=0;
125;Jan 13, 2022 19:31:08.931894554 CET;192.168.1.102;192.168.1.101;54534;1883;73;Publish Message [topic];message010
126;Jan 13, 2022 19:31:08.931932783 CET;192.168.1.102;192.168.1.101;54534;1883;56;Disconnect Req;
127;Jan 13, 2022 19:31:09.356581848 CET;192.168.1.102;192.168.1.101;54534;1883;75;[TCP Retransmission] 54534 → 1883 [FIN, PSH, ACK] Seq=55 Ack=5 Win=42336 Len=21;
128;Jan 13, 2022 19:31:09.360117885 CET;192.168.1.101;192.168.1.102;1883;54534;54;1883 → 54534 [FIN, ACK] Seq=5 Ack=77 Win=8192 Len=0;
129;Jan 13, 2022 19:31:09.360131767 CET;192.168.1.102;192.168.1.101;54534;1883;54;54534 → 1883 [ACK] Seq=77 Ack=6 Win=42335 Len=0;
130;Jan 13, 2022 19:31:18.938504235 CET;192.168.1.102;192.168.1.101;54536;1883;74;54536 → 1883 [SYN] Seq=0 Win=42340 Len=0 MSS=1460 SACK_PERM=1 TSval=3425792829 TSecr=0 WS=512;
131;Jan 13, 2022 19:31:18.942972393 CET;192.168.1.101;192.168.1.102;1883;54536;58;1883 → 54536 [SYN, ACK] Seq=0 Ack=1 Win=8192 Len=0 MSS=1460;
132;Jan 13, 2022 19:31:18.942995283 CET;192.168.1.102;192.168.1.101;54536;1883;54;54536 → 1883 [ACK] Seq=1 Ack=1 Win=42340 Len=0;
133;Jan 13, 2022 19:31:18.947618926 CET;192.168.1.102;192.168.1.101;54536;1883;108;Connect Command;
134;Jan 13, 2022 19:31:18.953961520 CET;192.168.1.101;192.168.1.102;1883;54536;54;1883 → 54536 [ACK] Seq=1 Ack=55 Win=8192 Len=0;
135;Jan 13, 2022 19:31:18.961845080 CET;192.168.1.101;192.168.1.102;1883;54536;58;Connect Ack;
136;Jan 13, 2022 19:31:18.961859136 CET;192.168.1.102;192.168.1.101;54536;1883;54;54536 → 1883 [ACK] Seq=55 Ack=5 Win=42336 Len=0;
137;Jan 13, 2022 19:31:18.961911999 CET;192.168.1.102;192.168.1.101;54536;1883;73;Publish Message [topic];message011
138;Jan 13, 2022 19:31:18.961933061 CET;192.168.1.102;192.168.1.101;54536;1883;56;Disconnect Req;
139;Jan 13, 2022 19:31:19.172602823 CET;192.168.1.102;192.168.1.101;54536;1883;75;[TCP Retransmission] 54536 → 1883 [FIN, PSH, ACK] Seq=55 Ack=5 Win=42336 Len=21;
140;Jan 13, 2022 19:31:19.175556884 CET;192.168.1.101;192.168.1.102;1883;54536;54;1883 → 54536 [FIN, ACK] Seq=5 Ack=77 Win=8192 Len=0;
141;Jan 13, 2022 19:31:19.175567470 CET;192.168.1.102;192.168.1.101;54536;1883;54;54536 → 1883 [ACK] Seq=77 Ack=6 Win=42335 Len=0;
142;Jan 13, 2022 19:31:28.969837935 CET;192.168.1.102;192.168.1.101;54538;1883;74;54538 → 1883 [SYN] Seq=0 Win=42340 Len=0 MSS=1460 SACK_PERM=1 TSval=3425802860 TSecr=0 WS=512;
143;Jan 13, 2022 19:31:28.973655955 CET;192.168.1.101;192.168.1.102;1883;54538;58;1883 → 54538 [SYN, ACK] Seq=0 Ack=1 Win=8192 Len=0 MSS=1460;
144;Jan 13, 2022 19:31:28.973671695 CET;192.168.1.102;192.168.1.101;54538;1883;54;54538 → 1883 [ACK] Seq=1 Ack=1 Win=42340 Len=0;
145;Jan 13, 2022 19:31:28.974776893 CET;192.168.1.102;192.168.1.101;54538;1883;108;Connect Command;
146;Jan 13, 2022 19:31:29.180572664 CET;192.168.1.102;192.168.1.101;54538;1883;108;[TCP Retransmission] 54538 → 1883 [PSH, ACK] Seq=1 Ack=1 Win=42340 Len=54;
147;Jan 13, 2022 19:31:29.196926509 CET;192.168.1.101;192.168.1.102;1883;54538;54;1883 → 54538 [ACK] Seq=1 Ack=55 Win=8192 Len=0;
148;Jan 13, 2022 19:31:29.203488372 CET;192.168.1.101;192.168.1.102;1883;54538;58;Connect Ack;
149;Jan 13, 2022 19:31:29.203501676 CET;192.168.1.102;192.168.1.101;54538;1883;54;54538 → 1883 [ACK] Seq=55 Ack=5 Win=42336 Len=0;
150;Jan 13, 2022 19:31:29.203587314 CET;192.168.1.102;192.168.1.101;54538;1883;73;Publish Message [topic];message012
151;Jan 13, 2022 19:31:29.203627569 CET;192.168.1.102;192.168.1.101;54538;1883;56;Disconnect Req;
152;Jan 13, 2022 19:31:29.612649238 CET;192.168.1.102;192.168.1.101;54538;1883;75;[TCP Retransmission] 54538 → 1883 [FIN, PSH, ACK] Seq=55 Ack=5 Win=42336 Len=21;
153;Jan 13, 2022 19:31:29.660536742 CET;192.168.1.101;192.168.1.102;1883;54538;54;1883 → 54538 [FIN, ACK] Seq=5 Ack=77 Win=8192 Len=0;
154;Jan 13, 2022 19:31:29.660591891 CET;192.168.1.102;192.168.1.101;54538;1883;54;54538 → 1883 [ACK] Seq=77 Ack=6 Win=42335 Len=0;
155;Jan 13, 2022 19:31:39.216158240 CET;192.168.1.102;192.168.1.101;54540;1883;74;54540 → 1883 [SYN] Seq=0 Win=42340 Len=0 MSS=1460 SACK_PERM=1 TSval=3425813107 TSecr=0 WS=512;
156;Jan 13, 2022 19:31:39.227165460 CET;192.168.1.101;192.168.1.102;1883;54540;58;1883 → 54540 [SYN, ACK] Seq=0 Ack=1 Win=8192 Len=0 MSS=1460;
157;Jan 13, 2022 19:31:39.227179277 CET;192.168.1.102;192.168.1.101;54540;1883;54;54540 → 1883 [ACK] Seq=1 Ack=1 Win=42340 Len=0;
158;Jan 13, 2022 19:31:39.227221118 CET;192.168.1.102;192.168.1.101;54540;1883;108;Connect Command;
159;Jan 13, 2022 19:31:39.440546420 CET;192.168.1.102;192.168.1.101;54540;1883;108;[TCP Retransmission] 54540 → 1883 [PSH, ACK] Seq=1 Ack=1 Win=42340 Len=54;
160;Jan 13, 2022 19:31:39.447691861 CET;192.168.1.101;192.168.1.102;1883;54540;54;1883 → 54540 [ACK] Seq=1 Ack=55 Win=8192 Len=0;
161;Jan 13, 2022 19:31:39.450362208 CET;192.168.1.101;192.168.1.102;1883;54540;58;Connect Ack;
162;Jan 13, 2022 19:31:39.450368617 CET;192.168.1.102;192.168.1.101;54540;1883;54;54540 → 1883 [ACK] Seq=55 Ack=5 Win=42336 Len=0;
163;Jan 13, 2022 19:31:39.450419938 CET;192.168.1.102;192.168.1.101;54540;1883;73;Publish Message [topic];message013
164;Jan 13, 2022 19:31:39.450442200 CET;192.168.1.102;192.168.1.101;54540;1883;56;Disconnect Req;
165;Jan 13, 2022 19:31:39.884757718 CET;192.168.1.102;192.168.1.101;54540;1883;75;[TCP Retransmission] 54540 → 1883 [FIN, PSH, ACK] Seq=55 Ack=5 Win=42336 Len=21;
166;Jan 13, 2022 19:31:39.891903993 CET;192.168.1.101;192.168.1.102;1883;54540;54;1883 → 54540 [FIN, ACK] Seq=5 Ack=77 Win=8192 Len=0;
167;Jan 13, 2022 19:31:39.891922753 CET;192.168.1.102;192.168.1.101;54540;1883;54;54540 → 1883 [ACK] Seq=77 Ack=6 Win=42335 Len=0;
168;Jan 13, 2022 19:31:49.457588838 CET;192.168.1.102;192.168.1.101;54542;1883;74;54542 → 1883 [SYN] Seq=0 Win=42340 Len=0 MSS=1460 SACK_PERM=1 TSval=3425823348 TSecr=0 WS=512;
169;Jan 13, 2022 19:31:49.461527465 CET;192.168.1.101;192.168.1.102;1883;54542;58;1883 → 54542 [SYN, ACK] Seq=0 Ack=1 Win=8192 Len=0 MSS=1460;
170;Jan 13, 2022 19:31:49.461556451 CET;192.168.1.102;192.168.1.101;54542;1883;54;54542 → 1883 [ACK] Seq=1 Ack=1 Win=42340 Len=0;
171;Jan 13, 2022 19:31:49.461875739 CET;192.168.1.102;192.168.1.101;54542;1883;108;Connect Command;
172;Jan 13, 2022 19:31:49.668692546 CET;192.168.1.102;192.168.1.101;54542;1883;108;[TCP Retransmission] 54542 → 1883 [PSH, ACK] Seq=1 Ack=1 Win=42340 Len=54;
173;Jan 13, 2022 19:31:49.676189912 CET;192.168.1.101;192.168.1.102;1883;54542;54;1883 → 54542 [ACK] Seq=1 Ack=55 Win=8192 Len=0;
174;Jan 13, 2022 19:31:49.679025142 CET;192.168.1.101;192.168.1.102;1883;54542;58;Connect Ack;
175;Jan 13, 2022 19:31:49.679038902 CET;192.168.1.102;192.168.1.101;54542;1883;54;54542 → 1883 [ACK] Seq=55 Ack=5 Win=42336 Len=0;
176;Jan 13, 2022 19:31:49.679101189 CET;192.168.1.102;192.168.1.101;54542;1883;73;Publish Message [topic];message014
177;Jan 13, 2022 19:31:49.679124358 CET;192.168.1.102;192.168.1.101;54542;1883;56;Disconnect Req;
178;Jan 13, 2022 19:31:50.092575063 CET;192.168.1.102;192.168.1.101;54542;1883;75;[TCP Retransmission] 54542 → 1883 [FIN, PSH, ACK] Seq=55 Ack=5 Win=42336 Len=21;
179;Jan 13, 2022 19:31:50.106780138 CET;192.168.1.101;192.168.1.102;1883;54542;54;1883 → 54542 [FIN, ACK] Seq=5 Ack=77 Win=8192 Len=0;
180;Jan 13, 2022 19:31:50.106815836 CET;192.168.1.102;192.168.1.101;54542;1883;54;54542 → 1883 [ACK] Seq=77 Ack=6 Win=42335 Len=0;
181;Jan 13, 2022 19:31:59.686118808 CET;192.168.1.102;192.168.1.101;54544;1883;74;54544 → 1883 [SYN] Seq=0 Win=42340 Len=0 MSS=1460 SACK_PERM=1 TSval=3425833577 TSecr=0 WS=512;
182;Jan 13, 2022 19:31:59.689222542 CET;192.168.1.101;192.168.1.102;1883;54544;58;1883 → 54544 [SYN, ACK] Seq=0 Ack=1 Win=8192 Len=0 MSS=1460;
183;Jan 13, 2022 19:31:59.689240285 CET;192.168.1.102;192.168.1.101;54544;1883;54;54544 → 1883 [ACK] Seq=1 Ack=1 Win=42340 Len=0;
184;Jan 13, 2022 19:31:59.690682719 CET;192.168.1.102;192.168.1.101;54544;1883;108;Connect Command;
185;Jan 13, 2022 19:31:59.694064587 CET;192.168.1.101;192.168.1.102;1883;54544;54;1883 → 54544 [ACK] Seq=1 Ack=55 Win=8192 Len=0;
186;Jan 13, 2022 19:31:59.696726229 CET;192.168.1.101;192.168.1.102;1883;54544;58;Connect Ack;
187;Jan 13, 2022 19:31:59.696732522 CET;192.168.1.102;192.168.1.101;54544;1883;54;54544 → 1883 [ACK] Seq=55 Ack=5 Win=42336 Len=0;
188;Jan 13, 2022 19:31:59.696769001 CET;192.168.1.102;192.168.1.101;54544;1883;73;Publish Message [topic];message015
189;Jan 13, 2022 19:31:59.696787743 CET;192.168.1.102;192.168.1.101;54544;1883;56;Disconnect Req;
190;Jan 13, 2022 19:31:59.904533173 CET;192.168.1.102;192.168.1.101;54544;1883;75;[TCP Retransmission] 54544 → 1883 [FIN, PSH, ACK] Seq=55 Ack=5 Win=42336 Len=21;
191;Jan 13, 2022 19:31:59.910055119 CET;192.168.1.101;192.168.1.102;1883;54544;54;1883 → 54544 [FIN, ACK] Seq=5 Ack=77 Win=8192 Len=0;
192;Jan 13, 2022 19:31:59.910080064 CET;192.168.1.102;192.168.1.101;54544;1883;54;54544 → 1883 [ACK] Seq=77 Ack=6 Win=42335 Len=0;
193;Jan 13, 2022 19:32:09.704274270 CET;192.168.1.102;192.168.1.101;54546;1883;74;54546 → 1883 [SYN] Seq=0 Win=42340 Len=0 MSS=1460 SACK_PERM=1 TSval=3425843595 TSecr=0 WS=512;
194;Jan 13, 2022 19:32:09.708193428 CET;192.168.1.101;192.168.1.102;1883;54546;58;1883 → 54546 [SYN, ACK] Seq=0 Ack=1 Win=8192 Len=0 MSS=1460;
195;Jan 13, 2022 19:32:09.708219129 CET;192.168.1.102;192.168.1.101;54546;1883;54;54546 → 1883 [ACK] Seq=1 Ack=1 Win=42340 Len=0;
196;Jan 13, 2022 19:32:09.709300663 CET;192.168.1.102;192.168.1.101;54546;1883;108;Connect Command;
197;Jan 13, 2022 19:32:09.916707265 CET;192.168.1.102;192.168.1.101;54546;1883;108;[TCP Retransmission] 54546 → 1883 [PSH, ACK] Seq=1 Ack=1 Win=42340 Len=54;
198;Jan 13, 2022 19:32:09.933337640 CET;192.168.1.101;192.168.1.102;1883;54546;54;1883 → 54546 [ACK] Seq=1 Ack=55 Win=8192 Len=0;
199;Jan 13, 2022 19:32:09.940273665 CET;192.168.1.101;192.168.1.102;1883;54546;58;Connect Ack;
200;Jan 13, 2022 19:32:09.940289185 CET;192.168.1.102;192.168.1.101;54546;1883;54;54546 → 1883 [ACK] Seq=55 Ack=5 Win=42336 Len=0;
201;Jan 13, 2022 19:32:09.940385764 CET;192.168.1.102;192.168.1.101;54546;1883;73;Publish Message [topic];message016
202;Jan 13, 2022 19:32:09.940431201 CET;192.168.1.102;192.168.1.101;54546;1883;56;Disconnect Req;
203;Jan 13, 2022 19:32:10.348719623 CET;192.168.1.102;192.168.1.101;54546;1883;75;[TCP Retransmission] 54546 → 1883 [FIN, PSH, ACK] Seq=55 Ack=5 Win=42336 Len=21;
204;Jan 13, 2022 19:32:10.364394572 CET;192.168.1.101;192.168.1.102;1883;54546;54;1883 → 54546 [FIN, ACK] Seq=5 Ack=77 Win=8192 Len=0;
205;Jan 13, 2022 19:32:10.364430586 CET;192.168.1.102;192.168.1.101;54546;1883;54;54546 → 1883 [ACK] Seq=77 Ack=6 Win=42335 Len=0;
206;Jan 13, 2022 19:32:19.949150371 CET;192.168.1.102;192.168.1.101;54550;1883;74;54550 → 1883 [SYN] Seq=0 Win=42340 Len=0 MSS=1460 SACK_PERM=1 TSval=3425853840 TSecr=0 WS=512;
207;Jan 13, 2022 19:32:19.952758605 CET;192.168.1.101;192.168.1.102;1883;54550;58;1883 → 54550 [SYN, ACK] Seq=0 Ack=1 Win=8192 Len=0 MSS=1460;
208;Jan 13, 2022 19:32:19.952776237 CET;192.168.1.102;192.168.1.101;54550;1883;54;54550 → 1883 [ACK] Seq=1 Ack=1 Win=42340 Len=0;
209;Jan 13, 2022 19:32:19.953022550 CET;192.168.1.102;192.168.1.101;54550;1883;108;Connect Command;
210;Jan 13, 2022 19:32:20.160563420 CET;192.168.1.102;192.168.1.101;54550;1883;108;[TCP Retransmission] 54550 → 1883 [PSH, ACK] Seq=1 Ack=1 Win=42340 Len=54;
211;Jan 13, 2022 19:32:20.175195621 CET;192.168.1.101;192.168.1.102;1883;54550;54;1883 → 54550 [ACK] Seq=1 Ack=55 Win=8192 Len=0;
212;Jan 13, 2022 19:32:20.183904778 CET;192.168.1.101;192.168.1.102;1883;54550;58;Connect Ack;
213;Jan 13, 2022 19:32:20.183921606 CET;192.168.1.102;192.168.1.101;54550;1883;54;54550 → 1883 [ACK] Seq=55 Ack=5 Win=42336 Len=0;
214;Jan 13, 2022 19:32:20.184030052 CET;192.168.1.102;192.168.1.101;54550;1883;73;Publish Message [topic];message017
215;Jan 13, 2022 19:32:20.184084083 CET;192.168.1.102;192.168.1.101;54550;1883;56;Disconnect Req;
216;Jan 13, 2022 19:32:20.620522949 CET;192.168.1.102;192.168.1.101;54550;1883;75;[TCP Retransmission] 54550 → 1883 [FIN, PSH, ACK] Seq=55 Ack=5 Win=42336 Len=21;
217;Jan 13, 2022 19:32:20.624562683 CET;192.168.1.101;192.168.1.102;1883;54550;54;1883 → 54550 [FIN, ACK] Seq=5 Ack=77 Win=8192 Len=0;
218;Jan 13, 2022 19:32:20.624584218 CET;192.168.1.102;192.168.1.101;54550;1883;54;54550 → 1883 [ACK] Seq=77 Ack=6 Win=42335 Len=0;
219;Jan 13, 2022 19:32:30.191974519 CET;192.168.1.102;192.168.1.101;54552;1883;74;54552 → 1883 [SYN] Seq=0 Win=42340 Len=0 MSS=1460 SACK_PERM=1 TSval=3425864083 TSecr=0 WS=512;
220;Jan 13, 2022 19:32:30.195630735 CET;192.168.1.101;192.168.1.102;1883;54552;58;1883 → 54552 [SYN, ACK] Seq=0 Ack=1 Win=8192 Len=0 MSS=1460;
221;Jan 13, 2022 19:32:30.195647775 CET;192.168.1.102;192.168.1.101;54552;1883;54;54552 → 1883 [ACK] Seq=1 Ack=1 Win=42340 Len=0;
222;Jan 13, 2022 19:32:30.195872931 CET;192.168.1.102;192.168.1.101;54552;1883;108;Connect Command;
223;Jan 13, 2022 19:32:30.400521879 CET;192.168.1.102;192.168.1.101;54552;1883;108;[TCP Retransmission] 54552 → 1883 [PSH, ACK] Seq=1 Ack=1 Win=42340 Len=54;
224;Jan 13, 2022 19:32:30.405093850 CET;192.168.1.101;192.168.1.102;1883;54552;54;1883 → 54552 [ACK] Seq=1 Ack=55 Win=8192 Len=0;
225;Jan 13, 2022 19:32:30.408237544 CET;192.168.1.101;192.168.1.102;1883;54552;58;Connect Ack;
226;Jan 13, 2022 19:32:30.408245494 CET;192.168.1.102;192.168.1.101;54552;1883;54;54552 → 1883 [ACK] Seq=55 Ack=5 Win=42336 Len=0;
227;Jan 13, 2022 19:32:30.408318568 CET;192.168.1.102;192.168.1.101;54552;1883;73;Publish Message [topic];message018
228;Jan 13, 2022 19:32:30.408345983 CET;192.168.1.102;192.168.1.101;54552;1883;56;Disconnect Req;
229;Jan 13, 2022 19:32:30.828525435 CET;192.168.1.102;192.168.1.101;54552;1883;75;[TCP Retransmission] 54552 → 1883 [FIN, PSH, ACK] Seq=55 Ack=5 Win=42336 Len=21;
230;Jan 13, 2022 19:32:30.832288633 CET;192.168.1.101;192.168.1.102;1883;54552;54;1883 → 54552 [FIN, ACK] Seq=5 Ack=77 Win=8192 Len=0;
231;Jan 13, 2022 19:32:30.832306925 CET;192.168.1.102;192.168.1.101;54552;1883;54;54552 → 1883 [ACK] Seq=77 Ack=6 Win=42335 Len=0;
232;Jan 13, 2022 19:32:40.412301002 CET;192.168.1.102;192.168.1.101;54554;1883;74;54554 → 1883 [SYN] Seq=0 Win=42340 Len=0 MSS=1460 SACK_PERM=1 TSval=3425874303 TSecr=0 WS=512;
233;Jan 13, 2022 19:32:40.415397487 CET;192.168.1.101;192.168.1.102;1883;54554;58;1883 → 54554 [SYN, ACK] Seq=0 Ack=1 Win=8192 Len=0 MSS=1460;
234;Jan 13, 2022 19:32:40.415410971 CET;192.168.1.102;192.168.1.101;54554;1883;54;54554 → 1883 [ACK] Seq=1 Ack=1 Win=42340 Len=0;
235;Jan 13, 2022 19:32:40.415607952 CET;192.168.1.102;192.168.1.101;54554;1883;108;Connect Command;
236;Jan 13, 2022 19:32:40.620544141 CET;192.168.1.102;192.168.1.101;54554;1883;108;[TCP Retransmission] 54554 → 1883 [PSH, ACK] Seq=1 Ack=1 Win=42340 Len=54;
237;Jan 13, 2022 19:32:40.634768673 CET;192.168.1.101;192.168.1.102;1883;54554;54;1883 → 54554 [ACK] Seq=1 Ack=55 Win=8192 Len=0;
238;Jan 13, 2022 19:32:40.641416202 CET;192.168.1.101;192.168.1.102;1883;54554;58;Connect Ack;
239;Jan 13, 2022 19:32:40.641430473 CET;192.168.1.102;192.168.1.101;54554;1883;54;54554 → 1883 [ACK] Seq=55 Ack=5 Win=42336 Len=0;
240;Jan 13, 2022 19:32:40.641515775 CET;192.168.1.102;192.168.1.101;54554;1883;73;Publish Message [topic];message019
241;Jan 13, 2022 19:32:40.641558227 CET;192.168.1.102;192.168.1.101;54554;1883;56;Disconnect Req;
242;Jan 13, 2022 19:32:41.068631127 CET;192.168.1.102;192.168.1.101;54554;1883;75;[TCP Retransmission] 54554 → 1883 [FIN, PSH, ACK] Seq=55 Ack=5 Win=42336 Len=21;
243;Jan 13, 2022 19:32:41.076670226 CET;192.168.1.101;192.168.1.102;1883;54554;54;1883 → 54554 [FIN, ACK] Seq=5 Ack=77 Win=8192 Len=0;
244;Jan 13, 2022 19:32:41.076691752 CET;192.168.1.102;192.168.1.101;54554;1883;54;54554 → 1883 [ACK] Seq=77 Ack=6 Win=42335 Len=0;
245;Jan 13, 2022 19:32:50.649992480 CET;192.168.1.102;192.168.1.101;54556;1883;74;54556 → 1883 [SYN] Seq=0 Win=42340 Len=0 MSS=1460 SACK_PERM=1 TSval=3425884541 TSecr=0 WS=512;
246;Jan 13, 2022 19:32:50.653657080 CET;192.168.1.101;192.168.1.102;1883;54556;58;1883 → 54556 [SYN, ACK] Seq=0 Ack=1 Win=8192 Len=0 MSS=1460;
247;Jan 13, 2022 19:32:50.653676486 CET;192.168.1.102;192.168.1.101;54556;1883;54;54556 → 1883 [ACK] Seq=1 Ack=1 Win=42340 Len=0;
248;Jan 13, 2022 19:32:50.653904335 CET;192.168.1.102;192.168.1.101;54556;1883;108;Connect Command;
249;Jan 13, 2022 19:32:50.860732102 CET;192.168.1.102;192.168.1.101;54556;1883;108;[TCP Retransmission] 54556 → 1883 [PSH, ACK] Seq=1 Ack=1 Win=42340 Len=54;
250;Jan 13, 2022 19:32:50.875552340 CET;192.168.1.101;192.168.1.102;1883;54556;54;1883 → 54556 [ACK] Seq=1 Ack=55 Win=8192 Len=0;
251;Jan 13, 2022 19:32:50.882281070 CET;192.168.1.101;192.168.1.102;1883;54556;58;Connect Ack;
252;Jan 13, 2022 19:32:50.882294676 CET;192.168.1.102;192.168.1.101;54556;1883;54;54556 → 1883 [ACK] Seq=55 Ack=5 Win=42336 Len=0;
253;Jan 13, 2022 19:32:50.882380294 CET;192.168.1.102;192.168.1.101;54556;1883;73;Publish Message [topic];message020
254;Jan 13, 2022 19:32:50.882422423 CET;192.168.1.102;192.168.1.101;54556;1883;56;Disconnect Req;
255;Jan 13, 2022 19:32:51.308641653 CET;192.168.1.102;192.168.1.101;54556;1883;75;[TCP Retransmission] 54556 → 1883 [FIN, PSH, ACK] Seq=55 Ack=5 Win=42336 Len=21;
256;Jan 13, 2022 19:32:51.315069091 CET;192.168.1.101;192.168.1.102;1883;54556;54;1883 → 54556 [FIN, ACK] Seq=5 Ack=77 Win=8192 Len=0;
257;Jan 13, 2022 19:32:51.315088889 CET;192.168.1.102;192.168.1.101;54556;1883;54;54556 → 1883 [ACK] Seq=77 Ack=6 Win=42335 Len=0;
258;Jan 13, 2022 19:33:00.891260924 CET;192.168.1.102;192.168.1.101;54558;1883;74;54558 → 1883 [SYN] Seq=0 Win=42340 Len=0 MSS=1460 SACK_PERM=1 TSval=3425894782 TSecr=0 WS=512;
259;Jan 13, 2022 19:33:00.894476656 CET;192.168.1.101;192.168.1.102;1883;54558;58;1883 → 54558 [SYN, ACK] Seq=0 Ack=1 Win=8192 Len=0 MSS=1460;
260;Jan 13, 2022 19:33:00.894492200 CET;192.168.1.102;192.168.1.101;54558;1883;54;54558 → 1883 [ACK] Seq=1 Ack=1 Win=42340 Len=0;
261;Jan 13, 2022 19:33:00.895904024 CET;192.168.1.102;192.168.1.101;54558;1883;108;Connect Command;
262;Jan 13, 2022 19:33:00.899365457 CET;192.168.1.101;192.168.1.102;1883;54558;54;1883 → 54558 [ACK] Seq=1 Ack=55 Win=8192 Len=0;
263;Jan 13, 2022 19:33:00.902038645 CET;192.168.1.101;192.168.1.102;1883;54558;58;Connect Ack;
264;Jan 13, 2022 19:33:00.902045588 CET;192.168.1.102;192.168.1.101;54558;1883;54;54558 → 1883 [ACK] Seq=55 Ack=5 Win=42336 Len=0;
265;Jan 13, 2022 19:33:00.902085508 CET;192.168.1.102;192.168.1.101;54558;1883;73;Publish Message [topic];message021
266;Jan 13, 2022 19:33:00.902106168 CET;192.168.1.102;192.168.1.101;54558;1883;56;Disconnect Req;
267;Jan 13, 2022 19:33:01.108571712 CET;192.168.1.102;192.168.1.101;54558;1883;75;[TCP Retransmission] 54558 → 1883 [FIN, PSH, ACK] Seq=55 Ack=5 Win=42336 Len=21;
268;Jan 13, 2022 19:33:01.124075387 CET;192.168.1.101;192.168.1.102;1883;54558;54;1883 → 54558 [FIN, ACK] Seq=5 Ack=77 Win=8192 Len=0;
269;Jan 13, 2022 19:33:01.124113677 CET;192.168.1.102;192.168.1.101;54558;1883;54;54558 → 1883 [ACK] Seq=77 Ack=6 Win=42335 Len=0;
270;Jan 13, 2022 19:33:10.910424891 CET;192.168.1.102;192.168.1.101;54560;1883;74;54560 → 1883 [SYN] Seq=0 Win=42340 Len=0 MSS=1460 SACK_PERM=1 TSval=3425904801 TSecr=0 WS=512;
271;Jan 13, 2022 19:33:10.913874085 CET;192.168.1.101;192.168.1.102;1883;54560;58;1883 → 54560 [SYN, ACK] Seq=0 Ack=1 Win=8192 Len=0 MSS=1460;
272;Jan 13, 2022 19:33:10.913890952 CET;192.168.1.102;192.168.1.101;54560;1883;54;54560 → 1883 [ACK] Seq=1 Ack=1 Win=42340 Len=0;
273;Jan 13, 2022 19:33:10.915340218 CET;192.168.1.102;192.168.1.101;54560;1883;108;Connect Command;
274;Jan 13, 2022 19:33:10.918849141 CET;192.168.1.101;192.168.1.102;1883;54560;54;1883 → 54560 [ACK] Seq=1 Ack=55 Win=8192 Len=0;
275;Jan 13, 2022 19:33:10.921558504 CET;192.168.1.101;192.168.1.102;1883;54560;58;Connect Ack;
276;Jan 13, 2022 19:33:10.921565380 CET;192.168.1.102;192.168.1.101;54560;1883;54;54560 → 1883 [ACK] Seq=55 Ack=5 Win=42336 Len=0;
277;Jan 13, 2022 19:33:10.921609070 CET;192.168.1.102;192.168.1.101;54560;1883;73;Publish Message [topic];message022
278;Jan 13, 2022 19:33:10.921630390 CET;192.168.1.102;192.168.1.101;54560;1883;56;Disconnect Req;
279;Jan 13, 2022 19:33:11.128570677 CET;192.168.1.102;192.168.1.101;54560;1883;75;[TCP Retransmission] 54560 → 1883 [FIN, PSH, ACK] Seq=55 Ack=5 Win=42336 Len=21;
280;Jan 13, 2022 19:33:11.143075209 CET;192.168.1.101;192.168.1.102;1883;54560;54;1883 → 54560 [FIN, ACK] Seq=5 Ack=77 Win=8192 Len=0;
281;Jan 13, 2022 19:33:11.143109077 CET;192.168.1.102;192.168.1.101;54560;1883;54;54560 → 1883 [ACK] Seq=77 Ack=6 Win=42335 Len=0;
282;Jan 13, 2022 19:33:20.926423542 CET;192.168.1.102;192.168.1.101;54562;1883;74;54562 → 1883 [SYN] Seq=0 Win=42340 Len=0 MSS=1460 SACK_PERM=1 TSval=3425914817 TSecr=0 WS=512;
283;Jan 13, 2022 19:33:20.929544780 CET;192.168.1.101;192.168.1.102;1883;54562;58;1883 → 54562 [SYN, ACK] Seq=0 Ack=1 Win=8192 Len=0 MSS=1460;
284;Jan 13, 2022 19:33:20.929559782 CET;192.168.1.102;192.168.1.101;54562;1883;54;54562 → 1883 [ACK] Seq=1 Ack=1 Win=42340 Len=0;
285;Jan 13, 2022 19:33:20.930881040 CET;192.168.1.102;192.168.1.101;54562;1883;108;Connect Command;
286;Jan 13, 2022 19:33:20.934087814 CET;192.168.1.101;192.168.1.102;1883;54562;54;1883 → 54562 [ACK] Seq=1 Ack=55 Win=8192 Len=0;
287;Jan 13, 2022 19:33:20.936461978 CET;192.168.1.101;192.168.1.102;1883;54562;58;Connect Ack;
288;Jan 13, 2022 19:33:20.936467285 CET;192.168.1.102;192.168.1.101;54562;1883;54;54562 → 1883 [ACK] Seq=55 Ack=5 Win=42336 Len=0;
289;Jan 13, 2022 19:33:20.936505876 CET;192.168.1.102;192.168.1.101;54562;1883;73;Publish Message [topic];message023
290;Jan 13, 2022 19:33:20.936551939 CET;192.168.1.102;192.168.1.101;54562;1883;56;Disconnect Req;
291;Jan 13, 2022 19:33:21.144560309 CET;192.168.1.102;192.168.1.101;54562;1883;75;[TCP Retransmission] 54562 → 1883 [FIN, PSH, ACK] Seq=55 Ack=5 Win=42336 Len=21;
292;Jan 13, 2022 19:33:21.157852093 CET;192.168.1.101;192.168.1.102;1883;54562;54;1883 → 54562 [FIN, ACK] Seq=5 Ack=77 Win=8192 Len=0;
293;Jan 13, 2022 19:33:21.157885855 CET;192.168.1.102;192.168.1.101;54562;1883;54;54562 → 1883 [ACK] Seq=77 Ack=6 Win=42335 Len=0;
294;Jan 13, 2022 19:33:30.944229626 CET;192.168.1.102;192.168.1.101;54564;1883;74;54564 → 1883 [SYN] Seq=0 Win=42340 Len=0 MSS=1460 SACK_PERM=1 TSval=3425924835 TSecr=0 WS=512;
295;Jan 13, 2022 19:33:30.947783283 CET;192.168.1.101;192.168.1.102;1883;54564;58;1883 → 54564 [SYN, ACK] Seq=0 Ack=1 Win=8192 Len=0 MSS=1460;
296;Jan 13, 2022 19:33:30.947799322 CET;192.168.1.102;192.168.1.101;54564;1883;54;54564 → 1883 [ACK] Seq=1 Ack=1 Win=42340 Len=0;
297;Jan 13, 2022 19:33:30.948043171 CET;192.168.1.102;192.168.1.101;54564;1883;108;Connect Command;
298;Jan 13, 2022 19:33:31.153329968 CET;192.168.1.102;192.168.1.101;54564;1883;108;[TCP Retransmission] 54564 → 1883 [PSH, ACK] Seq=1 Ack=1 Win=42340 Len=54;
299;Jan 13, 2022 19:33:31.170046152 CET;192.168.1.101;192.168.1.102;1883;54564;54;1883 → 54564 [ACK] Seq=1 Ack=55 Win=8192 Len=0;
300;Jan 13, 2022 19:33:31.178504161 CET;192.168.1.101;192.168.1.102;1883;54564;58;Connect Ack;
301;Jan 13, 2022 19:33:31.178515875 CET;192.168.1.102;192.168.1.101;54564;1883;54;54564 → 1883 [ACK] Seq=55 Ack=5 Win=42336 Len=0;
302;Jan 13, 2022 19:33:31.178593595 CET;192.168.1.102;192.168.1.101;54564;1883;73;Publish Message [topic];message024
303;Jan 13, 2022 19:33:31.178633875 CET;192.168.1.102;192.168.1.101;54564;1883;56;Disconnect Req;
304;Jan 13, 2022 19:33:31.596624719 CET;192.168.1.102;192.168.1.101;54564;1883;75;[TCP Retransmission] 54564 → 1883 [FIN, PSH, ACK] Seq=55 Ack=5 Win=42336 Len=21;
305;Jan 13, 2022 19:33:31.603094460 CET;192.168.1.101;192.168.1.102;1883;54564;54;1883 → 54564 [FIN, ACK] Seq=5 Ack=77 Win=8192 Len=0;
306;Jan 13, 2022 19:33:31.603109741 CET;192.168.1.102;192.168.1.101;54564;1883;54;54564 → 1883 [ACK] Seq=77 Ack=6 Win=42335 Len=0;
307;Jan 13, 2022 19:33:41.186206102 CET;192.168.1.102;192.168.1.101;54566;1883;74;54566 → 1883 [SYN] Seq=0 Win=42340 Len=0 MSS=1460 SACK_PERM=1 TSval=3425935077 TSecr=0 WS=512;
308;Jan 13, 2022 19:33:41.196320375 CET;192.168.1.101;192.168.1.102;1883;54566;58;1883 → 54566 [SYN, ACK] Seq=0 Ack=1 Win=8192 Len=0 MSS=1460;
309;Jan 13, 2022 19:33:41.196335029 CET;192.168.1.102;192.168.1.101;54566;1883;54;54566 → 1883 [ACK] Seq=1 Ack=1 Win=42340 Len=0;
310;Jan 13, 2022 19:33:41.196381724 CET;192.168.1.102;192.168.1.101;54566;1883;108;Connect Command;
311;Jan 13, 2022 19:33:41.408636836 CET;192.168.1.102;192.168.1.101;54566;1883;108;[TCP Retransmission] 54566 → 1883 [PSH, ACK] Seq=1 Ack=1 Win=42340 Len=54;
312;Jan 13, 2022 19:33:41.424990935 CET;192.168.1.101;192.168.1.102;1883;54566;54;1883 → 54566 [ACK] Seq=1 Ack=55 Win=8192 Len=0;
313;Jan 13, 2022 19:33:41.431789088 CET;192.168.1.101;192.168.1.102;1883;54566;58;Connect Ack;
314;Jan 13, 2022 19:33:41.431802586 CET;192.168.1.102;192.168.1.101;54566;1883;54;54566 → 1883 [ACK] Seq=55 Ack=5 Win=42336 Len=0;
315;Jan 13, 2022 19:33:41.431894319 CET;192.168.1.102;192.168.1.101;54566;1883;73;Publish Message [topic];message025
316;Jan 13, 2022 19:33:41.431942576 CET;192.168.1.102;192.168.1.101;54566;1883;56;Disconnect Req;
317;Jan 13, 2022 19:33:41.868603019 CET;192.168.1.102;192.168.1.101;54566;1883;75;[TCP Retransmission] 54566 → 1883 [FIN, PSH, ACK] Seq=55 Ack=5 Win=42336 Len=21;
318;Jan 13, 2022 19:33:41.875298132 CET;192.168.1.101;192.168.1.102;1883;54566;54;1883 → 54566 [FIN, ACK] Seq=5 Ack=77 Win=8192 Len=0;
319;Jan 13, 2022 19:33:41.875313363 CET;192.168.1.102;192.168.1.101;54566;1883;54;54566 → 1883 [ACK] Seq=77 Ack=6 Win=42335 Len=0;
320;Jan 13, 2022 19:33:51.445611634 CET;192.168.1.102;192.168.1.101;54568;1883;74;54568 → 1883 [SYN] Seq=0 Win=42340 Len=0 MSS=1460 SACK_PERM=1 TSval=3425945336 TSecr=0 WS=512;
321;Jan 13, 2022 19:33:51.454721473 CET;192.168.1.101;192.168.1.102;1883;54568;58;1883 → 54568 [SYN, ACK] Seq=0 Ack=1 Win=8192 Len=0 MSS=1460;
322;Jan 13, 2022 19:33:51.454761150 CET;192.168.1.102;192.168.1.101;54568;1883;54;54568 → 1883 [ACK] Seq=1 Ack=1 Win=42340 Len=0;
323;Jan 13, 2022 19:33:51.454848134 CET;192.168.1.102;192.168.1.101;54568;1883;108;Connect Command;
324;Jan 13, 2022 19:33:51.668845472 CET;192.168.1.102;192.168.1.101;54568;1883;108;[TCP Retransmission] 54568 → 1883 [PSH, ACK] Seq=1 Ack=1 Win=42340 Len=54;
325;Jan 13, 2022 19:33:51.687071167 CET;192.168.1.101;192.168.1.102;1883;54568;54;1883 → 54568 [ACK] Seq=1 Ack=55 Win=8192 Len=0;
326;Jan 13, 2022 19:33:51.693644257 CET;192.168.1.101;192.168.1.102;1883;54568;58;Connect Ack;
327;Jan 13, 2022 19:33:51.693664255 CET;192.168.1.102;192.168.1.101;54568;1883;54;54568 → 1883 [ACK] Seq=55 Ack=5 Win=42336 Len=0;
328;Jan 13, 2022 19:33:51.693748223 CET;192.168.1.102;192.168.1.101;54568;1883;73;Publish Message [topic];message026
329;Jan 13, 2022 19:33:51.693790404 CET;192.168.1.102;192.168.1.101;54568;1883;56;Disconnect Req;
330;Jan 13, 2022 19:33:52.140616913 CET;192.168.1.102;192.168.1.101;54568;1883;75;[TCP Retransmission] 54568 → 1883 [FIN, PSH, ACK] Seq=55 Ack=5 Win=42336 Len=21;
331;Jan 13, 2022 19:33:52.145974278 CET;192.168.1.101;192.168.1.102;1883;54568;54;1883 → 54568 [FIN, ACK] Seq=5 Ack=77 Win=8192 Len=0;
332;Jan 13, 2022 19:33:52.145994707 CET;192.168.1.102;192.168.1.101;54568;1883;54;54568 → 1883 [ACK] Seq=77 Ack=6 Win=42335 Len=0;
333;Jan 13, 2022 19:34:01.702013463 CET;192.168.1.102;192.168.1.101;54570;1883;74;54570 → 1883 [SYN] Seq=0 Win=42340 Len=0 MSS=1460 SACK_PERM=1 TSval=3425955593 TSecr=0 WS=512;
334;Jan 13, 2022 19:34:01.705370039 CET;192.168.1.101;192.168.1.102;1883;54570;58;1883 → 54570 [SYN, ACK] Seq=0 Ack=1 Win=8192 Len=0 MSS=1460;
335;Jan 13, 2022 19:34:01.705386234 CET;192.168.1.102;192.168.1.101;54570;1883;54;54570 → 1883 [ACK] Seq=1 Ack=1 Win=42340 Len=0;
336;Jan 13, 2022 19:34:01.706779818 CET;192.168.1.102;192.168.1.101;54570;1883;108;Connect Command;
337;Jan 13, 2022 19:34:01.710221141 CET;192.168.1.101;192.168.1.102;1883;54570;54;1883 → 54570 [ACK] Seq=1 Ack=55 Win=8192 Len=0;
338;Jan 13, 2022 19:34:01.712472465 CET;192.168.1.101;192.168.1.102;1883;54570;58;Connect Ack;
339;Jan 13, 2022 19:34:01.712479087 CET;192.168.1.102;192.168.1.101;54570;1883;54;54570 → 1883 [ACK] Seq=55 Ack=5 Win=42336 Len=0;
340;Jan 13, 2022 19:34:01.712523288 CET;192.168.1.102;192.168.1.101;54570;1883;73;Publish Message [topic];message027
341;Jan 13, 2022 19:34:01.712576128 CET;192.168.1.102;192.168.1.101;54570;1883;56;Disconnect Req;
342;Jan 13, 2022 19:34:01.921045027 CET;192.168.1.102;192.168.1.101;54570;1883;75;[TCP Retransmission] 54570 → 1883 [FIN, PSH, ACK] Seq=55 Ack=5 Win=42336 Len=21;
343;Jan 13, 2022 19:34:01.938533646 CET;192.168.1.101;192.168.1.102;1883;54570;54;1883 → 54570 [FIN, ACK] Seq=5 Ack=77 Win=8192 Len=0;
344;Jan 13, 2022 19:34:01.938570680 CET;192.168.1.102;192.168.1.101;54570;1883;54;54570 → 1883 [ACK] Seq=77 Ack=6 Win=42335 Len=0;
345;Jan 13, 2022 19:34:11.716378755 CET;192.168.1.102;192.168.1.101;54572;1883;74;54572 → 1883 [SYN] Seq=0 Win=42340 Len=0 MSS=1460 SACK_PERM=1 TSval=3425965607 TSecr=0 WS=512;
346;Jan 13, 2022 19:34:11.720007098 CET;192.168.1.101;192.168.1.102;1883;54572;58;1883 → 54572 [SYN, ACK] Seq=0 Ack=1 Win=8192 Len=0 MSS=1460;
347;Jan 13, 2022 19:34:11.720043490 CET;192.168.1.102;192.168.1.101;54572;1883;54;54572 → 1883 [ACK] Seq=1 Ack=1 Win=42340 Len=0;
348;Jan 13, 2022 19:34:11.720290493 CET;192.168.1.102;192.168.1.101;54572;1883;108;Connect Command;
349;Jan 13, 2022 19:34:11.924553741 CET;192.168.1.102;192.168.1.101;54572;1883;108;[TCP Retransmission] 54572 → 1883 [PSH, ACK] Seq=1 Ack=1 Win=42340 Len=54;
350;Jan 13, 2022 19:34:11.938003612 CET;192.168.1.101;192.168.1.102;1883;54572;54;1883 → 54572 [ACK] Seq=1 Ack=55 Win=8192 Len=0;
351;Jan 13, 2022 19:34:11.943438326 CET;192.168.1.101;192.168.1.102;1883;54572;58;Connect Ack;
352;Jan 13, 2022 19:34:11.943451593 CET;192.168.1.102;192.168.1.101;54572;1883;54;54572 → 1883 [ACK] Seq=55 Ack=5 Win=42336 Len=0;
353;Jan 13, 2022 19:34:11.943540945 CET;192.168.1.102;192.168.1.101;54572;1883;73;Publish Message [topic];message028
354;Jan 13, 2022 19:34:11.943589329 CET;192.168.1.102;192.168.1.101;54572;1883;56;Disconnect Req;
355;Jan 13, 2022 19:34:12.364574804 CET;192.168.1.102;192.168.1.101;54572;1883;75;[TCP Retransmission] 54572 → 1883 [FIN, PSH, ACK] Seq=55 Ack=5 Win=42336 Len=21;
356;Jan 13, 2022 19:34:12.370908255 CET;192.168.1.101;192.168.1.102;1883;54572;54;1883 → 54572 [FIN, ACK] Seq=5 Ack=77 Win=8192 Len=0;
357;Jan 13, 2022 19:34:12.370921949 CET;192.168.1.102;192.168.1.101;54572;1883;54;54572 → 1883 [ACK] Seq=77 Ack=6 Win=42335 Len=0;
358;Jan 13, 2022 19:34:21.952156841 CET;192.168.1.102;192.168.1.101;54574;1883;74;54574 → 1883 [SYN] Seq=0 Win=42340 Len=0 MSS=1460 SACK_PERM=1 TSval=3425975843 TSecr=0 WS=512;
359;Jan 13, 2022 19:34:21.955283221 CET;192.168.1.101;192.168.1.102;1883;54574;58;1883 → 54574 [SYN, ACK] Seq=0 Ack=1 Win=8192 Len=0 MSS=1460;
360;Jan 13, 2022 19:34:21.955299335 CET;192.168.1.102;192.168.1.101;54574;1883;54;54574 → 1883 [ACK] Seq=1 Ack=1 Win=42340 Len=0;
361;Jan 13, 2022 19:34:21.956578499 CET;192.168.1.102;192.168.1.101;54574;1883;108;Connect Command;
362;Jan 13, 2022 19:34:21.960050154 CET;192.168.1.101;192.168.1.102;1883;54574;54;1883 → 54574 [ACK] Seq=1 Ack=55 Win=8192 Len=0;
363;Jan 13, 2022 19:34:21.962365528 CET;192.168.1.101;192.168.1.102;1883;54574;58;Connect Ack;
364;Jan 13, 2022 19:34:21.962371870 CET;192.168.1.102;192.168.1.101;54574;1883;54;54574 → 1883 [ACK] Seq=55 Ack=5 Win=42336 Len=0;
365;Jan 13, 2022 19:34:21.962410761 CET;192.168.1.102;192.168.1.101;54574;1883;73;Publish Message [topic];message029
366;Jan 13, 2022 19:34:21.962432336 CET;192.168.1.102;192.168.1.101;54574;1883;56;Disconnect Req;
367;Jan 13, 2022 19:34:22.168568449 CET;192.168.1.102;192.168.1.101;54574;1883;75;[TCP Retransmission] 54574 → 1883 [FIN, PSH, ACK] Seq=55 Ack=5 Win=42336 Len=21;
368;Jan 13, 2022 19:34:22.176282370 CET;192.168.1.101;192.168.1.102;1883;54574;54;1883 → 54574 [FIN, ACK] Seq=5 Ack=77 Win=8192 Len=0;
369;Jan 13, 2022 19:34:22.176314181 CET;192.168.1.102;192.168.1.101;54574;1883;54;54574 → 1883 [ACK] Seq=77 Ack=6 Win=42335 Len=0;
370;Jan 13, 2022 19:34:31.969283718 CET;192.168.1.102;192.168.1.101;54576;1883;74;54576 → 1883 [SYN] Seq=0 Win=42340 Len=0 MSS=1460 SACK_PERM=1 TSval=3425985860 TSecr=0 WS=512;
371;Jan 13, 2022 19:34:31.973416938 CET;192.168.1.101;192.168.1.102;1883;54576;58;1883 → 54576 [SYN, ACK] Seq=0 Ack=1 Win=8192 Len=0 MSS=1460;
372;Jan 13, 2022 19:34:31.973435232 CET;192.168.1.102;192.168.1.101;54576;1883;54;54576 → 1883 [ACK] Seq=1 Ack=1 Win=42340 Len=0;
373;Jan 13, 2022 19:34:31.973539417 CET;192.168.1.102;192.168.1.101;54576;1883;108;Connect Command;
374;Jan 13, 2022 19:34:32.184802055 CET;192.168.1.102;192.168.1.101;54576;1883;108;[TCP Retransmission] 54576 → 1883 [PSH, ACK] Seq=1 Ack=1 Win=42340 Len=54;
375;Jan 13, 2022 19:34:32.201196828 CET;192.168.1.101;192.168.1.102;1883;54576;54;1883 → 54576 [ACK] Seq=1 Ack=55 Win=8192 Len=0;
376;Jan 13, 2022 19:34:32.208021760 CET;192.168.1.101;192.168.1.102;1883;54576;58;Connect Ack;
377;Jan 13, 2022 19:34:32.208035508 CET;192.168.1.102;192.168.1.101;54576;1883;54;54576 → 1883 [ACK] Seq=55 Ack=5 Win=42336 Len=0;
378;Jan 13, 2022 19:34:32.208122354 CET;192.168.1.102;192.168.1.101;54576;1883;73;Publish Message [topic];message030
379;Jan 13, 2022 19:34:32.208169356 CET;192.168.1.102;192.168.1.101;54576;1883;56;Disconnect Req;
380;Jan 13, 2022 19:34:32.652560585 CET;192.168.1.102;192.168.1.101;54576;1883;75;[TCP Retransmission] 54576 → 1883 [FIN, PSH, ACK] Seq=55 Ack=5 Win=42336 Len=21;
381;Jan 13, 2022 19:34:32.669136405 CET;192.168.1.101;192.168.1.102;1883;54576;54;1883 → 54576 [FIN, ACK] Seq=5 Ack=77 Win=8192 Len=0;
382;Jan 13, 2022 19:34:32.669187357 CET;192.168.1.102;192.168.1.101;54576;1883;54;54576 → 1883 [ACK] Seq=77 Ack=6 Win=42335 Len=0;
383;Jan 13, 2022 19:34:42.225518912 CET;192.168.1.102;192.168.1.101;54578;1883;74;54578 → 1883 [SYN] Seq=0 Win=42340 Len=0 MSS=1460 SACK_PERM=1 TSval=3425996116 TSecr=0 WS=512;
384;Jan 13, 2022 19:34:42.233520729 CET;192.168.1.101;192.168.1.102;1883;54578;58;1883 → 54578 [SYN, ACK] Seq=0 Ack=1 Win=8192 Len=0 MSS=1460;
385;Jan 13, 2022 19:34:42.233552878 CET;192.168.1.102;192.168.1.101;54578;1883;54;54578 → 1883 [ACK] Seq=1 Ack=1 Win=42340 Len=0;
386;Jan 13, 2022 19:34:42.233622956 CET;192.168.1.102;192.168.1.101;54578;1883;108;Connect Command;
387;Jan 13, 2022 19:34:42.448580707 CET;192.168.1.102;192.168.1.101;54578;1883;108;[TCP Retransmission] 54578 → 1883 [PSH, ACK] Seq=1 Ack=1 Win=42340 Len=54;
388;Jan 13, 2022 19:34:42.464640536 CET;192.168.1.101;192.168.1.102;1883;54578;54;1883 → 54578 [ACK] Seq=1 Ack=55 Win=8192 Len=0;
389;Jan 13, 2022 19:34:42.470269563 CET;192.168.1.101;192.168.1.102;1883;54578;58;Connect Ack;
390;Jan 13, 2022 19:34:42.470307437 CET;192.168.1.102;192.168.1.101;54578;1883;54;54578 → 1883 [ACK] Seq=55 Ack=5 Win=42336 Len=0;
391;Jan 13, 2022 19:34:42.470396610 CET;192.168.1.102;192.168.1.101;54578;1883;73;Publish Message [topic];message031
392;Jan 13, 2022 19:34:42.470440723 CET;192.168.1.102;192.168.1.101;54578;1883;56;Disconnect Req;
393;Jan 13, 2022 19:34:42.924684702 CET;192.168.1.102;192.168.1.101;54578;1883;75;[TCP Retransmission] 54578 → 1883 [FIN, PSH, ACK] Seq=55 Ack=5 Win=42336 Len=21;
394;Jan 13, 2022 19:34:42.932002839 CET;192.168.1.101;192.168.1.102;1883;54578;54;1883 → 54578 [FIN, ACK] Seq=5 Ack=77 Win=8192 Len=0;
395;Jan 13, 2022 19:34:42.932024088 CET;192.168.1.102;192.168.1.101;54578;1883;54;54578 → 1883 [ACK] Seq=77 Ack=6 Win=42335 Len=0;
396;Jan 13, 2022 19:34:52.478548364 CET;192.168.1.102;192.168.1.101;54580;1883;74;54580 → 1883 [SYN] Seq=0 Win=42340 Len=0 MSS=1460 SACK_PERM=1 TSval=3426006369 TSecr=0 WS=512;
397;Jan 13, 2022 19:34:52.485046025 CET;192.168.1.101;192.168.1.102;1883;54580;58;1883 → 54580 [SYN, ACK] Seq=0 Ack=1 Win=8192 Len=0 MSS=1460;
398;Jan 13, 2022 19:34:52.485075091 CET;192.168.1.102;192.168.1.101;54580;1883;54;54580 → 1883 [ACK] Seq=1 Ack=1 Win=42340 Len=0;
399;Jan 13, 2022 19:34:52.485150173 CET;192.168.1.102;192.168.1.101;54580;1883;108;Connect Command;
400;Jan 13, 2022 19:34:52.697292749 CET;192.168.1.102;192.168.1.101;54580;1883;108;[TCP Retransmission] 54580 → 1883 [PSH, ACK] Seq=1 Ack=1 Win=42340 Len=54;
401;Jan 13, 2022 19:34:52.703069503 CET;192.168.1.101;192.168.1.102;1883;54580;54;1883 → 54580 [ACK] Seq=1 Ack=55 Win=8192 Len=0;
402;Jan 13, 2022 19:34:52.706201522 CET;192.168.1.101;192.168.1.102;1883;54580;58;Connect Ack;
403;Jan 13, 2022 19:34:52.706212687 CET;192.168.1.102;192.168.1.101;54580;1883;54;54580 → 1883 [ACK] Seq=55 Ack=5 Win=42336 Len=0;
404;Jan 13, 2022 19:34:52.706277459 CET;192.168.1.102;192.168.1.101;54580;1883;73;Publish Message [topic];message032
405;Jan 13, 2022 19:34:52.706307794 CET;192.168.1.102;192.168.1.101;54580;1883;56;Disconnect Req;
406;Jan 13, 2022 19:34:53.132545320 CET;192.168.1.102;192.168.1.101;54580;1883;75;[TCP Retransmission] 54580 → 1883 [FIN, PSH, ACK] Seq=55 Ack=5 Win=42336 Len=21;
407;Jan 13, 2022 19:34:53.137314420 CET;192.168.1.101;192.168.1.102;1883;54580;54;1883 → 54580 [FIN, ACK] Seq=5 Ack=77 Win=8192 Len=0;
408;Jan 13, 2022 19:34:53.137334235 CET;192.168.1.102;192.168.1.101;54580;1883;54;54580 → 1883 [ACK] Seq=77 Ack=6 Win=42335 Len=0;
409;Jan 13, 2022 19:35:02.711039154 CET;192.168.1.102;192.168.1.101;54582;1883;74;54582 → 1883 [SYN] Seq=0 Win=42340 Len=0 MSS=1460 SACK_PERM=1 TSval=3426016602 TSecr=0 WS=512;
410;Jan 13, 2022 19:35:02.714540852 CET;192.168.1.101;192.168.1.102;1883;54582;58;1883 → 54582 [SYN, ACK] Seq=0 Ack=1 Win=8192 Len=0 MSS=1460;
411;Jan 13, 2022 19:35:02.714565928 CET;192.168.1.102;192.168.1.101;54582;1883;54;54582 → 1883 [ACK] Seq=1 Ack=1 Win=42340 Len=0;
412;Jan 13, 2022 19:35:02.714856438 CET;192.168.1.102;192.168.1.101;54582;1883;108;Connect Command;
413;Jan 13, 2022 19:35:02.920806930 CET;192.168.1.102;192.168.1.101;54582;1883;108;[TCP Retransmission] 54582 → 1883 [PSH, ACK] Seq=1 Ack=1 Win=42340 Len=54;
414;Jan 13, 2022 19:35:02.924839108 CET;192.168.1.101;192.168.1.102;1883;54582;54;1883 → 54582 [ACK] Seq=1 Ack=55 Win=8192 Len=0;
415;Jan 13, 2022 19:35:02.927542220 CET;192.168.1.101;192.168.1.102;1883;54582;58;Connect Ack;
416;Jan 13, 2022 19:35:02.927552410 CET;192.168.1.102;192.168.1.101;54582;1883;54;54582 → 1883 [ACK] Seq=55 Ack=5 Win=42336 Len=0;
417;Jan 13, 2022 19:35:02.927618912 CET;192.168.1.102;192.168.1.101;54582;1883;73;Publish Message [topic];message033
418;Jan 13, 2022 19:35:02.927643402 CET;192.168.1.102;192.168.1.101;54582;1883;56;Disconnect Req;
419;Jan 13, 2022 19:35:03.340539563 CET;192.168.1.102;192.168.1.101;54582;1883;75;[TCP Retransmission] 54582 → 1883 [FIN, PSH, ACK] Seq=55 Ack=5 Win=42336 Len=21;
420;Jan 13, 2022 19:35:03.346405722 CET;192.168.1.101;192.168.1.102;1883;54582;54;1883 → 54582 [FIN, ACK] Seq=5 Ack=77 Win=8192 Len=0;
421;Jan 13, 2022 19:35:03.346429521 CET;192.168.1.102;192.168.1.101;54582;1883;54;54582 → 1883 [ACK] Seq=77 Ack=6 Win=42335 Len=0;
422;Jan 13, 2022 19:35:12.931903344 CET;192.168.1.102;192.168.1.101;54584;1883;74;54584 → 1883 [SYN] Seq=0 Win=42340 Len=0 MSS=1460 SACK_PERM=1 TSval=3426026823 TSecr=0 WS=512;
423;Jan 13, 2022 19:35:12.936714594 CET;192.168.1.101;192.168.1.102;1883;54584;58;1883 → 54584 [SYN, ACK] Seq=0 Ack=1 Win=8192 Len=0 MSS=1460;
424;Jan 13, 2022 19:35:12.936737602 CET;192.168.1.102;192.168.1.101;54584;1883;54;54584 → 1883 [ACK] Seq=1 Ack=1 Win=42340 Len=0;
425;Jan 13, 2022 19:35:12.936786065 CET;192.168.1.102;192.168.1.101;54584;1883;108;Connect Command;
426;Jan 13, 2022 19:35:13.148634075 CET;192.168.1.102;192.168.1.101;54584;1883;108;[TCP Retransmission] 54584 → 1883 [PSH, ACK] Seq=1 Ack=1 Win=42340 Len=54;
427;Jan 13, 2022 19:35:13.154175222 CET;192.168.1.101;192.168.1.102;1883;54584;54;1883 → 54584 [ACK] Seq=1 Ack=55 Win=8192 Len=0;
428;Jan 13, 2022 19:35:13.156966232 CET;192.168.1.101;192.168.1.102;1883;54584;58;Connect Ack;
429;Jan 13, 2022 19:35:13.156978965 CET;192.168.1.102;192.168.1.101;54584;1883;54;54584 → 1883 [ACK] Seq=55 Ack=5 Win=42336 Len=0;
430;Jan 13, 2022 19:35:13.157033187 CET;192.168.1.102;192.168.1.101;54584;1883;73;Publish Message [topic];message034
431;Jan 13, 2022 19:35:13.157056057 CET;192.168.1.102;192.168.1.101;54584;1883;56;Disconnect Req;
432;Jan 13, 2022 19:35:13.580541863 CET;192.168.1.102;192.168.1.101;54584;1883;75;[TCP Retransmission] 54584 → 1883 [FIN, PSH, ACK] Seq=55 Ack=5 Win=42336 Len=21;
433;Jan 13, 2022 19:35:13.587515254 CET;192.168.1.101;192.168.1.102;1883;54584;54;1883 → 54584 [FIN, ACK] Seq=5 Ack=77 Win=8192 Len=0;
434;Jan 13, 2022 19:35:13.587535046 CET;192.168.1.102;192.168.1.101;54584;1883;54;54584 → 1883 [ACK] Seq=77 Ack=6 Win=42335 Len=0;
435;Jan 13, 2022 19:35:23.161875473 CET;192.168.1.102;192.168.1.101;54586;1883;74;54586 → 1883 [SYN] Seq=0 Win=42340 Len=0 MSS=1460 SACK_PERM=1 TSval=3426037053 TSecr=0 WS=512;
436;Jan 13, 2022 19:35:23.165513677 CET;192.168.1.101;192.168.1.102;1883;54586;58;1883 → 54586 [SYN, ACK] Seq=0 Ack=1 Win=8192 Len=0 MSS=1460;
437;Jan 13, 2022 19:35:23.165540129 CET;192.168.1.102;192.168.1.101;54586;1883;54;54586 → 1883 [ACK] Seq=1 Ack=1 Win=42340 Len=0;
438;Jan 13, 2022 19:35:23.165830812 CET;192.168.1.102;192.168.1.101;54586;1883;108;Connect Command;
439;Jan 13, 2022 19:35:23.372596103 CET;192.168.1.102;192.168.1.101;54586;1883;108;[TCP Retransmission] 54586 → 1883 [PSH, ACK] Seq=1 Ack=1 Win=42340 Len=54;
440;Jan 13, 2022 19:35:23.378770279 CET;192.168.1.101;192.168.1.102;1883;54586;54;1883 → 54586 [ACK] Seq=1 Ack=55 Win=8192 Len=0;
441;Jan 13, 2022 19:35:23.382189136 CET;192.168.1.101;192.168.1.102;1883;54586;58;Connect Ack;
442;Jan 13, 2022 19:35:23.382200622 CET;192.168.1.102;192.168.1.101;54586;1883;54;54586 → 1883 [ACK] Seq=55 Ack=5 Win=42336 Len=0;
443;Jan 13, 2022 19:35:23.382269048 CET;192.168.1.102;192.168.1.101;54586;1883;73;Publish Message [topic];message035
444;Jan 13, 2022 19:35:23.382301487 CET;192.168.1.102;192.168.1.101;54586;1883;56;Disconnect Req;
445;Jan 13, 2022 19:35:23.820535285 CET;192.168.1.102;192.168.1.101;54586;1883;75;[TCP Retransmission] 54586 → 1883 [FIN, PSH, ACK] Seq=55 Ack=5 Win=42336 Len=21;
446;Jan 13, 2022 19:35:23.824355005 CET;192.168.1.101;192.168.1.102;1883;54586;54;1883 → 54586 [FIN, ACK] Seq=5 Ack=77 Win=8192 Len=0;
447;Jan 13, 2022 19:35:23.824374518 CET;192.168.1.102;192.168.1.101;54586;1883;54;54586 → 1883 [ACK] Seq=77 Ack=6 Win=42335 Len=0;
448;Jan 13, 2022 19:35:33.389757916 CET;192.168.1.102;192.168.1.101;54588;1883;74;54588 → 1883 [SYN] Seq=0 Win=42340 Len=0 MSS=1460 SACK_PERM=1 TSval=3426047280 TSecr=0 WS=512;
449;Jan 13, 2022 19:35:33.397205083 CET;192.168.1.101;192.168.1.102;1883;54588;58;1883 → 54588 [SYN, ACK] Seq=0 Ack=1 Win=8192 Len=0 MSS=1460;
450;Jan 13, 2022 19:35:33.397242605 CET;192.168.1.102;192.168.1.101;54588;1883;54;54588 → 1883 [ACK] Seq=1 Ack=1 Win=42340 Len=0;
451;Jan 13, 2022 19:35:33.397335053 CET;192.168.1.102;192.168.1.101;54588;1883;108;Connect Command;
452;Jan 13, 2022 19:35:33.608583962 CET;192.168.1.102;192.168.1.101;54588;1883;108;[TCP Retransmission] 54588 → 1883 [PSH, ACK] Seq=1 Ack=1 Win=42340 Len=54;
453;Jan 13, 2022 19:35:33.612623031 CET;192.168.1.101;192.168.1.102;1883;54588;54;1883 → 54588 [ACK] Seq=1 Ack=55 Win=8192 Len=0;
454;Jan 13, 2022 19:35:33.615605990 CET;192.168.1.101;192.168.1.102;1883;54588;58;Connect Ack;
455;Jan 13, 2022 19:35:33.615617376 CET;192.168.1.102;192.168.1.101;54588;1883;54;54588 → 1883 [ACK] Seq=55 Ack=5 Win=42336 Len=0;
456;Jan 13, 2022 19:35:33.615675622 CET;192.168.1.102;192.168.1.101;54588;1883;73;Publish Message [topic];message036
457;Jan 13, 2022 19:35:33.615700509 CET;192.168.1.102;192.168.1.101;54588;1883;56;Disconnect Req;
458;Jan 13, 2022 19:35:34.061278598 CET;192.168.1.102;192.168.1.101;54588;1883;75;[TCP Retransmission] 54588 → 1883 [FIN, PSH, ACK] Seq=55 Ack=5 Win=42336 Len=21;
459;Jan 13, 2022 19:35:34.065628734 CET;192.168.1.101;192.168.1.102;1883;54588;54;1883 → 54588 [FIN, ACK] Seq=5 Ack=77 Win=8192 Len=0;
460;Jan 13, 2022 19:35:34.065650146 CET;192.168.1.102;192.168.1.101;54588;1883;54;54588 → 1883 [ACK] Seq=77 Ack=6 Win=42335 Len=0;
461;Jan 13, 2022 19:35:43.619941450 CET;192.168.1.102;192.168.1.101;54590;1883;74;54590 → 1883 [SYN] Seq=0 Win=42340 Len=0 MSS=1460 SACK_PERM=1 TSval=3426057511 TSecr=0 WS=512;
462;Jan 13, 2022 19:35:43.631008805 CET;192.168.1.101;192.168.1.102;1883;54590;58;1883 → 54590 [SYN, ACK] Seq=0 Ack=1 Win=8192 Len=0 MSS=1460;
463;Jan 13, 2022 19:35:43.631037629 CET;192.168.1.102;192.168.1.101;54590;1883;54;54590 → 1883 [ACK] Seq=1 Ack=1 Win=42340 Len=0;
464;Jan 13, 2022 19:35:43.631093435 CET;192.168.1.102;192.168.1.101;54590;1883;108;Connect Command;
465;Jan 13, 2022 19:35:43.844548676 CET;192.168.1.102;192.168.1.101;54590;1883;108;[TCP Retransmission] 54590 → 1883 [PSH, ACK] Seq=1 Ack=1 Win=42340 Len=54;
466;Jan 13, 2022 19:35:43.847822670 CET;192.168.1.101;192.168.1.102;1883;54590;54;1883 → 54590 [ACK] Seq=1 Ack=55 Win=8192 Len=0;
467;Jan 13, 2022 19:35:43.851528324 CET;192.168.1.101;192.168.1.102;1883;54590;58;Connect Ack;
468;Jan 13, 2022 19:35:43.851537516 CET;192.168.1.102;192.168.1.101;54590;1883;54;54590 → 1883 [ACK] Seq=55 Ack=5 Win=42336 Len=0;
469;Jan 13, 2022 19:35:43.851589096 CET;192.168.1.102;192.168.1.101;54590;1883;73;Publish Message [topic];message037
470;Jan 13, 2022 19:35:43.851612958 CET;192.168.1.102;192.168.1.101;54590;1883;56;Disconnect Req;
471;Jan 13, 2022 19:35:44.301322869 CET;192.168.1.102;192.168.1.101;54590;1883;75;[TCP Retransmission] 54590 → 1883 [FIN, PSH, ACK] Seq=55 Ack=5 Win=42336 Len=21;
472;Jan 13, 2022 19:35:44.306618421 CET;192.168.1.101;192.168.1.102;1883;54590;54;1883 → 54590 [FIN, ACK] Seq=5 Ack=77 Win=8192 Len=0;
473;Jan 13, 2022 19:35:44.306639306 CET;192.168.1.102;192.168.1.101;54590;1883;54;54590 → 1883 [ACK] Seq=77 Ack=6 Win=42335 Len=0;
474;Jan 13, 2022 19:35:53.856022322 CET;192.168.1.102;192.168.1.101;54592;1883;74;54592 → 1883 [SYN] Seq=0 Win=42340 Len=0 MSS=1460 SACK_PERM=1 TSval=3426067747 TSecr=0 WS=512;
475;Jan 13, 2022 19:35:53.861692115 CET;192.168.1.101;192.168.1.102;1883;54592;58;1883 → 54592 [SYN, ACK] Seq=0 Ack=1 Win=8192 Len=0 MSS=1460;
476;Jan 13, 2022 19:35:53.861721056 CET;192.168.1.102;192.168.1.101;54592;1883;54;54592 → 1883 [ACK] Seq=1 Ack=1 Win=42340 Len=0;
477;Jan 13, 2022 19:35:53.861785569 CET;192.168.1.102;192.168.1.101;54592;1883;108;Connect Command;
478;Jan 13, 2022 19:35:54.072583832 CET;192.168.1.102;192.168.1.101;54592;1883;108;[TCP Retransmission] 54592 → 1883 [PSH, ACK] Seq=1 Ack=1 Win=42340 Len=54;
479;Jan 13, 2022 19:35:54.083869759 CET;192.168.1.101;192.168.1.102;1883;54592;54;1883 → 54592 [ACK] Seq=1 Ack=55 Win=8192 Len=0;
480;Jan 13, 2022 19:35:54.089405528 CET;192.168.1.101;192.168.1.102;1883;54592;58;Connect Ack;
481;Jan 13, 2022 19:35:54.089420484 CET;192.168.1.102;192.168.1.101;54592;1883;54;54592 → 1883 [ACK] Seq=55 Ack=5 Win=42336 Len=0;
482;Jan 13, 2022 19:35:54.089513659 CET;192.168.1.102;192.168.1.101;54592;1883;73;Publish Message [topic];message038
483;Jan 13, 2022 19:35:54.089562994 CET;192.168.1.102;192.168.1.101;54592;1883;56;Disconnect Req;
484;Jan 13, 2022 19:35:54.508527020 CET;192.168.1.102;192.168.1.101;54592;1883;75;[TCP Retransmission] 54592 → 1883 [FIN, PSH, ACK] Seq=55 Ack=5 Win=42336 Len=21;
485;Jan 13, 2022 19:35:54.512421220 CET;192.168.1.101;192.168.1.102;1883;54592;54;1883 → 54592 [FIN, ACK] Seq=5 Ack=77 Win=8192 Len=0;
486;Jan 13, 2022 19:35:54.512438750 CET;192.168.1.102;192.168.1.101;54592;1883;54;54592 → 1883 [ACK] Seq=77 Ack=6 Win=42335 Len=0;
487;Jan 13, 2022 19:36:04.097186930 CET;192.168.1.102;192.168.1.101;54594;1883;74;54594 → 1883 [SYN] Seq=0 Win=42340 Len=0 MSS=1460 SACK_PERM=1 TSval=3426077988 TSecr=0 WS=512;
488;Jan 13, 2022 19:36:04.100466797 CET;192.168.1.101;192.168.1.102;1883;54594;58;1883 → 54594 [SYN, ACK] Seq=0 Ack=1 Win=8192 Len=0 MSS=1460;
489;Jan 13, 2022 19:36:04.100486033 CET;192.168.1.102;192.168.1.101;54594;1883;54;54594 → 1883 [ACK] Seq=1 Ack=1 Win=42340 Len=0;
490;Jan 13, 2022 19:36:04.101969760 CET;192.168.1.102;192.168.1.101;54594;1883;108;Connect Command;
491;Jan 13, 2022 19:36:04.105346433 CET;192.168.1.101;192.168.1.102;1883;54594;54;1883 → 54594 [ACK] Seq=1 Ack=55 Win=8192 Len=0;
492;Jan 13, 2022 19:36:04.107559610 CET;192.168.1.101;192.168.1.102;1883;54594;58;Connect Ack;
493;Jan 13, 2022 19:36:04.107566134 CET;192.168.1.102;192.168.1.101;54594;1883;54;54594 → 1883 [ACK] Seq=55 Ack=5 Win=42336 Len=0;
494;Jan 13, 2022 19:36:04.107606351 CET;192.168.1.102;192.168.1.101;54594;1883;73;Publish Message [topic];message039
495;Jan 13, 2022 19:36:04.107630219 CET;192.168.1.102;192.168.1.101;54594;1883;56;Disconnect Req;
496;Jan 13, 2022 19:36:04.312545535 CET;192.168.1.102;192.168.1.101;54594;1883;75;[TCP Retransmission] 54594 → 1883 [FIN, PSH, ACK] Seq=55 Ack=5 Win=42336 Len=21;
497;Jan 13, 2022 19:36:04.318242491 CET;192.168.1.101;192.168.1.102;1883;54594;54;1883 → 54594 [FIN, ACK] Seq=5 Ack=77 Win=8192 Len=0;
498;Jan 13, 2022 19:36:04.318266119 CET;192.168.1.102;192.168.1.101;54594;1883;54;54594 → 1883 [ACK] Seq=77 Ack=6 Win=42335 Len=0;
499;Jan 13, 2022 19:36:14.111450817 CET;192.168.1.102;192.168.1.101;54596;1883;74;54596 → 1883 [SYN] Seq=0 Win=42340 Len=0 MSS=1460 SACK_PERM=1 TSval=3426088002 TSecr=0 WS=512;
500;Jan 13, 2022 19:36:14.114180550 CET;192.168.1.101;192.168.1.102;1883;54596;58;1883 → 54596 [SYN, ACK] Seq=0 Ack=1 Win=8192 Len=0 MSS=1460;
501;Jan 13, 2022 19:36:14.114194054 CET;192.168.1.102;192.168.1.101;54596;1883;54;54596 → 1883 [ACK] Seq=1 Ack=1 Win=42340 Len=0;
502;Jan 13, 2022 19:36:14.115538735 CET;192.168.1.102;192.168.1.101;54596;1883;108;Connect Command;
503;Jan 13, 2022 19:36:14.119293058 CET;192.168.1.101;192.168.1.102;1883;54596;54;1883 → 54596 [ACK] Seq=1 Ack=55 Win=8192 Len=0;
504;Jan 13, 2022 19:36:14.121661106 CET;192.168.1.101;192.168.1.102;1883;54596;58;Connect Ack;
505;Jan 13, 2022 19:36:14.121668021 CET;192.168.1.102;192.168.1.101;54596;1883;54;54596 → 1883 [ACK] Seq=55 Ack=5 Win=42336 Len=0;
506;Jan 13, 2022 19:36:14.121710256 CET;192.168.1.102;192.168.1.101;54596;1883;73;Publish Message [topic];message040
507;Jan 13, 2022 19:36:14.121734824 CET;192.168.1.102;192.168.1.101;54596;1883;56;Disconnect Req;
508;Jan 13, 2022 19:36:14.328565246 CET;192.168.1.102;192.168.1.101;54596;1883;75;[TCP Retransmission] 54596 → 1883 [FIN, PSH, ACK] Seq=55 Ack=5 Win=42336 Len=21;
509;Jan 13, 2022 19:36:14.338805694 CET;192.168.1.101;192.168.1.102;1883;54596;54;1883 → 54596 [FIN, ACK] Seq=5 Ack=77 Win=8192 Len=0;
510;Jan 13, 2022 19:36:14.338844692 CET;192.168.1.102;192.168.1.101;54596;1883;54;54596 → 1883 [ACK] Seq=77 Ack=6 Win=42335 Len=0;
511;Jan 13, 2022 19:36:24.126054697 CET;192.168.1.102;192.168.1.101;54598;1883;74;54598 → 1883 [SYN] Seq=0 Win=42340 Len=0 MSS=1460 SACK_PERM=1 TSval=3426098017 TSecr=0 WS=512;
512;Jan 13, 2022 19:36:24.130440605 CET;192.168.1.101;192.168.1.102;1883;54598;58;1883 → 54598 [SYN, ACK] Seq=0 Ack=1 Win=8192 Len=0 MSS=1460;
513;Jan 13, 2022 19:36:24.130481307 CET;192.168.1.102;192.168.1.101;54598;1883;54;54598 → 1883 [ACK] Seq=1 Ack=1 Win=42340 Len=0;
514;Jan 13, 2022 19:36:24.130901213 CET;192.168.1.102;192.168.1.101;54598;1883;108;Connect Command;
515;Jan 13, 2022 19:36:24.340844047 CET;192.168.1.102;192.168.1.101;54598;1883;108;[TCP Retransmission] 54598 → 1883 [PSH, ACK] Seq=1 Ack=1 Win=42340 Len=54;
516;Jan 13, 2022 19:36:24.346048327 CET;192.168.1.101;192.168.1.102;1883;54598;54;1883 → 54598 [ACK] Seq=1 Ack=55 Win=8192 Len=0;
517;Jan 13, 2022 19:36:24.348335902 CET;192.168.1.101;192.168.1.102;1883;54598;58;Connect Ack;
518;Jan 13, 2022 19:36:24.348345424 CET;192.168.1.102;192.168.1.101;54598;1883;54;54598 → 1883 [ACK] Seq=55 Ack=5 Win=42336 Len=0;
519;Jan 13, 2022 19:36:24.348402390 CET;192.168.1.102;192.168.1.101;54598;1883;73;Publish Message [topic];message041
520;Jan 13, 2022 19:36:24.348433563 CET;192.168.1.102;192.168.1.101;54598;1883;56;Disconnect Req;
521;Jan 13, 2022 19:36:24.780546081 CET;192.168.1.102;192.168.1.101;54598;1883;75;[TCP Retransmission] 54598 → 1883 [FIN, PSH, ACK] Seq=55 Ack=5 Win=42336 Len=21;
522;Jan 13, 2022 19:36:24.784923983 CET;192.168.1.101;192.168.1.102;1883;54598;54;1883 → 54598 [FIN, ACK] Seq=5 Ack=77 Win=8192 Len=0;
523;Jan 13, 2022 19:36:24.784944008 CET;192.168.1.102;192.168.1.101;54598;1883;54;54598 → 1883 [ACK] Seq=77 Ack=6 Win=42335 Len=0;
524;Jan 13, 2022 19:36:34.356811553 CET;192.168.1.102;192.168.1.101;54600;1883;74;54600 → 1883 [SYN] Seq=0 Win=42340 Len=0 MSS=1460 SACK_PERM=1 TSval=3426108247 TSecr=0 WS=512;
525;Jan 13, 2022 19:36:34.367902182 CET;192.168.1.101;192.168.1.102;1883;54600;58;1883 → 54600 [SYN, ACK] Seq=0 Ack=1 Win=8192 Len=0 MSS=1460;
526;Jan 13, 2022 19:36:34.367946982 CET;192.168.1.102;192.168.1.101;54600;1883;54;54600 → 1883 [ACK] Seq=1 Ack=1 Win=42340 Len=0;
527;Jan 13, 2022 19:36:34.368108132 CET;192.168.1.102;192.168.1.101;54600;1883;108;Connect Command;
528;Jan 13, 2022 19:36:34.580512475 CET;192.168.1.102;192.168.1.101;54600;1883;108;[TCP Retransmission] 54600 → 1883 [PSH, ACK] Seq=1 Ack=1 Win=42340 Len=54;
529;Jan 13, 2022 19:36:34.584821310 CET;192.168.1.101;192.168.1.102;1883;54600;54;1883 → 54600 [ACK] Seq=1 Ack=55 Win=8192 Len=0;
530;Jan 13, 2022 19:36:34.587193243 CET;192.168.1.101;192.168.1.102;1883;54600;58;Connect Ack;
531;Jan 13, 2022 19:36:34.587205344 CET;192.168.1.102;192.168.1.101;54600;1883;54;54600 → 1883 [ACK] Seq=55 Ack=5 Win=42336 Len=0;
532;Jan 13, 2022 19:36:34.587266011 CET;192.168.1.102;192.168.1.101;54600;1883;73;Publish Message [topic];message042
533;Jan 13, 2022 19:36:34.587291209 CET;192.168.1.102;192.168.1.101;54600;1883;56;Disconnect Req;
534;Jan 13, 2022 19:36:35.020968446 CET;192.168.1.102;192.168.1.101;54600;1883;75;[TCP Retransmission] 54600 → 1883 [FIN, PSH, ACK] Seq=55 Ack=5 Win=42336 Len=21;
535;Jan 13, 2022 19:36:35.029877448 CET;192.168.1.101;192.168.1.102;1883;54600;54;1883 → 54600 [FIN, ACK] Seq=5 Ack=77 Win=8192 Len=0;
536;Jan 13, 2022 19:36:35.029900827 CET;192.168.1.102;192.168.1.101;54600;1883;54;54600 → 1883 [ACK] Seq=77 Ack=6 Win=42335 Len=0;
537;Jan 13, 2022 19:36:44.591038534 CET;192.168.1.102;192.168.1.101;54602;1883;74;54602 → 1883 [SYN] Seq=0 Win=42340 Len=0 MSS=1460 SACK_PERM=1 TSval=3426118482 TSecr=0 WS=512;
538;Jan 13, 2022 19:36:44.594220236 CET;192.168.1.101;192.168.1.102;1883;54602;58;1883 → 54602 [SYN, ACK] Seq=0 Ack=1 Win=8192 Len=0 MSS=1460;
539;Jan 13, 2022 19:36:44.594238885 CET;192.168.1.102;192.168.1.101;54602;1883;54;54602 → 1883 [ACK] Seq=1 Ack=1 Win=42340 Len=0;
540;Jan 13, 2022 19:36:44.594450026 CET;192.168.1.102;192.168.1.101;54602;1883;108;Connect Command;
541;Jan 13, 2022 19:36:44.800527100 CET;192.168.1.102;192.168.1.101;54602;1883;108;[TCP Retransmission] 54602 → 1883 [PSH, ACK] Seq=1 Ack=1 Win=42340 Len=54;
542;Jan 13, 2022 19:36:44.805637810 CET;192.168.1.101;192.168.1.102;1883;54602;54;1883 → 54602 [ACK] Seq=1 Ack=55 Win=8192 Len=0;
543;Jan 13, 2022 19:36:44.808001680 CET;192.168.1.101;192.168.1.102;1883;54602;58;Connect Ack;
544;Jan 13, 2022 19:36:44.808012143 CET;192.168.1.102;192.168.1.101;54602;1883;54;54602 → 1883 [ACK] Seq=55 Ack=5 Win=42336 Len=0;
545;Jan 13, 2022 19:36:44.808078570 CET;192.168.1.102;192.168.1.101;54602;1883;73;Publish Message [topic];message043
546;Jan 13, 2022 19:36:44.808107798 CET;192.168.1.102;192.168.1.101;54602;1883;56;Disconnect Req;
547;Jan 13, 2022 19:36:45.228588123 CET;192.168.1.102;192.168.1.101;54602;1883;75;[TCP Retransmission] 54602 → 1883 [FIN, PSH, ACK] Seq=55 Ack=5 Win=42336 Len=21;
548;Jan 13, 2022 19:36:45.235643385 CET;192.168.1.101;192.168.1.102;1883;54602;54;1883 → 54602 [FIN, ACK] Seq=5 Ack=77 Win=8192 Len=0;
549;Jan 13, 2022 19:36:45.235676236 CET;192.168.1.102;192.168.1.101;54602;1883;54;54602 → 1883 [ACK] Seq=77 Ack=6 Win=42335 Len=0;
550;Jan 13, 2022 19:36:54.815030737 CET;192.168.1.102;192.168.1.101;54604;1883;74;54604 → 1883 [SYN] Seq=0 Win=42340 Len=0 MSS=1460 SACK_PERM=1 TSval=3426128706 TSecr=0 WS=512;
551;Jan 13, 2022 19:36:54.821881318 CET;192.168.1.101;192.168.1.102;1883;54604;58;1883 → 54604 [SYN, ACK] Seq=0 Ack=1 Win=8192 Len=0 MSS=1460;
552;Jan 13, 2022 19:36:54.821926176 CET;192.168.1.102;192.168.1.101;54604;1883;54;54604 → 1883 [ACK] Seq=1 Ack=1 Win=42340 Len=0;
553;Jan 13, 2022 19:36:54.822019482 CET;192.168.1.102;192.168.1.101;54604;1883;108;Connect Command;
554;Jan 13, 2022 19:36:55.032529084 CET;192.168.1.102;192.168.1.101;54604;1883;108;[TCP Retransmission] 54604 → 1883 [PSH, ACK] Seq=1 Ack=1 Win=42340 Len=54;
555;Jan 13, 2022 19:36:55.039700617 CET;192.168.1.101;192.168.1.102;1883;54604;54;1883 → 54604 [ACK] Seq=1 Ack=55 Win=8192 Len=0;
556;Jan 13, 2022 19:36:55.046068137 CET;192.168.1.101;192.168.1.102;1883;54604;58;Connect Ack;
557;Jan 13, 2022 19:36:55.046088279 CET;192.168.1.102;192.168.1.101;54604;1883;54;54604 → 1883 [ACK] Seq=55 Ack=5 Win=42336 Len=0;
558;Jan 13, 2022 19:36:55.046184240 CET;192.168.1.102;192.168.1.101;54604;1883;73;Publish Message [topic];message044
559;Jan 13, 2022 19:36:55.046227928 CET;192.168.1.102;192.168.1.101;54604;1883;56;Disconnect Req;
560;Jan 13, 2022 19:36:55.468878907 CET;192.168.1.102;192.168.1.101;54604;1883;75;[TCP Retransmission] 54604 → 1883 [FIN, PSH, ACK] Seq=55 Ack=5 Win=42336 Len=21;
561;Jan 13, 2022 19:36:55.478389891 CET;192.168.1.101;192.168.1.102;1883;54604;54;1883 → 54604 [FIN, ACK] Seq=5 Ack=77 Win=8192 Len=0;
562;Jan 13, 2022 19:36:55.478424243 CET;192.168.1.102;192.168.1.101;54604;1883;54;54604 → 1883 [ACK] Seq=77 Ack=6 Win=42335 Len=0;
563;Jan 13, 2022 19:37:05.061232981 CET;192.168.1.102;192.168.1.101;54606;1883;74;54606 → 1883 [SYN] Seq=0 Win=42340 Len=0 MSS=1460 SACK_PERM=1 TSval=3426138952 TSecr=0 WS=512;
564;Jan 13, 2022 19:37:05.090321874 CET;192.168.1.101;192.168.1.102;1883;54606;58;1883 → 54606 [SYN, ACK] Seq=0 Ack=1 Win=8192 Len=0 MSS=1460;
565;Jan 13, 2022 19:37:05.090413804 CET;192.168.1.102;192.168.1.101;54606;1883;54;54606 → 1883 [ACK] Seq=1 Ack=1 Win=42340 Len=0;
566;Jan 13, 2022 19:37:05.090604763 CET;192.168.1.102;192.168.1.101;54606;1883;108;Connect Command;
567;Jan 13, 2022 19:37:05.324599068 CET;192.168.1.102;192.168.1.101;54606;1883;108;[TCP Retransmission] 54606 → 1883 [PSH, ACK] Seq=1 Ack=1 Win=42340 Len=54;
568;Jan 13, 2022 19:37:05.331284177 CET;192.168.1.101;192.168.1.102;1883;54606;54;1883 → 54606 [ACK] Seq=1 Ack=55 Win=8192 Len=0;
569;Jan 13, 2022 19:37:05.335200152 CET;192.168.1.101;192.168.1.102;1883;54606;58;Connect Ack;
570;Jan 13, 2022 19:37:05.335224025 CET;192.168.1.102;192.168.1.101;54606;1883;54;54606 → 1883 [ACK] Seq=55 Ack=5 Win=42336 Len=0;
571;Jan 13, 2022 19:37:05.335331459 CET;192.168.1.102;192.168.1.101;54606;1883;73;Publish Message [topic];message045
572;Jan 13, 2022 19:37:05.335376651 CET;192.168.1.102;192.168.1.101;54606;1883;56;Disconnect Req;
573;Jan 13, 2022 19:37:05.805015570 CET;192.168.1.102;192.168.1.101;54606;1883;75;[TCP Retransmission] 54606 → 1883 [FIN, PSH, ACK] Seq=55 Ack=5 Win=42336 Len=21;
574;Jan 13, 2022 19:37:05.819060918 CET;192.168.1.101;192.168.1.102;1883;54606;54;1883 → 54606 [FIN, ACK] Seq=5 Ack=77 Win=8192 Len=0;
575;Jan 13, 2022 19:37:05.819100229 CET;192.168.1.102;192.168.1.101;54606;1883;54;54606 → 1883 [ACK] Seq=77 Ack=6 Win=42335 Len=0;
576;Jan 13, 2022 19:37:15.345935343 CET;192.168.1.102;192.168.1.101;54610;1883;74;54610 → 1883 [SYN] Seq=0 Win=42340 Len=0 MSS=1460 SACK_PERM=1 TSval=3426149237 TSecr=0 WS=512;
577;Jan 13, 2022 19:37:15.359367300 CET;192.168.1.101;192.168.1.102;1883;54610;58;1883 → 54610 [SYN, ACK] Seq=0 Ack=1 Win=8192 Len=0 MSS=1460;
578;Jan 13, 2022 19:37:15.359408508 CET;192.168.1.102;192.168.1.101;54610;1883;54;54610 → 1883 [ACK] Seq=1 Ack=1 Win=42340 Len=0;
579;Jan 13, 2022 19:37:15.359516812 CET;192.168.1.102;192.168.1.101;54610;1883;108;Connect Command;
580;Jan 13, 2022 19:37:15.576545127 CET;192.168.1.102;192.168.1.101;54610;1883;108;[TCP Retransmission] 54610 → 1883 [PSH, ACK] Seq=1 Ack=1 Win=42340 Len=54;
581;Jan 13, 2022 19:37:15.587913085 CET;192.168.1.101;192.168.1.102;1883;54610;54;1883 → 54610 [ACK] Seq=1 Ack=55 Win=8192 Len=0;
582;Jan 13, 2022 19:37:15.595831495 CET;192.168.1.101;192.168.1.102;1883;54610;58;Connect Ack;
583;Jan 13, 2022 19:37:15.595859368 CET;192.168.1.102;192.168.1.101;54610;1883;54;54610 → 1883 [ACK] Seq=55 Ack=5 Win=42336 Len=0;
584;Jan 13, 2022 19:37:15.596151437 CET;192.168.1.102;192.168.1.101;54610;1883;73;Publish Message [topic];message046
585;Jan 13, 2022 19:37:15.596229204 CET;192.168.1.102;192.168.1.101;54610;1883;56;Disconnect Req;
586;Jan 13, 2022 19:37:16.044581811 CET;192.168.1.102;192.168.1.101;54610;1883;75;[TCP Retransmission] 54610 → 1883 [FIN, PSH, ACK] Seq=55 Ack=5 Win=42336 Len=21;
587;Jan 13, 2022 19:37:16.054041753 CET;192.168.1.101;192.168.1.102;1883;54610;54;1883 → 54610 [FIN, ACK] Seq=5 Ack=77 Win=8192 Len=0;
588;Jan 13, 2022 19:37:16.054081347 CET;192.168.1.102;192.168.1.101;54610;1883;54;54610 → 1883 [ACK] Seq=77 Ack=6 Win=42335 Len=0;
589;Jan 13, 2022 19:37:25.602600424 CET;192.168.1.102;192.168.1.101;54612;1883;74;54612 → 1883 [SYN] Seq=0 Win=42340 Len=0 MSS=1460 SACK_PERM=1 TSval=3426159493 TSecr=0 WS=512;
590;Jan 13, 2022 19:37:25.608964694 CET;192.168.1.101;192.168.1.102;1883;54612;58;1883 → 54612 [SYN, ACK] Seq=0 Ack=1 Win=8192 Len=0 MSS=1460;
591;Jan 13, 2022 19:37:25.608996702 CET;192.168.1.102;192.168.1.101;54612;1883;54;54612 → 1883 [ACK] Seq=1 Ack=1 Win=42340 Len=0;
592;Jan 13, 2022 19:37:25.609076162 CET;192.168.1.102;192.168.1.101;54612;1883;108;Connect Command;
593;Jan 13, 2022 19:37:25.820524347 CET;192.168.1.102;192.168.1.101;54612;1883;108;[TCP Retransmission] 54612 → 1883 [PSH, ACK] Seq=1 Ack=1 Win=42340 Len=54;
594;Jan 13, 2022 19:37:25.826207185 CET;192.168.1.101;192.168.1.102;1883;54612;54;1883 → 54612 [ACK] Seq=1 Ack=55 Win=8192 Len=0;
595;Jan 13, 2022 19:37:25.830217605 CET;192.168.1.101;192.168.1.102;1883;54612;58;Connect Ack;
596;Jan 13, 2022 19:37:25.830237344 CET;192.168.1.102;192.168.1.101;54612;1883;54;54612 → 1883 [ACK] Seq=55 Ack=5 Win=42336 Len=0;
597;Jan 13, 2022 19:37:25.830366162 CET;192.168.1.102;192.168.1.101;54612;1883;73;Publish Message [topic];message047
598;Jan 13, 2022 19:37:25.830429303 CET;192.168.1.102;192.168.1.101;54612;1883;56;Disconnect Req;
599;Jan 13, 2022 19:37:26.252587724 CET;192.168.1.102;192.168.1.101;54612;1883;75;[TCP Retransmission] 54612 → 1883 [FIN, PSH, ACK] Seq=55 Ack=5 Win=42336 Len=21;
600;Jan 13, 2022 19:37:26.264320034 CET;192.168.1.101;192.168.1.102;1883;54612;54;1883 → 54612 [FIN, ACK] Seq=5 Ack=77 Win=8192 Len=0;
601;Jan 13, 2022 19:37:26.264360602 CET;192.168.1.102;192.168.1.101;54612;1883;54;54612 → 1883 [ACK] Seq=77 Ack=6 Win=42335 Len=0;
602;Jan 13, 2022 19:37:35.840171295 CET;192.168.1.102;192.168.1.101;54614;1883;74;54614 → 1883 [SYN] Seq=0 Win=42340 Len=0 MSS=1460 SACK_PERM=1 TSval=3426169731 TSecr=0 WS=512;
603;Jan 13, 2022 19:37:35.858670640 CET;192.168.1.101;192.168.1.102;1883;54614;58;1883 → 54614 [SYN, ACK] Seq=0 Ack=1 Win=8192 Len=0 MSS=1460;
604;Jan 13, 2022 19:37:35.858711703 CET;192.168.1.102;192.168.1.101;54614;1883;54;54614 → 1883 [ACK] Seq=1 Ack=1 Win=42340 Len=0;
605;Jan 13, 2022 19:37:35.858810677 CET;192.168.1.102;192.168.1.101;54614;1883;108;Connect Command;
606;Jan 13, 2022 19:37:36.080806924 CET;192.168.1.102;192.168.1.101;54614;1883;108;[TCP Retransmission] 54614 → 1883 [PSH, ACK] Seq=1 Ack=1 Win=42340 Len=54;
607;Jan 13, 2022 19:37:36.090715364 CET;192.168.1.101;192.168.1.102;1883;54614;54;1883 → 54614 [ACK] Seq=1 Ack=55 Win=8192 Len=0;
608;Jan 13, 2022 19:37:36.097520231 CET;192.168.1.101;192.168.1.102;1883;54614;58;Connect Ack;
609;Jan 13, 2022 19:37:36.097546502 CET;192.168.1.102;192.168.1.101;54614;1883;54;54614 → 1883 [ACK] Seq=55 Ack=5 Win=42336 Len=0;
610;Jan 13, 2022 19:37:36.097659217 CET;192.168.1.102;192.168.1.101;54614;1883;73;Publish Message [topic];message048
611;Jan 13, 2022 19:37:36.097715923 CET;192.168.1.102;192.168.1.101;54614;1883;56;Disconnect Req;
612;Jan 13, 2022 19:37:36.556548983 CET;192.168.1.102;192.168.1.101;54614;1883;75;[TCP Retransmission] 54614 → 1883 [FIN, PSH, ACK] Seq=55 Ack=5 Win=42336 Len=21;
613;Jan 13, 2022 19:37:36.564939395 CET;192.168.1.101;192.168.1.102;1883;54614;54;1883 → 54614 [FIN, ACK] Seq=5 Ack=77 Win=8192 Len=0;
614;Jan 13, 2022 19:37:36.564963281 CET;192.168.1.102;192.168.1.101;54614;1883;54;54614 → 1883 [ACK] Seq=77 Ack=6 Win=42335 Len=0;
615;Jan 13, 2022 19:37:46.103993664 CET;192.168.1.102;192.168.1.101;54616;1883;74;54616 → 1883 [SYN] Seq=0 Win=42340 Len=0 MSS=1460 SACK_PERM=1 TSval=3426179995 TSecr=0 WS=512;
616;Jan 13, 2022 19:37:46.123895646 CET;192.168.1.101;192.168.1.102;1883;54616;58;1883 → 54616 [SYN, ACK] Seq=0 Ack=1 Win=8192 Len=0 MSS=1460;
617;Jan 13, 2022 19:37:46.123920371 CET;192.168.1.102;192.168.1.101;54616;1883;54;54616 → 1883 [ACK] Seq=1 Ack=1 Win=42340 Len=0;
618;Jan 13, 2022 19:37:46.124002408 CET;192.168.1.102;192.168.1.101;54616;1883;108;Connect Command;
619;Jan 13, 2022 19:37:46.344517238 CET;192.168.1.102;192.168.1.101;54616;1883;108;[TCP Retransmission] 54616 → 1883 [PSH, ACK] Seq=1 Ack=1 Win=42340 Len=54;
620;Jan 13, 2022 19:37:46.353634823 CET;192.168.1.101;192.168.1.102;1883;54616;54;1883 → 54616 [ACK] Seq=1 Ack=55 Win=8192 Len=0;
621;Jan 13, 2022 19:37:46.359243819 CET;192.168.1.101;192.168.1.102;1883;54616;58;Connect Ack;
622;Jan 13, 2022 19:37:46.359264362 CET;192.168.1.102;192.168.1.101;54616;1883;54;54616 → 1883 [ACK] Seq=55 Ack=5 Win=42336 Len=0;
623;Jan 13, 2022 19:37:46.359356397 CET;192.168.1.102;192.168.1.101;54616;1883;73;Publish Message [topic];message049
624;Jan 13, 2022 19:37:46.359402568 CET;192.168.1.102;192.168.1.101;54616;1883;56;Disconnect Req;
625;Jan 13, 2022 19:37:46.828559081 CET;192.168.1.102;192.168.1.101;54616;1883;75;[TCP Retransmission] 54616 → 1883 [FIN, PSH, ACK] Seq=55 Ack=5 Win=42336 Len=21;
626;Jan 13, 2022 19:37:46.838432340 CET;192.168.1.101;192.168.1.102;1883;54616;54;1883 → 54616 [FIN, ACK] Seq=5 Ack=77 Win=8192 Len=0;
627;Jan 13, 2022 19:37:46.838465273 CET;192.168.1.102;192.168.1.101;54616;1883;54;54616 → 1883 [ACK] Seq=77 Ack=6 Win=42335 Len=0;
1;Jan 13, 2022 19:29:19.448800331 CET;192.168.1.103;192.168.1.104;49224;1883;74;49224 → 1883 [SYN] Seq=0 Win=42340 Len=0 MSS=1460 SACK_PERM=1 TSval=450806892 TSecr=0 WS=512;
2;Jan 13, 2022 19:29:19.472533924 CET;192.168.1.104;192.168.1.103;1883;49224;58;1883 → 49224 [SYN, ACK] Seq=0 Ack=1 Win=8192 Len=0 MSS=1460;
3;Jan 13, 2022 19:29:19.472567099 CET;192.168.1.103;192.168.1.104;49224;1883;54;49224 → 1883 [ACK] Seq=1 Ack=1 Win=42340 Len=0;
4;Jan 13, 2022 19:29:19.472662214 CET;192.168.1.103;192.168.1.104;49224;1883;108;Connect Command;
5;Jan 13, 2022 19:29:19.696560498 CET;192.168.1.103;192.168.1.104;49224;1883;108;[TCP Retransmission] 49224 → 1883 [PSH, ACK] Seq=1 Ack=1 Win=42340 Len=54;
6;Jan 13, 2022 19:29:19.702748126 CET;192.168.1.104;192.168.1.103;1883;49224;54;1883 → 49224 [ACK] Seq=1 Ack=55 Win=8192 Len=0;
7;Jan 13, 2022 19:29:19.708188310 CET;192.168.1.104;192.168.1.103;1883;49224;58;Connect Ack;
8;Jan 13, 2022 19:29:19.708202435 CET;192.168.1.103;192.168.1.104;49224;1883;54;49224 → 1883 [ACK] Seq=55 Ack=5 Win=42336 Len=0;
9;Jan 13, 2022 19:29:19.708292871 CET;192.168.1.103;192.168.1.104;49224;1883;66;Subscribe Request (id=1) [topic];
10;Jan 13, 2022 19:29:20.172741461 CET;192.168.1.103;192.168.1.104;49224;1883;66;[TCP Retransmission] 49224 → 1883 [PSH, ACK] Seq=55 Ack=5 Win=42336 Len=12;
11;Jan 13, 2022 19:29:21.100600459 CET;192.168.1.103;192.168.1.104;49224;1883;66;[TCP Retransmission] 49224 → 1883 [PSH, ACK] Seq=55 Ack=5 Win=42336 Len=12;
12;Jan 13, 2022 19:29:22.210085638 CET;192.168.1.104;192.168.1.103;1883;49224;54;1883 → 49224 [ACK] Seq=5 Ack=67 Win=8192 Len=0;
13;Jan 13, 2022 19:29:22.212187431 CET;192.168.1.104;192.168.1.103;1883;49224;59;Subscribe Ack (id=1);
14;Jan 13, 2022 19:29:22.212195330 CET;192.168.1.103;192.168.1.104;49224;1883;54;49224 → 1883 [ACK] Seq=67 Ack=10 Win=42331 Len=0;
15;Jan 13, 2022 19:29:40.527227956 CET;192.168.1.104;192.168.1.103;1883;49224;73;Publish Message [topic];message001
16;Jan 13, 2022 19:29:40.527253764 CET;192.168.1.103;192.168.1.104;49224;1883;54;49224 → 1883 [ACK] Seq=67 Ack=29 Win=42312 Len=0;
17;Jan 13, 2022 19:29:47.725037780 CET;192.168.1.104;192.168.1.103;1883;49224;73;Publish Message [topic];message002
18;Jan 13, 2022 19:29:47.725054012 CET;192.168.1.103;192.168.1.104;49224;1883;54;49224 → 1883 [ACK] Seq=67 Ack=48 Win=42293 Len=0;
19;Jan 13, 2022 19:29:57.926817860 CET;192.168.1.104;192.168.1.103;1883;49224;73;Publish Message [topic];message003
20;Jan 13, 2022 19:29:57.926838718 CET;192.168.1.103;192.168.1.104;49224;1883;54;49224 → 1883 [ACK] Seq=67 Ack=67 Win=42274 Len=0;
21;Jan 13, 2022 19:30:08.175563956 CET;192.168.1.104;192.168.1.103;1883;49224;73;Publish Message [topic];message004
22;Jan 13, 2022 19:30:08.175583089 CET;192.168.1.103;192.168.1.104;49224;1883;54;49224 → 1883 [ACK] Seq=67 Ack=86 Win=42255 Len=0;
23;Jan 13, 2022 19:30:18.402898812 CET;192.168.1.104;192.168.1.103;1883;49224;73;Publish Message [topic];message005
24;Jan 13, 2022 19:30:18.402915833 CET;192.168.1.103;192.168.1.104;49224;1883;54;49224 → 1883 [ACK] Seq=67 Ack=105 Win=42236 Len=0;
25;Jan 13, 2022 19:30:19.404330481 CET;192.168.1.103;192.168.1.104;49224;1883;56;Ping Request;
26;Jan 13, 2022 19:30:19.410594841 CET;192.168.1.104;192.168.1.103;1883;49224;54;1883 → 49224 [ACK] Seq=105 Ack=69 Win=8192 Len=0;
27;Jan 13, 2022 19:30:19.414806864 CET;192.168.1.104;192.168.1.103;1883;49224;56;Ping Response;
28;Jan 13, 2022 19:30:19.414816557 CET;192.168.1.103;192.168.1.104;49224;1883;54;49224 → 1883 [ACK] Seq=69 Ack=107 Win=42234 Len=0;
29;Jan 13, 2022 19:30:28.669405757 CET;192.168.1.104;192.168.1.103;1883;49224;73;Publish Message [topic];message006
30;Jan 13, 2022 19:30:28.669425306 CET;192.168.1.103;192.168.1.104;49224;1883;54;49224 → 1883 [ACK] Seq=69 Ack=126 Win=42215 Len=0;
31;Jan 13, 2022 19:30:38.875716795 CET;192.168.1.104;192.168.1.103;1883;49224;73;Publish Message [topic];message007
32;Jan 13, 2022 19:30:38.875735991 CET;192.168.1.103;192.168.1.104;49224;1883;54;49224 → 1883 [ACK] Seq=69 Ack=145 Win=42215 Len=0;
33;Jan 13, 2022 19:30:49.118124190 CET;192.168.1.104;192.168.1.103;1883;49224;73;Publish Message [topic];message008
34;Jan 13, 2022 19:30:49.118141758 CET;192.168.1.103;192.168.1.104;49224;1883;54;49224 → 1883 [ACK] Seq=69 Ack=164 Win=42215 Len=0;
35;Jan 13, 2022 19:30:58.928000465 CET;192.168.1.104;192.168.1.103;1883;49224;73;Publish Message [topic];message009
36;Jan 13, 2022 19:30:58.928020272 CET;192.168.1.103;192.168.1.104;49224;1883;54;49224 → 1883 [ACK] Seq=69 Ack=183 Win=42215 Len=0;
37;Jan 13, 2022 19:31:09.368190176 CET;192.168.1.104;192.168.1.103;1883;49224;73;Publish Message [topic];message010
38;Jan 13, 2022 19:31:09.368202750 CET;192.168.1.103;192.168.1.104;49224;1883;54;49224 → 1883 [ACK] Seq=69 Ack=202 Win=42215 Len=0;
39;Jan 13, 2022 19:31:19.184189480 CET;192.168.1.104;192.168.1.103;1883;49224;73;Publish Message [topic];message011
40;Jan 13, 2022 19:31:19.184203502 CET;192.168.1.103;192.168.1.104;49224;1883;54;49224 → 1883 [ACK] Seq=69 Ack=221 Win=42215 Len=0;
41;Jan 13, 2022 19:31:19.184254766 CET;192.168.1.103;192.168.1.104;49224;1883;56;Ping Request;
42;Jan 13, 2022 19:31:19.409198317 CET;192.168.1.103;192.168.1.104;49224;1883;56;[TCP Retransmission] 49224 → 1883 [PSH, ACK] Seq=69 Ack=221 Win=42215 Len=2;
43;Jan 13, 2022 19:31:19.421827293 CET;192.168.1.104;192.168.1.103;1883;49224;54;1883 → 49224 [ACK] Seq=221 Ack=71 Win=8192 Len=0;
44;Jan 13, 2022 19:31:19.428740184 CET;192.168.1.104;192.168.1.103;1883;49224;56;Ping Response;
45;Jan 13, 2022 19:31:19.428755789 CET;192.168.1.103;192.168.1.104;49224;1883;54;49224 → 1883 [ACK] Seq=71 Ack=223 Win=42215 Len=0;
46;Jan 13, 2022 19:31:29.679803448 CET;192.168.1.104;192.168.1.103;1883;49224;73;Publish Message [topic];message012
47;Jan 13, 2022 19:31:29.679815095 CET;192.168.1.103;192.168.1.104;49224;1883;54;49224 → 1883 [ACK] Seq=71 Ack=242 Win=42215 Len=0;
48;Jan 13, 2022 19:31:39.902915516 CET;192.168.1.104;192.168.1.103;1883;49224;73;Publish Message [topic];message013
49;Jan 13, 2022 19:31:39.902933196 CET;192.168.1.103;192.168.1.104;49224;1883;54;49224 → 1883 [ACK] Seq=71 Ack=261 Win=42215 Len=0;
50;Jan 13, 2022 19:31:50.124058558 CET;192.168.1.104;192.168.1.103;1883;49224;73;Publish Message [topic];message014
51;Jan 13, 2022 19:31:50.124076939 CET;192.168.1.103;192.168.1.104;49224;1883;54;49224 → 1883 [ACK] Seq=71 Ack=280 Win=42215 Len=0;
52;Jan 13, 2022 19:31:59.920431798 CET;192.168.1.104;192.168.1.103;1883;49224;73;Publish Message [topic];message015
53;Jan 13, 2022 19:31:59.920450622 CET;192.168.1.103;192.168.1.104;49224;1883;54;49224 → 1883 [ACK] Seq=71 Ack=299 Win=42215 Len=0;
54;Jan 13, 2022 19:32:10.383292308 CET;192.168.1.104;192.168.1.103;1883;49224;73;Publish Message [topic];message016
55;Jan 13, 2022 19:32:10.383310342 CET;192.168.1.103;192.168.1.104;49224;1883;54;49224 → 1883 [ACK] Seq=71 Ack=318 Win=42215 Len=0;
56;Jan 13, 2022 19:32:19.395530460 CET;192.168.1.103;192.168.1.104;49224;1883;56;Ping Request;
57;Jan 13, 2022 19:32:19.401406728 CET;192.168.1.104;192.168.1.103;1883;49224;54;1883 → 49224 [ACK] Seq=318 Ack=73 Win=8192 Len=0;
58;Jan 13, 2022 19:32:19.403673811 CET;192.168.1.104;192.168.1.103;1883;49224;56;Ping Response;
59;Jan 13, 2022 19:32:19.403680773 CET;192.168.1.103;192.168.1.104;49224;1883;54;49224 → 1883 [ACK] Seq=73 Ack=320 Win=42215 Len=0;
60;Jan 13, 2022 19:32:20.634756548 CET;192.168.1.104;192.168.1.103;1883;49224;73;Publish Message [topic];message017
61;Jan 13, 2022 19:32:20.634782344 CET;192.168.1.103;192.168.1.104;49224;1883;54;49224 → 1883 [ACK] Seq=73 Ack=339 Win=42215 Len=0;
62;Jan 13, 2022 19:32:30.841958450 CET;192.168.1.104;192.168.1.103;1883;49224;73;Publish Message [topic];message018
63;Jan 13, 2022 19:32:30.841976862 CET;192.168.1.103;192.168.1.104;49224;1883;54;49224 → 1883 [ACK] Seq=73 Ack=358 Win=42215 Len=0;
64;Jan 13, 2022 19:32:41.088078781 CET;192.168.1.104;192.168.1.103;1883;49224;73;Publish Message [topic];message019
65;Jan 13, 2022 19:32:41.088100170 CET;192.168.1.103;192.168.1.104;49224;1883;54;49224 → 1883 [ACK] Seq=73 Ack=377 Win=42215 Len=0;
66;Jan 13, 2022 19:32:51.324101400 CET;192.168.1.104;192.168.1.103;1883;49224;73;Publish Message [topic];message020
67;Jan 13, 2022 19:32:51.324116678 CET;192.168.1.103;192.168.1.104;49224;1883;54;49224 → 1883 [ACK] Seq=73 Ack=396 Win=42215 Len=0;
68;Jan 13, 2022 19:33:01.134993620 CET;192.168.1.104;192.168.1.103;1883;49224;73;Publish Message [topic];message021
69;Jan 13, 2022 19:33:01.135013637 CET;192.168.1.103;192.168.1.104;49224;1883;54;49224 → 1883 [ACK] Seq=73 Ack=415 Win=42215 Len=0;
70;Jan 13, 2022 19:33:11.160874026 CET;192.168.1.104;192.168.1.103;1883;49224;73;Publish Message [topic];message022
71;Jan 13, 2022 19:33:11.160898272 CET;192.168.1.103;192.168.1.104;49224;1883;54;49224 → 1883 [ACK] Seq=73 Ack=434 Win=42215 Len=0;
72;Jan 13, 2022 19:33:19.170272037 CET;192.168.1.103;192.168.1.104;49224;1883;56;Ping Request;
73;Jan 13, 2022 19:33:19.172974888 CET;192.168.1.104;192.168.1.103;1883;49224;54;1883 → 49224 [ACK] Seq=434 Ack=75 Win=8192 Len=0;
74;Jan 13, 2022 19:33:19.174797859 CET;192.168.1.104;192.168.1.103;1883;49224;56;Ping Response;
75;Jan 13, 2022 19:33:19.174803535 CET;192.168.1.103;192.168.1.104;49224;1883;54;49224 → 1883 [ACK] Seq=75 Ack=436 Win=42215 Len=0;
76;Jan 13, 2022 19:33:21.175429381 CET;192.168.1.104;192.168.1.103;1883;49224;73;Publish Message [topic];message023
77;Jan 13, 2022 19:33:21.175453611 CET;192.168.1.103;192.168.1.104;49224;1883;54;49224 → 1883 [ACK] Seq=75 Ack=455 Win=42215 Len=0;
78;Jan 13, 2022 19:33:31.621842324 CET;192.168.1.104;192.168.1.103;1883;49224;73;Publish Message [topic];message024
79;Jan 13, 2022 19:33:31.621849160 CET;192.168.1.103;192.168.1.104;49224;1883;54;49224 → 1883 [ACK] Seq=75 Ack=474 Win=42215 Len=0;
80;Jan 13, 2022 19:33:41.885850922 CET;192.168.1.104;192.168.1.103;1883;49224;73;Publish Message [topic];message025
81;Jan 13, 2022 19:33:41.885868708 CET;192.168.1.103;192.168.1.104;49224;1883;54;49224 → 1883 [ACK] Seq=75 Ack=493 Win=42215 Len=0;
82;Jan 13, 2022 19:33:52.155557922 CET;192.168.1.104;192.168.1.103;1883;49224;73;Publish Message [topic];message026
83;Jan 13, 2022 19:33:52.155573251 CET;192.168.1.103;192.168.1.104;49224;1883;54;49224 → 1883 [ACK] Seq=75 Ack=512 Win=42215 Len=0;
84;Jan 13, 2022 19:34:01.993874948 CET;192.168.1.104;192.168.1.103;1883;49224;73;Publish Message [topic];message027
85;Jan 13, 2022 19:34:01.993908939 CET;192.168.1.103;192.168.1.104;49224;1883;54;49224 → 1883 [ACK] Seq=75 Ack=531 Win=42215 Len=0;
86;Jan 13, 2022 19:34:12.381704708 CET;192.168.1.104;192.168.1.103;1883;49224;73;Publish Message [topic];message028
87;Jan 13, 2022 19:34:12.381722601 CET;192.168.1.103;192.168.1.104;49224;1883;54;49224 → 1883 [ACK] Seq=75 Ack=550 Win=42215 Len=0;
88;Jan 13, 2022 19:34:19.390662766 CET;192.168.1.103;192.168.1.104;49224;1883;56;Ping Request;
89;Jan 13, 2022 19:34:19.396668592 CET;192.168.1.104;192.168.1.103;1883;49224;54;1883 → 49224 [ACK] Seq=550 Ack=77 Win=8192 Len=0;
90;Jan 13, 2022 19:34:19.399013405 CET;192.168.1.104;192.168.1.103;1883;49224;56;Ping Response;
91;Jan 13, 2022 19:34:19.399020607 CET;192.168.1.103;192.168.1.104;49224;1883;54;49224 → 1883 [ACK] Seq=77 Ack=552 Win=42215 Len=0;
92;Jan 13, 2022 19:34:22.194624542 CET;192.168.1.104;192.168.1.103;1883;49224;73;Publish Message [topic];message029
93;Jan 13, 2022 19:34:22.194647816 CET;192.168.1.103;192.168.1.104;49224;1883;54;49224 → 1883 [ACK] Seq=77 Ack=571 Win=42215 Len=0;
94;Jan 13, 2022 19:34:32.689813477 CET;192.168.1.104;192.168.1.103;1883;49224;73;Publish Message [topic];message030
95;Jan 13, 2022 19:34:32.689831459 CET;192.168.1.103;192.168.1.104;49224;1883;54;49224 → 1883 [ACK] Seq=77 Ack=590 Win=42215 Len=0;
96;Jan 13, 2022 19:34:42.942298441 CET;192.168.1.104;192.168.1.103;1883;49224;73;Publish Message [topic];message031
97;Jan 13, 2022 19:34:42.942316382 CET;192.168.1.103;192.168.1.104;49224;1883;54;49224 → 1883 [ACK] Seq=77 Ack=609 Win=42215 Len=0;
98;Jan 13, 2022 19:34:53.146951604 CET;192.168.1.104;192.168.1.103;1883;49224;73;Publish Message [topic];message032
99;Jan 13, 2022 19:34:53.146967530 CET;192.168.1.103;192.168.1.104;49224;1883;54;49224 → 1883 [ACK] Seq=77 Ack=628 Win=42215 Len=0;
100;Jan 13, 2022 19:35:03.359486834 CET;192.168.1.104;192.168.1.103;1883;49224;73;Publish Message [topic];message033
101;Jan 13, 2022 19:35:03.359507796 CET;192.168.1.103;192.168.1.104;49224;1883;54;49224 → 1883 [ACK] Seq=77 Ack=647 Win=42215 Len=0;
102;Jan 13, 2022 19:35:13.603596228 CET;192.168.1.104;192.168.1.103;1883;49224;73;Publish Message [topic];message034
103;Jan 13, 2022 19:35:13.603615355 CET;192.168.1.103;192.168.1.104;49224;1883;54;49224 → 1883 [ACK] Seq=77 Ack=666 Win=42215 Len=0;
104;Jan 13, 2022 19:35:19.610778059 CET;192.168.1.103;192.168.1.104;49224;1883;56;Ping Request;
105;Jan 13, 2022 19:35:19.613627168 CET;192.168.1.104;192.168.1.103;1883;49224;54;1883 → 49224 [ACK] Seq=666 Ack=79 Win=8192 Len=0;
106;Jan 13, 2022 19:35:19.615497006 CET;192.168.1.104;192.168.1.103;1883;49224;56;Ping Response;
107;Jan 13, 2022 19:35:19.615502744 CET;192.168.1.103;192.168.1.104;49224;1883;54;49224 → 1883 [ACK] Seq=79 Ack=668 Win=42215 Len=0;
108;Jan 13, 2022 19:35:23.836949479 CET;192.168.1.104;192.168.1.103;1883;49224;73;Publish Message [topic];message035
109;Jan 13, 2022 19:35:23.836971744 CET;192.168.1.103;192.168.1.104;49224;1883;54;49224 → 1883 [ACK] Seq=79 Ack=687 Win=42215 Len=0;
110;Jan 13, 2022 19:35:34.089961922 CET;192.168.1.104;192.168.1.103;1883;49224;73;Publish Message [topic];message036
111;Jan 13, 2022 19:35:34.089980069 CET;192.168.1.103;192.168.1.104;49224;1883;54;49224 → 1883 [ACK] Seq=79 Ack=706 Win=42215 Len=0;
112;Jan 13, 2022 19:35:44.318231905 CET;192.168.1.104;192.168.1.103;1883;49224;73;Publish Message [topic];message037
113;Jan 13, 2022 19:35:44.318249712 CET;192.168.1.103;192.168.1.104;49224;1883;54;49224 → 1883 [ACK] Seq=79 Ack=725 Win=42215 Len=0;
114;Jan 13, 2022 19:35:54.522297609 CET;192.168.1.104;192.168.1.103;1883;49224;73;Publish Message [topic];message038
115;Jan 13, 2022 19:35:54.522314615 CET;192.168.1.103;192.168.1.104;49224;1883;54;49224 → 1883 [ACK] Seq=79 Ack=744 Win=42215 Len=0;
116;Jan 13, 2022 19:36:04.331418238 CET;192.168.1.104;192.168.1.103;1883;49224;73;Publish Message [topic];message039
117;Jan 13, 2022 19:36:04.331442932 CET;192.168.1.103;192.168.1.104;49224;1883;54;49224 → 1883 [ACK] Seq=79 Ack=763 Win=42215 Len=0;
118;Jan 13, 2022 19:36:14.356897959 CET;192.168.1.104;192.168.1.103;1883;49224;73;Publish Message [topic];message040
119;Jan 13, 2022 19:36:14.356917009 CET;192.168.1.103;192.168.1.104;49224;1883;54;49224 → 1883 [ACK] Seq=79 Ack=782 Win=42215 Len=0;
120;Jan 13, 2022 19:36:19.363435549 CET;192.168.1.103;192.168.1.104;49224;1883;56;Ping Request;
121;Jan 13, 2022 19:36:19.370017129 CET;192.168.1.104;192.168.1.103;1883;49224;54;1883 → 49224 [ACK] Seq=782 Ack=81 Win=8192 Len=0;
122;Jan 13, 2022 19:36:19.374909945 CET;192.168.1.104;192.168.1.103;1883;49224;56;Ping Response;
123;Jan 13, 2022 19:36:19.374928279 CET;192.168.1.103;192.168.1.104;49224;1883;54;49224 → 1883 [ACK] Seq=81 Ack=784 Win=42215 Len=0;
124;Jan 13, 2022 19:36:24.795024829 CET;192.168.1.104;192.168.1.103;1883;49224;73;Publish Message [topic];message041
125;Jan 13, 2022 19:36:24.795050494 CET;192.168.1.103;192.168.1.104;49224;1883;54;49224 → 1883 [ACK] Seq=81 Ack=803 Win=42215 Len=0;
126;Jan 13, 2022 19:36:35.039784899 CET;192.168.1.104;192.168.1.103;1883;49224;73;Publish Message [topic];message042
127;Jan 13, 2022 19:36:35.039800245 CET;192.168.1.103;192.168.1.104;49224;1883;54;49224 → 1883 [ACK] Seq=81 Ack=822 Win=42215 Len=0;
128;Jan 13, 2022 19:36:45.256319053 CET;192.168.1.104;192.168.1.103;1883;49224;73;Publish Message [topic];message043
129;Jan 13, 2022 19:36:45.256336117 CET;192.168.1.103;192.168.1.104;49224;1883;54;49224 → 1883 [ACK] Seq=81 Ack=841 Win=42215 Len=0;
130;Jan 13, 2022 19:36:55.503521669 CET;192.168.1.104;192.168.1.103;1883;49224;73;Publish Message [topic];message044
131;Jan 13, 2022 19:36:55.503546802 CET;192.168.1.103;192.168.1.104;49224;1883;54;49224 → 1883 [ACK] Seq=81 Ack=860 Win=42215 Len=0;
132;Jan 13, 2022 19:37:05.843178210 CET;192.168.1.104;192.168.1.103;1883;49224;73;Publish Message [topic];message045
133;Jan 13, 2022 19:37:05.843201787 CET;192.168.1.103;192.168.1.104;49224;1883;54;49224 → 1883 [ACK] Seq=81 Ack=879 Win=42215 Len=0;
134;Jan 13, 2022 19:37:16.087202537 CET;192.168.1.104;192.168.1.103;1883;49224;73;Publish Message [topic];message046
135;Jan 13, 2022 19:37:16.087226657 CET;192.168.1.103;192.168.1.104;49224;1883;54;49224 → 1883 [ACK] Seq=81 Ack=898 Win=42215 Len=0;
136;Jan 13, 2022 19:37:19.089745605 CET;192.168.1.103;192.168.1.104;49224;1883;56;Ping Request;
137;Jan 13, 2022 19:37:19.097457061 CET;192.168.1.104;192.168.1.103;1883;49224;54;1883 → 49224 [ACK] Seq=898 Ack=83 Win=8192 Len=0;
138;Jan 13, 2022 19:37:19.103568944 CET;192.168.1.104;192.168.1.103;1883;49224;56;Ping Response;
139;Jan 13, 2022 19:37:19.103593001 CET;192.168.1.103;192.168.1.104;49224;1883;54;49224 → 1883 [ACK] Seq=83 Ack=900 Win=42215 Len=0;
140;Jan 13, 2022 19:37:26.296497297 CET;192.168.1.104;192.168.1.103;1883;49224;73;Publish Message [topic];message047
141;Jan 13, 2022 19:37:26.296529317 CET;192.168.1.103;192.168.1.104;49224;1883;54;49224 → 1883 [ACK] Seq=83 Ack=919 Win=42215 Len=0;
142;Jan 13, 2022 19:37:36.596374846 CET;192.168.1.104;192.168.1.103;1883;49224;73;Publish Message [topic];message048
143;Jan 13, 2022 19:37:36.596402159 CET;192.168.1.103;192.168.1.104;49224;1883;54;49224 → 1883 [ACK] Seq=83 Ack=938 Win=42215 Len=0;
144;Jan 13, 2022 19:37:46.859943747 CET;192.168.1.104;192.168.1.103;1883;49224;73;Publish Message [topic];message049
145;Jan 13, 2022 19:37:46.859964196 CET;192.168.1.103;192.168.1.104;49224;1883;54;49224 → 1883 [ACK] Seq=83 Ack=957 Win=42215 Len=0;
