1;Jan 13, 2022 18:49:11.131877052 CET;192.168.1.102;192.168.1.101;53904;1883;74;53904 → 1883 [SYN] Seq=0 Win=42340 Len=0 MSS=1460 SACK_PERM=1 TSval=3423265023 TSecr=0 WS=512;
2;Jan 13, 2022 18:49:11.140618353 CET;192.168.1.101;192.168.1.102;1883;53904;58;1883 → 53904 [SYN, ACK] Seq=0 Ack=1 Win=8192 Len=0 MSS=1460;
3;Jan 13, 2022 18:49:11.140662299 CET;192.168.1.102;192.168.1.101;53904;1883;54;53904 → 1883 [ACK] Seq=1 Ack=1 Win=42340 Len=0;
4;Jan 13, 2022 18:49:11.140728797 CET;192.168.1.102;192.168.1.101;53904;1883;108;Connect Command;
5;Jan 13, 2022 18:49:11.356568314 CET;192.168.1.102;192.168.1.101;53904;1883;108;[TCP Retransmission] 53904 → 1883 [PSH, ACK] Seq=1 Ack=1 Win=42340 Len=54;
6;Jan 13, 2022 18:49:11.375164729 CET;192.168.1.101;192.168.1.102;1883;53904;54;1883 → 53904 [ACK] Seq=1 Ack=55 Win=8192 Len=0;
7;Jan 13, 2022 18:49:11.379602545 CET;192.168.1.101;192.168.1.102;1883;53904;58;Connect Ack;
8;Jan 13, 2022 18:49:11.379623384 CET;192.168.1.102;192.168.1.101;53904;1883;54;53904 → 1883 [ACK] Seq=55 Ack=5 Win=42336 Len=0;
9;Jan 13, 2022 18:49:11.379695713 CET;192.168.1.102;192.168.1.101;53904;1883;73;Publish Message [topic];message001
10;Jan 13, 2022 18:49:11.379715550 CET;192.168.1.102;192.168.1.101;53904;1883;56;Disconnect Req;
11;Jan 13, 2022 18:49:11.820676064 CET;192.168.1.102;192.168.1.101;53904;1883;75;[TCP Retransmission] 53904 → 1883 [FIN, PSH, ACK] Seq=55 Ack=5 Win=42336 Len=21;
12;Jan 13, 2022 18:49:11.837750826 CET;192.168.1.101;192.168.1.102;1883;53904;54;1883 → 53904 [FIN, ACK] Seq=5 Ack=77 Win=8192 Len=0;
13;Jan 13, 2022 18:49:11.837783218 CET;192.168.1.102;192.168.1.101;53904;1883;54;53904 → 1883 [ACK] Seq=77 Ack=6 Win=42335 Len=0;
14;Jan 13, 2022 18:49:21.392798877 CET;192.168.1.102;192.168.1.101;53906;1883;74;53906 → 1883 [SYN] Seq=0 Win=42340 Len=0 MSS=1460 SACK_PERM=1 TSval=3423275283 TSecr=0 WS=512;
15;Jan 13, 2022 18:49:21.397086467 CET;192.168.1.101;192.168.1.102;1883;53906;58;1883 → 53906 [SYN, ACK] Seq=0 Ack=1 Win=8192 Len=0 MSS=1460;
16;Jan 13, 2022 18:49:21.397108509 CET;192.168.1.102;192.168.1.101;53906;1883;54;53906 → 1883 [ACK] Seq=1 Ack=1 Win=42340 Len=0;
17;Jan 13, 2022 18:49:21.398906817 CET;192.168.1.102;192.168.1.101;53906;1883;108;Connect Command;
18;Jan 13, 2022 18:49:21.403073935 CET;192.168.1.101;192.168.1.102;1883;53906;54;1883 → 53906 [ACK] Seq=1 Ack=55 Win=8192 Len=0;
19;Jan 13, 2022 18:49:21.405397536 CET;192.168.1.101;192.168.1.102;1883;53906;58;Connect Ack;
20;Jan 13, 2022 18:49:21.405406537 CET;192.168.1.102;192.168.1.101;53906;1883;54;53906 → 1883 [ACK] Seq=55 Ack=5 Win=42336 Len=0;
21;Jan 13, 2022 18:49:21.405471337 CET;192.168.1.102;192.168.1.101;53906;1883;73;Publish Message [topic];message002
22;Jan 13, 2022 18:49:21.405490731 CET;192.168.1.102;192.168.1.101;53906;1883;56;Disconnect Req;
23;Jan 13, 2022 18:49:21.616573312 CET;192.168.1.102;192.168.1.101;53906;1883;75;[TCP Retransmission] 53906 → 1883 [FIN, PSH, ACK] Seq=55 Ack=5 Win=42336 Len=21;
24;Jan 13, 2022 18:49:21.635126846 CET;192.168.1.101;192.168.1.102;1883;53906;54;1883 → 53906 [FIN, ACK] Seq=5 Ack=77 Win=8192 Len=0;
25;Jan 13, 2022 18:49:21.635167119 CET;192.168.1.102;192.168.1.101;53906;1883;54;53906 → 1883 [ACK] Seq=77 Ack=6 Win=42335 Len=0;
26;Jan 13, 2022 18:49:31.414133608 CET;192.168.1.102;192.168.1.101;53908;1883;74;53908 → 1883 [SYN] Seq=0 Win=42340 Len=0 MSS=1460 SACK_PERM=1 TSval=3423285305 TSecr=0 WS=512;
27;Jan 13, 2022 18:49:31.419141539 CET;192.168.1.101;192.168.1.102;1883;53908;58;1883 → 53908 [SYN, ACK] Seq=0 Ack=1 Win=8192 Len=0 MSS=1460;
28;Jan 13, 2022 18:49:31.419167477 CET;192.168.1.102;192.168.1.101;53908;1883;54;53908 → 1883 [ACK] Seq=1 Ack=1 Win=42340 Len=0;
29;Jan 13, 2022 18:49:31.419446923 CET;192.168.1.102;192.168.1.101;53908;1883;108;Connect Command;
30;Jan 13, 2022 18:49:31.628751258 CET;192.168.1.102;192.168.1.101;53908;1883;108;[TCP Retransmission] 53908 → 1883 [PSH, ACK] Seq=1 Ack=1 Win=42340 Len=54;
31;Jan 13, 2022 18:49:31.647997238 CET;192.168.1.101;192.168.1.102;1883;53908;54;1883 → 53908 [ACK] Seq=1 Ack=55 Win=8192 Len=0;
32;Jan 13, 2022 18:49:31.655553680 CET;192.168.1.101;192.168.1.102;1883;53908;58;Connect Ack;
33;Jan 13, 2022 18:49:31.655573562 CET;192.168.1.102;192.168.1.101;53908;1883;54;53908 → 1883 [ACK] Seq=55 Ack=5 Win=42336 Len=0;
34;Jan 13, 2022 18:49:31.655648566 CET;192.168.1.102;192.168.1.101;53908;1883;73;Publish Message [topic];message003
35;Jan 13, 2022 18:49:31.655677813 CET;192.168.1.102;192.168.1.101;53908;1883;56;Disconnect Req;
36;Jan 13, 2022 18:49:32.076638020 CET;192.168.1.102;192.168.1.101;53908;1883;75;[TCP Retransmission] 53908 → 1883 [FIN, PSH, ACK] Seq=55 Ack=5 Win=42336 Len=21;
37;Jan 13, 2022 18:49:32.092766749 CET;192.168.1.101;192.168.1.102;1883;53908;54;1883 → 53908 [FIN, ACK] Seq=5 Ack=77 Win=8192 Len=0;
38;Jan 13, 2022 18:49:32.092807414 CET;192.168.1.102;192.168.1.101;53908;1883;54;53908 → 1883 [ACK] Seq=77 Ack=6 Win=42335 Len=0;
39;Jan 13, 2022 18:49:41.661122410 CET;192.168.1.102;192.168.1.101;53910;1883;74;53910 → 1883 [SYN] Seq=0 Win=42340 Len=0 MSS=1460 SACK_PERM=1 TSval=3423295552 TSecr=0 WS=512;
40;Jan 13, 2022 18:49:41.665752989 CET;192.168.1.101;192.168.1.102;1883;53910;58;1883 → 53910 [SYN, ACK] Seq=0 Ack=1 Win=8192 Len=0 MSS=1460;
41;Jan 13, 2022 18:49:41.665773483 CET;192.168.1.102;192.168.1.101;53910;1883;54;53910 → 1883 [ACK] Seq=1 Ack=1 Win=42340 Len=0;
42;Jan 13, 2022 18:49:41.665942524 CET;192.168.1.102;192.168.1.101;53910;1883;108;Connect Command;
43;Jan 13, 2022 18:49:41.876848539 CET;192.168.1.102;192.168.1.101;53910;1883;108;[TCP Retransmission] 53910 → 1883 [PSH, ACK] Seq=1 Ack=1 Win=42340 Len=54;
44;Jan 13, 2022 18:49:41.882084614 CET;192.168.1.101;192.168.1.102;1883;53910;54;1883 → 53910 [ACK] Seq=1 Ack=55 Win=8192 Len=0;
45;Jan 13, 2022 18:49:41.884498189 CET;192.168.1.101;192.168.1.102;1883;53910;58;Connect Ack;
46;Jan 13, 2022 18:49:41.884508651 CET;192.168.1.102;192.168.1.101;53910;1883;54;53910 → 1883 [ACK] Seq=55 Ack=5 Win=42336 Len=0;
47;Jan 13, 2022 18:49:41.884595952 CET;192.168.1.102;192.168.1.101;53910;1883;73;Publish Message [topic];message004
48;Jan 13, 2022 18:49:41.884616145 CET;192.168.1.102;192.168.1.101;53910;1883;56;Disconnect Req;
49;Jan 13, 2022 18:49:42.316580499 CET;192.168.1.102;192.168.1.101;53910;1883;75;[TCP Retransmission] 53910 → 1883 [FIN, PSH, ACK] Seq=55 Ack=5 Win=42336 Len=21;
50;Jan 13, 2022 18:49:42.320153328 CET;192.168.1.101;192.168.1.102;1883;53910;54;1883 → 53910 [FIN, ACK] Seq=5 Ack=77 Win=8192 Len=0;
51;Jan 13, 2022 18:49:42.320172722 CET;192.168.1.102;192.168.1.101;53910;1883;54;53910 → 1883 [ACK] Seq=77 Ack=6 Win=42335 Len=0;
52;Jan 13, 2022 18:49:51.889176822 CET;192.168.1.102;192.168.1.101;53912;1883;74;53912 → 1883 [SYN] Seq=0 Win=42340 Len=0 MSS=1460 SACK_PERM=1 TSval=3423305780 TSecr=0 WS=512;
53;Jan 13, 2022 18:49:51.892469627 CET;192.168.1.101;192.168.1.102;1883;53912;58;1883 → 53912 [SYN, ACK] Seq=0 Ack=1 Win=8192 Len=0 MSS=1460;
54;Jan 13, 2022 18:49:51.892485168 CET;192.168.1.102;192.168.1.101;53912;1883;54;53912 → 1883 [ACK] Seq=1 Ack=1 Win=42340 Len=0;
55;Jan 13, 2022 18:49:51.893642538 CET;192.168.1.102;192.168.1.101;53912;1883;108;Connect Command;
56;Jan 13, 2022 18:49:52.101435096 CET;192.168.1.102;192.168.1.101;53912;1883;108;[TCP Retransmission] 53912 → 1883 [PSH, ACK] Seq=1 Ack=1 Win=42340 Len=54;
57;Jan 13, 2022 18:49:52.111316661 CET;192.168.1.101;192.168.1.102;1883;53912;54;1883 → 53912 [ACK] Seq=1 Ack=55 Win=8192 Len=0;
58;Jan 13, 2022 18:49:52.115080754 CET;192.168.1.101;192.168.1.102;1883;53912;58;Connect Ack;
59;Jan 13, 2022 18:49:52.115112393 CET;192.168.1.102;192.168.1.101;53912;1883;54;53912 → 1883 [ACK] Seq=55 Ack=5 Win=42336 Len=0;
60;Jan 13, 2022 18:49:52.115215772 CET;192.168.1.102;192.168.1.101;53912;1883;73;Publish Message [topic];message005
61;Jan 13, 2022 18:49:52.115244241 CET;192.168.1.102;192.168.1.101;53912;1883;56;Disconnect Req;
62;Jan 13, 2022 18:49:52.524534713 CET;192.168.1.102;192.168.1.101;53912;1883;75;[TCP Retransmission] 53912 → 1883 [FIN, PSH, ACK] Seq=55 Ack=5 Win=42336 Len=21;
63;Jan 13, 2022 18:49:52.531243651 CET;192.168.1.101;192.168.1.102;1883;53912;54;1883 → 53912 [FIN, ACK] Seq=5 Ack=77 Win=8192 Len=0;
64;Jan 13, 2022 18:49:52.531264528 CET;192.168.1.102;192.168.1.101;53912;1883;54;53912 → 1883 [ACK] Seq=77 Ack=6 Win=42335 Len=0;
65;Jan 13, 2022 18:50:02.119517740 CET;192.168.1.102;192.168.1.101;53914;1883;74;53914 → 1883 [SYN] Seq=0 Win=42340 Len=0 MSS=1460 SACK_PERM=1 TSval=3423316010 TSecr=0 WS=512;
66;Jan 13, 2022 18:50:02.123946368 CET;192.168.1.101;192.168.1.102;1883;53914;58;1883 → 53914 [SYN, ACK] Seq=0 Ack=1 Win=8192 Len=0 MSS=1460;
67;Jan 13, 2022 18:50:02.124028094 CET;192.168.1.102;192.168.1.101;53914;1883;54;53914 → 1883 [ACK] Seq=1 Ack=1 Win=42340 Len=0;
68;Jan 13, 2022 18:50:02.124219317 CET;192.168.1.102;192.168.1.101;53914;1883;108;Connect Command;
69;Jan 13, 2022 18:50:02.332561956 CET;192.168.1.102;192.168.1.101;53914;1883;108;[TCP Retransmission] 53914 → 1883 [PSH, ACK] Seq=1 Ack=1 Win=42340 Len=54;
70;Jan 13, 2022 18:50:02.338258644 CET;192.168.1.101;192.168.1.102;1883;53914;54;1883 → 53914 [ACK] Seq=1 Ack=55 Win=8192 Len=0;
71;Jan 13, 2022 18:50:02.344041844 CET;192.168.1.101;192.168.1.102;1883;53914;58;Connect Ack;
72;Jan 13, 2022 18:50:02.344056992 CET;192.168.1.102;192.168.1.101;53914;1883;54;53914 → 1883 [ACK] Seq=55 Ack=5 Win=42336 Len=0;
73;Jan 13, 2022 18:50:02.344109267 CET;192.168.1.102;192.168.1.101;53914;1883;73;Publish Message [topic];message006
74;Jan 13, 2022 18:50:02.344129533 CET;192.168.1.102;192.168.1.101;53914;1883;56;Disconnect Req;
75;Jan 13, 2022 18:50:02.764721279 CET;192.168.1.102;192.168.1.101;53914;1883;75;[TCP Retransmission] 53914 → 1883 [FIN, PSH, ACK] Seq=55 Ack=5 Win=42336 Len=21;
76;Jan 13, 2022 18:50:02.768518082 CET;192.168.1.101;192.168.1.102;1883;53914;54;1883 → 53914 [FIN, ACK] Seq=5 Ack=77 Win=8192 Len=0;
77;Jan 13, 2022 18:50:02.768529072 CET;192.168.1.102;192.168.1.101;53914;1883;54;53914 → 1883 [ACK] Seq=77 Ack=6 Win=42335 Len=0;
78;Jan 13, 2022 18:50:12.348206137 CET;192.168.1.102;192.168.1.101;53916;1883;74;53916 → 1883 [SYN] Seq=0 Win=42340 Len=0 MSS=1460 SACK_PERM=1 TSval=3423326239 TSecr=0 WS=512;
79;Jan 13, 2022 18:50:12.352748311 CET;192.168.1.101;192.168.1.102;1883;53916;58;1883 → 53916 [SYN, ACK] Seq=0 Ack=1 Win=8192 Len=0 MSS=1460;
80;Jan 13, 2022 18:50:12.352765138 CET;192.168.1.102;192.168.1.101;53916;1883;54;53916 → 1883 [ACK] Seq=1 Ack=1 Win=42340 Len=0;
81;Jan 13, 2022 18:50:12.353320372 CET;192.168.1.102;192.168.1.101;53916;1883;108;Connect Command;
82;Jan 13, 2022 18:50:12.564667492 CET;192.168.1.102;192.168.1.101;53916;1883;108;[TCP Retransmission] 53916 → 1883 [PSH, ACK] Seq=1 Ack=1 Win=42340 Len=54;
83;Jan 13, 2022 18:50:12.585455556 CET;192.168.1.101;192.168.1.102;1883;53916;54;1883 → 53916 [ACK] Seq=1 Ack=55 Win=8192 Len=0;
84;Jan 13, 2022 18:50:12.593073395 CET;192.168.1.101;192.168.1.102;1883;53916;58;Connect Ack;
85;Jan 13, 2022 18:50:12.593095863 CET;192.168.1.102;192.168.1.101;53916;1883;54;53916 → 1883 [ACK] Seq=55 Ack=5 Win=42336 Len=0;
86;Jan 13, 2022 18:50:12.593181377 CET;192.168.1.102;192.168.1.101;53916;1883;73;Publish Message [topic];message007
87;Jan 13, 2022 18:50:12.593216447 CET;192.168.1.102;192.168.1.101;53916;1883;56;Disconnect Req;
88;Jan 13, 2022 18:50:13.036534510 CET;192.168.1.102;192.168.1.101;53916;1883;75;[TCP Retransmission] 53916 → 1883 [FIN, PSH, ACK] Seq=55 Ack=5 Win=42336 Len=21;
89;Jan 13, 2022 18:50:13.041917701 CET;192.168.1.101;192.168.1.102;1883;53916;54;1883 → 53916 [FIN, ACK] Seq=5 Ack=77 Win=8192 Len=0;
90;Jan 13, 2022 18:50:13.041938656 CET;192.168.1.102;192.168.1.101;53916;1883;54;53916 → 1883 [ACK] Seq=77 Ack=6 Win=42335 Len=0;
91;Jan 13, 2022 18:50:22.601826803 CET;192.168.1.102;192.168.1.101;53918;1883;74;53918 → 1883 [SYN] Seq=0 Win=42340 Len=0 MSS=1460 SACK_PERM=1 TSval=3423336492 TSecr=0 WS=512;
92;Jan 13, 2022 18:50:22.610169454 CET;192.168.1.101;192.168.1.102;1883;53918;58;1883 → 53918 [SYN, ACK] Seq=0 Ack=1 Win=8192 Len=0 MSS=1460;
93;Jan 13, 2022 18:50:22.610208505 CET;192.168.1.102;192.168.1.101;53918;1883;54;53918 → 1883 [ACK] Seq=1 Ack=1 Win=42340 Len=0;
94;Jan 13, 2022 18:50:22.610283609 CET;192.168.1.102;192.168.1.101;53918;1883;108;Connect Command;
95;Jan 13, 2022 18:50:22.825320885 CET;192.168.1.102;192.168.1.101;53918;1883;108;[TCP Retransmission] 53918 → 1883 [PSH, ACK] Seq=1 Ack=1 Win=42340 Len=54;
96;Jan 13, 2022 18:50:22.835407589 CET;192.168.1.101;192.168.1.102;1883;53918;54;1883 → 53918 [ACK] Seq=1 Ack=55 Win=8192 Len=0;
97;Jan 13, 2022 18:50:22.841013367 CET;192.168.1.101;192.168.1.102;1883;53918;58;Connect Ack;
98;Jan 13, 2022 18:50:22.841033840 CET;192.168.1.102;192.168.1.101;53918;1883;54;53918 → 1883 [ACK] Seq=55 Ack=5 Win=42336 Len=0;
99;Jan 13, 2022 18:50:22.841112680 CET;192.168.1.102;192.168.1.101;53918;1883;73;Publish Message [topic];message008
100;Jan 13, 2022 18:50:22.841143097 CET;192.168.1.102;192.168.1.101;53918;1883;56;Disconnect Req;
101;Jan 13, 2022 18:50:23.276677063 CET;192.168.1.102;192.168.1.101;53918;1883;75;[TCP Retransmission] 53918 → 1883 [FIN, PSH, ACK] Seq=55 Ack=5 Win=42336 Len=21;
102;Jan 13, 2022 18:50:23.295072068 CET;192.168.1.101;192.168.1.102;1883;53918;54;1883 → 53918 [FIN, ACK] Seq=5 Ack=77 Win=8192 Len=0;
103;Jan 13, 2022 18:50:23.295109772 CET;192.168.1.102;192.168.1.101;53918;1883;54;53918 → 1883 [ACK] Seq=77 Ack=6 Win=42335 Len=0;
104;Jan 13, 2022 18:50:32.857121197 CET;192.168.1.102;192.168.1.101;53920;1883;74;53920 → 1883 [SYN] Seq=0 Win=42340 Len=0 MSS=1460 SACK_PERM=1 TSval=3423346748 TSecr=0 WS=512;
105;Jan 13, 2022 18:50:32.869124944 CET;192.168.1.101;192.168.1.102;1883;53920;58;1883 → 53920 [SYN, ACK] Seq=0 Ack=1 Win=8192 Len=0 MSS=1460;
106;Jan 13, 2022 18:50:32.869166503 CET;192.168.1.102;192.168.1.101;53920;1883;54;53920 → 1883 [ACK] Seq=1 Ack=1 Win=42340 Len=0;
107;Jan 13, 2022 18:50:32.869257774 CET;192.168.1.102;192.168.1.101;53920;1883;108;Connect Command;
108;Jan 13, 2022 18:50:33.089032359 CET;192.168.1.102;192.168.1.101;53920;1883;108;[TCP Retransmission] 53920 → 1883 [PSH, ACK] Seq=1 Ack=1 Win=42340 Len=54;
109;Jan 13, 2022 18:50:33.092369852 CET;192.168.1.101;192.168.1.102;1883;53920;54;1883 → 53920 [ACK] Seq=1 Ack=55 Win=8192 Len=0;
110;Jan 13, 2022 18:50:33.095599478 CET;192.168.1.101;192.168.1.102;1883;53920;58;Connect Ack;
111;Jan 13, 2022 18:50:33.095610821 CET;192.168.1.102;192.168.1.101;53920;1883;54;53920 → 1883 [ACK] Seq=55 Ack=5 Win=42336 Len=0;
112;Jan 13, 2022 18:50:33.095660219 CET;192.168.1.102;192.168.1.101;53920;1883;73;Publish Message [topic];message009
113;Jan 13, 2022 18:50:33.095678595 CET;192.168.1.102;192.168.1.101;53920;1883;56;Disconnect Req;
114;Jan 13, 2022 18:50:33.548561538 CET;192.168.1.102;192.168.1.101;53920;1883;75;[TCP Retransmission] 53920 → 1883 [FIN, PSH, ACK] Seq=55 Ack=5 Win=42336 Len=21;
115;Jan 13, 2022 18:50:33.561531692 CET;192.168.1.101;192.168.1.102;1883;53920;54;1883 → 53920 [FIN, ACK] Seq=5 Ack=77 Win=8192 Len=0;
116;Jan 13, 2022 18:50:33.561567663 CET;192.168.1.102;192.168.1.101;53920;1883;54;53920 → 1883 [ACK] Seq=77 Ack=6 Win=42335 Len=0;
117;Jan 13, 2022 18:50:43.100718733 CET;192.168.1.102;192.168.1.101;53922;1883;74;53922 → 1883 [SYN] Seq=0 Win=42340 Len=0 MSS=1460 SACK_PERM=1 TSval=3423356991 TSecr=0 WS=512;
118;Jan 13, 2022 18:50:43.104231928 CET;192.168.1.101;192.168.1.102;1883;53922;58;1883 → 53922 [SYN, ACK] Seq=0 Ack=1 Win=8192 Len=0 MSS=1460;
119;Jan 13, 2022 18:50:43.104248083 CET;192.168.1.102;192.168.1.101;53922;1883;54;53922 → 1883 [ACK] Seq=1 Ack=1 Win=42340 Len=0;
120;Jan 13, 2022 18:50:43.105588916 CET;192.168.1.102;192.168.1.101;53922;1883;108;Connect Command;
121;Jan 13, 2022 18:50:43.312591470 CET;192.168.1.102;192.168.1.101;53922;1883;108;[TCP Retransmission] 53922 → 1883 [PSH, ACK] Seq=1 Ack=1 Win=42340 Len=54;
122;Jan 13, 2022 18:50:43.333421336 CET;192.168.1.101;192.168.1.102;1883;53922;54;1883 → 53922 [ACK] Seq=1 Ack=55 Win=8192 Len=0;
123;Jan 13, 2022 18:50:43.341847643 CET;192.168.1.101;192.168.1.102;1883;53922;58;Connect Ack;
124;Jan 13, 2022 18:50:43.341871211 CET;192.168.1.102;192.168.1.101;53922;1883;54;53922 → 1883 [ACK] Seq=55 Ack=5 Win=42336 Len=0;
125;Jan 13, 2022 18:50:43.341958874 CET;192.168.1.102;192.168.1.101;53922;1883;73;Publish Message [topic];message010
126;Jan 13, 2022 18:50:43.341994666 CET;192.168.1.102;192.168.1.101;53922;1883;56;Disconnect Req;
127;Jan 13, 2022 18:50:43.756579152 CET;192.168.1.102;192.168.1.101;53922;1883;75;[TCP Retransmission] 53922 → 1883 [FIN, PSH, ACK] Seq=55 Ack=5 Win=42336 Len=21;
128;Jan 13, 2022 18:50:43.772244585 CET;192.168.1.101;192.168.1.102;1883;53922;54;1883 → 53922 [FIN, ACK] Seq=5 Ack=77 Win=8192 Len=0;
129;Jan 13, 2022 18:50:43.772279994 CET;192.168.1.102;192.168.1.101;53922;1883;54;53922 → 1883 [ACK] Seq=77 Ack=6 Win=42335 Len=0;
130;Jan 13, 2022 18:50:53.350990014 CET;192.168.1.102;192.168.1.101;53924;1883;74;53924 → 1883 [SYN] Seq=0 Win=42340 Len=0 MSS=1460 SACK_PERM=1 TSval=3423367242 TSecr=0 WS=512;
131;Jan 13, 2022 18:50:53.355464237 CET;192.168.1.101;192.168.1.102;1883;53924;58;1883 → 53924 [SYN, ACK] Seq=0 Ack=1 Win=8192 Len=0 MSS=1460;
132;Jan 13, 2022 18:50:53.355488418 CET;192.168.1.102;192.168.1.101;53924;1883;54;53924 → 1883 [ACK] Seq=1 Ack=1 Win=42340 Len=0;
133;Jan 13, 2022 18:50:53.355776814 CET;192.168.1.102;192.168.1.101;53924;1883;108;Connect Command;
134;Jan 13, 2022 18:50:53.564624371 CET;192.168.1.102;192.168.1.101;53924;1883;108;[TCP Retransmission] 53924 → 1883 [PSH, ACK] Seq=1 Ack=1 Win=42340 Len=54;
135;Jan 13, 2022 18:50:53.588291756 CET;192.168.1.101;192.168.1.102;1883;53924;54;1883 → 53924 [ACK] Seq=1 Ack=55 Win=8192 Len=0;
136;Jan 13, 2022 18:50:53.597345460 CET;192.168.1.101;192.168.1.102;1883;53924;58;Connect Ack;
137;Jan 13, 2022 18:50:53.597370300 CET;192.168.1.102;192.168.1.101;53924;1883;54;53924 → 1883 [ACK] Seq=55 Ack=5 Win=42336 Len=0;
138;Jan 13, 2022 18:50:53.597456935 CET;192.168.1.102;192.168.1.101;53924;1883;73;Publish Message [topic];message011
139;Jan 13, 2022 18:50:53.597491221 CET;192.168.1.102;192.168.1.101;53924;1883;56;Disconnect Req;
140;Jan 13, 2022 18:50:54.028661528 CET;192.168.1.102;192.168.1.101;53924;1883;75;[TCP Retransmission] 53924 → 1883 [FIN, PSH, ACK] Seq=55 Ack=5 Win=42336 Len=21;
141;Jan 13, 2022 18:50:54.044174073 CET;192.168.1.101;192.168.1.102;1883;53924;54;1883 → 53924 [FIN, ACK] Seq=5 Ack=77 Win=8192 Len=0;
142;Jan 13, 2022 18:50:54.044206239 CET;192.168.1.102;192.168.1.101;53924;1883;54;53924 → 1883 [ACK] Seq=77 Ack=6 Win=42335 Len=0;
143;Jan 13, 2022 18:51:03.602205681 CET;192.168.1.102;192.168.1.101;53926;1883;74;53926 → 1883 [SYN] Seq=0 Win=42340 Len=0 MSS=1460 SACK_PERM=1 TSval=3423377493 TSecr=0 WS=512;
144;Jan 13, 2022 18:51:03.606331753 CET;192.168.1.101;192.168.1.102;1883;53926;58;1883 → 53926 [SYN, ACK] Seq=0 Ack=1 Win=8192 Len=0 MSS=1460;
145;Jan 13, 2022 18:51:03.606351395 CET;192.168.1.102;192.168.1.101;53926;1883;54;53926 → 1883 [ACK] Seq=1 Ack=1 Win=42340 Len=0;
146;Jan 13, 2022 18:51:03.607051393 CET;192.168.1.102;192.168.1.101;53926;1883;108;Connect Command;
147;Jan 13, 2022 18:51:03.816536229 CET;192.168.1.102;192.168.1.101;53926;1883;108;[TCP Retransmission] 53926 → 1883 [PSH, ACK] Seq=1 Ack=1 Win=42340 Len=54;
148;Jan 13, 2022 18:51:03.824111855 CET;192.168.1.101;192.168.1.102;1883;53926;54;1883 → 53926 [ACK] Seq=1 Ack=55 Win=8192 Len=0;
149;Jan 13, 2022 18:51:03.828499882 CET;192.168.1.101;192.168.1.102;1883;53926;58;Connect Ack;
150;Jan 13, 2022 18:51:03.828524690 CET;192.168.1.102;192.168.1.101;53926;1883;54;53926 → 1883 [ACK] Seq=55 Ack=5 Win=42336 Len=0;
151;Jan 13, 2022 18:51:03.828695903 CET;192.168.1.102;192.168.1.101;53926;1883;73;Publish Message [topic];message012
152;Jan 13, 2022 18:51:03.828713203 CET;192.168.1.102;192.168.1.101;53926;1883;56;Disconnect Req;
153;Jan 13, 2022 18:51:04.268851321 CET;192.168.1.102;192.168.1.101;53926;1883;75;[TCP Retransmission] 53926 → 1883 [FIN, PSH, ACK] Seq=55 Ack=5 Win=42336 Len=21;
154;Jan 13, 2022 18:51:04.322852246 CET;192.168.1.101;192.168.1.102;1883;53926;54;1883 → 53926 [FIN, ACK] Seq=5 Ack=77 Win=8192 Len=0;
155;Jan 13, 2022 18:51:04.322873918 CET;192.168.1.102;192.168.1.101;53926;1883;54;53926 → 1883 [ACK] Seq=77 Ack=6 Win=42335 Len=0;
156;Jan 13, 2022 18:51:13.841596316 CET;192.168.1.102;192.168.1.101;53928;1883;74;53928 → 1883 [SYN] Seq=0 Win=42340 Len=0 MSS=1460 SACK_PERM=1 TSval=3423387732 TSecr=0 WS=512;
157;Jan 13, 2022 18:51:13.858274910 CET;192.168.1.101;192.168.1.102;1883;53928;58;1883 → 53928 [SYN, ACK] Seq=0 Ack=1 Win=8192 Len=0 MSS=1460;
158;Jan 13, 2022 18:51:13.858292502 CET;192.168.1.102;192.168.1.101;53928;1883;54;53928 → 1883 [ACK] Seq=1 Ack=1 Win=42340 Len=0;
159;Jan 13, 2022 18:51:13.858345668 CET;192.168.1.102;192.168.1.101;53928;1883;108;Connect Command;
160;Jan 13, 2022 18:51:14.080663965 CET;192.168.1.102;192.168.1.101;53928;1883;108;[TCP Retransmission] 53928 → 1883 [PSH, ACK] Seq=1 Ack=1 Win=42340 Len=54;
161;Jan 13, 2022 18:51:14.097854684 CET;192.168.1.101;192.168.1.102;1883;53928;54;1883 → 53928 [ACK] Seq=1 Ack=55 Win=8192 Len=0;
162;Jan 13, 2022 18:51:14.103191409 CET;192.168.1.101;192.168.1.102;1883;53928;58;Connect Ack;
163;Jan 13, 2022 18:51:14.103213009 CET;192.168.1.102;192.168.1.101;53928;1883;54;53928 → 1883 [ACK] Seq=55 Ack=5 Win=42336 Len=0;
164;Jan 13, 2022 18:51:14.103302072 CET;192.168.1.102;192.168.1.101;53928;1883;73;Publish Message [topic];message013
165;Jan 13, 2022 18:51:14.103336358 CET;192.168.1.102;192.168.1.101;53928;1883;56;Disconnect Req;
166;Jan 13, 2022 18:51:14.572536637 CET;192.168.1.102;192.168.1.101;53928;1883;75;[TCP Retransmission] 53928 → 1883 [FIN, PSH, ACK] Seq=55 Ack=5 Win=42336 Len=21;
167;Jan 13, 2022 18:51:14.576195397 CET;192.168.1.101;192.168.1.102;1883;53928;54;1883 → 53928 [FIN, ACK] Seq=5 Ack=77 Win=8192 Len=0;
168;Jan 13, 2022 18:51:14.576210542 CET;192.168.1.102;192.168.1.101;53928;1883;54;53928 → 1883 [ACK] Seq=77 Ack=6 Win=42335 Len=0;
169;Jan 13, 2022 18:51:24.114952683 CET;192.168.1.102;192.168.1.101;53930;1883;74;53930 → 1883 [SYN] Seq=0 Win=42340 Len=0 MSS=1460 SACK_PERM=1 TSval=3423398006 TSecr=0 WS=512;
170;Jan 13, 2022 18:51:24.125717192 CET;192.168.1.101;192.168.1.102;1883;53930;58;1883 → 53930 [SYN, ACK] Seq=0 Ack=1 Win=8192 Len=0 MSS=1460;
171;Jan 13, 2022 18:51:24.125756208 CET;192.168.1.102;192.168.1.101;53930;1883;54;53930 → 1883 [ACK] Seq=1 Ack=1 Win=42340 Len=0;
172;Jan 13, 2022 18:51:24.125842168 CET;192.168.1.102;192.168.1.101;53930;1883;108;Connect Command;
173;Jan 13, 2022 18:51:24.340566614 CET;192.168.1.102;192.168.1.101;53930;1883;108;[TCP Retransmission] 53930 → 1883 [PSH, ACK] Seq=1 Ack=1 Win=42340 Len=54;
174;Jan 13, 2022 18:51:24.349821526 CET;192.168.1.101;192.168.1.102;1883;53930;54;1883 → 53930 [ACK] Seq=1 Ack=55 Win=8192 Len=0;
175;Jan 13, 2022 18:51:24.352795500 CET;192.168.1.101;192.168.1.102;1883;53930;58;Connect Ack;
176;Jan 13, 2022 18:51:24.352810331 CET;192.168.1.102;192.168.1.101;53930;1883;54;53930 → 1883 [ACK] Seq=55 Ack=5 Win=42336 Len=0;
177;Jan 13, 2022 18:51:24.352868078 CET;192.168.1.102;192.168.1.101;53930;1883;73;Publish Message [topic];message014
178;Jan 13, 2022 18:51:24.352890489 CET;192.168.1.102;192.168.1.101;53930;1883;56;Disconnect Req;
179;Jan 13, 2022 18:51:24.781653335 CET;192.168.1.102;192.168.1.101;53930;1883;75;[TCP Retransmission] 53930 → 1883 [FIN, PSH, ACK] Seq=55 Ack=5 Win=42336 Len=21;
180;Jan 13, 2022 18:51:24.785002867 CET;192.168.1.101;192.168.1.102;1883;53930;54;1883 → 53930 [FIN, ACK] Seq=5 Ack=77 Win=8192 Len=0;
181;Jan 13, 2022 18:51:24.785017842 CET;192.168.1.102;192.168.1.101;53930;1883;54;53930 → 1883 [ACK] Seq=77 Ack=6 Win=42335 Len=0;
182;Jan 13, 2022 18:51:34.358274041 CET;192.168.1.102;192.168.1.101;53932;1883;74;53932 → 1883 [SYN] Seq=0 Win=42340 Len=0 MSS=1460 SACK_PERM=1 TSval=3423408249 TSecr=0 WS=512;
183;Jan 13, 2022 18:51:34.362996092 CET;192.168.1.101;192.168.1.102;1883;53932;58;1883 → 53932 [SYN, ACK] Seq=0 Ack=1 Win=8192 Len=0 MSS=1460;
184;Jan 13, 2022 18:51:34.363017375 CET;192.168.1.102;192.168.1.101;53932;1883;54;53932 → 1883 [ACK] Seq=1 Ack=1 Win=42340 Len=0;
185;Jan 13, 2022 18:51:34.363064700 CET;192.168.1.102;192.168.1.101;53932;1883;108;Connect Command;
186;Jan 13, 2022 18:51:34.572562593 CET;192.168.1.102;192.168.1.101;53932;1883;108;[TCP Retransmission] 53932 → 1883 [PSH, ACK] Seq=1 Ack=1 Win=42340 Len=54;
187;Jan 13, 2022 18:51:34.592402355 CET;192.168.1.101;192.168.1.102;1883;53932;54;1883 → 53932 [ACK] Seq=1 Ack=55 Win=8192 Len=0;
188;Jan 13, 2022 18:51:34.601490164 CET;192.168.1.101;192.168.1.102;1883;53932;58;Connect Ack;
189;Jan 13, 2022 18:51:34.601512069 CET;192.168.1.102;192.168.1.101;53932;1883;54;53932 → 1883 [ACK] Seq=55 Ack=5 Win=42336 Len=0;
190;Jan 13, 2022 18:51:34.601597339 CET;192.168.1.102;192.168.1.101;53932;1883;73;Publish Message [topic];message015
191;Jan 13, 2022 18:51:34.601632478 CET;192.168.1.102;192.168.1.101;53932;1883;56;Disconnect Req;
192;Jan 13, 2022 18:51:35.020653639 CET;192.168.1.102;192.168.1.101;53932;1883;75;[TCP Retransmission] 53932 → 1883 [FIN, PSH, ACK] Seq=55 Ack=5 Win=42336 Len=21;
193;Jan 13, 2022 18:51:35.029231258 CET;192.168.1.101;192.168.1.102;1883;53932;54;1883 → 53932 [FIN, ACK] Seq=5 Ack=77 Win=8192 Len=0;
194;Jan 13, 2022 18:51:35.029252675 CET;192.168.1.102;192.168.1.101;53932;1883;54;53932 → 1883 [ACK] Seq=77 Ack=6 Win=42335 Len=0;
195;Jan 13, 2022 18:51:44.606388663 CET;192.168.1.102;192.168.1.101;53934;1883;74;53934 → 1883 [SYN] Seq=0 Win=42340 Len=0 MSS=1460 SACK_PERM=1 TSval=3423418497 TSecr=0 WS=512;
196;Jan 13, 2022 18:51:44.609591173 CET;192.168.1.101;192.168.1.102;1883;53934;58;1883 → 53934 [SYN, ACK] Seq=0 Ack=1 Win=8192 Len=0 MSS=1460;
197;Jan 13, 2022 18:51:44.609609793 CET;192.168.1.102;192.168.1.101;53934;1883;54;53934 → 1883 [ACK] Seq=1 Ack=1 Win=42340 Len=0;
198;Jan 13, 2022 18:51:44.610008793 CET;192.168.1.102;192.168.1.101;53934;1883;108;Connect Command;
199;Jan 13, 2022 18:51:44.816525321 CET;192.168.1.102;192.168.1.101;53934;1883;108;[TCP Retransmission] 53934 → 1883 [PSH, ACK] Seq=1 Ack=1 Win=42340 Len=54;
200;Jan 13, 2022 18:51:44.820046996 CET;192.168.1.101;192.168.1.102;1883;53934;54;1883 → 53934 [ACK] Seq=1 Ack=55 Win=8192 Len=0;
201;Jan 13, 2022 18:51:44.825260149 CET;192.168.1.101;192.168.1.102;1883;53934;58;Connect Ack;
202;Jan 13, 2022 18:51:44.825274751 CET;192.168.1.102;192.168.1.101;53934;1883;54;53934 → 1883 [ACK] Seq=55 Ack=5 Win=42336 Len=0;
203;Jan 13, 2022 18:51:44.825327081 CET;192.168.1.102;192.168.1.101;53934;1883;73;Publish Message [topic];message016
204;Jan 13, 2022 18:51:44.825347820 CET;192.168.1.102;192.168.1.101;53934;1883;56;Disconnect Req;
205;Jan 13, 2022 18:51:45.260527842 CET;192.168.1.102;192.168.1.101;53934;1883;75;[TCP Retransmission] 53934 → 1883 [FIN, PSH, ACK] Seq=55 Ack=5 Win=42336 Len=21;
206;Jan 13, 2022 18:51:45.263899844 CET;192.168.1.101;192.168.1.102;1883;53934;54;1883 → 53934 [FIN, ACK] Seq=5 Ack=77 Win=8192 Len=0;
207;Jan 13, 2022 18:51:45.263914113 CET;192.168.1.102;192.168.1.101;53934;1883;54;53934 → 1883 [ACK] Seq=77 Ack=6 Win=42335 Len=0;
208;Jan 13, 2022 18:51:54.829556086 CET;192.168.1.102;192.168.1.101;53936;1883;74;53936 → 1883 [SYN] Seq=0 Win=42340 Len=0 MSS=1460 SACK_PERM=1 TSval=3423428720 TSecr=0 WS=512;
209;Jan 13, 2022 18:51:54.833304755 CET;192.168.1.101;192.168.1.102;1883;53936;58;1883 → 53936 [SYN, ACK] Seq=0 Ack=1 Win=8192 Len=0 MSS=1460;
210;Jan 13, 2022 18:51:54.833326063 CET;192.168.1.102;192.168.1.101;53936;1883;54;53936 → 1883 [ACK] Seq=1 Ack=1 Win=42340 Len=0;
211;Jan 13, 2022 18:51:54.833531567 CET;192.168.1.102;192.168.1.101;53936;1883;108;Connect Command;
212;Jan 13, 2022 18:51:55.040518418 CET;192.168.1.102;192.168.1.101;53936;1883;108;[TCP Retransmission] 53936 → 1883 [PSH, ACK] Seq=1 Ack=1 Win=42340 Len=54;
213;Jan 13, 2022 18:51:55.043861642 CET;192.168.1.101;192.168.1.102;1883;53936;54;1883 → 53936 [ACK] Seq=1 Ack=55 Win=8192 Len=0;
214;Jan 13, 2022 18:51:55.047900903 CET;192.168.1.101;192.168.1.102;1883;53936;58;Connect Ack;
215;Jan 13, 2022 18:51:55.047960872 CET;192.168.1.102;192.168.1.101;53936;1883;54;53936 → 1883 [ACK] Seq=55 Ack=5 Win=42336 Len=0;
216;Jan 13, 2022 18:51:55.048404167 CET;192.168.1.102;192.168.1.101;53936;1883;73;Publish Message [topic];message017
217;Jan 13, 2022 18:51:55.048427474 CET;192.168.1.102;192.168.1.101;53936;1883;56;Disconnect Req;
218;Jan 13, 2022 18:51:55.468516830 CET;192.168.1.102;192.168.1.101;53936;1883;75;[TCP Retransmission] 53936 → 1883 [FIN, PSH, ACK] Seq=55 Ack=5 Win=42336 Len=21;
219;Jan 13, 2022 18:51:55.471550679 CET;192.168.1.101;192.168.1.102;1883;53936;54;1883 → 53936 [FIN, ACK] Seq=5 Ack=77 Win=8192 Len=0;
220;Jan 13, 2022 18:51:55.471563198 CET;192.168.1.102;192.168.1.101;53936;1883;54;53936 → 1883 [ACK] Seq=77 Ack=6 Win=42335 Len=0;
221;Jan 13, 2022 18:52:05.053875246 CET;192.168.1.102;192.168.1.101;53938;1883;74;53938 → 1883 [SYN] Seq=0 Win=42340 Len=0 MSS=1460 SACK_PERM=1 TSval=3423438945 TSecr=0 WS=512;
222;Jan 13, 2022 18:52:05.057781377 CET;192.168.1.101;192.168.1.102;1883;53938;58;1883 → 53938 [SYN, ACK] Seq=0 Ack=1 Win=8192 Len=0 MSS=1460;
223;Jan 13, 2022 18:52:05.057795060 CET;192.168.1.102;192.168.1.101;53938;1883;54;53938 → 1883 [ACK] Seq=1 Ack=1 Win=42340 Len=0;
224;Jan 13, 2022 18:52:05.059494056 CET;192.168.1.102;192.168.1.101;53938;1883;108;Connect Command;
225;Jan 13, 2022 18:52:05.264694365 CET;192.168.1.102;192.168.1.101;53938;1883;108;[TCP Retransmission] 53938 → 1883 [PSH, ACK] Seq=1 Ack=1 Win=42340 Len=54;
226;Jan 13, 2022 18:52:05.285626706 CET;192.168.1.101;192.168.1.102;1883;53938;54;1883 → 53938 [ACK] Seq=1 Ack=55 Win=8192 Len=0;
227;Jan 13, 2022 18:52:05.293890365 CET;192.168.1.101;192.168.1.102;1883;53938;58;Connect Ack;
228;Jan 13, 2022 18:52:05.293911901 CET;192.168.1.102;192.168.1.101;53938;1883;54;53938 → 1883 [ACK] Seq=55 Ack=5 Win=42336 Len=0;
229;Jan 13, 2022 18:52:05.293991713 CET;192.168.1.102;192.168.1.101;53938;1883;73;Publish Message [topic];message018
230;Jan 13, 2022 18:52:05.294028743 CET;192.168.1.102;192.168.1.101;53938;1883;56;Disconnect Req;
231;Jan 13, 2022 18:52:05.708593285 CET;192.168.1.102;192.168.1.101;53938;1883;75;[TCP Retransmission] 53938 → 1883 [FIN, PSH, ACK] Seq=55 Ack=5 Win=42336 Len=21;
232;Jan 13, 2022 18:52:05.717713502 CET;192.168.1.101;192.168.1.102;1883;53938;54;1883 → 53938 [FIN, ACK] Seq=5 Ack=77 Win=8192 Len=0;
233;Jan 13, 2022 18:52:05.717737092 CET;192.168.1.102;192.168.1.101;53938;1883;54;53938 → 1883 [ACK] Seq=77 Ack=6 Win=42335 Len=0;
234;Jan 13, 2022 18:52:15.298897334 CET;192.168.1.102;192.168.1.101;53942;1883;74;53942 → 1883 [SYN] Seq=0 Win=42340 Len=0 MSS=1460 SACK_PERM=1 TSval=3423449190 TSecr=0 WS=512;
235;Jan 13, 2022 18:52:15.301590400 CET;192.168.1.101;192.168.1.102;1883;53942;58;1883 → 53942 [SYN, ACK] Seq=0 Ack=1 Win=8192 Len=0 MSS=1460;
236;Jan 13, 2022 18:52:15.301603616 CET;192.168.1.102;192.168.1.101;53942;1883;54;53942 → 1883 [ACK] Seq=1 Ack=1 Win=42340 Len=0;
237;Jan 13, 2022 18:52:15.302740771 CET;192.168.1.102;192.168.1.101;53942;1883;108;Connect Command;
238;Jan 13, 2022 18:52:15.310565845 CET;192.168.1.101;192.168.1.102;1883;53942;54;1883 → 53942 [ACK] Seq=1 Ack=55 Win=8192 Len=0;
239;Jan 13, 2022 18:52:15.314352300 CET;192.168.1.101;192.168.1.102;1883;53942;58;Connect Ack;
240;Jan 13, 2022 18:52:15.314374650 CET;192.168.1.102;192.168.1.101;53942;1883;54;53942 → 1883 [ACK] Seq=55 Ack=5 Win=42336 Len=0;
241;Jan 13, 2022 18:52:15.314444071 CET;192.168.1.102;192.168.1.101;53942;1883;73;Publish Message [topic];message019
242;Jan 13, 2022 18:52:15.314466429 CET;192.168.1.102;192.168.1.101;53942;1883;56;Disconnect Req;
243;Jan 13, 2022 18:52:15.520734835 CET;192.168.1.102;192.168.1.101;53942;1883;75;[TCP Retransmission] 53942 → 1883 [FIN, PSH, ACK] Seq=55 Ack=5 Win=42336 Len=21;
244;Jan 13, 2022 18:52:15.537169552 CET;192.168.1.101;192.168.1.102;1883;53942;54;1883 → 53942 [FIN, ACK] Seq=5 Ack=77 Win=8192 Len=0;
245;Jan 13, 2022 18:52:15.537217782 CET;192.168.1.102;192.168.1.101;53942;1883;54;53942 → 1883 [ACK] Seq=77 Ack=6 Win=42335 Len=0;
246;Jan 13, 2022 18:52:25.321823224 CET;192.168.1.102;192.168.1.101;53944;1883;74;53944 → 1883 [SYN] Seq=0 Win=42340 Len=0 MSS=1460 SACK_PERM=1 TSval=3423459212 TSecr=0 WS=512;
247;Jan 13, 2022 18:52:25.326316192 CET;192.168.1.101;192.168.1.102;1883;53944;58;1883 → 53944 [SYN, ACK] Seq=0 Ack=1 Win=8192 Len=0 MSS=1460;
248;Jan 13, 2022 18:52:25.326340987 CET;192.168.1.102;192.168.1.101;53944;1883;54;53944 → 1883 [ACK] Seq=1 Ack=1 Win=42340 Len=0;
249;Jan 13, 2022 18:52:25.326615293 CET;192.168.1.102;192.168.1.101;53944;1883;108;Connect Command;
250;Jan 13, 2022 18:52:25.536530343 CET;192.168.1.102;192.168.1.101;53944;1883;108;[TCP Retransmission] 53944 → 1883 [PSH, ACK] Seq=1 Ack=1 Win=42340 Len=54;
251;Jan 13, 2022 18:52:25.541958431 CET;192.168.1.101;192.168.1.102;1883;53944;54;1883 → 53944 [ACK] Seq=1 Ack=55 Win=8192 Len=0;
252;Jan 13, 2022 18:52:25.545329317 CET;192.168.1.101;192.168.1.102;1883;53944;58;Connect Ack;
253;Jan 13, 2022 18:52:25.545347956 CET;192.168.1.102;192.168.1.101;53944;1883;54;53944 → 1883 [ACK] Seq=55 Ack=5 Win=42336 Len=0;
254;Jan 13, 2022 18:52:25.545411425 CET;192.168.1.102;192.168.1.101;53944;1883;73;Publish Message [topic];message020
255;Jan 13, 2022 18:52:25.545433385 CET;192.168.1.102;192.168.1.101;53944;1883;56;Disconnect Req;
256;Jan 13, 2022 18:52:25.964542372 CET;192.168.1.102;192.168.1.101;53944;1883;75;[TCP Retransmission] 53944 → 1883 [FIN, PSH, ACK] Seq=55 Ack=5 Win=42336 Len=21;
257;Jan 13, 2022 18:52:25.973991535 CET;192.168.1.101;192.168.1.102;1883;53944;54;1883 → 53944 [FIN, ACK] Seq=5 Ack=77 Win=8192 Len=0;
258;Jan 13, 2022 18:52:25.974019592 CET;192.168.1.102;192.168.1.101;53944;1883;54;53944 → 1883 [ACK] Seq=77 Ack=6 Win=42335 Len=0;
259;Jan 13, 2022 18:52:35.554868789 CET;192.168.1.102;192.168.1.101;53946;1883;74;53946 → 1883 [SYN] Seq=0 Win=42340 Len=0 MSS=1460 SACK_PERM=1 TSval=3423469446 TSecr=0 WS=512;
260;Jan 13, 2022 18:52:35.559599414 CET;192.168.1.101;192.168.1.102;1883;53946;58;1883 → 53946 [SYN, ACK] Seq=0 Ack=1 Win=8192 Len=0 MSS=1460;
261;Jan 13, 2022 18:52:35.559630884 CET;192.168.1.102;192.168.1.101;53946;1883;54;53946 → 1883 [ACK] Seq=1 Ack=1 Win=42340 Len=0;
262;Jan 13, 2022 18:52:35.559920773 CET;192.168.1.102;192.168.1.101;53946;1883;108;Connect Command;
263;Jan 13, 2022 18:52:35.768515780 CET;192.168.1.102;192.168.1.101;53946;1883;108;[TCP Retransmission] 53946 → 1883 [PSH, ACK] Seq=1 Ack=1 Win=42340 Len=54;
264;Jan 13, 2022 18:52:35.772219053 CET;192.168.1.101;192.168.1.102;1883;53946;54;1883 → 53946 [ACK] Seq=1 Ack=55 Win=8192 Len=0;
265;Jan 13, 2022 18:52:35.777237242 CET;192.168.1.101;192.168.1.102;1883;53946;58;Connect Ack;
266;Jan 13, 2022 18:52:35.777256239 CET;192.168.1.102;192.168.1.101;53946;1883;54;53946 → 1883 [ACK] Seq=55 Ack=5 Win=42336 Len=0;
267;Jan 13, 2022 18:52:35.777320157 CET;192.168.1.102;192.168.1.101;53946;1883;73;Publish Message [topic];message021
268;Jan 13, 2022 18:52:35.777345019 CET;192.168.1.102;192.168.1.101;53946;1883;56;Disconnect Req;
269;Jan 13, 2022 18:52:36.204604750 CET;192.168.1.102;192.168.1.101;53946;1883;75;[TCP Retransmission] 53946 → 1883 [FIN, PSH, ACK] Seq=55 Ack=5 Win=42336 Len=21;
270;Jan 13, 2022 18:52:36.223465102 CET;192.168.1.101;192.168.1.102;1883;53946;54;1883 → 53946 [FIN, ACK] Seq=5 Ack=77 Win=8192 Len=0;
271;Jan 13, 2022 18:52:36.223500955 CET;192.168.1.102;192.168.1.101;53946;1883;54;53946 → 1883 [ACK] Seq=77 Ack=6 Win=42335 Len=0;
272;Jan 13, 2022 18:52:45.791252904 CET;192.168.1.102;192.168.1.101;53948;1883;74;53948 → 1883 [SYN] Seq=0 Win=42340 Len=0 MSS=1460 SACK_PERM=1 TSval=3423479682 TSecr=0 WS=512;
273;Jan 13, 2022 18:52:45.802960738 CET;192.168.1.101;192.168.1.102;1883;53948;58;1883 → 53948 [SYN, ACK] Seq=0 Ack=1 Win=8192 Len=0 MSS=1460;
274;Jan 13, 2022 18:52:45.803002644 CET;192.168.1.102;192.168.1.101;53948;1883;54;53948 → 1883 [ACK] Seq=1 Ack=1 Win=42340 Len=0;
275;Jan 13, 2022 18:52:45.803085400 CET;192.168.1.102;192.168.1.101;53948;1883;108;Connect Command;
276;Jan 13, 2022 18:52:46.016581624 CET;192.168.1.102;192.168.1.101;53948;1883;108;[TCP Retransmission] 53948 → 1883 [PSH, ACK] Seq=1 Ack=1 Win=42340 Len=54;
277;Jan 13, 2022 18:52:46.037378756 CET;192.168.1.101;192.168.1.102;1883;53948;54;1883 → 53948 [ACK] Seq=1 Ack=55 Win=8192 Len=0;
278;Jan 13, 2022 18:52:46.045266494 CET;192.168.1.101;192.168.1.102;1883;53948;58;Connect Ack;
279;Jan 13, 2022 18:52:46.045322755 CET;192.168.1.102;192.168.1.101;53948;1883;54;53948 → 1883 [ACK] Seq=55 Ack=5 Win=42336 Len=0;
280;Jan 13, 2022 18:52:46.045422372 CET;192.168.1.102;192.168.1.101;53948;1883;73;Publish Message [topic];message022
281;Jan 13, 2022 18:52:46.045464144 CET;192.168.1.102;192.168.1.101;53948;1883;56;Disconnect Req;
282;Jan 13, 2022 18:52:46.476549734 CET;192.168.1.102;192.168.1.101;53948;1883;75;[TCP Retransmission] 53948 → 1883 [FIN, PSH, ACK] Seq=55 Ack=5 Win=42336 Len=21;
283;Jan 13, 2022 18:52:46.483778687 CET;192.168.1.101;192.168.1.102;1883;53948;54;1883 → 53948 [FIN, ACK] Seq=5 Ack=77 Win=8192 Len=0;
284;Jan 13, 2022 18:52:46.483808107 CET;192.168.1.102;192.168.1.101;53948;1883;54;53948 → 1883 [ACK] Seq=77 Ack=6 Win=42335 Len=0;
285;Jan 13, 2022 18:52:56.049849644 CET;192.168.1.102;192.168.1.101;53950;1883;74;53950 → 1883 [SYN] Seq=0 Win=42340 Len=0 MSS=1460 SACK_PERM=1 TSval=3423489940 TSecr=0 WS=512;
286;Jan 13, 2022 18:52:56.052554276 CET;192.168.1.101;192.168.1.102;1883;53950;58;1883 → 53950 [SYN, ACK] Seq=0 Ack=1 Win=8192 Len=0 MSS=1460;
287;Jan 13, 2022 18:52:56.052569600 CET;192.168.1.102;192.168.1.101;53950;1883;54;53950 → 1883 [ACK] Seq=1 Ack=1 Win=42340 Len=0;
288;Jan 13, 2022 18:52:56.053744437 CET;192.168.1.102;192.168.1.101;53950;1883;108;Connect Command;
289;Jan 13, 2022 18:52:56.058977440 CET;192.168.1.101;192.168.1.102;1883;53950;54;1883 → 53950 [ACK] Seq=1 Ack=55 Win=8192 Len=0;
290;Jan 13, 2022 18:52:56.062344986 CET;192.168.1.101;192.168.1.102;1883;53950;58;Connect Ack;
291;Jan 13, 2022 18:52:56.062360964 CET;192.168.1.102;192.168.1.101;53950;1883;54;53950 → 1883 [ACK] Seq=55 Ack=5 Win=42336 Len=0;
292;Jan 13, 2022 18:52:56.062415520 CET;192.168.1.102;192.168.1.101;53950;1883;73;Publish Message [topic];message023
293;Jan 13, 2022 18:52:56.062438627 CET;192.168.1.102;192.168.1.101;53950;1883;56;Disconnect Req;
294;Jan 13, 2022 18:52:56.268583613 CET;192.168.1.102;192.168.1.101;53950;1883;75;[TCP Retransmission] 53950 → 1883 [FIN, PSH, ACK] Seq=55 Ack=5 Win=42336 Len=21;
295;Jan 13, 2022 18:52:56.290503244 CET;192.168.1.101;192.168.1.102;1883;53950;54;1883 → 53950 [FIN, ACK] Seq=5 Ack=77 Win=8192 Len=0;
296;Jan 13, 2022 18:52:56.290537138 CET;192.168.1.102;192.168.1.101;53950;1883;54;53950 → 1883 [ACK] Seq=77 Ack=6 Win=42335 Len=0;
297;Jan 13, 2022 18:53:06.066782737 CET;192.168.1.102;192.168.1.101;53952;1883;74;53952 → 1883 [SYN] Seq=0 Win=42340 Len=0 MSS=1460 SACK_PERM=1 TSval=3423499957 TSecr=0 WS=512;
298;Jan 13, 2022 18:53:06.069510271 CET;192.168.1.101;192.168.1.102;1883;53952;58;1883 → 53952 [SYN, ACK] Seq=0 Ack=1 Win=8192 Len=0 MSS=1460;
299;Jan 13, 2022 18:53:06.069525316 CET;192.168.1.102;192.168.1.101;53952;1883;54;53952 → 1883 [ACK] Seq=1 Ack=1 Win=42340 Len=0;
300;Jan 13, 2022 18:53:06.069659413 CET;192.168.1.102;192.168.1.101;53952;1883;108;Connect Command;
301;Jan 13, 2022 18:53:06.276983373 CET;192.168.1.102;192.168.1.101;53952;1883;108;[TCP Retransmission] 53952 → 1883 [PSH, ACK] Seq=1 Ack=1 Win=42340 Len=54;
302;Jan 13, 2022 18:53:06.281948353 CET;192.168.1.101;192.168.1.102;1883;53952;54;1883 → 53952 [ACK] Seq=1 Ack=55 Win=8192 Len=0;
303;Jan 13, 2022 18:53:06.286272060 CET;192.168.1.101;192.168.1.102;1883;53952;58;Connect Ack;
304;Jan 13, 2022 18:53:06.286285317 CET;192.168.1.102;192.168.1.101;53952;1883;54;53952 → 1883 [ACK] Seq=55 Ack=5 Win=42336 Len=0;
305;Jan 13, 2022 18:53:06.286342966 CET;192.168.1.102;192.168.1.101;53952;1883;73;Publish Message [topic];message024
306;Jan 13, 2022 18:53:06.286365465 CET;192.168.1.102;192.168.1.101;53952;1883;56;Disconnect Req;
