1;Jan 13, 2022 17:58:41.469460385 CET;192.168.1.102;192.168.1.101;53312;1883;74;53312 → 1883 [SYN] Seq=0 Win=42340 Len=0 MSS=1460 SACK_PERM=1 TSval=3420235360 TSecr=0 WS=512;
2;Jan 13, 2022 17:58:41.488441240 CET;192.168.1.101;192.168.1.102;1883;53312;58;1883 → 53312 [SYN, ACK] Seq=0 Ack=1 Win=8192 Len=0 MSS=1460;
3;Jan 13, 2022 17:58:41.488461920 CET;192.168.1.102;192.168.1.101;53312;1883;54;53312 → 1883 [ACK] Seq=1 Ack=1 Win=42340 Len=0;
4;Jan 13, 2022 17:58:41.488604197 CET;192.168.1.102;192.168.1.101;53312;1883;108;Connect Command;
5;Jan 13, 2022 17:58:41.712510952 CET;192.168.1.102;192.168.1.101;53312;1883;108;[TCP Retransmission] 53312 → 1883 [PSH, ACK] Seq=1 Ack=1 Win=42340 Len=54;
6;Jan 13, 2022 17:58:41.718331377 CET;192.168.1.101;192.168.1.102;1883;53312;54;1883 → 53312 [ACK] Seq=1 Ack=55 Win=8192 Len=0;
7;Jan 13, 2022 17:58:41.720776241 CET;192.168.1.101;192.168.1.102;1883;53312;58;Connect Ack;
8;Jan 13, 2022 17:58:41.720795341 CET;192.168.1.102;192.168.1.101;53312;1883;54;53312 → 1883 [ACK] Seq=55 Ack=5 Win=42336 Len=0;
9;Jan 13, 2022 17:58:41.720853714 CET;192.168.1.102;192.168.1.101;53312;1883;73;Publish Message [topic];message001
10;Jan 13, 2022 17:58:41.720870323 CET;192.168.1.102;192.168.1.101;53312;1883;56;Disconnect Req;
11;Jan 13, 2022 17:58:42.188854934 CET;192.168.1.102;192.168.1.101;53312;1883;75;[TCP Retransmission] 53312 → 1883 [FIN, PSH, ACK] Seq=55 Ack=5 Win=42336 Len=21;
12;Jan 13, 2022 17:58:42.196831186 CET;192.168.1.101;192.168.1.102;1883;53312;54;1883 → 53312 [FIN, ACK] Seq=5 Ack=77 Win=8192 Len=0;
13;Jan 13, 2022 17:58:42.196856612 CET;192.168.1.102;192.168.1.101;53312;1883;54;53312 → 1883 [ACK] Seq=77 Ack=6 Win=42335 Len=0;
14;Jan 13, 2022 17:58:51.738892728 CET;192.168.1.102;192.168.1.101;53314;1883;74;53314 → 1883 [SYN] Seq=0 Win=42340 Len=0 MSS=1460 SACK_PERM=1 TSval=3420245630 TSecr=0 WS=512;
15;Jan 13, 2022 17:58:51.751803880 CET;192.168.1.101;192.168.1.102;1883;53314;58;1883 → 53314 [SYN, ACK] Seq=0 Ack=1 Win=8192 Len=0 MSS=1460;
16;Jan 13, 2022 17:58:51.751837362 CET;192.168.1.102;192.168.1.101;53314;1883;54;53314 → 1883 [ACK] Seq=1 Ack=1 Win=42340 Len=0;
17;Jan 13, 2022 17:58:51.751950439 CET;192.168.1.102;192.168.1.101;53314;1883;108;Connect Command;
18;Jan 13, 2022 17:58:51.968597233 CET;192.168.1.102;192.168.1.101;53314;1883;108;[TCP Retransmission] 53314 → 1883 [PSH, ACK] Seq=1 Ack=1 Win=42340 Len=54;
19;Jan 13, 2022 17:58:51.975808936 CET;192.168.1.101;192.168.1.102;1883;53314;54;1883 → 53314 [ACK] Seq=1 Ack=55 Win=8192 Len=0;
20;Jan 13, 2022 17:58:51.983442353 CET;192.168.1.101;192.168.1.102;1883;53314;58;Connect Ack;
21;Jan 13, 2022 17:58:51.983462573 CET;192.168.1.102;192.168.1.101;53314;1883;54;53314 → 1883 [ACK] Seq=55 Ack=5 Win=42336 Len=0;
22;Jan 13, 2022 17:58:51.983569104 CET;192.168.1.102;192.168.1.101;53314;1883;73;Publish Message [topic];message002
23;Jan 13, 2022 17:58:51.983592949 CET;192.168.1.102;192.168.1.101;53314;1883;56;Disconnect Req;
24;Jan 13, 2022 17:58:52.428590852 CET;192.168.1.102;192.168.1.101;53314;1883;75;[TCP Retransmission] 53314 → 1883 [FIN, PSH, ACK] Seq=55 Ack=5 Win=42336 Len=21;
25;Jan 13, 2022 17:58:52.446592935 CET;192.168.1.101;192.168.1.102;1883;53314;54;1883 → 53314 [FIN, ACK] Seq=5 Ack=77 Win=8192 Len=0;
26;Jan 13, 2022 17:58:52.446629057 CET;192.168.1.102;192.168.1.101;53314;1883;54;53314 → 1883 [ACK] Seq=77 Ack=6 Win=42335 Len=0;
27;Jan 13, 2022 17:59:01.996551488 CET;192.168.1.102;192.168.1.101;53316;1883;74;53316 → 1883 [SYN] Seq=0 Win=42340 Len=0 MSS=1460 SACK_PERM=1 TSval=3420255887 TSecr=0 WS=512;
28;Jan 13, 2022 17:59:02.010818608 CET;192.168.1.101;192.168.1.102;1883;53316;58;1883 → 53316 [SYN, ACK] Seq=0 Ack=1 Win=8192 Len=0 MSS=1460;
29;Jan 13, 2022 17:59:02.010861451 CET;192.168.1.102;192.168.1.101;53316;1883;54;53316 → 1883 [ACK] Seq=1 Ack=1 Win=42340 Len=0;
30;Jan 13, 2022 17:59:02.010941354 CET;192.168.1.102;192.168.1.101;53316;1883;108;Connect Command;
31;Jan 13, 2022 17:59:02.228534427 CET;192.168.1.102;192.168.1.101;53316;1883;108;[TCP Retransmission] 53316 → 1883 [PSH, ACK] Seq=1 Ack=1 Win=42340 Len=54;
32;Jan 13, 2022 17:59:02.234859802 CET;192.168.1.101;192.168.1.102;1883;53316;54;1883 → 53316 [ACK] Seq=1 Ack=55 Win=8192 Len=0;
33;Jan 13, 2022 17:59:02.238520028 CET;192.168.1.101;192.168.1.102;1883;53316;58;Connect Ack;
34;Jan 13, 2022 17:59:02.238541851 CET;192.168.1.102;192.168.1.101;53316;1883;54;53316 → 1883 [ACK] Seq=55 Ack=5 Win=42336 Len=0;
35;Jan 13, 2022 17:59:02.238621766 CET;192.168.1.102;192.168.1.101;53316;1883;73;Publish Message [topic];message003
36;Jan 13, 2022 17:59:02.238647056 CET;192.168.1.102;192.168.1.101;53316;1883;56;Disconnect Req;
37;Jan 13, 2022 17:59:02.700636120 CET;192.168.1.102;192.168.1.101;53316;1883;75;[TCP Retransmission] 53316 → 1883 [FIN, PSH, ACK] Seq=55 Ack=5 Win=42336 Len=21;
38;Jan 13, 2022 17:59:02.719039289 CET;192.168.1.101;192.168.1.102;1883;53316;54;1883 → 53316 [FIN, ACK] Seq=5 Ack=77 Win=8192 Len=0;
39;Jan 13, 2022 17:59:02.719082061 CET;192.168.1.102;192.168.1.101;53316;1883;54;53316 → 1883 [ACK] Seq=77 Ack=6 Win=42335 Len=0;
40;Jan 13, 2022 17:59:12.252279239 CET;192.168.1.102;192.168.1.101;53318;1883;74;53318 → 1883 [SYN] Seq=0 Win=42340 Len=0 MSS=1460 SACK_PERM=1 TSval=3420266143 TSecr=0 WS=512;
41;Jan 13, 2022 17:59:12.266154397 CET;192.168.1.101;192.168.1.102;1883;53318;58;1883 → 53318 [SYN, ACK] Seq=0 Ack=1 Win=8192 Len=0 MSS=1460;
42;Jan 13, 2022 17:59:12.266192177 CET;192.168.1.102;192.168.1.101;53318;1883;54;53318 → 1883 [ACK] Seq=1 Ack=1 Win=42340 Len=0;
43;Jan 13, 2022 17:59:12.266274149 CET;192.168.1.102;192.168.1.101;53318;1883;108;Connect Command;
44;Jan 13, 2022 17:59:12.484531318 CET;192.168.1.102;192.168.1.101;53318;1883;108;[TCP Retransmission] 53318 → 1883 [PSH, ACK] Seq=1 Ack=1 Win=42340 Len=54;
45;Jan 13, 2022 17:59:12.488022258 CET;192.168.1.101;192.168.1.102;1883;53318;54;1883 → 53318 [ACK] Seq=1 Ack=55 Win=8192 Len=0;
46;Jan 13, 2022 17:59:12.491911895 CET;192.168.1.101;192.168.1.102;1883;53318;58;Connect Ack;
47;Jan 13, 2022 17:59:12.491934922 CET;192.168.1.102;192.168.1.101;53318;1883;54;53318 → 1883 [ACK] Seq=55 Ack=5 Win=42336 Len=0;
48;Jan 13, 2022 17:59:12.492004363 CET;192.168.1.102;192.168.1.101;53318;1883;73;Publish Message [topic];message004
49;Jan 13, 2022 17:59:12.492024022 CET;192.168.1.102;192.168.1.101;53318;1883;56;Disconnect Req;
50;Jan 13, 2022 17:59:12.940775217 CET;192.168.1.102;192.168.1.101;53318;1883;75;[TCP Retransmission] 53318 → 1883 [FIN, PSH, ACK] Seq=55 Ack=5 Win=42336 Len=21;
51;Jan 13, 2022 17:59:12.944156623 CET;192.168.1.101;192.168.1.102;1883;53318;54;1883 → 53318 [FIN, ACK] Seq=5 Ack=77 Win=8192 Len=0;
52;Jan 13, 2022 17:59:12.944175640 CET;192.168.1.102;192.168.1.101;53318;1883;54;53318 → 1883 [ACK] Seq=77 Ack=6 Win=42335 Len=0;
53;Jan 13, 2022 17:59:22.505872345 CET;192.168.1.102;192.168.1.101;53320;1883;74;53320 → 1883 [SYN] Seq=0 Win=42340 Len=0 MSS=1460 SACK_PERM=1 TSval=3420276396 TSecr=0 WS=512;
54;Jan 13, 2022 17:59:22.517963414 CET;192.168.1.101;192.168.1.102;1883;53320;58;1883 → 53320 [SYN, ACK] Seq=0 Ack=1 Win=8192 Len=0 MSS=1460;
55;Jan 13, 2022 17:59:22.518006808 CET;192.168.1.102;192.168.1.101;53320;1883;54;53320 → 1883 [ACK] Seq=1 Ack=1 Win=42340 Len=0;
56;Jan 13, 2022 17:59:22.518091928 CET;192.168.1.102;192.168.1.101;53320;1883;108;Connect Command;
57;Jan 13, 2022 17:59:22.736738766 CET;192.168.1.102;192.168.1.101;53320;1883;108;[TCP Retransmission] 53320 → 1883 [PSH, ACK] Seq=1 Ack=1 Win=42340 Len=54;
58;Jan 13, 2022 17:59:22.744289788 CET;192.168.1.101;192.168.1.102;1883;53320;54;1883 → 53320 [ACK] Seq=1 Ack=55 Win=8192 Len=0;
59;Jan 13, 2022 17:59:22.748982204 CET;192.168.1.101;192.168.1.102;1883;53320;58;Connect Ack;
60;Jan 13, 2022 17:59:22.749004036 CET;192.168.1.102;192.168.1.101;53320;1883;54;53320 → 1883 [ACK] Seq=55 Ack=5 Win=42336 Len=0;
61;Jan 13, 2022 17:59:22.749081773 CET;192.168.1.102;192.168.1.101;53320;1883;73;Publish Message [topic];message005
62;Jan 13, 2022 17:59:22.749111721 CET;192.168.1.102;192.168.1.101;53320;1883;56;Disconnect Req;
63;Jan 13, 2022 17:59:23.212609143 CET;192.168.1.102;192.168.1.101;53320;1883;75;[TCP Retransmission] 53320 → 1883 [FIN, PSH, ACK] Seq=55 Ack=5 Win=42336 Len=21;
64;Jan 13, 2022 17:59:23.235002878 CET;192.168.1.101;192.168.1.102;1883;53320;54;1883 → 53320 [FIN, ACK] Seq=5 Ack=77 Win=8192 Len=0;
65;Jan 13, 2022 17:59:23.235050433 CET;192.168.1.102;192.168.1.101;53320;1883;54;53320 → 1883 [ACK] Seq=77 Ack=6 Win=42335 Len=0;
66;Jan 13, 2022 17:59:32.755828997 CET;192.168.1.102;192.168.1.101;53322;1883;74;53322 → 1883 [SYN] Seq=0 Win=42340 Len=0 MSS=1460 SACK_PERM=1 TSval=3420286646 TSecr=0 WS=512;
67;Jan 13, 2022 17:59:32.760392597 CET;192.168.1.101;192.168.1.102;1883;53322;58;1883 → 53322 [SYN, ACK] Seq=0 Ack=1 Win=8192 Len=0 MSS=1460;
68;Jan 13, 2022 17:59:32.760422865 CET;192.168.1.102;192.168.1.101;53322;1883;54;53322 → 1883 [ACK] Seq=1 Ack=1 Win=42340 Len=0;
69;Jan 13, 2022 17:59:32.762023626 CET;192.168.1.102;192.168.1.101;53322;1883;108;Connect Command;
70;Jan 13, 2022 17:59:32.972535576 CET;192.168.1.102;192.168.1.101;53322;1883;108;[TCP Retransmission] 53322 → 1883 [PSH, ACK] Seq=1 Ack=1 Win=42340 Len=54;
71;Jan 13, 2022 17:59:32.979668771 CET;192.168.1.101;192.168.1.102;1883;53322;54;1883 → 53322 [ACK] Seq=1 Ack=55 Win=8192 Len=0;
72;Jan 13, 2022 17:59:32.984939290 CET;192.168.1.101;192.168.1.102;1883;53322;58;Connect Ack;
73;Jan 13, 2022 17:59:32.984952104 CET;192.168.1.102;192.168.1.101;53322;1883;54;53322 → 1883 [ACK] Seq=55 Ack=5 Win=42336 Len=0;
74;Jan 13, 2022 17:59:32.985019416 CET;192.168.1.102;192.168.1.101;53322;1883;73;Publish Message [topic];message006
75;Jan 13, 2022 17:59:32.985046469 CET;192.168.1.102;192.168.1.101;53322;1883;56;Disconnect Req;
76;Jan 13, 2022 17:59:33.420529963 CET;192.168.1.102;192.168.1.101;53322;1883;75;[TCP Retransmission] 53322 → 1883 [FIN, PSH, ACK] Seq=55 Ack=5 Win=42336 Len=21;
77;Jan 13, 2022 17:59:33.424364153 CET;192.168.1.101;192.168.1.102;1883;53322;54;1883 → 53322 [FIN, ACK] Seq=5 Ack=77 Win=8192 Len=0;
78;Jan 13, 2022 17:59:33.424388039 CET;192.168.1.102;192.168.1.101;53322;1883;54;53322 → 1883 [ACK] Seq=77 Ack=6 Win=42335 Len=0;
79;Jan 13, 2022 17:59:42.998073530 CET;192.168.1.102;192.168.1.101;53324;1883;74;53324 → 1883 [SYN] Seq=0 Win=42340 Len=0 MSS=1460 SACK_PERM=1 TSval=3420296889 TSecr=0 WS=512;
80;Jan 13, 2022 17:59:43.012276812 CET;192.168.1.101;192.168.1.102;1883;53324;58;1883 → 53324 [SYN, ACK] Seq=0 Ack=1 Win=8192 Len=0 MSS=1460;
81;Jan 13, 2022 17:59:43.012307597 CET;192.168.1.102;192.168.1.101;53324;1883;54;53324 → 1883 [ACK] Seq=1 Ack=1 Win=42340 Len=0;
82;Jan 13, 2022 17:59:43.012377336 CET;192.168.1.102;192.168.1.101;53324;1883;108;Connect Command;
83;Jan 13, 2022 17:59:43.228531957 CET;192.168.1.102;192.168.1.101;53324;1883;108;[TCP Retransmission] 53324 → 1883 [PSH, ACK] Seq=1 Ack=1 Win=42340 Len=54;
84;Jan 13, 2022 17:59:43.234647005 CET;192.168.1.101;192.168.1.102;1883;53324;54;1883 → 53324 [ACK] Seq=1 Ack=55 Win=8192 Len=0;
85;Jan 13, 2022 17:59:43.238319223 CET;192.168.1.101;192.168.1.102;1883;53324;58;Connect Ack;
86;Jan 13, 2022 17:59:43.238340993 CET;192.168.1.102;192.168.1.101;53324;1883;54;53324 → 1883 [ACK] Seq=55 Ack=5 Win=42336 Len=0;
87;Jan 13, 2022 17:59:43.238420822 CET;192.168.1.102;192.168.1.101;53324;1883;73;Publish Message [topic];message007
88;Jan 13, 2022 17:59:43.238447087 CET;192.168.1.102;192.168.1.101;53324;1883;56;Disconnect Req;
89;Jan 13, 2022 17:59:43.692642687 CET;192.168.1.102;192.168.1.101;53324;1883;75;[TCP Retransmission] 53324 → 1883 [FIN, PSH, ACK] Seq=55 Ack=5 Win=42336 Len=21;
90;Jan 13, 2022 17:59:43.711901341 CET;192.168.1.101;192.168.1.102;1883;53324;54;1883 → 53324 [FIN, ACK] Seq=5 Ack=77 Win=8192 Len=0;
91;Jan 13, 2022 17:59:43.711943056 CET;192.168.1.102;192.168.1.101;53324;1883;54;53324 → 1883 [ACK] Seq=77 Ack=6 Win=42335 Len=0;
92;Jan 13, 2022 17:59:53.249359156 CET;192.168.1.102;192.168.1.101;53326;1883;74;53326 → 1883 [SYN] Seq=0 Win=42340 Len=0 MSS=1460 SACK_PERM=1 TSval=3420307140 TSecr=0 WS=512;
93;Jan 13, 2022 17:59:53.255010091 CET;192.168.1.101;192.168.1.102;1883;53326;58;1883 → 53326 [SYN, ACK] Seq=0 Ack=1 Win=8192 Len=0 MSS=1460;
94;Jan 13, 2022 17:59:53.255082288 CET;192.168.1.102;192.168.1.101;53326;1883;54;53326 → 1883 [ACK] Seq=1 Ack=1 Win=42340 Len=0;
95;Jan 13, 2022 17:59:53.255159764 CET;192.168.1.102;192.168.1.101;53326;1883;108;Connect Command;
96;Jan 13, 2022 17:59:53.464721051 CET;192.168.1.102;192.168.1.101;53326;1883;108;[TCP Retransmission] 53326 → 1883 [PSH, ACK] Seq=1 Ack=1 Win=42340 Len=54;
97;Jan 13, 2022 17:59:53.473044159 CET;192.168.1.101;192.168.1.102;1883;53326;54;1883 → 53326 [ACK] Seq=1 Ack=55 Win=8192 Len=0;
98;Jan 13, 2022 17:59:53.479148845 CET;192.168.1.101;192.168.1.102;1883;53326;58;Connect Ack;
99;Jan 13, 2022 17:59:53.479168202 CET;192.168.1.102;192.168.1.101;53326;1883;54;53326 → 1883 [ACK] Seq=55 Ack=5 Win=42336 Len=0;
100;Jan 13, 2022 17:59:53.479264727 CET;192.168.1.102;192.168.1.101;53326;1883;73;Publish Message [topic];message008
101;Jan 13, 2022 17:59:53.479291957 CET;192.168.1.102;192.168.1.101;53326;1883;56;Disconnect Req;
102;Jan 13, 2022 17:59:53.900605322 CET;192.168.1.102;192.168.1.101;53326;1883;75;[TCP Retransmission] 53326 → 1883 [FIN, PSH, ACK] Seq=55 Ack=5 Win=42336 Len=21;
103;Jan 13, 2022 17:59:53.923992247 CET;192.168.1.101;192.168.1.102;1883;53326;54;1883 → 53326 [FIN, ACK] Seq=5 Ack=77 Win=8192 Len=0;
104;Jan 13, 2022 17:59:53.924025355 CET;192.168.1.102;192.168.1.101;53326;1883;54;53326 → 1883 [ACK] Seq=77 Ack=6 Win=42335 Len=0;
105;Jan 13, 2022 18:00:03.491782962 CET;192.168.1.102;192.168.1.101;53328;1883;74;53328 → 1883 [SYN] Seq=0 Win=42340 Len=0 MSS=1460 SACK_PERM=1 TSval=3420317382 TSecr=0 WS=512;
106;Jan 13, 2022 18:00:03.504339964 CET;192.168.1.101;192.168.1.102;1883;53328;58;1883 → 53328 [SYN, ACK] Seq=0 Ack=1 Win=8192 Len=0 MSS=1460;
107;Jan 13, 2022 18:00:03.504387247 CET;192.168.1.102;192.168.1.101;53328;1883;54;53328 → 1883 [ACK] Seq=1 Ack=1 Win=42340 Len=0;
108;Jan 13, 2022 18:00:03.504475751 CET;192.168.1.102;192.168.1.101;53328;1883;108;Connect Command;
109;Jan 13, 2022 18:00:03.720685334 CET;192.168.1.102;192.168.1.101;53328;1883;108;[TCP Retransmission] 53328 → 1883 [PSH, ACK] Seq=1 Ack=1 Win=42340 Len=54;
110;Jan 13, 2022 18:00:03.727800766 CET;192.168.1.101;192.168.1.102;1883;53328;54;1883 → 53328 [ACK] Seq=1 Ack=55 Win=8192 Len=0;
111;Jan 13, 2022 18:00:03.731105382 CET;192.168.1.101;192.168.1.102;1883;53328;58;Connect Ack;
112;Jan 13, 2022 18:00:03.731124607 CET;192.168.1.102;192.168.1.101;53328;1883;54;53328 → 1883 [ACK] Seq=55 Ack=5 Win=42336 Len=0;
113;Jan 13, 2022 18:00:03.731195625 CET;192.168.1.102;192.168.1.101;53328;1883;73;Publish Message [topic];message009
114;Jan 13, 2022 18:00:03.731244963 CET;192.168.1.102;192.168.1.101;53328;1883;56;Disconnect Req;
115;Jan 13, 2022 18:00:04.172579929 CET;192.168.1.102;192.168.1.101;53328;1883;75;[TCP Retransmission] 53328 → 1883 [FIN, PSH, ACK] Seq=55 Ack=5 Win=42336 Len=21;
116;Jan 13, 2022 18:00:04.180959114 CET;192.168.1.101;192.168.1.102;1883;53328;54;1883 → 53328 [FIN, ACK] Seq=5 Ack=77 Win=8192 Len=0;
117;Jan 13, 2022 18:00:04.180988493 CET;192.168.1.102;192.168.1.101;53328;1883;54;53328 → 1883 [ACK] Seq=77 Ack=6 Win=42335 Len=0;
118;Jan 13, 2022 18:00:13.747688021 CET;192.168.1.102;192.168.1.101;53330;1883;74;53330 → 1883 [SYN] Seq=0 Win=42340 Len=0 MSS=1460 SACK_PERM=1 TSval=3420327638 TSecr=0 WS=512;
119;Jan 13, 2022 18:00:13.758405195 CET;192.168.1.101;192.168.1.102;1883;53330;58;1883 → 53330 [SYN, ACK] Seq=0 Ack=1 Win=8192 Len=0 MSS=1460;
120;Jan 13, 2022 18:00:13.758427584 CET;192.168.1.102;192.168.1.101;53330;1883;54;53330 → 1883 [ACK] Seq=1 Ack=1 Win=42340 Len=0;
121;Jan 13, 2022 18:00:13.758482551 CET;192.168.1.102;192.168.1.101;53330;1883;108;Connect Command;
122;Jan 13, 2022 18:00:13.972517070 CET;192.168.1.102;192.168.1.101;53330;1883;108;[TCP Retransmission] 53330 → 1883 [PSH, ACK] Seq=1 Ack=1 Win=42340 Len=54;
123;Jan 13, 2022 18:00:13.976019122 CET;192.168.1.101;192.168.1.102;1883;53330;54;1883 → 53330 [ACK] Seq=1 Ack=55 Win=8192 Len=0;
124;Jan 13, 2022 18:00:13.979822101 CET;192.168.1.101;192.168.1.102;1883;53330;58;Connect Ack;
125;Jan 13, 2022 18:00:13.979832540 CET;192.168.1.102;192.168.1.101;53330;1883;54;53330 → 1883 [ACK] Seq=55 Ack=5 Win=42336 Len=0;
126;Jan 13, 2022 18:00:13.979882586 CET;192.168.1.102;192.168.1.101;53330;1883;73;Publish Message [topic];message010
127;Jan 13, 2022 18:00:13.979903511 CET;192.168.1.102;192.168.1.101;53330;1883;56;Disconnect Req;
128;Jan 13, 2022 18:00:14.412523956 CET;192.168.1.102;192.168.1.101;53330;1883;75;[TCP Retransmission] 53330 → 1883 [FIN, PSH, ACK] Seq=55 Ack=5 Win=42336 Len=21;
129;Jan 13, 2022 18:00:14.416025907 CET;192.168.1.101;192.168.1.102;1883;53330;54;1883 → 53330 [FIN, ACK] Seq=5 Ack=77 Win=8192 Len=0;
130;Jan 13, 2022 18:00:14.416042248 CET;192.168.1.102;192.168.1.101;53330;1883;54;53330 → 1883 [ACK] Seq=77 Ack=6 Win=42335 Len=0;
131;Jan 13, 2022 18:00:23.992319429 CET;192.168.1.102;192.168.1.101;53332;1883;74;53332 → 1883 [SYN] Seq=0 Win=42340 Len=0 MSS=1460 SACK_PERM=1 TSval=3420337883 TSecr=0 WS=512;
132;Jan 13, 2022 18:00:24.003618594 CET;192.168.1.101;192.168.1.102;1883;53332;58;1883 → 53332 [SYN, ACK] Seq=0 Ack=1 Win=8192 Len=0 MSS=1460;
133;Jan 13, 2022 18:00:24.003665403 CET;192.168.1.102;192.168.1.101;53332;1883;54;53332 → 1883 [ACK] Seq=1 Ack=1 Win=42340 Len=0;
134;Jan 13, 2022 18:00:24.003753873 CET;192.168.1.102;192.168.1.101;53332;1883;108;Connect Command;
135;Jan 13, 2022 18:00:24.216571761 CET;192.168.1.102;192.168.1.101;53332;1883;108;[TCP Retransmission] 53332 → 1883 [PSH, ACK] Seq=1 Ack=1 Win=42340 Len=54;
136;Jan 13, 2022 18:00:24.230916513 CET;192.168.1.101;192.168.1.102;1883;53332;54;1883 → 53332 [ACK] Seq=1 Ack=55 Win=8192 Len=0;
137;Jan 13, 2022 18:00:24.234925771 CET;192.168.1.101;192.168.1.102;1883;53332;58;Connect Ack;
138;Jan 13, 2022 18:00:24.234942670 CET;192.168.1.102;192.168.1.101;53332;1883;54;53332 → 1883 [ACK] Seq=55 Ack=5 Win=42336 Len=0;
139;Jan 13, 2022 18:00:24.235004458 CET;192.168.1.102;192.168.1.101;53332;1883;73;Publish Message [topic];message011
140;Jan 13, 2022 18:00:24.235024558 CET;192.168.1.102;192.168.1.101;53332;1883;56;Disconnect Req;
141;Jan 13, 2022 18:00:24.685331594 CET;192.168.1.102;192.168.1.101;53332;1883;75;[TCP Retransmission] 53332 → 1883 [FIN, PSH, ACK] Seq=55 Ack=5 Win=42336 Len=21;
142;Jan 13, 2022 18:00:24.702752198 CET;192.168.1.101;192.168.1.102;1883;53332;54;1883 → 53332 [FIN, ACK] Seq=5 Ack=77 Win=8192 Len=0;
143;Jan 13, 2022 18:00:24.702782740 CET;192.168.1.102;192.168.1.101;53332;1883;54;53332 → 1883 [ACK] Seq=77 Ack=6 Win=42335 Len=0;
144;Jan 13, 2022 18:00:34.246154722 CET;192.168.1.102;192.168.1.101;53334;1883;74;53334 → 1883 [SYN] Seq=0 Win=42340 Len=0 MSS=1460 SACK_PERM=1 TSval=3420348137 TSecr=0 WS=512;
145;Jan 13, 2022 18:00:34.261965241 CET;192.168.1.101;192.168.1.102;1883;53334;58;1883 → 53334 [SYN, ACK] Seq=0 Ack=1 Win=8192 Len=0 MSS=1460;
146;Jan 13, 2022 18:00:34.262002885 CET;192.168.1.102;192.168.1.101;53334;1883;54;53334 → 1883 [ACK] Seq=1 Ack=1 Win=42340 Len=0;
147;Jan 13, 2022 18:00:34.262082671 CET;192.168.1.102;192.168.1.101;53334;1883;108;Connect Command;
148;Jan 13, 2022 18:00:34.480849302 CET;192.168.1.102;192.168.1.101;53334;1883;108;[TCP Retransmission] 53334 → 1883 [PSH, ACK] Seq=1 Ack=1 Win=42340 Len=54;
149;Jan 13, 2022 18:00:34.485454324 CET;192.168.1.101;192.168.1.102;1883;53334;54;1883 → 53334 [ACK] Seq=1 Ack=55 Win=8192 Len=0;
150;Jan 13, 2022 18:00:34.527047553 CET;192.168.1.101;192.168.1.102;1883;53334;58;Connect Ack;
151;Jan 13, 2022 18:00:34.527065254 CET;192.168.1.102;192.168.1.101;53334;1883;54;53334 → 1883 [ACK] Seq=55 Ack=5 Win=42336 Len=0;
152;Jan 13, 2022 18:00:34.527130610 CET;192.168.1.102;192.168.1.101;53334;1883;73;Publish Message [topic];message012
153;Jan 13, 2022 18:00:34.527154116 CET;192.168.1.102;192.168.1.101;53334;1883;56;Disconnect Req;
154;Jan 13, 2022 18:00:34.988662506 CET;192.168.1.102;192.168.1.101;53334;1883;75;[TCP Retransmission] 53334 → 1883 [FIN, PSH, ACK] Seq=55 Ack=5 Win=42336 Len=21;
155;Jan 13, 2022 18:00:34.995368006 CET;192.168.1.101;192.168.1.102;1883;53334;54;1883 → 53334 [FIN, ACK] Seq=5 Ack=77 Win=8192 Len=0;
156;Jan 13, 2022 18:00:34.995393023 CET;192.168.1.102;192.168.1.101;53334;1883;54;53334 → 1883 [ACK] Seq=77 Ack=6 Win=42335 Len=0;
157;Jan 13, 2022 18:00:44.532578718 CET;192.168.1.102;192.168.1.101;53336;1883;74;53336 → 1883 [SYN] Seq=0 Win=42340 Len=0 MSS=1460 SACK_PERM=1 TSval=3420358423 TSecr=0 WS=512;
158;Jan 13, 2022 18:00:44.542645088 CET;192.168.1.101;192.168.1.102;1883;53336;58;1883 → 53336 [SYN, ACK] Seq=0 Ack=1 Win=8192 Len=0 MSS=1460;
159;Jan 13, 2022 18:00:44.542669228 CET;192.168.1.102;192.168.1.101;53336;1883;54;53336 → 1883 [ACK] Seq=1 Ack=1 Win=42340 Len=0;
160;Jan 13, 2022 18:00:44.542720479 CET;192.168.1.102;192.168.1.101;53336;1883;108;Connect Command;
161;Jan 13, 2022 18:00:44.756526647 CET;192.168.1.102;192.168.1.101;53336;1883;108;[TCP Retransmission] 53336 → 1883 [PSH, ACK] Seq=1 Ack=1 Win=42340 Len=54;
162;Jan 13, 2022 18:00:44.763294689 CET;192.168.1.101;192.168.1.102;1883;53336;54;1883 → 53336 [ACK] Seq=1 Ack=55 Win=8192 Len=0;
163;Jan 13, 2022 18:00:44.765786503 CET;192.168.1.101;192.168.1.102;1883;53336;58;Connect Ack;
164;Jan 13, 2022 18:00:44.765803023 CET;192.168.1.102;192.168.1.101;53336;1883;54;53336 → 1883 [ACK] Seq=55 Ack=5 Win=42336 Len=0;
165;Jan 13, 2022 18:00:44.765865047 CET;192.168.1.102;192.168.1.101;53336;1883;73;Publish Message [topic];message013
166;Jan 13, 2022 18:00:44.765885641 CET;192.168.1.102;192.168.1.101;53336;1883;56;Disconnect Req;
167;Jan 13, 2022 18:00:45.196581865 CET;192.168.1.102;192.168.1.101;53336;1883;75;[TCP Retransmission] 53336 → 1883 [FIN, PSH, ACK] Seq=55 Ack=5 Win=42336 Len=21;
168;Jan 13, 2022 18:00:45.213909995 CET;192.168.1.101;192.168.1.102;1883;53336;54;1883 → 53336 [FIN, ACK] Seq=5 Ack=77 Win=8192 Len=0;
169;Jan 13, 2022 18:00:45.213952262 CET;192.168.1.102;192.168.1.101;53336;1883;54;53336 → 1883 [ACK] Seq=77 Ack=6 Win=42335 Len=0;
170;Jan 13, 2022 18:00:54.770600406 CET;192.168.1.102;192.168.1.101;53338;1883;74;53338 → 1883 [SYN] Seq=0 Win=42340 Len=0 MSS=1460 SACK_PERM=1 TSval=3420368661 TSecr=0 WS=512;
171;Jan 13, 2022 18:00:54.773864847 CET;192.168.1.101;192.168.1.102;1883;53338;58;1883 → 53338 [SYN, ACK] Seq=0 Ack=1 Win=8192 Len=0 MSS=1460;
172;Jan 13, 2022 18:00:54.773905348 CET;192.168.1.102;192.168.1.101;53338;1883;54;53338 → 1883 [ACK] Seq=1 Ack=1 Win=42340 Len=0;
173;Jan 13, 2022 18:00:54.774659373 CET;192.168.1.102;192.168.1.101;53338;1883;108;Connect Command;
174;Jan 13, 2022 18:00:54.980813150 CET;192.168.1.102;192.168.1.101;53338;1883;108;[TCP Retransmission] 53338 → 1883 [PSH, ACK] Seq=1 Ack=1 Win=42340 Len=54;
175;Jan 13, 2022 18:00:54.998566560 CET;192.168.1.101;192.168.1.102;1883;53338;54;1883 → 53338 [ACK] Seq=1 Ack=55 Win=8192 Len=0;
176;Jan 13, 2022 18:00:55.003853156 CET;192.168.1.101;192.168.1.102;1883;53338;58;Connect Ack;
177;Jan 13, 2022 18:00:55.003875325 CET;192.168.1.102;192.168.1.101;53338;1883;54;53338 → 1883 [ACK] Seq=55 Ack=5 Win=42336 Len=0;
178;Jan 13, 2022 18:00:55.003966729 CET;192.168.1.102;192.168.1.101;53338;1883;73;Publish Message [topic];message014
179;Jan 13, 2022 18:00:55.004002670 CET;192.168.1.102;192.168.1.101;53338;1883;56;Disconnect Req;
180;Jan 13, 2022 18:00:55.436540375 CET;192.168.1.102;192.168.1.101;53338;1883;75;[TCP Retransmission] 53338 → 1883 [FIN, PSH, ACK] Seq=55 Ack=5 Win=42336 Len=21;
181;Jan 13, 2022 18:00:55.440416552 CET;192.168.1.101;192.168.1.102;1883;53338;54;1883 → 53338 [FIN, ACK] Seq=5 Ack=77 Win=8192 Len=0;
182;Jan 13, 2022 18:00:55.440452913 CET;192.168.1.102;192.168.1.101;53338;1883;54;53338 → 1883 [ACK] Seq=77 Ack=6 Win=42335 Len=0;
183;Jan 13, 2022 18:01:05.019215042 CET;192.168.1.102;192.168.1.101;53340;1883;74;53340 → 1883 [SYN] Seq=0 Win=42340 Len=0 MSS=1460 SACK_PERM=1 TSval=3420378910 TSecr=0 WS=512;
184;Jan 13, 2022 18:01:05.029392313 CET;192.168.1.101;192.168.1.102;1883;53340;58;1883 → 53340 [SYN, ACK] Seq=0 Ack=1 Win=8192 Len=0 MSS=1460;
185;Jan 13, 2022 18:01:05.029433372 CET;192.168.1.102;192.168.1.101;53340;1883;54;53340 → 1883 [ACK] Seq=1 Ack=1 Win=42340 Len=0;
186;Jan 13, 2022 18:01:05.029562381 CET;192.168.1.102;192.168.1.101;53340;1883;108;Connect Command;
187;Jan 13, 2022 18:01:05.245314189 CET;192.168.1.102;192.168.1.101;53340;1883;108;[TCP Retransmission] 53340 → 1883 [PSH, ACK] Seq=1 Ack=1 Win=42340 Len=54;
188;Jan 13, 2022 18:01:05.249754875 CET;192.168.1.101;192.168.1.102;1883;53340;54;1883 → 53340 [ACK] Seq=1 Ack=55 Win=8192 Len=0;
189;Jan 13, 2022 18:01:05.252880673 CET;192.168.1.101;192.168.1.102;1883;53340;58;Connect Ack;
190;Jan 13, 2022 18:01:05.252909930 CET;192.168.1.102;192.168.1.101;53340;1883;54;53340 → 1883 [ACK] Seq=55 Ack=5 Win=42336 Len=0;
191;Jan 13, 2022 18:01:05.252963809 CET;192.168.1.102;192.168.1.101;53340;1883;73;Publish Message [topic];message015
192;Jan 13, 2022 18:01:05.252987656 CET;192.168.1.102;192.168.1.101;53340;1883;56;Disconnect Req;
193;Jan 13, 2022 18:01:05.708592446 CET;192.168.1.102;192.168.1.101;53340;1883;75;[TCP Retransmission] 53340 → 1883 [FIN, PSH, ACK] Seq=55 Ack=5 Win=42336 Len=21;
194;Jan 13, 2022 18:01:05.727844733 CET;192.168.1.101;192.168.1.102;1883;53340;54;1883 → 53340 [FIN, ACK] Seq=5 Ack=77 Win=8192 Len=0;
195;Jan 13, 2022 18:01:05.727893650 CET;192.168.1.102;192.168.1.101;53340;1883;54;53340 → 1883 [ACK] Seq=77 Ack=6 Win=42335 Len=0;
196;Jan 13, 2022 18:01:15.256801330 CET;192.168.1.102;192.168.1.101;53342;1883;74;53342 → 1883 [SYN] Seq=0 Win=42340 Len=0 MSS=1460 SACK_PERM=1 TSval=3420389147 TSecr=0 WS=512;
197;Jan 13, 2022 18:01:15.259427392 CET;192.168.1.101;192.168.1.102;1883;53342;58;1883 → 53342 [SYN, ACK] Seq=0 Ack=1 Win=8192 Len=0 MSS=1460;
198;Jan 13, 2022 18:01:15.259440035 CET;192.168.1.102;192.168.1.101;53342;1883;54;53342 → 1883 [ACK] Seq=1 Ack=1 Win=42340 Len=0;
199;Jan 13, 2022 18:01:15.260565178 CET;192.168.1.102;192.168.1.101;53342;1883;108;Connect Command;
200;Jan 13, 2022 18:01:15.468604115 CET;192.168.1.102;192.168.1.101;53342;1883;108;[TCP Retransmission] 53342 → 1883 [PSH, ACK] Seq=1 Ack=1 Win=42340 Len=54;
201;Jan 13, 2022 18:01:15.477150929 CET;192.168.1.101;192.168.1.102;1883;53342;54;1883 → 53342 [ACK] Seq=1 Ack=55 Win=8192 Len=0;
202;Jan 13, 2022 18:01:15.484677941 CET;192.168.1.101;192.168.1.102;1883;53342;58;Connect Ack;
203;Jan 13, 2022 18:01:15.484696923 CET;192.168.1.102;192.168.1.101;53342;1883;54;53342 → 1883 [ACK] Seq=55 Ack=5 Win=42336 Len=0;
204;Jan 13, 2022 18:01:15.484762071 CET;192.168.1.102;192.168.1.101;53342;1883;73;Publish Message [topic];message016
205;Jan 13, 2022 18:01:15.484788776 CET;192.168.1.102;192.168.1.101;53342;1883;56;Disconnect Req;
206;Jan 13, 2022 18:01:15.916651342 CET;192.168.1.102;192.168.1.101;53342;1883;75;[TCP Retransmission] 53342 → 1883 [FIN, PSH, ACK] Seq=55 Ack=5 Win=42336 Len=21;
207;Jan 13, 2022 18:01:15.920308583 CET;192.168.1.101;192.168.1.102;1883;53342;54;1883 → 53342 [FIN, ACK] Seq=5 Ack=77 Win=8192 Len=0;
208;Jan 13, 2022 18:01:15.920322144 CET;192.168.1.102;192.168.1.101;53342;1883;54;53342 → 1883 [ACK] Seq=77 Ack=6 Win=42335 Len=0;
209;Jan 13, 2022 18:01:25.490413912 CET;192.168.1.102;192.168.1.101;53344;1883;74;53344 → 1883 [SYN] Seq=0 Win=42340 Len=0 MSS=1460 SACK_PERM=1 TSval=3420399381 TSecr=0 WS=512;
210;Jan 13, 2022 18:01:25.495182474 CET;192.168.1.101;192.168.1.102;1883;53344;58;1883 → 53344 [SYN, ACK] Seq=0 Ack=1 Win=8192 Len=0 MSS=1460;
211;Jan 13, 2022 18:01:25.495204943 CET;192.168.1.102;192.168.1.101;53344;1883;54;53344 → 1883 [ACK] Seq=1 Ack=1 Win=42340 Len=0;
212;Jan 13, 2022 18:01:25.495286578 CET;192.168.1.102;192.168.1.101;53344;1883;108;Connect Command;
213;Jan 13, 2022 18:01:25.704589024 CET;192.168.1.102;192.168.1.101;53344;1883;108;[TCP Retransmission] 53344 → 1883 [PSH, ACK] Seq=1 Ack=1 Win=42340 Len=54;
214;Jan 13, 2022 18:01:25.722594592 CET;192.168.1.101;192.168.1.102;1883;53344;54;1883 → 53344 [ACK] Seq=1 Ack=55 Win=8192 Len=0;
215;Jan 13, 2022 18:01:25.730477243 CET;192.168.1.101;192.168.1.102;1883;53344;58;Connect Ack;
216;Jan 13, 2022 18:01:25.730499258 CET;192.168.1.102;192.168.1.101;53344;1883;54;53344 → 1883 [ACK] Seq=55 Ack=5 Win=42336 Len=0;
217;Jan 13, 2022 18:01:25.730581658 CET;192.168.1.102;192.168.1.101;53344;1883;73;Publish Message [topic];message017
218;Jan 13, 2022 18:01:25.730619024 CET;192.168.1.102;192.168.1.101;53344;1883;56;Disconnect Req;
219;Jan 13, 2022 18:01:26.156625127 CET;192.168.1.102;192.168.1.101;53344;1883;75;[TCP Retransmission] 53344 → 1883 [FIN, PSH, ACK] Seq=55 Ack=5 Win=42336 Len=21;
220;Jan 13, 2022 18:01:26.173969844 CET;192.168.1.101;192.168.1.102;1883;53344;54;1883 → 53344 [FIN, ACK] Seq=5 Ack=77 Win=8192 Len=0;
221;Jan 13, 2022 18:01:26.174010250 CET;192.168.1.102;192.168.1.101;53344;1883;54;53344 → 1883 [ACK] Seq=77 Ack=6 Win=42335 Len=0;
222;Jan 13, 2022 18:01:35.746620664 CET;192.168.1.102;192.168.1.101;53346;1883;74;53346 → 1883 [SYN] Seq=0 Win=42340 Len=0 MSS=1460 SACK_PERM=1 TSval=3420409637 TSecr=0 WS=512;
223;Jan 13, 2022 18:01:35.756427287 CET;192.168.1.101;192.168.1.102;1883;53346;58;1883 → 53346 [SYN, ACK] Seq=0 Ack=1 Win=8192 Len=0 MSS=1460;
224;Jan 13, 2022 18:01:35.756454382 CET;192.168.1.102;192.168.1.101;53346;1883;54;53346 → 1883 [ACK] Seq=1 Ack=1 Win=42340 Len=0;
225;Jan 13, 2022 18:01:35.756516682 CET;192.168.1.102;192.168.1.101;53346;1883;108;Connect Command;
226;Jan 13, 2022 18:01:35.968543823 CET;192.168.1.102;192.168.1.101;53346;1883;108;[TCP Retransmission] 53346 → 1883 [PSH, ACK] Seq=1 Ack=1 Win=42340 Len=54;
227;Jan 13, 2022 18:01:35.974548530 CET;192.168.1.101;192.168.1.102;1883;53346;54;1883 → 53346 [ACK] Seq=1 Ack=55 Win=8192 Len=0;
228;Jan 13, 2022 18:01:35.978822404 CET;192.168.1.101;192.168.1.102;1883;53346;58;Connect Ack;
229;Jan 13, 2022 18:01:35.978836373 CET;192.168.1.102;192.168.1.101;53346;1883;54;53346 → 1883 [ACK] Seq=55 Ack=5 Win=42336 Len=0;
230;Jan 13, 2022 18:01:35.978905389 CET;192.168.1.102;192.168.1.101;53346;1883;73;Publish Message [topic];message018
231;Jan 13, 2022 18:01:35.978933038 CET;192.168.1.102;192.168.1.101;53346;1883;56;Disconnect Req;
232;Jan 13, 2022 18:01:36.428588576 CET;192.168.1.102;192.168.1.101;53346;1883;75;[TCP Retransmission] 53346 → 1883 [FIN, PSH, ACK] Seq=55 Ack=5 Win=42336 Len=21;
233;Jan 13, 2022 18:01:36.446084465 CET;192.168.1.101;192.168.1.102;1883;53346;54;1883 → 53346 [FIN, ACK] Seq=5 Ack=77 Win=8192 Len=0;
234;Jan 13, 2022 18:01:36.446122731 CET;192.168.1.102;192.168.1.101;53346;1883;54;53346 → 1883 [ACK] Seq=77 Ack=6 Win=42335 Len=0;
235;Jan 13, 2022 18:01:45.992449149 CET;192.168.1.102;192.168.1.101;53348;1883;74;53348 → 1883 [SYN] Seq=0 Win=42340 Len=0 MSS=1460 SACK_PERM=1 TSval=3420419883 TSecr=0 WS=512;
236;Jan 13, 2022 18:01:46.004636468 CET;192.168.1.101;192.168.1.102;1883;53348;58;1883 → 53348 [SYN, ACK] Seq=0 Ack=1 Win=8192 Len=0 MSS=1460;
237;Jan 13, 2022 18:01:46.004725493 CET;192.168.1.102;192.168.1.101;53348;1883;54;53348 → 1883 [ACK] Seq=1 Ack=1 Win=42340 Len=0;
238;Jan 13, 2022 18:01:46.004834542 CET;192.168.1.102;192.168.1.101;53348;1883;108;Connect Command;
239;Jan 13, 2022 18:01:46.224555710 CET;192.168.1.102;192.168.1.101;53348;1883;108;[TCP Retransmission] 53348 → 1883 [PSH, ACK] Seq=1 Ack=1 Win=42340 Len=54;
240;Jan 13, 2022 18:01:46.227816995 CET;192.168.1.101;192.168.1.102;1883;53348;54;1883 → 53348 [ACK] Seq=1 Ack=55 Win=8192 Len=0;
241;Jan 13, 2022 18:01:46.231632943 CET;192.168.1.101;192.168.1.102;1883;53348;58;Connect Ack;
242;Jan 13, 2022 18:01:46.231653247 CET;192.168.1.102;192.168.1.101;53348;1883;54;53348 → 1883 [ACK] Seq=55 Ack=5 Win=42336 Len=0;
243;Jan 13, 2022 18:01:46.231719297 CET;192.168.1.102;192.168.1.101;53348;1883;73;Publish Message [topic];message019
244;Jan 13, 2022 18:01:46.231742101 CET;192.168.1.102;192.168.1.101;53348;1883;56;Disconnect Req;
245;Jan 13, 2022 18:01:46.668618460 CET;192.168.1.102;192.168.1.101;53348;1883;75;[TCP Retransmission] 53348 → 1883 [FIN, PSH, ACK] Seq=55 Ack=5 Win=42336 Len=21;
246;Jan 13, 2022 18:01:46.674687061 CET;192.168.1.101;192.168.1.102;1883;53348;54;1883 → 53348 [FIN, ACK] Seq=5 Ack=77 Win=8192 Len=0;
247;Jan 13, 2022 18:01:46.674708963 CET;192.168.1.102;192.168.1.101;53348;1883;54;53348 → 1883 [ACK] Seq=77 Ack=6 Win=42335 Len=0;
248;Jan 13, 2022 18:01:56.244447869 CET;192.168.1.102;192.168.1.101;53350;1883;74;53350 → 1883 [SYN] Seq=0 Win=42340 Len=0 MSS=1460 SACK_PERM=1 TSval=3420430135 TSecr=0 WS=512;
249;Jan 13, 2022 18:01:56.257983585 CET;192.168.1.101;192.168.1.102;1883;53350;58;1883 → 53350 [SYN, ACK] Seq=0 Ack=1 Win=8192 Len=0 MSS=1460;
250;Jan 13, 2022 18:01:56.258029778 CET;192.168.1.102;192.168.1.101;53350;1883;54;53350 → 1883 [ACK] Seq=1 Ack=1 Win=42340 Len=0;
251;Jan 13, 2022 18:01:56.258124248 CET;192.168.1.102;192.168.1.101;53350;1883;108;Connect Command;
252;Jan 13, 2022 18:01:56.476768432 CET;192.168.1.102;192.168.1.101;53350;1883;108;[TCP Retransmission] 53350 → 1883 [PSH, ACK] Seq=1 Ack=1 Win=42340 Len=54;
253;Jan 13, 2022 18:01:56.482172776 CET;192.168.1.101;192.168.1.102;1883;53350;54;1883 → 53350 [ACK] Seq=1 Ack=55 Win=8192 Len=0;
254;Jan 13, 2022 18:01:56.488881452 CET;192.168.1.101;192.168.1.102;1883;53350;58;Connect Ack;
255;Jan 13, 2022 18:01:56.488898623 CET;192.168.1.102;192.168.1.101;53350;1883;54;53350 → 1883 [ACK] Seq=55 Ack=5 Win=42336 Len=0;
256;Jan 13, 2022 18:01:56.488957004 CET;192.168.1.102;192.168.1.101;53350;1883;73;Publish Message [topic];message020
257;Jan 13, 2022 18:01:56.488980830 CET;192.168.1.102;192.168.1.101;53350;1883;56;Disconnect Req;
258;Jan 13, 2022 18:01:56.940547775 CET;192.168.1.102;192.168.1.101;53350;1883;75;[TCP Retransmission] 53350 → 1883 [FIN, PSH, ACK] Seq=55 Ack=5 Win=42336 Len=21;
259;Jan 13, 2022 18:01:56.944339560 CET;192.168.1.101;192.168.1.102;1883;53350;54;1883 → 53350 [FIN, ACK] Seq=5 Ack=77 Win=8192 Len=0;
260;Jan 13, 2022 18:01:56.944350717 CET;192.168.1.102;192.168.1.101;53350;1883;54;53350 → 1883 [ACK] Seq=77 Ack=6 Win=42335 Len=0;
261;Jan 13, 2022 18:02:06.502157464 CET;192.168.1.102;192.168.1.101;53352;1883;74;53352 → 1883 [SYN] Seq=0 Win=42340 Len=0 MSS=1460 SACK_PERM=1 TSval=3420440393 TSecr=0 WS=512;
262;Jan 13, 2022 18:02:06.515309237 CET;192.168.1.101;192.168.1.102;1883;53352;58;1883 → 53352 [SYN, ACK] Seq=0 Ack=1 Win=8192 Len=0 MSS=1460;
263;Jan 13, 2022 18:02:06.515357547 CET;192.168.1.102;192.168.1.101;53352;1883;54;53352 → 1883 [ACK] Seq=1 Ack=1 Win=42340 Len=0;
264;Jan 13, 2022 18:02:06.515452501 CET;192.168.1.102;192.168.1.101;53352;1883;108;Connect Command;
265;Jan 13, 2022 18:02:06.732523744 CET;192.168.1.102;192.168.1.101;53352;1883;108;[TCP Retransmission] 53352 → 1883 [PSH, ACK] Seq=1 Ack=1 Win=42340 Len=54;
266;Jan 13, 2022 18:02:06.739010039 CET;192.168.1.101;192.168.1.102;1883;53352;54;1883 → 53352 [ACK] Seq=1 Ack=55 Win=8192 Len=0;
267;Jan 13, 2022 18:02:06.741852360 CET;192.168.1.101;192.168.1.102;1883;53352;58;Connect Ack;
268;Jan 13, 2022 18:02:06.741871071 CET;192.168.1.102;192.168.1.101;53352;1883;54;53352 → 1883 [ACK] Seq=55 Ack=5 Win=42336 Len=0;
269;Jan 13, 2022 18:02:06.741940556 CET;192.168.1.102;192.168.1.101;53352;1883;73;Publish Message [topic];message021
270;Jan 13, 2022 18:02:06.741962991 CET;192.168.1.102;192.168.1.101;53352;1883;56;Disconnect Req;
271;Jan 13, 2022 18:02:07.180600707 CET;192.168.1.102;192.168.1.101;53352;1883;75;[TCP Retransmission] 53352 → 1883 [FIN, PSH, ACK] Seq=55 Ack=5 Win=42336 Len=21;
272;Jan 13, 2022 18:02:07.199042594 CET;192.168.1.101;192.168.1.102;1883;53352;54;1883 → 53352 [FIN, ACK] Seq=5 Ack=77 Win=8192 Len=0;
273;Jan 13, 2022 18:02:07.199084593 CET;192.168.1.102;192.168.1.101;53352;1883;54;53352 → 1883 [ACK] Seq=77 Ack=6 Win=42335 Len=0;
274;Jan 13, 2022 18:02:16.747055835 CET;192.168.1.102;192.168.1.101;53356;1883;74;53356 → 1883 [SYN] Seq=0 Win=42340 Len=0 MSS=1460 SACK_PERM=1 TSval=3420450638 TSecr=0 WS=512;
275;Jan 13, 2022 18:02:16.750434518 CET;192.168.1.101;192.168.1.102;1883;53356;58;1883 → 53356 [SYN, ACK] Seq=0 Ack=1 Win=8192 Len=0 MSS=1460;
276;Jan 13, 2022 18:02:16.750452527 CET;192.168.1.102;192.168.1.101;53356;1883;54;53356 → 1883 [ACK] Seq=1 Ack=1 Win=42340 Len=0;
277;Jan 13, 2022 18:02:16.752664739 CET;192.168.1.102;192.168.1.101;53356;1883;108;Connect Command;
278;Jan 13, 2022 18:02:16.758203889 CET;192.168.1.101;192.168.1.102;1883;53356;54;1883 → 53356 [ACK] Seq=1 Ack=55 Win=8192 Len=0;
279;Jan 13, 2022 18:02:16.761439020 CET;192.168.1.101;192.168.1.102;1883;53356;58;Connect Ack;
280;Jan 13, 2022 18:02:16.761456291 CET;192.168.1.102;192.168.1.101;53356;1883;54;53356 → 1883 [ACK] Seq=55 Ack=5 Win=42336 Len=0;
281;Jan 13, 2022 18:02:16.761514486 CET;192.168.1.102;192.168.1.101;53356;1883;73;Publish Message [topic];message022
282;Jan 13, 2022 18:02:16.761537314 CET;192.168.1.102;192.168.1.101;53356;1883;56;Disconnect Req;
283;Jan 13, 2022 18:02:16.969141383 CET;192.168.1.102;192.168.1.101;53356;1883;75;[TCP Retransmission] 53356 → 1883 [FIN, PSH, ACK] Seq=55 Ack=5 Win=42336 Len=21;
284;Jan 13, 2022 18:02:16.977121426 CET;192.168.1.101;192.168.1.102;1883;53356;54;1883 → 53356 [FIN, ACK] Seq=5 Ack=77 Win=8192 Len=0;
285;Jan 13, 2022 18:02:16.977149857 CET;192.168.1.102;192.168.1.101;53356;1883;54;53356 → 1883 [ACK] Seq=77 Ack=6 Win=42335 Len=0;
286;Jan 13, 2022 18:02:26.768229565 CET;192.168.1.102;192.168.1.101;53358;1883;74;53358 → 1883 [SYN] Seq=0 Win=42340 Len=0 MSS=1460 SACK_PERM=1 TSval=3420460659 TSecr=0 WS=512;
287;Jan 13, 2022 18:02:26.776465559 CET;192.168.1.101;192.168.1.102;1883;53358;58;1883 → 53358 [SYN, ACK] Seq=0 Ack=1 Win=8192 Len=0 MSS=1460;
288;Jan 13, 2022 18:02:26.776508128 CET;192.168.1.102;192.168.1.101;53358;1883;54;53358 → 1883 [ACK] Seq=1 Ack=1 Win=42340 Len=0;
289;Jan 13, 2022 18:02:26.776677650 CET;192.168.1.102;192.168.1.101;53358;1883;108;Connect Command;
290;Jan 13, 2022 18:02:26.992529608 CET;192.168.1.102;192.168.1.101;53358;1883;108;[TCP Retransmission] 53358 → 1883 [PSH, ACK] Seq=1 Ack=1 Win=42340 Len=54;
291;Jan 13, 2022 18:02:26.998159302 CET;192.168.1.101;192.168.1.102;1883;53358;54;1883 → 53358 [ACK] Seq=1 Ack=55 Win=8192 Len=0;
292;Jan 13, 2022 18:02:27.001617552 CET;192.168.1.101;192.168.1.102;1883;53358;58;Connect Ack;
293;Jan 13, 2022 18:02:27.001640577 CET;192.168.1.102;192.168.1.101;53358;1883;54;53358 → 1883 [ACK] Seq=55 Ack=5 Win=42336 Len=0;
294;Jan 13, 2022 18:02:27.001719422 CET;192.168.1.102;192.168.1.101;53358;1883;73;Publish Message [topic];message023
295;Jan 13, 2022 18:02:27.001746892 CET;192.168.1.102;192.168.1.101;53358;1883;56;Disconnect Req;
296;Jan 13, 2022 18:02:27.436819492 CET;192.168.1.102;192.168.1.101;53358;1883;75;[TCP Retransmission] 53358 → 1883 [FIN, PSH, ACK] Seq=55 Ack=5 Win=42336 Len=21;
297;Jan 13, 2022 18:02:27.450287036 CET;192.168.1.101;192.168.1.102;1883;53358;54;1883 → 53358 [FIN, ACK] Seq=5 Ack=77 Win=8192 Len=0;
298;Jan 13, 2022 18:02:27.450313686 CET;192.168.1.102;192.168.1.101;53358;1883;54;53358 → 1883 [ACK] Seq=77 Ack=6 Win=42335 Len=0;
299;Jan 13, 2022 18:02:37.007648064 CET;192.168.1.102;192.168.1.101;53360;1883;74;53360 → 1883 [SYN] Seq=0 Win=42340 Len=0 MSS=1460 SACK_PERM=1 TSval=3420470898 TSecr=0 WS=512;
300;Jan 13, 2022 18:02:37.011038670 CET;192.168.1.101;192.168.1.102;1883;53360;58;1883 → 53360 [SYN, ACK] Seq=0 Ack=1 Win=8192 Len=0 MSS=1460;
301;Jan 13, 2022 18:02:37.011069568 CET;192.168.1.102;192.168.1.101;53360;1883;54;53360 → 1883 [ACK] Seq=1 Ack=1 Win=42340 Len=0;
302;Jan 13, 2022 18:02:37.011854638 CET;192.168.1.102;192.168.1.101;53360;1883;108;Connect Command;
303;Jan 13, 2022 18:02:37.216605204 CET;192.168.1.102;192.168.1.101;53360;1883;108;[TCP Retransmission] 53360 → 1883 [PSH, ACK] Seq=1 Ack=1 Win=42340 Len=54;
304;Jan 13, 2022 18:02:37.242405604 CET;192.168.1.101;192.168.1.102;1883;53360;54;1883 → 53360 [ACK] Seq=1 Ack=55 Win=8192 Len=0;
305;Jan 13, 2022 18:02:37.248331007 CET;192.168.1.101;192.168.1.102;1883;53360;58;Connect Ack;
