1;Jan 13, 2022 19:18:16.649984539 CET;192.168.1.102;192.168.1.101;54322;1883;74;54322 → 1883 [SYN] Seq=0 Win=42340 Len=0 MSS=1460 SACK_PERM=1 TSval=3425010541 TSecr=0 WS=512;
2;Jan 13, 2022 19:18:16.663849245 CET;192.168.1.101;192.168.1.102;1883;54322;58;1883 → 54322 [SYN, ACK] Seq=0 Ack=1 Win=8192 Len=0 MSS=1460;
3;Jan 13, 2022 19:18:16.663867574 CET;192.168.1.102;192.168.1.101;54322;1883;54;54322 → 1883 [ACK] Seq=1 Ack=1 Win=42340 Len=0;
4;Jan 13, 2022 19:18:16.663945277 CET;192.168.1.102;192.168.1.101;54322;1883;108;Connect Command;
5;Jan 13, 2022 19:18:16.880523786 CET;192.168.1.102;192.168.1.101;54322;1883;108;[TCP Retransmission] 54322 → 1883 [PSH, ACK] Seq=1 Ack=1 Win=42340 Len=54;
6;Jan 13, 2022 19:18:16.886205569 CET;192.168.1.101;192.168.1.102;1883;54322;54;1883 → 54322 [ACK] Seq=1 Ack=55 Win=8192 Len=0;
7;Jan 13, 2022 19:18:16.889375089 CET;192.168.1.101;192.168.1.102;1883;54322;58;Connect Ack;
8;Jan 13, 2022 19:18:16.889392687 CET;192.168.1.102;192.168.1.101;54322;1883;54;54322 → 1883 [ACK] Seq=55 Ack=5 Win=42336 Len=0;
9;Jan 13, 2022 19:18:16.889457662 CET;192.168.1.102;192.168.1.101;54322;1883;73;Publish Message [topic];message001
10;Jan 13, 2022 19:18:16.889479583 CET;192.168.1.102;192.168.1.101;54322;1883;56;Disconnect Req;
11;Jan 13, 2022 19:18:17.325326703 CET;192.168.1.102;192.168.1.101;54322;1883;75;[TCP Retransmission] 54322 → 1883 [FIN, PSH, ACK] Seq=55 Ack=5 Win=42336 Len=21;
12;Jan 13, 2022 19:18:17.329557426 CET;192.168.1.101;192.168.1.102;1883;54322;54;1883 → 54322 [FIN, ACK] Seq=5 Ack=77 Win=8192 Len=0;
13;Jan 13, 2022 19:18:17.329606179 CET;192.168.1.102;192.168.1.101;54322;1883;54;54322 → 1883 [ACK] Seq=77 Ack=6 Win=42335 Len=0;
14;Jan 13, 2022 19:18:26.896029930 CET;192.168.1.102;192.168.1.101;54324;1883;74;54324 → 1883 [SYN] Seq=0 Win=42340 Len=0 MSS=1460 SACK_PERM=1 TSval=3425020787 TSecr=0 WS=512;
15;Jan 13, 2022 19:18:26.898886481 CET;192.168.1.101;192.168.1.102;1883;54324;58;1883 → 54324 [SYN, ACK] Seq=0 Ack=1 Win=8192 Len=0 MSS=1460;
16;Jan 13, 2022 19:18:26.898899628 CET;192.168.1.102;192.168.1.101;54324;1883;54;54324 → 1883 [ACK] Seq=1 Ack=1 Win=42340 Len=0;
17;Jan 13, 2022 19:18:26.901656995 CET;192.168.1.102;192.168.1.101;54324;1883;108;Connect Command;
18;Jan 13, 2022 19:18:26.905772529 CET;192.168.1.101;192.168.1.102;1883;54324;54;1883 → 54324 [ACK] Seq=1 Ack=55 Win=8192 Len=0;
19;Jan 13, 2022 19:18:26.908217448 CET;192.168.1.101;192.168.1.102;1883;54324;58;Connect Ack;
20;Jan 13, 2022 19:18:26.908226726 CET;192.168.1.102;192.168.1.101;54324;1883;54;54324 → 1883 [ACK] Seq=55 Ack=5 Win=42336 Len=0;
21;Jan 13, 2022 19:18:26.908276842 CET;192.168.1.102;192.168.1.101;54324;1883;73;Publish Message [topic];message002
22;Jan 13, 2022 19:18:26.908293974 CET;192.168.1.102;192.168.1.101;54324;1883;56;Disconnect Req;
23;Jan 13, 2022 19:18:27.112524361 CET;192.168.1.102;192.168.1.101;54324;1883;75;[TCP Retransmission] 54324 → 1883 [FIN, PSH, ACK] Seq=55 Ack=5 Win=42336 Len=21;
24;Jan 13, 2022 19:18:27.116031637 CET;192.168.1.101;192.168.1.102;1883;54324;54;1883 → 54324 [FIN, ACK] Seq=5 Ack=77 Win=8192 Len=0;
25;Jan 13, 2022 19:18:27.116043594 CET;192.168.1.102;192.168.1.101;54324;1883;54;54324 → 1883 [ACK] Seq=77 Ack=6 Win=42335 Len=0;
26;Jan 13, 2022 19:18:36.916163414 CET;192.168.1.102;192.168.1.101;54326;1883;74;54326 → 1883 [SYN] Seq=0 Win=42340 Len=0 MSS=1460 SACK_PERM=1 TSval=3425030807 TSecr=0 WS=512;
27;Jan 13, 2022 19:18:36.919897707 CET;192.168.1.101;192.168.1.102;1883;54326;58;1883 → 54326 [SYN, ACK] Seq=0 Ack=1 Win=8192 Len=0 MSS=1460;
28;Jan 13, 2022 19:18:36.919925043 CET;192.168.1.102;192.168.1.101;54326;1883;54;54326 → 1883 [ACK] Seq=1 Ack=1 Win=42340 Len=0;
29;Jan 13, 2022 19:18:36.921164092 CET;192.168.1.102;192.168.1.101;54326;1883;108;Connect Command;
30;Jan 13, 2022 19:18:37.128739009 CET;192.168.1.102;192.168.1.101;54326;1883;108;[TCP Retransmission] 54326 → 1883 [PSH, ACK] Seq=1 Ack=1 Win=42340 Len=54;
31;Jan 13, 2022 19:18:37.132075377 CET;192.168.1.101;192.168.1.102;1883;54326;54;1883 → 54326 [ACK] Seq=1 Ack=55 Win=8192 Len=0;
32;Jan 13, 2022 19:18:37.136021223 CET;192.168.1.101;192.168.1.102;1883;54326;58;Connect Ack;
33;Jan 13, 2022 19:18:37.136042354 CET;192.168.1.102;192.168.1.101;54326;1883;54;54326 → 1883 [ACK] Seq=55 Ack=5 Win=42336 Len=0;
34;Jan 13, 2022 19:18:37.136111423 CET;192.168.1.102;192.168.1.101;54326;1883;73;Publish Message [topic];message003
35;Jan 13, 2022 19:18:37.136131501 CET;192.168.1.102;192.168.1.101;54326;1883;56;Disconnect Req;
36;Jan 13, 2022 19:18:37.548563520 CET;192.168.1.102;192.168.1.101;54326;1883;75;[TCP Retransmission] 54326 → 1883 [FIN, PSH, ACK] Seq=55 Ack=5 Win=42336 Len=21;
37;Jan 13, 2022 19:18:37.569281847 CET;192.168.1.101;192.168.1.102;1883;54326;54;1883 → 54326 [FIN, ACK] Seq=5 Ack=77 Win=8192 Len=0;
38;Jan 13, 2022 19:18:37.569315753 CET;192.168.1.102;192.168.1.101;54326;1883;54;54326 → 1883 [ACK] Seq=77 Ack=6 Win=42335 Len=0;
39;Jan 13, 2022 19:18:47.150849744 CET;192.168.1.102;192.168.1.101;54328;1883;74;54328 → 1883 [SYN] Seq=0 Win=42340 Len=0 MSS=1460 SACK_PERM=1 TSval=3425041041 TSecr=0 WS=512;
40;Jan 13, 2022 19:18:47.163352513 CET;192.168.1.101;192.168.1.102;1883;54328;58;1883 → 54328 [SYN, ACK] Seq=0 Ack=1 Win=8192 Len=0 MSS=1460;
41;Jan 13, 2022 19:18:47.163381135 CET;192.168.1.102;192.168.1.101;54328;1883;54;54328 → 1883 [ACK] Seq=1 Ack=1 Win=42340 Len=0;
42;Jan 13, 2022 19:18:47.163437375 CET;192.168.1.102;192.168.1.101;54328;1883;108;Connect Command;
43;Jan 13, 2022 19:18:47.380524405 CET;192.168.1.102;192.168.1.101;54328;1883;108;[TCP Retransmission] 54328 → 1883 [PSH, ACK] Seq=1 Ack=1 Win=42340 Len=54;
44;Jan 13, 2022 19:18:47.383851857 CET;192.168.1.101;192.168.1.102;1883;54328;54;1883 → 54328 [ACK] Seq=1 Ack=55 Win=8192 Len=0;
45;Jan 13, 2022 19:18:47.387899849 CET;192.168.1.101;192.168.1.102;1883;54328;58;Connect Ack;
46;Jan 13, 2022 19:18:47.387920580 CET;192.168.1.102;192.168.1.101;54328;1883;54;54328 → 1883 [ACK] Seq=55 Ack=5 Win=42336 Len=0;
47;Jan 13, 2022 19:18:47.387980684 CET;192.168.1.102;192.168.1.101;54328;1883;73;Publish Message [topic];message004
48;Jan 13, 2022 19:18:47.388000307 CET;192.168.1.102;192.168.1.101;54328;1883;56;Disconnect Req;
49;Jan 13, 2022 19:18:47.820524153 CET;192.168.1.102;192.168.1.101;54328;1883;75;[TCP Retransmission] 54328 → 1883 [FIN, PSH, ACK] Seq=55 Ack=5 Win=42336 Len=21;
50;Jan 13, 2022 19:18:47.825541518 CET;192.168.1.101;192.168.1.102;1883;54328;54;1883 → 54328 [FIN, ACK] Seq=5 Ack=77 Win=8192 Len=0;
51;Jan 13, 2022 19:18:47.825561252 CET;192.168.1.102;192.168.1.101;54328;1883;54;54328 → 1883 [ACK] Seq=77 Ack=6 Win=42335 Len=0;
52;Jan 13, 2022 19:18:57.395353469 CET;192.168.1.102;192.168.1.101;54330;1883;74;54330 → 1883 [SYN] Seq=0 Win=42340 Len=0 MSS=1460 SACK_PERM=1 TSval=3425051286 TSecr=0 WS=512;
53;Jan 13, 2022 19:18:57.399873572 CET;192.168.1.101;192.168.1.102;1883;54330;58;1883 → 54330 [SYN, ACK] Seq=0 Ack=1 Win=8192 Len=0 MSS=1460;
54;Jan 13, 2022 19:18:57.399905434 CET;192.168.1.102;192.168.1.101;54330;1883;54;54330 → 1883 [ACK] Seq=1 Ack=1 Win=42340 Len=0;
55;Jan 13, 2022 19:18:57.400176878 CET;192.168.1.102;192.168.1.101;54330;1883;108;Connect Command;
56;Jan 13, 2022 19:18:57.608994486 CET;192.168.1.102;192.168.1.101;54330;1883;108;[TCP Retransmission] 54330 → 1883 [PSH, ACK] Seq=1 Ack=1 Win=42340 Len=54;
57;Jan 13, 2022 19:18:57.616988200 CET;192.168.1.101;192.168.1.102;1883;54330;54;1883 → 54330 [ACK] Seq=1 Ack=55 Win=8192 Len=0;
58;Jan 13, 2022 19:18:57.621323390 CET;192.168.1.101;192.168.1.102;1883;54330;58;Connect Ack;
59;Jan 13, 2022 19:18:57.621343731 CET;192.168.1.102;192.168.1.101;54330;1883;54;54330 → 1883 [ACK] Seq=55 Ack=5 Win=42336 Len=0;
60;Jan 13, 2022 19:18:57.621417175 CET;192.168.1.102;192.168.1.101;54330;1883;73;Publish Message [topic];message005
61;Jan 13, 2022 19:18:57.621446176 CET;192.168.1.102;192.168.1.101;54330;1883;56;Disconnect Req;
62;Jan 13, 2022 19:18:58.060536675 CET;192.168.1.102;192.168.1.101;54330;1883;75;[TCP Retransmission] 54330 → 1883 [FIN, PSH, ACK] Seq=55 Ack=5 Win=42336 Len=21;
63;Jan 13, 2022 19:18:58.067748139 CET;192.168.1.101;192.168.1.102;1883;54330;54;1883 → 54330 [FIN, ACK] Seq=5 Ack=77 Win=8192 Len=0;
64;Jan 13, 2022 19:18:58.067773345 CET;192.168.1.102;192.168.1.101;54330;1883;54;54330 → 1883 [ACK] Seq=77 Ack=6 Win=42335 Len=0;
65;Jan 13, 2022 19:19:07.626255444 CET;192.168.1.102;192.168.1.101;54332;1883;74;54332 → 1883 [SYN] Seq=0 Win=42340 Len=0 MSS=1460 SACK_PERM=1 TSval=3425061517 TSecr=0 WS=512;
66;Jan 13, 2022 19:19:07.629254803 CET;192.168.1.101;192.168.1.102;1883;54332;58;1883 → 54332 [SYN, ACK] Seq=0 Ack=1 Win=8192 Len=0 MSS=1460;
67;Jan 13, 2022 19:19:07.629268450 CET;192.168.1.102;192.168.1.101;54332;1883;54;54332 → 1883 [ACK] Seq=1 Ack=1 Win=42340 Len=0;
68;Jan 13, 2022 19:19:07.630975701 CET;192.168.1.102;192.168.1.101;54332;1883;108;Connect Command;
69;Jan 13, 2022 19:19:07.637076309 CET;192.168.1.101;192.168.1.102;1883;54332;54;1883 → 54332 [ACK] Seq=1 Ack=55 Win=8192 Len=0;
70;Jan 13, 2022 19:19:07.639628328 CET;192.168.1.101;192.168.1.102;1883;54332;58;Connect Ack;
71;Jan 13, 2022 19:19:07.639640205 CET;192.168.1.102;192.168.1.101;54332;1883;54;54332 → 1883 [ACK] Seq=55 Ack=5 Win=42336 Len=0;
72;Jan 13, 2022 19:19:07.639694215 CET;192.168.1.102;192.168.1.101;54332;1883;73;Publish Message [topic];message006
73;Jan 13, 2022 19:19:07.639712865 CET;192.168.1.102;192.168.1.101;54332;1883;56;Disconnect Req;
74;Jan 13, 2022 19:19:07.845007241 CET;192.168.1.102;192.168.1.101;54332;1883;75;[TCP Retransmission] 54332 → 1883 [FIN, PSH, ACK] Seq=55 Ack=5 Win=42336 Len=21;
75;Jan 13, 2022 19:19:07.864075078 CET;192.168.1.101;192.168.1.102;1883;54332;54;1883 → 54332 [FIN, ACK] Seq=5 Ack=77 Win=8192 Len=0;
76;Jan 13, 2022 19:19:07.864101169 CET;192.168.1.102;192.168.1.101;54332;1883;54;54332 → 1883 [ACK] Seq=77 Ack=6 Win=42335 Len=0;
77;Jan 13, 2022 19:19:17.643284055 CET;192.168.1.102;192.168.1.101;54334;1883;74;54334 → 1883 [SYN] Seq=0 Win=42340 Len=0 MSS=1460 SACK_PERM=1 TSval=3425071534 TSecr=0 WS=512;
78;Jan 13, 2022 19:19:17.645850224 CET;192.168.1.101;192.168.1.102;1883;54334;58;1883 → 54334 [SYN, ACK] Seq=0 Ack=1 Win=8192 Len=0 MSS=1460;
79;Jan 13, 2022 19:19:17.645861537 CET;192.168.1.102;192.168.1.101;54334;1883;54;54334 → 1883 [ACK] Seq=1 Ack=1 Win=42340 Len=0;
80;Jan 13, 2022 19:19:17.646923731 CET;192.168.1.102;192.168.1.101;54334;1883;108;Connect Command;
81;Jan 13, 2022 19:19:17.651725333 CET;192.168.1.101;192.168.1.102;1883;54334;54;1883 → 54334 [ACK] Seq=1 Ack=55 Win=8192 Len=0;
82;Jan 13, 2022 19:19:17.654773451 CET;192.168.1.101;192.168.1.102;1883;54334;58;Connect Ack;
83;Jan 13, 2022 19:19:17.654795104 CET;192.168.1.102;192.168.1.101;54334;1883;54;54334 → 1883 [ACK] Seq=55 Ack=5 Win=42336 Len=0;
84;Jan 13, 2022 19:19:17.654867455 CET;192.168.1.102;192.168.1.101;54334;1883;73;Publish Message [topic];message007
85;Jan 13, 2022 19:19:17.654887595 CET;192.168.1.102;192.168.1.101;54334;1883;56;Disconnect Req;
86;Jan 13, 2022 19:19:17.860659308 CET;192.168.1.102;192.168.1.101;54334;1883;75;[TCP Retransmission] 54334 → 1883 [FIN, PSH, ACK] Seq=55 Ack=5 Win=42336 Len=21;
87;Jan 13, 2022 19:19:17.864042834 CET;192.168.1.101;192.168.1.102;1883;54334;54;1883 → 54334 [FIN, ACK] Seq=5 Ack=77 Win=8192 Len=0;
88;Jan 13, 2022 19:19:17.864054870 CET;192.168.1.102;192.168.1.101;54334;1883;54;54334 → 1883 [ACK] Seq=77 Ack=6 Win=42335 Len=0;
89;Jan 13, 2022 19:19:27.667079067 CET;192.168.1.102;192.168.1.101;54336;1883;74;54336 → 1883 [SYN] Seq=0 Win=42340 Len=0 MSS=1460 SACK_PERM=1 TSval=3425081558 TSecr=0 WS=512;
90;Jan 13, 2022 19:19:27.678890535 CET;192.168.1.101;192.168.1.102;1883;54336;58;1883 → 54336 [SYN, ACK] Seq=0 Ack=1 Win=8192 Len=0 MSS=1460;
91;Jan 13, 2022 19:19:27.678935456 CET;192.168.1.102;192.168.1.101;54336;1883;54;54336 → 1883 [ACK] Seq=1 Ack=1 Win=42340 Len=0;
92;Jan 13, 2022 19:19:27.679019051 CET;192.168.1.102;192.168.1.101;54336;1883;108;Connect Command;
93;Jan 13, 2022 19:19:27.892639999 CET;192.168.1.102;192.168.1.101;54336;1883;108;[TCP Retransmission] 54336 → 1883 [PSH, ACK] Seq=1 Ack=1 Win=42340 Len=54;
94;Jan 13, 2022 19:19:27.912068239 CET;192.168.1.101;192.168.1.102;1883;54336;54;1883 → 54336 [ACK] Seq=1 Ack=55 Win=8192 Len=0;
95;Jan 13, 2022 19:19:27.920495234 CET;192.168.1.101;192.168.1.102;1883;54336;58;Connect Ack;
96;Jan 13, 2022 19:19:27.920566954 CET;192.168.1.102;192.168.1.101;54336;1883;54;54336 → 1883 [ACK] Seq=55 Ack=5 Win=42336 Len=0;
97;Jan 13, 2022 19:19:27.920661930 CET;192.168.1.102;192.168.1.101;54336;1883;73;Publish Message [topic];message008
98;Jan 13, 2022 19:19:27.920678474 CET;192.168.1.102;192.168.1.101;54336;1883;56;Disconnect Req;
99;Jan 13, 2022 19:19:28.364538415 CET;192.168.1.102;192.168.1.101;54336;1883;75;[TCP Retransmission] 54336 → 1883 [FIN, PSH, ACK] Seq=55 Ack=5 Win=42336 Len=21;
100;Jan 13, 2022 19:19:28.369557446 CET;192.168.1.101;192.168.1.102;1883;54336;54;1883 → 54336 [FIN, ACK] Seq=5 Ack=77 Win=8192 Len=0;
101;Jan 13, 2022 19:19:28.369571605 CET;192.168.1.102;192.168.1.101;54336;1883;54;54336 → 1883 [ACK] Seq=77 Ack=6 Win=42335 Len=0;
102;Jan 13, 2022 19:19:37.933620829 CET;192.168.1.102;192.168.1.101;54338;1883;74;54338 → 1883 [SYN] Seq=0 Win=42340 Len=0 MSS=1460 SACK_PERM=1 TSval=3425091824 TSecr=0 WS=512;
103;Jan 13, 2022 19:19:37.945835359 CET;192.168.1.101;192.168.1.102;1883;54338;58;1883 → 54338 [SYN, ACK] Seq=0 Ack=1 Win=8192 Len=0 MSS=1460;
104;Jan 13, 2022 19:19:37.945881637 CET;192.168.1.102;192.168.1.101;54338;1883;54;54338 → 1883 [ACK] Seq=1 Ack=1 Win=42340 Len=0;
105;Jan 13, 2022 19:19:37.945969196 CET;192.168.1.102;192.168.1.101;54338;1883;108;Connect Command;
106;Jan 13, 2022 19:19:38.164568085 CET;192.168.1.102;192.168.1.101;54338;1883;108;[TCP Retransmission] 54338 → 1883 [PSH, ACK] Seq=1 Ack=1 Win=42340 Len=54;
107;Jan 13, 2022 19:19:38.188267125 CET;192.168.1.101;192.168.1.102;1883;54338;54;1883 → 54338 [ACK] Seq=1 Ack=55 Win=8192 Len=0;
108;Jan 13, 2022 19:19:38.196254562 CET;192.168.1.101;192.168.1.102;1883;54338;58;Connect Ack;
109;Jan 13, 2022 19:19:38.196273811 CET;192.168.1.102;192.168.1.101;54338;1883;54;54338 → 1883 [ACK] Seq=55 Ack=5 Win=42336 Len=0;
110;Jan 13, 2022 19:19:38.196346901 CET;192.168.1.102;192.168.1.101;54338;1883;73;Publish Message [topic];message009
111;Jan 13, 2022 19:19:38.196377307 CET;192.168.1.102;192.168.1.101;54338;1883;56;Disconnect Req;
112;Jan 13, 2022 19:19:38.636548002 CET;192.168.1.102;192.168.1.101;54338;1883;75;[TCP Retransmission] 54338 → 1883 [FIN, PSH, ACK] Seq=55 Ack=5 Win=42336 Len=21;
113;Jan 13, 2022 19:19:38.649939421 CET;192.168.1.101;192.168.1.102;1883;54338;54;1883 → 54338 [FIN, ACK] Seq=5 Ack=77 Win=8192 Len=0;
114;Jan 13, 2022 19:19:38.649985036 CET;192.168.1.102;192.168.1.101;54338;1883;54;54338 → 1883 [ACK] Seq=77 Ack=6 Win=42335 Len=0;
115;Jan 13, 2022 19:19:48.202752358 CET;192.168.1.102;192.168.1.101;54340;1883;74;54340 → 1883 [SYN] Seq=0 Win=42340 Len=0 MSS=1460 SACK_PERM=1 TSval=3425102093 TSecr=0 WS=512;
116;Jan 13, 2022 19:19:48.206913673 CET;192.168.1.101;192.168.1.102;1883;54340;58;1883 → 54340 [SYN, ACK] Seq=0 Ack=1 Win=8192 Len=0 MSS=1460;
117;Jan 13, 2022 19:19:48.206934128 CET;192.168.1.102;192.168.1.101;54340;1883;54;54340 → 1883 [ACK] Seq=1 Ack=1 Win=42340 Len=0;
118;Jan 13, 2022 19:19:48.208408783 CET;192.168.1.102;192.168.1.101;54340;1883;108;Connect Command;
119;Jan 13, 2022 19:19:48.416526162 CET;192.168.1.102;192.168.1.101;54340;1883;108;[TCP Retransmission] 54340 → 1883 [PSH, ACK] Seq=1 Ack=1 Win=42340 Len=54;
120;Jan 13, 2022 19:19:48.422739488 CET;192.168.1.101;192.168.1.102;1883;54340;54;1883 → 54340 [ACK] Seq=1 Ack=55 Win=8192 Len=0;
121;Jan 13, 2022 19:19:48.425861352 CET;192.168.1.101;192.168.1.102;1883;54340;58;Connect Ack;
122;Jan 13, 2022 19:19:48.425877806 CET;192.168.1.102;192.168.1.101;54340;1883;54;54340 → 1883 [ACK] Seq=55 Ack=5 Win=42336 Len=0;
123;Jan 13, 2022 19:19:48.425934736 CET;192.168.1.102;192.168.1.101;54340;1883;73;Publish Message [topic];message010
124;Jan 13, 2022 19:19:48.425954097 CET;192.168.1.102;192.168.1.101;54340;1883;56;Disconnect Req;
125;Jan 13, 2022 19:19:48.844772184 CET;192.168.1.102;192.168.1.101;54340;1883;75;[TCP Retransmission] 54340 → 1883 [FIN, PSH, ACK] Seq=55 Ack=5 Win=42336 Len=21;
126;Jan 13, 2022 19:19:48.864425068 CET;192.168.1.101;192.168.1.102;1883;54340;54;1883 → 54340 [FIN, ACK] Seq=5 Ack=77 Win=8192 Len=0;
127;Jan 13, 2022 19:19:48.864475854 CET;192.168.1.102;192.168.1.101;54340;1883;54;54340 → 1883 [ACK] Seq=77 Ack=6 Win=42335 Len=0;
128;Jan 13, 2022 19:19:58.429820520 CET;192.168.1.102;192.168.1.101;54342;1883;74;54342 → 1883 [SYN] Seq=0 Win=42340 Len=0 MSS=1460 SACK_PERM=1 TSval=3425112320 TSecr=0 WS=512;
129;Jan 13, 2022 19:19:58.432519012 CET;192.168.1.101;192.168.1.102;1883;54342;58;1883 → 54342 [SYN, ACK] Seq=0 Ack=1 Win=8192 Len=0 MSS=1460;
130;Jan 13, 2022 19:19:58.432532062 CET;192.168.1.102;192.168.1.101;54342;1883;54;54342 → 1883 [ACK] Seq=1 Ack=1 Win=42340 Len=0;
131;Jan 13, 2022 19:19:58.433739710 CET;192.168.1.102;192.168.1.101;54342;1883;108;Connect Command;
132;Jan 13, 2022 19:19:58.439243992 CET;192.168.1.101;192.168.1.102;1883;54342;54;1883 → 54342 [ACK] Seq=1 Ack=55 Win=8192 Len=0;
133;Jan 13, 2022 19:19:58.444904497 CET;192.168.1.101;192.168.1.102;1883;54342;58;Connect Ack;
134;Jan 13, 2022 19:19:58.444920897 CET;192.168.1.102;192.168.1.101;54342;1883;54;54342 → 1883 [ACK] Seq=55 Ack=5 Win=42336 Len=0;
135;Jan 13, 2022 19:19:58.444978055 CET;192.168.1.102;192.168.1.101;54342;1883;73;Publish Message [topic];message011
136;Jan 13, 2022 19:19:58.444998431 CET;192.168.1.102;192.168.1.101;54342;1883;56;Disconnect Req;
137;Jan 13, 2022 19:19:58.653567107 CET;192.168.1.102;192.168.1.101;54342;1883;75;[TCP Retransmission] 54342 → 1883 [FIN, PSH, ACK] Seq=55 Ack=5 Win=42336 Len=21;
138;Jan 13, 2022 19:19:58.671198419 CET;192.168.1.101;192.168.1.102;1883;54342;54;1883 → 54342 [FIN, ACK] Seq=5 Ack=77 Win=8192 Len=0;
139;Jan 13, 2022 19:19:58.671235056 CET;192.168.1.102;192.168.1.101;54342;1883;54;54342 → 1883 [ACK] Seq=77 Ack=6 Win=42335 Len=0;
140;Jan 13, 2022 19:20:08.449078473 CET;192.168.1.102;192.168.1.101;54344;1883;74;54344 → 1883 [SYN] Seq=0 Win=42340 Len=0 MSS=1460 SACK_PERM=1 TSval=3425122340 TSecr=0 WS=512;
141;Jan 13, 2022 19:20:08.451960797 CET;192.168.1.101;192.168.1.102;1883;54344;58;1883 → 54344 [SYN, ACK] Seq=0 Ack=1 Win=8192 Len=0 MSS=1460;
142;Jan 13, 2022 19:20:08.451978996 CET;192.168.1.102;192.168.1.101;54344;1883;54;54344 → 1883 [ACK] Seq=1 Ack=1 Win=42340 Len=0;
143;Jan 13, 2022 19:20:08.452979107 CET;192.168.1.102;192.168.1.101;54344;1883;108;Connect Command;
144;Jan 13, 2022 19:20:08.661025944 CET;192.168.1.102;192.168.1.101;54344;1883;108;[TCP Retransmission] 54344 → 1883 [PSH, ACK] Seq=1 Ack=1 Win=42340 Len=54;
145;Jan 13, 2022 19:20:08.670892527 CET;192.168.1.101;192.168.1.102;1883;54344;54;1883 → 54344 [ACK] Seq=1 Ack=55 Win=8192 Len=0;
146;Jan 13, 2022 19:20:08.674058027 CET;192.168.1.101;192.168.1.102;1883;54344;58;Connect Ack;
147;Jan 13, 2022 19:20:08.674084834 CET;192.168.1.102;192.168.1.101;54344;1883;54;54344 → 1883 [ACK] Seq=55 Ack=5 Win=42336 Len=0;
148;Jan 13, 2022 19:20:08.674168269 CET;192.168.1.102;192.168.1.101;54344;1883;73;Publish Message [topic];message012
149;Jan 13, 2022 19:20:08.674194028 CET;192.168.1.102;192.168.1.101;54344;1883;56;Disconnect Req;
150;Jan 13, 2022 19:20:09.100629314 CET;192.168.1.102;192.168.1.101;54344;1883;75;[TCP Retransmission] 54344 → 1883 [FIN, PSH, ACK] Seq=55 Ack=5 Win=42336 Len=21;
151;Jan 13, 2022 19:20:09.173099306 CET;192.168.1.101;192.168.1.102;1883;54344;54;1883 → 54344 [FIN, ACK] Seq=5 Ack=77 Win=8192 Len=0;
152;Jan 13, 2022 19:20:09.173123160 CET;192.168.1.102;192.168.1.101;54344;1883;54;54344 → 1883 [ACK] Seq=77 Ack=6 Win=42335 Len=0;
153;Jan 13, 2022 19:20:18.686531748 CET;192.168.1.102;192.168.1.101;54346;1883;74;54346 → 1883 [SYN] Seq=0 Win=42340 Len=0 MSS=1460 SACK_PERM=1 TSval=3425132577 TSecr=0 WS=512;
154;Jan 13, 2022 19:20:18.702892840 CET;192.168.1.101;192.168.1.102;1883;54346;58;1883 → 54346 [SYN, ACK] Seq=0 Ack=1 Win=8192 Len=0 MSS=1460;
155;Jan 13, 2022 19:20:18.702911144 CET;192.168.1.102;192.168.1.101;54346;1883;54;54346 → 1883 [ACK] Seq=1 Ack=1 Win=42340 Len=0;
156;Jan 13, 2022 19:20:18.702966791 CET;192.168.1.102;192.168.1.101;54346;1883;108;Connect Command;
157;Jan 13, 2022 19:20:18.924865097 CET;192.168.1.102;192.168.1.101;54346;1883;108;[TCP Retransmission] 54346 → 1883 [PSH, ACK] Seq=1 Ack=1 Win=42340 Len=54;
158;Jan 13, 2022 19:20:18.929846348 CET;192.168.1.101;192.168.1.102;1883;54346;54;1883 → 54346 [ACK] Seq=1 Ack=55 Win=8192 Len=0;
159;Jan 13, 2022 19:20:18.934044044 CET;192.168.1.101;192.168.1.102;1883;54346;58;Connect Ack;
160;Jan 13, 2022 19:20:18.934061806 CET;192.168.1.102;192.168.1.101;54346;1883;54;54346 → 1883 [ACK] Seq=55 Ack=5 Win=42336 Len=0;
161;Jan 13, 2022 19:20:18.934127161 CET;192.168.1.102;192.168.1.101;54346;1883;73;Publish Message [topic];message013
162;Jan 13, 2022 19:20:18.934152065 CET;192.168.1.102;192.168.1.101;54346;1883;56;Disconnect Req;
163;Jan 13, 2022 19:20:19.404779123 CET;192.168.1.102;192.168.1.101;54346;1883;75;[TCP Retransmission] 54346 → 1883 [FIN, PSH, ACK] Seq=55 Ack=5 Win=42336 Len=21;
164;Jan 13, 2022 19:20:19.420620822 CET;192.168.1.101;192.168.1.102;1883;54346;54;1883 → 54346 [FIN, ACK] Seq=5 Ack=77 Win=8192 Len=0;
165;Jan 13, 2022 19:20:19.420654427 CET;192.168.1.102;192.168.1.101;54346;1883;54;54346 → 1883 [ACK] Seq=77 Ack=6 Win=42335 Len=0;
166;Jan 13, 2022 19:20:28.938115336 CET;192.168.1.102;192.168.1.101;54348;1883;74;54348 → 1883 [SYN] Seq=0 Win=42340 Len=0 MSS=1460 SACK_PERM=1 TSval=3425142829 TSecr=0 WS=512;
167;Jan 13, 2022 19:20:28.941239301 CET;192.168.1.101;192.168.1.102;1883;54348;58;1883 → 54348 [SYN, ACK] Seq=0 Ack=1 Win=8192 Len=0 MSS=1460;
168;Jan 13, 2022 19:20:28.941265275 CET;192.168.1.102;192.168.1.101;54348;1883;54;54348 → 1883 [ACK] Seq=1 Ack=1 Win=42340 Len=0;
169;Jan 13, 2022 19:20:28.942031696 CET;192.168.1.102;192.168.1.101;54348;1883;108;Connect Command;
170;Jan 13, 2022 19:20:29.149114757 CET;192.168.1.102;192.168.1.101;54348;1883;108;[TCP Retransmission] 54348 → 1883 [PSH, ACK] Seq=1 Ack=1 Win=42340 Len=54;
171;Jan 13, 2022 19:20:29.164741579 CET;192.168.1.101;192.168.1.102;1883;54348;54;1883 → 54348 [ACK] Seq=1 Ack=55 Win=8192 Len=0;
172;Jan 13, 2022 19:20:29.172070498 CET;192.168.1.101;192.168.1.102;1883;54348;58;Connect Ack;
173;Jan 13, 2022 19:20:29.172093312 CET;192.168.1.102;192.168.1.101;54348;1883;54;54348 → 1883 [ACK] Seq=55 Ack=5 Win=42336 Len=0;
174;Jan 13, 2022 19:20:29.172174920 CET;192.168.1.102;192.168.1.101;54348;1883;73;Publish Message [topic];message014
175;Jan 13, 2022 19:20:29.172211591 CET;192.168.1.102;192.168.1.101;54348;1883;56;Disconnect Req;
176;Jan 13, 2022 19:20:29.580612507 CET;192.168.1.102;192.168.1.101;54348;1883;75;[TCP Retransmission] 54348 → 1883 [FIN, PSH, ACK] Seq=55 Ack=5 Win=42336 Len=21;
177;Jan 13, 2022 19:20:29.583738121 CET;192.168.1.101;192.168.1.102;1883;54348;54;1883 → 54348 [FIN, ACK] Seq=5 Ack=77 Win=8192 Len=0;
178;Jan 13, 2022 19:20:29.583751399 CET;192.168.1.102;192.168.1.101;54348;1883;54;54348 → 1883 [ACK] Seq=77 Ack=6 Win=42335 Len=0;
179;Jan 13, 2022 19:20:39.178470970 CET;192.168.1.102;192.168.1.101;54350;1883;74;54350 → 1883 [SYN] Seq=0 Win=42340 Len=0 MSS=1460 SACK_PERM=1 TSval=3425153069 TSecr=0 WS=512;
180;Jan 13, 2022 19:20:39.183486898 CET;192.168.1.101;192.168.1.102;1883;54350;58;1883 → 54350 [SYN, ACK] Seq=0 Ack=1 Win=8192 Len=0 MSS=1460;
181;Jan 13, 2022 19:20:39.183509161 CET;192.168.1.102;192.168.1.101;54350;1883;54;54350 → 1883 [ACK] Seq=1 Ack=1 Win=42340 Len=0;
182;Jan 13, 2022 19:20:39.183559785 CET;192.168.1.102;192.168.1.101;54350;1883;108;Connect Command;
183;Jan 13, 2022 19:20:39.392724147 CET;192.168.1.102;192.168.1.101;54350;1883;108;[TCP Retransmission] 54350 → 1883 [PSH, ACK] Seq=1 Ack=1 Win=42340 Len=54;
184;Jan 13, 2022 19:20:39.401445689 CET;192.168.1.101;192.168.1.102;1883;54350;54;1883 → 54350 [ACK] Seq=1 Ack=55 Win=8192 Len=0;
185;Jan 13, 2022 19:20:39.405102525 CET;192.168.1.101;192.168.1.102;1883;54350;58;Connect Ack;
186;Jan 13, 2022 19:20:39.405119334 CET;192.168.1.102;192.168.1.101;54350;1883;54;54350 → 1883 [ACK] Seq=55 Ack=5 Win=42336 Len=0;
187;Jan 13, 2022 19:20:39.405182671 CET;192.168.1.102;192.168.1.101;54350;1883;73;Publish Message [topic];message015
188;Jan 13, 2022 19:20:39.405226418 CET;192.168.1.102;192.168.1.101;54350;1883;56;Disconnect Req;
189;Jan 13, 2022 19:20:39.852725151 CET;192.168.1.102;192.168.1.101;54350;1883;75;[TCP Retransmission] 54350 → 1883 [FIN, PSH, ACK] Seq=55 Ack=5 Win=42336 Len=21;
190;Jan 13, 2022 19:20:39.856375102 CET;192.168.1.101;192.168.1.102;1883;54350;54;1883 → 54350 [FIN, ACK] Seq=5 Ack=77 Win=8192 Len=0;
191;Jan 13, 2022 19:20:39.856392215 CET;192.168.1.102;192.168.1.101;54350;1883;54;54350 → 1883 [ACK] Seq=77 Ack=6 Win=42335 Len=0;
192;Jan 13, 2022 19:20:49.410210276 CET;192.168.1.102;192.168.1.101;54352;1883;74;54352 → 1883 [SYN] Seq=0 Win=42340 Len=0 MSS=1460 SACK_PERM=1 TSval=3425163301 TSecr=0 WS=512;
193;Jan 13, 2022 19:20:49.414671036 CET;192.168.1.101;192.168.1.102;1883;54352;58;1883 → 54352 [SYN, ACK] Seq=0 Ack=1 Win=8192 Len=0 MSS=1460;
194;Jan 13, 2022 19:20:49.414685643 CET;192.168.1.102;192.168.1.101;54352;1883;54;54352 → 1883 [ACK] Seq=1 Ack=1 Win=42340 Len=0;
195;Jan 13, 2022 19:20:49.415268754 CET;192.168.1.102;192.168.1.101;54352;1883;108;Connect Command;
196;Jan 13, 2022 19:20:49.624581996 CET;192.168.1.102;192.168.1.101;54352;1883;108;[TCP Retransmission] 54352 → 1883 [PSH, ACK] Seq=1 Ack=1 Win=42340 Len=54;
197;Jan 13, 2022 19:20:49.640863532 CET;192.168.1.101;192.168.1.102;1883;54352;54;1883 → 54352 [ACK] Seq=1 Ack=55 Win=8192 Len=0;
198;Jan 13, 2022 19:20:49.646333189 CET;192.168.1.101;192.168.1.102;1883;54352;58;Connect Ack;
199;Jan 13, 2022 19:20:49.646349487 CET;192.168.1.102;192.168.1.101;54352;1883;54;54352 → 1883 [ACK] Seq=55 Ack=5 Win=42336 Len=0;
200;Jan 13, 2022 19:20:49.646431405 CET;192.168.1.102;192.168.1.101;54352;1883;73;Publish Message [topic];message016
201;Jan 13, 2022 19:20:49.646466279 CET;192.168.1.102;192.168.1.101;54352;1883;56;Disconnect Req;
202;Jan 13, 2022 19:20:50.093165427 CET;192.168.1.102;192.168.1.101;54352;1883;75;[TCP Retransmission] 54352 → 1883 [FIN, PSH, ACK] Seq=55 Ack=5 Win=42336 Len=21;
203;Jan 13, 2022 19:20:50.101326487 CET;192.168.1.101;192.168.1.102;1883;54352;54;1883 → 54352 [FIN, ACK] Seq=5 Ack=77 Win=8192 Len=0;
204;Jan 13, 2022 19:20:50.101345555 CET;192.168.1.102;192.168.1.101;54352;1883;54;54352 → 1883 [ACK] Seq=77 Ack=6 Win=42335 Len=0;
205;Jan 13, 2022 19:20:59.654489785 CET;192.168.1.102;192.168.1.101;54354;1883;74;54354 → 1883 [SYN] Seq=0 Win=42340 Len=0 MSS=1460 SACK_PERM=1 TSval=3425173545 TSecr=0 WS=512;
206;Jan 13, 2022 19:20:59.657900970 CET;192.168.1.101;192.168.1.102;1883;54354;58;1883 → 54354 [SYN, ACK] Seq=0 Ack=1 Win=8192 Len=0 MSS=1460;
207;Jan 13, 2022 19:20:59.657943622 CET;192.168.1.102;192.168.1.101;54354;1883;54;54354 → 1883 [ACK] Seq=1 Ack=1 Win=42340 Len=0;
208;Jan 13, 2022 19:20:59.658099470 CET;192.168.1.102;192.168.1.101;54354;1883;108;Connect Command;
209;Jan 13, 2022 19:20:59.865642263 CET;192.168.1.102;192.168.1.101;54354;1883;108;[TCP Retransmission] 54354 → 1883 [PSH, ACK] Seq=1 Ack=1 Win=42340 Len=54;
210;Jan 13, 2022 19:20:59.884386287 CET;192.168.1.101;192.168.1.102;1883;54354;54;1883 → 54354 [ACK] Seq=1 Ack=55 Win=8192 Len=0;
211;Jan 13, 2022 19:20:59.892122181 CET;192.168.1.101;192.168.1.102;1883;54354;58;Connect Ack;
212;Jan 13, 2022 19:20:59.892142375 CET;192.168.1.102;192.168.1.101;54354;1883;54;54354 → 1883 [ACK] Seq=55 Ack=5 Win=42336 Len=0;
213;Jan 13, 2022 19:20:59.892221949 CET;192.168.1.102;192.168.1.101;54354;1883;73;Publish Message [topic];message017
214;Jan 13, 2022 19:20:59.892257076 CET;192.168.1.102;192.168.1.101;54354;1883;56;Disconnect Req;
215;Jan 13, 2022 19:21:00.300527811 CET;192.168.1.102;192.168.1.101;54354;1883;75;[TCP Retransmission] 54354 → 1883 [FIN, PSH, ACK] Seq=55 Ack=5 Win=42336 Len=21;
216;Jan 13, 2022 19:21:00.303634011 CET;192.168.1.101;192.168.1.102;1883;54354;54;1883 → 54354 [FIN, ACK] Seq=5 Ack=77 Win=8192 Len=0;
217;Jan 13, 2022 19:21:00.303648748 CET;192.168.1.102;192.168.1.101;54354;1883;54;54354 → 1883 [ACK] Seq=77 Ack=6 Win=42335 Len=0;
218;Jan 13, 2022 19:21:09.900175025 CET;192.168.1.102;192.168.1.101;54356;1883;74;54356 → 1883 [SYN] Seq=0 Win=42340 Len=0 MSS=1460 SACK_PERM=1 TSval=3425183791 TSecr=0 WS=512;
219;Jan 13, 2022 19:21:09.904838550 CET;192.168.1.101;192.168.1.102;1883;54356;58;1883 → 54356 [SYN, ACK] Seq=0 Ack=1 Win=8192 Len=0 MSS=1460;
220;Jan 13, 2022 19:21:09.904869843 CET;192.168.1.102;192.168.1.101;54356;1883;54;54356 → 1883 [ACK] Seq=1 Ack=1 Win=42340 Len=0;
221;Jan 13, 2022 19:21:09.905152732 CET;192.168.1.102;192.168.1.101;54356;1883;108;Connect Command;
222;Jan 13, 2022 19:21:10.117031818 CET;192.168.1.102;192.168.1.101;54356;1883;108;[TCP Retransmission] 54356 → 1883 [PSH, ACK] Seq=1 Ack=1 Win=42340 Len=54;
223;Jan 13, 2022 19:21:10.122209942 CET;192.168.1.101;192.168.1.102;1883;54356;54;1883 → 54356 [ACK] Seq=1 Ack=55 Win=8192 Len=0;
224;Jan 13, 2022 19:21:10.126484037 CET;192.168.1.101;192.168.1.102;1883;54356;58;Connect Ack;
225;Jan 13, 2022 19:21:10.126495977 CET;192.168.1.102;192.168.1.101;54356;1883;54;54356 → 1883 [ACK] Seq=55 Ack=5 Win=42336 Len=0;
226;Jan 13, 2022 19:21:10.126553895 CET;192.168.1.102;192.168.1.101;54356;1883;73;Publish Message [topic];message018
227;Jan 13, 2022 19:21:10.126600197 CET;192.168.1.102;192.168.1.101;54356;1883;56;Disconnect Req;
228;Jan 13, 2022 19:21:10.572579972 CET;192.168.1.102;192.168.1.101;54356;1883;75;[TCP Retransmission] 54356 → 1883 [FIN, PSH, ACK] Seq=55 Ack=5 Win=42336 Len=21;
229;Jan 13, 2022 19:21:10.591917643 CET;192.168.1.101;192.168.1.102;1883;54356;54;1883 → 54356 [FIN, ACK] Seq=5 Ack=77 Win=8192 Len=0;
230;Jan 13, 2022 19:21:10.591966135 CET;192.168.1.102;192.168.1.101;54356;1883;54;54356 → 1883 [ACK] Seq=77 Ack=6 Win=42335 Len=0;
231;Jan 13, 2022 19:21:20.131844523 CET;192.168.1.102;192.168.1.101;54358;1883;74;54358 → 1883 [SYN] Seq=0 Win=42340 Len=0 MSS=1460 SACK_PERM=1 TSval=3425194022 TSecr=0 WS=512;
232;Jan 13, 2022 19:21:20.135653135 CET;192.168.1.101;192.168.1.102;1883;54358;58;1883 → 54358 [SYN, ACK] Seq=0 Ack=1 Win=8192 Len=0 MSS=1460;
233;Jan 13, 2022 19:21:20.135672794 CET;192.168.1.102;192.168.1.101;54358;1883;54;54358 → 1883 [ACK] Seq=1 Ack=1 Win=42340 Len=0;
234;Jan 13, 2022 19:21:20.137957952 CET;192.168.1.102;192.168.1.101;54358;1883;108;Connect Command;
235;Jan 13, 2022 19:21:20.144033671 CET;192.168.1.101;192.168.1.102;1883;54358;54;1883 → 54358 [ACK] Seq=1 Ack=55 Win=8192 Len=0;
236;Jan 13, 2022 19:21:20.147596056 CET;192.168.1.101;192.168.1.102;1883;54358;58;Connect Ack;
237;Jan 13, 2022 19:21:20.147612232 CET;192.168.1.102;192.168.1.101;54358;1883;54;54358 → 1883 [ACK] Seq=55 Ack=5 Win=42336 Len=0;
238;Jan 13, 2022 19:21:20.147664578 CET;192.168.1.102;192.168.1.101;54358;1883;73;Publish Message [topic];message019
239;Jan 13, 2022 19:21:20.147686589 CET;192.168.1.102;192.168.1.101;54358;1883;56;Disconnect Req;
240;Jan 13, 2022 19:21:20.356563369 CET;192.168.1.102;192.168.1.101;54358;1883;75;[TCP Retransmission] 54358 → 1883 [FIN, PSH, ACK] Seq=55 Ack=5 Win=42336 Len=21;
241;Jan 13, 2022 19:21:20.364019072 CET;192.168.1.101;192.168.1.102;1883;54358;54;1883 → 54358 [FIN, ACK] Seq=5 Ack=77 Win=8192 Len=0;
242;Jan 13, 2022 19:21:20.364036762 CET;192.168.1.102;192.168.1.101;54358;1883;54;54358 → 1883 [ACK] Seq=77 Ack=6 Win=42335 Len=0;
243;Jan 13, 2022 19:21:30.154304100 CET;192.168.1.102;192.168.1.101;54360;1883;74;54360 → 1883 [SYN] Seq=0 Win=42340 Len=0 MSS=1460 SACK_PERM=1 TSval=3425204045 TSecr=0 WS=512;
244;Jan 13, 2022 19:21:30.158942927 CET;192.168.1.101;192.168.1.102;1883;54360;58;1883 → 54360 [SYN, ACK] Seq=0 Ack=1 Win=8192 Len=0 MSS=1460;
245;Jan 13, 2022 19:21:30.158974929 CET;192.168.1.102;192.168.1.101;54360;1883;54;54360 → 1883 [ACK] Seq=1 Ack=1 Win=42340 Len=0;
246;Jan 13, 2022 19:21:30.159285569 CET;192.168.1.102;192.168.1.101;54360;1883;108;Connect Command;
247;Jan 13, 2022 19:21:30.368522096 CET;192.168.1.102;192.168.1.101;54360;1883;108;[TCP Retransmission] 54360 → 1883 [PSH, ACK] Seq=1 Ack=1 Win=42340 Len=54;
248;Jan 13, 2022 19:21:30.372047265 CET;192.168.1.101;192.168.1.102;1883;54360;54;1883 → 54360 [ACK] Seq=1 Ack=55 Win=8192 Len=0;
249;Jan 13, 2022 19:21:30.376312271 CET;192.168.1.101;192.168.1.102;1883;54360;58;Connect Ack;
250;Jan 13, 2022 19:21:30.376332651 CET;192.168.1.102;192.168.1.101;54360;1883;54;54360 → 1883 [ACK] Seq=55 Ack=5 Win=42336 Len=0;
251;Jan 13, 2022 19:21:30.376405013 CET;192.168.1.102;192.168.1.101;54360;1883;73;Publish Message [topic];message020
252;Jan 13, 2022 19:21:30.376437468 CET;192.168.1.102;192.168.1.101;54360;1883;56;Disconnect Req;
253;Jan 13, 2022 19:21:30.796635373 CET;192.168.1.102;192.168.1.101;54360;1883;75;[TCP Retransmission] 54360 → 1883 [FIN, PSH, ACK] Seq=55 Ack=5 Win=42336 Len=21;
254;Jan 13, 2022 19:21:30.817464946 CET;192.168.1.101;192.168.1.102;1883;54360;54;1883 → 54360 [FIN, ACK] Seq=5 Ack=77 Win=8192 Len=0;
255;Jan 13, 2022 19:21:30.817500516 CET;192.168.1.102;192.168.1.101;54360;1883;54;54360 → 1883 [ACK] Seq=77 Ack=6 Win=42335 Len=0;
256;Jan 13, 2022 19:21:40.389406178 CET;192.168.1.102;192.168.1.101;54362;1883;74;54362 → 1883 [SYN] Seq=0 Win=42340 Len=0 MSS=1460 SACK_PERM=1 TSval=3425214280 TSecr=0 WS=512;
257;Jan 13, 2022 19:21:40.399100476 CET;192.168.1.101;192.168.1.102;1883;54362;58;1883 → 54362 [SYN, ACK] Seq=0 Ack=1 Win=8192 Len=0 MSS=1460;
258;Jan 13, 2022 19:21:40.399149835 CET;192.168.1.102;192.168.1.101;54362;1883;54;54362 → 1883 [ACK] Seq=1 Ack=1 Win=42340 Len=0;
259;Jan 13, 2022 19:21:40.399244960 CET;192.168.1.102;192.168.1.101;54362;1883;108;Connect Command;
260;Jan 13, 2022 19:21:40.612551381 CET;192.168.1.102;192.168.1.101;54362;1883;108;[TCP Retransmission] 54362 → 1883 [PSH, ACK] Seq=1 Ack=1 Win=42340 Len=54;
261;Jan 13, 2022 19:21:40.618346441 CET;192.168.1.101;192.168.1.102;1883;54362;54;1883 → 54362 [ACK] Seq=1 Ack=55 Win=8192 Len=0;
262;Jan 13, 2022 19:21:40.622691320 CET;192.168.1.101;192.168.1.102;1883;54362;58;Connect Ack;
263;Jan 13, 2022 19:21:40.622708157 CET;192.168.1.102;192.168.1.101;54362;1883;54;54362 → 1883 [ACK] Seq=55 Ack=5 Win=42336 Len=0;
264;Jan 13, 2022 19:21:40.622798483 CET;192.168.1.102;192.168.1.101;54362;1883;73;Publish Message [topic];message021
265;Jan 13, 2022 19:21:40.622820957 CET;192.168.1.102;192.168.1.101;54362;1883;56;Disconnect Req;
266;Jan 13, 2022 19:21:41.068939816 CET;192.168.1.102;192.168.1.101;54362;1883;75;[TCP Retransmission] 54362 → 1883 [FIN, PSH, ACK] Seq=55 Ack=5 Win=42336 Len=21;
267;Jan 13, 2022 19:21:41.072424211 CET;192.168.1.101;192.168.1.102;1883;54362;54;1883 → 54362 [FIN, ACK] Seq=5 Ack=77 Win=8192 Len=0;
268;Jan 13, 2022 19:21:41.072451590 CET;192.168.1.102;192.168.1.101;54362;1883;54;54362 → 1883 [ACK] Seq=77 Ack=6 Win=42335 Len=0;
269;Jan 13, 2022 19:21:50.630072698 CET;192.168.1.102;192.168.1.101;54364;1883;74;54364 → 1883 [SYN] Seq=0 Win=42340 Len=0 MSS=1460 SACK_PERM=1 TSval=3425224521 TSecr=0 WS=512;
270;Jan 13, 2022 19:21:50.634444584 CET;192.168.1.101;192.168.1.102;1883;54364;58;1883 → 54364 [SYN, ACK] Seq=0 Ack=1 Win=8192 Len=0 MSS=1460;
271;Jan 13, 2022 19:21:50.634466516 CET;192.168.1.102;192.168.1.101;54364;1883;54;54364 → 1883 [ACK] Seq=1 Ack=1 Win=42340 Len=0;
272;Jan 13, 2022 19:21:50.634860546 CET;192.168.1.102;192.168.1.101;54364;1883;108;Connect Command;
273;Jan 13, 2022 19:21:50.844528616 CET;192.168.1.102;192.168.1.101;54364;1883;108;[TCP Retransmission] 54364 → 1883 [PSH, ACK] Seq=1 Ack=1 Win=42340 Len=54;
274;Jan 13, 2022 19:21:50.847862573 CET;192.168.1.101;192.168.1.102;1883;54364;54;1883 → 54364 [ACK] Seq=1 Ack=55 Win=8192 Len=0;
275;Jan 13, 2022 19:21:50.851866471 CET;192.168.1.101;192.168.1.102;1883;54364;58;Connect Ack;
276;Jan 13, 2022 19:21:50.851881150 CET;192.168.1.102;192.168.1.101;54364;1883;54;54364 → 1883 [ACK] Seq=55 Ack=5 Win=42336 Len=0;
277;Jan 13, 2022 19:21:50.851933798 CET;192.168.1.102;192.168.1.101;54364;1883;73;Publish Message [topic];message022
278;Jan 13, 2022 19:21:50.851955631 CET;192.168.1.102;192.168.1.101;54364;1883;56;Disconnect Req;
279;Jan 13, 2022 19:21:51.276780470 CET;192.168.1.102;192.168.1.101;54364;1883;75;[TCP Retransmission] 54364 → 1883 [FIN, PSH, ACK] Seq=55 Ack=5 Win=42336 Len=21;
280;Jan 13, 2022 19:21:51.285396422 CET;192.168.1.101;192.168.1.102;1883;54364;54;1883 → 54364 [FIN, ACK] Seq=5 Ack=77 Win=8192 Len=0;
281;Jan 13, 2022 19:21:51.285420297 CET;192.168.1.102;192.168.1.101;54364;1883;54;54364 → 1883 [ACK] Seq=77 Ack=6 Win=42335 Len=0;
282;Jan 13, 2022 19:22:00.867831745 CET;192.168.1.102;192.168.1.101;54366;1883;74;54366 → 1883 [SYN] Seq=0 Win=42340 Len=0 MSS=1460 SACK_PERM=1 TSval=3425234758 TSecr=0 WS=512;
283;Jan 13, 2022 19:22:00.876449492 CET;192.168.1.101;192.168.1.102;1883;54366;58;1883 → 54366 [SYN, ACK] Seq=0 Ack=1 Win=8192 Len=0 MSS=1460;
284;Jan 13, 2022 19:22:00.876477392 CET;192.168.1.102;192.168.1.101;54366;1883;54;54366 → 1883 [ACK] Seq=1 Ack=1 Win=42340 Len=0;
285;Jan 13, 2022 19:22:00.876580599 CET;192.168.1.102;192.168.1.101;54366;1883;108;Connect Command;
286;Jan 13, 2022 19:22:01.092713275 CET;192.168.1.102;192.168.1.101;54366;1883;108;[TCP Retransmission] 54366 → 1883 [PSH, ACK] Seq=1 Ack=1 Win=42340 Len=54;
287;Jan 13, 2022 19:22:01.096351052 CET;192.168.1.101;192.168.1.102;1883;54366;54;1883 → 54366 [ACK] Seq=1 Ack=55 Win=8192 Len=0;
288;Jan 13, 2022 19:22:01.101212880 CET;192.168.1.101;192.168.1.102;1883;54366;58;Connect Ack;
289;Jan 13, 2022 19:22:01.101230509 CET;192.168.1.102;192.168.1.101;54366;1883;54;54366 → 1883 [ACK] Seq=55 Ack=5 Win=42336 Len=0;
290;Jan 13, 2022 19:22:01.101294083 CET;192.168.1.102;192.168.1.101;54366;1883;73;Publish Message [topic];message023
291;Jan 13, 2022 19:22:01.101319697 CET;192.168.1.102;192.168.1.101;54366;1883;56;Disconnect Req;
292;Jan 13, 2022 19:22:01.548534206 CET;192.168.1.102;192.168.1.101;54366;1883;75;[TCP Retransmission] 54366 → 1883 [FIN, PSH, ACK] Seq=55 Ack=5 Win=42336 Len=21;
293;Jan 13, 2022 19:22:01.554552179 CET;192.168.1.101;192.168.1.102;1883;54366;54;1883 → 54366 [FIN, ACK] Seq=5 Ack=77 Win=8192 Len=0;
294;Jan 13, 2022 19:22:01.554572796 CET;192.168.1.102;192.168.1.101;54366;1883;54;54366 → 1883 [ACK] Seq=77 Ack=6 Win=42335 Len=0;
295;Jan 13, 2022 19:22:11.113682127 CET;192.168.1.102;192.168.1.101;54368;1883;74;54368 → 1883 [SYN] Seq=0 Win=42340 Len=0 MSS=1460 SACK_PERM=1 TSval=3425245004 TSecr=0 WS=512;
296;Jan 13, 2022 19:22:11.127132716 CET;192.168.1.101;192.168.1.102;1883;54368;58;1883 → 54368 [SYN, ACK] Seq=0 Ack=1 Win=8192 Len=0 MSS=1460;
297;Jan 13, 2022 19:22:11.127181088 CET;192.168.1.102;192.168.1.101;54368;1883;54;54368 → 1883 [ACK] Seq=1 Ack=1 Win=42340 Len=0;
298;Jan 13, 2022 19:22:11.127278750 CET;192.168.1.102;192.168.1.101;54368;1883;108;Connect Command;
299;Jan 13, 2022 19:22:11.344812201 CET;192.168.1.102;192.168.1.101;54368;1883;108;[TCP Retransmission] 54368 → 1883 [PSH, ACK] Seq=1 Ack=1 Win=42340 Len=54;
300;Jan 13, 2022 19:22:11.370472126 CET;192.168.1.101;192.168.1.102;1883;54368;54;1883 → 54368 [ACK] Seq=1 Ack=55 Win=8192 Len=0;
301;Jan 13, 2022 19:22:11.378663394 CET;192.168.1.101;192.168.1.102;1883;54368;58;Connect Ack;
302;Jan 13, 2022 19:22:11.378680860 CET;192.168.1.102;192.168.1.101;54368;1883;54;54368 → 1883 [ACK] Seq=55 Ack=5 Win=42336 Len=0;
303;Jan 13, 2022 19:22:11.378754656 CET;192.168.1.102;192.168.1.101;54368;1883;73;Publish Message [topic];message024
304;Jan 13, 2022 19:22:11.378819535 CET;192.168.1.102;192.168.1.101;54368;1883;56;Disconnect Req;
305;Jan 13, 2022 19:22:11.821460236 CET;192.168.1.102;192.168.1.101;54368;1883;75;[TCP Retransmission] 54368 → 1883 [FIN, PSH, ACK] Seq=55 Ack=5 Win=42336 Len=21;
306;Jan 13, 2022 19:22:11.824756440 CET;192.168.1.101;192.168.1.102;1883;54368;54;1883 → 54368 [FIN, ACK] Seq=5 Ack=77 Win=8192 Len=0;
