1;Jan 13, 2022 16:27:48.690137149 CET;192.168.1.102;192.168.1.101;52866;1883;74;52866 → 1883 [SYN] Seq=0 Win=42340 Len=0 MSS=1460 SACK_PERM=1 TSval=3414782581 TSecr=0 WS=512;
2;Jan 13, 2022 16:27:48.699036582 CET;192.168.1.101;192.168.1.102;1883;52866;58;1883 → 52866 [SYN, ACK] Seq=0 Ack=1 Win=8192 Len=0 MSS=1460;
3;Jan 13, 2022 16:27:48.699052055 CET;192.168.1.102;192.168.1.101;52866;1883;54;52866 → 1883 [ACK] Seq=1 Ack=1 Win=42340 Len=0;
4;Jan 13, 2022 16:27:48.699114400 CET;192.168.1.102;192.168.1.101;52866;1883;108;Connect Command;
5;Jan 13, 2022 16:27:48.912577179 CET;192.168.1.102;192.168.1.101;52866;1883;108;[TCP Retransmission] 52866 → 1883 [PSH, ACK] Seq=1 Ack=1 Win=42340 Len=54;
6;Jan 13, 2022 16:27:48.931974212 CET;192.168.1.101;192.168.1.102;1883;52866;54;1883 → 52866 [ACK] Seq=1 Ack=55 Win=8192 Len=0;
7;Jan 13, 2022 16:27:48.938793138 CET;192.168.1.101;192.168.1.102;1883;52866;58;Connect Ack;
8;Jan 13, 2022 16:27:48.938866458 CET;192.168.1.102;192.168.1.101;52866;1883;54;52866 → 1883 [ACK] Seq=55 Ack=5 Win=42336 Len=0;
9;Jan 13, 2022 16:27:48.938964808 CET;192.168.1.102;192.168.1.101;52866;1883;73;Publish Message [topic];message001
10;Jan 13, 2022 16:27:48.939001574 CET;192.168.1.102;192.168.1.101;52866;1883;56;Disconnect Req;
11;Jan 13, 2022 16:27:49.388642017 CET;192.168.1.102;192.168.1.101;52866;1883;75;[TCP Retransmission] 52866 → 1883 [FIN, PSH, ACK] Seq=55 Ack=5 Win=42336 Len=21;
12;Jan 13, 2022 16:27:49.396467566 CET;192.168.1.101;192.168.1.102;1883;52866;54;1883 → 52866 [FIN, ACK] Seq=5 Ack=77 Win=8192 Len=0;
13;Jan 13, 2022 16:27:49.396509441 CET;192.168.1.102;192.168.1.101;52866;1883;54;52866 → 1883 [ACK] Seq=77 Ack=6 Win=42335 Len=0;
14;Jan 13, 2022 16:27:58.946410302 CET;192.168.1.102;192.168.1.101;52868;1883;74;52868 → 1883 [SYN] Seq=0 Win=42340 Len=0 MSS=1460 SACK_PERM=1 TSval=3414792837 TSecr=0 WS=512;
15;Jan 13, 2022 16:27:58.950394299 CET;192.168.1.101;192.168.1.102;1883;52868;58;1883 → 52868 [SYN, ACK] Seq=0 Ack=1 Win=8192 Len=0 MSS=1460;
16;Jan 13, 2022 16:27:58.950417211 CET;192.168.1.102;192.168.1.101;52868;1883;54;52868 → 1883 [ACK] Seq=1 Ack=1 Win=42340 Len=0;
17;Jan 13, 2022 16:27:58.952224321 CET;192.168.1.102;192.168.1.101;52868;1883;108;Connect Command;
18;Jan 13, 2022 16:27:58.956414581 CET;192.168.1.101;192.168.1.102;1883;52868;54;1883 → 52868 [ACK] Seq=1 Ack=55 Win=8192 Len=0;
19;Jan 13, 2022 16:27:58.958807920 CET;192.168.1.101;192.168.1.102;1883;52868;58;Connect Ack;
20;Jan 13, 2022 16:27:58.958816396 CET;192.168.1.102;192.168.1.101;52868;1883;54;52868 → 1883 [ACK] Seq=55 Ack=5 Win=42336 Len=0;
21;Jan 13, 2022 16:27:58.958865948 CET;192.168.1.102;192.168.1.101;52868;1883;73;Publish Message [topic];message002
22;Jan 13, 2022 16:27:58.958883282 CET;192.168.1.102;192.168.1.101;52868;1883;56;Disconnect Req;
23;Jan 13, 2022 16:27:59.168616964 CET;192.168.1.102;192.168.1.101;52868;1883;75;[TCP Retransmission] 52868 → 1883 [FIN, PSH, ACK] Seq=55 Ack=5 Win=42336 Len=21;
24;Jan 13, 2022 16:27:59.185441864 CET;192.168.1.101;192.168.1.102;1883;52868;54;1883 → 52868 [FIN, ACK] Seq=5 Ack=77 Win=8192 Len=0;
25;Jan 13, 2022 16:27:59.185480212 CET;192.168.1.102;192.168.1.101;52868;1883;54;52868 → 1883 [ACK] Seq=77 Ack=6 Win=42335 Len=0;
26;Jan 13, 2022 16:28:08.972022842 CET;192.168.1.102;192.168.1.101;52870;1883;74;52870 → 1883 [SYN] Seq=0 Win=42340 Len=0 MSS=1460 SACK_PERM=1 TSval=3414802863 TSecr=0 WS=512;
27;Jan 13, 2022 16:28:08.987220858 CET;192.168.1.101;192.168.1.102;1883;52870;58;1883 → 52870 [SYN, ACK] Seq=0 Ack=1 Win=8192 Len=0 MSS=1460;
28;Jan 13, 2022 16:28:08.987256981 CET;192.168.1.102;192.168.1.101;52870;1883;54;52870 → 1883 [ACK] Seq=1 Ack=1 Win=42340 Len=0;
29;Jan 13, 2022 16:28:08.987332701 CET;192.168.1.102;192.168.1.101;52870;1883;108;Connect Command;
30;Jan 13, 2022 16:28:09.204522254 CET;192.168.1.102;192.168.1.101;52870;1883;108;[TCP Retransmission] 52870 → 1883 [PSH, ACK] Seq=1 Ack=1 Win=42340 Len=54;
31;Jan 13, 2022 16:28:09.207976637 CET;192.168.1.101;192.168.1.102;1883;52870;54;1883 → 52870 [ACK] Seq=1 Ack=55 Win=8192 Len=0;
32;Jan 13, 2022 16:28:09.211966380 CET;192.168.1.101;192.168.1.102;1883;52870;58;Connect Ack;
33;Jan 13, 2022 16:28:09.211986550 CET;192.168.1.102;192.168.1.101;52870;1883;54;52870 → 1883 [ACK] Seq=55 Ack=5 Win=42336 Len=0;
34;Jan 13, 2022 16:28:09.212073485 CET;192.168.1.102;192.168.1.101;52870;1883;73;Publish Message [topic];message003
35;Jan 13, 2022 16:28:09.212125679 CET;192.168.1.102;192.168.1.101;52870;1883;56;Disconnect Req;
36;Jan 13, 2022 16:28:09.644543038 CET;192.168.1.102;192.168.1.101;52870;1883;75;[TCP Retransmission] 52870 → 1883 [FIN, PSH, ACK] Seq=55 Ack=5 Win=42336 Len=21;
37;Jan 13, 2022 16:28:09.649663255 CET;192.168.1.101;192.168.1.102;1883;52870;54;1883 → 52870 [FIN, ACK] Seq=5 Ack=77 Win=8192 Len=0;
38;Jan 13, 2022 16:28:09.649692432 CET;192.168.1.102;192.168.1.101;52870;1883;54;52870 → 1883 [ACK] Seq=77 Ack=6 Win=42335 Len=0;
39;Jan 13, 2022 16:28:19.220973511 CET;192.168.1.102;192.168.1.101;52872;1883;74;52872 → 1883 [SYN] Seq=0 Win=42340 Len=0 MSS=1460 SACK_PERM=1 TSval=3414813112 TSecr=0 WS=512;
40;Jan 13, 2022 16:28:19.225782968 CET;192.168.1.101;192.168.1.102;1883;52872;58;1883 → 52872 [SYN, ACK] Seq=0 Ack=1 Win=8192 Len=0 MSS=1460;
41;Jan 13, 2022 16:28:19.225809470 CET;192.168.1.102;192.168.1.101;52872;1883;54;52872 → 1883 [ACK] Seq=1 Ack=1 Win=42340 Len=0;
42;Jan 13, 2022 16:28:19.226108043 CET;192.168.1.102;192.168.1.101;52872;1883;108;Connect Command;
43;Jan 13, 2022 16:28:19.436570350 CET;192.168.1.102;192.168.1.101;52872;1883;108;[TCP Retransmission] 52872 → 1883 [PSH, ACK] Seq=1 Ack=1 Win=42340 Len=54;
44;Jan 13, 2022 16:28:19.443555325 CET;192.168.1.101;192.168.1.102;1883;52872;54;1883 → 52872 [ACK] Seq=1 Ack=55 Win=8192 Len=0;
45;Jan 13, 2022 16:28:19.446325494 CET;192.168.1.101;192.168.1.102;1883;52872;58;Connect Ack;
46;Jan 13, 2022 16:28:19.446347789 CET;192.168.1.102;192.168.1.101;52872;1883;54;52872 → 1883 [ACK] Seq=55 Ack=5 Win=42336 Len=0;
47;Jan 13, 2022 16:28:19.446419406 CET;192.168.1.102;192.168.1.101;52872;1883;73;Publish Message [topic];message004
48;Jan 13, 2022 16:28:19.446438941 CET;192.168.1.102;192.168.1.101;52872;1883;56;Disconnect Req;
49;Jan 13, 2022 16:28:19.884596005 CET;192.168.1.102;192.168.1.101;52872;1883;75;[TCP Retransmission] 52872 → 1883 [FIN, PSH, ACK] Seq=55 Ack=5 Win=42336 Len=21;
50;Jan 13, 2022 16:28:19.890897106 CET;192.168.1.101;192.168.1.102;1883;52872;54;1883 → 52872 [FIN, ACK] Seq=5 Ack=77 Win=8192 Len=0;
51;Jan 13, 2022 16:28:19.890921890 CET;192.168.1.102;192.168.1.101;52872;1883;54;52872 → 1883 [ACK] Seq=77 Ack=6 Win=42335 Len=0;
52;Jan 13, 2022 16:28:29.451521161 CET;192.168.1.102;192.168.1.101;52874;1883;74;52874 → 1883 [SYN] Seq=0 Win=42340 Len=0 MSS=1460 SACK_PERM=1 TSval=3414823342 TSecr=0 WS=512;
53;Jan 13, 2022 16:28:29.459512565 CET;192.168.1.101;192.168.1.102;1883;52874;58;1883 → 52874 [SYN, ACK] Seq=0 Ack=1 Win=8192 Len=0 MSS=1460;
54;Jan 13, 2022 16:28:29.459559240 CET;192.168.1.102;192.168.1.101;52874;1883;54;52874 → 1883 [ACK] Seq=1 Ack=1 Win=42340 Len=0;
55;Jan 13, 2022 16:28:29.459640244 CET;192.168.1.102;192.168.1.101;52874;1883;108;Connect Command;
56;Jan 13, 2022 16:28:29.673138097 CET;192.168.1.102;192.168.1.101;52874;1883;108;[TCP Retransmission] 52874 → 1883 [PSH, ACK] Seq=1 Ack=1 Win=42340 Len=54;
57;Jan 13, 2022 16:28:29.678953681 CET;192.168.1.101;192.168.1.102;1883;52874;54;1883 → 52874 [ACK] Seq=1 Ack=55 Win=8192 Len=0;
58;Jan 13, 2022 16:28:29.682278437 CET;192.168.1.101;192.168.1.102;1883;52874;58;Connect Ack;
59;Jan 13, 2022 16:28:29.682300169 CET;192.168.1.102;192.168.1.101;52874;1883;54;52874 → 1883 [ACK] Seq=55 Ack=5 Win=42336 Len=0;
60;Jan 13, 2022 16:28:29.682371206 CET;192.168.1.102;192.168.1.101;52874;1883;73;Publish Message [topic];message005
61;Jan 13, 2022 16:28:29.682392143 CET;192.168.1.102;192.168.1.101;52874;1883;56;Disconnect Req;
62;Jan 13, 2022 16:28:30.124532401 CET;192.168.1.102;192.168.1.101;52874;1883;75;[TCP Retransmission] 52874 → 1883 [FIN, PSH, ACK] Seq=55 Ack=5 Win=42336 Len=21;
63;Jan 13, 2022 16:28:30.130872995 CET;192.168.1.101;192.168.1.102;1883;52874;54;1883 → 52874 [FIN, ACK] Seq=5 Ack=77 Win=8192 Len=0;
64;Jan 13, 2022 16:28:30.130903829 CET;192.168.1.102;192.168.1.101;52874;1883;54;52874 → 1883 [ACK] Seq=77 Ack=6 Win=42335 Len=0;
65;Jan 13, 2022 16:28:39.691428450 CET;192.168.1.102;192.168.1.101;52876;1883;74;52876 → 1883 [SYN] Seq=0 Win=42340 Len=0 MSS=1460 SACK_PERM=1 TSval=3414833582 TSecr=0 WS=512;
66;Jan 13, 2022 16:28:39.701323490 CET;192.168.1.101;192.168.1.102;1883;52876;58;1883 → 52876 [SYN, ACK] Seq=0 Ack=1 Win=8192 Len=0 MSS=1460;
67;Jan 13, 2022 16:28:39.701367481 CET;192.168.1.102;192.168.1.101;52876;1883;54;52876 → 1883 [ACK] Seq=1 Ack=1 Win=42340 Len=0;
68;Jan 13, 2022 16:28:39.701455269 CET;192.168.1.102;192.168.1.101;52876;1883;108;Connect Command;
69;Jan 13, 2022 16:28:39.916536509 CET;192.168.1.102;192.168.1.101;52876;1883;108;[TCP Retransmission] 52876 → 1883 [PSH, ACK] Seq=1 Ack=1 Win=42340 Len=54;
70;Jan 13, 2022 16:28:39.922700443 CET;192.168.1.101;192.168.1.102;1883;52876;54;1883 → 52876 [ACK] Seq=1 Ack=55 Win=8192 Len=0;
71;Jan 13, 2022 16:28:39.925992378 CET;192.168.1.101;192.168.1.102;1883;52876;58;Connect Ack;
72;Jan 13, 2022 16:28:39.926009635 CET;192.168.1.102;192.168.1.101;52876;1883;54;52876 → 1883 [ACK] Seq=55 Ack=5 Win=42336 Len=0;
73;Jan 13, 2022 16:28:39.926069698 CET;192.168.1.102;192.168.1.101;52876;1883;73;Publish Message [topic];message006
74;Jan 13, 2022 16:28:39.926090548 CET;192.168.1.102;192.168.1.101;52876;1883;56;Disconnect Req;
75;Jan 13, 2022 16:28:40.364536808 CET;192.168.1.102;192.168.1.101;52876;1883;75;[TCP Retransmission] 52876 → 1883 [FIN, PSH, ACK] Seq=55 Ack=5 Win=42336 Len=21;
76;Jan 13, 2022 16:28:40.370157819 CET;192.168.1.101;192.168.1.102;1883;52876;54;1883 → 52876 [FIN, ACK] Seq=5 Ack=77 Win=8192 Len=0;
77;Jan 13, 2022 16:28:40.370179164 CET;192.168.1.102;192.168.1.101;52876;1883;54;52876 → 1883 [ACK] Seq=77 Ack=6 Win=42335 Len=0;
78;Jan 13, 2022 16:28:49.933149112 CET;192.168.1.102;192.168.1.101;52878;1883;74;52878 → 1883 [SYN] Seq=0 Win=42340 Len=0 MSS=1460 SACK_PERM=1 TSval=3414843824 TSecr=0 WS=512;
79;Jan 13, 2022 16:28:49.937903238 CET;192.168.1.101;192.168.1.102;1883;52878;58;1883 → 52878 [SYN, ACK] Seq=0 Ack=1 Win=8192 Len=0 MSS=1460;
80;Jan 13, 2022 16:28:49.937934436 CET;192.168.1.102;192.168.1.101;52878;1883;54;52878 → 1883 [ACK] Seq=1 Ack=1 Win=42340 Len=0;
81;Jan 13, 2022 16:28:49.938241797 CET;192.168.1.102;192.168.1.101;52878;1883;108;Connect Command;
82;Jan 13, 2022 16:28:50.148608601 CET;192.168.1.102;192.168.1.101;52878;1883;108;[TCP Retransmission] 52878 → 1883 [PSH, ACK] Seq=1 Ack=1 Win=42340 Len=54;
83;Jan 13, 2022 16:28:50.153704752 CET;192.168.1.101;192.168.1.102;1883;52878;54;1883 → 52878 [ACK] Seq=1 Ack=55 Win=8192 Len=0;
84;Jan 13, 2022 16:28:50.157129234 CET;192.168.1.101;192.168.1.102;1883;52878;58;Connect Ack;
85;Jan 13, 2022 16:28:50.157147883 CET;192.168.1.102;192.168.1.101;52878;1883;54;52878 → 1883 [ACK] Seq=55 Ack=5 Win=42336 Len=0;
86;Jan 13, 2022 16:28:50.157209737 CET;192.168.1.102;192.168.1.101;52878;1883;73;Publish Message [topic];message007
87;Jan 13, 2022 16:28:50.157229886 CET;192.168.1.102;192.168.1.101;52878;1883;56;Disconnect Req;
88;Jan 13, 2022 16:28:50.604743412 CET;192.168.1.102;192.168.1.101;52878;1883;75;[TCP Retransmission] 52878 → 1883 [FIN, PSH, ACK] Seq=55 Ack=5 Win=42336 Len=21;
89;Jan 13, 2022 16:28:50.614150284 CET;192.168.1.101;192.168.1.102;1883;52878;54;1883 → 52878 [FIN, ACK] Seq=5 Ack=77 Win=8192 Len=0;
90;Jan 13, 2022 16:28:50.614174623 CET;192.168.1.102;192.168.1.101;52878;1883;54;52878 → 1883 [ACK] Seq=77 Ack=6 Win=42335 Len=0;
91;Jan 13, 2022 16:29:00.169659765 CET;192.168.1.102;192.168.1.101;52880;1883;74;52880 → 1883 [SYN] Seq=0 Win=42340 Len=0 MSS=1460 SACK_PERM=1 TSval=3414854060 TSecr=0 WS=512;
92;Jan 13, 2022 16:29:00.183045549 CET;192.168.1.101;192.168.1.102;1883;52880;58;1883 → 52880 [SYN, ACK] Seq=0 Ack=1 Win=8192 Len=0 MSS=1460;
93;Jan 13, 2022 16:29:00.183096766 CET;192.168.1.102;192.168.1.101;52880;1883;54;52880 → 1883 [ACK] Seq=1 Ack=1 Win=42340 Len=0;
94;Jan 13, 2022 16:29:00.183187241 CET;192.168.1.102;192.168.1.101;52880;1883;108;Connect Command;
95;Jan 13, 2022 16:29:00.400556673 CET;192.168.1.102;192.168.1.101;52880;1883;108;[TCP Retransmission] 52880 → 1883 [PSH, ACK] Seq=1 Ack=1 Win=42340 Len=54;
96;Jan 13, 2022 16:29:00.409352032 CET;192.168.1.101;192.168.1.102;1883;52880;54;1883 → 52880 [ACK] Seq=1 Ack=55 Win=8192 Len=0;
97;Jan 13, 2022 16:29:00.412925262 CET;192.168.1.101;192.168.1.102;1883;52880;58;Connect Ack;
98;Jan 13, 2022 16:29:00.412941039 CET;192.168.1.102;192.168.1.101;52880;1883;54;52880 → 1883 [ACK] Seq=55 Ack=5 Win=42336 Len=0;
99;Jan 13, 2022 16:29:00.412999119 CET;192.168.1.102;192.168.1.101;52880;1883;73;Publish Message [topic];message008
100;Jan 13, 2022 16:29:00.413019215 CET;192.168.1.102;192.168.1.101;52880;1883;56;Disconnect Req;
101;Jan 13, 2022 16:29:00.876575378 CET;192.168.1.102;192.168.1.101;52880;1883;75;[TCP Retransmission] 52880 → 1883 [FIN, PSH, ACK] Seq=55 Ack=5 Win=42336 Len=21;
102;Jan 13, 2022 16:29:00.889523537 CET;192.168.1.101;192.168.1.102;1883;52880;54;1883 → 52880 [FIN, ACK] Seq=5 Ack=77 Win=8192 Len=0;
103;Jan 13, 2022 16:29:00.889549263 CET;192.168.1.102;192.168.1.101;52880;1883;54;52880 → 1883 [ACK] Seq=77 Ack=6 Win=42335 Len=0;
104;Jan 13, 2022 16:29:10.418588193 CET;192.168.1.102;192.168.1.101;52882;1883;74;52882 → 1883 [SYN] Seq=0 Win=42340 Len=0 MSS=1460 SACK_PERM=1 TSval=3414864309 TSecr=0 WS=512;
105;Jan 13, 2022 16:29:10.424221957 CET;192.168.1.101;192.168.1.102;1883;52882;58;1883 → 52882 [SYN, ACK] Seq=0 Ack=1 Win=8192 Len=0 MSS=1460;
106;Jan 13, 2022 16:29:10.424248780 CET;192.168.1.102;192.168.1.101;52882;1883;54;52882 → 1883 [ACK] Seq=1 Ack=1 Win=42340 Len=0;
107;Jan 13, 2022 16:29:10.424303118 CET;192.168.1.102;192.168.1.101;52882;1883;108;Connect Command;
108;Jan 13, 2022 16:29:10.632520760 CET;192.168.1.102;192.168.1.101;52882;1883;108;[TCP Retransmission] 52882 → 1883 [PSH, ACK] Seq=1 Ack=1 Win=42340 Len=54;
109;Jan 13, 2022 16:29:10.637476567 CET;192.168.1.101;192.168.1.102;1883;52882;54;1883 → 52882 [ACK] Seq=1 Ack=55 Win=8192 Len=0;
110;Jan 13, 2022 16:29:10.640640610 CET;192.168.1.101;192.168.1.102;1883;52882;58;Connect Ack;
111;Jan 13, 2022 16:29:10.640661276 CET;192.168.1.102;192.168.1.101;52882;1883;54;52882 → 1883 [ACK] Seq=55 Ack=5 Win=42336 Len=0;
112;Jan 13, 2022 16:29:10.640727377 CET;192.168.1.102;192.168.1.101;52882;1883;73;Publish Message [topic];message009
113;Jan 13, 2022 16:29:10.640748815 CET;192.168.1.102;192.168.1.101;52882;1883;56;Disconnect Req;
114;Jan 13, 2022 16:29:11.084517675 CET;192.168.1.102;192.168.1.101;52882;1883;75;[TCP Retransmission] 52882 → 1883 [FIN, PSH, ACK] Seq=55 Ack=5 Win=42336 Len=21;
115;Jan 13, 2022 16:29:11.089330946 CET;192.168.1.101;192.168.1.102;1883;52882;54;1883 → 52882 [FIN, ACK] Seq=5 Ack=77 Win=8192 Len=0;
116;Jan 13, 2022 16:29:11.089352983 CET;192.168.1.102;192.168.1.101;52882;1883;54;52882 → 1883 [ACK] Seq=77 Ack=6 Win=42335 Len=0;
117;Jan 13, 2022 16:29:20.645825363 CET;192.168.1.102;192.168.1.101;52884;1883;74;52884 → 1883 [SYN] Seq=0 Win=42340 Len=0 MSS=1460 SACK_PERM=1 TSval=3414874536 TSecr=0 WS=512;
118;Jan 13, 2022 16:29:20.651827684 CET;192.168.1.101;192.168.1.102;1883;52884;58;1883 → 52884 [SYN, ACK] Seq=0 Ack=1 Win=8192 Len=0 MSS=1460;
119;Jan 13, 2022 16:29:20.651878989 CET;192.168.1.102;192.168.1.101;52884;1883;54;52884 → 1883 [ACK] Seq=1 Ack=1 Win=42340 Len=0;
120;Jan 13, 2022 16:29:20.651966308 CET;192.168.1.102;192.168.1.101;52884;1883;108;Connect Command;
121;Jan 13, 2022 16:29:20.860800470 CET;192.168.1.102;192.168.1.101;52884;1883;108;[TCP Retransmission] 52884 → 1883 [PSH, ACK] Seq=1 Ack=1 Win=42340 Len=54;
122;Jan 13, 2022 16:29:20.871819706 CET;192.168.1.101;192.168.1.102;1883;52884;54;1883 → 52884 [ACK] Seq=1 Ack=55 Win=8192 Len=0;
123;Jan 13, 2022 16:29:20.875199681 CET;192.168.1.101;192.168.1.102;1883;52884;58;Connect Ack;
124;Jan 13, 2022 16:29:20.875219451 CET;192.168.1.102;192.168.1.101;52884;1883;54;52884 → 1883 [ACK] Seq=55 Ack=5 Win=42336 Len=0;
125;Jan 13, 2022 16:29:20.875306137 CET;192.168.1.102;192.168.1.101;52884;1883;73;Publish Message [topic];message010
126;Jan 13, 2022 16:29:20.875326415 CET;192.168.1.102;192.168.1.101;52884;1883;56;Disconnect Req;
127;Jan 13, 2022 16:29:21.292522587 CET;192.168.1.102;192.168.1.101;52884;1883;75;[TCP Retransmission] 52884 → 1883 [FIN, PSH, ACK] Seq=55 Ack=5 Win=42336 Len=21;
128;Jan 13, 2022 16:29:21.298862890 CET;192.168.1.101;192.168.1.102;1883;52884;54;1883 → 52884 [FIN, ACK] Seq=5 Ack=77 Win=8192 Len=0;
129;Jan 13, 2022 16:29:21.298933676 CET;192.168.1.102;192.168.1.101;52884;1883;54;52884 → 1883 [ACK] Seq=77 Ack=6 Win=42335 Len=0;
130;Jan 13, 2022 16:29:30.882184270 CET;192.168.1.102;192.168.1.101;52886;1883;74;52886 → 1883 [SYN] Seq=0 Win=42340 Len=0 MSS=1460 SACK_PERM=1 TSval=3414884773 TSecr=0 WS=512;
131;Jan 13, 2022 16:29:30.886143736 CET;192.168.1.101;192.168.1.102;1883;52886;58;1883 → 52886 [SYN, ACK] Seq=0 Ack=1 Win=8192 Len=0 MSS=1460;
132;Jan 13, 2022 16:29:30.886166598 CET;192.168.1.102;192.168.1.101;52886;1883;54;52886 → 1883 [ACK] Seq=1 Ack=1 Win=42340 Len=0;
133;Jan 13, 2022 16:29:30.887965807 CET;192.168.1.102;192.168.1.101;52886;1883;108;Connect Command;
134;Jan 13, 2022 16:29:30.892140249 CET;192.168.1.101;192.168.1.102;1883;52886;54;1883 → 52886 [ACK] Seq=1 Ack=55 Win=8192 Len=0;
135;Jan 13, 2022 16:29:30.895949239 CET;192.168.1.101;192.168.1.102;1883;52886;58;Connect Ack;
136;Jan 13, 2022 16:29:30.895960811 CET;192.168.1.102;192.168.1.101;52886;1883;54;52886 → 1883 [ACK] Seq=55 Ack=5 Win=42336 Len=0;
137;Jan 13, 2022 16:29:30.896012495 CET;192.168.1.102;192.168.1.101;52886;1883;73;Publish Message [topic];message011
138;Jan 13, 2022 16:29:30.896031168 CET;192.168.1.102;192.168.1.101;52886;1883;56;Disconnect Req;
139;Jan 13, 2022 16:29:31.104529964 CET;192.168.1.102;192.168.1.101;52886;1883;75;[TCP Retransmission] 52886 → 1883 [FIN, PSH, ACK] Seq=55 Ack=5 Win=42336 Len=21;
140;Jan 13, 2022 16:29:31.110866570 CET;192.168.1.101;192.168.1.102;1883;52886;54;1883 → 52886 [FIN, ACK] Seq=5 Ack=77 Win=8192 Len=0;
141;Jan 13, 2022 16:29:31.110891404 CET;192.168.1.102;192.168.1.101;52886;1883;54;52886 → 1883 [ACK] Seq=77 Ack=6 Win=42335 Len=0;
142;Jan 13, 2022 16:29:40.909975566 CET;192.168.1.102;192.168.1.101;52888;1883;74;52888 → 1883 [SYN] Seq=0 Win=42340 Len=0 MSS=1460 SACK_PERM=1 TSval=3414894801 TSecr=0 WS=512;
143;Jan 13, 2022 16:29:40.920856873 CET;192.168.1.101;192.168.1.102;1883;52888;58;1883 → 52888 [SYN, ACK] Seq=0 Ack=1 Win=8192 Len=0 MSS=1460;
144;Jan 13, 2022 16:29:40.920891999 CET;192.168.1.102;192.168.1.101;52888;1883;54;52888 → 1883 [ACK] Seq=1 Ack=1 Win=42340 Len=0;
145;Jan 13, 2022 16:29:40.920967095 CET;192.168.1.102;192.168.1.101;52888;1883;108;Connect Command;
146;Jan 13, 2022 16:29:41.136548713 CET;192.168.1.102;192.168.1.101;52888;1883;108;[TCP Retransmission] 52888 → 1883 [PSH, ACK] Seq=1 Ack=1 Win=42340 Len=54;
147;Jan 13, 2022 16:29:41.147370764 CET;192.168.1.101;192.168.1.102;1883;52888;54;1883 → 52888 [ACK] Seq=1 Ack=55 Win=8192 Len=0;
148;Jan 13, 2022 16:29:41.153633670 CET;192.168.1.101;192.168.1.102;1883;52888;58;Connect Ack;
149;Jan 13, 2022 16:29:41.153661347 CET;192.168.1.102;192.168.1.101;52888;1883;54;52888 → 1883 [ACK] Seq=55 Ack=5 Win=42336 Len=0;
150;Jan 13, 2022 16:29:41.153796806 CET;192.168.1.102;192.168.1.101;52888;1883;73;Publish Message [topic];message012
151;Jan 13, 2022 16:29:41.153844661 CET;192.168.1.102;192.168.1.101;52888;1883;56;Disconnect Req;
152;Jan 13, 2022 16:29:41.580766563 CET;192.168.1.102;192.168.1.101;52888;1883;75;[TCP Retransmission] 52888 → 1883 [FIN, PSH, ACK] Seq=55 Ack=5 Win=42336 Len=21;
153;Jan 13, 2022 16:29:41.632108278 CET;192.168.1.101;192.168.1.102;1883;52888;54;1883 → 52888 [FIN, ACK] Seq=5 Ack=77 Win=8192 Len=0;
154;Jan 13, 2022 16:29:41.632131508 CET;192.168.1.102;192.168.1.101;52888;1883;54;52888 → 1883 [ACK] Seq=77 Ack=6 Win=42335 Len=0;
155;Jan 13, 2022 16:29:51.159054650 CET;192.168.1.102;192.168.1.101;52890;1883;74;52890 → 1883 [SYN] Seq=0 Win=42340 Len=0 MSS=1460 SACK_PERM=1 TSval=3414905050 TSecr=0 WS=512;
156;Jan 13, 2022 16:29:51.168930841 CET;192.168.1.101;192.168.1.102;1883;52890;58;1883 → 52890 [SYN, ACK] Seq=0 Ack=1 Win=8192 Len=0 MSS=1460;
157;Jan 13, 2022 16:29:51.168956846 CET;192.168.1.102;192.168.1.101;52890;1883;54;52890 → 1883 [ACK] Seq=1 Ack=1 Win=42340 Len=0;
158;Jan 13, 2022 16:29:51.169011732 CET;192.168.1.102;192.168.1.101;52890;1883;108;Connect Command;
159;Jan 13, 2022 16:29:51.384532171 CET;192.168.1.102;192.168.1.101;52890;1883;108;[TCP Retransmission] 52890 → 1883 [PSH, ACK] Seq=1 Ack=1 Win=42340 Len=54;
160;Jan 13, 2022 16:29:51.388086209 CET;192.168.1.101;192.168.1.102;1883;52890;54;1883 → 52890 [ACK] Seq=1 Ack=55 Win=8192 Len=0;
161;Jan 13, 2022 16:29:51.393084954 CET;192.168.1.101;192.168.1.102;1883;52890;58;Connect Ack;
162;Jan 13, 2022 16:29:51.393113161 CET;192.168.1.102;192.168.1.101;52890;1883;54;52890 → 1883 [ACK] Seq=55 Ack=5 Win=42336 Len=0;
163;Jan 13, 2022 16:29:51.393253762 CET;192.168.1.102;192.168.1.101;52890;1883;73;Publish Message [topic];message013
164;Jan 13, 2022 16:29:51.393288204 CET;192.168.1.102;192.168.1.101;52890;1883;56;Disconnect Req;
165;Jan 13, 2022 16:29:51.820641700 CET;192.168.1.102;192.168.1.101;52890;1883;75;[TCP Retransmission] 52890 → 1883 [FIN, PSH, ACK] Seq=55 Ack=5 Win=42336 Len=21;
166;Jan 13, 2022 16:29:51.828074138 CET;192.168.1.101;192.168.1.102;1883;52890;54;1883 → 52890 [FIN, ACK] Seq=5 Ack=77 Win=8192 Len=0;
167;Jan 13, 2022 16:29:51.828149816 CET;192.168.1.102;192.168.1.101;52890;1883;54;52890 → 1883 [ACK] Seq=77 Ack=6 Win=42335 Len=0;
168;Jan 13, 2022 16:30:01.398241343 CET;192.168.1.102;192.168.1.101;52892;1883;74;52892 → 1883 [SYN] Seq=0 Win=42340 Len=0 MSS=1460 SACK_PERM=1 TSval=3414915289 TSecr=0 WS=512;
169;Jan 13, 2022 16:30:01.400938111 CET;192.168.1.101;192.168.1.102;1883;52892;58;1883 → 52892 [SYN, ACK] Seq=0 Ack=1 Win=8192 Len=0 MSS=1460;
170;Jan 13, 2022 16:30:01.400952365 CET;192.168.1.102;192.168.1.101;52892;1883;54;52892 → 1883 [ACK] Seq=1 Ack=1 Win=42340 Len=0;
171;Jan 13, 2022 16:30:01.402092018 CET;192.168.1.102;192.168.1.101;52892;1883;108;Connect Command;
172;Jan 13, 2022 16:30:01.409137474 CET;192.168.1.101;192.168.1.102;1883;52892;54;1883 → 52892 [ACK] Seq=1 Ack=55 Win=8192 Len=0;
173;Jan 13, 2022 16:30:01.411875452 CET;192.168.1.101;192.168.1.102;1883;52892;58;Connect Ack;
174;Jan 13, 2022 16:30:01.411890684 CET;192.168.1.102;192.168.1.101;52892;1883;54;52892 → 1883 [ACK] Seq=55 Ack=5 Win=42336 Len=0;
175;Jan 13, 2022 16:30:01.411949693 CET;192.168.1.102;192.168.1.101;52892;1883;73;Publish Message [topic];message014
176;Jan 13, 2022 16:30:01.411970204 CET;192.168.1.102;192.168.1.101;52892;1883;56;Disconnect Req;
177;Jan 13, 2022 16:30:01.616552427 CET;192.168.1.102;192.168.1.101;52892;1883;75;[TCP Retransmission] 52892 → 1883 [FIN, PSH, ACK] Seq=55 Ack=5 Win=42336 Len=21;
178;Jan 13, 2022 16:30:01.625777039 CET;192.168.1.101;192.168.1.102;1883;52892;54;1883 → 52892 [FIN, ACK] Seq=5 Ack=77 Win=8192 Len=0;
179;Jan 13, 2022 16:30:01.625799534 CET;192.168.1.102;192.168.1.101;52892;1883;54;52892 → 1883 [ACK] Seq=77 Ack=6 Win=42335 Len=0;
180;Jan 13, 2022 16:30:11.415814650 CET;192.168.1.102;192.168.1.101;52894;1883;74;52894 → 1883 [SYN] Seq=0 Win=42340 Len=0 MSS=1460 SACK_PERM=1 TSval=3414925306 TSecr=0 WS=512;
181;Jan 13, 2022 16:30:11.418583747 CET;192.168.1.101;192.168.1.102;1883;52894;58;1883 → 52894 [SYN, ACK] Seq=0 Ack=1 Win=8192 Len=0 MSS=1460;
182;Jan 13, 2022 16:30:11.418601882 CET;192.168.1.102;192.168.1.101;52894;1883;54;52894 → 1883 [ACK] Seq=1 Ack=1 Win=42340 Len=0;
183;Jan 13, 2022 16:30:11.419619083 CET;192.168.1.102;192.168.1.101;52894;1883;108;Connect Command;
184;Jan 13, 2022 16:30:11.625272488 CET;192.168.1.102;192.168.1.101;52894;1883;108;[TCP Retransmission] 52894 → 1883 [PSH, ACK] Seq=1 Ack=1 Win=42340 Len=54;
185;Jan 13, 2022 16:30:11.634152541 CET;192.168.1.101;192.168.1.102;1883;52894;54;1883 → 52894 [ACK] Seq=1 Ack=55 Win=8192 Len=0;
186;Jan 13, 2022 16:30:11.638982174 CET;192.168.1.101;192.168.1.102;1883;52894;58;Connect Ack;
187;Jan 13, 2022 16:30:11.639004974 CET;192.168.1.102;192.168.1.101;52894;1883;54;52894 → 1883 [ACK] Seq=55 Ack=5 Win=42336 Len=0;
188;Jan 13, 2022 16:30:11.639108148 CET;192.168.1.102;192.168.1.101;52894;1883;73;Publish Message [topic];message015
189;Jan 13, 2022 16:30:11.639147188 CET;192.168.1.102;192.168.1.101;52894;1883;56;Disconnect Req;
190;Jan 13, 2022 16:30:12.076906950 CET;192.168.1.102;192.168.1.101;52894;1883;75;[TCP Retransmission] 52894 → 1883 [FIN, PSH, ACK] Seq=55 Ack=5 Win=42336 Len=21;
191;Jan 13, 2022 16:30:12.088782923 CET;192.168.1.101;192.168.1.102;1883;52894;54;1883 → 52894 [FIN, ACK] Seq=5 Ack=77 Win=8192 Len=0;
192;Jan 13, 2022 16:30:12.088814722 CET;192.168.1.102;192.168.1.101;52894;1883;54;52894 → 1883 [ACK] Seq=77 Ack=6 Win=42335 Len=0;
193;Jan 13, 2022 16:30:21.651241056 CET;192.168.1.102;192.168.1.101;52896;1883;74;52896 → 1883 [SYN] Seq=0 Win=42340 Len=0 MSS=1460 SACK_PERM=1 TSval=3414935542 TSecr=0 WS=512;
194;Jan 13, 2022 16:30:21.662864218 CET;192.168.1.101;192.168.1.102;1883;52896;58;1883 → 52896 [SYN, ACK] Seq=0 Ack=1 Win=8192 Len=0 MSS=1460;
195;Jan 13, 2022 16:30:21.662914690 CET;192.168.1.102;192.168.1.101;52896;1883;54;52896 → 1883 [ACK] Seq=1 Ack=1 Win=42340 Len=0;
196;Jan 13, 2022 16:30:21.663033585 CET;192.168.1.102;192.168.1.101;52896;1883;108;Connect Command;
197;Jan 13, 2022 16:30:21.876524381 CET;192.168.1.102;192.168.1.101;52896;1883;108;[TCP Retransmission] 52896 → 1883 [PSH, ACK] Seq=1 Ack=1 Win=42340 Len=54;
198;Jan 13, 2022 16:30:21.883278343 CET;192.168.1.101;192.168.1.102;1883;52896;54;1883 → 52896 [ACK] Seq=1 Ack=55 Win=8192 Len=0;
199;Jan 13, 2022 16:30:21.887346184 CET;192.168.1.101;192.168.1.102;1883;52896;58;Connect Ack;
200;Jan 13, 2022 16:30:21.887364265 CET;192.168.1.102;192.168.1.101;52896;1883;54;52896 → 1883 [ACK] Seq=55 Ack=5 Win=42336 Len=0;
201;Jan 13, 2022 16:30:21.887435770 CET;192.168.1.102;192.168.1.101;52896;1883;73;Publish Message [topic];message016
202;Jan 13, 2022 16:30:21.887462189 CET;192.168.1.102;192.168.1.101;52896;1883;56;Disconnect Req;
203;Jan 13, 2022 16:30:22.316669757 CET;192.168.1.102;192.168.1.101;52896;1883;75;[TCP Retransmission] 52896 → 1883 [FIN, PSH, ACK] Seq=55 Ack=5 Win=42336 Len=21;
204;Jan 13, 2022 16:30:22.323403126 CET;192.168.1.101;192.168.1.102;1883;52896;54;1883 → 52896 [FIN, ACK] Seq=5 Ack=77 Win=8192 Len=0;
205;Jan 13, 2022 16:30:22.323425948 CET;192.168.1.102;192.168.1.101;52896;1883;54;52896 → 1883 [ACK] Seq=77 Ack=6 Win=42335 Len=0;
206;Jan 13, 2022 16:30:31.894412287 CET;192.168.1.102;192.168.1.101;52898;1883;74;52898 → 1883 [SYN] Seq=0 Win=42340 Len=0 MSS=1460 SACK_PERM=1 TSval=3414945785 TSecr=0 WS=512;
207;Jan 13, 2022 16:30:31.901416940 CET;192.168.1.101;192.168.1.102;1883;52898;58;1883 → 52898 [SYN, ACK] Seq=0 Ack=1 Win=8192 Len=0 MSS=1460;
208;Jan 13, 2022 16:30:31.901454443 CET;192.168.1.102;192.168.1.101;52898;1883;54;52898 → 1883 [ACK] Seq=1 Ack=1 Win=42340 Len=0;
209;Jan 13, 2022 16:30:31.901530221 CET;192.168.1.102;192.168.1.101;52898;1883;108;Connect Command;
210;Jan 13, 2022 16:30:32.112708299 CET;192.168.1.102;192.168.1.101;52898;1883;108;[TCP Retransmission] 52898 → 1883 [PSH, ACK] Seq=1 Ack=1 Win=42340 Len=54;
211;Jan 13, 2022 16:30:32.118897568 CET;192.168.1.101;192.168.1.102;1883;52898;54;1883 → 52898 [ACK] Seq=1 Ack=55 Win=8192 Len=0;
212;Jan 13, 2022 16:30:32.123074804 CET;192.168.1.101;192.168.1.102;1883;52898;58;Connect Ack;
213;Jan 13, 2022 16:30:32.123094073 CET;192.168.1.102;192.168.1.101;52898;1883;54;52898 → 1883 [ACK] Seq=55 Ack=5 Win=42336 Len=0;
214;Jan 13, 2022 16:30:32.123169486 CET;192.168.1.102;192.168.1.101;52898;1883;73;Publish Message [topic];message017
215;Jan 13, 2022 16:30:32.123198016 CET;192.168.1.102;192.168.1.101;52898;1883;56;Disconnect Req;
216;Jan 13, 2022 16:30:32.556545165 CET;192.168.1.102;192.168.1.101;52898;1883;75;[TCP Retransmission] 52898 → 1883 [FIN, PSH, ACK] Seq=55 Ack=5 Win=42336 Len=21;
217;Jan 13, 2022 16:30:32.561575074 CET;192.168.1.101;192.168.1.102;1883;52898;54;1883 → 52898 [FIN, ACK] Seq=5 Ack=77 Win=8192 Len=0;
218;Jan 13, 2022 16:30:32.561603873 CET;192.168.1.102;192.168.1.101;52898;1883;54;52898 → 1883 [ACK] Seq=77 Ack=6 Win=42335 Len=0;
219;Jan 13, 2022 16:30:42.127653215 CET;192.168.1.102;192.168.1.101;52900;1883;74;52900 → 1883 [SYN] Seq=0 Win=42340 Len=0 MSS=1460 SACK_PERM=1 TSval=3414956018 TSecr=0 WS=512;
220;Jan 13, 2022 16:30:42.132212142 CET;192.168.1.101;192.168.1.102;1883;52900;58;1883 → 52900 [SYN, ACK] Seq=0 Ack=1 Win=8192 Len=0 MSS=1460;
221;Jan 13, 2022 16:30:42.132240579 CET;192.168.1.102;192.168.1.101;52900;1883;54;52900 → 1883 [ACK] Seq=1 Ack=1 Win=42340 Len=0;
222;Jan 13, 2022 16:30:42.132584647 CET;192.168.1.102;192.168.1.101;52900;1883;108;Connect Command;
223;Jan 13, 2022 16:30:42.344624041 CET;192.168.1.102;192.168.1.101;52900;1883;108;[TCP Retransmission] 52900 → 1883 [PSH, ACK] Seq=1 Ack=1 Win=42340 Len=54;
224;Jan 13, 2022 16:30:42.353526075 CET;192.168.1.101;192.168.1.102;1883;52900;54;1883 → 52900 [ACK] Seq=1 Ack=55 Win=8192 Len=0;
225;Jan 13, 2022 16:30:42.357312556 CET;192.168.1.101;192.168.1.102;1883;52900;58;Connect Ack;
226;Jan 13, 2022 16:30:42.357330159 CET;192.168.1.102;192.168.1.101;52900;1883;54;52900 → 1883 [ACK] Seq=55 Ack=5 Win=42336 Len=0;
227;Jan 13, 2022 16:30:42.357401120 CET;192.168.1.102;192.168.1.101;52900;1883;73;Publish Message [topic];message018
228;Jan 13, 2022 16:30:42.357426846 CET;192.168.1.102;192.168.1.101;52900;1883;56;Disconnect Req;
229;Jan 13, 2022 16:30:42.796604539 CET;192.168.1.102;192.168.1.101;52900;1883;75;[TCP Retransmission] 52900 → 1883 [FIN, PSH, ACK] Seq=55 Ack=5 Win=42336 Len=21;
230;Jan 13, 2022 16:30:42.805208589 CET;192.168.1.101;192.168.1.102;1883;52900;54;1883 → 52900 [FIN, ACK] Seq=5 Ack=77 Win=8192 Len=0;
231;Jan 13, 2022 16:30:42.805238579 CET;192.168.1.102;192.168.1.101;52900;1883;54;52900 → 1883 [ACK] Seq=77 Ack=6 Win=42335 Len=0;
232;Jan 13, 2022 16:30:52.369730262 CET;192.168.1.102;192.168.1.101;52902;1883;74;52902 → 1883 [SYN] Seq=0 Win=42340 Len=0 MSS=1460 SACK_PERM=1 TSval=3414966260 TSecr=0 WS=512;
233;Jan 13, 2022 16:30:52.381703842 CET;192.168.1.101;192.168.1.102;1883;52902;58;1883 → 52902 [SYN, ACK] Seq=0 Ack=1 Win=8192 Len=0 MSS=1460;
234;Jan 13, 2022 16:30:52.381748143 CET;192.168.1.102;192.168.1.101;52902;1883;54;52902 → 1883 [ACK] Seq=1 Ack=1 Win=42340 Len=0;
235;Jan 13, 2022 16:30:52.381841707 CET;192.168.1.102;192.168.1.101;52902;1883;108;Connect Command;
236;Jan 13, 2022 16:30:52.600889845 CET;192.168.1.102;192.168.1.101;52902;1883;108;[TCP Retransmission] 52902 → 1883 [PSH, ACK] Seq=1 Ack=1 Win=42340 Len=54;
237;Jan 13, 2022 16:30:52.605862859 CET;192.168.1.101;192.168.1.102;1883;52902;54;1883 → 52902 [ACK] Seq=1 Ack=55 Win=8192 Len=0;
238;Jan 13, 2022 16:30:52.608788421 CET;192.168.1.101;192.168.1.102;1883;52902;58;Connect Ack;
239;Jan 13, 2022 16:30:52.608805683 CET;192.168.1.102;192.168.1.101;52902;1883;54;52902 → 1883 [ACK] Seq=55 Ack=5 Win=42336 Len=0;
240;Jan 13, 2022 16:30:52.608868728 CET;192.168.1.102;192.168.1.101;52902;1883;73;Publish Message [topic];message019
241;Jan 13, 2022 16:30:52.608891887 CET;192.168.1.102;192.168.1.101;52902;1883;56;Disconnect Req;
242;Jan 13, 2022 16:30:53.068575805 CET;192.168.1.102;192.168.1.101;52902;1883;75;[TCP Retransmission] 52902 → 1883 [FIN, PSH, ACK] Seq=55 Ack=5 Win=42336 Len=21;
243;Jan 13, 2022 16:30:53.093012725 CET;192.168.1.101;192.168.1.102;1883;52902;54;1883 → 52902 [FIN, ACK] Seq=5 Ack=77 Win=8192 Len=0;
244;Jan 13, 2022 16:30:53.093043794 CET;192.168.1.102;192.168.1.101;52902;1883;54;52902 → 1883 [ACK] Seq=77 Ack=6 Win=42335 Len=0;
245;Jan 13, 2022 16:31:02.618837106 CET;192.168.1.102;192.168.1.101;52904;1883;74;52904 → 1883 [SYN] Seq=0 Win=42340 Len=0 MSS=1460 SACK_PERM=1 TSval=3414976509 TSecr=0 WS=512;
246;Jan 13, 2022 16:31:02.627546651 CET;192.168.1.101;192.168.1.102;1883;52904;58;1883 → 52904 [SYN, ACK] Seq=0 Ack=1 Win=8192 Len=0 MSS=1460;
247;Jan 13, 2022 16:31:02.627587517 CET;192.168.1.102;192.168.1.101;52904;1883;54;52904 → 1883 [ACK] Seq=1 Ack=1 Win=42340 Len=0;
248;Jan 13, 2022 16:31:02.627660018 CET;192.168.1.102;192.168.1.101;52904;1883;108;Connect Command;
249;Jan 13, 2022 16:31:02.840733537 CET;192.168.1.102;192.168.1.101;52904;1883;108;[TCP Retransmission] 52904 → 1883 [PSH, ACK] Seq=1 Ack=1 Win=42340 Len=54;
250;Jan 13, 2022 16:31:02.862189084 CET;192.168.1.101;192.168.1.102;1883;52904;54;1883 → 52904 [ACK] Seq=1 Ack=55 Win=8192 Len=0;
251;Jan 13, 2022 16:31:02.869620315 CET;192.168.1.101;192.168.1.102;1883;52904;58;Connect Ack;
252;Jan 13, 2022 16:31:02.869641410 CET;192.168.1.102;192.168.1.101;52904;1883;54;52904 → 1883 [ACK] Seq=55 Ack=5 Win=42336 Len=0;
253;Jan 13, 2022 16:31:02.869725068 CET;192.168.1.102;192.168.1.101;52904;1883;73;Publish Message [topic];message020
254;Jan 13, 2022 16:31:02.869763182 CET;192.168.1.102;192.168.1.101;52904;1883;56;Disconnect Req;
255;Jan 13, 2022 16:31:03.308612454 CET;192.168.1.102;192.168.1.101;52904;1883;75;[TCP Retransmission] 52904 → 1883 [FIN, PSH, ACK] Seq=55 Ack=5 Win=42336 Len=21;
256;Jan 13, 2022 16:31:03.328355395 CET;192.168.1.101;192.168.1.102;1883;52904;54;1883 → 52904 [FIN, ACK] Seq=5 Ack=77 Win=8192 Len=0;
257;Jan 13, 2022 16:31:03.328412439 CET;192.168.1.102;192.168.1.101;52904;1883;54;52904 → 1883 [ACK] Seq=77 Ack=6 Win=42335 Len=0;
258;Jan 13, 2022 16:31:12.876626732 CET;192.168.1.102;192.168.1.101;52906;1883;74;52906 → 1883 [SYN] Seq=0 Win=42340 Len=0 MSS=1460 SACK_PERM=1 TSval=3414986767 TSecr=0 WS=512;
259;Jan 13, 2022 16:31:12.883960689 CET;192.168.1.101;192.168.1.102;1883;52906;58;1883 → 52906 [SYN, ACK] Seq=0 Ack=1 Win=8192 Len=0 MSS=1460;
260;Jan 13, 2022 16:31:12.883999801 CET;192.168.1.102;192.168.1.101;52906;1883;54;52906 → 1883 [ACK] Seq=1 Ack=1 Win=42340 Len=0;
261;Jan 13, 2022 16:31:12.884080259 CET;192.168.1.102;192.168.1.101;52906;1883;108;Connect Command;
262;Jan 13, 2022 16:31:13.092520788 CET;192.168.1.102;192.168.1.101;52906;1883;108;[TCP Retransmission] 52906 → 1883 [PSH, ACK] Seq=1 Ack=1 Win=42340 Len=54;
263;Jan 13, 2022 16:31:13.099271809 CET;192.168.1.101;192.168.1.102;1883;52906;54;1883 → 52906 [ACK] Seq=1 Ack=55 Win=8192 Len=0;
264;Jan 13, 2022 16:31:13.103140472 CET;192.168.1.101;192.168.1.102;1883;52906;58;Connect Ack;
265;Jan 13, 2022 16:31:13.103158344 CET;192.168.1.102;192.168.1.101;52906;1883;54;52906 → 1883 [ACK] Seq=55 Ack=5 Win=42336 Len=0;
266;Jan 13, 2022 16:31:13.103223005 CET;192.168.1.102;192.168.1.101;52906;1883;73;Publish Message [topic];message021
267;Jan 13, 2022 16:31:13.103247072 CET;192.168.1.102;192.168.1.101;52906;1883;56;Disconnect Req;
268;Jan 13, 2022 16:31:13.548681086 CET;192.168.1.102;192.168.1.101;52906;1883;75;[TCP Retransmission] 52906 → 1883 [FIN, PSH, ACK] Seq=55 Ack=5 Win=42336 Len=21;
269;Jan 13, 2022 16:31:13.567706765 CET;192.168.1.101;192.168.1.102;1883;52906;54;1883 → 52906 [FIN, ACK] Seq=5 Ack=77 Win=8192 Len=0;
270;Jan 13, 2022 16:31:13.567753182 CET;192.168.1.102;192.168.1.101;52906;1883;54;52906 → 1883 [ACK] Seq=77 Ack=6 Win=42335 Len=0;
271;Jan 13, 2022 16:31:23.117579399 CET;192.168.1.102;192.168.1.101;52908;1883;74;52908 → 1883 [SYN] Seq=0 Win=42340 Len=0 MSS=1460 SACK_PERM=1 TSval=3414997008 TSecr=0 WS=512;
272;Jan 13, 2022 16:31:23.125131053 CET;192.168.1.101;192.168.1.102;1883;52908;58;1883 → 52908 [SYN, ACK] Seq=0 Ack=1 Win=8192 Len=0 MSS=1460;
273;Jan 13, 2022 16:31:23.125165484 CET;192.168.1.102;192.168.1.101;52908;1883;54;52908 → 1883 [ACK] Seq=1 Ack=1 Win=42340 Len=0;
274;Jan 13, 2022 16:31:23.125237143 CET;192.168.1.102;192.168.1.101;52908;1883;108;Connect Command;
275;Jan 13, 2022 16:31:23.336547027 CET;192.168.1.102;192.168.1.101;52908;1883;108;[TCP Retransmission] 52908 → 1883 [PSH, ACK] Seq=1 Ack=1 Win=42340 Len=54;
276;Jan 13, 2022 16:31:23.343090625 CET;192.168.1.101;192.168.1.102;1883;52908;54;1883 → 52908 [ACK] Seq=1 Ack=55 Win=8192 Len=0;
277;Jan 13, 2022 16:31:23.347102756 CET;192.168.1.101;192.168.1.102;1883;52908;58;Connect Ack;
278;Jan 13, 2022 16:31:23.347120700 CET;192.168.1.102;192.168.1.101;52908;1883;54;52908 → 1883 [ACK] Seq=55 Ack=5 Win=42336 Len=0;
279;Jan 13, 2022 16:31:23.347192747 CET;192.168.1.102;192.168.1.101;52908;1883;73;Publish Message [topic];message022
280;Jan 13, 2022 16:31:23.347218393 CET;192.168.1.102;192.168.1.101;52908;1883;56;Disconnect Req;
281;Jan 13, 2022 16:31:23.788607802 CET;192.168.1.102;192.168.1.101;52908;1883;75;[TCP Retransmission] 52908 → 1883 [FIN, PSH, ACK] Seq=55 Ack=5 Win=42336 Len=21;
282;Jan 13, 2022 16:31:23.807549220 CET;192.168.1.101;192.168.1.102;1883;52908;54;1883 → 52908 [FIN, ACK] Seq=5 Ack=77 Win=8192 Len=0;
283;Jan 13, 2022 16:31:23.807587924 CET;192.168.1.102;192.168.1.101;52908;1883;54;52908 → 1883 [ACK] Seq=77 Ack=6 Win=42335 Len=0;
284;Jan 13, 2022 16:31:33.359652659 CET;192.168.1.102;192.168.1.101;52910;1883;74;52910 → 1883 [SYN] Seq=0 Win=42340 Len=0 MSS=1460 SACK_PERM=1 TSval=3415007250 TSecr=0 WS=512;
285;Jan 13, 2022 16:31:33.364447156 CET;192.168.1.101;192.168.1.102;1883;52910;58;1883 → 52910 [SYN, ACK] Seq=0 Ack=1 Win=8192 Len=0 MSS=1460;
286;Jan 13, 2022 16:31:33.364478496 CET;192.168.1.102;192.168.1.101;52910;1883;54;52910 → 1883 [ACK] Seq=1 Ack=1 Win=42340 Len=0;
287;Jan 13, 2022 16:31:33.364587152 CET;192.168.1.102;192.168.1.101;52910;1883;108;Connect Command;
288;Jan 13, 2022 16:31:33.576608437 CET;192.168.1.102;192.168.1.101;52910;1883;108;[TCP Retransmission] 52910 → 1883 [PSH, ACK] Seq=1 Ack=1 Win=42340 Len=54;
289;Jan 13, 2022 16:31:33.585878453 CET;192.168.1.101;192.168.1.102;1883;52910;54;1883 → 52910 [ACK] Seq=1 Ack=55 Win=8192 Len=0;
290;Jan 13, 2022 16:31:33.589422017 CET;192.168.1.101;192.168.1.102;1883;52910;58;Connect Ack;
291;Jan 13, 2022 16:31:33.589443959 CET;192.168.1.102;192.168.1.101;52910;1883;54;52910 → 1883 [ACK] Seq=55 Ack=5 Win=42336 Len=0;
292;Jan 13, 2022 16:31:33.589549188 CET;192.168.1.102;192.168.1.101;52910;1883;73;Publish Message [topic];message023
293;Jan 13, 2022 16:31:33.589581178 CET;192.168.1.102;192.168.1.101;52910;1883;56;Disconnect Req;
294;Jan 13, 2022 16:31:34.028534516 CET;192.168.1.102;192.168.1.101;52910;1883;75;[TCP Retransmission] 52910 → 1883 [FIN, PSH, ACK] Seq=55 Ack=5 Win=42336 Len=21;
295;Jan 13, 2022 16:31:34.033326525 CET;192.168.1.101;192.168.1.102;1883;52910;54;1883 → 52910 [FIN, ACK] Seq=5 Ack=77 Win=8192 Len=0;
296;Jan 13, 2022 16:31:34.033364452 CET;192.168.1.102;192.168.1.101;52910;1883;54;52910 → 1883 [ACK] Seq=77 Ack=6 Win=42335 Len=0;
297;Jan 13, 2022 16:31:43.597468158 CET;192.168.1.102;192.168.1.101;52912;1883;74;52912 → 1883 [SYN] Seq=0 Win=42340 Len=0 MSS=1460 SACK_PERM=1 TSval=3415017488 TSecr=0 WS=512;
298;Jan 13, 2022 16:31:43.602064342 CET;192.168.1.101;192.168.1.102;1883;52912;58;1883 → 52912 [SYN, ACK] Seq=0 Ack=1 Win=8192 Len=0 MSS=1460;
299;Jan 13, 2022 16:31:43.602093052 CET;192.168.1.102;192.168.1.101;52912;1883;54;52912 → 1883 [ACK] Seq=1 Ack=1 Win=42340 Len=0;
300;Jan 13, 2022 16:31:43.602391779 CET;192.168.1.102;192.168.1.101;52912;1883;108;Connect Command;
301;Jan 13, 2022 16:31:43.812566615 CET;192.168.1.102;192.168.1.101;52912;1883;108;[TCP Retransmission] 52912 → 1883 [PSH, ACK] Seq=1 Ack=1 Win=42340 Len=54;
302;Jan 13, 2022 16:31:43.830581879 CET;192.168.1.101;192.168.1.102;1883;52912;54;1883 → 52912 [ACK] Seq=1 Ack=55 Win=8192 Len=0;
303;Jan 13, 2022 16:31:43.838715960 CET;192.168.1.101;192.168.1.102;1883;52912;58;Connect Ack;
304;Jan 13, 2022 16:31:43.838736332 CET;192.168.1.102;192.168.1.101;52912;1883;54;52912 → 1883 [ACK] Seq=55 Ack=5 Win=42336 Len=0;
305;Jan 13, 2022 16:31:43.838819638 CET;192.168.1.102;192.168.1.101;52912;1883;73;Publish Message [topic];message024
306;Jan 13, 2022 16:31:43.838858785 CET;192.168.1.102;192.168.1.101;52912;1883;56;Disconnect Req;
